id,created,updated,title,content,tags,product,topic,locale,answers,creator
1492014,2025-02-09 05:21:29 -0800,2025-02-09 05:21:29 -0800,zoom per domain logged in,<p>I want to get rid off all settings for a domain.  I delete all the settings and then log in and they come right back.  Specifically for Zoom but I would like to get rid of all saved settings for a domain from my logged in data. I have deleted fire fox and they just reappear.  I want this to stop. </p>,firefox;settings;,firefox,settings,en-US,"",rocket625
1492012,2025-02-09 05:09:40 -0800,2025-02-09 05:13:09 -0800,browsing recomended extention,<p>is there a way to browse only through the recomended extention&nbsp;? </p>,firefox;accessibility;,firefox,accessibility,en-US,1710892;1710893;,epsilon.determination
1492010,2025-02-09 05:01:57 -0800,2025-02-09 05:01:57 -0800,Não consigo entrar nos meus emails,<p>Não sei </p>,firefox;accessibility;,firefox,accessibility,pt-BR,"",adilsonjardim49
1492009,2025-02-09 04:51:55 -0800,2025-02-09 04:51:55 -0800,Recupero  password,<p>Non mi ricordo la password di mozila thunderbird </p>,firefox;accounts;,firefox,accounts,it,"",maurocorsi63
1492008,2025-02-09 04:47:50 -0800,2025-02-09 04:47:50 -0800,account backup,<p>pleas help me to get my account and backup give me pleas </p>,firefox;accounts;,firefox,accounts,en-US,"",kj7831536
1492007,2025-02-09 04:46:31 -0800,2025-02-09 04:46:31 -0800,account,<p>finding my account<strong>bold text</strong> </p>,firefox;accounts;,firefox,accounts,en-US,"",jamfake43
1492006,2025-02-09 04:41:21 -0800,2025-02-09 04:41:21 -0800,Linux HomePage UI - shortcuts view much worse after recent update,"<p>Hello, I've been using Firefox as my main browser for work for a while and I've always been happy with it. However, a recent update (which happened a few days ago) seems to have messed up the UI when it comes to homepage shortcuts. They became much smaller and narrower, while the font seemingly became larger. Now only a few letters fit in the descriptions of every shortcut, which makes it frustratingly difficult to identify them. Please fix this! I've included a screenshot of what my homepage looks now at 100% zoom and with minimum font size 9 selected. There's so much unused space to the sides, while the shortcuts text gets cut after only a few symbols. Increasing the zoom doesn't help. </p>",firefox;accessibility;,firefox,accessibility,en-US,"",kzvc
1492005,2025-02-09 04:39:56 -0800,2025-02-09 04:39:56 -0800,Mise à jour,<p>RAS RAS </p>,firefox;installation-and-updates;,firefox,installation-and-updates,en-US,"",icilaminesy
1492004,2025-02-09 04:33:34 -0800,2025-02-09 04:33:34 -0800,I can't scoll through ad pictures on ebay,"<p>i want to look through ad pictures on ebay but firefox keeps stopping me opening new pictures for the same ad, if i open an ad initially it lets me view each picture then it starts blocking them, so that  i can only view the main picture, its really annoying and i'll have to stop using firefox if it continues because it makes buying on ebay impossible and  it's also doing similar things on other sites, i've reset the advanced tracking to standard and added an exemption for ebay  but its still doing it&nbsp;????? </p>",firefox;browse;,firefox,browse,en-US,"",rogerj666
1492003,2025-02-09 04:32:50 -0800,2025-02-09 04:32:50 -0800,documentos de assinatura digital não está abrindo sate Serasa,<p>Estou tentando abrir documentos no Serasa e não está abrindo para assinatura digital </p>,firefox;download-and-save;,firefox,download-and-save,pt-BR,"",fernando_prefeitura
1492002,2025-02-09 04:26:47 -0800,2025-02-09 04:26:47 -0800,"""New Tab"" doesn't work.","<p>Earlier version, New Tab works very well but  1.7.6b version doesn't work normally. </p>",firefox;browse;,firefox,browse,en-US,"",djk2000
1492001,2025-02-09 04:25:12 -0800,2025-02-09 04:25:12 -0800,Probleme bei der Nutzung von so genannten Authentifizierungs-Apps,"<p>Liebe Community, ich habe ein Problem bei der Nutzung von Apps, die eine Zwei-Faktor-Authentifizierung ermöglichen sollen (in meinem Falle enteAuth und OneAuth). Ich habe diese Apps probiert und komme mit beiden nicht zurecht, da sie alle 10-20 Sekunden einen neuen Code generieren, obwohl ich ja erstmal den von mir gescannten Code verifizieren muss. Der Mozilla Login sagt mir dann immer, der Code sei falsch. Dabei wollte ich eigentlich nur Themes gestalten hier im Online-Editor. Liebe Grüße Sven </p><p>Dear community, I have a problem when using apps that are supposed to enable two-factor authentication (in my case enteAuth and OneAuth). I have tried these apps and can't get along with either of them because they generate a new code every 10-20 seconds, even though I first have to verify the code I have scanned. The Mozilla login then always tells me that the code is incorrect. I actually only wanted to design themes here in the online editor. Best regards Sven </p>",firefox;passwords-and-sign-in;,firefox,passwords-and-sign-in,en-US,"",sven.tasche
1492000,2025-02-09 04:14:07 -0800,2025-02-09 04:14:07 -0800,Data lose,<p>I lose my data form my Account </p>,firefox-1270;firefox;accounts;,firefox,accounts,en-US,"",brightonmultimedia
1491998,2025-02-09 04:04:32 -0800,2025-02-09 04:04:32 -0800,Connect printer,<p>How can I connect my canon printer to my account </p>,firefox;settings;,firefox,settings,en-US,"",johnbarker19
1491996,2025-02-09 03:21:26 -0800,2025-02-09 03:21:26 -0800,synchronise « Mail »,"<p>Hi, i want to synchronise « Mail » into my iphone and my macbook pro 10.15.7&nbsp;? </p>",firefox;backup-recovery-and-sync;,firefox,backup-recovery-and-sync,en-US,"",tgentil
1491992,2025-02-09 03:07:15 -0800,2025-02-09 03:07:15 -0800,Science,"<p>I want use this website but cannot, can I use it now </p>",firefox;browse;,firefox,browse,en-US,"",tarbojrmea
1491991,2025-02-09 03:00:22 -0800,2025-02-09 03:00:22 -0800,Password Saving,<p>We can used for password Saving </p>,firefox;passwords-and-sign-in;,firefox,passwords-and-sign-in,en-US,"",aqeelsial740
1491990,2025-02-09 02:50:17 -0800,2025-02-09 02:50:17 -0800,How to restore Meta tag in game,<p>text/html; charset=ISO-8859-1 </p><p>How do I restore the above in a game </p>,firefox;backup-recovery-and-sync;,firefox,backup-recovery-and-sync,en-US,"",leebella038
1491989,2025-02-09 02:13:51 -0800,2025-02-09 05:17:32 -0800,Firefox Startup,<p>How can I get Firefox to always startup with 4 tabs each at a specific URL.  So easy to do with Edge. Opening with my last used tabs is NOT what I want to do. </p>,seg-win10;firefox;settings;,firefox,settings,en-US,1710894;,mike820
1491988,2025-02-09 02:07:38 -0800,2025-02-09 02:08:04 -0800,okiwo20,<p>noks9iwa8qj2 a9201hia </p>,firefox;download-and-save;needsinfo;,firefox,download-and-save,en-US,1710868;,mrizwanrizwan581
1491986,2025-02-09 01:58:49 -0800,2025-02-09 04:43:15 -0800,Please make vertical tabs better,"<p>(btw my browser is Firefox Nightly) Don't get me wrong, I love having vertical tabs. It's less busy than the horizontal tabs and I can look through my tabs more quickly. But, the way it's implemented sucks - It makes the layout of the webpage pop anytime I use it; there is no keyboard button attached to opening and closing the tab (I have to go through my horizontal bar to open my vertical bar); and recently my browser forgets the sidebar settings, meaning I have to re-check the ""Hide tabs and sidebar"" setting. </p><p>Bonus request Can the sidebar just go over the webpage (i.e. like the application menu) instead of squishing it? I'm ok with having some webpage features temporarily covered if it means I don't have to see the screen pop into a new rectangular shape every time I switch tabs. </p>",firefox;performance-and-connectivity;,firefox,performance-and-connectivity,en-US,1710888;,povilas.buda
1491985,2025-02-09 01:56:04 -0800,2025-02-09 01:57:25 -0800,i can not download video,<p>i can not download video </p>,firefox;download-and-save;,firefox,download-and-save,en-US,1710867;,shafiqkln78
1491984,2025-02-09 01:53:28 -0800,2025-02-09 04:50:23 -0800,Firefox Studies,"<p>The great and mighty Firefox that lords it over all other browsers about privacy has far too many opt-out features and options. I'm happy to know I participated in 22 studies before I found the toggle to turn it off, whatever the Hell those studies are. I haven't used Firefox in 13 years and this is the sort of non-sense I return to? </p><p>I don't actually want an answer, I just needed to complain. </p>",firefox;privacy-and-security_1;,firefox,privacy-and-security,en-US,1710889;,theanticat
1491983,2025-02-09 01:44:29 -0800,2025-02-09 04:52:54 -0800,Firefox Nightly 137.0a1 bookmarks list of second level overrides 1st level,"<p>Click on bookmarks, the drop-down menu appears, click or move cursor on an entry in the list, the new drop-down-menu of 2nd level appears. If the list contains many entries the 2nd level drop-down menu overrides 1st level.   This does not happen with firefox preceding version. Note: attaching a picture because a webm video is not accepted. </p>",firefox;performance-and-connectivity;,firefox,performance-and-connectivity,en-US,1710890;,corradoventu
1491982,2025-02-09 01:28:48 -0800,2025-02-09 01:28:48 -0800,How do i manually generate a password using the firefox generator for use in a desktop app or some such?,<p>as the question above </p>,firefox;privacy-and-security_1;,firefox,privacy-and-security,en-US,"",overtaker40
1491980,2025-02-09 01:24:22 -0800,2025-02-09 01:24:22 -0800,Trabajo,<p>Merci </p>,firefox;accounts;,firefox,accounts,es,"",mbenguemodou97
1491978,2025-02-09 00:58:02 -0800,2025-02-09 01:01:50 -0800,documents,<p>not really </p>,firefox;accessibility;needsinfo;,firefox,accessibility,en-US,1710861;,reaganthestatesman
1491977,2025-02-09 00:51:35 -0800,2025-02-09 00:51:35 -0800,Browser being managed by my organisation when it's my personal browser,"<p>So, my browser says ""managed by your organisation"" at the top of the screen when it's my personal browser and really should be managed by me. I tried reinstalling but it's still there </p>",firefox;settings;,firefox,settings,en-US,"",cyr3x7
1491975,2025-02-09 00:28:13 -0800,2025-02-09 00:54:39 -0800,Secure Connection Failed  An error occurred during a connection to www.mediafire.com. PR_CONNECT_RESET_ERROR  Error code: PR_CONNECT_RESET_ERROR,"<p>Secure Connection Failed </p><p>An error occurred during a connection to <a href=""http://www.mediafire.com"" rel=""nofollow"">www.mediafire.com</a>. PR_CONNECT_RESET_ERROR </p><p>Error code: PR_CONNECT_RESET_ERROR </p><pre>   The page you are trying to view cannot be shown because the authenticity of the received data could not be verified.    Please contact the website owners to inform them of this problem. </pre> <p>Learn more… </p>",firefox;download-and-save;,firefox,download-and-save,en-US,1710857;,rathvaharshil566
1491974,2025-02-09 00:25:44 -0800,2025-02-09 01:01:34 -0800,softawar,<p><strong>bold text</strong> </p>,firefox;download-and-save;needsinfo;,firefox,download-and-save,en-US,1710860;,rathvaharshil566
1491973,2025-02-09 00:25:35 -0800,2025-02-09 04:54:03 -0800,Firefox keeps crashing lately. What's the solution?,<p>Firefox keeps crashing. Please provide step by step instructions on how to resolve the issue. Thanks' </p>,firefox;performance-and-connectivity;,firefox,performance-and-connectivity,en-US,1710891;,rved1234
1491970,2025-02-08 23:59:19 -0800,2025-02-09 01:01:11 -0800,not service avalable,<p>best for you </p>,firefox;installation-and-updates;needsinfo;,firefox,installation-and-updates,en-US,1710859;,RAKESHSHEKHPURA1
1491968,2025-02-08 23:32:33 -0800,2025-02-08 23:32:33 -0800,X (twitter) links open in Bing,<p>How do i stop some files automatically opening in Bing. Twitter is a good example of this. Should i just uninstall Bing? Thanks </p>,firefox;settings;,firefox,settings,en-US,"",mazzer89irav
1491967,2025-02-08 23:32:26 -0800,2025-02-08 23:33:44 -0800,fiefox menu,"<p><a href=""https://mymediu.ir"" rel=""nofollow"">https://mymediu.ir</a> </p>",firefox;passwords-and-sign-in;,firefox,passwords-and-sign-in,en-US,1710850;,mahdis12308089
1491966,2025-02-08 23:30:55 -0800,2025-02-08 23:30:55 -0800,Youtube Video always watching and downloading convenience app for all user and me.,<p>some youtube video are can't download but mostly all video downloaded . </p>,firefox;download-and-save;,firefox,download-and-save,en-US,"",mtaung1403
1491965,2025-02-08 23:15:44 -0800,2025-02-09 01:09:45 -0800,sarching slow,<p>speed slow </p>,firefox;search-tag-and-share;needsinfo;,firefox,search-tag-and-share,en-US,1710862;,knand4343
1491964,2025-02-08 23:15:21 -0800,2025-02-08 23:15:21 -0800,1jsksj,<p>Kksjwm </p>,firefox;installation-and-updates;,firefox,installation-and-updates,hu,"",barkooczizs333
1491961,2025-02-08 22:08:56 -0800,2025-02-08 23:52:28 -0800,Trying to get NordPass to work,"<p>I had NordPass working on my MacBook Pro, so that the little NordPass icon appeared when I had to sign in to a site with my username and password. If it wasn't in NordPass yet, NordPass would ""watch"" while I signed in somewhere, and then ask if I wanted to save that info, and I could say yes or no. But now I've installed NordPass again, and I'm not seeing the little green NordPass prompts. Where did they go? What did I do that caused them to disappear? I'm going to give up for the evening, but if you have any ideas about this, please share them. I will check back in tomorrow and attack the problem again, and will see your ideas then.  TIA for any thoughts you might have about this. </p>",firefox-1350;firefox;passwords-and-sign-in;,firefox,passwords-and-sign-in,en-US,1710855;,mmorrison32
1491960,2025-02-08 22:08:23 -0800,2025-02-08 22:08:23 -0800,update my window,<p>help me </p>,firefox;installation-and-updates;,firefox,installation-and-updates,en-US,"",zeeshanmurtaza196
1491959,2025-02-08 22:06:43 -0800,2025-02-08 22:42:34 -0800,Intagram account gtr_rosales22,<p>Use my pho number 2 step verification [edited] </p>,firefox;backup-recovery-and-sync;needsinfo;,firefox,backup-recovery-and-sync,en-US,1710844;1710848;,r.adrian1996
1491956,2025-02-08 21:56:25 -0800,2025-02-08 21:56:25 -0800,plex videos have a greyish filter on it when playing videos.  all other browsers and apps appear normal.,<p>plex videos have a greyish filter on it when playing videos.  all other browsers and apps appear normal. </p>,firefox;accessibility;,firefox,accessibility,en-US,"",treestump
1491955,2025-02-08 21:51:41 -0800,2025-02-09 01:00:12 -0800,Brown,<p><strong>bold text</strong> </p>,firefox;privacy-and-security_1;needsinfo;,firefox,privacy-and-security,en-US,1710858;,minthat9922
1491953,2025-02-08 21:27:01 -0800,2025-02-08 21:27:01 -0800,ok to update from firefox browser 133.0 to 135.0?,<p>ok to update from firefox browser 133.0 to 135.0? </p>,firefox;installation-and-updates;,firefox,installation-and-updates,en-US,"",dvrosenthal
1491951,2025-02-08 21:18:10 -0800,2025-02-08 21:21:36 -0800,Bad REquest,"<p>I have never had a problem opening my email client before in Firefox, but now after the last time I started my computer I get this message when I try to open my email client (Shaw Webmail): </p><p>400 Bad Request Request Header Or Cookie Too Large nginx/1.24.0 </p><p>Oddly though, it will open if I go into the Incognito window. Why is this happening and how can I fix it so I don't have to constantly into Incognito mode to access it? </p>",firefox;accessibility;,firefox,accessibility,en-US,1710838;,bighugs
1491950,2025-02-08 21:14:44 -0800,2025-02-08 21:24:49 -0800,Connection with chatgpt,<p>Why I can not be connected with chatgpt by mozilla firefox </p>,firefox;performance-and-connectivity;needsinfo;,firefox,performance-and-connectivity,en-US,1710839;,krisnasree99
1491948,2025-02-08 20:07:31 -0800,2025-02-08 20:10:36 -0800,AI Chet bug with hotkey,"<p>On ver 135.0, the AI chet occupies the hotkey ""Ctrl + Alt + X"" </p><p>Even if this feature is turned off in the settings, it will be turned on when the shortcut key is pressed </p>",firefox;settings;,firefox,settings,en-US,1710834;,.__.._
1491947,2025-02-08 20:06:40 -0800,2025-02-08 20:06:40 -0800,Youtube at max 720p?,"<p>Do you know of a mod that won't allow Youtube to have a resolution higher than 720p, including when embedded? I almost-always have Youtube at 480p when watching through their site. I noticed that when watching a video on another site and that it's embedding Youtube, that the resolution is higher &gt; 480p and in <em>those cases</em> it's not rare to be &gt; 720p. </p><p>I'd like a mod or setting so that when it's active that Youtube can't have a resolution higher than 720p, including when embedded. Any idea if there's something alike? </p><p>Thank you kindly for your help </p>",firefox;browse;youtube;,firefox,browse,en-US,"",DynV
1491946,2025-02-08 19:45:06 -0800,2025-02-08 19:45:06 -0800,EDISTRICT CSC ONLINE WORK,<p>NADEEM ALI  MOBILE NO. 8218735775 EDISTRICT SEWA FULL COMPLATE  OPEN </p>,firefox;browse;,firefox,browse,en-US,"",nadimbhatti186
1491945,2025-02-08 19:38:57 -0800,2025-02-08 19:38:57 -0800,How do I access the authenticator app?,<p><strong>How do I access the authenticator app?</strong> </p>,firefox;privacy-and-security_1;,firefox,privacy-and-security,en-US,"",Monte8322
1491944,2025-02-08 19:28:53 -0800,2025-02-08 21:39:48 -0800,Firefox 135 - New Tab Pinned Shortcuts are not centered?,"<p>Since the 135 update, the pinned shortcuts on the new tab are now not centered under the search bar. I've found a temporary fix in about:config (see below) but this makes the icons incredibly small. I would just like the pinned shortcuts to be centered now instead of left adjacent.  </p><p><br> </p><p>browser.newtabpage.activity-stream.newtabLayouts.variant-a	 browser.newtabpage.activity-stream.newtabLayouts.variant-b </p>",firefox;settings;,firefox,settings,en-US,1710843;,viavi91
1491941,2025-02-08 19:20:30 -0800,2025-02-08 19:20:30 -0800,Sync and save data,<p>How do I sync my iOS and desktop? </p>,firefox;backup-recovery-and-sync;,firefox,backup-recovery-and-sync,en-US,"",vasquito58
1491939,2025-02-08 18:56:19 -0800,2025-02-08 18:56:19 -0800,"my games load in firefox , i want to use google",<p><strong>bold text</strong>i downloaded a game it opens firefox browser but not the game </p>,firefox;accessibility;,firefox,accessibility,en-US,"",lesliekirk397
1491938,2025-02-08 18:55:34 -0800,2025-02-08 18:58:08 -0800,FF on Mac: Control+Enter used to complete the address bar entry with .com,"<p>This does not work anymore and I get an edit drop down with copy, paste etc It works on Chrome and Safari. I checked the config for ""browser.fixup.alternate.suffix"" and it is set to .com. </p>",firefox;browse;,firefox,browse,en-US,"",itredler
1491937,2025-02-08 18:31:53 -0800,2025-02-08 19:12:44 -0800,Spark password,<p>I cannot open robbuldr@xtra.co.nz and forgotten the password </p>,firefox;passwords-and-sign-in;,firefox,passwords-and-sign-in,en-US,1710823;,robbuldr
1491936,2025-02-08 18:14:55 -0800,2025-02-08 18:14:55 -0800,Re: Mozilla Firefox Interface,"<p>Dear Sir/Madam </p><p>I would like to know if Firefox has been able to make compact or reduce the sizes of the Tools and Menu bars. For the last time I checked they were too wide, thus making the Interface ugly. </p><p>Kind regards. </p><p>DR CLEMENT AKATENG MD </p>",firefox;installation-and-updates;,firefox,installation-and-updates,en-US,"",DRCLEMENTAKATENG1
1491935,2025-02-08 18:12:05 -0800,2025-02-08 18:12:05 -0800,Can no longer delete items from address bar dropdown,"<p>Using latest version of Firefox for PC (Version 135.0 (64-bit)).  As of a few months ago, I can no longer delete suggested webpages from the address bar drop down. Per the instructions, I should be able to right click on an item and select: ""Remove From Toolbar"" but that option is greyed out. I have looked through the Address Bar settings and can't find a setting that affects it. Am I doing anything wrong?  This problem is exactly the same on both my Windows 10 PC and my Windows 11 laptop.  Both started with this issue 2 or 3 months ago. </p>",firefox;settings;,firefox,settings,en-US,"",eddiejoe67
1491934,2025-02-08 18:01:49 -0800,2025-02-08 18:01:49 -0800,Firefox,<p>Firefox does not work with Jackpocket to verify state of residence. Opera works perfectly. </p>,firefox;performance-and-connectivity;,firefox,performance-and-connectivity,en-US,"",tom168
1491933,2025-02-08 17:49:40 -0800,2025-02-08 17:49:40 -0800,Trying to log in on television and having trouble,<p>Having trouble connecting to my tv. Login isn't working </p>,firefox;accessibility;,firefox,accessibility,en-US,"",longvanessa31
1491932,2025-02-08 17:48:24 -0800,2025-02-08 17:48:24 -0800,Trying to log in on television and having trouble,<p>Having trouble connecting to my tv. </p>,firefox;accessibility;,firefox,accessibility,en-US,"",longvanessa31
1491931,2025-02-08 17:46:32 -0800,2025-02-09 01:10:36 -0800,my use brouse,<p>no brouse </p>,firefox;download-and-save;needsinfo;,firefox,download-and-save,en-US,1710863;,myomin162005
1491930,2025-02-08 17:45:04 -0800,2025-02-08 17:45:04 -0800,Kekin,<p>Campus </p>,firefox;settings;,firefox,settings,es,"",kladino309
1491929,2025-02-08 17:44:29 -0800,2025-02-08 18:20:05 -0800,How can I change the year on a tax payment?,<p>How can I change the tax year on a tax payment?  It only prompts me the first time I enter it. </p>,windows-11;firefox;accounts;,firefox,accounts,en-US,1710819;,lharman
1491928,2025-02-08 17:44:17 -0800,2025-02-09 01:10:49 -0800,my use,<p>browse </p>,firefox;download-and-save;needsinfo;,firefox,download-and-save,en-US,1710864;,myomin162005
1491927,2025-02-08 17:38:10 -0800,2025-02-08 17:38:10 -0800,Set up,<p>Nice &amp;helpfulness </p>,firefox;download-and-save;,firefox,download-and-save,en-US,"",salmanrashidridoy1
1491926,2025-02-08 17:35:50 -0800,2025-02-08 17:35:50 -0800,Known not,<p>Very Good Services </p>,firefox;installation-and-updates;,firefox,installation-and-updates,en-US,"",salmanrashidridoy1
1491925,2025-02-08 17:35:47 -0800,2025-02-08 17:35:47 -0800,Updates and other,"<p>1)Why did my ""thumbnails"" to linked stories on my firefox homepage stop loading yesterday? Still not getting them. </p><p>2) I received a message a while ago that I need to update firefox or ti will stop working properly. My questions are: - when do I have to update by? - when Microsoft sends me a required update (almost every 3 months or so) they have to restart my laptop ... that wipes out my bookmarks. Will that happen with a the firefox update? That's why I've been reluctant to update. </p><p>I do backup and re-enter my bookmarks from a USB drive and reload them after a restart ... but then I also have to reenter passwords for several regular sites and it's a pain in the ass. </p><p>Thank you in advance </p>",firefox;installation-and-updates;,firefox,installation-and-updates,en-US,"",prenticeehret
1491923,2025-02-08 17:09:30 -0800,2025-02-08 17:09:30 -0800,I cannot log into my email account,<p>let me access my email accounts </p>,firefox;passwords-and-sign-in;,firefox,passwords-and-sign-in,en-US,"",charles152
1491922,2025-02-08 16:58:24 -0800,2025-02-08 18:01:30 -0800,Working payment visa in Australia,<p>I need job working payment visa in Australia </p>,firefox;download-and-save;needsinfo;,firefox,download-and-save,en-US,1710813;1710816;,ok7943093
1491921,2025-02-08 16:53:34 -0800,2025-02-08 17:57:30 -0800,Ghana,"<p><i>duplicate of <a href=""/questions/1491922"" rel=""nofollow"">/questions/1491922</a> thread</i>  </p><pre>need job working payment visa in Australia. lm mechanic and driver more please help me </pre>",firefox;download-and-save;,firefox,download-and-save,en-US,"",ok7943093
1491920,2025-02-08 16:49:18 -0800,2025-02-08 16:49:18 -0800,"After the update, the mouse wheel in the browser stopped working.","<p>After the last update, the mouse wheel in the browser stopped working. This is very inconvenient, the pages do not scroll with the mouse wheel, only with the arrows on the keyboard. </p>",firefox;installation-and-updates;,firefox,installation-and-updates,en-US,"",vega_90
1491919,2025-02-08 16:48:07 -0800,2025-02-08 16:48:07 -0800,When you rebranded a product I accidentally created a second account. How can I merge my accounts or just the account data?,"<p>When you rebranded the Firefox accounts to Mozilla accounts (or maybe during the close of relay??)  I accidentally created a second account. How can I merge my accounts or just the account data? </p><p>I am auditing my accounts and my MFA codes so that is why I am now finally dealing with this. </p><p>Is there any process I can go through to take browsing history and bookmarks from one of my accounts and merge them into another one? </p><p>I could even create a new Firefox profile so that it's possible to export this data to import into the other profile, then sync. </p><p>If I manually import data, does it overwrite the old data or will they merge together? </p><p>Let me know what information you need from me. </p><p>Thank you </p>",firefox;accounts;,firefox,accounts,en-US,"",RMaRIDTH
