id,created,updated,title,content,tags,product,topic,locale,answers,creator
1487207,2025-01-19 17:45:43 -0800,2025-01-19 23:08:36 -0800,Private Browsing blocking part of page. I think.,"<p>I have been using Private Browsing to read <a href=""https://www.dailymail.co.uk"" rel=""nofollow"">https://www.dailymail.co.uk</a> for years because it blocks the adds.  Now for the second time in years it seems to block a part of the page I don't want it too block. And for the life of me I cant remember if I did something to fix it the first time or Mozilla fixed it.  Anyway the problem does not show up in ordinary Firefox but the adds make it so hard to concentrate while they keep flashing on and off all the time.  So I have attached two screen shots to show the difference between the two Ordinary &amp; Private. Any ideas very welcome. Thanks. First one shows the comment section that I want to see the second shows Private not showing them. Same story, day ect </p>",firefox;browse;,firefox,browse,en-US,1705026;1705038;,phillstroud
1487206,2025-01-19 17:27:17 -0800,2025-01-19 20:52:37 -0800,Bookmarks deleted,"<p>I had to re-install Windows and so I downloaded Firefox again and logged in to my account. I had sync turned on with bookmarks enabled but it wasn't syncing my bookmarks to my computer. I double checked that these sync settings were enabled on the Firefox app on my phone and I tried syncing multiple times. It transferred my passwords and other data but not my bookmarks. So I logged out of Firefox on my computer and phone, then logged back in and synced them together only to find that Firefox deleted all my bookmarks from my account completely (now they don't show up on my phone either). I looked at the forums and saw that they make separate profiles that I could access with about:profiles so I opened that and only saw 2 profiles, neither of which have my bookmarks. Is there a way to recover these since Firefox deleted them out of no where? </p>",firefox;backup-recovery-and-sync;,firefox,backup-recovery-and-sync,en-US,1705028;,bmschw
1487205,2025-01-19 17:19:18 -0800,2025-01-20 01:47:41 -0800,Firefox attempting to open files before download finishes,"<p>Recently when I try to download a file Firefox seems to give it a random amount of time before it attempts to open the file. For small files this isn't a problem, as it always seems to give at least a few seconds, but larger files get cut off. This leaves the file corrupted/incomplete. </p><p>I have no idea why is started doing this. Just one day it started opening everything I downloaded, be it PDF, image etc when complete. I turned this off and it has stopped for things that download properly, but it's still doing this 'cut off' attempt to open. </p><p>Any help would be appreciated, thanks, </p>",firefox-13401;firefox-1340;performance-and-connectivity;,firefox,performance-and-connectivity,en-US,1705017;1705071;,mirumotokojiro
1487204,2025-01-19 17:11:34 -0800,2025-01-19 21:15:10 -0800,Discoloration in Firefox Theme,"<p>Hello, </p><p>I am experiencing discoloration on the top left corner of my firefox browser theme when I am in ""full screen view"". The discoloration disappears when I exit from full screen mode to ""window view"". This discoloration is happening on every theme I enable. I have attached two pictures to show what I am seeing between the full screen view and window view.  </p><p>I am running Windows 11 and have a 32"" curved monitor. I searched for solutions such as disabling hardware acceleration, but nothing seems to be working.  </p><p>Any help would be really appreciated! </p><p>Thank you! </p>",firefox;performance-and-connectivity;,firefox,performance-and-connectivity,en-US,1705030;1705031;,JMLFirefox
1487203,2025-01-19 16:53:52 -0800,2025-01-19 16:53:52 -0800,Green lines and visual defects in videos on firefox,"<p>There's a problem with video playback on firefox, where after a while/randomly, the thing happens as shown in the image. I've uninstalled intel graphics driver and reinstall, didn't work, I've refreshed firefox, didn't work, I've fully uninstalled firefox and reinstall, didn't work, and when the error occurs the igpu is at 100% usage (and ram/vram usage is not full). The whole firefox app will be laggy but not windows, and upon pausing the video only will firefox be free of lag, and a refresh will solve the issue. However, it will occur again once in a while, doesn't matter the resolution or volume, and not just youtube but all other video players. It does occur more frequently and predictably when the video is paused for some time, or when the computer sleeps for a while, and I think it has something to do with the way firefox handles ram. (just my guess) </p><p>The only fix that worked was setting <strong>media.wmf.dxva.d3d11.enabled</strong> to false, which is undesirable as it increases cpu usage by at least 20% as well as increasing my battery discharge. Other fix includes using other browsers, using my nvidia rtx on firefox, and (not totally sure) setting the resolution lower.  </p><p>Also, after the error occurs/before the error occurs, firefox doesn't do that blink-in-blink-out animation when going fullscreen on video players (like chrome), which can be fixed by exiting the firefox application completely and restarting it. Refresh doesn't work here. </p>",firefox-13401;firefox-1340;firefox;performance-and-connectivity;,firefox,performance-and-connectivity,en-US,"",dennisheyuxi
1487202,2025-01-19 16:53:17 -0800,2025-01-19 16:53:17 -0800,I seem to be blocked from shopping on my favourite web sites,<p>Why is my credit card blocked on my favourite shopping site? Everything was fine until the end of December. My cards are not blocked by the bank or Visa or Mastercard. I've checked many times. A site I haven't used for 6 months isn't a problem. How do I correct this? Thanks for reading this. I hope you can help. I appreciate that you are here. Marcia Green </p>,firefox-13401;firefox-1340;firefox;accessibility;,firefox,accessibility,en-US,"",dgreenm407
1487201,2025-01-19 16:50:34 -0800,2025-01-19 16:50:34 -0800,Firefox Home (default) desktop is different on two computers in the same house (same accounts),"<p>I have two computers.  Both sign into the same Firefox account.  Both instances of Firefox are the same version (134.0.1 64-bit). </p><p>On my main computer, creating a new tab is set to Firefox Home (default), and clicking the ""+"" sign to create a new tab results in the recommendations appearing as seen in the first image (firefox_2025-01-19_17-42-57.png) </p><p>On the other computer, creating a new tab is set to Firefox Home (default), and clicking the ""+"" sign to create a new tab results in the recommendations appearing as seen in the second image (firefox_2025-01-19_17-43-57.png) </p><p>How to I get both instances of Firefox to do the same thing when creating a  new tab, i.e. organize the recommendations like the second image? </p>",firefox-13401;firefox-1340;firefox;browse;,firefox,browse,en-US,"",jjreisert
1487200,2025-01-19 16:42:30 -0800,2025-01-19 16:42:30 -0800,plying video,<p>don't use extensions </p>,firefox;browse;,firefox,browse,en-US,"",sergei.gindikin
1487198,2025-01-19 16:38:24 -0800,2025-01-19 16:38:24 -0800,Bluesky blocked,<p>You have suddenly blocked my access to BlueSky. Please restore it. Now. Blocking this on the eve of the new President's installation makes me question your motivation. </p>,firefox;privacy-and-security_1;,firefox,privacy-and-security,en-US,"",amanda.forsyth
1487196,2025-01-19 16:10:33 -0800,2025-01-19 18:28:06 -0800,Desktop new tab dose not show add new link option,<p>Something went drunk and  now my blank page no longer lists the links i want it to. Used to be once upon a time that the browser showed (as setup) 2 rows of links for ease of access. </p><p>Refer to screenshot if i fail to make sense. </p>,firefox;settings;,firefox,settings,en-US,1705014;,jakub.otruba
