id,created,updated,title,content,tags,product,topic,locale,answers,creator
1517833,2025-06-19 03:10:24 -0700,2025-06-19 03:10:24 -0700,Adblock plus,"<p>Spett.Firefox, sto cercando di completare la mia dichiarazione 730 pre compilata. Purtroppo ho riscontrato da Agenzia delle Entrate questa segnalazione:   se utilizzi il browser Firefox potresti avere difficoltà ad accedere a questo quadro (segnalazione di errore ""Non è stato possibile ottenere i dati dal server"").  Ti consigliamo di disattivare il plugin ""Adblock plus"" per Firefox oppure di utilizzare un altro browser (Chrome, Edge, ecc.).  Quindi gentilmente come posso procedere?grazie </p>",firefox;privacy-and-security_1;,firefox,privacy-and-security,it,"",mirella.dalio
1517832,2025-06-19 03:08:51 -0700,2025-06-19 03:08:51 -0700,Odhlašování z účtu Firefox,"<p>Dobrý den, posledních pár dní se mi po každém vypnutí zařízení automaticky odhlásí účet mozilla firefox a musím se znovu přihlašovat. Dříve nic takové nebylo a přihlášený jsem byl furt. Lze toto někde nastavit, aby se mi účet po každém vypnutí zařízení neodhlašoval? Předem děkuji za odpověď. </p>",firefox;passwords-and-sign-in;,firefox,passwords-and-sign-in,cs,"",gp1
1517830,2025-06-19 02:54:27 -0700,2025-06-19 02:54:27 -0700,tab discarding not working even tho its nearly using all memory,"<p>firefox not discarding tabs automatically even though i have tab discarding on in about:config via ""browser.tabs.unloadOnLowMemory=true"" ""browser.tabs.min_inactive_duration_before_unload=60000"" </p><p>also if i discard them manually from about:unloads manually whenever i restart firefox all discarded tabs come back to life is it supposed to do that? </p><p>Thanks </p>",firefox;browse;,firefox,browse,en-US,"",sscicluna89
1517824,2025-06-19 02:17:05 -0700,2025-06-19 02:17:05 -0700,about:config -> security.pki.certificate_transparency.disable_for_spki_hashes not working as expected,"<p>Hello community&nbsp;:)  </p><p>hope everybody is doing well. I´m coming here with with asking for a help.  </p><p>I´m managing browsers (Google Chrome, MS Edge and Firefox) in my company via GPOs. What we´ve been dealing with since 135 version came up is having the ""Did Not Connect: Potential Security Issue error page , Error insufficient cert transparency"" while visiting our internal resources.  </p><p>Despite of having the  security.pki.certificate_transparency.disable_for_spki_hashes set up -&gt;  main three certificate hashes are correctly added, basically copying the setup from Chromium browsers , where everything works as expected , Firefox is not.  </p><p>The only way how to make it work is via security.pki.certificate_transparency.disable_for_hosts , which is , of course, not desirable , because of the security risks. </p><p>Does anyone face the same issues&nbsp;?  </p><p>Thank you very much ya´ll </p>",firefox;web-certificates;,firefox,web-certificates,en-US,"",tomas.jetel
1517823,2025-06-19 02:00:13 -0700,2025-06-19 02:00:13 -0700,gghhh,<p>This information gives details about the internal workings of your browser that will help in answering your question. </p>,firefox;download-and-save;,firefox,download-and-save,en-US,"",madhubalan.s
1517821,2025-06-19 01:29:24 -0700,2025-06-19 01:29:24 -0700,DINESH,<p>DAKJNNGLKN LNLKML </p>,firefox;download-and-save;,firefox,download-and-save,en-US,"",suigamgjsug
1517818,2025-06-19 00:53:12 -0700,2025-06-19 00:53:12 -0700,why do i have to sign in with google every time i want to use youtube ?,<p>Tired of signing in on google to go on Youtube. </p>,firefox;accessibility;,firefox,accessibility,en-US,"",timdixon946
1517816,2025-06-19 00:41:45 -0700,2025-06-19 00:50:04 -0700,formulieren,"<p>Ik wil graag dat firefox automatisch gegevens invult. Zoals adres, naam, bedrijfsnaam etc. op formulieren. </p>",firefox;autofill;,firefox,autofill,nl,1743191;,manager35
1517815,2025-06-19 00:41:01 -0700,2025-06-19 00:41:01 -0700,Desarrollador de free fire,<p>Supresor </p>,firefox;accessibility;,firefox,accessibility,es,"",martinezjesus4025
1517814,2025-06-19 00:25:41 -0700,2025-06-19 00:37:59 -0700,unable to login epfo portal,<p>i unable to login epfo portal from firefox browser </p>,firefox;performance-and-connectivity;needsinfo;,firefox,performance-and-connectivity,en-US,1743184;,mohd.anwa
1517812,2025-06-19 00:05:34 -0700,2025-06-19 00:05:34 -0700,acesso misto,"<p>E POSSIVEL UMA ATUALIZACAO? POIS INSTALEI UMA BOX H96 MAX 318, QUE IMPORTADA ESTA FUNCIONANDO MUITO BEM. SIM REFIRO-ME  UMA ATUALIZACAO DO MEU NAVEGADOR FIREFOX, SE POSSIVEL JA ADIANTO-ME AGRADECIDO, POIS SOU UM ANALFABETO DIGITAL. </p>",firefox;installation-and-updates;,firefox,installation-and-updates,pt-BR,"",nunesfilosophya178
1517810,2025-06-18 23:59:48 -0700,2025-06-18 23:59:48 -0700,SPOTIFY MOD APK,"<p>is a perfect solution for music lovers who want a premium experience without the subscription cost. It offers all the features of the paid Spotify Premium version, including ad-free listening, unlimited skips, and offline downloads, allowing users [[ spotify mod apk |<a href=""https://spotimoody.com/]]"" rel=""nofollow"">https://spotimoody.com/]]</a>  to enjoy high-quality music and podcasts without interruptions. The app also allows you to download your favorite tracks in various formats, including MP4, and even in 4K quality, making them ideal for offline listening. </p>",firefox;backup-recovery-and-sync;,firefox,backup-recovery-and-sync,en-US,"",foruswaiting60
1517808,2025-06-18 23:46:29 -0700,2025-06-18 23:46:29 -0700,Analyse des impacts environnementaux des barrages hydroélectriques et solutions de minimisation pour le Cameroun,"<p>Résumé Le développement accéléré des barrages hydroélectriques constitue un levier stratégique pour la sécurisation énergétique du Cameroun. Toutefois, cette dynamique s’accompagne d’effets environnementaux non négligeables, souvent sous-évalués, qui compromettent l’intégrité écologique des bassins fluviaux. Cette étude a pour objet l’analyse systémique et quantitative des impacts environnementaux induits par les principales infrastructures hydroélectriques nationales, à travers une approche multidisciplinaire combinant analyses spatiales par télédétection, évaluations écotoxicologiques, et modélisation hydrosédimentaire. L’objectif est double&nbsp;: (i) identifier les transformations majeures des écosystèmes aquatiques et terrestres en aval et en amont des barrages (dégradation de la biodiversité, perturbations hydroclimatiques, sédimentation excessive, fragmentation des habitats) et (ii) formuler un ensemble de solutions opérationnelles de minimisation. Parmi les résultats significatifs, l’étude révèle une réduction de plus de 40 % des flux sédimentaires naturels, une perte substantielle de zones humides, et des altérations notables dans les dynamiques de reproduction des espèces halieutiques. En réponse, des stratégies intégrées de gestion adaptative sont proposées, incluant la mise en œuvre de déversoirs écologiques, la restauration des corridors biologiques, et l’optimisation du régime de rétention des eaux selon des modèles de flux écologiques. L’originalité de cette recherche réside dans l’élaboration d’un cadre méthodologique contextualisé, fondé sur l’interfaçage entre modélisation environnementale et gouvernance énergétique. Cette approche novatrice permet de concilier impératifs de développement et sauvegarde durable des écosystèmes, ouvrant ainsi la voie à une hydroélectricité écologiquement soutenable au Cameroun. Mots-clés&nbsp;: Hydroélectricité, Impact environnemental, Modélisation écologique, Barrages, Développement durable </p><p>Introduction L’essor des infrastructures hydroélectriques au Cameroun s’inscrit dans une dynamique plus large de transition énergétique visant à réduire la dépendance aux combustibles fossiles tout en répondant à une demande croissante en électricité. Dans ce contexte, les barrages hydroélectriques représentent une solution privilégiée pour garantir une production énergétique stable, renouvelable et relativement peu coûteuse. Toutefois, derrière cet élan de développement se cachent de profondes perturbations environnementales, souvent reléguées au second plan. En effet, la mise en eau des réservoirs entraîne des modifications substantielles des régimes hydrologiques, l’inondation de vastes zones terrestres, l’érosion accélérée des sols, ainsi que la fragmentation des habitats naturels, affectant durablement la biodiversité locale et régionale. Pour répondre à ces défis, plusieurs approches ont été proposées dans la littérature, allant de l’adoption de normes environnementales strictes à l’implémentation de technologies de régulation écohydrologique. Des études antérieures menées dans divers contextes (par exemple, les bassins de l’Amazone, du Mékong ou du Nil) ont mis en évidence des impacts similaires, tout en soulignant l’importance d’une gestion adaptative et contextuelle. Cependant, l’état de l’art révèle une carence notable d’analyses empiriques et modélisées spécifiques au contexte camerounais, notamment en ce qui concerne la quantification spatio-temporelle des impacts, la modélisation prédictive des effets cumulatifs et la formulation de stratégies de mitigation intégrées. Cette étude propose de combler ces lacunes en élaborant un cadre méthodologique rigoureux, alliant imagerie satellitaire, analyses géo-écologiques et modélisation environnementale, afin de produire un diagnostic précis des effets des barrages hydroélectriques sur les écosystèmes locaux. L’objectif fondamental est d’identifier des mesures de minimisation robustes, scientifiquement fondées et adaptées aux spécificités du territoire camerounais. La nouveauté de cette recherche réside dans l’interconnexion systémique entre dynamique écosystémique, gouvernance environnementale et planification énergétique durable, contribuant ainsi à la construction d’un modèle national d’hydroélectricité écologiquement responsable. </p><p><br> </p><p><br> Références  1.	Nonki RM, Lenouo A, Tchawoua C, Lennard CJ, Amoussou E. Impact of climate change on hydropower potential of the Lagdo dam, Benue River Basin, Northern Cameroon. Proc IAHS. 2021;384:337–<a href=""http://342.link.springer.com"" rel=""nofollow"">342.link.springer.com</a>+<a href=""http://3piahs.copernicus.org"" rel=""nofollow"">3piahs.copernicus.org</a>+<a href=""http://3en.wikipedia.org"" rel=""nofollow"">3en.wikipedia.org</a>+3 2.	Akono EB, Kemezang VC. Balancing short-term costs and long-term benefits: an analysis of the impact of hydroelectric power generation on electricity prices volatility in Cameroon. Sustain Energy Res. 2024;11:<a href=""http://7.sustainenergyres.springeropen.com"" rel=""nofollow"">7.sustainenergyres.springeropen.com</a> 3.	Almeida RM, et al. Strategic planning of hydropower development: balancing benefits and socioenvironmental costs. Curr Opin Environ Sustain. 2022;56:<a href=""http://101175.nature.com"" rel=""nofollow"">101175.nature.com</a> 4.	Flecker AS, et al. Reducing adverse impacts of Amazon hydropower expansion. Science. 2022;375:753–<a href=""http://760.nature.com"" rel=""nofollow"">760.nature.com</a> 5.	Opperman JJ, et al. Balancing renewable energy and river resources by moving from individual assessments of hydropower projects to energy system planning. Front Environ Sci. 2023;10:<a href=""http://2410.nature.com"" rel=""nofollow"">2410.nature.com</a> 6.	Siala K, Chowdhury AK, Dang TD, Galelli S. Solar energy and regional coordination as a feasible alternative to large hydropower in Southeast Asia. Nat Commun. 2021;12:<a href=""http://4159.nature.com"" rel=""nofollow"">4159.nature.com</a> 7.	Gonzalez JM, et al. Designing diversified renewable energy systems to balance multisector performance. Nat Sustain. 2023;6:415–<a href=""http://427.nature.com"" rel=""nofollow"">427.nature.com</a> 8.	Neumann F, Brown T. The near-optimal feasible space of a renewable power system model. Electr Power Syst Res. 2021;190:<a href=""http://106690.nature.com"" rel=""nofollow"">106690.nature.com</a> 9.	Howells M, et al. OSeMOSYS: the Open Source Energy Modeling System: an introduction to its ethos, structure and development. Energy Policy. 2011;39:5850–<a href=""http://5870.nature.com"" rel=""nofollow"">5870.nature.com</a> 10.	Taliotis C, et al. An indicative analysis of investment opportunities in the African electricity supply sector—using TEMBA (The Electricity Model Base for Africa). Energy Sustain Dev. 2016;31:50–<a href=""http://66.nature.com"" rel=""nofollow"">66.nature.com</a> 11.	Pappis I, et al. Energy Projections for African Countries. JRC. <a href=""http://2019.nature.com"" rel=""nofollow"">2019.nature.com</a> 12.	Kelman R, et al. Sustainable Hydropower Planning in Gabon. arXiv preprint arXiv:2212.09901. <a href=""http://2022.arxiv.org"" rel=""nofollow"">2022.arxiv.org</a> 13.	Achieng AO, et al. Monitoring biodiversity loss in rapidly changing Afrotropical ecosystems: An emerging imperative for governance and research. arXiv preprint arXiv:2303.13984. <a href=""http://2023.arxiv.org"" rel=""nofollow"">2023.arxiv.org</a> 14.	Beilfuss R. Risky climate for southern African hydro: assessing hydrological risks and consequences for Zambezi River basin dams. International Rivers. <a href=""http://2012.nature.com"" rel=""nofollow"">2012.nature.com</a> 15.	Spalding-Fecher R, Joyce B, Winkler H. Climate change and hydropower in the Southern African Power Pool and Zambezi River Basin: system-wide impacts and policy implications. Energy Policy. 2017;103:84–<a href=""http://97.nature.com"" rel=""nofollow"">97.nature.com</a> 16.	Mutsindikwa TC, Yira Y, Bossa AY, et al. Modeling climate change impact on the hydropower potential of the Bamboi catchment. Model Earth Syst Environ. 2021;7:2709–<a href=""http://2717.link.springer.com"" rel=""nofollow"">2717.link.springer.com</a> 17.	Amoussou E, et al. Climate and extreme rainfall events in the mono river basin (West Africa): Investigating future changes with regional climate models. Water. 2020;12:<a href=""http://833.link.springer.com"" rel=""nofollow"">833.link.springer.com</a> 18.	Coulibaly N, et al. The Impact of Climate Change on Water Resource Availability in a Trans-Boundary Basin in West Africa: The Case of Sassandra. Hydrology. 2018;5:<a href=""http://12.mdpi.com"" rel=""nofollow"">12.mdpi.com</a> 19.	Sylla MB, Faye A. Projected Increased Risk of Water Deficit over Major West African River Basins under Future Climates. Clim Chang. 2018;151:247–<a href=""http://258.mdpi.com"" rel=""nofollow"">258.mdpi.com</a> 20.	Jin L, et al. Modeling Future Flows of the Volta River System: Impacts of Climate Change and Socio-Economic Changes. Sci Total Environ. 2018;637–638:1069–<a href=""http://1080.mdpi.com"" rel=""nofollow"">1080.mdpi.com</a> 21.	Afgan N, da Graça Carvalho M. Sustainable Assessment Method for Energy Systems: Indicators, Criteria and Decision Making Procedure. Springer; <a href=""http://2000.mdpi.com"" rel=""nofollow"">2000.mdpi.com</a> 22.	Gadonneix P, et al. Pursuing Sustainability: 2010 Assessment of Country Energy and Climate Policy. World Energy Council; <a href=""http://2010.mdpi.com"" rel=""nofollow"">2010.mdpi.com</a> 23.	Abubakari S, et al. Modelling Streamflow Response to Climate Change in Data-Scarce White Volta River Basin of West Africa Using a Semi-Distributed Hydrologic Model. J Water Clim Chang. <a href=""http://2018.mdpi.com"" rel=""nofollow"">2018.mdpi.com</a> 24.	Arias ME, et al. Impacts of climate change and deforestation on hydropower planning in the Brazilian Amazon. Nat Sustain. 2020;3:430–<a href=""http://436.link.springer.com"" rel=""nofollow"">436.link.springer.com</a> 25.	Atsri HK, et al. Changes in the West African forest-savanna mosaic, insights from central Togo. PLoS ONE. 2018;13:<a href=""http://e0203999.link.springer.com"" rel=""nofollow"">e0203999.link.springer.com</a> 26.	Amisigo BA, et al. Modeling impact of climate change on water resources and agriculture demand in the Volta Basin and other basin systems in Ghana. Sustainability. 2015;7:6957–<a href=""http://6975.link.springer.com"" rel=""nofollow"">6975.link.springer.com</a>+<a href=""http://1mdpi.com"" rel=""nofollow"">1mdpi.com</a>+1 27.	Amoussou E. Analyse hydroméorologique des crues dans le bassin-versant du Mono en Afrique de l’Ouest avec un modèle conceptuel pluie-débit. Arch Ouvert. <a href=""http://2015.link.springer.com"" rel=""nofollow"">2015.link.springer.com</a> 28.	Amoussou E, et al. Impact de la variabilité climatique et du barrage nangbéto sur l’hydrologie du système Mono-Couffo (Afrique de l’ouest). Hydrol Sci J. 2012;57:805–<a href=""http://817.link.springer.com"" rel=""nofollow"">817.link.springer.com</a> 29.	Achieng AO, et al. Monitoring biodiversity loss in rapidly changing Afrotropical ecosystems: An emerging imperative for governance and research. arXiv preprint arXiv:2303.13984. <a href=""http://2023.arxiv.org"" rel=""nofollow"">2023.arxiv.org</a> 30.	dos Santos MA, et al. Carbon Trapping Efficiency of Hydropower Reservoirs under the Influence of a Tropical Climate. arXiv preprint arXiv:2501.10400. <a href=""http://2025.arxiv.org"" rel=""nofollow"">2025.arxiv.org</a> 31.	Beilfuss R. Risky climate for southern African hydro: assessing hydrological risks and consequences for Zambezi River basin dams. International Rivers. <a href=""http://2012.nature.com"" rel=""nofollow"">2012.nature.com</a> 32.	Spalding-Fecher R, Joyce B, Winkler H. Climate change and hydropower in the Southern African Power Pool and Zambezi River Basin: system-wide impacts and policy implications. Energy Policy. 2017;103:84–<a href=""http://97.nature.com"" rel=""nofollow"">97.nature.com</a> 33.	Mutsindikwa TC, et al. Modeling climate change impact on the hydropower potential of the Bamboi catchment. Model Earth Syst Environ. 2021;7:2709–<a href=""http://2717.link.springer.com"" rel=""nofollow"">2717.link.springer.com</a> 34.	Amoussou E, et al. Climate and extreme rainfall events in the mono river basin (West Africa): Investigating future changes with regional climate models. Water. 2020;12:<a href=""http://833.link.springer.com"" rel=""nofollow"">833.link.springer.com</a> 35.	Coulibaly N, et al. The Impact of Climate Change on Water Resource Availability in a Trans-Boundary Basin in West Africa: The Case of Sassandra. Hydrology. 2018;5:<a href=""http://12.mdpi.com"" rel=""nofollow"">12.mdpi.com</a> 36.	Sylla MB, Faye A. Projected Increased Risk of Water Deficit over Major West African River Basins under Future Climates. Clim Chang. 2018;151:247–<a href=""http://258.mdpi.com"" rel=""nofollow"">258.mdpi.com</a> 37.	Jin L, et al. Modeling Future Flows of the Volta River System: Impacts of Climate Change and Socio-Economic Changes. Sci Total Environ. 2018;637–638:1069–<a href=""http://1080.mdpi.com"" rel=""nofollow"">1080.mdpi.com</a> 38.	Afgan N, da Graça Carvalho M. Sustainable Assessment Method for Energy Systems: Indicators, Criteria and Decision Making Procedure. Springer; <a href=""http://2000.mdpi.com"" rel=""nofollow"">2000.mdpi.com</a> 39.	Gadonneix P, et al. Pursuing Sustainability: 2010 Assessment of Country Energy and Climate Policy. World Energy Council; <a href=""http://2010.mdpi.com"" rel=""nofollow"">2010.mdpi.com</a> 40.	Abubakari S, et al. Modelling Streamflow Response to Climate Change in Data-Scarce White Volta River Basin of West Africa Using a Semi-Distributed Hydrologic Model. J Water Clim Chang. <a href=""http://2018.mdpi.com"" rel=""nofollow"">2018.mdpi.com</a> </p>",firefox;performance-and-connectivity;,firefox,performance-and-connectivity,en-US,"",kikmochristopher
1517807,2025-06-18 23:38:19 -0700,2025-06-18 23:38:19 -0700,Video still auto plays even though AutoPlay is blocked for both Audio and Video,"<p>On certain  <a href=""https://www.huffpost.com/entry/daily-show-jordan-klepper-ted-cruz-tucker-carlson-clash_n_6853773ee4b07e1309c58c2c"" rel=""nofollow"">websites </a>, the audio and video still auto play even though the option, ""AutoPlay"" is blocked for both audio and video.  </p><p>Please see the attached screenshot which shows that auto play is blocked, it is circled in red. While the video has auto played, circled in orange with a timestamp of 17 seconds being played prior to it being manually stopped.  </p><p>Please fix this issue. </p>",firefox-13904;firefox-1390;firefox;browse;,firefox,browse,en-US,"",LimuxSpring
1517806,2025-06-18 23:32:30 -0700,2025-06-19 00:19:24 -0700,sync firefox,<p>how do i do it </p>,firefox;sync-data;,firefox,sync-data,en-US,1743169;,Gembrae
1517804,2025-06-18 22:52:58 -0700,2025-06-18 23:28:42 -0700,can i search with duckduckgo on firefox?,<p><strong>bold text</strong> </p>,firefox;browse;,firefox,browse,en-US,1743146;,anjiripli
1517803,2025-06-18 22:44:53 -0700,2025-06-18 22:44:53 -0700,Trying to join New York Times _ much too difficult,<p><strong># * bold text</strong>I can't join New York Times too difficult. </p>,firefox;passwords-and-sign-in;,firefox,passwords-and-sign-in,en-US,"",pawood12
1517801,2025-06-18 22:28:24 -0700,2025-06-18 22:28:24 -0700,Please TikTok family,<p>Please TikTok family UK account for TikTok live </p>,firefox;accounts;,firefox,accounts,en-US,"",kkhateebkayvillog
1517799,2025-06-18 22:14:16 -0700,2025-06-18 22:14:16 -0700,history,<p>my browser history bookmarks and pinned taps disappeared without my clearing it and my firefox mobile which i just connected last night is not connected </p>,firefox;backup-recovery-and-sync;,firefox,backup-recovery-and-sync,en-US,"",traibeck
1517796,2025-06-18 21:01:42 -0700,2025-06-18 23:54:48 -0700,Change the font size in Firefox itself,"<p>The Firefox version I used before was Mac version 136.0 After I updated to the latest version, I found that the fonts of the browser's tab bar, search box, and bookmarks became significantly larger. How can I change the font size? </p>",firefox-13904;firefox-1390;firefox;settings;,firefox,settings,en-US,"",zhangbingxin25
1517795,2025-06-18 20:58:25 -0700,2025-06-18 20:58:25 -0700,Firefox Nightly crashes every time I try to zoom in using my touch-pad,"<p>As the title states, every time I try to zoom into a page using pinch and zoom with my touch-pad, firefox nightly crashes. However, if I try to zoom in using CTRL+ and CTRL-, it works just fine. </p><p>I have tried to disable hardware acceleration but it didnt help. </p><p>These are the logs which I obtained from the crash reporter: AdapterDeviceID: 0x46a8 AdapterDriverVendor: mesa/iris AdapterDriverVersion: 24.2.8.0 AdapterVendorID: 0x8086 AvailablePageFile: 1012457472 AvailablePhysicalMemory: 10165415936 AvailableSwapMemory: 2000678912 AvailableVirtualMemory: 12812111872 BackgroundTaskMode: 0 BuildID: 20250613160838 ContentSandboxCapabilities: 119 ContentSandboxCapable: 1 ContentSandboxLevel: 6 CrashTime: 1750302886 DOMFissionEnabled: 1 DOMIPCEnabled: 1 DesktopEnvironment: ubuntu:gnome EMCheckCompatibility: true EventLoopNestingLevel: 1 GpuSandboxLevel: 0 GraphicsCriticalError: |[0][GFX1-]: RenderCompositorSWGL failed mapping default framebuffer, no dt (t=148.335)  GraphicsNumActiveRenderers: 2 GraphicsNumRenderers: 1 HeadlessMode: 0 InstallTime: 1749869266 IsWayland: 1 LastStartupWasCrash: 0 LinuxUnderMemoryPressure: 0 MozCrashReason: internal error: entered unreachable code NimbusEnrollments: upgrade-spotlight-rollout:treatment,fx-accounts-ping-release-rollout-2:control,disable-ads-startup-cache:control,desktop-nightly-show-relay-to-13501-logged-out-users:synthetic-control,desktop-credit-card-autofill-global-enablement-rollout-nightly:creditcard-enable,enable-enrollment-status-telemetry-in-firefox-desktop:control,desktop-address-autofill-india-nightly-rollout:control,fpp-screen-avail-hardware-concurrency-desktop:control,hide-descriptions-on-newtab-articles-fix-rollout:control Notes: Ubuntu Core 24FP(D10-L1000-W0000000-T01) WR? WR+ EGL? EGL- GL Context? GL Context+ WebGL? WebGL+  ProductID: {ec8030f7-c20a-464f-9b0e-13a3a9e97384} ProductName: Firefox RDDProcessStatus: Running ReleaseChannel: nightly SafeMode: 0 SecondsSinceLastCrash: 191 StartupCacheValid: 1 StartupCrash: 0 StartupTime: 1750302698 SubmittedFrom: Client Throttleable: 1 TotalPageFile: 18425405440 TotalPhysicalMemory: 16424726528 URL: about:newtab UptimeTS: 188.44815843 UtilityProcessStatus: Running Vendor: Mozilla Version: 141.0a1 useragent_locale: en-US </p><p>Any help or direction would be appreciated, Thanks! </p>",firefox;app-crash;,firefox,app-crash,en-US,"",aksforspam
1517794,2025-06-18 20:55:53 -0700,2025-06-18 20:55:53 -0700,Identify Purchase,<p>Can I have a copy of this purchase B-41K87007MU889471S </p>,firefox;accounts;,firefox,accounts,en-US,"",rjjenquin
1517793,2025-06-18 20:39:18 -0700,2025-06-19 00:14:19 -0700,why not add extiontion,<p>add on not set up my account plz tall how to do this </p>,firefox;extensions;needsinfo;,firefox,extensions,en-US,1743162;,tajuislam89849
1517792,2025-06-18 20:37:59 -0700,2025-06-18 20:37:59 -0700,Bjkxk,<p>Ajsjd </p>,firefox;settings;,firefox,settings,en-US,"",54367hdhdh
1517790,2025-06-18 19:40:56 -0700,2025-06-18 19:40:56 -0700,trying to get into my yahoo account,<p>please all I  am trying to do is get into my yahoo.acct. My tower took a crap and forz now using this  laptop untill I purchase a new laptop.What the fuck do I have to do to get into my yahoo e-mail have used my 8 code numbers quite a few of them etc. Mary Rivero </p>,firefox;accessibility;,firefox,accessibility,en-US,"",riveromary250
1517789,2025-06-18 19:09:44 -0700,2025-06-18 19:09:44 -0700,asking assitance,"<p>hi good morning, can you help me to open my pag-ibig account. </p>",firefox;accounts;,firefox,accounts,en-US,"",bolantejr3
