id,created,updated,title,content,tags,product,topic,locale,answers,creator
1490329,2025-02-02 06:24:23 -0800,2025-02-02 06:24:23 -0800,How do I complain about a wrong transaction on Navi?,"<p>Contact Navi Customer Service:✔️0888~1283-259,, 📞 ❾⓿❶❾❶❹❺❾❻❸Reach out to Navi's customer service team either by phone, email, or through their website's customer support portal. Explain the issue you are facing with your loan and request to file a formal complaint. </p>",firefox;installation-and-updates;,firefox,installation-and-updates,en-US,"",vopildash
1490328,2025-02-02 06:19:39 -0800,2025-02-02 06:20:57 -0800,How do I complain about a wrong transaction on Navi?,"<p>Contact Navi Customer Service:✔️0888~1283-259,, 📞 ❾⓿❶❾❶❹❺❾❻❸Reach out to Navi's customer service team either by phone, email, or through their website's customer support portal. Explain the issue you are facing with your loan and request to file a formal complaint. </p>",firefox;installation-and-updates;,firefox,installation-and-updates,en-US,1708911;1708912;1708913;1708914;,vopildash
1490327,2025-02-02 06:19:04 -0800,2025-02-02 06:19:04 -0800,How do I complain about a wrong transaction on Navi?,"<p>Contact Navi Customer Service:✔️0888~1283-259,, 📞 ❾⓿❶❾❶❹❺❾❻❸Reach out to Navi's customer service team either by phone, email, or through their website's customer support portal. Explain the issue you are facing with your loan and request to file a formal complaint. </p>",firefox;installation-and-updates;,firefox,installation-and-updates,en-US,"",vopildash
1490326,2025-02-02 06:13:12 -0800,2025-02-02 06:18:02 -0800,How do I complain about a wrong transaction on Navi?,"<p>Contact Navi Customer Service:✔️0888~1283-259,, 📞 ❾⓿❶❾❶❹❺❾❻❸Reach out to Navi's customer service team either by phone, email, or through their website's customer support portal. Explain the issue you are facing with your loan and request to file a formal complaint. </p>",firefox;installation-and-updates;needsinfo;,firefox,installation-and-updates,en-US,1708902;1708903;1708904;1708905;1708906;1708907;1708908;1708909;1708910;,vopildash
1490325,2025-02-02 06:09:30 -0800,2025-02-02 06:09:54 -0800,How do I complain about a wrong transaction on Navi?,"<p>Contact Navi Customer Service:✔️0888~1283-259,, 📞 ❾⓿❶❾❶❹❺❾❻❸Reach out to Navi's customer service team either by phone, email, or through their website's customer support portal. Explain the issue you are facing with your loan and request to file a formal complaint. </p>",firefox;installation-and-updates;,firefox,installation-and-updates,en-US,1708898;1708899;,vopildash
1490324,2025-02-02 06:09:08 -0800,2025-02-02 06:10:12 -0800,Timely purse Loan ApP CUSToMER Care Helpline number ♀️+91)-∆-7811067035=///-@-8121√456√902_∆∆∆♂️@+Call,<p>Timely purse Loan ApP CUSToMER Care Helpline number ♀️+91)-∆-7811067035=///-@-8121√456√902_∆∆∆♂️@+CallTimely purse Loan ApP CUSToMER Care Helpline number ♀️+91)-∆-7811067035=///-@-8121√456√902_∆∆∆♂️@+CallTimely purse Loan ApP CUSToMER Care Helpline number ♀️+91)-∆-7811067035=///-@-8121√456√902_∆∆∆♂️@+CallTimely purse Loan ApP CUSToMER Care Helpline number ♀️+91)-∆-7811067035=///-@-8121√456√902_∆∆∆♂️@+CallTimely purse Loan ApP CUSToMER Care Helpline number ♀️+91)-∆-7811067035=///-@-8121√456√902_∆∆∆♂️@+Call </p>,firefox;accessibility;needsinfo;,firefox,accessibility,en-US,1708897;1708900;1708901;,dstfoouy
1490323,2025-02-02 06:01:58 -0800,2025-02-02 06:01:58 -0800,Lost Bookmark folders,"<p>My desktop computer has the default browser as Firefox which I have used for years and love. Yesterday all was working fine and today when I turned' on my computer all bookmark folders were empty! I tried the manage bookmarks and restore backup but every date listed which I tried, gave me a message that it could not be done. What happened with the last Firefox update that caused this and how can I fix it. </p><p>I certainly hope you can help as it would be a mess to recreate these boomark folders which have been built and updated over several years. </p>",firefox;backup-recovery-and-sync;,firefox,backup-recovery-and-sync,en-US,"",tsullivanmd3
1490321,2025-02-02 05:45:40 -0800,2025-02-02 05:45:40 -0800,l'app non funziona,"<p>clicco l'icona di Firefox, l'app non si apre </p>",firefox;accessibility;,firefox,accessibility,it,"",roberto.scarfone
1490320,2025-02-02 05:42:20 -0800,2025-02-02 05:42:40 -0800,How do I complain about a wrong transaction on Navi?,"<p>Contact Navi Customer Service:✔️0888~1283-259,, 📞 ❾⓿❶❾❶❹❺❾❻❸Reach out to Navi's customer service team either by phone, email, or through their website's customer support portal. Explain the issue you are facing with your loan and request to file a formal complaint. </p>",firefox;installation-and-updates;,firefox,installation-and-updates,en-US,1708892;1708893;,vopildash
1490318,2025-02-02 05:25:28 -0800,2025-02-02 05:25:28 -0800,your account has been locked for security reasons,<p>your account has been locked for security reasons&gt;&gt; for quite sometime and i can find how to fix it! my account is zinminkyaw.dc@gmail.com by typing and password and it keep saying 'your account has been locked for security reasons': can you guys tell me how to fix! </p>,firefox;accounts;,firefox,accounts,en-US,"",zinminkyaw.dc
1490317,2025-02-02 05:17:10 -0800,2025-02-02 05:17:10 -0800,Not able to access any site,<p>I am unable to browse </p>,firefox;privacy-and-security_1;,firefox,privacy-and-security,en-US,"",241305y
1490315,2025-02-02 04:56:54 -0800,2025-02-02 04:56:54 -0800,Removing unwanted add ons,<p>How can I remove Zone 94 from firefox? </p>,firefox;accessibility;,firefox,accessibility,en-US,"",lincoln.richford
1490312,2025-02-02 04:46:42 -0800,2025-02-02 04:46:42 -0800,Recuperar minha conta do Google,<p>Recuperar minha conta do Google porque eu esqueci a senha sem e-mail de recuperação </p>,firefox;passwords-and-sign-in;,firefox,passwords-and-sign-in,pt-BR,"",wesleysilvasantos0099
1490311,2025-02-02 04:32:33 -0800,2025-02-02 04:32:33 -0800,"How can I troubleshoot website display issues in Firefox, such as formatting errors or missing content?","<p>If you're experiencing website display issues in Firefox, such as formatting errors or missing content, try the following steps:   </p><p>1. Clear Cache and Cookies – Outdated or corrupted data can cause display issues.   2. Disable Extensions– Some add-ons may interfere with website rendering. Try disabling them temporarily.   3. Check for Updates – Ensure Firefox is up to date, as older versions may not support newer web standards.   4. Try Safe Mode– Launch Firefox in Safe Mode to see if the issue is caused by custom settings or extensions.   5. Inspect Developer Tools – Press `F12` to open the Developer Console and check for errors in the Console or Network tabs.   6. Reset Firefox – If all else fails, resetting Firefox to default settings can resolve persistent issues.   </p><p>If the problem persists on a specific site, try accessing it in another browser to determine if the issue is Firefox-related or site-specific. I am interested in making a menu blog for that purpose I was collecting information from different blogs, I faced the same problems while visiting the site <a href=""https://wingsmenu.co.uk/"" rel=""nofollow"">https://wingsmenu.co.uk/</a> Hope you will help me to resolve my problems. Thanks. </p>",firefox;performance-and-connectivity;,firefox,performance-and-connectivity,en-US,"",jaanesmith24
1490309,2025-02-02 04:18:39 -0800,2025-02-02 04:21:28 -0800,Windows 11 runs slowly when FF is open,"<p>Since around the time I updated to Windows 11 version 24H2 (which I severely regret doing, but it's too late to revert), my computer runs very slowly for several seconds whenever Firefox is launched or whenever its window is restored from minimized. It also randomly slows down the computer every minute or two for several seconds. The slow down manifests as a very long lag in cursor movements and typing. </p><p>The impact is most severe when I am running other programs at the same time, including Outlook and a rather old version of Quicken, but it can be seen even when there are no other programs running. </p><p>This happens even in Firefox troubleshoot mode. This happens even after a refresh. I tried deleting my entire Firefox profile. I tried uninstalling Firefox and reinstalling it. I tried reinstalling the two previous versions of Firefox. I tried with hardware acceleration off and on. I tried changing every possible video setting I could find. My video drivers are fully up-to-date, as are my Windows updates and my BIOS. Nothing has helped. The same problem even exists with a brand-new installation of Firefox and a brand-new profile! </p><p>Notably, I don't see this issue with either Chrome or Edge. </p><p>Before updating to Win 11 ver 24H2, FF was running on this computer for years without issues. I can't say the problem started exactly when I installed 24H2, but it seems like it was around then. I have another computer still on 23H2 with the same version of Firefox (and the same versions of Outlook and Quicken) that does not have this issue. </p><p>My computer is essentially unusable when Firefox and any other major program are running at the same time. I've tried seeing if the CPU or RAM usage spikes during the slowdown, but since the computer nearly (but not quite) freezes when it happens, I haven't been able to catch it live. </p><p>Thank you to anyone who might be able to help. I've had to move to Chrome because of this, and I'm not happy about that. </p>",firefox;performance-and-connectivity;,firefox,performance-and-connectivity,en-US,"",Jon9
1490305,2025-02-02 03:53:21 -0800,2025-02-02 03:53:21 -0800,playing video on YouTube is always choppy,<p>I am not able to play the youtube video on How To Find Your Setup - LuxAlgo Exclusive Toolkits </p>,firefox;accessibility;,firefox,accessibility,en-US,"",ibhafidon
1490302,2025-02-02 02:51:56 -0800,2025-02-02 03:48:21 -0800,previous session lost how to recover,<p>w11 on laptop. Cleaned PC using CCleaner. Restarted windows. Launched Firefox and only 1 tab with calendar opened. Went to History but no indication of the previous session available.&nbsp;? </p>,firefox;backup-recovery-and-sync;,firefox,backup-recovery-and-sync,en-US,1708878;,malaus1
1490300,2025-02-02 02:38:09 -0800,2025-02-02 02:38:09 -0800,Mr korea sontomoro,<p>aide moi pour obtenir tous mes </p>,firefox;accounts;,firefox,accounts,en-US,"",koredeorichande
1490299,2025-02-02 02:11:52 -0800,2025-02-02 02:57:54 -0800,how to block mcfee popups in firefox,<p>how to block ads </p><pre>in firefox </pre>,windows-10;firefox;accessibility;,firefox,accessibility,en-US,1708867;1708872;,phil_borth
1490297,2025-02-02 01:46:56 -0800,2025-02-02 01:46:56 -0800,This is a question from the users to the administration; what will it take for FUTO & Louis Rossmann to officially collaborate?,"<p>Please directly contact Louis Rossmann's current emplouer. That business, FUTO, has been doing the work&nbsp;; so much so, id content it would be the only logical business decision for FUTO to develop their own iteration of a meticulously secure, open-source browser for the community. </p><p>Id donate to that endeavour, should FUTO ever shoulder that responsibility. </p><p>As a short reference to provide context, here is their statement on legal challenges against their users &amp; projects:  <a href=""https://m.youtube.com/watch?v=ReYTWc76SbI&amp;t=6s"" rel=""nofollow"">https://m.youtube.com/watch?v=ReYTWc76SbI&amp;t=6s</a> </p><p>Doing the right thing is simple, but impossibility hard. Your project's 'soul' has not yet abandoned their principles 'ad' sold out .  </p><p>To whoever had to read this, enjoy the music link. </p>",firefox;privacy-and-security_1;,firefox,privacy-and-security,en-US,"",dontwatchitman
1490296,2025-02-02 01:45:01 -0800,2025-02-02 01:45:01 -0800,"Pixilation of news channels and solcial media feed such as X, substack BBC and others",<p>In playing videos from other feeds the video opens and within seconds the picture is pixilated although the sound is clear. Has been like this for about 5 days since your last release. Place the URL in Chrome and running the video shows NO pixilation. This is very frustrating. </p><p>I have attached various screen shots from different feeds </p>,firefox;performance-and-connectivity;,firefox,performance-and-connectivity,en-US,"",henry.wild
1490295,2025-02-02 01:39:43 -0800,2025-02-02 02:43:20 -0800,Downloading Add-Ons,<p>I wanted to download an Add-On: 4.9.23 but I could not see it in your list of add-ons. What do I do? </p>,firefox;download-and-save;,firefox,download-and-save,en-US,1708869;,quinn.200
1490294,2025-02-02 01:34:29 -0800,2025-02-02 01:34:29 -0800,Color not showing,<p>Color on emails and documents not showing </p>,firefox;settings;,firefox,settings,en-US,"",adelehughes
1490293,2025-02-02 01:27:36 -0800,2025-02-02 01:27:36 -0800,lost all my passwords,"<p>hi! today i bought a new computer and tried to sign into my firefox account.but unfortunately i only remembered my email <a href=""http://name.so"" rel=""nofollow"">name.so</a> i changed my password by ""forgot password"".now all my saved password are gone. how can i get those back? i dont have the old ssd that had firefox . should i send an email to mozilla? </p>",firefox;backup-recovery-and-sync;,firefox,backup-recovery-and-sync,en-US,"",thathsararajapaksha16
1490290,2025-02-02 01:09:46 -0800,2025-02-02 01:09:46 -0800,Can't Alt+Tab or otherwise use keyboard to switch between multiple Firefox windows,"<p>When a tab is opened or moved into a new window (image 2.png), the additional windows will disappear from the Windows taskbar after a few moments (image 3.png) and cannot be accessed via Alt+Tab, the only way to reach that window is via dragging the windows around or with the Firefox View tab. </p>",windows-10;firefox-13402;firefox-1340;firefox;accessibility;,firefox,accessibility,en-US,"",superrobot300
1490288,2025-02-02 01:06:28 -0800,2025-02-02 01:06:28 -0800,bloquer expéditeur de mail,"<p>bonjour  </p><p>la mention ""bloquer l'expéditeur"" dans la réception de mail n'existe plus </p><p>comment faire &nbsp;? </p><p>merci  </p><p>bien à vous  </p><p>Benoît </p>",firefox;performance-and-connectivity;,firefox,performance-and-connectivity,en-US,"",Benoitdurand
1490286,2025-02-02 00:58:39 -0800,2025-02-02 00:58:39 -0800,nao estou conseguindo fazer pesquisa no firefox,<p>nao estou conseguindo fazer pesquisa no firefox fica travando </p>,firefox;accessibility;,firefox,accessibility,pt-BR,"",alexandren1957
1490285,2025-02-02 00:58:24 -0800,2025-02-02 00:58:24 -0800,papahawee@yahoo.com,<p><strong>bold text</strong> </p>,firefox;accounts;,firefox,accounts,en-US,"",papahawee
1490282,2025-02-02 00:27:56 -0800,2025-02-02 03:24:46 -0800,About Mozilla Firefox site history,<p>Hi About Mozilla Firefox site In which file is site history stored in Windows 10? </p>,firefox;settings;,firefox,settings,tr,1708875;,guvenderince41
1490279,2025-02-01 23:59:14 -0800,2025-02-01 23:59:14 -0800,wat you name?,<p>ftdrgjghykj </p>,firefox;accounts;,firefox,accounts,en-US,"",mjdmls.net
1490278,2025-02-01 23:40:44 -0800,2025-02-01 23:40:44 -0800,Videos on YouTube/Instagram,"<p>I've been using Firefox for the various iterations of Windows for many years and it's gone smoothly. Now, when I play a YouTube or Instagram video in Windows 11, the video often becomes just an image of pixelated multicolored squares. The sound continues to play normally. On YouTube, the video continues to play. On Instagram the video tends to freeze. I've attached a screenshot from an Instagram video. </p><p>I checked my external monitor and it's definitely the laptop, which is less than a year old. This only happens with videos and other browsing works as usual. I have no issue using Chrome, so it seems to be a Firefox thing. I tried clearing the cache and history. When that didn't work, I uninstalled Firefox completely and reinstalled it. Same issue. I've attached a screenshot from an Instagram video. Thanks for any advice you can offer. </p>",windows-11;firefox-13402;firefox-1340;firefox;performance-and-connectivity;,firefox,performance-and-connectivity,en-US,"",woodswoman
1490276,2025-02-01 23:26:47 -0800,2025-02-01 23:26:47 -0800,Hmm. We’re having trouble finding that site. Firefox but not Brave.,"<p>Hi. </p><p>I've been having this problem for a few months now with Firefox displaying the message ""Hmm. We’re having trouble finding that site"".  </p><p>It's intermittent and not related to a particular site. </p><p>Usually, if I click ""Try Again"", the page loads perfectly. Sometimes, a second attempt is required. </p><p>I'm having the problem with 2 of our desktop PCs (different profiles). </p><p>It got so frustrating I switched to Brave for a while. It doesn't have the same problem. </p><p>I'm just guessing here, but I've noticed that some sites (again, no particular sites, it varies) take 10s-15s to come up.  Is Firefox giving up and reporting ""Server not Found"" while Brave keeps trying? </p><p>The computers are rebooted daily and I've tried cycling the power on our router. </p><p>No other responses to this problem have helped. </p>",firefox;browse;,firefox,browse,en-US,"",dhanslip
1490275,2025-02-01 23:19:01 -0800,2025-02-02 00:05:51 -0800,My phone number is working and my email isn’t verified,<p>Hello so my roblox name is (Mina1237655) and I tried using my number to recover my password because my email isn’t verified and my number doesn’t work i don’t know why can you help </p>,firefox;backup-recovery-and-sync;,firefox,backup-recovery-and-sync,en-US,1708829;,famakinwadiamond4
1490272,2025-02-01 22:40:52 -0800,2025-02-01 22:40:52 -0800,Konto gesperrt,"<p>hallo mein Konto ist gesperrt und ich kann mich nicht mehr einlocken. ich hatte eine warnung erhalten,dass ich von einem datenleck betroffen war. ich habe die angegebenen Fehler dan behoben, kann mich seit dem aber trozdem nicht mehr bei meinem Browser anmelden. </p>",firefox;accounts;,firefox,accounts,en-US,"",ron.fr.79
1490269,2025-02-01 22:11:11 -0800,2025-02-01 22:13:01 -0800,Goodnight fytbbdufry58_,<p>Nothing bro </p>,firefox;privacy-and-security_1;,firefox,privacy-and-security,en-US,1708814;1708815;1708816;,dashontucker2014
1490267,2025-02-01 22:02:26 -0800,2025-02-01 22:02:26 -0800,Gestion de la barre personnelle/raccourci sur plusieurs compte Mozilla très pénibles,"<p>Hello, </p><p>Nous sommes en voyage et avons un laptop pour 2. Nous sommes 2 utilisateurs avec chacun un compte Mozilla. Pb&nbsp;: quand on se déconnecte de notre session pour se connecter à l'autre, il y a fusion des marques pages et des raccourcis sur la barre personnelle. CE qui rend l'utilisation peu gérable... Avez vous une solution? </p>",firefox;accounts;,firefox,accounts,en-US,"",pierre.vallerant
1490265,2025-02-01 21:59:37 -0800,2025-02-01 22:02:16 -0800,Browser cache,<p>How to delete cache in the browser? </p>,firefox;browse;,firefox,browse,en-US,1708813;,bandopadhyay.d
1490264,2025-02-01 21:58:28 -0800,2025-02-01 21:58:28 -0800,update,<p>this browser doesent have the same bookmarks as my other </p>,firefox;installation-and-updates;,firefox,installation-and-updates,en-US,"",danvest
1490263,2025-02-01 21:57:11 -0800,2025-02-01 21:57:11 -0800,am i set up  for firefox now?,<p>'<em><strong>bold text'</strong></em> </p>,windows-10;firefox;accounts;,firefox,accounts,en-US,"",lgbabe
1490261,2025-02-01 21:38:16 -0800,2025-02-01 21:38:16 -0800,"Your client, I talked to him today bc I found out about the GitHub  program and he acknowledged it when I showed him i have the program files. We agreed I'm going to use my phone the old way for a while, I need a regular browser and phone control","<p>My dad is your client, I talked to him today bc I found out about the GitHub  program and he acknowledged it when I showed him i have the program files. We agreed I'm going to use my phone the old way for a while, I need a regular browser and full control of my phone </p>",firefox;accessibility;,firefox,accessibility,en-US,"",jason.postbrothers
1490259,2025-02-01 21:13:37 -0800,2025-02-01 21:13:37 -0800,Sync Setup Stalls,"<p>I'm attempting to set up sync between my windows laptop and my new android phone.  The phone has firefox loaded, allows me to pull up the 'sync and save your data' page, allows me to choose 'ready to scan' and presumably successfully scans the QR code displayed on the laptop (the laptop prompts me to approve the new device).  Then the laptop indicates I need to wait to approve it on my phone, and the whole process stalls.  The phone continues to display the mostly blank white screen with only the ""moz://a"" at the top and the spinning blue circle in the center.  Eventually the whole thing seems to time out and I receive an error message on the laptop saying ""websocket unexpectedly closed"" and ""device pairing failed"". </p><p>My two hypotheses are that either still having my old phone (which is being retired to at-home use only, and I'd rather not de-sync) still synced is somehow interfering (seems unlikely), or that something about the new phone's software is interfering in the sync (seems unlikely and way out of my league in terms of troubleshooting around). </p><p>Help please? </p>",firefox-13402;firefox-1340;firefox;backup-recovery-and-sync;,firefox,backup-recovery-and-sync,en-US,"",pittsmaddi
1490256,2025-02-01 20:59:27 -0800,2025-02-01 20:59:27 -0800,restore search bar,<p>'<em>bold text'</em><strong>bold text</strong> </p>,firefox;search-tag-and-share;,firefox,search-tag-and-share,en-US,"",hmff
1490254,2025-02-01 20:38:57 -0800,2025-02-01 20:38:57 -0800,"Current Firefox from yahoo mail get error: Something's gone wrong We may be having trouble with your connection. Connecting your device to Wi-Fi could help fix the issue or try again later. If you were using an app, close this page. Otherwise, start over.","<p>In current version of firefox when attempting to log in to <a href=""http://yahoo.com"" rel=""nofollow"">yahoo.com</a> I get the error message from AT&amp;T: </p><p>Something's gone wrong We may be having trouble with your connection. Connecting your device to Wi-Fi could help fix the issue or try again later. If you were using an app, close this page. Otherwise, start over. </p> <hr> <p>No error when using edge or chrome. </p>",firefox-13402;firefox-1340;firefox;browse;,firefox,browse,en-US,"",david.burlingame
1490250,2025-02-01 20:29:26 -0800,2025-02-01 20:29:26 -0800,onlyfans,<p>For some reason everything I try to log on to my only fans it won't let me. </p>,firefox;accessibility;,firefox,accessibility,en-US,"",lauriesontag
1490249,2025-02-01 20:27:45 -0800,2025-02-01 20:28:24 -0800,Side do not work,<p>side nahi khul raha is pej par </p>,firefox;accessibility;needsinfo;,firefox,accessibility,en-US,1708796;,pujaabhitanu
1490248,2025-02-01 20:21:40 -0800,2025-02-01 20:21:40 -0800,wont play any videos on youtube or xvideos,<p><strong>bold text</strong> </p>,firefox;performance-and-connectivity;,firefox,performance-and-connectivity,en-US,"",nmooren317
1490247,2025-02-01 20:20:17 -0800,2025-02-01 20:20:17 -0800,bookmarks,<p>Hello mozilla crew Just inquiring how to back up my bookmarks as I am thinking of updating from windows 10 to windows 11 and I am not sure if bookmark will be reset when I sign back into firefox on new windows 11 </p><pre>Cheers Skinny </pre>,firefox;backup-recovery-and-sync;,firefox,backup-recovery-and-sync,en-US,"",skincat17
1490243,2025-02-01 19:13:19 -0800,2025-02-01 19:13:19 -0800,online banking account access,"<p>Yesterday I could not access my account to view recent statements.  It would not accept username , which bank insured was correct(as it is my account #).  Anything I entered flashed an ALERT message that info was incorrect. </p>",firefox-13402;firefox-1340;firefox;accounts;,firefox,accounts,en-US,"",ritah4
1490239,2025-02-01 18:36:28 -0800,2025-02-01 21:35:55 -0800,Download helper add*on,<p>can't be installed properly! How-to-do? </p>,firefox;installation-and-updates;,firefox,installation-and-updates,en-US,1708804;,salimbasaci
1490237,2025-02-01 18:27:12 -0800,2025-02-01 18:27:55 -0800,arnaque menace de mort,<p>Sosricochet qui produise meme des situation a risque pour les victime comme moi </p>,firefox;privacy-and-security_1;needsinfo;,firefox,privacy-and-security,en-US,1708781;,arurpinto
1490236,2025-02-01 18:26:53 -0800,2025-02-01 18:26:53 -0800,How to keep Bookmarks toolbar always visble ?,"<p>I use Firefox 134.0.2 on Mac Sequoia 15.2, how can I keep always visible my Bookmarks toolbar&nbsp;? </p>",firefox;settings;,firefox,settings,en-US,"",cldjr
1490235,2025-02-01 18:12:33 -0800,2025-02-01 18:12:33 -0800,no internet connection,<p>improve connection and performance </p>,firefox;performance-and-connectivity;,firefox,performance-and-connectivity,en-US,"",landilebhubesi
