id,created,updated,title,content,tags,product,topic,locale,answers,creator
1490234,2025-02-01 18:05:02 -0800,2025-02-01 18:23:32 -0800,I'm trying to identify what might be a toolbar or top bar on a screenshot,"<p>I'm looking at a screenshot which was submitted as part of a court filing that shows what looks like some sort of toolbar perhaps on a browser. </p><p>I'm trying to figure out just what it belongs do - what browser or such? </p><p>I've attached thepart of the screenshot showing the ""toolbar."" </p><p>Is this a part of an Android browser for non-PC devices - phone, tablet, etc.? </p><p>It looks like there's an address  bar showing ""<a href=""http://jonpsalmonds.net"" rel=""nofollow"">jonpsalmonds.net</a>"" (defunct as of now because of horribly conducted court case) </p><p>I'm just guessing this is the standard top part of browser's window for a browser I've never seen before. </p><p>Any ideas? </p><p>Note - the PDF in which the screenshot was presented had a watermark - that's the faint lettering you see in the background of the image. Just ignore it. </p><p>Bob </p>",firefox;browse;,firefox,browse,en-US,"",BNovell
1490233,2025-02-01 18:00:16 -0800,2025-02-01 18:46:18 -0800,how to block pop-ups,"<p>Hi! I am currently receiving ""Fake"" pop-ups on my laptop from ""McAfee"".... but I know they're FAKE notices as I am not subscribed with McAfee. How can I block these pop-ups? Thank you! </p>",firefox;privacy-and-security_1;,firefox,privacy-and-security,en-US,1708780;1708784;,gingerleigh.wj
1490230,2025-02-01 17:35:00 -0800,2025-02-01 17:35:00 -0800,accessjbility,<p>HOW DO I ACCESS IT AGAIN? </p>,firefox-13402;firefox-1340;firefox;accessibility;,firefox,accessibility,en-US,"",a44wakeup
1490226,2025-02-01 17:16:06 -0800,2025-02-01 17:16:06 -0800,Why isn't this website working in Firefox (but works in Chrome)?,"<p>When trying to access the Tax Withholding Estimate at IRS: <a href=""https://apps.irs.gov/app/tax-withholding-estimator"" rel=""nofollow"">https://apps.irs.gov/app/tax-withholding-estimator</a> it will not work in Firefox. I get this message: ""Application error: a client-side exception has occurred (see the browser console for more information)."" I don't understand how to interpret the console messages. </p><p>I get the message after filling out the ""Information about you"" page and clicking NEXT. Website works without issue in Google Chrome. </p><p>Is there a setting I have clicked in Firefox that is breaking the website or is the website to blame? </p><p>Using Firefox 128.6.0esr with no extensions installed. </p>",firefox;performance-and-connectivity;,firefox,performance-and-connectivity,en-US,"",grgwmsm
1490225,2025-02-01 17:16:03 -0800,2025-02-01 17:22:07 -0800,my location now i can chat,<p>I mainly want to see my gmail location please help </p>,firefox;download-and-save;needsinfo;,firefox,download-and-save,en-US,1708769;,panshwetaw96
1490224,2025-02-01 17:11:50 -0800,2025-02-01 17:11:50 -0800,Mozilla,<p><strong>bold text</strong> </p>,firefox;performance-and-connectivity;,firefox,performance-and-connectivity,en-US,"",abdiahamad72
1490223,2025-02-01 17:11:11 -0800,2025-02-01 17:11:11 -0800,Mozilla,<p><strong>bold text</strong> </p>,firefox;performance-and-connectivity;,firefox,performance-and-connectivity,en-US,"",abdiahamad72
1490221,2025-02-01 17:04:28 -0800,2025-02-01 21:37:10 -0800,where is a my broken app dowlood app,"<p>I know someone is accessing my gmails, I don't know which gmail accounts they are in. I can't see my location. If I have gone to social accounts, there is a problem for me. I have 2 Stats with my phone number and I can't get back to that gmail. Please help </p>",firefox;browse;,firefox,browse,en-US,1708805;,panshwetaw96
1490218,2025-02-01 16:32:36 -0800,2025-02-01 16:32:36 -0800,"I used to have a search bar next to the address bar, but it has disappeared.  How do I get it back?",<p>See above. </p>,firefox;browse;,firefox,browse,en-US,"",larryfelliott
1490217,2025-02-01 16:18:50 -0800,2025-02-01 16:18:50 -0800,Rifat,<p>Facebook </p>,firefox;passwords-and-sign-in;,firefox,passwords-and-sign-in,en-US,"",rexratul68
1490216,2025-02-01 16:15:51 -0800,2025-02-01 16:15:51 -0800,Re pinning Dashlane icon back to menu bar,<p>Had Dashine pinned for two weeks.  Change history settings today to not save history.  Now noticed that icon is not on menu bar anymore.  Tried to add extention back and get this message.  See image.  Using Windows 11.  Suggestions? </p>,firefox;settings;,firefox,settings,en-US,"",lcpaulus
1490215,2025-02-01 16:13:13 -0800,2025-02-01 16:13:13 -0800,Recovery key doesn't work,"<p>Just to be extra safe I tried using my account recovery key and it told me it was invalid.  I was luckily only testing and am still signed in, so I made a new key, and copy pasted it directly from where I made it, and it still told me the key was invalid.  </p><p>Seems bad. </p>",firefox;backup-recovery-and-sync;,firefox,backup-recovery-and-sync,en-US,"",sleepingweevil
