id,created,updated,title,content,tags,product,topic,locale,answers,creator
1501196,2025-03-23 08:26:20 -0700,2025-03-23 08:26:20 -0700,Browser update,<p>You guys are just too stupid. It's better not to update at all. Where did you update the recently closed tab restoration function and the drag-and-drop search function to? </p>,firefox;browse;,firefox,browse,en-US,"",995425750
1501194,2025-03-23 08:19:53 -0700,2025-03-23 08:19:53 -0700,i need to accesss,<p>need to access this link </p>,firefox;privacy-and-security_1;,firefox,privacy-and-security,en-US,"",risulislam520077
1501193,2025-03-23 08:16:08 -0700,2025-03-23 08:16:08 -0700,Prohlížeč Modzilla,"<p>Na PC s W10 používám prohlížeč Modzilla Firefox 136.0.2, který je nastavený jako hlavní prohlížeč a mám v něm nastavený jazyk Čeština. Cca před rokem jsem spouštěl i ""MS EDGE"", abych se sním trochu seznámil a používal jsem ho celkem ""v pohodě"". </p><p>Z naprosto neznámých a mně nepochopitelných důvodů najednou začal EDGE zobrazovat nově otevřené stránky zásadně v arabštině. Nevylučuji, že jsem nevědomky zmáčkl nějaký CTRL - ""něco"" příkaz... Protože jsem si s problémem neuměl poradit, přestal jsem EDGE vůbec spouštět. </p><p>Myslím, že problém nastal tím, že jsem ""z lahve vypustil džina"" = poprvé spustil EDGE. Pokud jsem si vědom, i tam mám nastaven jazyk systému - Češtinu. </p><p>Jenže při startu systému a otevření Firefoxu mi vždy systém otevře jedno nové okno z EDGE. Nevím co se děje, protože ani v levém horním rohu okna prohlížeče není ikona Firefox, nýbrž jakýsi obdélníček s tečkou upropstřed, který je v oknech EDGE. </p><p>No a dnes ""tato plíseň"" přerostla i do Firefoxu. To nové okno EDGE, jaksi vždy vnucené do Firefoxu systémem?  se ode dneška také ukazuje v Arabštině, včetně všech menu, které v tom okně otevřu. </p><p>Takže soudím, že tam bude (jak v EDGE, tak Modzille (nebo v systému?) nějaké mně skryté nastavení, které úplně kašle na to, co mám zvoleno na stránce nastavení a ""překopne"" mito do něčeho co naprosto nechci = do Arabštiny!  Problém bude možná úplně jinde...? </p><p>Používám antivir ESET a řekl bych, že je někde něco ""hacknuté""...? </p><p>Co s tím? </p><p>Děkuji. </p>",firefox-13602;firefox-1360;firefox;settings;,firefox,settings,cs,"",jan.bederka
1501192,2025-03-23 08:04:09 -0700,2025-03-23 08:04:09 -0700,.y account,<p>My account seatings </p>,firefox;accounts;,firefox,accounts,en-US,"",villaverruel05
1501191,2025-03-23 08:03:37 -0700,2025-03-23 08:03:37 -0700,Home screen,"<p>Please forgive me for not being a ""smart guy"". I like to keep three rows on they home screen. BUT, I don't want every site or ""sponsor"" to add to that site. I hope that makes sense. I only want to have the ones I want. Example: I use att for my internet and email. ""Currently"" is where I log in, and then go to my email. But.....I end up with 4-5 ""windows"" from att on the Home screen. Also taps/links to places I haven't visited. Is there a way to stop stuff, and just save the ones I always want....unless I tag one to add? </p><p>Hoping this makes sense!! </p><p>Thanks for the help!! BWP </p>",firefox;accounts;,firefox,accounts,en-US,"",pierce5
1501186,2025-03-23 07:45:37 -0700,2025-03-23 08:10:50 -0700,Meaning of question marks in Release Calendar next to some releases?,<p>What do these question marks mean? Do they indicate tentatively planned releases? </p><p>Bottom line: will there be 115.22 through 115.24? </p><p><br> /uploads/images/2025-03-23-07-41-00-a333e6.png </p>,firefox;installation-and-updates;,firefox,installation-and-updates,en-US,1720515;,wzjweiner
1501185,2025-03-23 07:44:50 -0700,2025-03-23 07:44:50 -0700,Por que tem que está feliz hoje?,<p><strong>texto em negrito</strong>olá </p>,firefox;installation-and-updates;,firefox,installation-and-updates,pt-BR,"",domingas.carvalho
1501184,2025-03-23 07:30:39 -0700,2025-03-23 07:31:38 -0700,after windows reinstall no password,<p>I had ore format  windows 10  and s stupidly used&nbsp;;last pass for all password that   can not get into now either. I do not remember my   firefox password  t and can not get it because  i do not have y email either. what can  i do to log in to Firefox with out email or password p lease help Thank you to all who answer and can help   Mary </p>,firefox;passwords-and-sign-in;,firefox,passwords-and-sign-in,en-US,1720507;,marytheknees
1501183,2025-03-23 07:21:58 -0700,2025-03-23 07:21:58 -0700,使用macmini M4 24G下载使用的火狐浏览器，登陆后与windows、Macmini M4 16G火狐浏览器账号数据不同步，且两者账号的头像、账户密码创建日期都不一致,<p>请提供一个账户数据可以同步的浏览器安装包给我 </p>,firefox;browse;,firefox,browse,en-US,"",Zhengbo_Liang
1501180,2025-03-23 07:16:38 -0700,2025-03-23 08:21:34 -0700,50%-100% CPU usage with no tabs,"<p>For some weeks I have ad an issue with Firefox using 50%-100% of CPU. Normally it is the Firefox process itself, sometimes it is also ""Privileged Cont"". </p><p>OS is Kubuntu 24.04. Firefox has done this across 2-3 versions. </p><p>Things I have tried: </p><p><strong>Restarting Firefox </strong> No change, I'll even get 100% cpu usage with no tabs open </p><p><strong>Refresh Firefox to remove settings and addons</strong> No change </p><p><strong>Uninstall Snap and try direct Apt package</strong> No change </p><p><strong>Remove ~/.mozilla to fully remove any residual settings/cache/etc</strong> No change </p><p><strong>Try with and without hardware acceleration</strong> See: <a href=""https://support.mozilla.org/en-US/questions/1308215"" rel=""nofollow"">https://support.mozilla.org/en-US/questions/1308215</a> No change! </p><p>I would blame my old computer hardware, but Brave runs fine. I am now using Brave, but would dearly like to return to Firefox as I miss containers, and I don't support a chromium dominated web. </p>",firefox;performance-and-connectivity;,firefox,performance-and-connectivity,en-US,1720510;1720512;1720516;,julian3
1501175,2025-03-23 06:37:44 -0700,2025-03-23 06:37:44 -0700,My toolbar button for FB has been disabled.,<p>My toolbar button for FB has been disabled on my page. It shows on my wife's though. What happened? How do I get it enabled again? </p>,firefox;settings;,firefox,settings,en-US,"",sbr1115
1501174,2025-03-23 06:35:31 -0700,2025-03-23 06:35:31 -0700,why does this page open when not wanted: https://support.mozilla.org/en-US/kb/firefox-options-preferences-and-settings?as=u&utm_source=inproduct,"<p><a href=""https://support.mozilla.org/en-US/kb/firefox-options-preferences-and-settings?as=u&amp;utm_source=inproduct"" rel=""nofollow"">https://support.mozilla.org/en-US/kb/firefox-options-preferences-and-settings?as=u&amp;utm_source=inproduct</a> That page always opens togetherwith the actually wanted page&nbsp;? </p>",firefox;settings;,firefox,settings,en-US,"",miniauth
1501173,2025-03-23 06:34:47 -0700,2025-03-23 07:42:29 -0700,latest update is bugged,"<p>Latest update 136.0.2 ruined all accesses like  gmail, bank-sites, other (password) protected sites, even access to Firefox was not easy. Please fix issues back to previous 135 version. </p>",firefox;settings;,firefox,settings,en-US,1720508;,info642
1501171,2025-03-23 06:06:23 -0700,2025-03-23 06:54:17 -0700,text size has suddenly shrunk - too small for reading,"<p>The size of the text on my computer, especially AOL Email has diminished to unreadable size.  How to enlarge the text to a normal size (around 16 or larger).  I've tried settings and specifications and zoom and many others but nothing changes the size of the text.  Can you help in plain language that an old person can follow?  I thank you in advance. </p>",firefox;settings;,firefox,settings,en-US,1720503;,dfmccauley
1501169,2025-03-23 05:38:36 -0700,2025-03-23 05:38:36 -0700,Permissão do Instagram,<p>Permitindo que a pagina do instagram </p>,firefox;accessibility;,firefox,accessibility,pt-BR,"",andrealves.mea
1501168,2025-03-23 05:28:59 -0700,2025-03-23 05:28:59 -0700,fritz box aanmelden,"<p>fritz box aanmelden, Ik ben vergeten om mijn fritzbox aan te melden via de ontvangen mail, is dit nog steeds mogelijk. want als ik nu mijn wachtwoord van de fritzbox wil invullen geeft hij aan dat dat via een onbeveiligde verbinding gaat en dus vraag ik mij af of dit verstandig is. nu blijft er een rood lampje branden bij Info op de fritzbox zelf. zouden jullie de mail anders nogmaals kunnen sturen, zodat ik me alsnog kan aan melden. </p>",firefox;passwords-and-sign-in;,firefox,passwords-and-sign-in,nl,"",jjwaarts
1501167,2025-03-23 05:15:12 -0700,2025-03-23 05:15:12 -0700,learning,<p>for download </p>,firefox;search-tag-and-share;,firefox,search-tag-and-share,en-US,"",ayekyawt245245
1501166,2025-03-23 05:14:15 -0700,2025-03-23 05:14:15 -0700,learning,<p>for learning </p>,firefox;search-tag-and-share;,firefox,search-tag-and-share,en-US,"",ayekyawt245245
1501164,2025-03-23 04:42:30 -0700,2025-03-23 04:42:30 -0700,unable to add new card for payment,<p>I'm trying to update my payment information to add a card but keeps bringing me to here and then wont let me change it here how can this be fixed? </p>,windows-11;firefox;accounts;,firefox,accounts,en-US,"",Manage
1501163,2025-03-23 04:16:24 -0700,2025-03-23 05:32:19 -0700,privatebase.netflix,"<p>I can not receive privatebase.netflix any more, because the certificate is expired on March,22.  according to the fault message. How can I get it again? </p>",firefox;accessibility;needsinfo;,firefox,accessibility,en-US,1720493;,friedan
1501161,2025-03-23 03:54:08 -0700,2025-03-23 03:54:08 -0700,unlock xxx video,<p><strong>bold text</strong>faphouse xxx video </p>,firefox;download-and-save;,firefox,download-and-save,en-US,"",sahunsayang
1501160,2025-03-23 03:53:11 -0700,2025-03-23 03:53:11 -0700,NEM MÜKÖDIK A KAMERA A FIREFOXON....,<p>Nem müködik a kamera a firefoxon </p>,windows-10;firefox-13602;firefox-1360;firefox;installation-and-updates;,firefox,installation-and-updates,hu,"",csincsa
1501159,2025-03-23 03:47:33 -0700,2025-03-23 05:10:36 -0700,upload dialog linux,"<p>Is there a way to just paste a file with path for uploading. In the windows dialogue I can do that to bypass waiting, but in the linux dialogue 1. I really have to wait for all folder content to be shown (I just tried that on a network drive with a quarter million images) 2. I cannot just type paths that are hidden but I know they exist </p>",firefox;needsinfo;linux;,firefox,download-and-save,en-US,1720490;,hamann.w
1501154,2025-03-23 03:05:17 -0700,2025-03-23 03:05:17 -0700,Trinity,"<p>Write a Reflection about the Trinity of God  as one of the Theological Controversy in Patristic period, explain the view about it in your own words. </p>",firefox;search-tag-and-share;,firefox,search-tag-and-share,en-US,"",nazeritem12
1501153,2025-03-23 02:51:31 -0700,2025-03-23 02:51:31 -0700,Working for Customer Service,<p>I will try it but not this </p>,firefox;passwords-and-sign-in;,firefox,passwords-and-sign-in,en-US,"",boishakhi132
1501152,2025-03-23 02:13:22 -0700,2025-03-23 02:16:34 -0700,How to always have Google Translate open weblinks in English ?,"<p>Does anyone know how on Firefox for Windows 10., Pro. - 64 bit / Firefox Browser Ver.: 136.0.2 (64-bit):  </p><p>How to Always have Google Translate open Weblinks in English&nbsp;? </p><p>I have some software programs on my laptop: </p> <ul><li> Advanced SystemCare (from: IO bit) </li><li> Smart Defrag 10            (from: IO bit) </li><li> Driver Booster 12           (from: IO bit), </li></ul> <p>and in the program, to open it's ""User Manual"", it redirects it to open an online manual, in a web browser, that seems to always open them in: ""Sprache auswählen"" language format, which seems to be of some German language orgin (upon trying to ID the language format &amp; the form in of itself). </p><p>I'm using ""Bitdefender VPN"". Within Firefox browser, how do I get weblinks to require them to be opened in a browser, &amp; to get them to be on an English version of Google Translate&nbsp;? / here's the homepage of Google Translate:  <a href=""https://translate.google.com"" rel=""nofollow"">https://translate.google.com</a> </p><p>Do I always need to disable: ""Bitdefender VPN"", just to have them properly open, without using a VPN of any kind&nbsp;? </p><p>I oringinally thought that ""Bitdefender VPN"" is behind this, cause it's a VPN after all, &amp; doesn't ID that i'm based in &amp; within the United States of America. </p><p>I find this very strange why these weblinks open these pages on Google Translate, in some form of German. GOAL: i just want to find a fix to just get these links to: ""auto-open"", in English, on the Google Translate domain. </p><p>Please let me know if anyone has any idea's on how to fix this (&amp; is there an approved Firefox Extention or Add-On that could be of some help in this area)&nbsp;? </p><p>Any idea's on this could really be helpful / I only speek &amp; understand in USA English [&amp; unfortunately, I'm not bilingual]&nbsp;! </p><p>Thanks, Chris Canfield. </p>",firefox;search-tag-and-share;,firefox,search-tag-and-share,en-US,"",ChrisTCanfield722
1501151,2025-03-23 02:10:50 -0700,2025-03-23 02:10:50 -0700,How to add apps such as WhatsApp and Telegram to my computer's home screen?,"<p>Hello Volunteers, Recently I've encountered some issues on adding apps such as WhatsApp and Telegram to my laptop's home screen. I've been trying to figure that out for the past hour. I'd really appreciate if you helped me with this issue as soon as possible. </p>",firefox;settings;,firefox,settings,en-US,"",mshanmugapriya105
1501150,2025-03-23 02:02:18 -0700,2025-03-23 05:07:00 -0700,STRANGE DOWNLOADS,"<p>Recently I have been getting strange automatic downloads which I have seen before. They look like this: Dh3qd41m.htm, iTOaBR9n.htm There is 14 of them. What is causing them </p>",firefox;download-and-save;needsinfo;,firefox,download-and-save,en-US,1720485;,compendium18
1501149,2025-03-23 02:02:10 -0700,2025-03-23 05:19:49 -0700,"After the recent update, i cant interact with elements on some website, eg i cant open an image in image tab of google","<p>After the recent update, i cant interact with elements on some website, eg i cant open an image in image tab of google </p>",firefox;accessibility;needsinfo;,firefox,accessibility,en-US,1720491;,hassangaming111
1501148,2025-03-23 01:58:13 -0700,2025-03-23 01:58:13 -0700,Hindi,<p><strong>bold text</strong> </p>,firefox;settings;,firefox,settings,en-US,"",virendramahiya01
1501147,2025-03-23 01:48:47 -0700,2025-03-23 02:00:09 -0700,Malfunzionamento,<p>Le pagine web sono incomplete specialmente per quello che riguarda i link che non appaiono pur essendoci perchè andando a caso si visualizza la mano al posto del puntatore e schiacciando il collegamento funziona pur non apparendo. Grazie </p>,firefox-13602;firefox-1360;firefox;browse;needsinfo;,firefox,browse,it,1720471;,friva36
1501144,2025-03-23 01:23:33 -0700,2025-03-23 05:56:25 -0700,I simply want to read my passwords,<p>How do I read my passwords? </p>,firefox;passwords-and-sign-in;,firefox,passwords-and-sign-in,en-US,1720495;,corrado5
1501142,2025-03-23 00:56:07 -0700,2025-03-23 00:56:07 -0700,nice too,<p>nice too </p>,firefox;download-and-save;,firefox,download-and-save,en-US,"",cfaustiin
1501141,2025-03-23 00:37:41 -0700,2025-03-23 00:37:41 -0700,ACCOUNT AND PASSWORD RECOVERY,<p>After update all passwords are gone.  How do I recover my account and especially my passwords? </p>,firefox;passwords-and-sign-in;,firefox,passwords-and-sign-in,en-US,"",melifowl
1501139,2025-03-23 00:11:26 -0700,2025-03-23 00:11:26 -0700,one way interview,<p>I need to go straight to the interview without logging </p>,firefox;accounts;,firefox,accounts,en-US,"",arionphiri2
1501138,2025-03-23 00:02:01 -0700,2025-03-23 00:02:01 -0700,office,<p>Please </p>,firefox;browse;,firefox,browse,en-US,"",natubhaisolanki8
1501136,2025-03-22 23:21:11 -0700,2025-03-22 23:21:11 -0700,Amazon saler,<p>i want to make an advertisement for shear my business whit people who you can help me? </p>,firefox;accessibility;,firefox,accessibility,en-US,"",mohammadimahmoud688
1501133,2025-03-22 23:07:35 -0700,2025-03-22 23:07:35 -0700,jdfhsfjfdgjlfdj,<p>ghfhggghjhghj </p>,firefox;download-and-save;,firefox,download-and-save,en-US,"",armanfor786
1501132,2025-03-22 22:59:44 -0700,2025-03-22 22:59:44 -0700,playing video on YouTube is always choppy,<p>thanks for all your work. </p>,firefox;browse;,firefox,browse,en-US,"",abdinur1220
1501131,2025-03-22 22:48:31 -0700,2025-03-22 22:48:31 -0700,extensions,<p>Firefox Multi-Account Container installation? How to do it and add on my page </p>,firefox;installation-and-updates;,firefox,installation-and-updates,en-US,"",mohammedomarduale
1501130,2025-03-22 22:44:48 -0700,2025-03-22 23:13:37 -0700,I want to use Firefox search engine not Google,<p><strong>bold text</strong> </p>,firefox;search-tag-and-share;,firefox,search-tag-and-share,en-US,1720461;,garry.paulson
1501129,2025-03-22 22:42:14 -0700,2025-03-22 22:42:14 -0700,adobe not supporting,<p>adobe not supporting </p>,firefox-13602;firefox-1360;firefox;browse;,firefox,browse,en-US,"",waqarsonia48
1501128,2025-03-22 22:24:01 -0700,2025-03-22 22:24:01 -0700,please save bookmark,<p>dear sir  </p><pre>           my bookmark file is not saved in desktop </pre>,firefox;download-and-save;,firefox,download-and-save,en-US,"",bansalbajranggarhtoll
1501125,2025-03-22 21:57:17 -0700,2025-03-22 21:57:17 -0700,"Downloads Often are Very Slow to Download, and Stops General Searching Until Cancelled","<p>Hello, </p><p>Can you please assist with the following download issue? </p><p>Firefox often, though not always, is very slow to download files, and when this occurs, I am unable to search by others tabs etc. I can download the same file using Edge on the same computer ""instantaneously"". Firefox returns to normal operation ~ 10 seconds after I cancel the download. </p><p>I unsuccessfully attempted to search for solutions. </p><p>Thanks and regards. </p>",firefox;download-and-save;,firefox,download-and-save,en-US,"",settingsaver
1501123,2025-03-22 21:25:18 -0700,2025-03-23 04:57:30 -0700,I cannot play videos on CNN.com ONLY,<p>I can select the video on the thumbnail and then the thumbnail says playing but nothing is happening.  No video and no audio. Videos on all other sites work normally </p>,firefox;needsinfo;,firefox,browse,en-US,1720459;1720460;1720487;,oh.esuom.ynona
1501122,2025-03-22 21:11:21 -0700,2025-03-22 21:11:21 -0700,Opening new windows and swapping between windows takes 10 seconds or more,"<p>I have recently built myself a new computer and started running MS Windows 11. </p><p>I have a problem with Mozilla Firefox, where after a few days of being installed it takes 10 seconds or more to load (or to load subsequent new windows).  It also takes a long time to switch from window to window or to close any windows.  Opening and swapping between tabs is immediate. </p><p>Here is what I have tried: </p><p>- Switching off hardware acceleration. - Clearing the cache, deleting all other data and uninstalling the single add-on I use. - Creating a new profile. - Using Mozilla's own ""Refresh Firefox"" option. - Trying the beta version. - Probably some other stuff that I've forgotten about. </p><p>The ONLY way I can get things running at the proper speed again is to completely uninstall Firefox using an uninstaller (that also deletes all the registry entries), restart the computer, and then reinstall Firefox. </p><p>After setting things back up the way I want, Firefox will run nicely for a number of days, then will slow down again to the point where I have to uninstall and reinstall (whilst also deleting the registry entries). </p><p>It doesn't seem to make any difference whatsoever whether the computer has or hasn't been restarted during that time. </p><p>Does anyone have any idea why this is happening? </p>",firefox-13602;firefox-1360;firefox;performance-and-connectivity;,firefox,performance-and-connectivity,en-US,"",firefox3084
1501120,2025-03-22 20:30:39 -0700,2025-03-22 20:30:39 -0700,search,<p>permanently set my safe search to filter </p>,firefox;search-tag-and-share;,firefox,search-tag-and-share,en-US,"",michaelkwadwomarfo
1501119,2025-03-22 20:08:47 -0700,2025-03-23 02:34:09 -0700,Mozilla,"<p>mam problem z lokalizacją, strona <a href=""https://www.lotto.pl/"" rel=""nofollow"">https://www.lotto.pl/</a> żąda potwierdzenia że jestem na terenie Polski a przeglądarka ciągle mi to blokuje mimo zaznaczenia w ustawieniach zezwolenia na pokazanie lokalizacji, a stwierdzam, że od 30 lat mieszkam w Polsce, podobny bład pojawiał się też kilka lat temu ale wtedy wystarczyło udostępnić tą lokalizację i było ok, proszę o pomoc </p>",firefox;privacy-and-security_1;,firefox,privacy-and-security,en-US,1720474;,rafalwujda5
1501118,2025-03-22 20:08:08 -0700,2025-03-22 20:08:08 -0700,how to search specific date in history on firefox browser 2025,<p>how to search specific date in history on firefox browser 2025? </p>,firefox;search-tag-and-share;,firefox,search-tag-and-share,en-US,"",rfhnl2000
1501117,2025-03-22 19:59:46 -0700,2025-03-22 19:59:46 -0700,无所谓啦啦操,<p>无法理解不了我艹 </p>,firefox;passwords-and-sign-in;,firefox,passwords-and-sign-in,en-US,"",1468758185
1501115,2025-03-22 19:40:00 -0700,2025-03-22 20:26:36 -0700,Logging in to Reddit is blocked.,"<p>Firefox is not allowing me to login to <a href=""http://Reddit.com"" rel=""nofollow"">Reddit.com</a>. Nor can I create a new account with <a href=""http://Reddit.com"" rel=""nofollow"">Reddit.com</a> with Firefox. </p><p>I can login fine with Microsoft Edge. I don't want to use Microsoft Edge. </p><p>I can login fine with Chrome. I don't want to use Chrome. </p><p>What's Firefox's problems? </p><p>moonpupy@outlook.com </p>",firefox;passwords-and-sign-in;,firefox,passwords-and-sign-in,en-US,1720450;,moonpupy
1501114,2025-03-22 19:24:36 -0700,2025-03-22 19:24:36 -0700,Sport,"<p>I want open the <a href=""http://pintar.bi.go.id"" rel=""nofollow"">pintar.bi.go.id</a> </p>",firefox;accessibility;,firefox,accessibility,en-US,"",okta.blackmore78
1501113,2025-03-22 19:13:21 -0700,2025-03-22 19:13:21 -0700,computer,<p>open my firefox brouzing </p>,firefox;installation-and-updates;,firefox,installation-and-updates,en-US,"",bobsonbagajah0
1501110,2025-03-22 18:40:16 -0700,2025-03-22 18:40:16 -0700,Loans and outcomes,<p>Trying to get into redtree </p>,firefox;accounts;,firefox,accounts,en-US,"",jjoannagiza142
1501109,2025-03-22 18:38:31 -0700,2025-03-22 18:38:31 -0700,videos wont stream/play,<p>Videos will not play in firefox. They will play in safari. I tried clearing cache and settings to allow websites to auto play video and sound. Nothing is working. It says I have the latest version of firefox. HELP! </p>,firefox;performance-and-connectivity;,firefox,performance-and-connectivity,en-US,"",sherryecushman
1501108,2025-03-22 18:27:32 -0700,2025-03-22 18:27:32 -0700,Verification,<p>Verification for persona </p>,firefox;backup-recovery-and-sync;,firefox,backup-recovery-and-sync,en-US,"",mohamedakkiel26
1501107,2025-03-22 18:18:44 -0700,2025-03-22 18:18:44 -0700,Playing video,<ol><li> Numbered list item </li></ol>,firefox;accessibility;,firefox,accessibility,en-US,"",nnsheladia
1501102,2025-03-22 17:23:25 -0700,2025-03-22 17:23:25 -0700,Syncing Issues,"<p>Hello Mozilla. I am logged on to my Firefox account on a new computer. Although I have logged in, I haven't experienced Firefox automatically syncing my bookmarks and extensions as I did two computers ago to this last computer. I have tried syncing numerous time (pressing the sync button in my account) to no avail. What do I need to do to get this working? Thank you for your time and attention. </p>",firefox;backup-recovery-and-sync;,firefox,backup-recovery-and-sync,en-US,"",sleepyalligator227
1501101,2025-03-22 17:23:23 -0700,2025-03-23 01:15:46 -0700,115.9.1esr 64 bit,<p>aggiornamento vers. 115.9.1esr 64bit linux </p>,needsinfo;,firefox,installation-and-updates,it,1720466;,maurichine
1501100,2025-03-22 17:21:52 -0700,2025-03-22 17:21:52 -0700,i have no questions,<p>I have no problems </p>,firefox;accessibility;,firefox,accessibility,en-US,"",annetterandy
1501098,2025-03-22 17:12:40 -0700,2025-03-22 17:12:40 -0700,Google Search Results Screen Loads Incorrectly,"<p>Hello, </p><p>I recently switched from Brave to FireFox, and notice that my Google search results page doesn't load properly. I'm not sure how long after switching this was an issue. I feel like Google worked fine for a time, but now it's suddenly loading improperly. </p><p>I've also grabbed the console output from Google when on a search results page. You can find that <a href=""https://pastebin.com/nmpFcn7S"" rel=""nofollow"">here</a>. </p><p>I'm using Windows 11 and have never had this issue happen before as far as I can remember. I am aware of a <a href=""https://support.mozilla.org/en-US/questions/1365101"" rel=""nofollow"">thread with an identical issue</a>, but my issue still persists even after trying their solution. </p><p>Any help would be appreciated. </p><p>Thanks! </p>",firefox-13602;firefox-1360;firefox;browse;,firefox,browse,en-US,"",Noisyroblot101
1501097,2025-03-22 17:02:45 -0700,2025-03-22 17:02:45 -0700,"how do you turn off 11 digit phone numbers, the STANDARD IN THE USA IS 10","<p>how do you turn off 11 digit phone numbers in firefox, most web sites i  want/need 10 digit phone numbers  not 11  how can i turn off your addition of the 11th number </p>",firefox-13602;firefox-1360;firefox;settings;,firefox,settings,en-US,"",arichardson004
