id,created,updated,title,content,tags,product,topic,locale,answers,creator
1507350,2025-04-21 14:03:23 -0700,2025-04-21 14:03:23 -0700,Secure Connection Failed,<p>how can i access a site with unsecure connection </p>,firefox;privacy-and-security_1;,firefox,privacy-and-security,en-US,"",genocidal24
1507349,2025-04-21 13:44:59 -0700,2025-04-21 13:44:59 -0700,ativar meu canal e não encontro a senha,<p><strong>Não acho minha senha </strong> do canal youtube<strong></strong> </p>,firefox;accessibility;,firefox,accessibility,pt-BR,"",alaskaehaiti
1507347,2025-04-21 13:40:52 -0700,2025-04-21 13:40:52 -0700,Firefox and Hulu,<p>Sometimes when watching a video on hulu (and maybe other similar sites) after a commercial the screen is all messed up and I have to stop the video and reload to get a picture. The sound is fine but the picture is messed up. This only happens with firefox. Any ideas on how to fix this? </p>,firefox;performance-and-connectivity;,firefox,performance-and-connectivity,en-US,"",tbundy00
1507346,2025-04-21 13:36:35 -0700,2025-04-21 13:36:35 -0700,FF & AMZ,<p>Why isn't Amazon loading on Firefox? Getting an unsecure Secure Connection Failed notice. </p>,firefox-13702;firefox-1370;firefox;accessibility;,firefox,accessibility,en-US,"",lordgus1
1507345,2025-04-21 13:34:06 -0700,2025-04-21 13:34:06 -0700,How do I remove bookmarks that are suddenly arrayed horizontally across my screen?,"<p>I suddenly have random bookmarks along the top of my screen, just below the Google search bar. I cannot figure out how this happened or how to undo it. I HATE this and have already wasted a huge amount of time. Please tell me how to get rid of this plague. It seems to happen only when I open a new tab, but it is really annoying. </p>",windows-10;firefox;settings;,firefox,settings,en-US,"",amazinphrasin
1507344,2025-04-21 13:26:37 -0700,2025-04-21 13:26:37 -0700,"I can't download any archive with ""untraditional"" extension, like .mobi .tar.xz .epub etc","<p>Since yesterday, and without doing anything in particular (apparently) all ebooks or other files try to download, show as ""failed"" in the Firefox download area. I am using Ubuntu 25.04 for some days and beyond that I have not had other problems. I have deactivated my Add Ons and I have tried changing the restrictive settings to Firefox Standard Settings... and nothing. I don't know what the error can be. </p>",firefox-13702;firefox-1370;firefox;download-and-save;,firefox,download-and-save,es,"",azambrano83
1507343,2025-04-21 13:13:20 -0700,2025-04-21 13:13:20 -0700,Synced new computer,"<p>Synced my new computer, received bookmark toolbar and 10 year old bookmarks from when i switched from interent explorer, but all my more recent bookmarks and bookmark folders are still missing on the new computer. Also didn't seem to transfer passwords and autofill info. </p>",firefox;backup-recovery-and-sync;,firefox,backup-recovery-and-sync,en-US,"",hrlychrly1
1507342,2025-04-21 13:11:01 -0700,2025-04-21 13:11:01 -0700,Black thumbtacks suddenly appear on all shortcuts,"<p>Why are these showing up now? They were never there before. Is there a way to hide them or make them disappear? They are ugly, distracting to look at and unnecessary. I tried one about:config solution, but it did not work. Please fix this. See screenshot.  The black tacks should not be visible, but now they are. </p>",firefox;settings;,firefox,settings,en-US,"",Lyghtkeepr
1507340,2025-04-21 13:04:41 -0700,2025-04-21 13:04:41 -0700,COMMUNITY SOFTWARE,"<p>ACCESSING BACKUP ISSUES, ANYBODY? </p>",firefox;accounts;,firefox,accounts,en-US,"",hankinssamuelleeiii
1507339,2025-04-21 13:02:04 -0700,2025-04-21 13:02:04 -0700,No confirmation email recevied to sync with another computer.,"<p>Hello,   </p><p>I never received a  confirmation code to sync with my other computer.  I've tried to followed all the instruction per request, still no avi.   </p><p>I've followed below instruciton from your team: </p><p><br> </p><pre>   Search your inbox for emails from accounts@firefox.com with the subject line ""Confirm your account"". Be sure to also check Spam/Junk folders.    Add accounts@firefox.com to your whitelist/address book. After that you, will need to trigger another confirmation email by trying to sign into your account again.    Check that you’re using the correct email address. Very often the email you’re trying to sign in with is not the email the account was created with.    If you're using an email application to check your inbox, try using your email provider's website instead, or vice-versa.    Disable any VPN or special DNS configuration when attempting to sign into your account </pre>",firefox;backup-recovery-and-sync;,firefox,backup-recovery-and-sync,en-US,"",jimmyc1121
1507338,2025-04-21 12:40:56 -0700,2025-04-21 12:40:56 -0700,Web Pages,"<p>Why can I no longer refresh pages which are open the symbol is now missing,hope you can help </p>",firefox;accessibility;,firefox,accessibility,en-US,"",perry2.cornish
1507336,2025-04-21 12:11:09 -0700,2025-04-21 12:11:09 -0700,yes i like it,<p>ok very good so much </p>,firefox;search-tag-and-share;,firefox,search-tag-and-share,en-US,"",soranithpen
1507335,2025-04-21 11:18:44 -0700,2025-04-21 11:47:51 -0700,Firefox,"<p>Created Gmail account for <a href=""http://gmail.com"" rel=""nofollow"">gmail.com</a>. </p><p>Where my name or initial should appear, it says ""Finish setup"" </p><p>I have checked circles that I want, but it still says ""Finish setup.""  </p><p>What can I do? </p>",firefox;accessibility;,firefox,accessibility,en-US,1727226;,mreldersmith3
1507334,2025-04-21 11:18:30 -0700,2025-04-21 11:54:30 -0700,How many times do I have to say YES or DISMISS to the update question,<p>how many times do I have to say YES to the update question that constantly appears each time I access another page? I said YES the first time. It is driving me NUTS and interrupting my work </p>,firefox;installation-and-updates;,firefox,installation-and-updates,en-US,1727229;,nbrowall
1507332,2025-04-21 11:16:20 -0700,2025-04-21 11:16:20 -0700,Display Error,"<p>When I have firefox open for a while, not sure how long, the display starts to mess up on some pages.  When I print those pages, the words are still messed up.  One place is printing things form the Virginia Department of Taxation I-File.  I do not like to close out of the browser every single day and with other browsers I do not have to.  This is new and started this year.  Not sure when.  How do I fix this issue without having to restart the browser and close out of everything all the time? </p>",firefox;performance-and-connectivity;,firefox,performance-and-connectivity,en-US,"",hhts1
1507331,2025-04-21 11:14:57 -0700,2025-04-21 11:54:13 -0700,Passkey worthless BS,"<p>Trying to log into Amazon and Firefox is request a Passkey.  I selected to log in with my usually password and the passkey request will not go away...WTF Firefox this is total bs that this type of request is being even suggested when I have a password, pin and phone verification to already login. </p>",firefox;passwords-and-sign-in;,firefox,passwords-and-sign-in,en-US,1727228;,rodken67
1507329,2025-04-21 11:04:29 -0700,2025-04-21 11:57:28 -0700,CONFLICT WITH FIREFOX AND OUTLOOK 2021,"<p>I'm using Windows 10 and have just completely uninstalled and reinstalled Firefox.  </p><p>PROBLEM: Using MS Office 2021, OUTLOOK, when I select ""EMAIL LINK"" I get two windows, the expected one with the email link in the body, and one much smaller that is blank. </p><p>The second smaller window is an extra and serves no purpose; except that I have to close it. After an hour with a senior Microsoft tech this morning, he said the problem with with Mozilla; that everything works normally (only one window opens!) - leaving Firefox/Mozilla as the source of the problem </p><p>I've completely uninstalled and reinstalled Firefox, clearing the cache, etc., etc.  so I have nothing to attach. ALSO, when I tried to ""Share Date,"" there was an error and I 've had to retype the above again. So, if you need more that the info I've given, please let me know. </p>",firefox;performance-and-connectivity;,firefox,performance-and-connectivity,en-US,1727230;,salpern
1507327,2025-04-21 10:42:23 -0700,2025-04-21 10:42:23 -0700,Jelszócsere után minden elveszett,"<p>Sziasztok! </p><p>Ma ahogy újra fel kellett raknom a firefoxot egy rendszer újrarakás miatt és be szerettem volna jelentkezni, nem tudtam, nem fogadta el a jelszavam. Csináltam újat és sehol nem kérte a fiók helyreállítási kulcsom, hanem generált nekem egy újat, de ezzel mint kiderült mindenem elveszett. Van valami mód, hogy 10 évnyi jelszót/könyvjelzők garmadáját valahogy vissza tudjam állítani a régi fiók helyreállítási kulcs birtokában? </p>",firefox;passwords-and-sign-in;,firefox,passwords-and-sign-in,hu,"",csabika121
1507324,2025-04-21 10:34:47 -0700,2025-04-21 10:34:47 -0700,ZAKLINA,<p>SSSSSSSS </p>,firefox;accounts;,firefox,accounts,en-US,"",zaklinafilipovic.nis
1507323,2025-04-21 10:34:32 -0700,2025-04-21 13:09:44 -0700,All push notifications from Firefox are not showing as banners on desktop,<p>Good afternoon.  I now have all my firefox push site notifications set to come through on the desktop even if the browser is closed.  However only when I open the browser do the notifications come across as banners and show in the action center on the desktop.  How do I have them show without accessing Firefox?  Thank you. </p>,firefox;performance-and-connectivity;,firefox,performance-and-connectivity,en-US,1727232;1727253;,figureguy1
1507320,2025-04-21 10:25:20 -0700,2025-04-21 12:32:49 -0700,Bookmarks not syncing on new device,"<p>Hello, </p><p>Earlier today I reformatted my device but when I logged in to firefox I can only see my history is getting synced my bookmarks are empty, I've checked and bookmarks are check off and they should be synced. How do I get them to sync? It has worked fine in the past. Thanks. </p>",firefox-1370;firefox;backup-recovery-and-sync;,firefox,backup-recovery-and-sync,en-US,1727241;,nmr_privat
1507318,2025-04-21 10:21:04 -0700,2025-04-21 12:29:04 -0700,Facebook,"<p>Help me get on Facebook. I am 85, and have used facebook for years.  I have never put anything on, but enjoy looking at it everyday and sometimes sharing a page. </p><pre>For over a month I  have  not been able  to get on. I must take a selfie for identity, but my computer does not have a camera and I will never be able  to do this. It is me and I  want back on.  Can you  help me?? </pre> <p>Thanks Brenda Hutto   N.  Ft. Myers FL </p>",firefox;accounts;,firefox,accounts,en-US,1727239;,ualemp4860
1507317,2025-04-21 10:08:30 -0700,2025-04-21 10:08:30 -0700,homeboy,<p><strong>bold text</strong> </p>,firefox;download-and-save;,firefox,download-and-save,en-US,"",DEBUMA78
1507316,2025-04-21 10:05:53 -0700,2025-04-21 12:33:36 -0700,I recently switched to Firefox browser but lost my bookmarks in the process,<p>Help me get my bookmarks back in Firefox </p>,firefox;backup-recovery-and-sync;,firefox,backup-recovery-and-sync,en-US,1727242;,julia_ambridge
1507315,2025-04-21 09:37:10 -0700,2025-04-21 09:50:39 -0700,Norton password manager icon,<p>I cannot get the  Norton password manager on my samsung tablet.  Mozilla Firefox is my default browser. </p>,firefox;passwords-and-sign-in;,firefox,passwords-and-sign-in,en-US,1727207;,vickierose12
1507314,2025-04-21 09:32:50 -0700,2025-04-21 09:32:50 -0700,vídeo ruim,<p>Verificar controle externo na minha conta </p>,firefox;privacy-and-security_1;,firefox,privacy-and-security,pt-BR,"",pastorandersondossantos1980
1507311,2025-04-21 09:12:52 -0700,2025-04-21 09:12:52 -0700,Firefox deloga minha conta toda vez que fecho o navegador,"<p>Gostaria de relatar um problema persistente no Firefox: toda vez que fecho o navegador, minha conta é desconectada automaticamente. Como resultado, preciso fazer login novamente sempre que reinicio o navegador, o que é bastante inconveniente. </p>",firefox;accounts;,firefox,accounts,pt-BR,"",matheuswach
1507310,2025-04-21 09:09:09 -0700,2025-04-21 09:09:09 -0700,Why are Firefox tabs automatically moving from far left to far right?,<p>I usually keep between 15-20-30 tabs open at a time and like to keep about 5-7 at the far left. Just lately Firefox has started automatically on its own shifting my tabs that were far left all the way to the end on the far right. It is always just one at a time and then sometime later another and another. </p><p>How do I fix this? </p>,firefox;performance-and-connectivity;,firefox,performance-and-connectivity,en-US,"",troyammons3
1507309,2025-04-21 09:06:13 -0700,2025-04-21 09:06:13 -0700,xslt Firefox  137.0.2,"<p>Hello, </p><p>Since the new version of Firefox desktop 137.0.2 my xslt is no longer interpreted correctly. I use the xpath-function document to load external xml documents in my stylesheet. But no document is since the new version loaded. Also with links to intern pdf-documents I receive the error ""file not found"". </p><p>I saw that in the new version there was changes in xslt. Is my problem a bug or may be exists there a workaround (in changing settings)? </p><p>Thanks a lot for your answer. Regards, Tomateus </p>",firefox;accessibility;,firefox,accessibility,en-US,"",tomateus
1507308,2025-04-21 08:42:08 -0700,2025-04-21 08:42:08 -0700,come ripristinare l'audio?,<p>come ripristinare l'audio? </p>,firefox;performance-and-connectivity;,firefox,performance-and-connectivity,it,"",brunamahne6
1507307,2025-04-21 08:35:17 -0700,2025-04-21 08:35:17 -0700,fedback,"<p><a href=""http://example.com"" rel=""nofollow"">link text</a> </p>",firefox;privacy-and-security_1;,firefox,privacy-and-security,en-US,"",mtsafsar2411
1507304,2025-04-21 08:31:34 -0700,2025-04-21 08:57:35 -0700,email turned off,<p>my email does not work. I can not see anything that is sent </p>,firefox;passwords-and-sign-in;,firefox,passwords-and-sign-in,en-US,1727187;1727197;,singletree300
1507301,2025-04-21 08:27:09 -0700,2025-04-21 09:09:05 -0700,email turned off,<p>my email account does not work. I can not receive email. when the code is sent I can not see it. the code needs to be sent to my cell phone. </p>,firefox;passwords-and-sign-in;,firefox,passwords-and-sign-in,en-US,1727183;1727195;1727201;,singletree300
1507299,2025-04-21 08:21:49 -0700,2025-04-21 11:38:55 -0700,Error codes between AT&T and Firefox,"<p>Trying to connect to yahoo mail (<a href=""http://currently.com"" rel=""nofollow"">currently.com</a>) and keep getting error messages. All other websites on firefox work. </p>",firefox;performance-and-connectivity;,firefox,performance-and-connectivity,en-US,1727202;1727203;1727214;1727215;1727225;,kareneanthony
1507296,2025-04-21 08:08:08 -0700,2025-04-21 12:36:06 -0700,Firefox not connecting to internet,"<p>Yesterday, the Firefox quit working.  Today my connection was verified by Fios and during the phone call, we tried Google Chrome (Yuck!) and it worked on the internet.  I have downloaded the latest Firefox and it still does not work.  Is there a problem with Firefox?  Should I delete Firefox and reinstall? </p>",firefox;performance-and-connectivity;,firefox,performance-and-connectivity,en-US,1727244;,rhaliski
1507295,2025-04-21 07:57:04 -0700,2025-04-21 08:15:31 -0700,Can I add another IA on my firefox? Like Deepseek?,"<p>About this link: <a href=""https://support.mozilla.org/en-US/kb/ai-chatbot?utm_source=activity-stream"" rel=""nofollow"">https://support.mozilla.org/en-US/kb/ai-chatbot?utm_source=activity-stream</a> </p><p>I think is so nice this idea to put the IA assistance for research and study for college and programming for me. A have a question if is possible add another IA like: Copilot (Microsoft) or Deepseek. </p>",firefox;search-tag-and-share;,firefox,search-tag-and-share,en-US,1727172;,rafaelmartinsja
1507293,2025-04-21 07:55:34 -0700,2025-04-21 07:55:34 -0700,recent crashes and hangups logging into certain accounts,"<p>i've recently had problems with not being able to login to certain accounts (others are fine) resulting in hanging.  other times i might be writing a message (or other) and the browser crashes.  can you help me, please? </p>",firefox;browse;,firefox,browse,en-US,"",brigitte.j.stephenson
1507289,2025-04-21 07:33:32 -0700,2025-04-21 07:33:32 -0700,SEMMAKARA6666@GMAIL.COM,"<p><a href=""https://faq.whatsapp.com/673193694148537/?helpref=uf_share"" rel=""nofollow"">https://faq.whatsapp.com/673193694148537/?helpref=uf_share</a> </p>",firefox;backup-recovery-and-sync;,firefox,backup-recovery-and-sync,en-US,"",semmakara6666
1507288,2025-04-21 07:07:56 -0700,2025-04-21 08:17:45 -0700,Audio volume sliders,"<p>I am 82 years old and have Essential Tremor. I am on medications but my hands still shake enough to give me problems with your audio volume sliders. </p><p>Is there a way to make the audio volume sliders wider? </p><p>If not, there should be.  </p><p>Thank you. </p>",firefox;accessibility;,firefox,accessibility,en-US,1727173;,j.majka
1507287,2025-04-21 06:57:05 -0700,2025-04-21 08:18:51 -0700,"The subject is ""Effective Communication"" or ""Troubleshooting,"" specifically highlighting the importance of being descriptive when reporting issues or problems, such as with video playback on YouTube.","<p>The subject is ""Effective Communication"" or ""Troubleshooting,"" specifically highlighting the importance of being descriptive when reporting issues or problems, such as with video playback on YouTube. </p>",firefox;search-tag-and-share;,firefox,search-tag-and-share,en-US,1727174;,babirye1717
1507286,2025-04-21 06:55:38 -0700,2025-04-21 06:55:38 -0700,"The subject is ""Effective Communication"" or ""Troubleshooting,"" specifically highlighting the importance of being descriptive when reporting issues or problems, such as with video playback on YouTube.","<p>The subject is ""Effective Communication"" or ""Troubleshooting,"" specifically highlighting the importance of being descriptive when reporting issues or problems, such as with video playback on YouTube. </p>",firefox;backup-recovery-and-sync;,firefox,backup-recovery-and-sync,en-US,"",babirye1717
1507285,2025-04-21 06:53:58 -0700,2025-04-21 06:53:58 -0700,English (United States),<p><strong> </strong> </p><pre>   Help    Privacy    Terms<strong></strong> </pre>,firefox;accounts;,firefox,accounts,en-US,"",gackerbha0
1507283,2025-04-21 06:50:45 -0700,2025-04-21 06:51:17 -0700,Firefox wont open,"<p>So anytime about a month ago, everytime I boot up my PC then first thing I do is double click on Firefox to open it and that worked fine  until a month ago, now when I do it youll see the circle spin for 1 second and spot but Firefox doent open, no matter how many times I click on it, the only way Ive gotten it to work is that I have to restart my pc and try again until it eventually DOES open when I click on it, I usually have to restart 3-5 times before itll open. </p><p>Im wondering why that is and how to fix it? I havent done anything new to my PC since then, no new Firefox addons, also if there was a problem with Firefox itself then restarting should never make it open yet it eventually works after a few restarts. soooo i cant be Firefox right? Ive also tried refreshing firefox as well as going to add and remove programs and uninstalled it then reinstalled it the issue still remains, any way to fix this? </p>",firefox-13702;firefox-1370;firefox;performance-and-connectivity;,firefox,performance-and-connectivity,en-US,"",duomaxwell007
1507282,2025-04-21 06:15:11 -0700,2025-04-21 08:19:36 -0700,Britannica aappears after every search,"<p>Every time I carry out a search (on Google or on DuckDuckGo), after I have my Google or DDG results I find a tab has been created with Britannica offering a result for the search. I never installed Britannica and I don't want it to appear - I want to remove Britannica from my system altogether. But I don't have a Britannica app in my Settings list of apps and I never intstalled it. It's like a virus. Can anybody help me to get rid of it? </p>",firefox;settings;,firefox,settings,en-US,1727175;,chris310
1507281,2025-04-21 05:57:59 -0700,2025-04-21 10:18:36 -0700,culture,"<p>ditch dei.  </p><p>employee performance is number one. implement a solid performance incentive program with annual reviews with plus one review. all performance objectives are focused/directive on a 1-3 year corporate growth strategy. </p><p>social, inclusion and environmental speak is emotional. Courteous and Respectful behavior is not emotional and is essential in a performance culture. </p><p>you have made a decent start, but you can be quickly replaced. </p><p>eric </p>",firefox;accessibility;,firefox,accessibility,en-US,1727167;1727210;,deasaa
1507280,2025-04-21 05:33:59 -0700,2025-04-21 09:52:05 -0700,JPG PIC.zip,<p>downloaded  as soon as posible </p>,firefox;download-and-save;,firefox,download-and-save,en-US,1727208;,mdabirhasanmondal
1507279,2025-04-21 05:17:34 -0700,2025-04-21 05:17:34 -0700,m s world,<p>ms world is shown </p>,firefox;accounts;,firefox,accounts,en-US,"",sandeepdeshpande555
1507277,2025-04-21 04:55:07 -0700,2025-04-21 04:56:16 -0700,vreee,<p>Tanks </p>,firefox;browse;,firefox,browse,en-US,1727151;1727152;,mahmood.1377.haddadi
1507273,2025-04-21 04:17:19 -0700,2025-04-21 08:43:30 -0700,I do not have a cell phone to sighn in,<p>I do not have a cell phone to sign in. </p>,firefox;accessibility;,firefox,accessibility,en-US,1727188;,margcurtis2006
1507272,2025-04-21 04:12:01 -0700,2025-04-21 04:12:01 -0700,insequre conecction problem,<p>connect the sequre conection </p>,firefox;backup-recovery-and-sync;,firefox,backup-recovery-and-sync,en-US,"",syedtufailahmedsyl89
1507271,2025-04-21 03:49:39 -0700,2025-04-21 03:49:39 -0700,download,<p>nicest </p>,firefox;performance-and-connectivity;,firefox,performance-and-connectivity,en-US,"",fidelisdripper
1507270,2025-04-21 03:48:23 -0700,2025-04-21 03:48:23 -0700,nice services,<p>speed should be advanced </p>,firefox;download-and-save;,firefox,download-and-save,en-US,"",fidelisdripper
1507269,2025-04-21 03:20:08 -0700,2025-04-21 03:20:08 -0700,saber tem outra conta perdida,<p>Como saber se tenho outra conta. </p>,firefox;settings;,firefox,settings,pt-BR,"",enildesfilho
1507268,2025-04-21 03:18:57 -0700,2025-04-21 03:18:57 -0700,free fire,<p>mdsohanok900@gmail.com </p>,firefox;download-and-save;,firefox,download-and-save,en-US,"",mysohan7080
1507267,2025-04-21 03:17:46 -0700,2025-04-21 11:04:17 -0700,Videos on news sites don't play,"<p>For some months now when I click on a video that is on a news website, such as The Guardian or The BBC for example, the video screen goes black and nothing happens. Any suggestions?  </p><pre>Firefox 137.0.2 (64-bit) </pre>",windows-11;firefox;performance-and-connectivity;,firefox,performance-and-connectivity,en-US,1727177;1727178;1727221;,kittysback
1507263,2025-04-21 02:57:23 -0700,2025-04-21 02:57:23 -0700,Add ons,"<p>My television won’t allow me to play a movie from a data base, due to add blockers etc Would add ons on Firefox be contributing to this problem? </p>",firefox;performance-and-connectivity;,firefox,performance-and-connectivity,en-US,"",overtonlemons
1507262,2025-04-21 02:54:05 -0700,2025-04-21 02:54:05 -0700,Dashboard Display Issue in Firefox,"<p>Hi, </p><p>The dashboard on my landing page isn’t displaying correctly. Here's the link to a sample dashboard for reference: <a href=""https://kohnur.com/jessicanguyen"" rel=""nofollow"">https://kohnur.com/jessicanguyen</a>. </p><p>When you open the page in some browsers (like Google Chrome), everything appears correctly and completely. However, in Firefox, the dashboard doesn't the whole dashboard. I’ve attached a couple of screenshots to show the difference in how it's rendering. </p><p>Could you please help me understand what might be causing this and how to fix it? </p><p>Appreciate your help! </p><p>Best, Andy </p>",firefox;browse;,firefox,browse,en-US,"",Care7
1507261,2025-04-21 02:52:56 -0700,2025-04-21 08:24:38 -0700,Deleting add ons,<p>Will add one interfere with my web browsing on my television? </p>,firefox;privacy-and-security_1;,firefox,privacy-and-security,en-US,1727179;1727180;,overtonlemons
1507260,2025-04-21 02:51:38 -0700,2025-04-21 02:52:28 -0700,Hii i am sohan kumar,<p><strong> </strong> <strong></strong> </p>,firefox;browse;,firefox,browse,en-US,1727140;,sohank33745
1507258,2025-04-21 02:20:59 -0700,2025-04-21 08:52:27 -0700,odinstalace Mozilla,<p>nemůžu úplně odinstalovat Mozillu pomocí iobit uninstaller pro </p>,firefox;installation-and-updates;,firefox,installation-and-updates,cs,1727194;,josef.chmel
1507253,2025-04-21 02:00:20 -0700,2025-04-21 02:02:29 -0700,scrollen,<p>Sinds de laatste update is rustig scrollen om te zoomen niet meer mogelijk. Op routeplanners zoals Kurviger en RouteYou is alleen van 0 tot 100 %.  </p><p>Groet Rob </p>,firefox;installation-and-updates;,firefox,installation-and-updates,nl,"",r.a.oosthof
1507252,2025-04-21 01:57:25 -0700,2025-04-21 08:59:06 -0700,gooad,<p><strong>gooad</strong> </p>,firefox;settings;needsinfo;,firefox,settings,en-US,1727135;,nayemmiah189
1507251,2025-04-21 01:49:01 -0700,2025-04-21 01:49:01 -0700,software for pc,<p>Himalaya </p>,firefox;download-and-save;,firefox,download-and-save,en-US,"",himalayagamawa
1507250,2025-04-21 01:41:22 -0700,2025-04-21 01:41:22 -0700,Bookmarks,<p>Firefox downloaded an update this morning and has now wiped all my bookmarks - hjow do I get them back.........😡 </p>,firefox;accounts;,firefox,accounts,en-US,"",roger.js.langford
