id,created,updated,title,content,tags,product,topic,locale,answers,creator
1487313,2025-01-20 06:21:47 -0800,2025-01-20 06:22:09 -0800,research methodology,<p>Thesise proposal on Evaluation of semen  handling mechanism in holeta ethiopia pdf 2021 CHAT GPT </p>,firefox;backup-recovery-and-sync;,firefox,backup-recovery-and-sync,en-US,1705116;1705117;,melesemamo207
1487312,2025-01-20 06:20:40 -0800,2025-01-20 06:20:40 -0800,Thesise proposal on Evaluation of semen  handling mechanism in holeta ethiopia pdf 2021 CHAT GPT,<p>assignment </p>,firefox;performance-and-connectivity;,firefox,performance-and-connectivity,en-US,"",melesemamo207
1487311,2025-01-20 06:10:17 -0800,2025-01-20 06:10:17 -0800,"""Your browser is being managed by your organisation."" Unable to fix","<p>I am getting the following message in settings of Firefox: ""Your browser is being managed by your organisation."" </p><p>These are the problematic extions: {""{02274e0c-d135-45f0-8a9c-32b35110e10d}"":{""install_url"":""<a href=""https://addons.mozilla.org/firefox/downloads/latest/pkcs11-module-loader/latest.xpi"" rel=""nofollow"">https://addons.mozilla.org/firefox/downloads/latest/pkcs11-module-loader/latest.xpi</a>"",""installation_mode"":""normal_installed""},""{443830f0-1fff-4f9a-aa1e-444bafbc7319}"":{""installation_mode"":""normal_installed"",""install_url"":""<a href=""https://addons.mozilla.org/firefox/downloads/latest/token-signing2/latest.xpi"" rel=""nofollow"">https://addons.mozilla.org/firefox/downloads/latest/token-signing2/latest.xpi</a>""}} </p><p>I have followed the below steps and thus removed the add-on but yet I am not able to get message ""Your browser is being managed by your organisation."" </p><p>Is there a fix to the issue? </p><p><em>Uninstall manually </em> </p><p>If you can't remove an extension from Firefox using the other methods described above, you can manually remove it. First navigate to the folder where extensions are installed: </p><pre>   Open your profile folder:        From the Help menu, select More Troubleshooting Information. The Troubleshooting Information tab will open.        Under the Application Basics section next to Profile Folder, click Show in Finder. A window will open that contains your profile folder.     Note: If you are unable to open or use Firefox, follow the instructions in Finding your profile without opening Firefox. </pre> <pre>   Open the extensions folder inside your profile folder. Inside the extensions folder there are folders or XPI files for each extension and theme that you have installed.    To determine which folder or XPI file corresponds to the extension you want to uninstall, return to Firefox and the Troubleshooting Information tab.    In the Extensions section, find the extension you want to remove and note the string in the ID column.    Click the Firefox menu at the top of the screen and select Quit Firefox.    Delete the folder or XPI file that corresponds to the extension ID you noted above.<em></em> </pre>",firefox;settings;,firefox,settings,en-US,"",eduardroski
1487310,2025-01-20 06:06:54 -0800,2025-01-20 06:09:05 -0800,03558202971,<p>03558202971 chat hestoris call hestoris </p>,firefox;accounts;,firefox,accounts,en-US,1705114;1705115;,harisdilkash4
1487309,2025-01-20 06:06:41 -0800,2025-01-20 06:06:41 -0800,extensies,"<p>Het downloaden van youtube videoos d.m.v. firefox extensies zoals bijv Ytdownloader luikt niet meer . De zaken lijken veranderd te zijn want ook andere extensies met hetzelfde doel werken niet meer. Andere methodes bijv de VLC media player werken ook niet zondermeer. ER zijn vast meerdere manieren. Kun je me helpen ajb? Groeten , Arend v H </p>",firefox;performance-and-connectivity;,firefox,performance-and-connectivity,nl,"",arend69
1487308,2025-01-20 06:04:34 -0800,2025-01-20 06:04:34 -0800,White screen in firefox,"<p>Several websites show nothing but a white screen.  I have tried everything suggested in other posts about this issue (Clearing history &amp; cookies. Starting in safe mode. Disabling addons, themes, and extentions. Disabling hardware acceleration. Updating video card drivers. Checking the url bars ""tracker"" icon. Uninstalling and reinstalling Firefox.) and still I get a white screen when visiting certain sites.  I really don't want to switch to another browser but I'm at a complete loss and have no idea why I have this issue. </p>",firefox;performance-and-connectivity;,firefox,performance-and-connectivity,en-US,"",its_burton
1487307,2025-01-20 05:56:06 -0800,2025-01-20 05:56:06 -0800,cannot sign into mozilla firefox - no email security code,<p>This is new mint 22.1 installation. I have firefox running properly on another machine running mint 21. This machine was working correctly with firefox logging in when it was mint21 (firefox synchronised  settings on both machines ) </p><p>I am unable to sign in to mozilla firefox with the top right hamburger menu. When I enter my email address and password it tells me to enter the six digit security code sent to my email but those emails never arrive. </p><p>I am not using two factor authentication or pass keys or mobile phone numbers ( I dont understand any of those ). </p>,firefox;passwords-and-sign-in;,firefox,passwords-and-sign-in,en-US,"",harrisonmph
1487305,2025-01-20 05:26:25 -0800,2025-01-20 05:26:25 -0800,not connected,<p>fdhfdhfhfh </p>,firefox;browse;,firefox,browse,en-US,"",Edobabaei
1487304,2025-01-20 05:20:03 -0800,2025-01-20 05:20:03 -0800,it's nice,<p><strong>bold text</strong> </p>,firefox;browse;,firefox,browse,en-US,"",jayganz.god17
1487303,2025-01-20 05:17:55 -0800,2025-01-20 05:17:55 -0800,Firefox not working,<p>Firefox quit 1/15/2025 </p>,firefox;installation-and-updates;,firefox,installation-and-updates,en-US,"",kearneyracing78
1487301,2025-01-20 05:07:11 -0800,2025-01-20 05:07:11 -0800,not connected,<p>i can not connecting  to website </p>,firefox;browse;,firefox,browse,en-US,"",Edobabaei
1487299,2025-01-20 04:53:01 -0800,2025-01-20 04:53:01 -0800,have i a new email address that i have applied for,<p>do i have a new email address </p>,firefox;passwords-and-sign-in;,firefox,passwords-and-sign-in,en-US,"",bondd5388
1487296,2025-01-20 04:35:47 -0800,2025-01-20 04:35:47 -0800,Firefox offline translation,"<p>I am using Firefox 128.5.0esr (64-bit) on Debian 12. This is the browser that comes installed with the system. Recently, an offline translation feature was added to Firefox. In settings, you can download various languages. I would like to know where language models for offline translation are stored. The downloaded languages I want to copy to another computer without internet connection so that I can use the offline translation on this computer. </p>",firefox;backup-recovery-and-sync;,firefox,backup-recovery-and-sync,en-US,"",tom.a.goetz
1487295,2025-01-20 04:30:40 -0800,2025-01-20 04:30:40 -0800,Blocked Account,"<p>I cannot sync my accaunt, My sign in was “blocked for security reasons” on Mozilla account. Please send me a Verification E-mail to jazzband9823@aol.com to confirm my identity? Thanks in advance </p>",firefox;accounts;,firefox,accounts,en-US,"",specialvehiclesgk
1487291,2025-01-20 04:17:40 -0800,2025-01-20 04:17:40 -0800,sincronizza su nuovo PC.,<p>Sul telefono non appare sincronizza e salva dati . </p>,firefox;backup-recovery-and-sync;,firefox,backup-recovery-and-sync,it,"",miscorati
1487290,2025-01-20 04:14:11 -0800,2025-01-20 04:14:11 -0800,Websites randomly load in the wrong font.,"<p>See attached screenshot. It just randomly happens from time to time, and I can't figure out what's causing it. I've used both Chrome and Firefox with the same results. Help! </p>",firefox-13401;firefox-1340;firefox;performance-and-connectivity;,firefox,performance-and-connectivity,en-US,"",kevdanielmartin
1487289,2025-01-20 04:10:48 -0800,2025-01-20 04:10:48 -0800,New Tab not showing Recent Activity anymore.,"<p>I have Firefox's New Tab set as my home page, since I'm choosing to divorce myself from political doomscrolling for the next four years. The New Tab page is perfect for having frequently visited sites at the top, Pocket stories I can curate in the middle, and what used to be a history of articles and sites I've read most recently in ""Recent Activity"" along the bottom.  Within the last few days, ""Recent Activity"" has been blank, and will no longer keep track of articles I've recently read. I've tried clearing the browser history and cookies, and it came back for a moment, but quickly went back to being blank. And the major downside to clearing the browser is that my four rows of most frequently visited sites gets wiped clean also, and I have to spend time getting them back on the list. I do not have Firefox set to automatically clear history upon closing it. I've tried turning ""Recent Activity"" off and on with the page's Settings (cog in the bottom right corner).  I'd really like to have this back, as it can help me find recently read content (especially Pocket content) easier than wading through the History log. Any help would be appreciated. </p>",firefox;browse;,firefox,browse,en-US,"",icemandave
1487288,2025-01-20 04:04:51 -0800,2025-01-20 04:04:51 -0800,forgot my password and lost account recovery key,"<p>Please help reset password and find new recovery key, </p>",firefox;passwords-and-sign-in;,firefox,passwords-and-sign-in,en-US,"",drvstripathi55
1487284,2025-01-20 04:02:15 -0800,2025-01-20 04:02:15 -0800,forgot my password and lost account recovery key,<p>Help to  reset password and find new recovery key. </p>,firefox;passwords-and-sign-in;,firefox,passwords-and-sign-in,en-US,"",drvstripathi55
1487283,2025-01-20 04:01:58 -0800,2025-01-20 04:15:01 -0800,Google sign in pages crashes,"<p>I had Firefox installed and working perfectly fine , but I had to factory rest my MSI laptop (windows 11 home) because I had suspect suspicious files I needed to get rid of, after the new install of Firefox each time I try to sign into a google account I would be able to type 2/3 letters and then Firefox crashes and closes down , I had uninstall and downloaded a fresh install from the microsoft store </p>",firefox-13401;firefox-1340;firefox;performance-and-connectivity;,firefox,performance-and-connectivity,en-US,1705097;,andrewb2247
1487280,2025-01-20 03:53:21 -0800,2025-01-20 03:53:21 -0800,Apple account & Password,<p>I have opened a Firefox Account with a password. My Apple credentials are not syncing with my Firefox account. I created my password today for that reason I don't need to reset another password based on principle and keeping things simple. However I do have a Gmail account with Mozilla therefore I may be able to edit my accounts that way. I will also need to update and sync my Apple keychain passwords with my Firefox account. Thank You </p>,firefox;accounts;,firefox,accounts,en-US,"",4nqh9dc7xf
1487278,2025-01-20 03:52:50 -0800,2025-01-20 03:52:50 -0800,forgot my password and lost account recovery key,<p>Please help me to reset password  and find new recovery key. </p>,firefox;passwords-and-sign-in;,firefox,passwords-and-sign-in,en-US,"",drvstripathi55
1487276,2025-01-20 03:34:14 -0800,2025-01-20 03:54:52 -0800,Problema gestione cifre per completaamento automatico,"<p>Buongiorno, ho notato da un po' di tempo (facendo prove anche su pc diversi), che ho alcuni problemi nell'effettuazione dei bonifici dell'homebanking (sono cliente credit agricole, non so se serva ai fini della risoluzione del problema. Nello specifico, quando vado a inserire l'importo che devo trasferire (per esempio 2000,00€), se è una cifra tonda che finisce per zero, l'importo viene automaticamente modificato, diventanto 2,00€. Non c'è modo poi di inserire la cifra corretta. Sembra che il sistema non gestica correttamente gli zeri, eliminandoli. Ovviamente le cifre sono disponibili sul conto corrente e provando con browser differenti, funziona correttamente (quindi non è un problema del servizio di home banking). C'è qualche impostazione da cambiare nel browser? Buona giornata Pierfrancesco Giunti </p>",firefox-13401;firefox-1340;firefox;performance-and-connectivity;needsinfo;,firefox,performance-and-connectivity,it,1705089;,pierfra.giunti
1487274,2025-01-20 03:01:35 -0800,2025-01-20 03:01:35 -0800,Overlapping text on some web pages | Firefox 134.0.1 (64-bit),"<p>Hi, I’m experiencing an issue with Firefox (v134.0.1) on Ubuntu 22.05. On certain websites, the text overlaps and becomes unreadable. For example, this happens on <a href=""https://globalwordnet.github.io/schemas/"" rel=""nofollow"">https://globalwordnet.github.io/schemas/</a> but not on others. </p><p>I’ve tried the following: </p> <ul><li> Resetting zoom (Ctrl+0). </li><li> Disabling all extensions. </li><li> Clearing cache and cookies. </li><li> Testing in Chrome, where the issue doesn't occur. </li></ul> <p>I also tried all the suggestion in this old discussion (<a href=""https://support.mozilla.org/en-US/questions/1392547"" rel=""nofollow"">https://support.mozilla.org/en-US/questions/1392547</a>), but I couldn't solve the problem. </p><p>Does anyone know what might be causing this or how to fix it? Thanks in advance! </p>",firefox;accessibility;,firefox,accessibility,en-US,"",lucabrigadavilla
1487273,2025-01-20 02:52:11 -0800,2025-01-20 03:19:43 -0800,how do I return to prequantum bookmarks,<p>How do I return to prequantum bookmarks </p>,firefox;settings;,firefox,settings,en-US,1705084;1705086;,hapibeli
1487271,2025-01-20 02:41:50 -0800,2025-01-20 02:45:51 -0800,......,<p>......... </p>,firefox;settings;,firefox,settings,en-US,"",eduardroski
1487268,2025-01-20 02:18:44 -0800,2025-01-20 02:18:44 -0800,www.mor.gov.et,"<p><strong><a href=""http://mor.gov.et"" rel=""nofollow"">mor.gov.et</a></strong> misconfigurd </p>",firefox;backup-recovery-and-sync;,firefox,backup-recovery-and-sync,en-US,"",sharechora
1487264,2025-01-20 02:02:29 -0800,2025-01-20 02:02:29 -0800,Cambiar color del texto al redactar,"<p>Buenos días, </p><p>En la aplicación de correo thunderbird para dispositivo mv va bien pero sería importante poder cambiar el color y forma del texto. </p><p>Gracias. </p>",firefox;settings;,firefox,settings,es,"",victor.roman1985
1487259,2025-01-20 01:40:42 -0800,2025-01-20 01:40:42 -0800,Firefox,"<p>Hello, I have a mac os high sierra version 10.13.6. Google meet has stopped working since yesterday.  I updated firefox (115.19.0esr). That doesn't work either.  Do you have any advice for me? I hope!  Thank you so much!  Marie Dupuis </p>",firefox;accessibility;,firefox,accessibility,en-US,"",maieutiques
1487257,2025-01-20 01:37:10 -0800,2025-01-20 02:27:33 -0800,Ho un problema su cellulare,<p>Voglio istallare il mio account e password su questo cellulare. </p>,firefox;accounts;,firefox,accounts,it,1705078;,aldobaldoni77
1487255,2025-01-20 01:29:38 -0800,2025-01-20 01:29:38 -0800,unable to use this mozillar browser,"<p>An error occurred during a connection to <a href=""http://www.mozilla.org"" rel=""nofollow"">www.mozilla.org</a>. The OCSP response is not yet valid (contains a date in the future). </p>",firefox;browse;,firefox,browse,en-US,"",samlink100
1487253,2025-01-20 01:25:33 -0800,2025-01-20 01:25:33 -0800,https://prdcfms.apcfss.in:44300/sap/bc/ui5_ui5/sap/zexp_billstatus/index.html?sap-client=%27%27,"<p><a href=""https://prdcfms.apcfss.in:44300/sap/bc/ui5_ui5/sap/zexp_billstatus/index.html?sap-client=%27%27"" rel=""nofollow"">https://prdcfms.apcfss.in:44300/sap/bc/ui5_ui5/sap/zexp_billstatus/index.html?sap-client=%27%27</a> this site was not opened </p>",firefox;browse;,firefox,browse,en-US,"",mppsnkphc
1487252,2025-01-20 01:20:58 -0800,2025-01-20 01:20:58 -0800,How to Automatically Trigger PDF Printing in Firefox?,"<p>In previous versions of Firefox (up to version 133), it was possible to automatically trigger printing of a PDF file by loading it into an iframe from a sandboxed iframe and call print. However, starting with version 134, this no longer works. </p><p>Is there any other way to automatically trigger the print dialog for a PDF file in Firefox, similar to how it can be done in Chrome/Edge (e.g., by opening the PDF in a new window and <strong>directly triggering the print dialog without additional button clicks</strong>)? </p>",firefox;privacy-and-security_1;,firefox,privacy-and-security,en-US,"",yuliiashurekop
1487250,2025-01-20 01:03:07 -0800,2025-01-20 01:03:07 -0800,digital certificate,"<p>After updating Mozilla, I can not use my digital certificate. </p>",firefox;accessibility;,firefox,accessibility,es,"",luiseta_alarcon
1487248,2025-01-20 00:44:12 -0800,2025-01-20 00:44:12 -0800,is it possible to delete everything but speed dials,"<p>Hi, With ctrl+maj+del, you are able to delete everything cache cookies and such.. but is it possible to delete everything but speed dials or at least pinned speed dials&nbsp;? </p><p>Thanks </p>",firefox;settings;,firefox,settings,en-US,"",lalasand
1487247,2025-01-20 00:43:49 -0800,2025-01-20 00:43:49 -0800,Cannot log into my Quickbooks account.,"<p>Since Friday i cannot log into my Quickbooks account using Firefox.  All other browers work fine when trying to log in.  My default browser is Firefox.  SO this is totally frustrating. </p><p>The error message i receive is:XML Parsing Error: no root element found Location: <a href=""https://accounts.intuit.com/app/sign-in?app_group=QBO&amp;asset_alias=Intuit.accounting.core.qbowebapp&amp;iux_tests=49561:8:119104&amp;state="" rel=""nofollow"">https://accounts.intuit.com/app/sign-in?app_group=QBO&amp;asset_alias=Intuit.accounting.core.qbowebapp&amp;iux_tests=49561:8:119104&amp;state=</a>{%22queryParams%22:{%22locale%22:%22en-us%22}}&amp;app_environment=prod&amp;locale=en-us Line Number 1, Column 1: </p>",firefox;passwords-and-sign-in;,firefox,passwords-and-sign-in,en-US,"",eugenefaber
1487241,2025-01-20 00:15:24 -0800,2025-01-20 03:17:20 -0800,not open,"<p>Secure Connection Failed </p><p>An error occurred during a connection to <a href=""http://myiphide.com"" rel=""nofollow"">myiphide.com</a>. PR_CONNECT_RESET_ERROR </p><p>Error code: PR_CONNECT_RESET_ERROR </p><pre>   The page you are trying to view cannot be shown because the authenticity of the received data could not be verified.    Please contact the website owners to inform them of this problem </pre>",firefox;browse;needsinfo;,firefox,browse,en-US,1705050;1705085;,tabilkhan546
1487237,2025-01-19 23:57:43 -0800,2025-01-19 23:57:43 -0800,I can't download gmail attachments.,<p>Suddenly all the gmail attachments stopped to download. I can see (and scroll) the e.g. pdf in a viewing mode but I can`t download it. I turned on the troublshooting mode but the problem persisted. I can download the same attachment in Chrome. </p>,firefox;accessibility;,firefox,accessibility,en-US,"",kublanov.ilya
1487236,2025-01-19 23:49:47 -0800,2025-01-20 05:49:16 -0800,PR_CONNECT_RESET_ERROR on certain websites (this error is not present in Troubleshoot Mode or other browsers),"<p>I am trying to access certain HTTPS websites and some of them show PR_CONNECT_RESET_ERROR in Firefox. This error is not present in Edge or Chromium. </p><p>Here's what I've tried (none of these works): </p> <ul><li> DNS over HTTPS turned off </li><li> Uninstall all add-ons </li><li> Reinstall Firefox </li><li> Create new profile and set it as default </li><li> Delete/rename certs.db in the Firefox profiles folder. </li></ul> <p>The only fix that works is to use Troubleshoot Mode every time I visit these websites which is not practical. Any ideas on what could be the problem? </p><p>I don't know if this is relevant but one of the websites that does not work is <a href=""https://alexan.com.ph/"" rel=""nofollow"">https://alexan.com.ph/</a> </p>",firefox-13401;firefox-1340;firefox;performance-and-connectivity;,firefox,performance-and-connectivity,en-US,1705070;,xqzgh297
1487235,2025-01-19 23:17:45 -0800,2025-01-19 23:17:45 -0800,g mail,<p>My Gmail indicates I have messages but I can't get them why? </p>,firefox;accounts;,firefox,accounts,en-US,"",cynthiaskeens70
1487234,2025-01-19 23:17:33 -0800,2025-01-19 23:17:33 -0800,i want to use application on desk top,<p>allow me to use application governed by you </p>,firefox;accessibility;,firefox,accessibility,en-US,"",efagonfa25
1487233,2025-01-19 23:00:30 -0800,2025-01-19 23:00:30 -0800,Crashes,<p>My firefox browser crashes every time whenever I tried to add second gmail account. </p>,windows-11;firefox;performance-and-connectivity;,firefox,performance-and-connectivity,en-US,"",21stifler
1487232,2025-01-19 22:44:31 -0800,2025-01-19 22:44:31 -0800,web site,<p>i cant assess the special  kerala govt. states </p>,firefox;accessibility;,firefox,accessibility,en-US,"",babykkunchan469
1487229,2025-01-19 22:23:28 -0800,2025-01-19 22:23:28 -0800,"Microphone is not available, audio is working",<p>“No audio device found” I’m getting this for microphone but Speaker is working fine </p><p>Could anyone help me on this </p>,firefox;settings;,firefox,settings,en-US,"",reddyashish47
1487228,2025-01-19 22:22:50 -0800,2025-01-20 00:27:48 -0800,Games,<p><em>kurzíva</em> </p>,firefox;installation-and-updates;,firefox,installation-and-updates,cs,1705056;,patrikcerny186
1487227,2025-01-19 21:53:03 -0800,2025-01-19 21:53:03 -0800,me jakearon,<p>Recovery Gmail </p>,firefox;accounts;,firefox,accounts,es,"",doserleon578
1487226,2025-01-19 21:50:41 -0800,2025-01-19 21:50:41 -0800,I keep pressing the wrong buttons and now nothing works,<p>See subject.  I do not understand computer language and am stuck.  o I was working on a newsletter for a group.  Now I cannot complete it. </p><p>I do not know how to connect to server I do not know how to connect to network  I do not know how to check with Firefox for permission  </p><p>I also cannot find the telephone numbers for my thinkpad for help. </p>,firefox;accounts;,firefox,accounts,en-US,"",thepresence98
1487217,2025-01-19 20:20:15 -0800,2025-01-19 20:46:05 -0800,problem to loading page,"<p>when i open this website, it shows like this: <a href=""https://in.tradingview.com/"" rel=""nofollow"">https://in.tradingview.com/</a> </p><p>Secure Connection Failed </p><p>An error occurred during a connection to <a href=""http://in.tradingview.com"" rel=""nofollow"">in.tradingview.com</a>. The OCSP response is not yet valid (contains a date in the future). </p><p>Error code: SEC_ERROR_OCSP_FUTURE_RESPONSE </p><pre>   The page you are trying to view cannot be shown because the authenticity of the received data could not be verified.    Please contact the website owners to inform them of this problem. </pre>",firefox;browse;,firefox,browse,en-US,1705022;,sethulaksmi93
1487215,2025-01-19 20:17:16 -0800,2025-01-19 20:17:16 -0800,Where the hell is JavaScript??,<p>JavaScript? </p>,firefox;accessibility;,firefox,accessibility,en-US,"",verydirty00
1487213,2025-01-19 19:42:42 -0800,2025-01-19 19:42:42 -0800,my old Firefox wasn't working so I uninstalled it and trying to install the latest version ?,<p><strong>bold text</strong>WILL THIS WORK&nbsp;? <strong>bold text</strong> </p>,windows-10;firefox;performance-and-connectivity;,firefox,performance-and-connectivity,en-US,"",joevariotsr
1487212,2025-01-19 19:12:15 -0800,2025-01-19 20:47:35 -0800,allow firefox to share with devices on my local networks,"<p>I got a popup from firefox saying ""allow firefox to share with devices on my local networks?""  I said yes but now realize Im not sure what i agreed to. What is this specifically?  How do i turn this off again?  Thanks </p>",firefox;privacy-and-security_1;,firefox,privacy-and-security,en-US,1705024;,mrrdiehl
1487209,2025-01-19 18:45:09 -0800,2025-01-19 20:06:12 -0800,Could there be a paid version?,"<p>The entire web seems to be creepy beyond belief! The stock in trade is my life. I don't want you people spending your time trying to dream up ways to build the cheese that leads me into your maze.  I just want to buy a product. I want that product to work for years. It should be reliable not flashy.  Why is that so hard these days? When did we become people who would accept junk that needed to constantly be repaired after purchase? Why does an upgrade do exactly the same thing it's predecessor did, but more slowly and requiring more resources?  Why can companies build something and then a few years down the road simply stop supporting it?  Here in the US car companies were required to support their products for 15 years. As expensive as phones have become and as disruptive as changing operating systems is we need similar legislation in the tech industry.  Google needs to be broken up and not be the hub of the internet. No matter where I go in the net my browser always goes to google first. That's just creepy. So please someone just offer a product that doesn't make me a product by it's use. </p>",firefox;privacy-and-security_1;,firefox,privacy-and-security,en-US,1705019;,bianaryabyss
1487208,2025-01-19 17:53:26 -0800,2025-01-19 17:53:26 -0800,oooooooo,<p>ooooooooooooooooooooooooooo </p>,firefox;settings;,firefox,settings,en-US,"",thefartofthestart
