id,created,updated,title,content,tags,product,topic,locale,answers,creator
1516790,2025-06-12 23:34:08 -0700,2025-06-12 23:34:08 -0700,why my connection is not secured,<p>plz solve the problem </p>,firefox;performance-and-connectivity;,firefox,performance-and-connectivity,en-US,"",angadpur.highschool
1516789,2025-06-12 23:33:20 -0700,2025-06-12 23:33:20 -0700,"Mozilla-tili ei avaudu, vaikka salasana on oikein. Googlen salasanalla pystyy kirjautumaan, mutta ei muuten.",<p><strong>lihavoitu teksti</strong> Katso kysymykseni. </p>,firefox;sign-in;,firefox,sign-in,fi,"",eerosippola
1516788,2025-06-12 23:19:43 -0700,2025-06-12 23:19:43 -0700,How do I access ''about:config'',<p>I have been trying to access <em>about:config</em> and it has not been working please is their anything I am during wrong for android </p>,firefox;settings;,firefox,settings,en-US,"",nashtag203
1516787,2025-06-12 23:15:35 -0700,2025-06-12 23:15:35 -0700,How to backup Gmail emails if I'm switching my personal email to Outlook?,"<p>When moving to Outlook, we typically export Gmail to PST format, as that’s directly compatible with Outlook. Use a <em>MailsDaddy Gmail Email Backup Tool</em>, it ensure to safely export all Gmail emails, including folders and attachments, to PST. Once exported, we simply open the PST file in Outlook, and everything appears exactly as it was in Gmail. Tool Link is in the Bio, Go and Checkout Today! </p> <ol><li>gmailbackup #gmailbackuptool #backupgmail #gmailemailbackuptool #gmailmailbackup #howtobackupgmailemails </li></ol>",firefox;backup-recovery-and-sync;,firefox,backup-recovery-and-sync,en-US,"",johnparkar
1516786,2025-06-12 23:08:40 -0700,2025-06-12 23:08:40 -0700,@shakib.044,"<p><a href=""https://www.tiktok.com"" rel=""nofollow"">https://www.tiktok.com</a> </p>",firefox;backup-recovery-and-sync;,firefox,backup-recovery-and-sync,en-US,"",ko1998925
1516785,2025-06-12 23:05:47 -0700,2025-06-12 23:05:47 -0700,अभी फोन पर गलती से किसी दूसरे नंबर में रिचार्ज हो जाए तो क्या करें? -,<p>अगर आप गलती से किसी दूसरे नंबर पर रिचार्ज कर देते हैं तो तुरंत अपने टेलीकॉम ऑपरेटर के कस्टमर केयर 08274087883 से संपर्क करें और उन्हें बताएं कि आपने गलती से रिचार्ज किया है और किस नंबर पर. वे आपको रिचार्ज को रिवर्स करने या रिफंड करने में मदद कर सकते हैं. </p>,firefox;accounts;,firefox,accounts,en-US,"",raazbabu01448
1516784,2025-06-12 23:04:51 -0700,2025-06-12 23:04:51 -0700,अभी फोन पर गलती से किसी दूसरे नंबर में रिचार्ज हो जाए तो क्या करें? -,<p>अगर आप गलती से किसी दूसरे नंबर पर रिचार्ज कर देते हैं तो तुरंत अपने टेलीकॉम ऑपरेटर के कस्टमर केयर 08274087883 से संपर्क करें और उन्हें बताएं कि आपने गलती से रिचार्ज किया है और किस नंबर पर. वे आपको रिचार्ज को रिवर्स करने या रिफंड करने में मदद कर सकते हैं. </p>,firefox;accounts;,firefox,accounts,en-US,"",raazbabu01448
1516783,2025-06-12 23:02:36 -0700,2025-06-12 23:02:36 -0700,"pay, phone pay या paytm से पैसा दूसरे के खाते में गलती से चला जाए तो वापस ...","<p>अगर फोनपे से गलत खाते में पैसे चले गए हैं, तो सबसे पहले आपको PhonePe की ग्राहक सेवा से संपर्क 0827 408 7883 करना चाहिए। इसके अलावा, आप अपने बैंक से भी बात कर सकते हैं। आपको गलत ट्रांजैक्शन की पूरी जानकारी देनी होगी, जैसे कि ट्रांजैक्शन आईडी, तारीख और राशि। </p>",firefox;accounts;,firefox,accounts,en-US,"",raazbabu01448
1516782,2025-06-12 23:02:10 -0700,2025-06-12 23:02:10 -0700,"pay, phone pay या paytm से पैसा दूसरे के खाते में गलती से चला जाए तो वापस ...","<p>अगर फोनपे से गलत खाते में पैसे चले गए हैं, तो सबसे पहले आपको PhonePe की ग्राहक सेवा से संपर्क 0827 408 7883 करना चाहिए। इसके अलावा, आप अपने बैंक से भी बात कर सकते हैं। आपको गलत ट्रांजैक्शन की पूरी जानकारी देनी होगी, जैसे कि ट्रांजैक्शन आईडी, तारीख और राशि। </p>",firefox;accounts;,firefox,accounts,en-US,"",raazbabu01448
1516780,2025-06-12 23:01:09 -0700,2025-06-12 23:01:09 -0700,"pay, phone pay या paytm से पैसा दूसरे के खाते में गलती से चला जाए तो वापस ...","<p>अगर फोनपे से गलत खाते में पैसे चले गए हैं, तो सबसे पहले आपको PhonePe की ग्राहक सेवा से संपर्क 0827 408 7883 करना चाहिए। इसके अलावा, आप अपने बैंक से भी बात कर सकते हैं। आपको गलत ट्रांजैक्शन की पूरी जानकारी देनी होगी, जैसे कि ट्रांजैक्शन आईडी, तारीख और राशि। </p>",firefox;accounts;,firefox,accounts,en-US,"",raazbabu01448
1516779,2025-06-12 22:51:42 -0700,2025-06-12 22:51:42 -0700,FIREFOX DOWNLOAD,<p>FIREFOX DOWNLOAD </p>,firefox;download-and-save;,firefox,download-and-save,en-US,"",kourkashmir9086
1516778,2025-06-12 22:48:41 -0700,2025-06-12 22:48:41 -0700,LA COMPUTADORA,<p>NECESITO QUE SE ACTUALICE </p> <ol><li> <em><strong>* Elemento de lista numerada</strong></em> </li></ol>,firefox;accessibility;,firefox,accessibility,es,"",priscilahernandez405
1516776,2025-06-12 22:34:15 -0700,2025-06-12 22:34:15 -0700,Facebook,<p>How do I take out the family out of my iPhone. They keep putting adds Third party off </p>,firefox;browse;,firefox,browse,en-US,"",4n2j2h5d6n
1516775,2025-06-12 22:33:01 -0700,2025-06-12 22:33:01 -0700,Connect my darling and my bank account details for email updates to the use of the most important part,<p>Connect the link below and my bank account details for the most important part in the use of this message is really good Android apps development services at all times </p>,firefox;browse;,firefox,browse,en-US,"",thamsaqafrance
1516773,2025-06-12 22:05:10 -0700,2025-06-12 22:05:10 -0700,always crases on desktop during webinars or downloading files from whats app,<p>i am very unhappy when Firefox browser crashes many time during WEBINARS AND DOWNLOADING FILES FROM MY WHATS APP WEB IT IS WORST ON WHATS APP WEB </p>,firefox;app-crash;,firefox,app-crash,en-US,"",aftabshariq12
1516772,2025-06-12 21:58:54 -0700,2025-06-12 21:58:54 -0700,working,<p>Khannna </p>,firefox;accounts;,firefox,accounts,en-US,"",kulwinder8760n
1516771,2025-06-12 21:56:33 -0700,2025-06-12 21:56:33 -0700,working,<p>Kulwinder </p>,firefox;accounts;,firefox,accounts,en-US,"",kulwinder8760n
1516768,2025-06-12 20:58:42 -0700,2025-06-12 20:58:42 -0700,zen browser support,<p>Zen browser </p><pre>   Is there a way to customize the sleep timer for each tab? Didnt see it in the settings </pre> <pre>   Is there a way to show all workspaces on the left side or a way to quickly switch from workspace to workspace? </pre> <pre>   Does it allow you to have multiple accounts open for the same website? </pre> <p>Can I have two windows opened with seperate accounts? In order to not duplicate resources and run different tabs on each window. </p>,firefox;browse;,firefox,browse,en-US,"",askmewhat
1516766,2025-06-12 20:36:22 -0700,2025-06-12 20:36:22 -0700,beparib407@gmail.com,<p>Billal Bepari+601111541254 +60178595071 beparib407@gmail.com </p>,firefox;accessibility;,firefox,accessibility,en-US,"",beparib407
1516763,2025-06-12 19:50:36 -0700,2025-06-12 20:51:19 -0700,Firfox is not supported in window 7,<p>How can operate Firefox in window 7 </p>,firefox;esr;,firefox,esr,en-US,1741469;,jitendraofficerlc
1516762,2025-06-12 19:49:28 -0700,2025-06-12 19:49:28 -0700,Drag and drop Thunderbird to Firefox,"<p>Hello, using Windows Version 22H2 (Build 19045.5965), Firefox 139.0.4, Thunderbird 139.0.2, I can drag multiple emails from Thunderbird but not drop them into Firefox (the stop symbol appears and does not let me finish the action). However, dragging and dropping single emails does work. Firefox does not understand the imap address but the drop is registered which is all that is relevant to me. Is this a bug/missing feature in Firefox or a problem with Thunderbird and Firefox on Windows? Or is there a way to do it by simply adjusting (preferrably very few) settings? Dragging and dropping multiple emails using Thunderbird and Firefox on Linux Mint works fine. Dragging and dropping multiple emails from the Windows Explorer to Firefox also works fine. In testing, the issue only arose using Thunderbird + Firefox, Chromium-based browsers also worked fine with Thunderbird. If this is the wrong forum to ask such a question because this should rather be in a bug tracker or something similar, please let me know. If this should be on the Thunderbird thread instead of Firefox, also let me know. Thank you for your help. </p>",firefox;performance-and-connectivity;,firefox,performance-and-connectivity,en-US,"",tizian.heckmann
1516760,2025-06-12 19:33:53 -0700,2025-06-12 19:33:53 -0700,"we can't get into our gmail (3 accounts ) on 1 pc , but we can use a friends pc both using a firefox /windows v-11","<p>We can't get into our gmail (3 accounts ) on 1 pc , but we can use a friends pc both using a firefox /windows v-11 </p><p>People don't respond to Gmail requests, only computers with simple answers for simple inquires, HARD THINGS ARE TOO HARD FOR THEIR MAINFRAMES. THANKS </p>",firefox;site-breakages;,firefox,site-breakages,en-US,"",jayel317
1516759,2025-06-12 19:22:55 -0700,2025-06-12 19:22:55 -0700,Cursor issues,<p>When typing the cursor resets and I'm having to keep placing the cursor on the line that I'm typing </p>,firefox;performance-and-connectivity;,firefox,performance-and-connectivity,en-US,"",ml4gold1
1516757,2025-06-12 18:15:05 -0700,2025-06-12 18:15:05 -0700,Firefox is being updated by another instance,"<p>I have only one instance of Firefox to run. </p><p>How can I correct my installation so it does not think something else is running/updating Firefox? </p><p>Thanks, </p><p><br> Craig </p>",firefox-13904;firefox-1390;firefox;update-failure;,firefox,update-failure,en-US,"",CWM50
1516755,2025-06-12 17:50:51 -0700,2025-06-12 17:50:51 -0700,job application,<p>I'm trying to apply for a job in robstown and it tells me to do this </p>,firefox;accessibility;,firefox,accessibility,en-US,"",bengonzalez308
1516754,2025-06-12 17:22:45 -0700,2025-06-12 17:22:45 -0700,stake account history delete,<p>delete the stake account casino history </p>,firefox;accounts;,firefox,accounts,en-US,"",karanpreet2k4
1516752,2025-06-12 17:14:19 -0700,2025-06-12 21:02:48 -0700,Firefox deleted user data after the update,"<p>I updated firefox, and all my addons and sign ins are gone now. Search history and tabs remained intact. It also created a folder on my desktop, but I'm not sure how do I ""extract"" my old data from it. </p>",windows-11;firefox-13904;firefox-1390;firefox;backup-recovery-and-sync;,firefox,backup-recovery-and-sync,en-US,1741472;,damirzasimenko
1516751,2025-06-12 17:02:25 -0700,2025-06-12 17:02:25 -0700,please help me make Domez@gmail.com my primary email,<p>Comfee150@gmail.com needs to be my secondary email. Please advise. Please make comfee150@gmail.com my secondary verification email for Domez@mozilla.com. </p><p>Please allow me to login to domez@gmail.com and when you send the verification send it to secondary email send it to comfee150@gmail.com. </p><p>Can you do this please? </p>,firefox;accounts;,firefox,accounts,en-US,"",comfee150
