id,created,updated,title,content,tags,product,topic,locale,answers,creator
1415843,2023-06-14 01:09:23 -0700,2023-06-14 01:49:38 -0700,"How to close existing Firefox process, to be able to connect to WEB","<p>I get message when trying to connect to the WEB via Firefox. ""Firefox is already running, but is not responding. To use Firefox, you must first close the existing Firefox process, restart your device, or use a different profile"". </p><p>How to close the running but not responding Firefox process&nbsp;? To be able to connect to the web </p>",linux;desktop;fix-problems;,firefox,fix-problems,en-US,1585392;,urban.forsberg1953
1415842,2023-06-14 00:06:19 -0700,2023-06-14 00:06:19 -0700,Unable to connect,"<p>I am no longer able to connect to my website on Firefox on my iMac running Big Sur. I can see it on Safari and on my Macbook. I have cleared the cache. My server support suggested Cloudflare could be causing an issue and I have now had that removed. After allowing time for the adjusted DNS to propagate the issue remains. </p><p>Here is the message: </p><p>Unable to connect </p><p>An error occurred during a connection to <a href=""http://amandacadabra.com"" rel=""nofollow"">amandacadabra.com</a>. </p><pre>   The site could be temporarily unavailable or too busy. Try again in a few moments.    If you are unable to load any pages, check your computer’s network connection.    If your computer or network is protected by a firewall or proxy, make sure that Firefox is permitted to access the web. </pre> <p>I am not trying to access the URL using a bookmark. I am not using any extensions. All other sites are loading as normal and at normal speeds. </p><p>Any help would be appreciated. Thank you! </p>",desktop;fix-problems;mac-os-x-1015;firefox-1140;firefox-11401;,firefox,fix-problems,en-US,"",suzanne22
1415841,2023-06-13 23:10:42 -0700,2023-06-14 00:36:39 -0700,"Website garbaged on Firefox, displays OK on Edge browser","<p>Firefox 64-bit 114.0.1 on Windows 11 with latest updates. When using Firefox, articles on The Guardian website are displaying with text overlaying images on the web page. The same problem does not happen if I view the same web page using the MS Edge browser on the same PC. This problem happens with every article I have viewed on The Guardian website, but I have not seen it on any web page on any other website. As an example, see the screen shots below of the same web page (<a href=""https://www.theguardian.com/australia-news/2023/jun/14/charge-dropped-against-man-accused-of-killing-german-backpacker"" rel=""nofollow"">https://www.theguardian.com/australia-news/2023/jun/14/charge-dropped-against-man-accused-of-killing-german-backpacker</a>) viewed on Firefox and Edge. </p>",desktop;windows-11;website-breakages;firefox-1140;firefox-11401;,firefox,website-breakages,en-US,1585388;,njhp94
1415840,2023-06-13 22:57:21 -0700,2023-06-13 22:57:21 -0700,lähetys ei onnistu gmail-osoitteisiin,<p><strong>lihavoitu teksti</strong> </p>,desktop;other;windows-10;,firefox,other,fi,"",ilkka.matila
1415838,2023-06-13 20:59:47 -0700,2023-06-13 20:59:47 -0700,OLG.ca access to my desktop location,"<p>Hello, I have made all the required changes to my privacy settings but still not able to Login to <a href=""http://OLG.ca"" rel=""nofollow"">OLG.ca</a> website via Firefox, I keep getting the following msg...  Sorry! We can’t seem to access your location. We need to confirm you’re playing in Ontario. Please enable your location services..........Pls note, I am able to login via Microsoft Edge. Hope you can help me solve this problem. </p>",desktop;privacy-and-security_1;windows-10;firefox-1140;firefox-11401;,firefox,privacy-and-security,en-US,"",mcdogman1
1415830,2023-06-13 18:07:26 -0700,2023-06-13 18:07:26 -0700,Printing,"<p>I received a receipt from a store &amp; when I open it up, all the pages show up.  When I go to print it, a couple of the pages are blank.  This just happened when AOLMail updated to a new version, but it works in Chrome &amp; Edge.  Any ideas on how to get this to work in Firefox?  It worked before this last update. </p>",desktop;other;windows-10;firefox-1140;firefox-11401;,firefox,other,en-US,"",darrentlynch
1415828,2023-06-13 17:49:39 -0700,2023-06-13 17:49:39 -0700,How do I add a numeric to the end of a duplicate downloaded files name?,"<p>chrome does this but I can't seem to figure how to do this on firefox I keep receiving this message I would like to download duplicates without this message showing up. </p><p><a href=""https://imgur.com/a/He3Rck8"" rel=""nofollow"">https://imgur.com/a/He3Rck8</a> </p>",linux;desktop;download-and-install_1;firefox-1130;firefox-11302;,firefox,download-and-install,en-US,"",Hawrtydoggs
1415827,2023-06-13 17:33:13 -0700,2023-06-13 17:33:13 -0700,mozilla firefox now sends me to xfinity discovery hub and i don't know why. can you help?,<p>mozilla firefox now sends me to xfinity discovery hub and i don't know why. can you help? </p>,desktop;other;windows-10;firefox-1140;,firefox,other,en-US,"",masacofr
