id,created,updated,title,content,tags,product,topic,locale,answers,creator
1409711,2023-03-31 08:52:55 -0700,2023-03-31 08:52:55 -0700,what is this   Your browser is being managed by your organization,<p>Your browser is being managed by your organization. Why am  i seeing this and how do   I remove   how do  i stop it from showing up and wwhy is it showing up&nbsp;? What organization  is  it  and why? </p><pre>? </pre>,desktop;other;windows-10;firefox-1110;firefox-11101;,firefox,other,en-US,"",mdm54
1409709,2023-03-31 08:47:55 -0700,2023-03-31 08:47:55 -0700,"SUSPICIOUS ""MCAFEE"" SECURITY ALERT KEEP POPPING UP WITH MOZILLA FIREFOX EMBLEM",<p>For the past week or two I have been getting these annoying pop ups with the Mozilla Firebox emblem demanding that I download the Mcafee and scan my computer for viruses.  I don't want to have anything to do with Mcafee or download ANYTHING from them.  What's going on?  How do I fix this? </p>,desktop;privacy-and-security_1;windows-10;firefox-1110;firefox-11101;,firefox,privacy-and-security,en-US,"",w.st26
1409708,2023-03-31 08:43:36 -0700,2023-03-31 08:43:36 -0700,"Redid my computer,  Reinstalled Firefox. And  Profile and Bookmarks were Wiped","<p>When I reinstalled firefox, I had a complete sync on my Tablet (chrome), and my phone (Android).   </p><p>I signed in using Authy as the MPA.  my account came back as blank.   I thought wierd.   Then signed in again to my phone,   It was also blanked, even though it showed previous website visits than no longer were in the profile.   </p><p>I know have one device (Chrome book).  with a complete profile and book mark list,  along with passwords etc.    Dont wanna sync, as it will wipe that as well.   How can I get it to populate correctly.  </p><p>From Chrome to Android etc. </p>",desktop;sync;windows-10;firefox-1110;firefox-11101;,firefox,sync,en-US,"",mcmanus.steve
1409707,2023-03-31 08:43:34 -0700,2023-03-31 08:47:08 -0700,Help requests via Adobe Community selection,"<p>So, whenever I select an Adobe Community/Forum help link, like this: <a href=""https://community.adobe.com/t5/indesign-discussions/how-to-set-default-font-in-indesign/m-p/11092203"" rel=""nofollow"">https://community.adobe.com/t5/indesign-discussions/how-to-set-default-font-in-indesign/m-p/11092203</a> </p><p>The web page ""blinks"" the requested Adobe destination page - but then provides an error page (see page-clip image attached here) and no destination result.  It does not require login - I should be able to see the topic in the Adobe Community (HelpX) page. </p><p>But either Adobe or Firefox is preventing me from seeing the page.  Please advise.  Firefox is my default browser.  When I copy link and paste-and-go in Chrome, it works as expected - I see the page. </p>",desktop;windows-10;website-breakages;firefox-1110;firefox-11101;,firefox,website-breakages,en-US,1573500;,sc.salamin
1409705,2023-03-31 08:33:28 -0700,2023-03-31 08:33:28 -0700,Firefox browser hangs on graphics when Gdata AV program is running.,"<p>Hi all,  </p><p>Firefox browser hangs on page graphics when GData AV program is running. This is becoming a persistent and annoying issue. I disabled the several add-ons one by one, and narrowed it down to the GData AV program. This also affects trying to log out of gmail where the hang is perfect. Disabling GData this, and warm reset everything then works fine. The problems don´t occur with GChrome. </p><p>How can one be sure which embedded program is actually causing the problem as all work and interface together&nbsp;? </p><pre>rich </pre>",desktop;fix-problems;windows-10;firefox-1110;,firefox,fix-problems,en-US,"",lab.schloss
1409703,2023-03-31 08:05:58 -0700,2023-03-31 08:05:58 -0700,ERRO AO ACESSAR SITE GOV.BR,"<p>Estou tentando acessar a plataforma <a href=""http://GOV.BR"" rel=""nofollow"">GOV.BR</a>, para acesso aos sites do Governo Federal, como por exemplo o site da Receita Federal do Brasil, no entanto, o Mozilla não acessa pelos meus certificados digitais, sejam da pessoa física (PF), seja da pessoa jurídica (PJ). </p><p>Segue abaixo a mensagem de erro: </p><p>Ocorreu um erro durante uma conexão com <a href=""http://certificado.sso.acesso.gov.br"" rel=""nofollow"">certificado.sso.acesso.gov.br</a>. Um módulo PKCS #11 retornou CKR_GENERAL_ERROR, indicando que ocorreu um erro irrecuperável. </p><p>Código do erro: SEC_ERROR_PKCS11_GENERAL_ERROR </p>",desktop;windows-10;website-breakages;firefox-1110;firefox-11101;,firefox,website-breakages,pt-BR,"",aluizamaral
1409701,2023-03-31 07:46:35 -0700,2023-03-31 07:59:00 -0700,password,"<p>on my account page under security - password lists an 18 character password. my password was actually only 8 characters, so i changed it and is now 9 characters but the only password listed is still the 18 character. </p>",desktop;privacy-and-security_1;windows-11;firefox-1110;firefox-11101;,firefox,privacy-and-security,en-US,"",thisfromyou
1409700,2023-03-31 07:42:44 -0700,2023-03-31 07:57:44 -0700,Sostituzione mail del mio profilo,"<p>Buon pomeriggio, non mi è stato possibile in autonomia di sostituire - nel mio profilo -  l'attuale indirizzo di posta --rimosso--@studiobosca.com con questo nuovo --rimosso--@gmail.com </p><p>come devo procedere&nbsp;? Grazie Massimo Bosca </p><p><br> ~ Rimossi indirizzi email non necessari </p>",desktop;privacy-and-security_1;windows-10;firefox-1110;firefox-11101;,firefox,privacy-and-security,it,1573492;,studiobosca
1409695,2023-03-31 07:21:28 -0700,2023-03-31 07:21:28 -0700,Firefox 111 using high memory resource processes for each tab,"<p>I know this has been addressed before, but I cannot find a solution that resolved the problem. Firefox is using a high percentage of ram and setting up individual resource demands for each tab. I have cleared the cache and refreshed Firefox with no resolution. At times this will freeze my computer if I have a lot of tabs open. I have compared the tab resources between Firefox, Avast Secure Browser and Edge. The other two use no where near as much resource.  </p><p>I am running a Lenovo P1 I7 processor with 16GB RAM </p><p>Attached are images of the resources from both about:processes and Advanced System Care.  </p><p>Any suggestions is appreciated. </p>",desktop;fix-problems;windows-11;firefox-1110;firefox-11101;,firefox,fix-problems,en-US,"",justin.spitzer
1409693,2023-03-31 07:04:40 -0700,2023-03-31 07:04:40 -0700,subtitulos,<p>hola buenos días. mi consulta es la siguiente al navegar en firefox mi navegador predeterminado entro a youtube y miro un video en ingles y puedo accionar los subtítulos (Español o lo que quiera) y aparecen los subtítulos. </p><p>luego entro por el mismo navegador predeterminado a youtube y ingreso mi usuario y password para ingresar a mi cuenta de youtube. ingreso y pongo un video y activo los subtítulos del video y no aparecen. no aparece ningún subtitulo. </p><p><br> realizo la misma operación con navegador Crome y si me muestra los subtítulos de las 2 formas anteriores </p><p>como puedo arreglar esto porque no quiero usar crome confió mas en Firefox por seguridad. </p>,desktop;other;windows-10;firefox-1110;firefox-11101;,firefox,other,es,"",rexcuzmar
1409692,2023-03-31 07:00:17 -0700,2023-03-31 07:00:17 -0700,How do I turn new download notification off?  Firefox 111,<p>The old fix (setting browser.download.alwaysOpenPanel to false) no longer works. </p>,desktop;download-and-install_1;windows-10;firefox-1110;firefox-11101;,firefox,download-and-install,en-US,"",JordanDave@gmail.com
1409691,2023-03-31 06:55:52 -0700,2023-03-31 06:55:52 -0700,dificuldade em carregar dados de uma pagina,"<p>estou tentado imprimir um boleto, mas não estou conseguindo, pois o site diz haver uma falha de segurança. Falha essa que eu desconheço e também não consigo resolver. </p>",desktop;windows-10;website-breakages;firefox-1090;,firefox,website-breakages,pt-BR,"",wendel.contador
1409689,2023-03-31 06:53:13 -0700,2023-03-31 06:53:13 -0700,Is there a way to get a deleted auto-complete address *back*?,"<p>Hello! </p><p>So a while back I deleted (shift-delete or ctrl-delete, whichever it is) an auto-complete address from preferences. Turns out I kinda need it back and I shouldn't have deleted it... Is there a way to get that address <em>back</em> into the auto-complete list? I've tried adding it as a bookmark, but that didn't seem to help. Ideas? Or is it gone forever.. </p><p>Thanks! J </p>",desktop;privacy-and-security_1;windows-10;firefox-1110;firefox-11101;,firefox,privacy-and-security,en-US,"",mistrowl
1409688,2023-03-31 06:51:42 -0700,2023-03-31 06:51:42 -0700,Acees Denied,"<p>Doing a flight search on the Easyjet airline website brings up this message. </p><p>You don't have permission to access ""<a href=""http://www.easyjet.com/en/buy/flights?"" rel=""nofollow"">http://www.easyjet.com/en/buy/flights?</a>"" on this server. Reference #18.a2051702.1680270222.a72aa67  </p><p>How do I give permission to allow the search to go ahead? It's pretty annoying to come out of Firefox and use Safari where this doesn't happen. Thanks </p>",desktop;privacy-and-security_1;mac-os-x-1015;firefox-1100;,firefox,privacy-and-security,en-US,"",steve526
1409687,2023-03-31 06:46:01 -0700,2023-03-31 06:46:32 -0700,AYUDA,<p>SE ME CERRO FIREFOX Y ME DA ERROR </p>,windows-7;desktop;fix-problems;needsinfo;firefox-1110;,firefox,fix-problems,es,1573477;,yordanoem
1409686,2023-03-31 06:28:01 -0700,2023-03-31 06:28:01 -0700,"Hoje o Mozilla com permissão da Microsoft fez o download automático do arquivo JJfb4Yxm.htm sem autorização, após a quarta atualização em cinco dias, e,É VÍRUS segundo WINDOWS DEFENDER.","<p>Quero saber o que é o arquivo JJfb4Yxm.htm baixado automaticamente pela Mozilla e com permissão da Microsoft, sendo que eu não dei permissão de download senão da quarta atualização em cinco dias, o que é o arquivo JJfb4Yxm.htm , Mozilla? Como ele veio parar nos meus downloads? Tem cinco anos que reclamo do excesso de atualizações e NUNCA, entendam a palavra NUNCA na totalidade, havia aparecido um download sequer ao atualizar. Fazia a atualização, abriam 3 abas apontando a atualização e fim. Continuava a mesma merda, na verdade sempre piorou, o consumo de memória do Mozilla beira os 86% diariamente, diariamente eu demoro 2h ou mais para conseguir abrir um site e hoje não foi diferente. E ao ver uma atualização, efetuei. E aí começou todo este caos.  O que é o arquivo JJfb4Yxm.htm , Mozilla? Por que a Microsoft mais uma vez abriu as pernas nessa retaliação contra mim? Mozilla, sabia que o arquivo JJfb4Yxm.htm que vocês colocaram no meu computador não existe nem na deepweb? Sabia que não existe uma informação no GOOGLE sobre? Então, o que é o arquivo JJfb4Yxm.htm , Mozilla? Se vocês colocaram no meu computador, eu mereço uma explicação, correto? Onde está discriminado o que é o arquivo JJfb4Yxm.htm que fora baixado sem nenhuma autorização minha? O crime é EVIDENTE! As provas são EVIDENTES! </p>",desktop;privacy-and-security_1;windows-10;firefox-1110;,firefox,privacy-and-security,pt-BR,"",twittesk
1409684,2023-03-31 06:06:13 -0700,2023-03-31 06:06:13 -0700,JJfb4Yxm.htm JJfb4Yxm.htm JJfb4Yxm.htmJJfb4Yxm.htm JJfb4Yxm.htm JJfb4Yxm.htm JJfb4Yxm.htm JJfb4Yxm.htm JJfb4Yxm.htm JJfb4Yxm.htm JJfb4Yxm.htm JJfb4Yxm.htm JJfb4Yxm.htm JJfb4Yxm.htm JJfb4Yxm.htm JJfb4Yxm.htm JJfb4Yxm.htm JJfb4Yxm.htm JJfb4Yxm.htm,<p>JJfb4Yxm.htm JJfb4Yxm.htm JJfb4Yxm.htmJJfb4Yxm.htm JJfb4Yxm.htm JJfb4Yxm.htm JJfb4Yxm.htm JJfb4Yxm.htm JJfb4Yxm.htm JJfb4Yxm.htm JJfb4Yxm.htm JJfb4Yxm.htm JJfb4Yxm.htm JJfb4Yxm.htm JJfb4Yxm.htm JJfb4Yxm.htm JJfb4Yxm.htm JJfb4Yxm.htm JJfb4Yxm.htm JJfb4Yxm.htm JJfb4Yxm.htm JJfb4Yxm.htmJJfb4Yxm.htm JJfb4Yxm.htm JJfb4Yxm.htm JJfb4Yxm.htm JJfb4Yxm.htm JJfb4Yxm.htm JJfb4Yxm.htm JJfb4Yxm.htm JJfb4Yxm.htm JJfb4Yxm.htm JJfb4Yxm.htm JJfb4Yxm.htm JJfb4Yxm.htm JJfb4Yxm.htm JJfb4Yxm.htm JJfb4Yxm.htm JJfb4Yxm.htm JJfb4Yxm.htm JJfb4Yxm.htmJJfb4Yxm.htm JJfb4Yxm.htm JJfb4Yxm.htm JJfb4Yxm.htm JJfb4Yxm.htm JJfb4Yxm.htm JJfb4Yxm.htm JJfb4Yxm.htm JJfb4Yxm.htm JJfb4Yxm.htm JJfb4Yxm.htm JJfb4Yxm.htm JJfb4Yxm.htm JJfb4Yxm.htm JJfb4Yxm.htm JJfb4Yxm.htm JJfb4Yxm.htm JJfb4Yxm.htm JJfb4Yxm.htmJJfb4Yxm.htm JJfb4Yxm.htm JJfb4Yxm.htm JJfb4Yxm.htm JJfb4Yxm.htm JJfb4Yxm.htm JJfb4Yxm.htm JJfb4Yxm.htm JJfb4Yxm.htm JJfb4Yxm.htm JJfb4Yxm.htm JJfb4Yxm.htm JJfb4Yxm.htm JJfb4Yxm.htm JJfb4Yxm.htm JJfb4Yxm.htm JJfb4Yxm.htm JJfb4Yxm.htm JJfb4Yxm.htmJJfb4Yxm.htm JJfb4Yxm.htm JJfb4Yxm.htm JJfb4Yxm.htm JJfb4Yxm.htm JJfb4Yxm.htm JJfb4Yxm.htm JJfb4Yxm.htm JJfb4Yxm.htm JJfb4Yxm.htm JJfb4Yxm.htm JJfb4Yxm.htm JJfb4Yxm.htm JJfb4Yxm.htm JJfb4Yxm.htm JJfb4Yxm.htm JJfb4Yxm.htm JJfb4Yxm.htm JJfb4Yxm.htmJJfb4Yxm.htm JJfb4Yxm.htm JJfb4Yxm.htm JJfb4Yxm.htm JJfb4Yxm.htm JJfb4Yxm.htm JJfb4Yxm.htm JJfb4Yxm.htm JJfb4Yxm.htm JJfb4Yxm.htm JJfb4Yxm.htm JJfb4Yxm.htm JJfb4Yxm.htm JJfb4Yxm.htm JJfb4Yxm.htm JJfb4Yxm.htm JJfb4Yxm.htm JJfb4Yxm.htm JJfb4Yxm.htmJJfb4Yxm.htm JJfb4Yxm.htm JJfb4Yxm.htm JJfb4Yxm.htm JJfb4Yxm.htm JJfb4Yxm.htm JJfb4Yxm.htm JJfb4Yxm.htm JJfb4Yxm.htm JJfb4Yxm.htm JJfb4Yxm.htm JJfb4Yxm.htm JJfb4Yxm.htm JJfb4Yxm.htm JJfb4Yxm.htm JJfb4Yxm.htm JJfb4Yxm.htm JJfb4Yxm.htm JJfb4Yxm.htmJJfb4Yxm.htm JJfb4Yxm.htm JJfb4Yxm.htm JJfb4Yxm.htm JJfb4Yxm.htm JJfb4Yxm.htm JJfb4Yxm.htm JJfb4Yxm.htm JJfb4Yxm.htm JJfb4Yxm.htm JJfb4Yxm.htm JJfb4Yxm.htm JJfb4Yxm.htm JJfb4Yxm.htm JJfb4Yxm.htm JJfb4Yxm.htm JJfb4Yxm.htm JJfb4Yxm.htm JJfb4Yxm.htmJJfb4Yxm.htm JJfb4Yxm.htm JJfb4Yxm.htm JJfb4Yxm.htm JJfb4Yxm.htm JJfb4Yxm.htm JJfb4Yxm.htm JJfb4Yxm.htm JJfb4Yxm.htm JJfb4Yxm.htm JJfb4Yxm.htm JJfb4Yxm.htm JJfb4Yxm.htm JJfb4Yxm.htm JJfb4Yxm.htm JJfb4Yxm.htm JJfb4Yxm.htm JJfb4Yxm.htm JJfb4Yxm.htmJJfb4Yxm.htm JJfb4Yxm.htm JJfb4Yxm.htm JJfb4Yxm.htm JJfb4Yxm.htm JJfb4Yxm.htm JJfb4Yxm.htm JJfb4Yxm.htm JJfb4Yxm.htm JJfb4Yxm.htm JJfb4Yxm.htm JJfb4Yxm.htm JJfb4Yxm.htm JJfb4Yxm.htm JJfb4Yxm.htm JJfb4Yxm.htm JJfb4Yxm.htm JJfb4Yxm.htm JJfb4Yxm.htmJJfb4Yxm.htm JJfb4Yxm.htm JJfb4Yxm.htm JJfb4Yxm.htm JJfb4Yxm.htm JJfb4Yxm.htm JJfb4Yxm.htm JJfb4Yxm.htm JJfb4Yxm.htm JJfb4Yxm.htm JJfb4Yxm.htm JJfb4Yxm.htm JJfb4Yxm.htm JJfb4Yxm.htm JJfb4Yxm.htm JJfb4Yxm.htm JJfb4Yxm.htm JJfb4Yxm.htm JJfb4Yxm.htmJJfb4Yxm.htm JJfb4Yxm.htm JJfb4Yxm.htm JJfb4Yxm.htm JJfb4Yxm.htm JJfb4Yxm.htm JJfb4Yxm.htm JJfb4Yxm.htm JJfb4Yxm.htm JJfb4Yxm.htm JJfb4Yxm.htm JJfb4Yxm.htm JJfb4Yxm.htm JJfb4Yxm.htm JJfb4Yxm.htm JJfb4Yxm.htm JJfb4Yxm.htm JJfb4Yxm.htm JJfb4Yxm.htmJJfb4Yxm.htm JJfb4Yxm.htm JJfb4Yxm.htm JJfb4Yxm.htm JJfb4Yxm.htm JJfb4Yxm.htm JJfb4Yxm.htm JJfb4Yxm.htm JJfb4Yxm.htm JJfb4Yxm.htm JJfb4Yxm.htm JJfb4Yxm.htm JJfb4Yxm.htm JJfb4Yxm.htm JJfb4Yxm.htm JJfb4Yxm.htm JJfb4Yxm.htm JJfb4Yxm.htm JJfb4Yxm.htmJJfb4Yxm.htm JJfb4Yxm.htm JJfb4Yxm.htm JJfb4Yxm.htm JJfb4Yxm.htm JJfb4Yxm.htm JJfb4Yxm.htm JJfb4Yxm.htm JJfb4Yxm.htm JJfb4Yxm.htm JJfb4Yxm.htm JJfb4Yxm.htm JJfb4Yxm.htm JJfb4Yxm.htm JJfb4Yxm.htm JJfb4Yxm.htm JJfb4Yxm.htm JJfb4Yxm.htm JJfb4Yxm.htmJJfb4Yxm.htm JJfb4Yxm.htm JJfb4Yxm.htm JJfb4Yxm.htm JJfb4Yxm.htm JJfb4Yxm.htm JJfb4Yxm.htm JJfb4Yxm.htm JJfb4Yxm.htm JJfb4Yxm.htm JJfb4Yxm.htm JJfb4Yxm.htm JJfb4Yxm.htm JJfb4Yxm.htm JJfb4Yxm.htm JJfb4Yxm.htm JJfb4Yxm.htm JJfb4Yxm.htm JJfb4Yxm.htmJJfb4Yxm.htm JJfb4Yxm.htm JJfb4Yxm.htm JJfb4Yxm.htm JJfb4Yxm.htm JJfb4Yxm.htm JJfb4Yxm.htm JJfb4Yxm.htm JJfb4Yxm.htm JJfb4Yxm.htm JJfb4Yxm.htm JJfb4Yxm.htm JJfb4Yxm.htm JJfb4Yxm.htm JJfb4Yxm.htm JJfb4Yxm.htm JJfb4Yxm.htm JJfb4Yxm.htm JJfb4Yxm.htmJJfb4Yxm.htm JJfb4Yxm.htm JJfb4Yxm.htm JJfb4Yxm.htm JJfb4Yxm.htm JJfb4Yxm.htm JJfb4Yxm.htm JJfb4Yxm.htm JJfb4Yxm.htm JJfb4Yxm.htm JJfb4Yxm.htm JJfb4Yxm.htm JJfb4Yxm.htm JJfb4Yxm.htm JJfb4Yxm.htm JJfb4Yxm.htm JJfb4Yxm.htm JJfb4Yxm.htm JJfb4Yxm.htmJJfb4Yxm.htm JJfb4Yxm.htm JJfb4Yxm.htm JJfb4Yxm.htm JJfb4Yxm.htm JJfb4Yxm.htm JJfb4Yxm.htm JJfb4Yxm.htm JJfb4Yxm.htm JJfb4Yxm.htm JJfb4Yxm.htm JJfb4Yxm.htm JJfb4Yxm.htm JJfb4Yxm.htm JJfb4Yxm.htm JJfb4Yxm.htm JJfb4Yxm.htm JJfb4Yxm.htm JJfb4Yxm.htmJJfb4Yxm.htm JJfb4Yxm.htm JJfb4Yxm.htm JJfb4Yxm.htm JJfb4Yxm.htm JJfb4Yxm.htm JJfb4Yxm.htm JJfb4Yxm.htm JJfb4Yxm.htm JJfb4Yxm.htm JJfb4Yxm.htm JJfb4Yxm.htm JJfb4Yxm.htm JJfb4Yxm.htm JJfb4Yxm.htm JJfb4Yxm.htm JJfb4Yxm.htm JJfb4Yxm.htm JJfb4Yxm.htmJJfb4Yxm.htm JJfb4Yxm.htm JJfb4Yxm.htm JJfb4Yxm.htm JJfb4Yxm.htm JJfb4Yxm.htm JJfb4Yxm.htm JJfb4Yxm.htm JJfb4Yxm.htm JJfb4Yxm.htm JJfb4Yxm.htm JJfb4Yxm.htm JJfb4Yxm.htm JJfb4Yxm.htm JJfb4Yxm.htm JJfb4Yxm.htm JJfb4Yxm.htm JJfb4Yxm.htm JJfb4Yxm.htmJJfb4Yxm.htm JJfb4Yxm.htm JJfb4Yxm.htm JJfb4Yxm.htm JJfb4Yxm.htm JJfb4Yxm.htm JJfb4Yxm.htm JJfb4Yxm.htm JJfb4Yxm.htm JJfb4Yxm.htm JJfb4Yxm.htm JJfb4Yxm.htm JJfb4Yxm.htm JJfb4Yxm.htm JJfb4Yxm.htm JJfb4Yxm.htm JJfb4Yxm.htm JJfb4Yxm.htm JJfb4Yxm.htmJJfb4Yxm.htm JJfb4Yxm.htm JJfb4Yxm.htm JJfb4Yxm.htm JJfb4Yxm.htm JJfb4Yxm.htm JJfb4Yxm.htm JJfb4Yxm.htm JJfb4Yxm.htm JJfb4Yxm.htm JJfb4Yxm.htm JJfb4Yxm.htm JJfb4Yxm.htm JJfb4Yxm.htm JJfb4Yxm.htm JJfb4Yxm.htm JJfb4Yxm.htm JJfb4Yxm.htm JJfb4Yxm.htmJJfb4Yxm.htm JJfb4Yxm.htm JJfb4Yxm.htm JJfb4Yxm.htm JJfb4Yxm.htm JJfb4Yxm.htm JJfb4Yxm.htm JJfb4Yxm.htm JJfb4Yxm.htm JJfb4Yxm.htm JJfb4Yxm.htm JJfb4Yxm.htm JJfb4Yxm.htm JJfb4Yxm.htm JJfb4Yxm.htm JJfb4Yxm.htm JJfb4Yxm.htm JJfb4Yxm.htm JJfb4Yxm.htmJJfb4Yxm.htm JJfb4Yxm.htm JJfb4Yxm.htm JJfb4Yxm.htm JJfb4Yxm.htm JJfb4Yxm.htm JJfb4Yxm.htm JJfb4Yxm.htm JJfb4Yxm.htm JJfb4Yxm.htm JJfb4Yxm.htm JJfb4Yxm.htm JJfb4Yxm.htm JJfb4Yxm.htm JJfb4Yxm.htm JJfb4Yxm.htm JJfb4Yxm.htm JJfb4Yxm.htm JJfb4Yxm.htmJJfb4Yxm.htm JJfb4Yxm.htm JJfb4Yxm.htm JJfb4Yxm.htm JJfb4Yxm.htm JJfb4Yxm.htm JJfb4Yxm.htm JJfb4Yxm.htm JJfb4Yxm.htm JJfb4Yxm.htm JJfb4Yxm.htm JJfb4Yxm.htm JJfb4Yxm.htm JJfb4Yxm.htm JJfb4Yxm.htm JJfb4Yxm.htm JJfb4Yxm.htm JJfb4Yxm.htm JJfb4Yxm.htmJJfb4Yxm.htm JJfb4Yxm.htm JJfb4Yxm.htm JJfb4Yxm.htm JJfb4Yxm.htm JJfb4Yxm.htm JJfb4Yxm.htm JJfb4Yxm.htm JJfb4Yxm.htm JJfb4Yxm.htm JJfb4Yxm.htm JJfb4Yxm.htm JJfb4Yxm.htm JJfb4Yxm.htm JJfb4Yxm.htm JJfb4Yxm.htm JJfb4Yxm.htm JJfb4Yxm.htm JJfb4Yxm.htmJJfb4Yxm.htm JJfb4Yxm.htm JJfb4Yxm.htm JJfb4Yxm.htm JJfb4Yxm.htm JJfb4Yxm.htm JJfb4Yxm.htm JJfb4Yxm.htm JJfb4Yxm.htm JJfb4Yxm.htm JJfb4Yxm.htm JJfb4Yxm.htm JJfb4Yxm.htm JJfb4Yxm.htm JJfb4Yxm.htm JJfb4Yxm.htm JJfb4Yxm.htm JJfb4Yxm.htm JJfb4Yxm.htmJJfb4Yxm.htm JJfb4Yxm.htm JJfb4Yxm.htm JJfb4Yxm.htm JJfb4Yxm.htm JJfb4Yxm.htm JJfb4Yxm.htm JJfb4Yxm.htm JJfb4Yxm.htm JJfb4Yxm.htm JJfb4Yxm.htm JJfb4Yxm.htm JJfb4Yxm.htm JJfb4Yxm.htm JJfb4Yxm.htm JJfb4Yxm.htm </p>,desktop;download-and-install_1;windows-10;firefox-1110;,firefox,download-and-install,pt-BR,"",twittesk
