id,created,updated,title,content,tags,product,topic,locale,answers,creator
1420636,2023-08-08 14:06:38 -0700,2023-08-08 14:06:38 -0700,Global Privacy,"<p>I went to about:config and set my privacy.globalprivacycontrol values to all True. Yet, when I go <a href=""https://globalprivacycontrol.org/"" rel=""nofollow"">https://globalprivacycontrol.org/</a>, the website states that the GPC signal is not detected. Is any other action required? I am using Firefox v16.0.2 on a Mac computer running Ventura 13.5. </p>",desktop;privacy-and-security_1;mac-os-x-1015;firefox-1160;firefox-11602;,firefox,privacy-and-security,en-US,"",jhuller
1420635,2023-08-08 13:58:57 -0700,2023-08-08 13:58:57 -0700,Is Youtube having issues with Firefox?,"<p>So I noticed last night that Youtube seems to be having some issues on Firefox. Sometimes the site won't load properly, and other times it will load fine, but the video won't let you turn off the annotations such as the little info card on the upper right hand screen. I checked this on multiple machines, and it's not just on my end. I cleared cookies and cache on both and the problem persisted. Whatever's happening with the annotations is also happening on Microsoft Edge as well. I was wondering if this was happening with anyone else and if so, what might be causing it. I am on 115.0.3 right now and I think the other machine I tested it on is on 116.0.2, and the issue is happening there too. Does anyone know what's happening here? </p>",desktop;windows-10;website-breakages;firefox-1150;,firefox,website-breakages,en-US,"",Marc7
1420634,2023-08-08 13:21:02 -0700,2023-08-08 13:21:02 -0700,https://www.seminolesocialcasino.com/,<p>Ever since the last update this website after running for a few minutes gets choppy and slow then crashes. I have to restart my computer to clear the problem. Running Windows 10. </p>,desktop;fix-problems;windows-10;firefox-1160;firefox-11602;,firefox,fix-problems,en-US,"",tbruscino56
1420630,2023-08-08 12:54:42 -0700,2023-08-08 12:54:42 -0700,laptop,<p><strong>bold text</strong>Firefox won't download anything on pc Just keep getting loading Or connection timed out </p>,desktop;download-and-install_1;,firefox,download-and-install,en-US,"",mmc.pmd
1420629,2023-08-08 12:23:01 -0700,2023-08-08 12:23:01 -0700,Non riesco a cambiare lingua,"<p>Non riesco a cambiare la lingua di Firefox Developer Edition da Italiano a Inglese. Ho provato dalle impostazione a rimuovere Italiano, lasciare solo English e riavviare ma non funziona. Il mio MacBook Pro è in lingua inglese ma con tastiera italiana. Con altri browser non ho problemi ma Firefox di default pare sia settato in Italiano. Come posso fare? </p>",desktop;beta;other;mac-os-x-1015;firefox-1170;,firefox,other,it,"",doni.rocco
1420627,2023-08-08 12:10:25 -0700,2023-08-08 12:29:42 -0700,Why can't I email a link from Firefox 2023?,<p>I do not see anyway to have the capability of emailing a link. </p>,desktop;customize;windows-10;firefox-1160;firefox-11602;,firefox,customize,en-US,1596310;,lyn.burgess
1420625,2023-08-08 11:57:59 -0700,2023-08-08 13:48:32 -0700,Blocked website,"<p>Hi I have a website that is being blocked on my friends computer. When I go to the same website it is blocked as well. I have updated the Firefox software but still cant get to the website. It does work on google chrome but I want to use it on Firefox. any help on this? </p><p>Here is the website: <a href=""https://www.microminimus.com"" rel=""nofollow"">https://www.microminimus.com</a> </p>",windows-7;desktop;other;firefox-1151;firefox-11510;,firefox,other,en-US,1596306;1596313;1596317;1596318;1596323;1596327;,buzzme
1420624,2023-08-08 11:28:24 -0700,2023-08-08 11:33:51 -0700,Custom default URL when opening a new tab,"<p>In settings &gt; New tabs, it appears that the only two choices are ""Firefox Home (Default)"" and ""blank page"".  I see no way to specify a URL of my choice, which I would like to do, but how? </p>",desktop;tabs;windows-10;firefox-1160;,firefox,tabs,en-US,1596286;,kindlingwoodme
1420623,2023-08-08 11:13:47 -0700,2023-08-08 12:11:06 -0700,Issues with the margins when printing labels,"<p>Hello,  I am trying to print labels from the web on a Dymo labelmaker. When I select no margins it prints on far left of label and cutting part of the text off. When I choose custom margins it prints very small and does not change regardless if I change the margins to 0 or change the size to 200%. When I print it in chrome it works perfectly fine. </p><p><br> </p><p>/edit: removed space before ""I am"" to removed horizontal scroll bar. </p>",desktop;other;windows-11;firefox-1150;firefox-11503;,firefox,other,en-US,1596289;,birderdave907
1420622,2023-08-08 11:01:28 -0700,2023-08-08 11:01:28 -0700,"When I search ""near me"" it thinks that I am in Atlanta.  I am in Florida.","<p>When I search ""near me"" it thinks that I am in Atlanta.  I am in Florida.  How do I tell it where I am? </p>",desktop;other;windows-11;firefox-1160;firefox-11601;,firefox,other,en-US,"",johnjjacobs41
1420621,2023-08-08 10:28:44 -0700,2023-08-08 10:28:44 -0700,"Navegação e pesquisa site ""E-Saj"" do TJSP","<p>Utilizo somente o Firefox, para tudo. Porém, há uns dias, o site do TJSP (e-Saj), passou a trabalhar com um certo ""delay"": ao entrar na pesquisa de processo, após digitar o número, o site demora a retornar e entrar no processo desejado. Está acontecendo no firefox e depois, ao testar, verifiquei o mesmo problema no Edge. Somente não Chrome não está assim e, em razão disso, para trabalhar com o e-Saj (fico muitas horas), estou fazendo somente no Chrome. Não sei a razão do ""bug"". Utilizo kaspersky (sem o salvador de chaves) e W10 Pro. </p>",desktop;fix-problems;windows-10;firefox-1160;firefox-11602;,firefox,fix-problems,pt-BR,"",pinheiro_adv
1420620,2023-08-08 10:27:15 -0700,2023-08-08 11:52:12 -0700,Attempting to attach any file crashes the browser - Version 116.0.2 (64-bit),"<p>As above, </p><p>Attempting to attach any file crashes the browser - Version 116.0.2 (64-bit) </p><p>Windows 10 Pro 64-Bit </p><p>Any website. File explorer window doesn't even appear. It just crashes instantly. </p>",desktop;fix-problems;windows-10;firefox-1160;firefox-11602;,firefox,fix-problems,en-US,1596290;,FirefoxConsumer
1420619,2023-08-08 10:19:32 -0700,2023-08-08 10:19:32 -0700,Estensione Avant Password,"<p>Buona Sera. Mi chiamo Gianfranco avrei bisogno che qualcuno mi possa spiegare come installare l'estensione Avant Password che ho sul mio antivirus Avant Premium. Visto che ogni volta che provo a installarla su Firefox 116.0.2. Mi appare la schermata di Avant che mi chiede di insallarla aprendo il Firefox. Ma appena ci clicco sopra non mi appare il la schermata che mi chiede, di scaricarla e installarla. Sono vari mesi che ci sto provando a fare questa procedura. Anche con versioni di Firefox più vecchie. Ma il risultato è lo stesso. Potete aiutarmi a risolvere questo problema. Visto che ho anche usato la funzione MODALITA RISOLUZIONE PROBLEMI, senza risultati Grazie per qualunque aiuto potete fornirmi. Distinti Saluti Gianfranco. </p>",desktop;customize;windows-10;firefox-1160;,firefox,customize,it,"",akwqet
1420618,2023-08-08 10:06:12 -0700,2023-08-08 11:18:20 -0700,How does the password manager encrypt passwords?,<p>I'd like to know what encryption algothim is used for the password manager and the process behind it. Since I'm using this information for a paper I'd appreciate it if you could add a source as well if possible. </p>,desktop;privacy-and-security_1;windows-11;firefox-1160;firefox-11601;,firefox,privacy-and-security,en-US,1596273;1596284;,cocytusdedi
1420617,2023-08-08 10:04:28 -0700,2023-08-08 10:04:28 -0700,Sharing loging with mother,<p>How can I set up my mothers computer to login to the ones on my computer**Firefox </p>,desktop;customize;windows-11;firefox-1160;firefox-11602;,firefox,customize,en-US,"",jeannowicki10
1420615,2023-08-08 09:46:30 -0700,2023-08-08 09:46:30 -0700,update?,<p>I got the notification that there was an update available...clicked on about Firefox and it is trying to download a new browser at 90mb...why is this and how do I get it to stop??? </p>,desktop;download-and-install_1;mac-os-x-1015;firefox-1160;firefox-11601;,firefox,download-and-install,en-US,"",lacewood12
1420614,2023-08-08 09:28:45 -0700,2023-08-08 09:37:03 -0700,"Various tasks have no effect, just have to switch to another browser to complete","<p>Various tasks have no effect , eg entering '<a href=""http://Duolingo.com"" rel=""nofollow"">Duolingo.com</a>' in the search field has no effect. Nothing is returned (screen remains blank - no messages). No problem with other search entries Also attempted link to my bank account similarly froze. End up by switching to Msoft Edge  and completing my mission. </p>",desktop;other;windows-10;firefox-1160;,firefox,other,en-US,1596247;,pedrowells
1420613,2023-08-08 09:25:17 -0700,2023-08-08 09:25:17 -0700,update,"<p>Just updated (7 August).  Now: </p><p>Everything (and I mean everything) is going at Tortoise speed Laptop crashed  Laptop rebooted - blanked screen Rebooted, wait 5 minutes for task bar population Select icon, wait to open Give up, try another </p><p>Click on a filename - wait 30 seconds - nothing happens, check Task Manager, wait 1/2 minute for that to open Open Explorer  - ""Not responding"" , go to anything else ""Not responding"" ""Save"" - ""Not responding""   </p><p>I daren't backup as it would take a week at this rate </p><p>Can you tell me how to reverse please please please. It was all good until yesterday </p>",desktop;fix-problems;windows-10;firefox-1150;firefox-11503;,firefox,fix-problems,en-US,"",PAE.ABER
1420611,2023-08-08 09:14:11 -0700,2023-08-08 09:14:11 -0700,Proxy socks,<p>I want to add proxy socks to my Firefox browser </p>,desktop;privacy-and-security_1;,firefox,privacy-and-security,en-US,"",ahnisarah1234
1420610,2023-08-08 09:13:39 -0700,2023-08-08 14:18:18 -0700,Mozilla tries to send default-browser ping despite all possible telemetry disabled,"<p>Hello I think I found a bug in firefox settings. Recently I upgraded my antivirus to bitdefender total security with firewall module. I set it to ask me about permission to connect with internet for every process on windows. I was very surprised to see that <strong>default-browser-agent.exe tried to connect to internet</strong>. I checked my privacy and telemetry settings again, but they are all disabled. I checked internet and found this mozilla article: <a href=""https://firefox-source-docs.mozilla.org/toolkit/components/telemetry/data/default-browser-ping.html"" rel=""nofollow"">https://firefox-source-docs.mozilla.org/toolkit/components/telemetry/data/default-browser-ping.html</a> You can read there that ""opting out of telemetry does disable it; the pref value is copied to the registry so that the default browser agent can read it without needing to work with profiles"". I <strong>opted out from all possible telemetry, both visible in settings and hidden in about:config</strong>(based on lists of telemtry-related options from web). </p><p>Is there any way to actually disable this ping? It tries to connect with internet every 24h.  I guess I can simply remove it from windows task scheduler but I want mozilla to respect my privacy settings and disable it solely using browser built-in settings! </p><p>Old article on web stated that this can be easily disabled by disabling setting responsible for sending technical data ( <a href=""https://www.bleepingcomputer.com/news/software/firefox-now-tells-mozilla-what-your-default-browser-is-every-day/"" rel=""nofollow"">https://www.bleepingcomputer.com/news/software/firefox-now-tells-mozilla-what-your-default-browser-is-every-day/</a> ) but I have it disabled and it is clearly ignored!!! </p><p>P.S. Sorry for screenshots in Polish but I guess you can understand them even without language context. </p>",desktop;privacy-and-security_1;windows-10;firefox-1160;firefox-11601;,firefox,privacy-and-security,en-US,1596292;1596308;1596325;1596329;,Piterk
1420609,2023-08-08 09:09:50 -0700,2023-08-08 09:46:52 -0700,toggle,<p>How or where do I find the Toggle for side by side view of two separate tabs? </p>,desktop;tips;windows-10;firefox-1160;,firefox,tips,en-US,1596250;,bombay.boss1
1420608,2023-08-08 09:05:40 -0700,2023-08-08 09:09:16 -0700,How do i reinstate the Action Toolbar ?,"<p>Hello.  One day after turning on my pc, the top-edge Action Toolbar was gone, and i dont know why.  Please inform me why it disappeared and how to reinstate it. </p>",desktop;other;windows-10;firefox-1150;firefox-11503;,firefox,other,en-US,1596241;,paul.merrill1
1420606,2023-08-08 09:04:26 -0700,2023-08-08 09:18:25 -0700,Print Friendly & PDF,"<p>Two, maybe three updates ago, not sure how many since there seem to have been quite a few the past couple of months, the PDF option in the Print Friendly &amp; PDF extension stopped working.  Period.  It's still usable for deleting content on a page but when the button to send it to Adobe as a PDF is clicked, a graphic with a large down arrow is shown with a scroll bar that at the end says Download Your PDF.  Clicking that brings up a box that says: The page you were looking for doesn't exist. </p><p>You may have mistyped the address or the page may have moved. </p><p>If you are the application owner check the logs for more information </p><p>I've removed and reloaded Print Friendly a couple of times in case that was the source of the trouble.  No change. </p>",desktop;fix-problems;windows-11;firefox-1160;firefox-11602;,firefox,fix-problems,en-US,1596242;,rrbluefin
1420605,2023-08-08 08:28:04 -0700,2023-08-08 08:31:52 -0700,Gmail doesn't works fine on Firefox.,"<p>Firefox works fine on every site, except <a href=""http://gmail.com"" rel=""nofollow"">G Mail.com</a> G <a href=""http://mail.com"" rel=""nofollow"">mail.com</a> On G mail the things works well, but when i try to move a e-mail or delete him, Firefox does it, but doesn't return to the primary and G mail site. </p><pre>The others G mail things works fine on all the other functions, and initiate well on Chrome, Opera and others internet navigators. </pre> <p>PS: It only happens after the last Firefox update. </p>",desktop;windows-10;website-breakages;firefox-1160;firefox-11602;,firefox,website-breakages,en-US,1596235;,sidijrr
1420601,2023-08-08 07:54:11 -0700,2023-08-08 10:09:08 -0700,"With Firefox 116.0.2, new tabs are crashing almost every day!","<p>In the past few weeks, I have been dealing with an ""epidemic"" of new tabs crashing. I use the New Tab extension so that each tab that I open with start with Google. Those tabs often crash. If I select a link on a fire service daily news blast, the tab will start to load the connection, then crash and ask me to report the conditions of the crash. When i select ""Retrieve the lost site,"" it will work about 10% of the time. The rest of the time, I wind up with a blank, white tab. That's it! </p>",desktop;fix-problems;windows-11;firefox-1160;firefox-11602;,firefox,fix-problems,en-US,1596255;,Dalmatprod
1420597,2023-08-08 07:19:58 -0700,2023-08-08 12:42:43 -0700,Spell Checker not working,"<p>The spell checker isn't working for me. I've found old answers to this: </p><p>""<strong>You can see which dictionary is selected if you right-click in a text area and open the Languages sub menu. At least one dictionary should be installed and have a check mark to indicate that it is selected. </strong> </p><pre>   open the ""Add Dictionaries"" link to install a dictionary if you do not have one.  </pre> <p>The spelling checker is enabled if [X] ""Check Spelling"" in the right-click context menu has a checkmark. </p><p>You can enable or disable spell checking globally: </p><pre>   Options/Preferences -&gt; General: Language and Appearance: ""Check your spelling as you type""  </pre> <p>You can look here for dictionaries: </p><pre>   <a href=""https://addons.mozilla.org/firefox/language-tools/"" rel=""nofollow"">https://addons.mozilla.org/firefox/language-tools/</a>  </pre> <p>Note that for spell check you need a dictionary. A language pack provides string translations for the user interface. </p><pre>   <a href=""https://support.mozilla.org/en-US/kb/use-firefox-interface-other-languages-language-pack"" rel=""nofollow"">https://support.mozilla.org/en-US/kb/use-firefox-interface-other-languages-language-pack</a>  </pre> <p>You can check the layout.spellcheckDefault pref on the about:config page. </p><pre>   <a href=""http://kb.mozillazine.org/layout.spellcheckDefault"" rel=""nofollow"">http://kb.mozillazine.org/layout.spellcheckDefault</a><em> ""'</em> </pre> <p><br> </p><p>But I don't understand what most of this means! </p><p>I don't find 'language' because I don't know where to find a ""text box containing more than one line""  I'd have thought this was one, but the option does not come up here when I right click.   </p><p>I realise this is probably me being dense, but can someone help in simple terms, please? Thanks. </p>",desktop;customize;windows-10;firefox-1150;firefox-11503;,firefox,customize,en-US,1596314;,janet25
1420594,2023-08-08 06:57:12 -0700,2023-08-08 09:22:19 -0700,A websites own font,"<p>Hi When I visit this webpage: https://www.locusmap.app/ I have some problems with the fonts </p><p>I have enable this setting: Allow pages to choose their own fonts, instead of your selections above </p><p>The problem i illustrated in the attached screenshot </p><p>It works without problems  in Edge and Chrome </p><p>Regards  Ole </p>",desktop;other;windows-10;firefox-1160;firefox-11602;,firefox,other,en-US,1596217;1596221;1596244;,abuole
1420592,2023-08-08 06:18:48 -0700,2023-08-08 06:18:48 -0700,Page loading sometime crazy,"<p>TV page frequently loads incorrectly, but after a second or two goes crazy. Then Firefox returns to the previous page. Then new glitch today. </p><p>95+% pages load okay, and are stable.  </p><p>So, what causes this, and is there any way I can fix it? </p><p>If non-TV page does this, I will try to grab a screenshot and send on. </p>",desktop;fix-problems;windows-10;firefox-1160;,firefox,fix-problems,en-US,"",jandalzell
1420591,2023-08-08 05:54:23 -0700,2023-08-08 05:56:02 -0700,loading,<p>nothing is loading can't open facebook my emails on yahoo none of the sites i  open regularly opens up this morning </p>,desktop;fix-problems;windows-8;firefox-1150;,firefox,fix-problems,en-US,1596210;,max_marc2000
1420590,2023-08-08 05:49:19 -0700,2023-08-08 12:37:34 -0700,why is it so difficult to get spell check to work?,"<p>I went into setting and made sure spellcheck is enabled and it is, but there are no other options there. I did exactly what it said on your help article and right clicked in the text box on multiple different web pages and there is NO OPTION.  It should not be this complicated. </p>",desktop;customize;windows-10;firefox-1160;firefox-11602;,firefox,customize,en-US,1596211;1596212;1596312;,tremault
1420588,2023-08-08 04:37:33 -0700,2023-08-08 04:50:10 -0700,logging into bank accounts,"<p>Hi there, I am experiencing some issues with logging into some websites, including bank accounts. Mozilla Firefox comes up with secure connection failed even though these are recognized banks. This has happened on a number of occasions recently with different logins. I even switched my online Firefox settings from strict to standard &amp; I am still experiencing these problems! Please could advise what else to do? I do not want to use Google but feel that I may have to download it to be able to access my accounts. Thank you, Howard </p>",desktop;privacy-and-security_1;windows-10;firefox-1160;firefox-11602;,firefox,privacy-and-security,en-US,1596206;,howardmintonfl
1420586,2023-08-08 04:31:40 -0700,2023-08-08 04:49:26 -0700,Cannot successfully connect with all accounts - get blank page.,"<p>My Wife and I are both 75 years old and have huge problems coping with modern computer technology. We have 3 computers with Ubuntu and Firefox. We find that we are able to successfully connect with most of our accounts. With some accounts like Royal Bank, Nextdoor, Koodo, TD Bank, Canadian Government we get in but only get a blank page and cannot go further. Accounts have told us the problem is Firefox and that we need to change to either Chrome or Edge. We have been with Ubuntu and Firefox since 2006, love both and do not want to change. </p>",linux;desktop;other;firefox-660;firefox-6603;,firefox,other,en-US,1596205;,krssnda
1420580,2023-08-08 03:21:30 -0700,2023-08-08 03:21:30 -0700,Faced issue while uploading images,"<p>I was uploading images on website ""<a href=""http://Pichastock.com"" rel=""nofollow"">Pichastock.com</a>"". While uploading images I encountered issue in which images was not uploading. I've tried same process in different browsers as well and process was pretty smooth. Only facing this issue in Mozilla Firefox browser. </p><p>I am providing you with the urls of images that I was trying to upload&nbsp;:- </p><p><a href=""https://drive.google.com/drive/folders/1I9vEuI4UmFPmESGTxnfFgvJfvBoXGzU3?usp=sharing"" rel=""nofollow"">https://drive.google.com/drive/folders/1I9vEuI4UmFPmESGTxnfFgvJfvBoXGzU3?usp=sharing</a> </p>",linux;desktop;fix-problems;firefox-1160;,firefox,fix-problems,en-US,"",sahilktpss
1420579,2023-08-08 03:19:03 -0700,2023-08-08 03:19:03 -0700,Firefox açılmıyor.,<p>Birçok kez yeniden yüklememe rağmen firefox çalışmıyor. Sistemim win11pro. </p>,desktop;other;windows-11;,firefox,other,tr,"",ofdhan
1420578,2023-08-08 03:15:48 -0700,2023-08-08 03:15:48 -0700,Uploading for some images doesn't work,"<p>Hello Firefox, </p><p>We have one web application which features uploading of media. Uploading of images are working fine in chrome but same images if we are uploading in firefox it is not working. </p><p>4 images uploading fine in chrome. Same 4 images doesn't upload in firefox. It is happening with only those 4 images. We converted the images in different formats as well but no luck. </p><p>Please check and let me know asap. </p>",linux;desktop;other;firefox-1160;,firefox,other,en-US,"",deepakdtpss
1420577,2023-08-08 01:54:02 -0700,2023-08-08 02:03:50 -0700,Selectively Allow Cookies,"<p>Hi Everyone, My Bank has suddenly decided that ALL cookies must be allowed before letting their customers in -- a requirement with which I wholly disagree. My FireFox is set to block anything that moves, and supported by Ad Blockers and Ublock too. Is there a way in which I can configure FF to allow me into the Bank site without having to change my ""secure"" settings every time? I am no computer genius - so please make it simple for me. </p><p>Thanks everyone. </p><p>Ian </p>",windows-7;desktop;privacy-and-security_1;firefox-1070;firefox-10701;,firefox,privacy-and-security,en-US,1596185;,ian_sd57llg
1420576,2023-08-08 01:38:33 -0700,2023-08-08 01:38:33 -0700,DevTools don’t show server response delays when requests are served via a service worker,"<p>It looks like Firefox’s DevTools, both the Network tab and profiler, don’t show the server response time when there is a Service Worker involved. Everything is shown at 0ms. </p><p>Is that expected and is there any way around it? </p><p>The attached screenshot shows the Network tab in the DevTools. All times in the timeline column are shown at 0ms, and all requests have transited via the service worker. </p>",linux;desktop;other;firefox-1150;firefox-11502;,firefox,other,en-US,"",sylvain.brunerie
1420572,2023-08-07 22:11:10 -0700,2023-08-08 00:56:12 -0700,Keyboard strokes showing on every key a different alphabet from what is been typed!,"<p>Why is firefox that set as my default browser having an issue of with my keyboard key strokes? When I type out a letter key, it shows it in a different key alphabet? For example, if I type “a” on the keyboard is will show a complete different random key like “5” or “d”. I am very comfortable and love using your browser. And would want to continue doing so without changing to another. </p><p><br> -	A practical example is the following attached screenshot.  I have typed the word “qwerty”  on your browser but instead I get displayed on your browser “dfghjk”. -	Very important to know is that I am running “ZoneAlarm Extreme Security NextGen” Anti-keylogger. That is configured to block programs that secretly record keystrokes (see attached document). Why is it only Firefox that is affected by this? -	I have also contacted Zonealarm and they instructed me to contact you about this seeing that this issue only happens with your browser and not with any other program. I can type in Word or outlook or any other App without issues. ( -	Like you can see from my other attached screenshots, it is not only your browser (firefox) that I have installed and working with as my default browser that is the only one having issues. The other browsers (Google Chrome, Microsoft Edge and Brave) are all working perfectly without this issue/problem. But only your browser that I made as the default browser that is the only one having this problem. -	A good example, I typed this whole message using outlook without an issue/problem of this sort (see attached document).  </p><p>Can you please look into this and provide me with answers on how to resolve this. </p>",desktop;other;needsinfo;windows-11;firefox-1160;firefox-11601;,firefox,other,en-US,1596174;,o.simeon
