id,created,updated,title,content,tags,product,topic,locale,answers,creator
1416245,2023-06-18 22:23:28 -0700,2023-06-18 22:23:28 -0700,I can nolonger log into my bank ... National Australia Bank,"<p>Hi </p><p>I log into my bank (in Australia) NAB almost every day. For about several weeks now when I successfully log in to the site it says ""Service Temporarily Unavailable. Please try Later"". However, if I use Chrome and log in (immediately after trying it wit Firefox) it logs in every time. </p><p>Can you please help me understand what might be stopping me from using Firefox on NAB website? </p>",desktop;mac-os-x-1015;website-breakages;firefox-1140;firefox-11401;,firefox,website-breakages,en-US,"",bnjelfs
1416244,2023-06-18 21:54:17 -0700,2023-06-19 00:11:56 -0700,URGENT HELP LOCKED OUT OF ACCOUNT HELP ME,"<p>I have literally been crying for what seems like the past hour because I have been locked out of my actual firefox account. I didn't know how to make a ""recovery key"" before, and I never realized that forgetting this password would literally lock me out of all of my log-ins. Is there any phone number I can call? I need urgent help. I've been trying to guess my password by using stupid passwords I always tend to use, and that isn't working as I keep getting locked out. Can I get in touch with a developer or staff member who can please help me? Help me please this is the only thing I have been able to find I am so confused and scared help me please I am locked out of my account. </p>",desktop;other;windows-10;firefox-1140;firefox-11401;,firefox,other,en-US,1586263;,lipop888
1416243,2023-06-18 20:59:59 -0700,2023-06-18 20:59:59 -0700,Unable to scroll when hovering over a folder in bookmark side panel,"<p>I just switched from chrome to Firefox. I find that when I hover my mouse over a folder in the bookmark side panel, I can't scroll with the mouse scroll wheel. This is really inconvenient since I have a lot of folders in my bookmark and hovering over the arrow to scroll is a pain. </p>",desktop;bookmarks;windows-11;firefox-1140;firefox-11401;,firefox,bookmarks,en-US,"",vagente
1416240,2023-06-18 20:06:03 -0700,2023-06-18 20:16:17 -0700,1Password not showing in toolbar,<p>I can't find a setting in Firefox or 1Password that will allow the 1Password to display in Firefox toolbar. Help please. </p>,desktop;other;mac-os-x-1014;firefox-1140;firefox-11401;,firefox,other,en-US,1586246;,dremltr
1416238,2023-06-18 17:06:28 -0700,2023-06-18 17:06:28 -0700,Ticketmaster resistance..see message below..,"<p>I've tried to purchase tickets and the web sites direct me to Ticketmaster. When I get to Ticketmaster I get the message below: </p><p><br> </p><p>Pardon the Interruption As you were browsing something about your browser made us think you were a bot. There are a few reasons this might happen: </p><pre>   You're a power user moving through this website with super-human speed.    You've disabled JavaScript in your web browser    A third-party browser plugin, such as Ghostery or NoScript is preventing JavaScript from running. </pre>",desktop;other;mac-os-x-1015;firefox-1140;firefox-11401;,firefox,other,en-US,"",warrenarch
1416237,2023-06-18 17:00:52 -0700,2023-06-18 17:00:52 -0700,Unexpected Refresh after Midnight,"<p>Every night I happen to be browsing past midnight, my active tab refreshes without any user input. Is there any way I can figure out why this is happening? No other program is affected as far as I can tell. </p>",desktop;other;windows-10;firefox-1140;,firefox,other,en-US,"",Prejudice182
