id,created,updated,title,content,tags,product,topic,locale,answers,creator
1410288,2023-04-07 21:47:05 -0700,2023-04-07 21:47:05 -0700,Uploading a new addon or updating the existing addon,"<p>I have published my addon on addons.mozilla, when i try to upload new version of the addon the progress bar stucks at validating filename.zip.  </p><p>I have tried creating a new addon, still the progress bar stucks at validationg filenam.zip </p><p>Methods tried: </p> <ol><li> Logging in again </li><li> Clearing browser data and trying again </li><li> Changing different browser and networks </li></ol> <p>Nothing seems to be working </p>",desktop;other;windows-10;,firefox,other,en-US,"",razoo.choudhary
1410287,2023-04-07 21:08:00 -0700,2023-04-07 21:08:00 -0700,How do I get rid of the notification count in paranthesis in tabs?,<p>Is this a behavior that can be disabled in about:config? </p>,desktop;customize;windows-10;firefox-1070;,firefox,customize,en-US,"",gsrgtrdg4565653
1410285,2023-04-07 20:29:09 -0700,2023-04-07 20:29:09 -0700,Window session refuses to restore after restarting laptop,"<p>Because one of the windows open was not responding, I restarted my laptop. When I tried to restore the previous session, nothing came up. What do I do? </p>",desktop;tabs;windows-11;firefox-1110;firefox-11101;,firefox,tabs,en-US,"",okoyevivian8
1410284,2023-04-07 20:11:13 -0700,2023-04-07 20:11:13 -0700,Firefox hangs in the task manager despite the fact that the browser is not running,"<p>After using the browser and closing it, Firefox continues to run in the background and hangs in the task manager, despite the fact that the browser is not running. We have to manually terminate processes. Strange behavior! </p>",desktop;other;windows-11;firefox-1110;firefox-11101;,firefox,other,en-US,"",redheat_specop
1410281,2023-04-07 17:52:07 -0700,2023-04-07 17:52:07 -0700,How to customize about:newtab (using a wallpaper)?,"<p>Hello, today I wanted to replace the ""about:newtab"" background with a picture. </p><p>I've already tried a lot like creating an extension, and adding the chrome folder with ""userChrome.css"" or ""userContent.css"" but I haven't had any luck whatsoever. </p><p>Could you help me in any way? </p><p>My preferred way would be through an extension to share it with my friends. </p><p>I already thank you in advance!&nbsp;:) </p><p>Best regards, Leon </p>",desktop;customize;windows-10;firefox-1110;firefox-11101;,firefox,customize,en-US,"",leon.klier
1410280,2023-04-07 17:12:26 -0700,2023-04-07 17:12:26 -0700,Disable the 3-dot menu icon next to the address bar drop down results?,<p>Looking for a solution to either completely disable this menu icon or at least stop Firefox from focusing on it when I press the tab key to navigate between results. </p>,desktop;customize;windows-11;,firefox,customize,en-US,"",98254
