id,created,updated,title,content,tags,product,topic,locale,answers,creator
1432780,2023-12-02 17:33:01 -0800,2023-12-02 17:33:01 -0800,Adding McAfee True Key to extensions,<p>Downloaded Mozilla browser to my new  computer. How do I add McAfee True Key to Extensions?  Thank you. </p>,desktop;other;windows-11;firefox-1200;firefox-12001;,firefox,other,en-US,"",hardingj2
1432779,2023-12-02 17:06:18 -0800,2023-12-02 17:06:18 -0800,Não consigo fazer log in na twitch,"<p>Não consigo fazer log in na twitch, fica falando que não estou com um browser  compativel </p>",desktop;fix-problems;windows-11;firefox-1200;firefox-12001;,firefox,fix-problems,pt-BR,"",mauricio.roy
1432778,2023-12-02 16:52:28 -0800,2023-12-02 16:52:28 -0800,Dragging web page elements causes them to increase in size,"<p>I often drag elements on <a href=""http://trello.com"" rel=""nofollow"">trello.com</a>.  Whenever I drag an element, that element seems to double in size, making it hard to see what is underneath.  Attached is an example. </p><p>I believe this is related to the fact that I am running Linux/X11 and my DPR is 2.  From about:support: </p> <ul><li> Window Device Pixel Ratios	2,2,2,2 </li><li> Window Protocol	x11 </li><li> OS 	Linux 6.1.0-13-amd64 #1 SMP PREEMPT_DYNAMIC Debian 6.1.55-1 (2023-09-29) </li></ul> <p>Is there an about:config setting or anything that will prevent scaling dragged elements? </p>",linux;desktop;website-breakages;firefox-1200;firefox-12001;,firefox,website-breakages,en-US,"",jayenashar
1432776,2023-12-02 16:44:05 -0800,2023-12-02 16:44:05 -0800,Automatic Threading of messages is potentially damaging. We need to be able to turn this off.,"<p>I've just now noticed the Threading automatic default grouping/marking of messages, and it is appalling. Thunderbird/Mozilla either needs to eliminate this (with appropriate warning notices, perhaps) or at least give us the ability to NOT link various messages. It's not only vastly annoying, it can cause severe real-world problems if anyone not in the CC or BCC fields is receiving these messages that were not intended for them. </p><p>I suppose for now, the only way to NOT link things that were never meant to be would be to change the Subject when discussing important topics. </p><p>Either that, or get a whole new mail service, which I'd prefer not to have to do. </p>",windows-7;desktop;customize;firefox-11550;firefox-1155;,firefox,customize,en-US,"",Squirebran
1432775,2023-12-02 16:04:49 -0800,2023-12-02 16:04:49 -0800,get error in  fgoogle search,<p>Ok well  i  went to about  config and  tired off all the accessibility  about the quick help bar  and now my question is  every time  i try to  go to google search and click on shopping no  matter what  item  i am searching for I get a pop up at the the bottom i of the  page every time  i hit on shopping  that say error update can not be added to this list or some  thing like that. it was ok until  the last update o of  firefox and  since  i did  that but  am not sure  why. doe not  do it in Chrome just frefox.  firefox is getting to the point b where  i an thing king of leaving it. Thank you tried a scree n shot but it does not sty on long enough ' </p>,desktop;other;windows-10;firefox-1200;firefox-12001;,firefox,other,en-US,"",mdm54
