id,created,updated,title,content,tags,product,topic,locale,answers,creator
1403821,2023-01-30 15:50:10 -0800,2023-01-30 15:50:10 -0800,Wrong Correspondent named,"<p>My wife shares my computer with her own account and email address in Thunderbird. When she sends me an email, my name instead of hers is listed as the Correspondent. Can that be changed to her own name? </p>",linux;desktop;other;firefox-1080;firefox-10802;,firefox,other,en-US,"",jwprincic
1403820,2023-01-30 15:34:28 -0800,2023-01-30 15:34:28 -0800,"YouTube ""Loop"" feature turns off randomly - videos stop playing","<p>When I play a Youtube video on loop (by right-clicking the video and selecting ""Loop"" from the context menu so a checkmark appears next to the word ""Loop""), it should play an infinite number of times until stopped. </p><p>I am noticing that Firefox will turn off the loop feature on its own, after a random number of plays, without user intervention, and the video will end. </p><p>This could happen after just one play, or after a few plays, or after many plays hours later. </p><p>I have tested this issue in non-Firefox browsers, and it does not occur with them. </p><p>It happens in most any version of Firefox I try, including FF88 and the recent FF109. </p><p>Please see attached screenshots. </p><p>Is this a known bug? </p><p>Thanks! </p>",windows-7;desktop;firefox-880;firefox-8801;website-breakages;,firefox,website-breakages,en-US,"",Slouch
1403816,2023-01-30 15:04:59 -0800,2023-01-30 15:35:53 -0800,Facebook troubles Plus,"<p>Firefox version 109.0 (64 bit) I have 2 Laptops, A and B. Laptop A: about 2 years ago Adobe and Flash quit the business, Firefox was doing ok then after an Firefox update videos would not play, I have to use chrome to this day, Had Windows 8 then updated to 10, no difference Laptop B: Everything was good until a couple of weeks ago January ? 10-20?? 2023. Just after an Firefox update my Facebook would not fully load, I can only see a couple of post followed by 3 post that only show a outlined box with an error occurred and if I click on it or anywhere else it kinda of locks up and does nothing. I can use Facebook on my cell phone (no Firefox) and on Laptop A (chrome) so nothing wrong with Facebook. I tried turning on-off, all that stuff. Tried using MS Edge still would not load fully. I uninstalled Firefox and reinstalled, no help. I updated  Windows 10 to 11, I can Run Facebook thru MS Edge but still cant thru Firefox. Just seems like Firefox doesn't like videos. Has my time expired with Mozilla Firefox? </p>",desktop;other;windows-11;firefox-1090;,firefox,other,en-US,1562925;,gmmory
1403815,2023-01-30 14:58:45 -0800,2023-01-30 14:58:45 -0800,luis.formy@gmail.com,"<p>Cuando pongo el reproductor en pantalla completa, en ocasiones, me mete los iconos de la Barra de herramientas de marcadores en el menú de desborde. Esto ocurre desde haca tres actualizaciones. </p>",desktop;other;windows-10;firefox-1090;,firefox,other,es,"",luis.formy
1403813,2023-01-30 14:51:41 -0800,2023-01-30 15:35:28 -0800,MyPath for rent rebate says fox has them blocked. need  to unblock them,<p>I need fox to unblock the government site of MyPath so I can get my rent rebate </p>,desktop;other;windows-10;firefox-1090;,firefox,other,en-US,1562924;,nitehazel
1403812,2023-01-30 14:39:45 -0800,2023-01-30 15:54:14 -0800,emaill login name saving,<p>How can I stop my email login name from being saved for display ? </p>,desktop;privacy-and-security_1;mac-os-x-1013;firefox-1090;,firefox,privacy-and-security,en-US,1562923;1562928;,siw65
1403811,2023-01-30 14:32:09 -0800,2023-01-30 14:58:35 -0800,New device does not require primary password,<p>I signed into firefox on a new device and all of my passwords are accessible without entering my primary password and the setting to require primary is unchecked on this device. How do I prevent this from happening? </p>,desktop;privacy-and-security_1;windows-10;firefox-1090;,firefox,privacy-and-security,en-US,1562915;,alex.zettler
1403808,2023-01-30 13:57:04 -0800,2023-01-30 13:57:04 -0800,Spotify,"<p>Reinstalé Firefox, todo bien, solo que específicamente Spotify Web ya no funciona, abre sesión normal pero al poner a reproducir alguna pista o playlist se salta pistas en automático, o cuando sí comienza la reproducción la pista se reproduce algunos segundos y ya no se escucha nada, al mismo tiempo que sigue corriendo como si nada. Está activada la opción DRM y ni así funciona. ¿Alguna solución? Gracias. </p>",linux;desktop;fix-problems;firefox-1090;,firefox,fix-problems,es,"",fmy.panaba
1403807,2023-01-30 13:54:06 -0800,2023-01-30 14:02:30 -0800,Firefox causing Blue Screens on Windows 10,"<p>I've been using Firefox for ages, and a month or two ago I began having BSODs on Win 10, while using Firefox. I tried removing add-ons, then clean install, after that Firefox crashes immediately on startup. After changing Browsers to Edge, my BSODs stopped. I'd prefer changing browsers back if possible. My Firefox version is 109. </p>",desktop;fix-problems;windows-10;,firefox,fix-problems,en-US,1562908;,brainhose
1403805,2023-01-30 13:33:42 -0800,2023-01-30 15:34:18 -0800,yahoo mail,"<p>My question is the yahoo mail systems does not let me do anything but read the email, no delete, no move, no open attachments, can not see past a couple of days. Nothing works. So confused. If I open edge and yahoo mail works great. Help please. </p>",desktop;tabs;windows-10;firefox-1090;,firefox,tabs,en-US,1562922;,lillithtormentir
1403803,2023-01-30 13:28:58 -0800,2023-01-30 13:28:58 -0800,Paste and Match Style missing from Firefox 109.0 on macOS,"<p>You used to be able to ""Paste and Match Style"" by either right-clicking and selecting ""Paste and Match Style"" or by pressing cmd+shift+v. This seems to have gone away in recent versions. I don't use it too often, so I'm not 100% sure when this change was made, but it is not there in the latest version. This is essentially required when pasting from certain apps into a rich text editor on a website. OneNote, for example, requires this. Now if I want to copy something from OneNote into a rich text editor (like a GitHub issue or Stackoverflow answer) in Firefox, I have to first paste it into a text editor and then copy again to paste it in the browser. </p><p>I'm attaching two screenshots one of the context menu when pasting into the body of a GitHub issue in Firefox from OneNote and another of the context menu while doing the same thing in Chrome. </p><p>Is this expected? It seems odd to remove the feature when it makes working between other widely-used apps difficult. </p>",desktop;other;mac-os-x-1015;firefox-1090;,firefox,other,en-US,"",charlieandrews.cwa
1403802,2023-01-30 13:18:21 -0800,2023-01-30 15:25:23 -0800,"When trying to log in to Amazon, the entire password box was already filled and will not delete, very scary, I cannot now enter Amazon unless I dump Firefox as a browser and choose Safari or Chrome","<p>When I try to access Amazon on Firefox the entire password box is already full and will not delete, very scary, I cannot now enter Amazon unless I dump Firefox as a browser and choose Safari or Chrome </p>",desktop;privacy-and-security_1;mac-os-x-1014;firefox-1090;,firefox,privacy-and-security,en-US,1562918;,kratekin
1403801,2023-01-30 13:08:38 -0800,2023-01-30 15:33:29 -0800,Crashing when loading files onto gmail,<p>My Firefox crashes when I attempt to attache a file to gmail. The entire thing freezes. I assume the crash reports were sent because the instructions to submit did not necessarily resemble what I saw. </p>,desktop;fix-problems;windows-10;firefox-1090;,firefox,fix-problems,en-US,1562921;,lgwilliams1947
1403800,2023-01-30 13:07:50 -0800,2023-01-30 15:23:07 -0800,"Reversing the ""Don't let this site prompt me again"" checkbox","<p>I once ticked the box in a pop-up to not allow prompts from a specific site, but I no longer want them blocked. How can I undo this? </p>",desktop;other;mac-os-x-1015;firefox-1060;firefox-10605;,firefox,other,en-US,1562903;1562917;,phoebeh18
1403799,2023-01-30 12:13:32 -0800,2023-01-30 12:13:32 -0800,Firefox draining huge resources for a single Twitch tab,"<p>Yo guys what's up! Been having problems with Firefox for several months now, restarts make no difference. Getting huge CPU drain if I have any Twitch tab running. Above screenshot is in troubleshooting mode (all my addons disabled) and a single twitch tab open. It makes my whole system sluggish especially if I happen to have something a little demanding in addition to the stream open. Chrome does NOT do this at all, much more balanced drain. </p><p>Specs: </p><p>HP pavilion laptop 16 gb ram core i7 chip bottom of the barrel nvidia mx250 GPU </p><p>The other screenshot is a comparison to Chrome. Both have a SINGLE tab open with a twitch stream playing. Firefox is using almost quadruple the resources, AND its in troubleshooting mode. </p><p>Hope you guys can help me out, been a long time Firefox user since I was a kid and really don't want to switch browsers. </p>",desktop;fix-problems;windows-10;firefox-1090;,firefox,fix-problems,en-US,"",jvggrayhawk
1403798,2023-01-30 12:06:38 -0800,2023-01-30 15:32:49 -0800,Recovering passwords,"<p>This morning a technician from Dell used remote desktop control to resolve a problem with my PC (an Inspiron AIO FT7710, running on Windows 11).  After that, I found that all my saved passwords to log into various on-line accounts (banking, Pandora, etc.) had disappeared.  Is there any way to recover them?  Thank you </p>",desktop;privacy-and-security_1;windows-11;firefox-1090;,firefox,privacy-and-security,en-US,1562920;,kisaval
1403796,2023-01-30 11:55:17 -0800,2023-01-30 14:12:27 -0800,i down load firefox and can not change search engine.  it is google and I can not change that.,<p>how can I change search engine to Firefox and not google? </p>,desktop;download-and-install_1;windows-11;firefox-1090;,firefox,download-and-install,en-US,1562909;1562912;,rich.cher5
1403795,2023-01-30 11:47:54 -0800,2023-01-30 15:41:12 -0800,Problem Loading Page,"<p>Hello Fire Fox, </p><p>I am trying to access a personal account through a client portal &amp; every time I try I get his error code: PR_END_OF_FILE_ERROR.  </p><p>I have cleared my cache &amp; every other trouble shooting option available to me. I need to access this client portal asap.  </p><p>My HP computer is old 2014/15 &amp; is running on Windows 7, does that have anything to do with my issue? </p><p>I have tried accessing this client portal on my new smartphone, newer Samsung tablet as well as another newer computer &amp; I keep getting the same message. </p><p>Is it the website or my device? </p><p>Any advice is greatly appreciated, thank you. </p>",windows-7;desktop;fix-problems;firefox-1090;,firefox,fix-problems,en-US,1562926;,jnrgonzo98
1403793,2023-01-30 11:31:42 -0800,2023-01-30 14:51:43 -0800,can't tell if I'm on Firefox as the G for Google is on the search bar,<p><strong>bold text</strong> Ive asked my question twice now... I'm not sure I'm using Firefox search because the G for Google is on the search bar.. </p>,desktop;other;,firefox,other,en-US,1562914;,fiber59freak
1403792,2023-01-30 11:21:48 -0800,2023-01-30 11:21:48 -0800,PDF editor doesn't save edits,"<p>I've been using firefox's built-in pdf editor and I know it's saved my edits in the past, but the file I'm working on right now never seems to save my annotations and I'm not sure why. I've saved it half a dozen times with the same name as before and changing it, and all I've managed to do is get more copies of the unchanged file on my computer. Does anyone know why this is happening? </p>",desktop;other;windows-10;firefox-1080;,firefox,other,en-US,"",mammothpowers
1403791,2023-01-30 11:14:53 -0800,2023-01-30 11:14:53 -0800,Firefox is already running,"<p>I have a user that is unable to open Firefox.  When she tries, she gets a popup that says Firefox is already running, but is not responding.  I have followed the troubleshooting guide, but I am still having this same issue.  I uninstalled, and reinstalled Firefox twice with fresh downloads from the Mozilla website.  We are still having the same issue.   Unless I close Firefox through task manager, the window will keep popping up.   </p><p>Any assistance will be greatly appreciated. </p>",desktop;other;windows-10;firefox-1090;,firefox,other,en-US,"",jgray4
1403789,2023-01-30 10:48:56 -0800,2023-01-30 10:48:56 -0800,using burp proxy firefox redirect me here -->>  https://www.google.com/search?client=firefox-b-d&q=hi&fcbz=1,"<p>hi team, </p><p>I'm able to intercept traffic using firefox and burp suite successfully but that my HTTP request got redirected to somewhere like <a href=""https://www.google.com/search?client=firefox-b-d&amp;q=hi&amp;fcbz=1"" rel=""nofollow"">https://www.google.com/search?client=firefox-b-d&amp;q=hi&amp;fcbz=1</a> and I got an error in firefox  </p><p>please solve it </p>",desktop;fix-problems;windows-10;,firefox,fix-problems,en-US,"",xtaraim
1403788,2023-01-30 10:40:50 -0800,2023-01-30 10:40:50 -0800,Exceptions for Enhanced Tracking Protection,"<p>I am working on development of a SaaS platform that will use a 3rd party chat bot for customer support. Enhanced tracking protection blocks the bot.  </p><p>If I click the shield and use the toggle to turn off ETP the bot loads. So far so good. But we don't want our users to have to click the toggle every time they want support.  </p><p>So I figured I would add exceptions to ETP. When I click the shield to see what is being blocked I see the bot URL. When I add the URL to the enhanced tracking protection exceptions whitelist the bot is still blocked. I also added our URL to the list. Still being blocked. I would expect to be able to see the bot if our URL and the blocked URL are both on the whitelist, but I don't.  </p><p>Is the exceptions list working as intended and not meant to do what I think it is meant to do? Am I missing settings that I need to use differently? Any help appreciated. (Sorry, I can't do screenshots because we're still in development) </p>",desktop;beta;privacy-and-security_1;windows-10;firefox-1100;,firefox,privacy-and-security,en-US,"",jason127
1403786,2023-01-30 10:10:36 -0800,2023-01-30 14:07:26 -0800,platby GP webpay,<p>Prosím o pomoc: mám ve Vašem prohlížeči potíže s platbou kartou přes GP webpay Click to pay - nefunguje. V microsoft edge bez problému. Lze nějak změnit nastavení prohlížeče? Banka csas. </p>,desktop;other;windows-10;firefox-1090;,firefox,other,cs,1562911;,horkyjenda
1403784,2023-01-30 10:05:26 -0800,2023-01-30 10:05:26 -0800,Problems with financial sites,"<p>Hi - Suddenly after using Firefox for many years I cannot open several of my financial-banking sites on my laptop. After entering the password, the browser goes back to the log-in screen. Starting again repeats this circle. I have tried turning off enhanced tracking but there is no effect. This problem occurs on these sites: <a href=""http://new.alterna.ca"" rel=""nofollow"">new.alterna.ca</a>, <a href=""http://alternabank.ca"" rel=""nofollow"">alternabank.ca</a> and <a href=""http://motivefinancial.com"" rel=""nofollow"">motivefinancial.com</a>. Oddly enough, <a href=""http://easyweb.td.com"" rel=""nofollow"">easyweb.td.com</a> still works to access my account. On my android mobile, logging in with Firefox works fine on all these sites. Can you help me resolve this issue? I don't want to have to start relying on Edge or Chrome! Paul Thomson </p>",desktop;other;windows-10;firefox-1090;,firefox,other,en-US,"",pthoms1535
1403783,2023-01-30 10:03:58 -0800,2023-01-30 10:03:58 -0800,hello,<p>Am good </p>,desktop;sync;,firefox,sync,en-US,"",abunic03
1403781,2023-01-30 10:02:02 -0800,2023-01-30 10:02:02 -0800,"file da scaricare con finale "".do""","<p>Non riesco a scaricare file con finale "".do""  Quando clk su aprire file mi appare come screenshot, pagina bianca. Grazie a chi mi aiuta :-))  Giusy </p>",desktop;download-and-install_1;windows-11;firefox-1090;,firefox,download-and-install,it,"",ottolina.giuseppina
1403779,2023-01-30 09:57:37 -0800,2023-01-30 10:48:56 -0800,browser keeps crashing,"<p>Hi, HELP!! My browser keeps crashing on sites that I use on a daily. I use office 365 outlook, and teams.  Its been getting worse and worse like crashes every 15-20 mins.  I've sent the reports but I have not see a patch to fix the issues.  Please help otherwise I have to go to another browser.  </p><p>Here are the links to the sites I work online that keep crashing on the Firefox browser: <a href=""https://acu.empirepro.com/AcumaticaERP/Frames/Login.aspx?ReturnUrl=%2fAcumaticaERP%2f"" rel=""nofollow"">https://acu.empirepro.com/AcumaticaERP/Frames/Login.aspx?ReturnUrl=%2fAcumaticaERP%2f</a> <a href=""https://outlook.office365.com/mail/inbox"" rel=""nofollow"">https://outlook.office365.com/mail/inbox</a> <a href=""https://teams.microsoft.com/_#/conversations/19:175319c1-ef69-4f40-a21d-173c9a0afbad_8a69628f-f70f-4696-ae5e-430740483a19@unq.gbl.spaces?ctx=chat"" rel=""nofollow"">https://teams.microsoft.com/_#/conversations/19:175319c1-ef69-4f40-a21d-173c9a0afbad_8a69628f-f70f-4696-ae5e-430740483a19@unq.gbl.spaces?ctx=chat</a> </p><p>Thanks, Oscar G. </p>",desktop;fix-problems;mac-os-x-10157;firefox-1090;,firefox,fix-problems,en-US,1562861;1562877;,oscar7
1403778,2023-01-30 09:41:27 -0800,2023-01-30 11:39:28 -0800,font performance problem,"<p>Hi, I use google type Montserrat on my site (<a href=""http://impres.bg"" rel=""nofollow"">impres.bg</a>). What Firefox displays is the font at the thinnest width (100). This is a problem only on firefox, on other browsers the font is displayed correctly. This is a disaster for page performance and design. I'm losing users who use this browser. </p><p>I can't find where the problem is, apparently it only occurs in Firefox. </p><p>thanks </p>",windows-7;desktop;website-breakages;firefox-1090;,firefox,website-breakages,en-US,1562885;,galgo4e
1403776,2023-01-30 09:30:14 -0800,2023-01-30 09:30:14 -0800,logging in with wrong user despite the proper credentials being given while using Firefox 109.0,"<p>Facebook, logging in with wrong user despite the proper credentials being given while using Firefox 109.0, Win 10, Lenovo Ideapad 5 PC. </p><p>Only since upgrading to ver 109.0. </p>",desktop;other;windows-10;firefox-1090;,firefox,other,en-US,"",tlist809
1403774,2023-01-30 09:12:27 -0800,2023-01-30 10:41:21 -0800,Firefox does not sync,"<p>Hi, I create an account to sync Bookmarks, Passwords, Add-ons, History etc from one computer to an other. I successfully created the account, verify mails, checkbox all features to sync in settings, and click on ""sync' multiple times. But nothing is synced on my new computer.  On the log I saw (about:sync-log):ab </p> <ol><li><ol><li> On new computer side </li></ol> </li></ol> <hr> <p>1674839909897	FirefoxAccounts	ERROR	FxA rejecting with error UNVERIFIED_ACCOUNT, details: undefined 1674839909897	FirefoxAccounts	ERROR	Background refresh of initial profile failed: Error: UNVERIFIED_ACCOUNT(resource://gre/modules/FxAccounts.jsm:1561:18) JS Stack trace: _error@FxAccounts.jsm:1561:18 </p> <hr> <p>1675070999227	FirefoxAccounts	ERROR	Background refresh of profile failed: {""name"":""FxAccountsProfileClientError"",""code"":null,""errno"":998,""error"":""NETWORK_ERROR"",""message"":""[Exception... \""NS_ERROR_ABORT\""  nsresult: \""0x80004004 (NS_ERROR_ABORT)\""  location: \""JS frame :: resource://services-common/rest.js :: onStopRequest :: line 491\""  data: no]""} </p> <ol><li><ol><li>On previous computer side </li></ol> </li></ol> <hr> <p>Sync.ErrorHandler  ERROR   Sync encountered a login error Sync.Service     DEBUG    Not syncing:login returned false </p><p>Can you help me please ? Mrs RICHTER </p>",linux;desktop;sync;firefox-1090;,firefox,sync,en-US,1562869;1562870;,crichter2
1403772,2023-01-30 08:29:35 -0800,2023-01-30 08:29:35 -0800,thundbird sähköpostitili,"<p>Sähköpostitilin asentaminen kaatuu, koska joko käyttäjänimi markku.krohn tai salasana ei kelpaa.  En ole tarvinnut salasanaa vuosiin ja yksi löytynyt ei toiminut. Vaihtomahdollisuutta ei tarjota. </p>",linux;desktop;download-and-install_1;,firefox,download-and-install,fi,"",markku.krohn
1403771,2023-01-30 08:23:00 -0800,2023-01-30 08:23:00 -0800,"Green lines in header,etc. Unchecked hardware accelerator and did restart. Did not solve. This began out of nowhere. Suggestions?","<p>Green lines in header,etc. Unchecked hardware accelerator and did restart. Did not solve. This began out of nowhere. Suggestions? </p>",desktop;other;windows-10;firefox-1090;,firefox,other,en-US,"",rdwyerwinz
1403768,2023-01-30 08:17:35 -0800,2023-01-30 09:09:06 -0800,"Installed Firefox extensions to make recording on YouTube EZ , but now some songs blurr image","<p>Please help me either with removing extensions on Firefox , I installed them to make recording songs more EZ, but now in YouTube on some songs the image is blurred </p>",desktop;customize;,firefox,customize,en-US,1562849;,Karla2u
1403767,2023-01-30 08:15:26 -0800,2023-01-30 08:15:26 -0800,autofil not working,"<p>this is the question dougumbarger asked in 2022. There does not appear to be a solution posted I now have the same problem. Especially noted with ticketing sites like Ticket master, Eventbrite. </p><p>Firefox has my credit card information and it shows up in a window when I go to pay for something, but when I click on the credit card I want to pay with, it won't autofill.  In Settings, the box to autofill is checked.  This has worked a hundred times before, but stopped working a few months ago.  How do I get the autofill to start working again </p>",desktop;customize;windows-10;firefox-1090;,firefox,customize,en-US,"",janet19
1403764,2023-01-30 07:31:17 -0800,2023-01-30 08:54:04 -0800,firefox does not load a specific website,"<p>Hi </p><p>Received following error when trying to load <a href=""http://openai.com"" rel=""nofollow"">openai.com</a>. </p><p>""The page isn’t redirecting properly </p><p>An error occurred during a connection to <a href=""http://openai.com"" rel=""nofollow"">openai.com</a>. </p><pre>   This problem can sometimes be caused by disabling or refusing to accept cookies."" </pre> <p>This web page loads fine when connecting directly to server (using ctrl+shift+r). </p><p>Already cleared web cache, individual cookies for the web site, history-but error remains! </p><p>Thanks Ravi </p>",linux;desktop;cookies;firefox-1090;,firefox,cookies,en-US,1562822;1562825;1562830;1562844;1562845;,rraj
1403763,2023-01-30 07:07:16 -0800,2023-01-30 07:07:16 -0800,Half size letters,"<p>When I create a new document in Word, the letters become cut off at the top.  My setting are OK.  The first paragraph is fine but when I create a new paragraph, then all the letters appear half size after that.  I have Windows 11. </p>",desktop;other;windows-11;firefox-1090;,firefox,other,en-US,"",condogal
1403761,2023-01-30 06:39:10 -0800,2023-01-30 06:39:10 -0800,Aniceto.,"<p>Hola me gustaría saber cuando estará disponible la extensión de Solana Phanton Wallet para Firefox?. Muchas  gracias, un saludo. </p>",desktop;download-and-install_1;mac-os-x-109;firefox-7815;firefox-78150;,firefox,download-and-install,es,"",anicheco
1403757,2023-01-30 05:48:03 -0800,2023-01-30 05:48:03 -0800,Can't Select Downloads Folder,"<p>I'm running MacOS Ventura 13.2 on a M2 Macbook and Firefox 109.0 </p><p>I can not select a Downloads folder and even if ""Always Ask"" is set, all Downloads of all types fail immediately. </p><p>See quick screenshare here: <a href=""https://www.loom.com/share/c5bc3563630f4d1182199ee7787e32f4"" rel=""nofollow"">https://www.loom.com/share/c5bc3563630f4d1182199ee7787e32f4</a> </p><p>I've tried many of the common things: uninstalled/reinstalled start with add-ons disabled refreshed </p><p>None of them solved the issue. </p><p>Any thoughts/insights? </p><p>Thanks! </p>",desktop;customize;mac-os-x-1015;firefox-1090;,firefox,customize,en-US,"",dave341
1403754,2023-01-30 05:22:42 -0800,2023-01-30 09:22:01 -0800,přihlašování do banky a platby,"<p>Sedlák dobrý den mám takový problém, přestalo mi fungovat přihlášení do KB, a někdy nejde třeba ani provést platbu kartou, třeba včera jsme poštěli testy na autoškolu a vůbec to nejde, přes ostatní prohlížeč jako je SEZNAM nebo Google to normálně funguje, asi je tam nastavené nějaké zabezpečení ??? Děkuji za odpověď.. </p>",desktop;windows-11;website-breakages;firefox-1090;,firefox,website-breakages,cs,1562853;,fabia1.4mpi
1403753,2023-01-30 05:19:57 -0800,2023-01-30 05:19:57 -0800,Slack does not launch app but always opens new tab,"<p>I would like FF to open the slack app rather than a new tab when I select ""Launch"" for a workspace </p>",desktop;fix-problems;windows-10;firefox-1090;,firefox,fix-problems,en-US,"",avi11b
