id,created,updated,title,content,tags,product,topic,locale,answers,creator
1415903,2023-06-14 12:57:04 -0700,2023-06-14 12:57:04 -0700,little yellow info pop-out windows,"<p>About those little yellow info pop-out windows that give us helpful information .They appear BEHIND the main firefox window and other open windows instead opening in FRONT. They open in front for a fraction of second and then they hide behind. AS such they are completely useless.  Can you help with issue? Thank you and regards,  Filip </p>",windows-7;desktop;customize;firefox-1140;firefox-11401;,firefox,customize,en-US,"",xesyxsexy
1415900,2023-06-14 12:43:36 -0700,2023-06-14 12:43:36 -0700,Screen always starts the wrong size.,"<p>I use a docking station with varying work monitors. Quite often I start firefox and the resolution is way too big, I cannot get to the top minimise maximise buttons they are off the top of the screen. The only way to resize is to grab the side of the frame and that fortunatley forces a resize. Its super annoying but I tolerate it. </p><p>Now it seems to have reached new heights. I booted my laptop unconnected to a dock, went to open firefox and it seems to be opening on another screen. which isnt even connected. took a minute to realise it was running, just not anywhere you could see it on the laptop screen. Can it not detect there is no screen to render on? </p><p>Only manged to get round it by using tasks view and dragging firefox on to an alternate dektop. </p><p>this is all on windows 10 and the latest version of firefox as of 6/14/23. Maybe a new blank screen start up  and updates tommorow!   </p><p>Hoped firefox would spot this obvious basic startup issue but it has been many months if not years and alas not. Now its just so bad I'm considering dumping years of firefox for Edge! </p><p>...not reallly, but almost. </p>",desktop;fix-problems;windows-10;firefox-1140;firefox-11401;,firefox,fix-problems,en-US,"",martin351
1415899,2023-06-14 12:32:58 -0700,2023-06-14 12:32:58 -0700,Password,<p>When selecting a financial browser it associates Last Pass with it revealing ID and password even though I logged out of Last Pass. How do i fix this? </p><p>Wesley Pinkham perichoresis@mac.com 661-713-3570 </p>,desktop;privacy-and-security_1;mac-os-x-1015;firefox-1140;firefox-11401;,firefox,privacy-and-security,en-US,"",wesleympinkham
1415896,2023-06-14 12:08:48 -0700,2023-06-14 12:31:17 -0700,SVG processing limit(s) ?,"<p>Related to some personal SVG project files. Which are relative large files (containing lots of generated paths and other data). </p><p>On the largest of these files I spotted that some general svg-viewer failed with a ""XML parse error: cannot load more than 200.000 XML elements"" error message. </p><p>The same file, when viewed in Firefox (114~, Linux, Mint), also developed some odd hiccup that did not make sense. Unless ... </p><p>Is there a similar limitation active in Firefox&nbsp;? </p><p>- I tried to see if ""Inspect&gt;Console"" gave some potential related message on this. But spotted nothing out of the ordinary. - Searched <a href=""http://developer.mozilla.org"" rel=""nofollow"">developer.mozilla.org</a> for any related svg data. But could not find any. - After ditching some data in the effected file, unrelated to the hiccup part, the hiccup disappeared. Suggesting I did hit some svg limit in Firefox. - File size: ~26.5MB. Number of elements: Other than more than 200.000, unknown at this point. (<em>not sure how to count them at this moment either</em>) </p>",linux;desktop;other;firefox-1140;firefox-11401;,firefox,other,en-US,1585483;,mvgulik
1415894,2023-06-14 11:59:27 -0700,2023-06-14 11:59:27 -0700,unable to login to my work website,"<p>I have been unable to login/sign in to my job website. It is not a network connection issue, nor that the website is temporary unavailable. </p><pre>I keep getting this message: </pre> <p>'If your computer or network is protected by a firewall or proxy, make sure that Firefox is permitted to access the web' </p>",desktop;privacy-and-security_1;mac-os-x-1015;firefox-1140;firefox-11401;,firefox,privacy-and-security,en-US,"",gpanting
1415892,2023-06-14 11:30:12 -0700,2023-06-14 11:30:12 -0700,Padlock with red line in address bar,<p>Since today my mobile android Firefox browser will not open any pages. It always shows the padlock with a red line through it. Tried most things? </p>,desktop;fix-problems;,firefox,fix-problems,en-US,"",robrhoose
1415890,2023-06-14 11:13:21 -0700,2023-06-14 11:13:21 -0700,Google blocking utube on firefox on my computer.,<p>Do you know about this?  G says I'm offline when I go to utube on firefox.  When I switch to chrome I'm 'online'. This has been going on for a few weeks and is periodic. Lasts for an hour or so. </p>,desktop;other;mac-os-x-1015;firefox-1130;firefox-11302;,firefox,other,en-US,"",rcreedd
1415888,2023-06-14 11:08:03 -0700,2023-06-14 11:08:03 -0700,Save to Pocket Icon Circular Login,"<p>The <strong>Save to Pocket</strong> icon on the toolbar just started (version: <strong>114.0 (64-bit</strong>)) a circular login pattern that does not allow me to login when trying to save a page.  I am logged into Pocket on another tab and have done the suggestions stated here: <strong><a href=""https://support.mozilla.org/en-US/kb/how-fix-pocket-login-issues"" rel=""nofollow"">https://support.mozilla.org/en-US/kb/how-fix-pocket-login-issues</a></strong>.  I am able to fully access Pocket and save the page by clicking the ""+"" button. </p>",desktop;other;windows-10;firefox-1140;,firefox,other,en-US,"",michael_c_o
1415887,2023-06-14 11:04:27 -0700,2023-06-14 11:04:27 -0700,Missing Bookmarks and other Firefox settings,<p>Has to reset my computer to factory settings and reinstall Firefox. I logged in thinking it would restore my Firefox settings.  There is no backup because I didn't know I needed to make one before the factory reset. I thought if I logged in my browser would sync to the last settings. </p>,desktop;sync;windows-11;firefox-1140;firefox-11401;,firefox,sync,en-US,"",debbiblessings
1415885,2023-06-14 10:58:16 -0700,2023-06-14 11:00:42 -0700,How to view history from other devices?,"<p>I would like to view the history from other devices (specifically my phone) i have signed in &amp; synced with Firefox. Does this feature exists? Going through sync settings I am not entirely sure. Often times I am researching about a topic on my phone on the way home, &amp; at home I wish to view the history of websites I visited on my phone. </p><p>The history tab on Firefox only appears to show the history from the current device i am on. I do see the option for sync tabs, but for my phone this only shows the tabs that are currently open in the browser &amp; for my other computer it seems to only show the very last page that i visited. Is there a way to view more history? </p><p>In sync settings of firefox one of the options is sync history across all my devices, but where can i view it? </p>",desktop;sync;windows-10;firefox-1130;firefox-11301;,firefox,sync,en-US,"",a3506104
1415883,2023-06-14 10:00:41 -0700,2023-06-14 12:12:35 -0700,Can't Update Firefox,"<p>Since about two months ago, I haven't been able to update Firefox(or any other browser for that matter). I've tried the typical method of going to Preferences, checking for updates, but I can't get passed that point. I get this error message stating ""Failed to check for updates."" </p><p>Chrome was giving me much of the same issue, I've allowed GoogleUpdate on my firewall rules, restarted the PC and tried again. Still got the same error message. I have no other antivirus software installed on this device other than the Windows Defender default app. Firefox hasn't told what I should be allowing past my firewall so I haven't tried anything similar for Firefox. </p><p>I also tried uninstalling Firefox, but when I tried to reinstall, I couldn't finish that process because clicking on Download Now led me to this error message stating ""Hmm. We’re having trouble finding that site. </p><p>We can’t connect to the server at <a href=""http://download.mozilla.org"" rel=""nofollow"">download.mozilla.org</a>."" </p><p>I assumed this was maybe a DNS issue. I tried a DNS flush but that also was ineffective. I tried changing my DNS servers to 1.1.1.1 and 1.1.1.2, also tried other known DNS servers but that didn't work either. </p><p>In the meantime, I'd like to at least get an offline installer going because my current version is 110.0.1. </p><p>Thank you. </p>",desktop;download-and-install_1;windows-10;firefox-1100;firefox-11001;,firefox,download-and-install,en-US,1585457;1585460;1585478;1585481;,kimberly9
1415882,2023-06-14 10:00:11 -0700,2023-06-14 10:00:11 -0700,Profile issue.,"<p>Getting message ""Can't access profile or profile is missing."" </p>",desktop;fix-problems;windows-11;firefox-1140;firefox-11401;,firefox,fix-problems,en-US,"",orangeade782
1415881,2023-06-14 09:54:55 -0700,2023-06-14 09:54:55 -0700,Firefox Bookmarks GPO Using JSON,"<p>I am using the most recent Firefox ADMX templates and I am unable to get bookmarks to show up using JSON. I have verified that the GPO is applied, and there is a registry key being created under the user's profile, however it is not the right registry key.  </p><p>The key it is creating: SOFTWARE\Policies\Mozilla\Firefox\Bookmarks Type: Reg_Multi-SZ </p><p><br> If I rename this registry key from Bookmarks to ManagedBookmarks, the bookmarks show up and work as intended.  </p><p>I do not see ""ManagedBookmarks"" in the GPO anywhere. If I am not setting ""ManagedBookmarks"" in the correct location then please show me where I am supposed to set them. I am tempted to just modify the ADMX template and have it create the registry key ""ManagedBookmarks"" instead of ""Bookmarks"" as that seems to work, but I can't imagine this is how the devs wanted this. </p>",desktop;bookmarks;windows-10;,firefox,bookmarks,en-US,"",tmgordon
1415879,2023-06-14 09:18:33 -0700,2023-06-14 09:18:33 -0700,"Why is it firefox browser does not open in full window, it did before last update????","<p>Why does firefox browser not open in full window like it use too, if I wish to reduce it I can, but now it opens in half window and I have to open it further.  Is there a reason for this? </p>",desktop;other;windows-11;firefox-1140;firefox-11401;,firefox,other,en-US,"",SaintlyIvan
1415878,2023-06-14 09:16:59 -0700,2023-06-14 12:29:21 -0700,Can't play videos,"<p>Something changed in my privacy settings in one of the recent Firefox updates - I did not intentionally change anything. Now I get frequent messages along the lines of ""Sorry. Because of its privacy settings, this video cannot be played here."" I tried clicking on the shield to turn Enhanced Tracking Protection off but that does not change all the privacy error messages I get. The ""Settings"" menu and options are so complicated that I cannot figure out a setting that allows access to these videos, even trying to ""manage exceptions.""  </p><p>So I am lost and frustrated and have to continually switch to another browser to view these things - it is getting to the point that it makes no sense for me to keep having to go to another browser and I am considering stopping using Firefox, which I hate doing because I have always loved Firefox.  </p><p>This is a last ditch effort to help me continue using Firefox - I would love to get this issue resolvedd, if anyone can assist and advise. </p>",desktop;privacy-and-security_1;firefox-1140;firefox-11401;,firefox,privacy-and-security,en-US,1585458;1585464;1585467;1585480;1585482;,jeffmorrismd
1415875,2023-06-14 09:00:52 -0700,2023-06-14 10:43:55 -0700,Links involving tracking info and/or redirects not working.,"<p>Suddenly I'm having issues clicking on links in emails that I get from known sources.  Some say the website is blocked (""This website is blocked due to your current protection level. Please contact your network administrator to gain access.""), others warn me about invalid certificates (and I ignore and proceed to, as I know the websites), but those pages never load.  I've tried everything in another browser, and they function flawlessly, so it's not my Watchguard firewall nor Windows settings.  I have the same issue sporadically clicking on email links in Outlook, so it's not only on links clicked IN Firefox (browser-based email).  I've completely disabled all the Enhanced Tracking Protection, but still, nothing.  I booted up another notebook, and it's exhibiting the exact same behavior (and that notebook doesn't have Norton on it to be an issue, (though I already have it completely disabled on the computer in question). </p><p>The tracking redirects that are causing me the post trouble are ""<a href=""http://trk.klclick1.com/ls/click?upn="" rel=""nofollow"">http://trk.klclick1.com/ls/click?upn=</a>..."" and ""<a href=""https://t.e2ma.net/click/"" rel=""nofollow"">https://t.e2ma.net/click/</a>..."" </p><p>As I mentioned, these are in emails from sources I get regularly.  One is a website that sells their own products, and the latter is for a content-oriented site.  The one that gave me problems from Outlook was news content, and (curiously enough), clicking on the image yielded the blocked site page, but clicking on the news heading beneath it got me through to the article in question, so I just figured it was an HTML email coding issue. </p>",desktop;other;windows-10;firefox-1140;firefox-11401;,firefox,other,en-US,1585462;,saigolives
1415872,2023-06-14 08:42:16 -0700,2023-06-14 11:33:12 -0700,Saturazione della RAM casuale,"<p>Salve a tutti, scrivo perchè sto avendo problemi con Firefox. Negli ultimi tempi, soprattutto casualmente, inizia a saturare la RAM: di 16GB di RAM, arriva a occuparne 11, diventando anche rallentatissimo, inutilizzabile; e un paio di volte è perfino crashato facendo riavviare anche dwm.exe. </p><p>Ho notato che ci sono pagine che possono farlo comportare in questo modo, come la Modalità Globo di Google Maps o Telegram Web, ma il comportamento comunque rimane casuale e inaspettato, non solo con queste pagine ma anche con pagine casualissime come un video su YouTube o anche questa pagina. </p><p>Il PC l'ho controllato con Sophos, Avast e Malwarebytes ed è pulito. Ho provato a ridurre il consumo di RAM attraverso about:memory come a controllare se ci fosse qualche estensione a causare questo comportamento attraverso il Task Manager di Firefox, ma non riesco a capirne il motivo, dato che mi segnala un consumo di RAM da parte di tutto il programma, e non di un singolo estensione/processo/pagina; al più so che a causare questo comportamento è qualche pagina ma comunque non trovo il motivo dato che poi riaprendo la stessa pagina il problema non si pone più. Dato che ho molte finestre aperte (ma non caricate), ho pensato potesse essere il Tree Style Tab, ma non ho prove a suffragio di questa tesi. </p><p>Qualcuno sa dirmi come posso risolvere questo problema? E' abbastanza fastidioso dover chiudere una pagina che mi serve per questo comportamento o anche solo privarmi di dover usare un sito per questo. </p>",desktop;fix-problems;windows-10;firefox-1140;,firefox,fix-problems,it,1585453;1585456;1585469;1585472;1585475;,jaikillingumsm
1415871,2023-06-14 08:34:28 -0700,2023-06-14 08:34:28 -0700,All videos not working (even when extensions are disabled),"<p>Hi there, </p><p>It's been a while now, but Firefox is not displaying any videos. Regardless of the website, Youtube or some other website, no video ever works. The sound works fine but there's no image, only a black screen. I tried disabling every extension however to no avail. Interestingly, I also use same privacy related extensions in Chrome (Adblock and Ghosterty) but Chrome works fine, no issues... </p><p>Any help is wanted, otherwhise I have to switch browsers&nbsp;:( </p>",desktop;windows-11;website-breakages;firefox-1140;firefox-11401;,firefox,website-breakages,en-US,"",a.brown1370
1415870,2023-06-14 08:11:01 -0700,2023-06-14 08:11:01 -0700,Links to PayPal dontbwork,"<p>Any website that has a PayPal option, I click on its button or icon and although Firefox opens a new tab (as I have it set to do), it stops loading after a couple seconds.  I open the same link in Safari or Chrome and it works fine.  It used to work in Firefox as well, up until a couple weeks ago.  I tried allowing pop up windows, but that didn’t fix the problem. </p>",desktop;tabs;,firefox,tabs,en-US,"",gregew
1415869,2023-06-14 07:08:04 -0700,2023-06-14 07:08:04 -0700,Input with Chinese language,<p>I was unable to input Chinese character on firefox webpage. No issue when using Chrome or Edge. </p><p>Appreciate help and solution. </p>,desktop;customize;windows-10;firefox-1140;firefox-11401;,firefox,customize,en-US,"",hlfzc
1415867,2023-06-14 06:48:02 -0700,2023-06-14 06:48:02 -0700,it's not important ror me heeee,<p>But may any person is sensitive to this attack </p>,desktop;download-and-install_1;,firefox,download-and-install,en-US,"",malekiemad
1415866,2023-06-14 06:44:27 -0700,2023-06-14 06:50:38 -0700,Difference in fonts/font size in Firefox 114 vs 113,"<p>Just updated to Firefox 114 from version 113 on Fedora 37 and spotted difference in the font rendering using the old profile. </p><p>On Firefox 114, the fonts are larger. I could not make it the same as in Firefox 113, despite all the configuration in the profile is the same. Downgrading to Firefox 113 return the previous font size/rendering. </p><p>However, in Firefox 114 there's a font difference even between my old profile and fresh new profile. The font configuration in the settings is exactly the same between these two profiles (default profile, Latin and Cyrillic — the same font families, sizes, checkboxes, i've even checked about:config options searching by ""font"" — all the same). </p><p>Check the screenshots. </p>",linux;desktop;customize;firefox-1140;,firefox,customize,en-US,1585421;,iam18
1415865,2023-06-14 06:43:10 -0700,2023-06-14 06:43:10 -0700,taraking,"<p>Tracking, grossly hacking </p>",desktop;customize;,firefox,customize,en-US,"",malekiemad
1415864,2023-06-14 06:37:30 -0700,2023-06-14 06:37:30 -0700,Search Results from Google Do Not Display,"<p>When I try to use Google, the results appear for a split second and then disappear, leaving me with just the ""shopping images etc."" bar on top and a blank screen after that. It started happening a few days ago. Occasionally, it does work, but it's glitching out more times than it works. </p>",desktop;mac-os-x-1015;website-breakages;firefox-1140;firefox-11401;,firefox,website-breakages,en-US,"",Little_Rat
1415863,2023-06-14 06:28:07 -0700,2023-06-14 06:28:07 -0700,calculator.swf,"<p>Every time I open my browser (Firefox Home page) an icon gets created on my desktop labeled ""calculator.swf""   The icon )image attached) cannot be opened. The Get Info for the icon says it has something to do with <a href=""http://www.terrence.com/flash/calculator.swf"" rel=""nofollow"">http://www.terrence.com/flash/calculator.swf</a> This all started about 6 weeks ago and I have no idea how to fix my startup (Settings, add-ons, extensions, etc.) to stop the icon being created. Firefox says my browser software is up to date. Any help would be appreciated... RKR </p>",desktop;other;mac-os-x-1014;firefox-1140;firefox-11401;,firefox,other,en-US,"",rkr943
1415862,2023-06-14 06:12:56 -0700,2023-06-14 06:12:56 -0700,Criar atalho rápido na página inicial do Firefox para desktop,<p>Como faço pra incluir um atalho rápido personalizado na tela inicial do Firefox para desktop? </p>,windows-7;desktop;bookmarks;firefox-1140;firefox-11401;,firefox,bookmarks,pt-BR,"",marcoswandenkolk
1415861,2023-06-14 05:40:00 -0700,2023-06-14 05:40:47 -0700,Forum Unreliable,"<p>Quite often when posting to this forum I'm met with an error message and the weariness of seeing many minutes of typing flushed down the drain. </p><p>I usually remember to compose in Notepad, which saves my bacon most of the time. Today I forgot and figured I might as well vent my frustrations in a constructive manner while I collect myself for typing round 2. </p>",desktop;other;windows-10;firefox-1140;,firefox,other,en-US,1585407;,Helmanfrow
1415860,2023-06-14 05:20:10 -0700,2023-06-14 05:37:31 -0700,"""Docutracks Signer"" extension stopped working after firefox update (114.0)","<p>Hello,  </p><p>We own an extension Docutracks Signer (<a href=""https://addons.mozilla.org/en-US/firefox/addon/docutracks-signer"" rel=""nofollow"">https://addons.mozilla.org/en-US/firefox/addon/docutracks-signer</a>) that is used to message a windows app.  After the 114.0 update it seems that the exe is never invoked to start.  We tried going back to previous versions and it works fine. Moreover we also updated to 114.0.1 and the problem still exists. We dont know what kind of additional info we need to provide you with, however we kindly request to help us on fixing the issue. </p><p>Kind regards, Docutracks Dev Team </p>",desktop;other;windows-11;firefox-1140;,firefox,other,en-US,1585406;,info9384
1415857,2023-06-14 04:38:20 -0700,2023-06-14 07:28:25 -0700,help get my bookmarks back,<p>my bookmarks are no longer there have bookmarked more than 250 bookmarks I want them back as well as fix folder in one drive bookmarks keep them there safely even deleted bookmarks I want back </p>,desktop;bookmarks;windows-10;firefox-1140;,firefox,bookmarks,en-US,1585401;1585429;,pgb0733284974
1415856,2023-06-14 04:13:31 -0700,2023-06-14 04:13:31 -0700,Remove the title bar in fullscreen mode (not just hide).,"<p>I want to remove (not just hide) the title bar in fullscreen mode, which pushes down the toolbar (tabs, search bar, etc), and want to keep the ""close, minimize, maximize button"" on the left-hand side of tabs in fullscreen mode. </p><p>Is there any useful code to put in `userChrome.css` to realize them? </p>",desktop;tips;mac-os-x-1015;firefox-1140;firefox-11401;,firefox,tips,en-US,"",n4659017382
1415855,2023-06-14 03:58:38 -0700,2023-06-14 08:40:26 -0700,Kullanıcı adı ve parolarım kayıt edilmiyor,"<p>bir siteye giriş yaptığımda kullanıcı adı ve parolamı yazdıktan sonra , kullanıcı adı ve şifre hatırlansın mı diye yazı çıkıyor.kaydet dememe rağmen parolarımı ve kullanıcı adlarımı kaydetmiyor. Ayarların ve yorumların hemen hemen hepsine baktım. Ayarlarım normal gözüküyor. </p>",desktop;privacy-and-security_1;windows-10;firefox-1140;firefox-11401;,firefox,privacy-and-security,tr,1585443;,feyziemin.dereci
1415854,2023-06-14 03:30:23 -0700,2023-06-14 03:32:46 -0700,Firefox opens new window when I open my editor(geany) or terminal program(terminator) How to stop this?,<p>See above Subject. </p>,linux;desktop;other;firefox-1140;firefox-11401;,firefox,other,en-US,1585400;,gbrown1
1415853,2023-06-14 03:14:27 -0700,2023-06-14 03:14:27 -0700,Gah. Your tab just crashed,<p>Getting Error </p>,desktop;fix-problems;windows-10;,firefox,fix-problems,en-US,"",gpcmssknagar
1415851,2023-06-14 03:08:20 -0700,2023-06-14 06:36:32 -0700,email,"<p>Buongiorno, ho scaricato l'ultima versione di Firefox e, come sempre, è apparsa la possibilità di sincronizzare il cellulare. L'ho fatto ma la mia casella di posta eletronica si è svuotata. Ho la necessità di ripristinare le cose come erano, cosa posso fare? Grazie </p>",desktop;sync;windows-10;firefox-1140;firefox-11401;,firefox,sync,it,1585404;1585412;1585420;,vvsp53
1415850,2023-06-14 01:51:39 -0700,2023-06-14 01:51:39 -0700,Uninstall extension with policies.json,"<p>I have an extension that has installation_mode set to force_installed at the policies.json file (at /Applications/Firefox.app/Contents/Resources/distribution/policies.json for macOs). I want to force the extension to remove from the browser (without any action from the end user). The extension id is 111 and by these templates: <a href=""https://mozilla.github.io/policy-templates/#extensions"" rel=""nofollow"">https://mozilla.github.io/policy-templates/#extensions</a>, I tried to modify the policies.json to be: { </p><pre> ""policies"": {    ""Extensions"": {      ""Uninstall"": [""111""]    }  } </pre> <p>} Doesn't seem to work (after this change, the extension can be removed, but only manually). What can I do? Same goes goes linux. </p><p>Thank you for you help! </p>",desktop;other;,firefox,other,en-US,"",guy.m
1415849,2023-06-14 01:50:40 -0700,2023-06-14 03:21:26 -0700,Adatta ad area stampabile,"<p>Dopo l'ultimo aggiornamento non mi funziona più l'adatta ad area stampabile, io stampo su foglio A6 in formato scontrino, la stampa dopo l'aggiornamento mi esce tutta a sinistra e non al centro del foglio. </p>",desktop;customize;windows-10;firefox-1140;,firefox,customize,it,1585396;1585398;,peppe91c
1415848,2023-06-14 01:48:23 -0700,2023-06-14 02:11:32 -0700,Non riesco ad entrate nella mia email,"<p>Salve , inserendo username e password , vai nella pagina ma non apre la email  la finestra dice&nbsp;: <a href=""http://login.virgilio.it/keycheck.php"" rel=""nofollow"">login.virgilio.it/keycheck.php</a> </p>",desktop;fix-problems;windows-10;firefox-1140;,firefox,fix-problems,it,1585395;,riccardo.tallini
1415845,2023-06-14 01:29:20 -0700,2023-06-14 01:29:20 -0700,Bold font not displayed,<p>Bold fonts are not properly displayed in some websites. Screenshots attached. Thanks </p>,desktop;other;mac-os-x-1015;firefox-1140;firefox-11401;,firefox,other,en-US,"",rigon.luca
