id,created,updated,title,content,tags,product,topic,locale,answers,creator
1403751,2023-01-30 04:39:45 -0800,2023-01-30 04:39:45 -0800,Configure navigation bar empty (without search box),"<p>Hello, </p><p>I need your help: how can I set navigation bar without any item (hide all items of this bar)? I need that this bar appears but empty. The reason is that I want to restrict options in Firefox (for all users) but let it be allowed open windows pop-up. </p><p>I got remove the menu button that is to the right of the whole (hamburger type), the forward and backward buttons that are to the left of the whole (which are the arrows to the right and to the left), the detention (which is the cross), etc. I did this with commands in userChrome.css file </p><p>But what I can't hide is the item where the url's are placed (search box). I just need to hide the search box. I wrote "" #nav-bar { visibility: collapse !important ; } "" in userChrome.css , and then all navigation bar is hidden but don't get windows of pop-up that I need them to appear. </p><p>The version of Firefox that I have is 108.0.1 (64 bits). </p><p>Could you help me, please? It's a little urgent. Thanks!! </p>",desktop;customize;windows-10;,firefox,customize,en-US,"",sergio_orishass
1403750,2023-01-30 04:31:23 -0800,2023-01-30 04:31:23 -0800,latest 109.0.1 firefox screw up wordpress editing page,<p>no display at wordpress editing page.......... </p>,desktop;windows-10;website-breakages;,firefox,website-breakages,en-US,"",CyberMania
1403749,2023-01-30 04:03:00 -0800,2023-01-30 09:40:47 -0800,portachiavi password,<p>mi viene richiesta una password chen non ho per portachiavi che non ho mai messo per il PCT. Urgente soluzione </p>,desktop;sync;mac-os-x-1014;firefox-1090;,firefox,sync,it,1562816;1562856;1562858;,paola.lagustena1502
1403748,2023-01-30 03:56:24 -0800,2023-01-30 03:56:24 -0800,The actual FireFox Bookmarks Toolbar doesn't match Bookmarks Toolbar when I open manage bookmarks,"<ol><li>1 When I open firefox there is a bookmarks toolbar displayed at the top. </li></ol> <ol><li>2 When I go Bookmarks &gt; Manage Bookmarks &gt; click Bookmarks Toolbar &gt; the bookmarks don't match what I see in the browser in #1 above.  </li></ol> <p>How do I fix this? </p><p>I uploaded a screen shot of the browser toolbar and the application bookmarks toolbar.  </p><p>Do you see that they are not the same in my attached image?  </p><p>The browser tool bar has PurpC after FamilyS. Application (in manage book marks) the bookmarks toolbar has LFTWeb after FamilyS. I want the browser to match what is in the application Bookmark Toolbar.  </p><p>I have turned sync off, that caused the issue in the first place. I had a recent saved bookmark file, that matches what is in the application, it is not updating the toolbar in the browser.  </p><p>Thanks, Stacey </p>",desktop;bookmarks;windows-10;firefox-1090;,firefox,bookmarks,en-US,"",wolframtech.cummings
1403747,2023-01-30 03:46:50 -0800,2023-01-30 03:46:50 -0800,How to reload Firefox bookmarks icons,"<p>Hi All my icons changed to a globe image yesterday. I don't know why. However, I discovered that if I opened a bookmark, the correct icon reappeared. With 30 bookmarks to work on, this seemed like a lot of time, BUT your can ""Open All Bookmarks in Tabs"" and if you wait long enough, all your icons will be restored to those which the websites supply. </p>",windows-7;desktop;bookmarks;firefox-1090;,firefox,bookmarks,en-US,"",j_mclay
1403746,2023-01-30 03:36:28 -0800,2023-01-30 03:36:28 -0800,Firefox browser hangs,"<p>The RAM of my device is about 4GB, which is not a lot, but the performance of the browser is very correct and fast, but in some cases, when loading pages, the browser freezes for a short moment, this is a bit annoying. The next problem in the web developer version is that the writing indicator is displayed everywhere in the browser, especially on the home page, when you click it, you need to disable this item on the home page. The browser is visible. Finally, the RAM consumption of the device needs to be optimized and slightly reduced </p>",desktop;beta;fix-problems;windows-10;firefox-1100;,firefox,fix-problems,en-US,"",mrnamdar10
1403744,2023-01-30 02:59:31 -0800,2023-01-30 02:59:31 -0800,login errors on facebook,"<p>Ever since upgrading to the latest browser (109.0) I cannot login into both of my facebook accounts. One works fine, but the other one, when I input the credentials, goes to the first account.  It only does this on firefox v 109.0. I tried them both using Opera, and they both work fine. What did you people do?  Are you saving my logins improperly?  If so, WHY??  Fix this problem or lose a very long time customer. </p>",desktop;other;windows-10;firefox-1090;,firefox,other,en-US,"",tlist809
1403742,2023-01-30 02:30:10 -0800,2023-01-30 02:30:10 -0800,Is there any way to group tabs?,"<p>Hey, guys! </p><p>Does Firefox provides us with an option to group the tabs. I tried finding it in Firefox Tab's content menu and Settings but couldn't. I tried the Simple Tab Groups add-on but didn't like it. I want to groups the tabs and want them in the tabs section just like How Google Chrome does it? </p><p>Thanks! </p>",desktop;tabs;mac-os-x-1015;firefox-1080;firefox-10801;,firefox,tabs,en-US,"",bhaveshrawat
1403738,2023-01-30 01:46:52 -0800,2023-01-30 01:46:52 -0800,Password sign in not accepted,<p>All the time it asks for my primary password but does not accept it.  I have changed it numerous times but it does not register. It does log me in here though. What is going on?  Is there another primary password somewhere? </p>,desktop;privacy-and-security_1;windows-11;firefox-1090;,firefox,privacy-and-security,en-US,"",kineticduck
1403737,2023-01-30 01:29:18 -0800,2023-01-30 01:29:18 -0800,what's missing,<p>How do Iog in </p>,desktop;customize;,firefox,customize,en-US,"",marquish
1403735,2023-01-30 01:00:24 -0800,2023-01-30 01:05:10 -0800,Firefox wont open file browser via websites,"<p>This relates to <a class=""new"" href=""/en-US/kb/new?title=Firefox+wont+open+file+browser+via+websites"" rel=""nofollow"" title=""Page does not exist."">this issue</a>  </p><p>I found a batter way to solve that problem. </p><p>You should install or reinstall one of the packages xdg-desktop-portal* List them on Ubuntu with: </p><pre> ```apt list | grep desktop-portal``` </pre> <p>And try to install: </p><pre> ```sudo apt-get install xdg-desktop-portal-gnome``` </pre> <p>or reinstall: </p><pre> ```sudo apt-get --reinstall install xdg-desktop-portal-gnome``` </pre> <p>It seems you need to rerun DBus to apply changes, but I just restarted my PC. </p><p>If xdg-desktop-portal-gnome won't help then try to install/reinstall  xdg-desktop-portal-gtk and xdg-desktop-portal. </p>",linux;desktop;fix-problems;firefox-1090;,firefox,fix-problems,en-US,1562778;,kirik516
1403734,2023-01-30 00:59:49 -0800,2023-01-30 00:59:49 -0800,Firefox Bookmarks Bar,"<p>Hello, </p><p>I have recently been having difficulties with my Firefox Bookmark bar at the top of the screen. </p><p>The addresses change and I cannot use them.  They look different.  I just updated them a day ago and  they've already gone back to this look and don't work anymore. </p><p>Please see screenshot. </p><p>Thank you. </p>",desktop;bookmarks;windows-10;firefox-1090;,firefox,bookmarks,en-US,"",efjacobson
1403733,2023-01-30 00:52:32 -0800,2023-01-30 02:55:40 -0800,Connessione interrotta: potenziale rischio per la sicurezza,"<p>Da circa 10 giorni non riesco ad aprire siti a cui accedevo normalmente perchè mi appare la pagina di connessione interrotta ""Firefox ha rilevato una potenziale minaccia per la sicurezza e interrotto la connessione con xxxxxxx in quanto è possibile collegarsi a questo sito solo in modo sicuro. Sto utilizzando la versione 109.0  su Windows10. Grazie se potrete aiutarmi a risolvere il problema M.Peloni </p>",desktop;windows-10;website-breakages;firefox-1090;,firefox,website-breakages,it,1562788;,maxpeloni
1403732,2023-01-30 00:26:29 -0800,2023-01-30 00:26:29 -0800,Glitching of text on all tabs,"<p>My Firefox keeps doing weird glitches and I recently updated to a Windows 11 laptop, instead of using a windows 10 one, and both have had the same issue with this glitch.  </p><p>I'm unsure what to do- and as shown in the attached screenshot all text has been all messed up and it with all tabs and not just a singular one and I'm unsure what to do besides restart my computer.  </p><p>I've allowed all stuff so hopefully this can help someone with answering this. </p>",desktop;fix-problems;windows-11;firefox-1090;,firefox,fix-problems,en-US,"",Nekokaburi_
1403730,2023-01-29 23:11:47 -0800,2023-01-29 23:11:47 -0800,Firefox Browser vertion-109,"<p>Dear Concern, </p><p>We are using Mozilla Firefox Browser Ver.-109 But facing some problems. show barcode label on browser is ok but after print/pdf when large view in  barcode label area. please find the attached file. </p>",desktop;fix-problems;windows-11;firefox-1090;,firefox,fix-problems,en-US,"",mdrazz44
1403727,2023-01-29 21:45:11 -0800,2023-01-30 00:36:25 -0800,why can't I delete bookmarks?,"<p>Every time I try and delete bookmarks my firefox locks up. I have 3,500 bookmarks I need to delete and can't. If I can't delete them I will just delete firefox and use chrome </p>",desktop;bookmarks;windows-10;firefox-1090;,firefox,bookmarks,en-US,1562776;,mcoon99
1403726,2023-01-29 21:44:47 -0800,2023-01-29 23:06:32 -0800,Twitter embedds are not showing in Firefox,"<p>Websites with embedded twitter images are not showing.  For example, <a href=""https://www.si.com/nfl/2023/01/30/joseph-ossai-personal-foul-patrick-mahomes-debate"" rel=""nofollow"">https://www.si.com/nfl/2023/01/30/joseph-ossai-personal-foul-patrick-mahomes-debate</a> does not show the embeds.  If viewed on Google Chrome, they can be seen </p>",desktop;windows-10;website-breakages;firefox-1090;,firefox,website-breakages,en-US,1562769;,knorwitz
1403721,2023-01-29 19:38:55 -0800,2023-01-29 19:38:55 -0800,school,<p>Jivraj@1989 </p>,desktop;other;,firefox,other,en-US,"",jivrajjaygoga
1403720,2023-01-29 18:36:24 -0800,2023-01-29 20:50:33 -0800,Random Crashes,"<p>Here is one of my crash IDs: bp-f9625951-7706-43b0-8a7f-6f0ae0230129 </p><p>Since dealing with an issue with my laptop running Linux Mint 20.3 Cinnamon 64-bit involving a mergelist error and packages with missing names, Firefox randomly crashes. Sometimes when it crashes it does it immediately every time I try to open it back up (sometimes even in safe mode), and other times it gets better after a reboot. I just installed the Flatpack version after the original one I had started crashing, so it is strange if it is an issue that just needs reinstalling Firefox, but other apps seem ok so I don't know that it's my OS. </p><p>I've tried looking for residual damage on my laptop after the earlier issue, but I can't find much information. System Reports tells me nothing is wrong and I can't make sense of syslogs. </p><p>Thank you for reading, I wish I had more details. If the crash report has any clues, please let me know. </p>",linux;desktop;fix-problems;firefox-1090;,firefox,fix-problems,en-US,1562759;1562761;,uraneaumbre
1403719,2023-01-29 18:35:54 -0800,2023-01-29 19:49:21 -0800,The page isn’t redirecting properly,"<p>I've started getting this error message on certain websites (always the same ones): </p><p><em><strong>The page isn’t redirecting properly</strong> </em> </p><p>An error occurred during a connection to <a href=""http://www.manek.org.uk"" rel=""nofollow"">www.manek.org.uk</a>. </p><pre>   This problem can sometimes be caused by disabling or refusing to accept cookies. </pre> <p><em> </em> The same websites still work fine on Firefox mobile, so it's nothing inherent in the sites themselves. </p><p>I have only noticed this in the last few days. I had just updated Firefox to version 109 – but it's not specific to one version of Firefox either, as I tried on one of my Macs which hadn't updated yet and is still on version 107, and the issue was replicated exactly the same. </p><p>I have tried clearing the cache, restarting Firefox, etc. </p><p>Can anyone help me resolve this? Some of these are websites I use quite a lot for my work, and it's frustrating to have to do anything just on my phone. </p>",desktop;fix-problems;mac-os-x-1014;firefox-1090;,firefox,fix-problems,en-US,1562752;1562754;1562755;1562756;1562758;,mail1276
1403718,2023-01-29 18:17:44 -0800,2023-01-29 18:59:41 -0800,cross OS download,"<p>i'm using linux, and want a windows 10 version of ff for my wine program,whos old IE is no longer supported.. </p>",linux;desktop;download-and-install_1;firefox-1090;,firefox,download-and-install,en-US,1562750;,bytemagister7
1403717,2023-01-29 18:10:42 -0800,2023-01-29 19:47:16 -0800,bookmarks toolbar icons and tabs,"<p>I have been using FireFox from the beginning, and it is still my browser of choice. Nonetheless, I still see some ways in which the interface would be better. In the long past, I'd been able to put some XML/XUL CSS code in userchrome.css to make these better, at least for me. However, 5-10 years ago, changes in FireFox broke these changes. For the past 5-10 years, I would occasionally get some time to tweak my userchrome.css with information find on this forum or elsewhere online. But every time I found some code snippets, FireFox had changed enough that they didn't work anymore. This is concerning in that the structure and codebase is changing relatively frequently and it's hard to find out how this affects these code snippets. </p><p>The two userchrome tweaks i would really like are (a) showing only icons on the bookmarks toolbar, and (b) having the tabs right next to the main window. </p><p>Full disclosure: I am not an IT professional, but I started off coding in machine code and only then was allowed to code in A86 assembler. I have had a long interest in user interaction design. I'm a physician and medical school professor, so my interest is primarily in medical software. But I've helped organize some international symposia on the usability of medical software at which I have also lectured, have a blog devoted to the subject, and I was awarded the first annual Lifetime Achievement Award by the Informatics Section of the American College of Emergency Physicians. </p><p>So, now for an observation. I have a file cabinet drawer filled with paper records that I need to keep in paper form (as opposed to my usual scanning to PDF. These papers are sorted into file folders. I do not cut the tabs off of all of my folders and put them in a pile somewhere else. Which is why I want my tabs to visually connect to the content in each ""folder"" by being next to them. </p><p>And as far as the Bookmarks Toolbar: I realize the importance of positional memory. I want to have my most important bookmarks on the screen – lots of them – where I can click on them easily. Easily in this case means not having to read text, but being able to automatically move my mouse cursor to about the right place and then refine my click by recognizing the graphic icon for that website.  </p><p>The best solution would be for the fireFox coders to think about these things, come around to my way of thinking (which OBVIOUSLY has to be right), and make changes in the codebase to make observe these UX principles, and make the appropriate changes in the user interface. Or at least make them options in the user interface. Or at the very least, post in an obvious place changes to the underlying structure that kills userchrome coding (with suggestions how to change the code to work in the new architecture) so that those who are not immersed in the innards of FireFox like me have a fighting chance to improve the interface, at least for a few of us. </p><p>&lt;/soapbox&gt; </p>",desktop;customize;windows-10;firefox-1090;,firefox,customize,en-US,1562757;,kconovermd
1403716,2023-01-29 18:08:47 -0800,2023-01-29 19:29:07 -0800,extensions do not appear,"<p>Hello </p><p>I used to be able to select my an extension to use, from the puzzle piece icon. </p><p>I now can no longer see any extensions, when I click on the puzzle piece icon. </p><p>When I ""manage"" my extensions, all the the extensions I downloaded are present and active. </p><p>Any Ideas? </p><p>THANKS, Mauro </p>",desktop;other;windows-10;firefox-1090;,firefox,other,en-US,1562753;,8ernus
1403715,2023-01-29 17:54:07 -0800,2023-01-29 17:54:07 -0800,Rejected URL,"<p>I had two replies to this question the other day but neither response works. </p><p>I have had one of my accounts not work on Firefox lately.  It has worked for years and now, over the last 2 months, it will not connect. I get this message back with about 25 different numbers. The requested URL was rejected.  Consult the administrator. I am not teck savy and have not been able to fix this. </p>",desktop;other;windows-11;firefox-1090;,firefox,other,en-US,"",shewy
1403714,2023-01-29 16:47:28 -0800,2023-01-30 02:33:15 -0800,update 109.0,"<p>After updating to 109.0 Firefox won't open on primary monitor. I have moved it, closed it, but it restarts back on secondary monitor. After I move it to primary monitor, if I open another browser window it opens on the primary. I have renamed the xulstore.json file(so it creates a new one) but that did not help. It was working fine before the 109.0 update. I also have chrome installed and it works fine the way it should, so I'm thinking it is a Firefox 109.0 problem. </p>",desktop;other;windows-10;firefox-1090;,firefox,other,en-US,1562742;1562746;1562783;,jstrunk1
