id,created,updated,title,content,tags,product,topic,locale,answers,creator
1560785,2026-01-17 12:51:50 -0800,2026-01-17 12:51:50 -0800,Firefox always shows Windows 10 but I use Windows 11,<p>Maybe that's at the root of the problem I'm constantly having with my history &amp; bookmarks being unavailable every time Windows updates? The strange thing is that this page shows that Firefox does know I'm using 11.  </p><p>I've already posed the question I have about resolving that matter. Hope this helps someone figure out the answer. Thanks to whoever tries! </p>,firefox-14701;firefox-1470;windows-11;firefox;recover-data;,firefox,recover-data,en-US,"",nmbourne
1560784,2026-01-17 12:50:35 -0800,2026-01-17 12:50:35 -0800,Some Some text in English after update from 146 to 147 for newly created users,"<p>Sirs, </p><p>I have Linux Mint 22.3 Cinnamon in Swedish language/locale. I set up two users with Firefox 146. Then, I upgraded Firefox to 147.0, and set up a third user on the same machine. </p><p>For the two original users, the Firefox is in all-Swedish locale. Perfect. But, for my newly created user, some is in English. Examples in English; Onboarding, Search in Privacy, and New Tab/Shortcuts. Web pages is no problem. The problem is in Firefox proper.  </p><p>Strangely, New Tab is in Swedish (Ny flik), if I do not use the shortcuts, i.e. chose Empty new page in Settings. How to fix? Minor annoyance, but I would like everything in Swedish, as in v. 146. Is it a bug that will be fixed by Mozilla, or do I have to do anything to fix it myself, or is it un-fixable? Or, is it maybe anything in Linux? I understand it is some changes between 146 and 147 regarding a couple of rather important things. Thanks. &gt;&gt;&gt; System: </p><pre> Kernel: 6.14.0-37-generic arch: x86_64 bits: 64 compiler: gcc v: 13.3.0 clocksource: tsc  Desktop: Cinnamon v: 6.6.5 tk: GTK v: 3.24.41 wm: Muffin v: 6.6.2 vt: 7 dm: LightDM v: 1.30.0    Distro: Linux Mint 22.3 Zena base: Ubuntu 24.04 noble </pre> <p>Machine: </p><pre> Type: Desktop System: HP product: HP ProDesk 600 G2 SFF v: N/A serial: &lt;superuser required&gt;    Chassis: type: 4 serial: &lt;superuser required&gt;  Mobo: HP model: 805D v: KBC Version 05.39 serial: &lt;superuser required&gt; part-nu: P1H12EA#UUW    uuid: &lt;superuser required&gt; UEFI: HP v: N02 Ver. 02.60 date: 12/15/2022 </pre> <p>CPU: </p><pre> Info: quad core model: Intel Core i5-6500 bits: 64 type: MCP smt: &lt;unsupported&gt; arch: Skylake-S    rev: 3 cache: L1: 256 KiB L2: 1024 KiB L3: 6 MiB  Speed (MHz): avg: 2600 high: 2602 min/max: 800/3200 cores: 1: 2602 2: 2600 3: 2600 4: 2600    bogomips: 25599  Flags: avx avx2 ht lm nx pae sse sse2 sse3 sse4_1 sse4_2 ssse3 vmx </pre> <p>Graphics: </p><pre> Device-1: Intel HD Graphics 530 vendor: Hewlett-Packard driver: i915 v: kernel arch: Gen-9 ports:    active: HDMI-A-1 empty: DP-1, DP-2, DP-3, HDMI-A-2 bus-ID: 00:02.0 chip-ID: 8086:1912    class-ID: 0300  Display: x11 server: <a href=""http://X.Org"" rel=""nofollow"">X.Org</a> v: 21.1.11 with: Xwayland v: 23.2.6 driver: X: loaded: modesetting    unloaded: fbdev,vesa dri: iris gpu: i915 display-ID:&nbsp;:0 screens: 1  Screen-1: 0 s-res: 1920x1080 s-dpi: 96 s-size: 508x285mm (20.00x11.22"") s-diag: 582mm (22.93"")  Monitor-1: HDMI-A-1 mapped: HDMI-1 model: Dell U2311H serial: &lt;filter&gt; res: 1920x1080 hz: 60    dpi: 96 size: 509x286mm (20.04x11.26"") diag: 584mm (23"") modes: max: 1920x1080 min: 720x400  API: EGL v: 1.5 hw: drv: intel iris platforms: device: 0 drv: iris device: 1 drv: swrast gbm:    drv: iris surfaceless: drv: iris x11: drv: iris inactive: wayland  API: OpenGL v: 4.6 compat-v: 4.5 vendor: intel mesa v: 25.0.7-0ubuntu0.24.04.2 glx-v: 1.4    direct-render: yes renderer: Mesa Intel HD Graphics 530 (SKL GT2) device-ID: 8086:1912  API: Vulkan v: 1.3.275 layers: 3 surfaces: xcb,xlib device: 0 type: integrated-gpu driver: N/A    device-ID: 8086:1912 device: 1 type: cpu driver: N/A device-ID: 10005:0000 </pre> <p>Audio: </p><pre> Device-1: Intel 100 Series/C230 Series Family HD Audio vendor: Hewlett-Packard    driver: snd_hda_intel v: kernel bus-ID: 00:1f.3 chip-ID: 8086:a170 class-ID: 0403  API: ALSA v: k6.14.0-37-generic status: kernel-api  Server-1: PipeWire v: 1.0.5 status: active with: 1: pipewire-pulse status: active    2: wireplumber status: active 3: pipewire-alsa type: plugin </pre> <p>Network: </p><pre> Device-1: Intel Ethernet I219-LM vendor: Hewlett-Packard driver: e1000e v: kernel port: N/A    bus-ID: 00:1f.6 chip-ID: 8086:15b7 class-ID: 0200  IF: eno1 state: up speed: 1000 Mbps duplex: full mac: &lt;filter&gt; </pre> <p>Drives: </p><pre> Local Storage: total: 473.23 GiB used: 26.22 GiB (5.5%)  ID-1: /dev/sda vendor: Samsung model: SSD 860 EVO 250GB size: 232.89 GiB speed: 6.0 Gb/s    tech: SSD serial: &lt;filter&gt; fw-rev: 3B6Q scheme: GPT  ID-2: /dev/sdb vendor: Samsung model: SSD 860 EVO 250GB size: 232.89 GiB speed: 6.0 Gb/s    tech: SSD serial: &lt;filter&gt; fw-rev: 3B6Q scheme: MBR  ID-3: /dev/sdc vendor: SanDisk model: Cruzer Blade size: 7.45 GiB type: USB rev: 2.0    spd: 480 Mb/s lanes: 1 tech: N/A serial: &lt;filter&gt; fw-rev: 2.01 scheme: MBR </pre> <p>Partition: </p><pre> ID-1: / size: 227.68 GiB used: 26.22 GiB (11.5%) fs: ext4 dev: /dev/sda2  ID-2: /boot/efi size: 511 MiB used: 6.1 MiB (1.2%) fs: vfat dev: /dev/sda1 </pre> <p>Swap: </p><pre> ID-1: swap-1 type: file size: 2 GiB used: 0 KiB (0.0%) priority: -2 file: /swapfile </pre> <p>USB: </p><pre> Hub-1: 1-0:1 info: hi-speed hub with single TT ports: 16 rev: 2.0 speed: 480 Mb/s lanes: 1    chip-ID: 1d6b:0002 class-ID: 0900  Device-1: 1-3:2 info: Dell KB212-B Quiet Key Keyboard type: keyboard driver: hid-generic,usbhid    interfaces: 1 rev: 1.1 speed: 1.5 Mb/s lanes: 1 power: 100mA chip-ID: 413c:2107 class-ID: 0301  Device-2: 1-6:3 info: MosArt Wireless Keyboard/Mouse type: keyboard,mouse    driver: hid-generic,usbhid interfaces: 2 rev: 1.1 speed: 12 Mb/s lanes: 1 power: 100mA    chip-ID: 062a:4101 class-ID: 0301  Device-3: 1-9:4 info: SanDisk Cruzer Blade type: mass storage driver: usb-storage interfaces: 1    rev: 2.0 speed: 480 Mb/s lanes: 1 power: 200mA chip-ID: 0781:5567 class-ID: 0806 serial: &lt;filter&gt;  Hub-2: 2-0:1 info: super-speed hub ports: 8 rev: 3.0 speed: 5 Gb/s lanes: 1 chip-ID: 1d6b:0003    class-ID: 0900 </pre> <p>Sensors: </p><pre> System Temperatures: cpu: 27.0 C pch: 30.5 C mobo: N/A  Fan Speeds (rpm): N/A </pre> <p>Repos: </p><pre> Packages: pm: dpkg pkgs: 2006  No active apt repos in: /etc/apt/sources.list  Active apt repos in: /etc/apt/sources.list.d/official-package-repositories.list    1: deb https: //<a href=""http://mirror.accum.se/mirror/linuxmint.com/packages"" rel=""nofollow"">mirror.accum.se/mirror/linuxmint.com/packages</a> zena main upstream import backport    2: deb http: //<a href=""http://ftp.acc.umu.se/ubuntu"" rel=""nofollow"">ftp.acc.umu.se/ubuntu</a> noble main restricted universe multiverse    3: deb http: //<a href=""http://ftp.acc.umu.se/ubuntu"" rel=""nofollow"">ftp.acc.umu.se/ubuntu</a> noble-updates main restricted universe multiverse    4: deb http: //<a href=""http://ftp.acc.umu.se/ubuntu"" rel=""nofollow"">ftp.acc.umu.se/ubuntu</a> noble-backports main restricted universe multiverse    5: deb http: //<a href=""http://security.ubuntu.com/ubuntu/"" rel=""nofollow"">security.ubuntu.com/ubuntu/</a> noble-security main restricted universe multiverse </pre> <p>Info: </p><pre> Memory: total: 24 GiB available: 23.35 GiB used: 2.21 GiB (9.5%)  Processes: 256 Power: uptime: 11h 28m states: freeze,mem,disk suspend: deep wakeups: 0    hibernate: platform Init: systemd v: 255 target: graphical (5) default: graphical  Compilers: gcc: 13.3.0 Client: Unknown python3.12 client inxi: 3.3.34 </pre> <p>&lt;&lt;&lt; Sincerely. Ronny </p>",firefox-1470;firefox;languages;,firefox,languages,en-US,"",knaber65
1560782,2026-01-17 12:24:22 -0800,2026-01-17 12:24:22 -0800,firefox,<p>i do not know at this time </p>,firefox-1270;windows-10;firefox;passwords-and-sign-in;,firefox,passwords-and-sign-in,en-US,"",wcgreen56
1560780,2026-01-17 12:20:39 -0800,2026-01-17 12:20:39 -0800,chi vedrà i miei dati,<p>Chi vedrà i miei dati di navigazione? </p>,firefox;privacy-and-security_1;,firefox,privacy-and-security,it,"",metallando
1560779,2026-01-17 12:10:39 -0800,2026-01-17 12:10:39 -0800,White popup.,<p>This just started today.  It's in the way of the screen.  Info it gives already get through a different protocol </p>,firefox;undefined;,firefox,undefined,en-US,"",mkey11
1560777,2026-01-17 12:07:12 -0800,2026-01-17 12:07:12 -0800,Ibrar welfare organization,<p>Yay for you guys to come in and get it </p>,firefox;accounts;,firefox,accounts,en-US,"",ibrarkhan442411
1560772,2026-01-17 11:16:21 -0800,2026-01-17 11:16:21 -0800,Difficulty with BT internet e-mail account using Firefox as browser,<p>Cannot use contacts from my BT e-mail account to send e-mail They link up and appear but then turn red with a x </p>,firefox;web-compatibility;,firefox,web-compatibility,en-US,"",xxvygrr7nm
1560771,2026-01-17 11:08:19 -0800,2026-01-17 11:08:19 -0800,Filterbalk,<p>Ik hoor vaak dat je gecopieerde text in de filterbalk van Firefox moet plakken. Waar zit nu  in firefox de filterbalk? </p>,firefox;search;,firefox,search,nl,"",agricola05
1560770,2026-01-17 10:55:15 -0800,2026-01-17 10:55:15 -0800,cannot type anything in firefox 147 linux mint 22.3,"<p>On updating to linux mint 22.3 - cannot type anything in firefox in address box, search and primary password or anywhere else within firefox - have uninstalled &amp; reinstalled but nothing happens </p>",firefox;app-responsiveness;,firefox,app-responsiveness,en-US,"",sbrhoden
1560769,2026-01-17 10:42:33 -0800,2026-01-17 10:42:33 -0800,what causes the system to be slow,<p><em><strong>bold text</strong></em> </p>,firefox-1470;windows-11;firefox;backup-recovery-and-sync;,firefox,backup-recovery-and-sync,en-US,"",majoriemaila
1560767,2026-01-17 10:39:32 -0800,2026-01-17 10:39:32 -0800,truck,<p>like to see my truck loan </p>,firefox-1150;windows-7;firefox;accounts;,firefox,accounts,en-US,"",simpsonmark861
1560763,2026-01-17 10:16:38 -0800,2026-01-17 11:31:30 -0800,PDF Editor,<p>How do I get the Fox PDF editor? </p>,firefox-1470;mac-os-x-1015;firefox;settings;,firefox,settings,en-US,1794511;,doerr.bob
1560762,2026-01-17 10:12:57 -0800,2026-01-17 10:49:39 -0800,How do I undo a firefox refresh to get extensions back?,<p>How do I undo a firefox refresh to get extensions back? </p>,firefox-14701;firefox-1470;windows-11;firefox;extensions;,firefox,extensions,en-US,1794504;,jols323
1560761,2026-01-17 10:11:17 -0800,2026-01-17 10:51:14 -0800,undo a refresh,<p>undo a refresh to save extensions </p>,firefox-14701;firefox-1470;windows-11;firefox;extensions;,firefox,extensions,en-US,1794505;,jols323
1560760,2026-01-17 10:03:01 -0800,2026-01-17 10:03:01 -0800,Nice browser,<p>Nice and easy browsing </p>,firefox-600;windows-10;firefox;browse;,firefox,browse,en-US,"",Khurram.mohammadi
1560758,2026-01-17 09:58:14 -0800,2026-01-17 09:58:14 -0800,unable to add pages or tabs to bookmark tab,<p>'Trying to use bookmark toolbar but cannot use drag and drop to place a new page in the toolbar </p>,firefox-1470;windows-11;firefox;bookmarks;,firefox,bookmarks,en-US,"",mkulick2000
1560756,2026-01-17 09:28:40 -0800,2026-01-17 10:25:40 -0800,Private Browsing,<p>How erase browsing history last 4 hours? </p>,firefox;history;,firefox,history,en-US,1794497;,ian.mclennan
1560755,2026-01-17 09:12:36 -0800,2026-01-17 09:12:36 -0800,Mecanismo de pesquisa da Mozilla,<p>A Mozilla não possui seu próprio mecanismo de pesquisa? </p>,firefox-1420;windows-10;firefox;search;,firefox,search,pt-BR,"",ja562022kk
1560754,2026-01-17 09:04:17 -0800,2026-01-17 11:33:59 -0800,Is Firefox secure to use,"<p>Hello... I'm just a novice user so I am not really sure here. This is my problem, I tried to view my gmail account and I got the pic in post. I'm not sure what to think, I like to know if it's secure to use Firefox? I'm using Windows 11 all up to date and Firefox 147.01 ... extensions &gt;&gt; uBlock, Chrome Mask, Ghostery Tracker &amp; Ad Blocker, Privacy Badger </p>",firefox-1470;windows-10;firefox;browser-security;,firefox,browser-security,en-US,1794513;,GoogleSucks
1560753,2026-01-17 09:03:43 -0800,2026-01-17 09:03:43 -0800,installare app,"<p>Coen installare app su altro telefono , esempio di mio figlio </p>",firefox;accessibility;,firefox,accessibility,it,"",porrini.manuela
1560748,2026-01-17 08:42:33 -0800,2026-01-17 12:06:21 -0800,disable search engine,"<p>This is the 3rd time I have had to post this. I am getting very frustrated.  I DO NOT want the search engine within my address bar. Nothing anyone from you ""community"" helped to disable the search engine in my address bar. Opera, Edge, Chrome, the user can disable the search engine in the address bar. Why is Firefox so different? And difficult? </p>",firefox;search;needsinfo;,firefox,search,en-US,1794470;1794518;1794521;1794524;,marcellaolejniczak
1560747,2026-01-17 08:42:03 -0800,2026-01-17 08:42:03 -0800,e pass portal,<p>passportethiopia </p>,firefox-1190;windows-10;firefox;accounts;,firefox,accounts,en-US,"",digotube9
1560746,2026-01-17 08:40:24 -0800,2026-01-17 08:40:24 -0800,not open file pdf,<p>This file not open </p>,firefox-1460;linux;pdfs;,firefox,pdfs,en-US,"",riyaztraders1
1560745,2026-01-17 08:40:23 -0800,2026-01-17 08:40:23 -0800,eowlmsi,<p>yesbiyewalew </p>,firefox-1190;windows-10;firefox;accounts;,firefox,accounts,en-US,"",digotube9
1560744,2026-01-17 08:25:03 -0800,2026-01-17 09:31:34 -0800,xHamster or Pornhub?,"<p>Why can't I access xHamster, Pornhub or other porn sites? </p>",firefox-14601;firefox-1460;mac-os-x-1015;firefox;blocked-application-service-website;,firefox,blocked-application-service-website,en-US,1794484;,jeffreyaltshuler
1560743,2026-01-17 08:23:36 -0800,2026-01-17 08:23:36 -0800,"""Checking for Updates"" keeps running while I'm working","<p>Hello, Within the past hour, ""Checking for Updates"" keeps running. I thought checking ""choose to install"" would limit the numerous times this happens per day, but it hasn't.  </p><p>I've been experiencing this for a couple weeks and it's getting worse. I'm not sure what's going on. </p><p>I'm running Windows 11 and the last FF Mozilla update was #147.01.  </p><p>Please advise. </p><p>Thank you, Gina </p>",firefox-1470;windows-10;firefox;update;,firefox,update,en-US,"",ginad2171
1560742,2026-01-17 08:16:58 -0800,2026-01-17 08:16:58 -0800,Segnalibri.,"<p>salve, sono spariti tutti i segnalibri ... </p>",firefox-14701;firefox-1470;windows-10;firefox;recover-data;,firefox,recover-data,it,"",pnicob
1560741,2026-01-17 08:16:40 -0800,2026-01-17 08:16:40 -0800,Firefox isn't loading tab favicons after Windows reinstall,<p>Due to a drive failure I had to do a fresh Windows install. Since then my Firefox has not been loading tab favicons for the tabs from my previous session when I launch it. They do not display until I click on each individual tab. I have tried poking around in about:config and turned off several lazy loading functions but nothing has fixed it. <strong>browser.sessionstore.restore_tabs_lazily</strong> and <strong>browser.sessionstore.restore_on_demand</strong> are both <strong>false</strong> with no effect on this behavior. </p><p>Any ideas for how to fix this? </p>,firefox-14601;firefox-1460;windows-11;firefox;tabs;,firefox,tabs,en-US,"",baconbeagle
1560739,2026-01-17 08:14:44 -0800,2026-01-17 08:14:44 -0800,primary password on startup,"<p>Firefox is now asking for primary password every time it starts, even before any site that required a sign-in.  This just started.  How can I stop this annoyance, but still keep the primary password for sign-ins? </p>",firefox-14701;firefox-1470;windows-11;firefox;primary-password;,firefox,primary-password,en-US,"",myfx
1560738,2026-01-17 08:14:16 -0800,2026-01-17 08:14:16 -0800,marijuana makes me feel sadness,<p>makes me feel scared a lot by summersies . </p>,firefox-14701;firefox-1470;windows-11;firefox;browse;,firefox,browse,pt-BR,"",brucewayneimnotbatman8
1560737,2026-01-17 08:12:09 -0800,2026-01-17 08:12:09 -0800,Auswahlliste anpassen,"<p>Wie kann ich die Auswahlliste anpassen die immer dann erscheint, wenn man mit dem Cursor in das Adressfeld geht. Vielen Dank für Hilfe. </p>",firefox-1470;windows-10;firefox;search-suggestions;,firefox,search-suggestions,en-US,"",dieter.ldot
1560736,2026-01-17 08:09:01 -0800,2026-01-17 10:40:12 -0800,Edit e-mail,<p>How do I edit my e-mail address to a new one?  I have to change all my accounts due to my current e-mail provider retiring their domain and switching to a new one. </p>,firefox-14701;firefox-1470;windows-11;firefox;edit-account-details;,firefox,edit-account-details,en-US,1794502;,jtallent
1560735,2026-01-17 07:51:52 -0800,2026-01-17 07:51:52 -0800,Backup,<p>My WhatsApp details </p>,firefox-680;linux;firefox;backup-recovery-and-sync;,firefox,backup-recovery-and-sync,en-US,"",sammyolandoh
1560734,2026-01-17 07:46:18 -0800,2026-01-17 07:46:18 -0800,I can't use firefox on my computer anymore.,"<p>I am not able to use Mozilla Firefox on my computer. It's the only browser I have been using. When I tried logging in today, I got a pop up the said: 147.0.1 is not compatible with min version 147.0, max version 147.0.  Try to reinstall. I reinstalled but no luck. Please help. I need my bookmarks. </p>",windows-11;firefox;install-failure;,firefox,install-failure,en-US,"",evapeachjuse
1560733,2026-01-17 07:45:48 -0800,2026-01-17 08:10:44 -0800,why did my firefox browser stop loading x.com?,"<p><a href=""http://x.com"" rel=""nofollow"">x.com</a> won't load on firefox anymore but it does on edge, why? </p>",firefox-1470;windows-10;firefox;web-compatibility;,firefox,web-compatibility,en-US,1794456;1794461;,gandmk
1560732,2026-01-17 07:41:27 -0800,2026-01-17 08:08:25 -0800,my firefox browser is not working when I search on firefox,<p>tell me why </p>,firefox-1470;mac-os-x-1015;firefox;search;,firefox,search,en-US,1794457;,atmananda
1560731,2026-01-17 07:39:35 -0800,2026-01-17 08:09:06 -0800,A firefox upgrade was offered I chose to apply it - now my firefox screen with all my icons that I use is gone,<p>my firefox screen with all my icons that I use is gone. I now have some generic screen which I do not want. How do I get my old screen back? </p>,firefox-14701;firefox-1470;windows-11;firefox;new-tab;,firefox,new-tab,en-US,1794458;,krich17
1560728,2026-01-17 07:25:28 -0800,2026-01-17 07:25:28 -0800,scrambled email attachments,<p>unscramble my yahoo email attachments </p>,firefox-14701;firefox-1470;windows-11;firefox;settings;,firefox,settings,en-US,"",rbstokes23
1560727,2026-01-17 07:23:58 -0800,2026-01-17 07:23:58 -0800,Bunbenr,"<p>from ursina import * from ursina.prefabs.first_person_controller import First_Person_Controller </p><p>app = Ursina() </p> <ol><li> Định nghĩa khối vuông (Voxel) </li></ol> <p>class Voxel(Button): </p><pre>   def __init__(self, position = (0,0,0)):        super().__init__(            parent = scene,            position = position,            model = 'cube',            origin_y = 0.5,            texture = 'white_cube', # Bạn có thể thay bằng ảnh cỏ/đất            color = color.color(0,0,random.uniform(0.9,1)),            highlight_color = color.lime,        ) </pre> <pre>   def input(self, key):        if self.hovered:            # Chuột phải để đặt khối            if key == 'right mouse down':                voxel = Voxel(position = self.position + mouse.normal)            # Chuột trái để phá khối            if key == 'left mouse down':                destroy(self) </pre> <ol><li> Tạo mặt đất 20x20 </li></ol> <p>for z in range(20): </p><pre>   for x in range(20):        voxel = Voxel(position = (x,0,z)) </pre> <ol><li> Thêm người chơi (Góc nhìn thứ nhất) </li></ol> <p>player = First_Person_Controller() </p><p>app.run() </p><p>'<em><strong></strong></em> </p>",firefox;backup-recovery-and-sync;,firefox,backup-recovery-and-sync,en-US,"",96bv8vw5jh
1560726,2026-01-17 07:18:26 -0800,2026-01-17 07:18:26 -0800,"After updating Firefox to 147.0.1, two Firefox entries appeared in the app list.","<p>I installed Firefox 147.0 using Firefox Setup 147.0.exe to D:\Programs\Mozilla firefox. </p><p>After updating Firefox to 147.0.1 via the Help menu, two Firefox entries appeared in the “Settings” app list. </p><p>Why did it become multiple? </p><p>Will the number of Firefox entries in the app list keep increasing forever with every future update? </p>",firefox-14701;firefox-1470;windows-11;firefox;update;,firefox,update,en-US,"",vyt04724-safes
1560725,2026-01-17 07:06:57 -0800,2026-01-17 07:06:57 -0800,Firefox update,<p><strong>a few days ago I received a message that i had an upgrade from Firefox. After that I can't find the bookmarks I had saved for paying bills as well as other important items.</strong> </p>,firefox-1470;windows-11;firefox;recover-data;,firefox,recover-data,en-US,"",Lloyd22
1560724,2026-01-17 07:03:27 -0800,2026-01-17 08:10:02 -0800,restore,<p>My computer HD crashed and I'm trying to see if my favorites was save somewhere on the computer or in the clouds </p>,windows-10;firefox;recover-data;,firefox,recover-data,en-US,1794459;,mroesch
1560723,2026-01-17 07:01:57 -0800,2026-01-17 08:18:10 -0800,Tumblr,"<p>Something's wrong with my Tumblr. When Firefox crashed before it updated, my Tumblr has completely broke (It won't show any notifcations that someone posted, the activity is stuck at 2 and community at 6).  PLEASE HELP </p>",firefox-1470;windows-10;firefox;site-breakages;,firefox,site-breakages,en-US,1794441;1794467;,Kittycatz1124
1560722,2026-01-17 07:01:55 -0800,2026-01-17 07:01:55 -0800,Mejor conexión,<p>A tener una buena conversación </p>,firefox;accessibility;,firefox,accessibility,es,"",johnguzman7243
1560721,2026-01-17 06:46:43 -0800,2026-01-17 06:46:43 -0800,Online shopping fails with access denied,"<p>I am getting an access denied message with <a href=""http://shop.coop.co.uk"" rel=""nofollow"">shop.coop.co.uk</a>,  but not with any other online shopping site.  </p><p>I have tried all the usual suggestions like reboot, clear cache, remove proxy, and I do not have VPN. </p><p>I have downloaded the html of the message, and taken a screenshot of it as shown below.  Looking into the html, there are references to Incapsula, which may suggest where the problem lies? </p><p>This problem started when I had to change my Virgin Media hub from Super Hub 2 to Hub 4  around July last year. </p><p>One suggestion that is often made is to delete cookies.  However it is not clear which cookies may be relevant. </p><p>Any ideas on how to identify the source of this issue will be most welcome. </p><p>Geoff </p>",firefox;blocked-application-service-website;,firefox,blocked-application-service-website,en-US,"",geoff60
1560716,2026-01-17 05:52:29 -0800,2026-01-17 06:15:37 -0800,Mozilla Firefox Extensions,"<p>In my new PC on Windows 11,  I decided to install the Mozilla Firefox from the ""Microsoft Store"". However, unfortunately, I realized that some Add-ons (extensions) where missing from the Firefox's ""Gallery of Extensions"". Among them, the well known and valuable extension  '""Enhancer for YouTube"", which I have installed on every browser that I use.  So, if I don't find a solutions for this issue, I am about uninstall the Firefox and reinstall it from Mozilla's Website.. </p>",firefox-1470;windows-10;extensions;,firefox,extensions,en-US,1794418;,rogergr
1560715,2026-01-17 05:50:55 -0800,2026-01-17 06:29:30 -0800,address bar search,"<p>I had to actually sign up fort a Mozilla account,the multiple hoops I had to jump through were ridicules, in order to ask a question of Firefox. I do not want my address bar to be my search engine. How do I disable the search engine in my address bar? And now I have to wait for an answer!!!!!!!! I used to love and trust Firefox. Not anymore. </p>",firefox-1470;windows-10;firefox;search;,firefox,search,en-US,1794412;1794419;1794428;,marcellaolejniczak
1560713,2026-01-17 05:35:18 -0800,2026-01-17 06:17:56 -0800,no it is good,<p>i need to help download any type of pictures </p>,firefox-11302;firefox-1130;linux;firefox;images;,firefox,images,en-US,1794420;,sreerekhapoilkave
1560712,2026-01-17 05:11:39 -0800,2026-01-17 05:11:39 -0800,Whatsapp,<p>To login onto whtsapp </p>,firefox-11302;firefox-1130;linux;firefox;download-and-save;,firefox,download-and-save,en-US,"",r240771
1560710,2026-01-17 05:03:17 -0800,2026-01-17 05:03:17 -0800,favourite movie,<p>khvkhqsvxhkhwevxkhqsv kqsvhv kuew vuo </p>,firefox;accessibility;,firefox,accessibility,en-US,"",yeyehlucu
1560709,2026-01-17 04:30:34 -0800,2026-01-17 06:18:13 -0800,I am lost all book mark,"<p>I am very upset, all my book mark was lost </p>",firefox-1470;windows-10;firefox;recover-data;,firefox,recover-data,en-US,1794421;,faridsidik64
1560706,2026-01-17 04:22:26 -0800,2026-01-17 04:22:26 -0800,Turkis air liner,<p>Mange booking </p>,firefox;browse;,firefox,browse,en-US,"",moghniaia90
1560705,2026-01-17 03:38:28 -0800,2026-01-17 03:38:28 -0800,How we can supprt Ucrains Offensive Cyber warfafe,<p>My idea is to develop sripts and plugins which can be used as more ffective traps. Targets must be ableto spot all the diferent signatures. </p>,firefox-1470;windows-10;firefox;privacy-and-security_1;,firefox,privacy-and-security,en-US,"",u7158577764
1560704,2026-01-17 03:11:12 -0800,2026-01-17 06:19:00 -0800,"cant find the menu button, where is it",<p>cant find menu button&nbsp;? </p>,firefox-14601;firefox-1460;windows-11;firefox;customization;,firefox,customization,en-US,1794422;,mt67102
