id,created,updated,title,content,tags,product,topic,locale,answers,creator
1579614,2026-05-02 13:27:42 -0700,2026-05-02 13:27:42 -0700,like to increase font size for URL and bookmark lines,"<p>just a couple of days ago, the font size changed. Web pages are ok, just the URL, Setting listings and bookmarks, etc just got to small, hardly can read it </p>",firefox-1500;windows-1011;firefox;browser-appearance;,firefox,browser-appearance,en-US,"",schachtell
1579612,2026-05-02 12:44:35 -0700,2026-05-02 12:44:35 -0700,whatsapp installing,<p>how download and istall </p>,firefox-7701;firefox-770;windows-81;firefox;installation-and-updates;,firefox,installation-and-updates,en-US,"",ibrahimibrahimpeta500
1579611,2026-05-02 12:38:17 -0700,2026-05-02 12:38:17 -0700,can I find out if my phone is hacked or mirror from other devices,<p>I would like to know the steps to check my phone from hackers and mirror devices. </p>,firefox;privacy-and-security_1;,firefox,privacy-and-security,en-US,"",michael.bvmgroup
1579609,2026-05-02 12:09:17 -0700,2026-05-02 12:09:17 -0700,please secure my phone with full protection,"<p><a href=""http://example.com"" rel=""nofollow"">link text</a> </p>",firefox;accessibility;,firefox,accessibility,en-US,"",call2rajanp12345
1579608,2026-05-02 12:04:59 -0700,2026-05-02 12:54:39 -0700,firefox 150.01  ADBLOCKER,"<p>Dear all, i use firefox 150.01 and receive a message Adbocker activated and some content is not shown correctly. Can you help to disable all adblockers </p><p>best regards Wolfgang </p>",firefox-1500;mac-os-x-1015;firefox;extensions;,firefox,extensions,en-US,1815331;,9x6r5rbcgk
1579607,2026-05-02 12:04:42 -0700,2026-05-02 12:04:42 -0700,Does your project still need financing?,"<p>Does your project still need financing? </p><p>We are a Financial Investment Loan Company looking for Companies Or Individuals to invest in, We are currently seeking means of expanding or relocating their investor's business interest abroad either as a joint venture partnership or a direct loan funding, their interest are in the following sectors: oil/Gas, real estate, property purchase,land acquisition, •Business Loans,business start-up,construction, equipment,renovation,expansion, working capital, stock, mining, transportation, health sector, tobacco, Personal Loans,Communication Services,  education,wedding, travel, Agriculture or any other viable sectors capable. </p><p>If you think you have a solid background and idea of making good profit in any of the mentioned business sectors or any other business  in your country, kindly reply and forward  your project/business plan for our management review. </p><p>Our finance investment on a short term loan is  $10,000,000.00 USD to $100,000,000.00 USD. Our long term loan investment is from $100,000,000.00 USD to 800,000,000.00 USD and above We offer loans to Individuals from the range of $ 10,000.00 USD  to $ 50,000,000.00 USD. Our loan interest rate is 2% and the Loan repayment duration ranges from 1 year to 35 years. duration. Once customer's receive our loan offers, the loan repayment starts after a 1 year grace period. </p><p>Why choose Mark Davson Financial Loan Firm? ✅ Personalized assessment of your application ✅ Fast and simple procedures ✅ Tailored support at every step ✅ Transparency, confidentiality, and reliability </p><p>📩 To learn more or submit your loan application, please contact us today at emails: <a href=""mailto:markdavsonfinancialloanfirm@consultant.com"" rel=""nofollow"">markdavsonfinancialloanfirm@consultant.com</a> Now our company is also looking for a person that can be our company representative in your country. If you are interest to be our company representative in your country, kindly contact us via below emails. </p><p>We look forward to helping you bring your projects to life. </p><p>If you do not have any idea, you can connect someone or a company that needs financing  to us and we will give you a commission for referring customers to us. </p><p>Kindly confirm if you interested in joint venture partnership or loan funding so we can proceed with its process. </p><p>Best regards, </p><p>Thank you C.E.O. Rev. Mark Davson MARK DAVSON FINANCIAL LOAN FIRM United Kingdom, England (UK) Email: <a href=""mailto:markdavsonfinancialloanfirm@consultant.com"" rel=""nofollow"">markdavsonfinancialloanfirm@consultant.com</a> Email:<a href=""mailto:markdavsonfinancialloanfirm@gmail.com"" rel=""nofollow"">markdavsonfinancialloanfirm@gmail.com</a> Email: <a href=""mailto:markdavsonfinancialloanservice@gmail.com"" rel=""nofollow"">markdavsonfinancialloanservice@gmail.com</a> Email: <a href=""mailto:markdavsonloanfirm@hotmail.com"" rel=""nofollow"">markdavsonloanfirm@hotmail.com</a> WhatsApp:+447300935913 Website: <a href=""https://markdavsonfinancialloanfirm.com/"" rel=""nofollow"">https://markdavsonfinancialloanfirm.com/</a> </p>",windows-10;firefox;accounts;,firefox,accounts,en-US,"",antoniasherrif1
1579606,2026-05-02 12:03:01 -0700,2026-05-02 12:03:01 -0700,"Trace Hacker's Crypto Recovery recovers scammed bitcoin, stolen bitcoin, and stolen cryptocurrency ‪+447355702876‬","<p>Trace Hacker's Crypto Recovery recovers scammed bitcoin, stolen bitcoin, and stolen cryptocurrency +447355702876 </p><p>Trace Hacker's Crypto Recovery is a solution-based company that specializes in recovering cryptocurrency stolen off innocent investors and crypto enthusiasts.  Trace Hacker's Crypto Recovery recovers scammed bitcoin, stolen bitcoin, and stolen cryptocurrency using cutting-edge technology and a breakthrough in recovery services following an initial examination and verification of the data provided by the clients. </p><p>Cryptocurrency Scam Recovery // Recover Lost Funds // Crypto Investment Gone Wrong. How To Hire A Hacker To Get Back Stolen Crypto Coins // Hire A Hacker To Recover Lost Or Stolen Bitcoin/Nft // Help I Can't Access My USDT Account, Seems I Got Hacked // Bitcoin Recovery Expert Needed// </p><p>Reach out to their Info below Whatsapp : +4,4,7,3,5,5,7,0,2,8,7,6 Email:<a href=""mailto:support@tracehackerscryptorecovery.com"" rel=""nofollow"">support@tracehackerscryptorecovery.com</a> Email: <a href=""mailto:info@tracehackerscryptorecovery.com"" rel=""nofollow"">info@tracehackerscryptorecovery.com</a> Whatsapp: +447355702876 Website:<a href=""https://tracehackerscryptorecovery.com"" rel=""nofollow"">https://tracehackerscryptorecovery.com</a> </p>",windows-10;firefox;accessibility;,firefox,accessibility,en-US,"",antoniasherrif1
1579605,2026-05-02 12:01:09 -0700,2026-05-02 12:18:52 -0700,Is there a way to get VPN to turn on automatically when you start Firefox?,"<p>I have to turn it on manually every time. The problem is that there are still tabs open from the last session, and I don't want them to connect before VPN  is on. </p>",firefox-15001;firefox-1500;windows-11;firefox;vpn;,firefox,vpn,en-US,1815323;,persecutie
1579601,2026-05-02 10:54:36 -0700,2026-05-02 13:28:16 -0700,[Nightly] Stutters / lags / CPU usage high since about a week?,"<p>Hello, I'm on Firefox Nightly 152.0a1 running on a freshly installed new Windows 11 version. I've used Firefox exclusively for my whole life and everything has always been smooth until a few days ago. Firefox started (and continues) to freeze for a second or two pretty regularly, each time I use the search bar for example, open a new tab, while a page is loading (which is very slow at the moment) but also scrolling on a page for example. During the freezes, the temperature of my CPU also increase by approximately 20°C. CPU usage in task manager shows that it is quite high, 10x higher than Edge that I opened for comparison only : <a href=""https://i.imgur.com/enuMMZl.png"" rel=""nofollow"">https://i.imgur.com/enuMMZl.png</a>. </p><p>I have sought the internet for advice but nothing changed this behaviour. I updated my computer through Windows Update, my drivers through Driver Booster, I disabled hardware acceleration on Firefox, I removes all AI components with zoicware/RemoveWindowsAI on GitHub, I changed dom.ipc.processPriorityManager.backgroundUsesEcoQoS on about:config to false but nothing cured the problems. </p><p>I'm out of solutions and I don't know if I should be waiting for another Nightly build (usually there's about 1-2 a day but 152.0a1 is sticking since a few days and there isn't any update available since, seemingly), if there's others energy economy parameters I could play with on Windows 11 that I don't know about or if something else is in the way. Any help very appreciated, thanks! </p>",windows-11;firefox;app-responsiveness;,firefox,app-responsiveness,en-US,1815322;1815342;,Olelko
1579599,2026-05-02 10:28:58 -0700,2026-05-02 10:28:58 -0700,Ggggggggg,<p>Gghhghhjk </p>,firefox;browse;,firefox,browse,en-US,"",jeg9000
1579598,2026-05-02 10:25:15 -0700,2026-05-02 10:25:15 -0700,I have acer chromebook which version of Firefox do I download?,<p>I do not know which version of Firefox to download. please help answer by email.thanks </p>,linux;firefox;download-and-save;,firefox,download-and-save,en-US,"",abdiesas
1579597,2026-05-02 10:15:13 -0700,2026-05-02 10:15:13 -0700,kesara,<p><em><strong>.........</strong></em> </p>,firefox-1500;windows-1011;firefox;download-and-save;,firefox,download-and-save,en-US,"",klalanga713
1579592,2026-05-02 09:31:11 -0700,2026-05-02 10:55:57 -0700,language,"<p>When I open Firefox from my account to log in to Facebook, it displays the page interface in Japanese and I cannot switch it to English. </p>",firefox-15001;firefox-1500;windows-11;firefox;languages;,firefox,languages,en-US,1815316;,juoddollar
1579591,2026-05-02 09:27:31 -0700,2026-05-02 09:27:31 -0700,6161982,<p><strong>bold text</strong> date of birth </p>,firefox-1500;linux;firefox;accounts;,firefox,accounts,en-US,"",amanjora1919
1579589,2026-05-02 09:06:24 -0700,2026-05-02 12:57:42 -0700,"Firefox downloads come up as ""File Missing or Moved""","<p>Hi,   I just upgraded from Windows 7 to Windows 10 home. One of the things that has changed is that my downloads don't stay. After closing Firefox the download is there but if you click on it it says ""File missing or moved"". </p>",firefox-1400;windows-1011;firefox;downloads;,firefox,downloads,en-US,1815333;,Amylogamy
1579588,2026-05-02 09:00:56 -0700,2026-05-02 09:00:56 -0700,what to do to hack a phone by sending an email,<p>I'm trying to figure out how to interfere with someone's email to mess up there phone </p>,firefox;backup-recovery-and-sync;,firefox,backup-recovery-and-sync,en-US,"",threscruses02
1579584,2026-05-02 08:45:09 -0700,2026-05-02 08:45:09 -0700,my pictures,<p>My pictures </p>,firefox;accessibility;,firefox,accessibility,en-US,"",etechcode51
1579581,2026-05-02 07:58:15 -0700,2026-05-02 13:34:31 -0700,"Copy and paste information from Google no longer working,","<p>Using OS 10.13.6 on MacBook Pro. Since latest Firefox update unable to copy and paste information from Google, How to resolve the problem? </p>",firefox-115351;firefox-11535;mac-os-x-1013;firefox;web-compatibility;,firefox,web-compatibility,en-US,1815337;1815338;1815343;,no1uno
1579580,2026-05-02 07:57:13 -0700,2026-05-02 08:02:13 -0700,Profiles reset after every update,"<p><strong>During the last week or so I have encountered the issue that one or more of my Firefox profiles keep resetting after every update.</strong> </p><p>I noticed there's couple of threads with similar issues already but the generic profile restore instructions are not helping at all since it seems that Firefox is actually wiping the default profile on every update. </p><p>I'm running Firefox 150.0.1 for Arch on CachyOS. </p><p>After an update when I click on my default profile in the selector, I get greeted with a completely fresh Firefox install. There's no extensions, it's not logged in to my account and no browser history. The edit profile button shows a pop-up <em>""Firefox is already running but not responding--""</em>. </p><p>If I try to switch profile via the Account button on top, I get another pop-up stating <em>""Your Firefox profile cannot be loaded. It may be missing or inaccessible.""</em> </p><p>I do not have the clean session after closing Firefox set on. </p><p><br> I followed the instructions to see if I can restore or recover my profiles.  </p> <ul><li> I can find three profile directories under <em>$HOME/.cache/mozilla/firefox</em> </li><li> In $HOME/.config/mozilla/firefox there are matching linked directories for the profiles </li><li> The broken profiles seem to have broken link, ie. no target in /run/user/1000/psd/&lt;profile&gt; is not found </li></ul> <p>Searching for the profile that should be under /psd/ doesn't seem to yield any results, meaning it's been wiped after the update. </p>",firefox-15001;firefox-1500;linux;firefox;profiles;escalate;,firefox,profiles,en-US,1815295;,morkkis
1579577,2026-05-02 07:30:22 -0700,2026-05-02 07:33:31 -0700,VPN Button not appear,<p>For new fearure that VPN Button will appear in my firefox browser I do not get it and not dispaly at all for Relase 150 </p>,firefox-15001;firefox-1500;windows-11;firefox;vpn;,firefox,vpn,en-US,1815287;,saied_skb
1579576,2026-05-02 07:29:25 -0700,2026-05-02 13:09:41 -0700,"website access problem ""error 403 forbidden"" from Firefox 115.35.1ESR on W7 x64","<p>Hi, since some weeks I'm unable to access some websites with Firefox, cause I get 403 errors, for instance <a href=""https://www.bexley.fr/"" rel=""nofollow"">https://www.bexley.fr/</a>. It works well with Chrome on the same computer+same OS, or with a newer version of Firefox on W10 (same computer, dual boot), but with my W7 and Firefox 115.35.1esr I can't access them because of that error. Any idea how I could fix that ? All my computers on W7 and the same version of Firefox are concerned. Thank you. </p>",firefox-115351;firefox-11535;windows-7;firefox;web-compatibility;,firefox,web-compatibility,en-US,1815296;1815309;1815324;1815334;,virtual.bug
1579575,2026-05-02 07:25:50 -0700,2026-05-02 10:17:14 -0700,My old firefox back,"<p>I need my old firefox back,. Can't access my bookmarks and all </p>",firefox-15001;firefox-1500;windows-11;firefox;recover-data;,firefox,recover-data,en-US,1815312;,bensongare
1579574,2026-05-02 07:17:56 -0700,2026-05-02 08:56:20 -0700,Update check,<p>how do I do my quick update check </p>,firefox-1500;windows-1011;firefox;update;,firefox,update,en-US,1815302;,uwakwebruce
1579572,2026-05-02 07:06:52 -0700,2026-05-02 07:07:18 -0700,Goods,<p><strong>bold text</strong> </p>,firefox-15001;firefox-1500;windows-10;firefox;settings;needsinfo;,firefox,settings,en-US,1815285;,samadsumra881
1579571,2026-05-02 05:53:08 -0700,2026-05-02 06:35:55 -0700,Firefox upgraded itself today and the process removed all my bookmarks and passwords.,"<p>Firefox has exceeded all previous mess-ups by upgrading itself today (apparently sometime when my battery went flat and was then left recharging), and this happened despite my account being set for 'upgrades to be only installed manually'. Now every bookmark, all passwords and all the settings of my Home Page have been erased. I have no 'restore point' to resort to as supposedly all this info is synced to the cloud. But I can find no method to retrieve any of these files let alone one to restore them. This is a nightmare. Please help. </p>",firefox-14902;firefox-1490;windows-11;firefox;sync-and-backup-confusion;,firefox,sync-and-backup-confusion,en-US,1815283;,anniesmart
1579570,2026-05-02 05:48:38 -0700,2026-05-02 05:48:38 -0700,786786,<p>Hi I am sameer alam </p>,firefox;browse;,firefox,browse,en-US,"",alamsamir607
1579569,2026-05-02 05:45:37 -0700,2026-05-02 05:45:37 -0700,786786,<p>Hi I’m sameer alam my business medical store </p>,firefox;browse;,firefox,browse,en-US,"",alamsamir607
1579568,2026-05-02 05:34:33 -0700,2026-05-02 13:10:11 -0700,NEED HELP,<p>i just added extensions from fire fox but lost you tube. how do I turn it back on? </p>,firefox-15001;firefox-1500;windows-11;firefox;extensions;,firefox,extensions,en-US,1815303;1815320;1815336;,BLADERUNNER_AK
1579567,2026-05-02 05:26:08 -0700,2026-05-02 08:57:56 -0700,I just added on extensionsbut totally lost you tube.how do I get it back?,<p>I just added on extensions but completely lost you tube. how do I turn it back on? </p>,firefox-15001;firefox-1500;windows-11;firefox;extensions;,firefox,extensions,en-US,1815304;,BLADERUNNER_AK
1579566,2026-05-02 04:50:47 -0700,2026-05-02 13:15:51 -0700,The server at biz209.vodien.com:2096 is taking too long to respond.,"<p>The server at <a href=""http://biz209.vodien.com:2096/"" rel=""nofollow"">biz209.vodien.com:2096</a> is taking too long to respond. </p><p><em>Moderator note: This question has been edited to correct the link formatting.</em> </p>",firefox-15001;firefox-1500;windows-10;firefox;slow-connection;needsinfo;,firefox,slow-connection,en-US,1815339;,bala4
1579565,2026-05-02 04:23:38 -0700,2026-05-02 04:23:38 -0700,taneja aerospace,<p>taneja aerospace and aviation ltd </p>,firefox-115351;firefox-11535;windows-7;firefox;settings;,firefox,settings,en-US,"",taalmaintenance
1579562,2026-05-02 03:49:45 -0700,2026-05-02 13:19:57 -0700,Videos don't play on SOME sites?,"<p>Videos don't play on some sites. CNN. MSNBC. Etc. Everything is on the screen - image, script gets underlined when mouse passes over - but there's no arrow when I pass over the image. What gives? I've tried everything I can think of. HELP!  </p><p>Thank you. </p><p>-Neil </p>",firefox-115351;firefox-11535;mac-os-x-1014;firefox;audio-and-video;needsinfo;,firefox,audio-and-video,en-US,1815340;,stretch6661
1579561,2026-05-02 03:39:35 -0700,2026-05-02 13:22:22 -0700,Widevine stopped working yesterday 4/30 can't watch crunchyroll or hianime.,"<p>Since yesterday Firefox stopped working with Crunchyroll and Hidive and says, ""Firefox is installing components needed to play the audio and video on this page.  Please try again later.""  </p><p>150.0.1 (64-bit) Bazzite Linux 6.19.14-ogc1.1.fc44.x86_64 bazzite-gnome-nvidia-open:stable v44.20260501.1 Widevine plugin is version 4.10.2934.0. </p><p>Additionally, I've disabled extensions as well, cleared the cache.  I've disabled play DRM content and restarted the browser before turning it back on.  I've changed from my own dns server which I see nothing being blocked to google public dns and saw no difference.  Everything was working fine on Wednesday night and stopped on Thursday. </p>",firefox-15001;firefox-1500;linux;firefox;audio-and-video;needsinfo;,firefox,audio-and-video,en-US,1815271;1815272;1815341;,whiskey.ext
1579560,2026-05-02 03:30:56 -0700,2026-05-02 03:30:56 -0700,The certificate has expired :],"<p>Zachowaj ostrożność. Coś tu nie gra. </p><p>Firefox wykrył potencjalnie poważny problem bezpieczeństwa na witrynie <a href=""http://ohttp-gateway-merino.services.mozilla.com"" rel=""nofollow"">ohttp-gateway-merino.services.mozilla.com</a>. Ktoś podszywający się pod nią może próbować ukraść dane karty płatniczej, hasła, adresy e-mail lub coś innego. </p><p>Witryna „<a href=""http://ohttp-gateway-merino.services.mozilla.com"" rel=""nofollow"">ohttp-gateway-merino.services.mozilla.com</a>” określa poprzez HSTS (HTTP Strict Transport Security), że Firefox ma się z nią łączyć jedynie w sposób zabezpieczony. Dodanie wyjątku w celu odwiedzenia tej witryny jest niemożliwe. </p>",firefox-15001;firefox-1500;windows-11;firefox;web-certificates;unsupported-locale;,firefox,web-certificates,en-US,"",mastergedi
1579558,2026-05-02 03:08:21 -0700,2026-05-02 06:51:09 -0700,how can change country in VPN,<p>how can I change country in VPN </p>,firefox-1500;windows-11;firefox;vpn;,firefox,vpn,en-US,1815284;,arianecoury
1579557,2026-05-02 02:51:08 -0700,2026-05-02 10:33:49 -0700,API Webgl2 Sorunu-2,"<p>Daha önceki sorun tekrar oldu.Nasıl çözebilirim?Oyun firması oyunu 3 Şubat 2026'da güncellediklerini,eski cihazların Webgl2'yi desteklemeyeceğini veya donanım hızlandırmanın aktif olmadığından oyunun çalışmayabileceğini söyledi.Webgl2 raporu bende bir öncekinin aynısı. </p>",firefox-115351;firefox-11535;windows-81;firefox;web-compatibility;,firefox,web-compatibility,tr,1815270;1815313;,Honorsega
1579554,2026-05-02 02:01:56 -0700,2026-05-02 02:01:56 -0700,Indonesia,"<p>Halo Tim Roblox, Saya telah mengubah negara saya ke Indonesia, Tetapi akun saya masih menampilkan Vietnam. Bantu saya mengubah lokasi saya. Terimakasih  Dear Roblox team, Have Accidentally Changed My Roblox Location,My Current Location is Indonesia, Would Like to set my location back, please help me as soon as possible </p>",firefox;browse;,firefox,browse,en-US,"",riskyandrean01828
1579553,2026-05-02 01:33:01 -0700,2026-05-02 01:33:01 -0700,wher start,<p>very good </p>,firefox;installation-and-updates;,firefox,installation-and-updates,en-US,"",rohtop49
1579550,2026-05-02 00:54:25 -0700,2026-05-02 00:54:25 -0700,ardhy,<p><strong>bold text</strong> </p>,firefox-15001;firefox-1500;windows-10;firefox;installation-and-updates;,firefox,installation-and-updates,en-US,"",nurdiansyah.singi82
1579549,2026-05-02 00:49:02 -0700,2026-05-02 00:49:02 -0700,No problem can be solved from the same level of consciousness that created it. Albert Einstein,<p>Me gustó </p>,firefox-680;linux;firefox;accessibility;,firefox,accessibility,es,"",donsabino528
1579548,2026-05-02 00:28:50 -0700,2026-05-02 00:33:53 -0700,how do I add a Bookmark,<p>How do I add a bookmark? </p>,firefox-15001;firefox-1500;windows-11;firefox;bookmarks;,firefox,bookmarks,en-US,1815267;,tkchuhran
1579547,2026-05-02 00:13:13 -0700,2026-05-02 00:13:13 -0700,"Can't browse Home Depot site.  Was able to do this prior to about 1 month.  Desktop, Windows 7 (!)","<p>When I click on any product at Home Depot site, I always get 'error page -- please refresh page'. Did not previously have any problems at that site.  I'm running Windows 7 (sorry!) on desktop. </p>",firefox-1150;windows-7;firefox;site-breakages;,firefox,site-breakages,en-US,"",cwolfathome
1579545,2026-05-02 00:04:02 -0700,2026-05-02 00:04:02 -0700,How to allow firefox to open up embedded videos?,<p><strong>bold text</strong> </p>,firefox-1470;mac-os-x-1015;firefox;privacy-and-security_1;,firefox,privacy-and-security,en-US,"",bernard_deanna
1579544,2026-05-01 23:51:10 -0700,2026-05-02 01:54:26 -0700,"Firefox won't access my primary Outlook email ID ""[email 1 removed]@msn.com"", but Edge will.","<p>Firefox comes up with my business ID ""<em>[email 2 removed]</em>@outlook .com"" when I try to access my normal email account ""<em>[email 1 removed]</em>@msn.com"". Have not been able to get around it. Egde however will always access the pena_rudy.... ID. </p>",firefox-1500;windows-1011;firefox;password-autofill;,firefox,password-autofill,en-US,1815269;,Penarg
1579543,2026-05-01 23:20:27 -0700,2026-05-01 23:28:46 -0700,I have been watching the  No Spin News almost every night for the last ten years. Now Firefox says it cant find the server. Whats up with that?,"<p>That is what I want to know, Can you fix my problem? </p>",firefox-15001;firefox-1500;windows-11;firefox;connectivity;,firefox,connectivity,en-US,1815266;,busterbrown20102
1579542,2026-05-01 23:18:15 -0700,2026-05-01 23:18:15 -0700,Nurse,<p>I'm youtuber </p>,firefox;download-and-save;,firefox,download-and-save,en-US,"",mo.mahmoudemara
1579541,2026-05-01 23:16:49 -0700,2026-05-01 23:16:49 -0700,My tree style tabs have disappeared after Firefox update.  It's not disabled.,"<p>My tree style tabs have disappeared. I did not enable split screen, but it appeared at one point. Please help. </p>",firefox-15001;firefox-1500;mac-os-x-1015;firefox;extensions;,firefox,extensions,en-US,"",rmorand53
1579539,2026-05-01 23:16:28 -0700,2026-05-01 23:16:28 -0700,Since last April 2026 update Prime Video no longer displaying thumbnails of shows/movies,"<p>Since a few days (last week of April), when I go to Amazon Prime Video, once I log in, the thumbnail no longer display (see attached screenshot).  However, when I arrive on Prime, before logging in, the thumbnails are there (but they might be actual images and not thumbnails). As soon as I log in, all thumbnails disappear and all I have is a text (might be the Alt-Text option for images). </p><p>It was working fine over the past weekend.  I had a Firefox update at the beginning of the week.  I think it somehow messed up my settings. </p><p>I tried several things: - clear cash (it clears everything when I close Firefox) - used different privacy settings (was at Strick) - added <a href=""http://www.primevideo.com"" rel=""nofollow"">www.primevideo.com</a> as exception in the privacy settings - was always use private window - had not installed any extension nor plugins - DMR was ON - most of every options were set to OFF or disabled </p><p>I tried to reinstall it through Snap Ubuntu 24.04 and it worked but the next day, the problem was back. </p><p>I installed Crome and out of the box, the thumbnails are there. </p>",firefox-15001;firefox-1500;linux;firefox;web-compatibility;,firefox,web-compatibility,en-US,"",browser_ice1
