id,created,updated,title,content,tags,product,topic,locale,answers,creator
1584651,2026-05-30 09:58:54 -0700,2026-05-30 11:39:33 -0700,All of a sudden(Firefox is my default browser) YouTube is layed out on the page all wrong!! i'm really pissed about this!!!!!!,"<p>I have no idea what happened!!!🤬 YouTube is normal on Internet Explorer(or WHATEVER it's called now!) But ALL OF A SUDDEN YESTERDAY I have to scroll all over the place on the page to find what I'm looking for in videos!! The whole organization on the page is totally screwy!!!!!🤬 WHAT THE HELL HAPPENED???????? I DON""T WANT TO USE MICROSOFT'S BROWSER!!!!!!!!!!!!!! </p>",firefox-15102;firefox-1510;windows-11;firefox;web-compatibility;,firefox,web-compatibility,en-US,1822111;,cmlyon
1584650,2026-05-30 09:33:02 -0700,2026-05-30 09:33:02 -0700,Reset mail,<p>AEC=AaJma5sptfB-7CXQ39izxba_PncpB3T_nUWcb48zqByhdp8Oqm37GUhLkSU; GOOGLE_ABUSE_EXEMPTION=ID=a4ac9e577b4f3fd9:TM=1780133346:C=R:IP=197.211.63.142-:S=GYAu_pw302WwGF-YiOOoL1U; SID=g.a000-gg-jzbekydahJ8zqQ9UmkLlK02QecrmAY8wyFLu_qi8hfze-OGOi4QURF7m0zrF6HnOjwACgYKAaESARASFQHGX2MiBJeKjQlSOnL25Ss9pPBTqhoVAUF8yKr1xHZsd0LAQsFUROe9qnRK0076; __Secure-1PSID=g.a000-gg-jzbekydahJ8zqQ9UmkLlK02QecrmAY8wyFLu_qi8hfzeWk8tIv8dGXXwWIZnI9ABYwACgYKAfYSARASFQHGX2MiAcV0xpw0UWQWcFNNCrLIXxoVAUF8yKqXPYFP0LMEO2Ihe6zDKBah0076; __Secure-3PSID=g.a000-gg-jzbekydahJ8zqQ9UmkLlK02QecrmAY8wyFLu_qi8hfzeCLny08en0F2iDlI4HfXaeAACgYKAXsSARASFQHGX2Mi1O4r1fUv3S96i5DRRr1UrBoVAUF8yKqsU62gPW8T55LhL8A_OVR20076; HSID=AQJVv6-MTCHjQwoq0; SSID=ATamXbJTQpI2w0R2P; APISID=ufwfw4sdOohs0lRX/AT3aAiCmdN_kylNYp; SAPISID=iQrCh7WOQaNGgoSt/Ay5uOBNxi_2miyuna; __Secure-1PAPISID=iQrCh7WOQaNGgoSt/Ay5uOBNxi_2miyuna; __Secure-3PAPISID=iQrCh7WOQaNGgoSt/Ay5uOBNxi_2miyuna; SEARCH_SAMESITE=CgQI-6AB; __Secure-STRP=ANmZwa3Ywc1Gdj3BjAQga-kLeN5g1ZZ3-trXYpkF5cSli2OSWjMX-J41PIxk4-9P5cU92zkk8nLzjEhQ343EPfwoPaOvA-A; NID=531=QfbS8u6FLCYBjWYfQQkQ6i898e2GtcGzYVZw84CvtkTQtXTfXDJgAgsKH1xJmHus_h4MoQ6iic6jc3KGsUld4h9wKgDUga33Dqk7va7CfSVTgvje-aWB5SeVxb1wvkdeNNSm6aGK69UHP9a3uDFD_qHLyxyPZplUgZ_u4PGB-FciDai2pFAgjbozHLZGL4Yxe0KPnXyJSRvrQSOH-NJ0c2rmbdpgxVLfMH5KUVKUGswQMH-Ac2sdt2ZqQbjEeSw6OuyRgiIALK9CqHj3GQx-IavKynPLf8cA6oNeMZfW8Bm6seXml-PQ-r5H5He_wV95uiIgpMc73nqzNeQUaIYJCJqIWpPvp7X6pCR6AfveO759sFu8fgrNM0JqqlAchZtHiehVCuMe8TIMe9JW41p7nxDHztvvDooEdZnYZ-qw_9iW5YZy02RRWVNNVqyKnI1PKWiBllBcSNWAzF5dfQk2GYA--vzX7ayAUL4Jl_NDKSlOcInBGmR-GyPR87bIrgrjyM0WhM2KopW5_dm_56pBnccLEL0wZUGdZD6PO3O3seOav5VAxT8jPuinZK08AELWjguS6cTeyTaF89pQdE1299u9ms8melud9qbgMcAE6dOUAPJWtjQXLzmfo1l5-P2Eczp29zjc4deJxecISr0PviYFvjqYgU-wNkOqrLmj-JX1-Z6iHhXB8iS_GU1EgtcLcglQAp3gOahsrM_SSQ; DV=o9ejuSMalo5mgIjjJVKBVqZhuIGD55lw4P5MyRCtQwAAAGAUsbpzQL8yIwAAAJhcTY7CRtr7HgAAAHw2_5TMtlDCwAAAIj4tWEufHl2AwAAAA; SIDCC=AKEyXzV-fZ2H7V1Y49466Y8dIGgUxjCCxbbU5tqFVy3XDMW_Ai0Yq8mgBxxH5ODL0tLb-yWjmA; __Secure-1PSIDCC=AKEyXzVpjWO9XT-v8xT62qFtyqIMnhBTyiRhtYk0V2v7INc5ua6eMRdJrJxrBCMdjN_jmD2M; __Secure-3PSIDCC=AKEyXzXIb3OiKDkTMBUohNm5ujT_4xNrKet13jQBgv2Co8p3GEvaXMthTFC2-BjrHe79qEM3 </p>,firefox;accounts;,firefox,accounts,en-US,"",muwaddatgml1
1584649,2026-05-30 09:28:05 -0700,2026-05-30 09:28:05 -0700,Reset,<p>AEC=AaJma5uNhf0dSzoFtXtOP6y-7KOu9EttgVr2Nf3SBxjaGzm0iJInPHP__QE; GOOGLE_ABUSE_EXEMPTION=ID=91402bd1e2ea7a50:TM=1780133118:C=R:IP=197.211.63.142-:S=hJpnzPEqNf2IbaNT9TrfneM; SID=g.a000-ghRW06Rm58tOrdZnaRJsq6rELb1nLUYB5eMeOUbhkzxb7NoNbsiMt2D1k462nX5cbnPkQACgYKAbQSARYSFQHGX2MiAHGI--m9fqB-ctP9cq-nVhoVAUF8yKpRx62Zyf9yVv6YteMInOHh0076; __Secure-1PSID=g.a000-ghRW06Rm58tOrdZnaRJsq6rELb1nLUYB5eMeOUbhkzxb7NoU0dzBFLKjjqI8M-mAWqwNgACgYKAVQSARYSFQHGX2Mi3hqz-eWLvrjqoRn09saf6hoVAUF8yKo6012j2rzBppBV6evTiHg30076; __Secure-3PSID=g.a000-ghRW06Rm58tOrdZnaRJsq6rELb1nLUYB5eMeOUbhkzxb7NoYiXtJH_vREt9iFkn9bvmCQACgYKAUQSARYSFQHGX2MimSMTPemn4B-AZm5YIIK7WRoVAUF8yKpUjDybY6ioJmOd-tAhpSob0076; HSID=ALn3_OxbdQddqS4DQ; SSID=A14jc242Ng9GsYglh; APISID=nEExFVozKcnaxibO/A_YWiCELxUnMzia6t; SAPISID=wocZTmAwsFRUwGVo/AFTiU8cF2PE9rcrOT; __Secure-1PAPISID=wocZTmAwsFRUwGVo/AFTiU8cF2PE9rcrOT; __Secure-3PAPISID=wocZTmAwsFRUwGVo/AFTiU8cF2PE9rcrOT; SEARCH_SAMESITE=CgQI-6AB; __Secure-STRP=ANmZwa1NVVe0tvR6PYbtokqMrcgY1jtuQ61hBbZOhPy9nnoq66MRbK0jOXbTSGFYXQYk8JOJTDzKO7F-1YuPwa90icAt5A4dY5m3; DV=o-T4tGQv3sdjACJ-bZgLX55dYE6D55lRxOrOAf3KjAIAAICI4yVSgVam8QAAAAgH7s-UDNE6UAAACZXk6Owkfa-FQAAQAD8tv-UTPbQBwAAAA; NID=531=Sv84FM1ZDvcIbxNLhuBsPs_wVEIEdv_Jov2Eymp46EN0xTf41nwmeq9ADGHUfER2u71vI2PJhZrz7nDXfM_IPYgPxkCoSAwlBm_JMoSkXfpSbsJ8wFTLanO45dIJycm6VKRYu-WYgBAlquDV_MJfWRNzs8oFeEtF0dGhfwUPmaNfEga-IGBSPBcg9vNiJCaseFHIWGJML-idy1ma9VBU9m5lKkxD-D7D1zodITYo5wL0nbLj520eLjZK3sClIdLS_e_8jXoShlXuaVzOUyxmCPI8CHEmpmoA30KGF4UaGZJSwov5sjk4kZvCfL498Ahfp22b3nduZHG2wsyi-XSGUuUlRred9tVZdzQ1I7ZjvJCwIVQrOwQLiGuFOAaHrEkzzDP7ds-xvEODXf9CuZOZiSmDGwAFbqgSIVplAFv5e2lW0XvwDGenl8cRNWQ_lNCVDtimn6cxFvGkiftiVz2YVcVBXopMIJbgJ4EX4S2cjgYSAKLlb5pZ6HzGN2R7KyyukGWd4l24WERoWrFJHFy2NR75bDCqhtq4niB0JqVwu-RRqNptWDrBom6bYA1yJK6MZ8_5iADUwka_K0wvq8W-ZbVTncatMItx9vSNcJWHe_aLm6BdW5shWBT5byHaOmpRv_f1nVUV4SnDaMalWRgqRrXJgewnV8VWJyIn6RhuQcWXZ3mSf0LQe-QbAkGo9EDgLobjhum4j1sEUrXEsQ; SIDCC=AKEyXzXqO1Ck3pz9_zW1kTpu_9Mm0mjVENZQpjjgQpT3VgIvJwxK2j3RLlcwnMUik_4gy58Qzg; __Secure-1PSIDCC=AKEyXzVXNWf-xex6h1AuBrizJ9Iw-J76Q-hU8FoloNVc9QyiQum8Cx0d3LRjEDACeF4TTyMBaA; __Secure-3PSIDCC=AKEyXzW3Cu6whqUWo8il5OaUzR5z0GP8hdY7yrJIEiyfnz-2BWTSYUHj6RLmRGVa1yRoxZpF </p>,firefox;accounts;,firefox,accounts,en-US,"",muwaddatgml1
1584648,2026-05-30 09:24:44 -0700,2026-05-30 09:24:44 -0700,Difficulty Adding a language to ' TranslationLanguage'.,"<p>Hello, </p><p>My chosen language is English, with French second and US English third. I want to set French as my translation language but when I select 'Translation Settings' I am presented with a menu that only allows Removal of languages. How do I Add a language ? In this case French. </p><p>Best wishes </p>",firefox-15102;firefox-1510;windows-11;firefox;languages;,firefox,languages,en-US,"",condon66
1584647,2026-05-30 09:23:59 -0700,2026-05-30 09:23:59 -0700,Reset mail,<p>AEC=AaJma5sZa-xoDsmBjMIfkAddmAlIqD7BXBCgvqlyVRhjGOooK5fbLe0fqdE; GOOGLE_ABUSE_EXEMPTION=ID=01522e91b2e3273d:TM=1780132772:C=R:IP=197.211.63.142-:S=OYyJGMYPBy7PLXpB6lnTDqs; SID=g.a000-ggwoOe9eJYKEILzClW-2-nxhYKzCcLeepkyhh0-P3XDaoXzNi_clnrM2wlzVS_8saLyeAACgYKAZ4SARcSFQHGX2MisGLsj4hNMuqNPL75Zv6iNxoVAUF8yKoF6Q5IvhGu8aAqbLmrD_bp0076; __Secure-1PSID=g.a000-ggwoOe9eJYKEILzClW-2-nxhYKzCcLeepkyhh0-P3XDaoXzstAWu_1oIDgCbMZm0GY12wACgYKAcgSARcSFQHGX2MiODztdpRNwgTlKFIHoGcoJhoVAUF8yKoLTt21UO7_7jVw3hoRkEXb0076; __Secure-3PSID=g.a000-ggwoOe9eJYKEILzClW-2-nxhYKzCcLeepkyhh0-P3XDaoXzZUo7vETUOKnyYBrspkQlVwACgYKARoSARcSFQHGX2Mi4785asQrJq5pAwvxGERqMxoVAUF8yKrKuiqsbdFevBHygkxSi5qO0076; HSID=AduE-Ydr4UYz55rgt; SSID=ASt2jlQulnYnjKGw8; APISID=KokLH6bwusthq8dt/AXO4vxsEajKkg48Jo; SAPISID=TxSs1qmcDlGABaEN/AfcWnIHxaCpqu0sI-; __Secure-1PAPISID=TxSs1qmcDlGABaEN/AfcWnIHxaCpqu0sI-; __Secure-3PAPISID=TxSs1qmcDlGABaEN/AfcWnIHxaCpqu0sI-; SEARCH_SAMESITE=CgQI-6AB; NID=531=GnzLE7OdvOdROH7xddQr_aTXL6-pZdcMgAz-duWp6yGQ_PEsdn61edEt76XYHswdyQr_v7ZcyJt47AUQEMgYA1Wpto_19A4-G1T2ReQgm6u5VdGksGHJHWdfGWnrePqqdfqiQEzpFXZ1_5MMFABRzv9xACNynJfQ0w_PSblCIpHxwbIydVL9bMLg3oURpp0VBmEc5aW_yTPS2vkU67MKcTvFUzmcTUgDhA-ifA5WAoovuW1-HA8ky0BIoWUY5oAzpp4NE7p2OlZ0tCCoqlaBzba1ny9hq9NTifBXSCq65VKFrD_YPxjqRuS0mU-6ar--AOQJFewZloohvmfRcJ79lz1oGaQPN75HLK4Nz4DGrCfWUei-2xJcYZHMlaOESY88VQ5Rbj70S6lj3U4sp4eRQU7Tb9xV8x1bW4Q2R5-OIRYZz0-IOJ-f4vKprMRObqXjKRNIPrMYu48xfAtiLdLrrxjDHyo4yDb5NnWPBDZx9HvboggffIIqw5pQVMtVChtfisEfJQ8bCP-n1PKTUIhxVYVXgSf9AuFnZweGEyZtz4Mdz9_RM7CrC7ot8vhY42807YJTuUORKSTm6bkr64d69NIDbSgDTu_fhO7QF-sVsxPskOHDY277pTGtsZQ0SaCQyv_Iq2JI2UbYMPdJd4qUyCgb7aiL_ah4oa_Ek6qGIYwLQ3DzbOab69vVJaov9bGzEXZFlo1NFA5h5c370C9qQh33; DV=M3lDnlGqvvZjIBy4P1MyROuQaR6D5xmI-LVhLnx5tgEAAICI4yVSgVamgQAAABhFrO4c0K_MIAAACZXk6Owkfa-EgAAQAD8tv-UTPYQBwAAAA; __Secure-STRP=ANmZwa0nXKrphcZ4Tg64yaOTdkU-p87QP6lz9dDz_r_pImE2dGQmmOPLSOFjZJySQgswioWhEB3WHSYDUGUdMCOP4wFHE4bVVJVz; SIDCC=AKEyXzXSvvHuAk8avG7sRcX6B0waNfr9cfIzt6FFKhqaAWAPFrEzbtrzm7LkITUdbVKh4ISQQQ; __Secure-1PSIDCC=AKEyXzUjk-ZKnRx5_e1kV-PDZeOW5v293aUxO8kes0hc7S0yvSEq6R9AQmtDgcDFKKG-z1q0xQ; __Secure-3PSIDCC=AKEyXzWNbP67ta02M-wOSxUuuDyTbdpPYQ_bsT_HZBmkbScA6mxZXIGxguHAuF9gTzrE3KKD1Q </p>,firefox;accounts;,firefox,accounts,en-US,"",muwaddatgml1
1584646,2026-05-30 09:21:58 -0700,2026-05-30 09:21:58 -0700,how do i turn on me mic,<p>unable to use any program that requires the use of a mic </p>,firefox-15102;firefox-1510;windows-11;firefox;accessibility;,firefox,accessibility,en-US,"",harryhardman895
1584645,2026-05-30 09:21:10 -0700,2026-05-30 09:21:10 -0700,"questo account mi soddisfa più di altri, molto più semplice",<p><strong>testo in grassetto</strong> </p>,firefox-15101;firefox-1510;windows-10;firefox;accounts;,firefox,accounts,it,"",severino.miotto
1584644,2026-05-30 09:18:59 -0700,2026-05-30 09:18:59 -0700,Reset mail,<p>AEC=AaJma5uPZXP1KCwFI3GuGsmsm_CzxfycZau6mjKnCF7Qj1HFizgiz5obTc8; GOOGLE_ABUSE_EXEMPTION=ID=6296dae5c95bb2e6:TM=1780129469:C=R:IP=102.90.96.253-:S=GoVCz_9XIRVgbNk5PHd75Sc; SID=g.a000-gh6eTVzp8E5q-EdXK61zi3sUddJO5IGoGHnSbZNrN-GgZkmdzBXB2wnNgRTGkRs3_yXcQACgYKAVASARESFQHGX2MiJj84W6wnhXEAdvwTnMUMpxoVAUF8yKp8wAJsxPlg4eclgtfYErHo0076; __Secure-1PSID=g.a000-gh6eTVzp8E5q-EdXK61zi3sUddJO5IGoGHnSbZNrN-GgZkmyLFsxDKVT-rKh7Mn15ZDkAACgYKASMSARESFQHGX2Mi_LObufJJmu160u8jBeugvBoVAUF8yKqv5QKOSJ02fkpig-KaE9bb0076; __Secure-3PSID=g.a000-gh6eTVzp8E5q-EdXK61zi3sUddJO5IGoGHnSbZNrN-GgZkmWlqmo_T1WuwpK4-9U9bJ7wACgYKASQSARESFQHGX2MiMWvAc2WwX2prbHgVWdBz_xoVAUF8yKr2HNVjs6-vE9un3I4tpsaF0076; HSID=AP6XzIi98R-PdoRbZ; SSID=AuoTMRGAPRiDYtDb6; APISID=GKu_f_BQZYwFe3VU/AisY6sIVKK-_v-t5E; SAPISID=RRIKJLSclrVUaWXb/ANVu7uEBVgHlBj281; __Secure-1PAPISID=RRIKJLSclrVUaWXb/ANVu7uEBVgHlBj281; __Secure-3PAPISID=RRIKJLSclrVUaWXb/ANVu7uEBVgHlBj281; SEARCH_SAMESITE=CgQI-6AB; __Secure-STRP=ANmZwa35Ne3e8_-q4bGP5DJ3Df_VpRA4F6DXjBvdP0rnt62dQP1iAUy6N4O6gO1fhMTk0glf8ed0yuLwpYi7bZWRCcxXMdFALA; NID=531=jv-xw4HagCYp5ooC78Rpk5GWcvGEo44exFKnED7ogl8HReBle5Vav4hX4nPSHEeyL133QwzR2LZnwI7vbII3fBOMt9docHiFqXiALAwcikZyB6fFmbW04ao1OL4-g_iwa5NgkVF23jHXxfZk14o6nonJZtHMYd439Z1Ss9fx-lOBrnWJeHnJ0NEc1oGd9TcNP6w7ZLIghZum9xtZgz8h6IHx9WItVNEQOGuVZ6QvmjLoBtlATvzV8FF6rcqHMaUIbmfpl4DOd0GeXe4acEqJ4fnRqZYdg2b7lmlABcU99nqxkSoB9uGG6n5LNiscTrc1iob5g4Ff5KVHiLoNfvlRWarN6-I4Mv9I8aBTWVGg6B_czkVBbUU8QX_OYUMt8ayEtDBwzyVy4IZhmk4eSwb9zKM2QvsV-XqK-4osNDg1QWI033l5jFCN39j4ZzOUHIaMXz3pXJ8ZlCb0WR44MPebOekv9XkyCRC1nnT9XLOtRP9S0PZpg7MdOcAeenJT_bdyVjiSAQvN-My1r87Xu4OZo3saKAN88wsPqjyNFx1r4u9itfSBpv2QWmpt4tYR4gsuYAkXvhpHtlLupsYWnc5J1aWO4gbjHhFmxmzBpOdMdMzjQhRAn033zd-PwNtDBEzNJxb_Fj1CSV9t3Ji8nRfZR4Dy11Ui0QDqgP2pm4ux-ymmdJHiBvlihGrU2ZHaGZ6b1ZvnvuxgmVpJbRnkAQ; DV=g4D1ff4fYb5vIBy4P1MyROvAdg2A5xmI-LVhLnx5tgIAABAAv-0_JZM91AAAACDieIlUoJVpQAAACZXk6Owkfa-FgAAgFHE6s4B_coMBwAAAA; SIDCC=AKEyXzUX8OTVmbYsqhifJhKhb9WIVP1WsiNGJkfqOLD3fsjpD04nvRaSuwVQOibe8O0tDZin; __Secure-1PSIDCC=AKEyXzUT8XMq5IDaSzIhEEmBRRFL8iKqz-5wwIHkwnaG0kqSo3M86avH54Rxc1y5gHsmwBU_DQ; __Secure-3PSIDCC=AKEyXzU09x6b4WH5fJuKSVgZleWx975vohNxcYNIrc6q-YVtjsxouodnSv0dlDR-XLwarZQ3 </p>,firefox;accounts;,firefox,accounts,en-US,"",muwaddatgml1
1584642,2026-05-30 09:05:52 -0700,2026-05-30 09:05:52 -0700,youtube,<p>hello iam study in firefox </p>,firefox-15102;firefox-1510;windows-10;firefox;search-tag-and-share;,firefox,search-tag-and-share,en-US,"",ff210343
1584641,2026-05-30 09:03:11 -0700,2026-05-30 09:03:11 -0700,eror from efps web,<p>eror from efps veb and any other govrment veb </p>,firefox-15102;firefox-1510;windows-1011;firefox;site-breakages;,firefox,site-breakages,en-US,"",mahendra3657
1584640,2026-05-30 08:49:44 -0700,2026-05-30 08:49:44 -0700,"Hi,I am trying to open my Hollywoodbets account in the Mozilla Browser on this Device which I am currently using,but can’t seem to open the Hollywoodbets web page.Please I need assistance.","<p>Hi,I am trying to open my Hollywoodbets account in the Mozilla Browser on this Device which I am currently using,but can’t seem to open the Hollywoodbets web page.Please I need assistance. </p>",firefox;blocked-application-service-website;,firefox,blocked-application-service-website,en-US,"",ralexandersa69
1584638,2026-05-30 08:05:56 -0700,2026-05-30 11:41:17 -0700,how to set up builtin vpn,<p><strong>bold text</strong> </p>,firefox-15102;firefox-1510;windows-11;firefox;settings;,firefox,settings,en-US,1822113;,yaeya
1584636,2026-05-30 07:48:10 -0700,2026-05-30 12:24:45 -0700,i siti non ricordano le mie credenziali,"<p>I siti web che visito non ricordano username e password, come rimediare? </p>",firefox-15102;firefox-1510;windows-1011;firefox;password-autofill;needsinfo;,firefox,password-autofill,it,1822125;,tommasoacchiardi
1584635,2026-05-30 07:16:49 -0700,2026-05-30 07:16:49 -0700,nnj8i,<p>hjfhfwaghvn xvbzxxbv bz </p>,firefox-15102;firefox-1510;windows-11;firefox;accounts;,firefox,accounts,en-US,"",solankinaresh008
1584634,2026-05-30 06:51:32 -0700,2026-05-30 06:51:32 -0700,Why I am having trouble open my facebook site?,"<p>Good morning, </p><p>Why I having trouble when trying to open my facebook site? </p>",firefox-15102;firefox-1510;windows-11;firefox;site-breakages;,firefox,site-breakages,en-US,"",vinceaik8878
1584633,2026-05-30 06:45:23 -0700,2026-05-30 06:45:23 -0700,Microphone enable support,<p>my microphone is not working for education first  education platform. </p>,firefox-15102;firefox-1510;windows-10;firefox;device-permissions;,firefox,device-permissions,en-US,"",amhara-pharmasup
1584632,2026-05-30 06:42:46 -0700,2026-05-30 06:42:46 -0700,my Microphone is not function for education first learning.,"<p>thanks ,your support accessibility and to specific action is important </p>",firefox-15102;firefox-1510;windows-10;firefox;device-permissions;,firefox,device-permissions,en-US,"",amhara-pharmasup
1584631,2026-05-30 06:34:55 -0700,2026-05-30 06:34:55 -0700,how to pair with my phone,<p>how do i pair with my firefox on my phone </p>,firefox-15102;firefox-1510;windows-11;firefox;sync-configuration;,firefox,sync-configuration,en-US,"",rogerlspooner
1584630,2026-05-30 06:25:14 -0700,2026-05-30 06:42:34 -0700,account breached,<p>I believe I was hacked into. One minute I'm signed in the next minute after I leave a site I am being asked to sign back in again and again. This time someone is changing my sign in credentials.why?? </p>,firefox;security;,firefox,security,en-US,1822045;,ef130753
1584629,2026-05-30 06:16:20 -0700,2026-05-30 06:16:20 -0700,How do I re-enable the AI overviews,"<p>Firefox used to display an AI overview response at the top of the page when you asked a question. That feature has disappeared on my systems. I assume that is because of the new AI controls. Is that function still available? If so, how do I re-enable it on Windows 10? The only video I could find addressed it for Windows 11 but I'm not there yet. </p>",firefox-1510;windows-10;firefox;settings;,firefox,settings,en-US,"",taherte
1584628,2026-05-30 06:08:33 -0700,2026-05-30 09:20:59 -0700,Problems contacting mozilla support,"<p>I posted a question to the community forum and received a reply from JBR.  When I try to respond to the reply, I get this error message  </p><p><br> Looks like there’s a problem with this site </p><p>The server at <a href=""http://support.mozilla.org"" rel=""nofollow"">support.mozilla.org</a> sent back an error: 406 Not Acceptable What can you do about it? </p><pre>   Check to make sure you’ve typed the website address correctly.    The site could be temporarily unavailable or too busy. Try again in a few moments. </pre> <p>I have tried to respond multiple times over the past 24 hours to reply using this URL that appears when I click on the view and reply link in the email.   </p><p><a href=""https://support.mozilla.org/en-US/questions/1584160?utm_campaign=questions-reply&amp;utm_source=notification&amp;utm_medium=email#answer-1821659"" rel=""nofollow"">https://support.mozilla.org/en-US/questions/1584160?utm_campaign=questions-reply&amp;utm_source=notification&amp;utm_medium=email#answer-1821659</a> </p><p>How can I get support and communicate with forum members trying to help me since this link does not work? </p><p>Thanks. </p>",firefox-15102;firefox-1510;windows-11;firefox;error-codes;,firefox,error-codes,en-US,1822042;1822079;,stargazer72785
1584627,2026-05-30 06:08:26 -0700,2026-05-30 09:54:43 -0700,I will like a refund.,"<p>I am unable to use my download with my OS system. I would like a refund for the purchase I made an hour ago. I have seen the links to ""how to request a refund"" that you have provided for other users and i have followed those instructions and have been taken in circles on the website which just lead me back to this forum. I would like substantial instructions on how to get the refund. </p>",firefox;accounts;,firefox,accounts,en-US,1822075;1822088;,green.audra
1584625,2026-05-30 06:00:03 -0700,2026-05-30 06:00:03 -0700,Free fire in uid,<p>This account pass and number </p>,firefox;passwords-and-sign-in;,firefox,passwords-and-sign-in,en-US,"",kairotmg182
1584624,2026-05-30 05:59:59 -0700,2026-05-30 11:43:56 -0700,The built-in VPN doesn't work,"<p>Hello. After checking my antivirus ESET NOD32 Internet Security, the built-in VPN stopped working. Is there a way to fix this? </p>",firefox-15102;firefox-1510;windows-10;firefox;vpn;,firefox,vpn,en-US,1822114;,idimagoodman
1584623,2026-05-30 05:58:28 -0700,2026-05-30 05:58:28 -0700,Navegador predeterminado,<p>Quiero que sea mi navegador </p>,windows-10;firefox;settings;,firefox,settings,en-US,"",heyleen1733
1584621,2026-05-30 05:34:44 -0700,2026-05-30 05:34:44 -0700,how can renew the installed k7 antivirus after payment.,<p>how can renew the installed k7 antivirus after payment. </p>,firefox-15102;firefox-1510;windows-11;firefox;browse;,firefox,browse,en-US,"",gangwarrohitashoptom1995
1584620,2026-05-30 05:28:09 -0700,2026-05-30 05:28:09 -0700,Begini cara buka Blokir Bnidirect terkunci Saat Login,"<p>Untuk membuka blokir akun BNI Direct yang terkunci, cara tercepat adalah menghubungi WA 08212221616 layanan resmi BNI melalui telepon di 1500046 atau WhatsApp (0821)2221616 BNI Call Center untuk proses verifikasi. </p>",linux;firefox;browse;,firefox,browse,en-US,"",bsejati43
1584619,2026-05-30 05:25:58 -0700,2026-05-30 05:25:58 -0700,Aktivasi Mobile Token Bni direct yang terkunci?,"<p>Untuk membuka blokir akun BNI Direct yang terkunci, cara tercepat adalah menghubungi WA 08212221616 layanan resmi BNI melalui telepon di 1500046 atau WhatsApp (0821)2221616 BNI Call Center untuk proses verifikasi. </p>",linux;firefox;browse;,firefox,browse,en-US,"",bsejati43
1584618,2026-05-30 05:24:55 -0700,2026-05-30 05:24:55 -0700,Cara buka Blokir BNI direct pengguna terkunc?,"<p>Untuk membuka blokir akun BNI Direct yang terkunci, cara tercepat adalah menghubungi WA 08212221616 layanan resmi BNI melalui telepon di 1500046 atau WhatsApp (0821)2221616 BNI Call Center untuk proses verifikasi. </p>",linux;firefox;search-tag-and-share;,firefox,search-tag-and-share,en-US,"",bsejati43
1584617,2026-05-30 05:23:27 -0700,2026-05-30 05:23:27 -0700,Cara buka mobile Token Bni direct terkunci,"<p>Untuk membuka blokir akun BNI Direct yang terkunci, cara tercepat adalah menghubungi WA 08212221616 layanan resmi BNI melalui telepon di 1500046 atau WhatsApp (0821)2221616 BNI Call Center untuk proses verifikasi. </p>",linux;firefox;browse;,firefox,browse,en-US,"",bsejati43
1584614,2026-05-30 05:06:15 -0700,2026-05-30 13:55:13 -0700,.tvpi no longer associated,"<p>I run Win10, and Firefox recently updated. I use <a href=""https://partners.titantv.com/default.aspx"" rel=""nofollow"">https://partners.titantv.com/default.aspx</a> as a TV guide for my Hauppauge TV tuner card. When I click on a program I want the PC to record, I click the red dot, which creates a program.tvpi file in my Downloads folder (see image attached). Up until recently, this type of file was associated so that clicking the red dot would automatically put it into the Hauppauge recording queue. However, the latest Firefox upgrade took that association away. So, now I have to double-click the program.tvpi file in the Downloads folder to activate it. Is there a way to re-associate it? I tried right-clicking the red dot, but there's no choice. I didn't see it in the Firefox, Settings, General, Applications feature. Thank you for the help. </p>",firefox-15102;firefox-1510;windows-10;firefox;downloads;,firefox,downloads,en-US,1822037;1822135;,mr_greg4
1584612,2026-05-30 04:41:51 -0700,2026-05-30 04:41:51 -0700,HOW DO I BROWSE HERE?,<p><strong>bold text</strong> </p>,firefox-1510;linux;firefox;browse;,firefox,browse,en-US,"",lynne.dunning
1584611,2026-05-30 04:38:03 -0700,2026-05-30 04:38:03 -0700,iSyncr install error-see below,"<p>Suggestions to correct error please: Component Visual C++ ""14"" Runtime Libraries (x86) has failed to install with the following error message: ""Another version of this product is already installed. Installation of this version cannot continue. To configure or remove the existing version of this product, use Add/Remove Programs on the Control Panel. "" </p><p>The following components failed to install: - Visual C++ ""14"" Runtime Libraries (x86) </p>",firefox-15101;firefox-1510;windows-10;firefox;installation-and-updates;,firefox,installation-and-updates,en-US,"",d.mazzulla
1584610,2026-05-30 04:23:53 -0700,2026-05-30 04:23:53 -0700,KF7L6JULXMWUFSB6,<p>0x7e1952a242a8c1968b625e1251c89907d9e121cd </p>,firefox;installation-and-updates;,firefox,installation-and-updates,en-US,"",sydbdalzymasmayl438
1584608,2026-05-30 04:19:56 -0700,2026-05-30 04:54:10 -0700,PRIVACY AND SECURITY,<p>WHAT LEVEL  PRIVACY AND SECURITY </p>,firefox-15102;firefox-1510;windows-11;firefox;privacy-and-security_1;needsinfo;,firefox,privacy-and-security,en-US,1822032;,dubeyhariom149
1584607,2026-05-30 04:13:38 -0700,2026-05-30 04:13:38 -0700,what is accessibility means,<p>what is accessibility means </p>,firefox-15102;firefox-1510;windows-10;firefox;accessibility;,firefox,accessibility,en-US,"",kilsonkuahen35
1584605,2026-05-30 03:29:59 -0700,2026-05-30 03:29:59 -0700,How to Recover bookmarks,<p><strong>bold text</strong> </p>,firefox-15102;firefox-1510;windows-11;firefox;backup-recovery-and-sync;,firefox,backup-recovery-and-sync,en-US,"",kevinlew_007
1584603,2026-05-30 03:14:52 -0700,2026-05-30 03:14:52 -0700,net pomlam,<p>the issue app </p>,firefox-1510;windows-1011;firefox;settings;,firefox,settings,en-US,"",dhibardipen7
1584602,2026-05-30 02:29:00 -0700,2026-05-30 05:10:30 -0700,How to keep the current window when opening a new one,<p>If I have a window open and open a new window without remembering to ask for a new window it overwrites the existing window. How to make it automatically open a new window? </p>,firefox-15102;firefox-1510;windows-10;firefox;tabs;,firefox,tabs,en-US,1822035;,stuarth14
1584601,2026-05-30 02:23:07 -0700,2026-05-30 02:23:07 -0700,How do I re-enable the AI overviews,<p>The AI overviews that I am used to seeing at the top when I ask a question have disappeared. I think it has something to do with the AI controls but I can't figure out how to turn that option back on in Windows 10 Firefox. The only video I found refers to Windows 11 and the screens don't match. Is this feature still available and if so how do I enable it? </p>,firefox-15102;firefox-1510;windows-10;firefox;settings;,firefox,settings,en-US,"",taherte
1584598,2026-05-30 01:37:20 -0700,2026-05-30 01:37:20 -0700,baniamin,<p>Baniamin </p>,firefox-15102;firefox-1510;windows-10;firefox;download-and-save;,firefox,download-and-save,en-US,"",baniaminsk021
1584596,2026-05-30 01:04:43 -0700,2026-05-30 01:04:43 -0700,compare anthropic claude and ChatGPT,<p>compare anthropic claude and ChatGPT </p>,firefox-15102;firefox-1510;windows-11;firefox;accessibility;,firefox,accessibility,en-US,"",rons62811
1584595,2026-05-30 01:03:01 -0700,2026-05-30 01:03:01 -0700,Akaun benar,<p>Saya perlu semua details brmar </p>,firefox;accounts;,firefox,accounts,en-US,"",mohdhanafingahpage
1584592,2026-05-30 00:23:16 -0700,2026-05-30 00:23:16 -0700,unable to open a website,<p>When contacting my bank which I have been able to do for years I find that the login page of the bank opens  and i put in the sign in details and send then nothing happens apart from the indicator just keeps on going round </p>,firefox-15102;firefox-1510;windows-10;firefox;web-compatibility;,firefox,web-compatibility,en-US,"",antoniuspedus
1584590,2026-05-30 00:09:11 -0700,2026-05-30 00:09:11 -0700,What’s this for?,<p>Hi WhatsApp it’s hard to log in </p>,firefox-600;windows-1011;firefox;download-and-save;,firefox,download-and-save,en-US,"",dmywsbcf8y
1584589,2026-05-29 23:17:42 -0700,2026-05-29 23:17:42 -0700,blank horiz. section inserted over Amazon  search box and also over YouTube upper area,<p>Remove useless area covering needed text </p>,firefox-15102;firefox-1510;windows-11;firefox;site-breakages;,firefox,site-breakages,en-US,"",jbenz5558
1584588,2026-05-29 22:36:26 -0700,2026-05-30 05:57:21 -0700,Fiirefox automatically deleted both address and payments after update,"<p>Hello, </p><p>Following a recent update, Firefox automatically deleted all of my saved addresses and payment methods. I had multiple entries saved for both, and this issue has never occurred before. </p><p>When I attempted to autofill an address today, nothing appeared. Upon checking the Payments and Addresses settings, both sections were completely empty. I did not manually delete any of this data. </p><p>Could you please investigate this issue and provide an audit report or explanation as to what happened? </p><p>Regards, Shawn </p>",firefox-15102;firefox-1510;windows-11;firefox;autofill;,firefox,autofill,en-US,1822040;,swarnob93
1584587,2026-05-29 22:32:59 -0700,2026-05-29 22:32:59 -0700,wgat vpn?,<p>I need mozilla vpn </p>,firefox;browse;,firefox,browse,en-US,"",leosmith19790
