id,created,updated,title,content,tags,product,topic,locale,answers,creator
1584584,2026-05-29 22:18:40 -0700,2026-05-29 22:18:40 -0700,"Lesezeichensicherung weg, ich benötige ein bestimmtes Profil zur Widerherstellung.","<p>Hallo, </p><p>ich hatte bereits Anfang des Jahres beim Einrichten meines Laptops Probleme damit, meine Lesezeichen wiederherzustellen. Damals habe ich es jedoch mithilfe eines älteren Profils geschafft. </p><p>Nun musste ich den Laptop neu aufsetzen und finde die passende Sicherungsdatei der Lesezeichen nicht mehr. Ich wollte die Lesezeichen daher wieder wie gewohnt zurückholen. Leider gibt es jedoch kein älteres Profil als 24 Stunden. Das bedeutet, dass alle Lesezeichen verschwunden sind. </p><p>Gibt es eine Möglichkeit, auf ein Profil zuzugreifen, das ein oder zwei Wochen oder sogar vier Monate alt ist? Und vor allem wie komm ich da ran? </p><p>VG Gritt </p>",firefox-15102;firefox-1510;windows-11;firefox;recover-data;,firefox,recover-data,en-US,"",gritt.weise
1584583,2026-05-29 22:16:58 -0700,2026-05-29 22:16:58 -0700,how do i increase the contrast?,<p><strong>bold text</strong> how do i increase the contrast? <strong>bold text</strong> </p>,firefox-1510;mac-os-x-1015;firefox;accessibility;,firefox,accessibility,en-US,"",aaracom
1584582,2026-05-29 22:03:58 -0700,2026-05-29 23:06:53 -0700,How do I disable vertical tabs,<p>I'm spending way more time on calls daily from the same people on turning them back off. </p>,firefox-1510;windows-1011;firefox;tabs;,firefox,tabs,en-US,1822001;1822010;,Colin.Warren
1584581,2026-05-29 21:47:56 -0700,2026-05-30 05:49:01 -0700,"I had to reload Windows 10 and lost Firefox as well as other apps. Can I recover my Firefox as it was with all extensions,bookmarks and passwords  thanks",<p>I had to reload windows 10 on my pc and lost all my Firefox settings including bookmarks passwords and extensions. Can I recover my settings. .thanks </p>,firefox;recover-data;,firefox,recover-data,en-US,1822039;,pjlewin
1584578,2026-05-29 21:19:21 -0700,2026-05-29 21:45:53 -0700,Firefox bookmarks are missing,"<p>Hello, </p><p>I recently reinstalled Windows on my computer, and after setting everything up again, I noticed that all of my Firefox bookmarks are missing. </p><p>I would like to know if it is possible to recover or restore my bookmarks. Before reinstalling Windows, I was using Firefox normally and had a large collection of saved bookmarks. Unfortunately, I can no longer find them after the reinstall. </p><p>Could you please let me know if there is any way to recover them, either from my Firefox account, a backup, or any other method? </p><p>Thank you for your help. </p>",firefox-15102;firefox-1510;windows-11;firefox;recover-data;,firefox,recover-data,en-US,1821994;,johannes.null
1584577,2026-05-29 21:16:35 -0700,2026-05-29 22:20:23 -0700,Today Direct TV stopped providing me content via Firefox. Why?,"<p>I have been getting Direct TV using Firefox as my browser. Today I was told that could no longer happen ""at this time"" </p>",firefox-15102;firefox-1510;windows-11;firefox;web-compatibility;,firefox,web-compatibility,en-US,1822002;,rbowen241494
1584575,2026-05-29 20:50:42 -0700,2026-05-30 08:42:08 -0700,"I used to have my favorite tabs on the main page. I went away for two weeks and didn't use my computer, but when I came back, I was greeted by such a blank page and I don't know how to get everything back. Please help.",<p>Please return my previously pinned tabs. It will be very difficult for me to use your browser if nothing changes. </p>,firefox-1500;windows-1011;firefox;new-tab;,firefox,new-tab,en-US,1822069;,evgeniasuhoroslova
1584574,2026-05-29 20:50:25 -0700,2026-05-29 20:50:25 -0700,Email not loading,"<p>no sure if this is the right topic place, but nothing else seemed any closer. can anyone tell me what the h*** the error message i keep getting when i do something like ""sort  by unread"" and then go back to ""sort by all""? i also have trouble just logging in - i have 3 profiles that i use.  could not find anything in the troubleshooting section and i don't think it would be from the malware app as everything worked just fine for several years with this running any help would be greatly appreciated! wolfgang </p>",firefox-15102;firefox-1510;windows-11;firefox;site-breakages;,firefox,site-breakages,en-US,"",wolfgang38
1584573,2026-05-29 20:46:55 -0700,2026-05-29 20:46:55 -0700,🎤 Lead:  🎶 বিসমিল্লাহ বলে শুরু হয় প্রতিটি সুরের যাত্রা আল্লাহর নামেই শেষ হয় আত্মার সব ব্যথা…  👥 Crowd: “আল্লাহ… আল্লাহ…” 🌙,"<p>🎤 Lead: </p><p>🎶 বিসমিল্লাহ বলে শুরু হয় প্রতিটি সুরের যাত্রা আল্লাহর নামেই শেষ হয় আত্মার সব ব্যথা… </p><p>👥 Crowd: “আল্লাহ… আল্লাহ…” 🌙<a href=""http://🎤"" rel=""nofollow"">Lead:  🎶 বিসমিল্লাহ বলে শুরু হয় প্রতিটি সুরের যাত্রা আল্লাহর নামেই শেষ হয় আত্মার সব ব্যথা…  👥 Crowd: “আল্লাহ… আল্লাহ…” 🌙 🎤 Lead:  🎶 বিসমিল্লাহ বলে শুরু হয় প্রতিটি সুরের যাত্রা আল্লাহর নামেই শেষ হয় আত্মার সব ব্যথা…  👥 Crowd: “আল্লাহ… আল্লাহ…” 🌙</a> * Bulleted list item# <em><strong>Numbered list item</strong></em> </p>",firefox-15102;firefox-1510;windows-1011;firefox;accessibility;,firefox,accessibility,en-US,"",bdbanglamy
1584571,2026-05-29 20:39:31 -0700,2026-05-29 20:39:31 -0700,actualizar firefox huayra,<p><strong>texto en negrita</strong> </p>,firefox-9102;firefox-910;linux;firefox;installation-and-updates;,firefox,installation-and-updates,es,"",soledadnoeliacruz6
1584569,2026-05-29 20:34:39 -0700,2026-05-29 20:34:39 -0700,my mozilla VPN will not load,"<p>I'm trying to start my VPN . It wont load from my start up page. when I open the firefox page it shows a green checmark with Vpn in the heading bar,but to the right the vpn icon has a red dot. </p>",firefox-15102;firefox-1510;windows-11;firefox;passwords-and-sign-in;vpn;,firefox,passwords-and-sign-in,en-US,"",b1clark
1584567,2026-05-29 20:33:11 -0700,2026-05-30 04:33:38 -0700,help activate firefox free VPN on Mac desktop computer,<p>instructions to activate firefox free VPN on Mac desktop computer </p>,firefox-15102;firefox-1510;mac-os-x-1015;firefox;vpn;,firefox,vpn,en-US,1822003;1822023;1822028;,EGMONROE
1584566,2026-05-29 20:21:40 -0700,2026-05-29 21:49:33 -0700,roblox,"<p>An error occurred during a connection to <a href=""http://roblox.com"" rel=""nofollow"">roblox.com</a>. The OCSP response contains out-of-date information. </p>",firefox-115321;firefox-11532;windows-81;firefox;web-certificates;,firefox,web-certificates,en-US,1821996;,sulamanidzebacho
1584565,2026-05-29 20:20:24 -0700,2026-05-30 08:10:39 -0700,updates,<p>why an update every day...  what are you doing??? </p>,windows-11;firefox;update;,firefox,update,en-US,1821991;1822017;1822058;,koyotee
1584564,2026-05-29 20:17:43 -0700,2026-05-29 20:17:43 -0700,"I thought I had already finish my setup in Foxfire but I still see the Finish setup option on my browser screen when I open it up, what do I need to do?","<p>I thought I had already finish my setup in Foxfire but I still see the Finish setup option on my browser screen when I open it up, what do I need to do? </p>",firefox-15102;firefox-1510;windows-11;firefox;settings;,firefox,settings,en-US,"",trigib49
1584563,2026-05-29 19:27:02 -0700,2026-05-30 05:20:26 -0700,Missing VPN Button,"<p>Hi there, while the built in vpn is working perfectly fine on my windows workstation, i miss the vpn button in the top right corner of this M1 Air.  I tried the advised procedures, but there is no vpn button in the  toolbar setup. My system uses Little Snitch as firewall. Any help would be appreciated. </p><p>best mijabo </p>",firefox-15102;firefox-1510;firefox;vpn;,firefox,vpn,en-US,1821995;1822004;1822036;,mijabo
1584562,2026-05-29 19:21:37 -0700,2026-05-29 19:21:37 -0700,No jala muy bien,<p>Mi celular no me permite 3ntrar a alas apps y poder navegar en internet </p>,firefox;installation-and-updates;,firefox,installation-and-updates,en-US,"",gkeyner06
1584560,2026-05-29 18:47:25 -0700,2026-05-29 18:54:29 -0700,Smart Window not available despite Beta Access,"<p>Hi! </p><p>Some time ago I signed up for the early access of Smart Windows Beta (it was still referred to as AI Window at that time). A couple of weeks ago I got an email saying ""Smart Window Beta is ready for you to try"". However, when I click on the ""Try Smart Window"" link (<a href=""http://clicks.mozilla.org/..."" rel=""nofollow"">clicks.mozilla.org/...</a>), I get to a page that says ""Join the waitlist"" and I still do not have the feature available in Firefox. </p> <ul><li> I am on Firefox desktop on Linux </li><li> My Firefox version is 151.0.2 </li><li> I am signed into Firefox with the same email address as I signed up for the early access with </li><li> I do not have ""Block AI Enhancements"" enabled </li></ul>",firefox-15102;firefox-1510;linux;firefox;smart-window;,firefox,smart-window,en-US,1821975;,usr0
1584559,2026-05-29 18:47:08 -0700,2026-05-29 18:47:08 -0700,"Firefox on macOS loads, opening all windows open at last Quit; then closes all windows; fails to display the window selected from menu","<p><i> </i></p><p><i>MacOS Sequoia 15.7.7; Firefox 141.0.2 </i></p><p><i>The ""one sentence"" in the heading states the problem. I am unable to use Firefox. </i></p><p><i>Firefox loads. It opens windows (I had fourteen open when I last used it successfully; I have many, many tabs). Then it removes each window from the screen. Firefox is in the Menu bar, but no windows are displayed. The windows still show when selecting Window in the menu bar. Selecting a window has no visible effect. File&gt;New Window opens a new window, which works as expected. With one new window open, File&gt;New Window does not open another. </i></p><p><i>Typing a few characters in the Address Bar opens a dropdown with a list of tabs, each with the affordance, Switch to Tab. Clicking on one takes down the list but does not open a window. </i></p><p><i>I would like, for a start, instructions on how to use Firefox starting afresh with no windows. First: having set aside the data that causes this problem.  I suppose that might be simply a new profile. </i> </p>",firefox;launch-failure;macos;,firefox,launch-failure,en-US,"",joaquin.oakland
1584558,2026-05-29 18:41:38 -0700,2026-05-29 19:59:22 -0700,Firefox Profiles is actively destructive!,"<p>Today I got on my laptop and opened Firefox like I do every day.   The browser looked different.  It was an ugly purple color.  A window showed me information about 'Profiles'.  I didn't want any 'Profiles', I just wanted my regular Firefox Browser.  So I deleted the Profiles.  This also ended up deleting all of my bookmarks and passwords!!  It took the last two hours and working with AI to recover my most recent backup which was two years old.  Firefox hasn't been backing up any of my data that I actually need, and it actively deleted the things I rely on.   Your devs and designers really messed up on this one.  I bet no one uses Profiles, but everyone uses passwords and bookmarks to some degree.  Why would you build it like that?!   Shame, Mozilla.  This was a serious error on your part.  Bad product design.   Make it easier to back up the things we need.  Get rid of this useless 'Profiles' function that I bet no one uses. </p>",firefox-15102;firefox-1510;mac-os-x-1015;firefox;profiles;,firefox,profiles,en-US,1821981;,kevinjhawley
1584557,2026-05-29 18:19:35 -0700,2026-05-29 20:18:09 -0700,"How to export cookies on Firefox Android?""","<p>How to export cookies on Firefox Android?"" </p><p><br> How to install and use cookies export extension on mobile browser?"" </p>",duplicate;firefox;undefined;,firefox,undefined,en-US,1821982;,mohitjainj441
1584556,2026-05-29 18:16:28 -0700,2026-05-29 18:16:28 -0700,changing back to color in the browser,<p>I have switched from all color to just a highlighted silver color to all the pics and black and white for the youtube entries.  how can I change back to all color in both.  ijk </p>,firefox-15102;firefox-1510;windows-11;firefox;browser-appearance;,firefox,browser-appearance,en-US,"",ivankuipers52
1584555,2026-05-29 18:15:41 -0700,2026-05-29 18:15:41 -0700,224610,<p><strong>bold text</strong> </p>,windows-11;firefox;download-and-save;,firefox,download-and-save,en-US,"",zulfiqarahamed1122
1584554,2026-05-29 18:14:45 -0700,2026-05-29 23:47:18 -0700,"How to install and use cookies export extension on mobile browser?""","<p>How to install and use cookies export extension on mobile browser?"" </p>",firefox;extensions;,firefox,extensions,en-US,1822016;,mohitjainj441
1584551,2026-05-29 17:52:52 -0700,2026-05-30 05:35:54 -0700,I often accidentally CLOSE my firefox browser. I DO NOT get the OPTION to click on & open all previous TABS! HELP?!!!,"<p>I often accidentally CLOSE my Firefox browser. I DO NOT get the OPTION to click on &amp; open ""all previous OPEN TABS""!   Only one tab at a time &amp; I am not going back five times!     HELP?!!!    Thank You!! </p>",firefox-15101;firefox-1510;windows-11;firefox;tabs;,firefox,tabs,en-US,1822038;,luvcuddlecats
1584550,2026-05-29 17:49:09 -0700,2026-05-30 02:08:57 -0700,Firefox 151.0.2 64-bit MenuBar Bookmarks Link Problems,"<p>As the title indicates, Firefox 151.0.2 64-bit Menu-Bar Bookmarks links redirect incorrectly.  After making the menu bar visible when you click Bookmarks, then Manage you are redirected to Bookmarks --&gt; Search; when you click Bookmarks, then Search Bookmarks you are redirected to Bookmarks --&gt; Recently Visited on the URL bar. </p>",firefox-1510;windows-1011;firefox;bookmarks;,firefox,bookmarks,en-US,1822026;,1proggy
1584548,2026-05-29 17:45:14 -0700,2026-05-29 22:14:39 -0700,How do I pin ALL of my extensions to the toolbar?,"<p>I have added extensions from the Firefox store, an element remover extension, and there is no option to pin it to my toolbar when I click on the gear icon.  I want all of my extensions to be added to the toolbar. </p>",firefox-15102;firefox-1510;mac-os-x-1015;firefox;extensions;,firefox,extensions,en-US,1822000;,recoveryis4me2019
1584547,2026-05-29 17:39:25 -0700,2026-05-29 17:39:25 -0700,My phone can't sign Gmail account all apk,<p>How to use only one user and Play store to sign account problem fixed and Microsoft account to use </p>,firefox;backup-recovery-and-sync;,firefox,backup-recovery-and-sync,en-US,"",abdifatahfarah753
1584546,2026-05-29 17:34:40 -0700,2026-05-29 17:34:40 -0700,texting factory,"<p><a href=""https://verify.evalid.io/token/x0nHXV0CMtM4RL28J_8ISQ_rAAwlyrmSTeq2bFyWyEXGcZiB5_5_qGbp7fNa_GDakpjnJmsQisYbLwVIxeDoWQ7lo9Xn3jTwFfeiZuOI8aFkx2EfRxiBtrOJdSZZiMH6ScLx2sWsp0W8f8_01HzmnGBcD2WGXMuODKlcNxxO5C8JoOltjWA0tJSC4eLhl5RPHZNVD"" rel=""nofollow"">https://verify.evalid.io/token/x0nHXV0CMtM4RL28J_8ISQ_rAAwlyrmSTeq2bFyWyEXGcZiB5_5_qGbp7fNa_GDakpjnJmsQisYbLwVIxeDoWQ7lo9Xn3jTwFfeiZuOI8aFkx2EfRxiBtrOJdSZZiMH6ScLx2sWsp0W8f8_01HzmnGBcD2WGXMuODKlcNxxO5C8JoOltjWA0tJSC4eLhl5RPHZNVD</a> </p>",firefox;browse;,firefox,browse,en-US,"",xolanithobela
1584545,2026-05-29 17:32:00 -0700,2026-05-29 17:34:35 -0700,where do I find My Questions ----- I asked a question of the community and don't know where to find it,<p>I asked a questions of the community and they told me to go to Profiles and My Questions.  I tried all ways but no help.  Will they send me an answer to my email? </p>,firefox-15102;firefox-1510;windows-11;firefox;undefined;,firefox,undefined,en-US,1821955;,maroki1308
1584540,2026-05-29 17:15:28 -0700,2026-05-29 17:15:28 -0700,I used to have a site added on the toolbar so that I could access more than one site that I want,<p>I used to be able to add another site on the top toolbar to the one I am currently on ---- this was on the toolbar at the top of the page.  This ability has disappeared recently. </p>,firefox-15102;firefox-1510;windows-11;firefox;bookmarks;,firefox,bookmarks,en-US,"",maroki1308
1584539,2026-05-29 17:00:04 -0700,2026-05-29 17:00:04 -0700,How do I make a letter,<p>I want to type a letter that I can then print and mail. </p>,firefox-15102;firefox-1510;windows-11;firefox;performance-and-connectivity;,firefox,performance-and-connectivity,en-US,"",kmccoy93010
