id,created,updated,title,content,tags,product,topic,locale,answers,creator
1579538,2026-05-01 23:03:35 -0700,2026-05-02 12:30:38 -0700,Firefox Tabs Keep Wedging,"<p>I recently upgraded from Ubuntu 24.04 to 26.04, using Mate Desktop and Compiz compositor.  I am using Firefox from the Mozilla Team PPA, currently 150.0.1.  I am running custom kernel built from upstream source, currently 6.18.25.  Hardware is a home brew CoffeeLake machine, i7-9700k, 64G of RAM, 2TB WD Black SSD and many TB's of spinning rust, graphics is Intel ARC B50 Pro, ASUS XONAR SE 5.1 Channel 192kHz/24-bit Hi-Res 116dB SNR PCIe Gaming Sound Card.  Prior to upgrading Firefox was not 100% occasionally tabs would wedge, now if I get two hours I'm doing good, I've tried disabling extensions and plugins no help.  Tried with and without hardware decoding, worse without but bad no matter.  Any suggestions how to get stability back? </p>",firefox-1500;linux;firefox;app-responsiveness;,firefox,app-responsiveness,en-US,1815327;,Robert.Dinse
1579536,2026-05-01 22:32:58 -0700,2026-05-01 23:02:34 -0700,sync data,<p>My accounts were hacked and accessed from an ex boyfriend trying to recover my financial and important data </p>,firefox;security;,firefox,security,en-US,1815264;,bethanywestenfelt25
1579535,2026-05-01 22:31:10 -0700,2026-05-01 22:31:10 -0700,pdf files error in loading,"<p>trying to download pdf files drom emails,bank statements or anything in firefox browser </p>",firefox-1500;windows-10;firefox;download-failure;,firefox,download-failure,en-US,"",brucedfd2
1579531,2026-05-01 21:52:54 -0700,2026-05-01 21:53:54 -0700,Post FF 150 Breaks Synology DSM (7.3.x) Drag & Drop Uploads,"<p>Hey everyone! </p><p>I just noticed that post FF's 150 update, I can no longer drag and drop folders into my DSM window. This has been a non issue for over 6 years and all of a sudden, poof. I did find that you can still to this on Safari, but long term, Mozilla and Synology need to address this. There's already a post on the <a href=""https://community.synology.com/enu/forum/1/post/196047?page=1&amp;reply=532388"" rel=""nofollow"">Synology fourms</a>  about it and I've emailed their Support Team to see what they have to day. Posting this here in case anyone has found a workaround in the Config settings pane. </p><p>Thanks! --Brian </p>",firefox-15001;firefox-1500;mac-os-x-1015;firefox;web-compatibility;,firefox,web-compatibility,en-US,1815250;,cronocx
1579530,2026-05-01 21:43:09 -0700,2026-05-01 21:43:09 -0700,cONTENT ON AOL.COM IS NOW NOT SHOWING UP.  IT WORKS ON EVERY OTHER BROSER.  HOW TO FIX?,<p>HOW TO FIX THE PROBLEM? </p>,firefox-1500;windows-1011;firefox;web-compatibility;,firefox,web-compatibility,en-US,"",barryloshin
1579529,2026-05-01 21:40:36 -0700,2026-05-02 05:12:11 -0700,翻译功能不全,<p>页面翻译器 </p>,firefox;languages;,firefox,languages,en-US,1815278;,bulu23902
1579528,2026-05-01 21:31:28 -0700,2026-05-01 22:14:32 -0700,Can you recover lists of my passwords from firefox after my computer was purged from viruses?,"<p>My desktop computer was infected with malware when I was called by a man supposedly from Paypal stating that I has been erroneously charged with over $600 of merchandise and he wanted to get information to refund the money to me. I gave him information (sadly) to enter my computer outfitted with Firefox running on Windows 11. After consulting my bank, they said that there was no way for Paypal to refund the money as he wished to do. Apparently he was infecting my computer while we spoke. I realized that is was a scam shortly after I hung up and shut the computer off. The next morning I took it to our local tech center and they 'cleaned' it. Now I find all of my passwords stored in Firefox are gone. Do you have a way of recovering them? </p>",firefox-1500;windows-11;firefox;recover-data;,firefox,recover-data,en-US,1815261;,krph
1579527,2026-05-01 21:30:35 -0700,2026-05-01 21:30:35 -0700,my phone is hacked,<p>I sent a list and pictures There is a bunch of this kind of stuff in my picture files </p>,firefox;privacy-and-security_1;,firefox,privacy-and-security,en-US,"",ngreene236.ng
1579523,2026-05-01 20:57:06 -0700,2026-05-01 20:57:06 -0700,for privacy,<p>nothing </p>,firefox;privacy-and-security_1;,firefox,privacy-and-security,en-US,"",superebalisticexpialidocious
1579520,2026-05-01 20:29:40 -0700,2026-05-01 20:29:40 -0700,make sure the vpn is on,<p>make sure thare is no virus on my laptop </p>,firefox-15001;firefox-1500;windows-11;firefox;backup-recovery-and-sync;,firefox,backup-recovery-and-sync,en-US,"",1audra2008
1579518,2026-05-01 20:20:14 -0700,2026-05-01 20:20:14 -0700,"is new pdf added auto.. or as extension or what??? win 11, FF 150.0.1","<p><strong>bold text''''</strong><em> is new pdf added auto.. or as extension or what??? win 11, FF 150.0.1</em> </p>",firefox-15001;firefox-1500;windows-1011;firefox;pdfs;,firefox,pdfs,en-US,"",pgjon
1579515,2026-05-01 20:08:06 -0700,2026-05-01 20:08:06 -0700,"""Save As"" portal makes Windows' context menu text invisible","<p>Hi!  </p><p>Really weird issue I've noticed with my Firefox-based browsers. </p><p>Essentially, whenever I am within the ""Save As"" feature of my browser, I am unable to realistically do anything that requires the context menu (e.g. creating a folder, renaming). I can still do things, but each entry in the context menu has no text. </p><p>I am on Windows 11, and am using the most up-to-date verison of both Firefox-based browsers. I do have a lot of customisation software and/or registry changes, but this issue has started to show up after I've spent a while with these changes already implemented. I don't think it's the problem as I have tested without each of these, but I thought worth mentioning if anyone knows of any potential conflicts (and to clear up any confusion from the screenshots). </p><p>An example of the above that I thought would affect this is a registry fix to enable the ""show more options"" setting on the context menu to be selected by default whenever I right click (steps followed here: <a href=""https://www.howtogeek.com/759449/how-to-get-full-context-menus-in-windows-11s-file-explorer/"" rel=""nofollow"">https://www.howtogeek.com/759449/how-to-get-full-context-menus-in-windows-11s-file-explorer/</a>). I've just tested by reversing this change and issue persists, and like I mentioned issue did not occur previously when this fix had already been applied. I hope that's not redundant information, I'm just trying to give as much info as possible! </p><p>I typically use Floorp, but when I noticed this issue I have tried and verified that this issue also happens on regular old Firefox. </p><p>Other browsers I have installed and verified this issue is NOT present on: </p> <ul><li> Microsoft Edge </li><li> Chrome </li><li> Pale Moon </li></ul> <p>The issue only seems to happen on FireFox and Floorp. </p><p>I have attached some images of what it is meant to look like (""expected_context_menu.png"") and what it looks like on FireFox based browsers (""real_context_menu01.png""). </p><p>Initially I though the menu was just useless, but it does appear I can actually use this menu without text as normal. I tested this by using the second-from-bottom option, and then the top-most option that marks the option for ""New Folder"" on the working context menu. I was able to create a folder as expected doing this (""real_context_menu02.png"" and ""real_context_menu03.png""), which suggests that it's just an issue with the text displaying. </p><p>Anyone have any ideas? Of course, I can provide any info about the OS customisation steps I've taken if needed! </p><p>I'd appreciate any help! </p><p>I've never uploaded here before so in case the images don't show the image name, they are uploaded in the order: ""real_context_menu01.png"" ""real_context_menu02.png"" ""real_context_menu03.png"" ""expected_context_menu.png"" </p>",firefox-15001;firefox-1500;windows-1011;firefox;save-content;,firefox,save-content,en-US,"",kneelesscat
1579514,2026-05-01 20:06:53 -0700,2026-05-01 20:06:53 -0700,How do I get access to my Mozilla VPN on my new computer?,<p>I have a paid Mozilla VPN account that is good to Dec 11th 2026.  I have a new computer with Windows 11. How to I attach VPN to Firefox on this new computer and operating system? </p>,firefox-15001;firefox-1500;windows-11;firefox;installation-and-updates;,firefox,installation-and-updates,en-US,"",kastigar1
1579513,2026-05-01 19:49:29 -0700,2026-05-01 19:49:29 -0700,I need someone to help me remove a hacker,<p>My accounts have been hacked since December and I can't get them out they have stole everything from. My Microsoft account and Google accounts. I'm 54 disabled and not a computer wizard but I can get around on my phone need guidance </p>,firefox;privacy-and-security_1;,firefox,privacy-and-security,en-US,"",bignate.ng71
1579512,2026-05-01 19:46:48 -0700,2026-05-01 20:03:14 -0700,need to reset my firefox password,<p>How can I reset my firefox password </p>,firefox-14902;firefox-1490;mac-os-x-1015;firefox;reset-passwords;,firefox,reset-passwords,en-US,1815245;,susanhrichey
1579511,2026-05-01 19:29:34 -0700,2026-05-01 19:29:34 -0700,copying a profile brings up a profile attached to my old firefox login,"<p>Help!  I updated my account to a new email months ago. I have been trying to set up a new different profile. Copying a profile or trying to add a profile adds the newly made profile to my old email address instead of my new email address.  In the new profiles created, I am unable to login to my new email and password. </p>",firefox-1500;windows-11;firefox;profiles;,firefox,profiles,en-US,"",humanitydreamscape
1579510,2026-05-01 19:22:45 -0700,2026-05-01 19:30:41 -0700,upgrade my brower,<p>I have no setting in my menu in order to up grade my brower  I was told I needed to upgrade my compute </p>,firefox-78150;firefox-7815;mac-os-x-1011;firefox;update;,firefox,update,en-US,1815244;,wlaurence34
1579509,2026-05-01 19:16:45 -0700,2026-05-01 19:16:45 -0700,Latest update broke my program in Firefox and then in Firefox for Developers.,"<p>Some faces of a 3d box are now invisible. The HTML is correct and the Inspector shows the faces in pale blue correctly. This worked for many months before the latest update to Firefox. I tried it in Safari and it worked, but I am used to Firefox. I tried Firefox for Developers and it worked until the update today, 5/1/26. Please help. </p>",mac-os-x-1015;firefox;web-compatibility;,firefox,web-compatibility,en-US,"",reculver
1579507,2026-05-01 19:06:07 -0700,2026-05-01 19:06:07 -0700,"if i want to switch it on, it always goes in a circle,-   instead of the turn on button it appears  again`: first steps with vpn......","<p>if i want to switch it on, instead of tehe turn on button the message `first steps with vpn`appears again and again </p>",firefox-15001;firefox-1500;windows-10;firefox;vpn;,firefox,vpn,en-US,"",nofer
1579505,2026-05-01 18:49:49 -0700,2026-05-01 18:49:49 -0700,I don't know what to ask only your assessments  I seek,<p>Assess my Google pixel  on Carrier Google fi </p>,firefox;privacy-and-security_1;,firefox,privacy-and-security,en-US,"",yodhehvavheh0
1579504,2026-05-01 18:44:34 -0700,2026-05-01 21:23:15 -0700,"I am unable to access the 'kingsoopers.com' website, I get an 'Access Denied' message every time.",<p>Tell me if there is a way to clear old data and resume access to the site. </p>,firefox-115351;firefox-11535;windows-7;firefox;blocked-application-service-website;,firefox,blocked-application-service-website,en-US,1815248;,threeoctaves
1579502,2026-05-01 18:40:07 -0700,2026-05-02 10:37:45 -0700,UK Telegraph problem,"<p>I have been quite unable to view comments on <a href=""http://www.telegraph.co.uk"" rel=""nofollow"">www.telegraph.co.uk</a>. The page simply does not appear when I click 'comments'. I have done a Firefox back to defaults refresh which was successful but no joy.  After a look around the internet for solutions I installed Chrome which worked first time and has continued to. Why does Firefox fail? Thanks </p>",firefox-1500;windows-1011;firefox;web-compatibility;,firefox,web-compatibility,en-US,1815260;1815288;1815300;1815311;1815314;,meditek2
1579495,2026-05-01 18:22:39 -0700,2026-05-01 18:24:37 -0700,I already subscribe to Malwarebytes.I don't need an additional VPN.,<p>I already subscribe to Malwarebytes  for VPN and fear that  complicates accessing websites. </p>,firefox-15001;firefox-1500;windows-11;firefox;vpn;,firefox,vpn,en-US,1815232;,howardj1
1579492,2026-05-01 17:52:08 -0700,2026-05-01 17:54:28 -0700,I have been trying to to turn on my vpn but for some reason its not working even after downloading it a lot of times.,<p>I have been trying to to turn on my vpn but for some reason its not working even after downloading it a lot of times </p>,firefox-15001;firefox-1500;windows-11;firefox;vpn;,firefox,vpn,en-US,1815229;,zegonza62
1579491,2026-05-01 17:49:58 -0700,2026-05-01 17:49:58 -0700,"Since latest update can't access Bluesky (claims no internet) on PC, but allows it in private browsing.","<p>I access Bluesky (bsky.app) for business on my PC. Since the last update, I've been unable to access Bluesky from my regular Firefox browser. I can using other browsers, the mobile app, and, oddly, in Firefox private browsing. I've cleared my browser history, cookies, etc. I restarted the computer. I logged out of Bluesky (and now can't log back on the regular PC account because it claims I'm not connected to the internet). Yet, I had no trouble logging in using private browsing. </p><p>I've looked through settings, etc. and can't figure out what could be limiting my ability to access this website. </p>",firefox-15001;firefox-1500;windows-11;firefox;blocked-application-service-website;,firefox,blocked-application-service-website,en-US,"",megheitz
1579490,2026-05-01 17:48:32 -0700,2026-05-01 18:29:45 -0700,"Since the latest Firefox update, I have 2 websites that will not load","<p>Since the latest Firefox update, I cannot load my primary banking account, and one of my work websites won't load.  I can access both of these sites on other browsers. </p>",firefox-1500;mac-os-x-1015;firefox;web-compatibility;,firefox,web-compatibility,en-US,1815230;1815234;,robington63
1579489,2026-05-01 17:24:17 -0700,2026-05-02 08:38:15 -0700,Storie che fanno riflettere (storie consigliate) non accessibili,"<p>Buonasera, da un' pò di tempo non riesco più ad più a visualizzare le storie che fanno riflettere (storie consigliate nella scheda inziale. Allego un'immagine di come appare la pagina. Grazie in anticipo per la risposta. MP </p>",firefox-15001;firefox-1500;windows-11;firefox;new-tab;,firefox,new-tab,it,1815231;1815239;1815297;,massimo.pallavicini
1579488,2026-05-01 17:16:35 -0700,2026-05-01 19:13:35 -0700,why there are hidden extension in Firefox which are not showing up in general extension setting?,<p>there are 4 extension hidden which are not showing up in general extension setting which are from Firefox. </p>,firefox-15001;firefox-1500;windows-10;firefox;extensions;,firefox,extensions,en-US,1815240;,ayush0477
1579487,2026-05-01 17:11:23 -0700,2026-05-01 17:11:23 -0700,"Mozilla browser VPN options and toolbar button disappeared, cant get it back","<p>The Firefox browser VPN option and toolbar button for Firefox 150 was originally showing up after a recent update (was not signed into the browser), but when I signed into the account as needed to activate VPN, the VPN toolbar button and options under security settings disappeared.  I can't find the vpn button to add back under the 'customize toolbar setting' as suggested. And when I go under privacy and security settings, the VPN section is no longer there. How do I get the VPN options back?  I tried signing out of Firefox and then back in. I tried disconnecting 'sync' from the computer and that didn't change anything either. I've updated the browser on all devices I'm signed into to 150.0.1.  The VPN toolbar button or setting option does not show up on any device I am using. The only browser I initially saw the VPN options on was the browser that I wasn't initially signed into, and it disappeared after I signed into the browser with the account.  </p><p>None of the suggestions at the following help page work to get the VPN options back in the browser settings, or toolbar: <a href=""https://support.mozilla.org/en-US/kb/built-in-vpn?utm_source=www.firefox.com&amp;utm_medium=referral&amp;utm_campaign=whatsnew-150#w_turn-on-vpn-in-firefox"" rel=""nofollow"">https://support.mozilla.org/en-US/kb/built-in-vpn?utm_source=www.firefox.com&amp;utm_medium=referral&amp;utm_campaign=whatsnew-150#w_turn-on-vpn-in-firefox</a> </p>",firefox-15001;firefox-1500;windows-10;firefox;vpn;,firefox,vpn,en-US,"",Silverrock
