id,created,updated,title,content,tags,product,topic,locale,answers,creator
1439562,2024-02-12 20:06:26 -0800,2024-02-12 20:06:26 -0800,Browser is installed twice,<p>I have Firefox version 100.0 (64-bit) and version 122.0.1 (64-bit) installed somehow. Both versions when you click on Help&gt;About Firefox say they are up to date. </p><p>I can uninstall the 122.0.1 version. I cannot uninstall the 100.0 version. </p><p>100.0 says it is up to date but in the top right corner there is a box that says: Update available Firefox couldn't update automatically. Download the new version - you won't lose saved information or customizations. </p><p>If I tell it to download I get the 122.0.1 version installed separately from the 100.0 version. </p><p>How do I get only ONE installation of Firefox? </p>,desktop;other;windows-11;firefox-1220;firefox-12201;,firefox,other,en-US,"",PissedTheEffOff
1439561,2024-02-12 19:48:15 -0800,2024-02-12 19:48:15 -0800,can't upload attachments,"<p>I am no longer able to add attachments to gmail or upload images or attachments to websites. When I click on the attachment icon or upload button, my finder window does not open. However, it works in other browsers. How can I fix this? </p>",desktop;fix-problems;mac-os-x-1015;firefox-1220;,firefox,fix-problems,en-US,"",core.empowerment
1439559,2024-02-12 19:24:03 -0800,2024-02-12 19:24:03 -0800,side by side error thunderbird doesn't load windows 11,"<p>is there an easy way to fix a side by side error in thunderbird,   thunderbird doesn't load  o/s windows 11 </p>",desktop;other;windows-10;,firefox,other,en-US,"",davidparks5001
1439557,2024-02-12 19:00:33 -0800,2024-02-12 19:00:33 -0800,tidal max,"<p>Tidal's max sound quality can be played in Chrome and Vivaldi, but not in Firefox. </p>",desktop;other;windows-11;firefox-1220;firefox-12201;,firefox,other,en-US,"",axolotl2048
1439555,2024-02-12 18:13:55 -0800,2024-02-12 18:13:55 -0800,Repeating dns queries for same domains,"<p>Hello, I have been looking at my traffic and discovered that my firefox for some reason does multiple DNS queries for the same domain, usually 6 times or 3 times, why is that happening I have checked with chrome and it does only 1 request per domain name. </p><p>I have attached a wireshark dump, the response is there instantly in very few ms yet it keeps querying the same name again. </p><p>My version is 115.3.1esr (64-bit) I have checked in about:config with dns and couldnt find anything relevant. </p>",windows-7;desktop;fix-problems;firefox-1153;firefox-11531;,firefox,fix-problems,en-US,"",xoxoxek
1439554,2024-02-12 17:48:04 -0800,2024-02-12 17:48:04 -0800,Video playback NY Times not working in v 122.0.1,<p>Video playback NY Times not working in v 122.0.1 </p><p>Got error message from NYT:  Video playback is not supported in your current browser TO view NYTimes video please upgrade your browser to the latest version </p>,desktop;other;windows-10;firefox-1220;firefox-12201;,firefox,other,en-US,"",wcolmers
1439552,2024-02-12 17:06:57 -0800,2024-02-12 17:06:57 -0800,MacOS notifications showing the icon for the wrong profile in the Notification Center.,"<p>Basically, I have three different profiles in my Firefox with three different app icons, but only one of has notifications. </p><p>For some odd reason, the MacOS notification center is showing the wrong profile. It's like only one of the profiles is visible, or working. I tried resetting it, which is apples way of ""deleting"" it, but Firefox keeps forcing that particular profile and not my main one.  </p><p>Firefox 122.0.1 (64-bit) MacOS Ventura 13.5.1 (22G90) </p>",desktop;other;mac-os-x-1015;firefox-1220;firefox-12201;,firefox,other,en-US,"",thiagoperrysampaio
1439550,2024-02-12 16:45:03 -0800,2024-02-12 17:17:58 -0800,Edge Opens Links instead of default browser Firefox,"<p>Firefox is my default browser; however, when I click on a link, MS Edge opens it instead of Firefox even thought Firefox is already opened.  How can I prevent that from happening? </p>",desktop;other;windows-10;firefox-1220;,firefox,other,en-US,1636535;,philselig
