id,created,updated,title,content,tags,product,topic,locale,answers,creator
1464159,2024-09-17 16:28:04 -0700,2024-09-17 16:28:04 -0700,Gmail account recovery,"<p>Same Gmail otp problem please help <a href=""http://sujonhasan1email.com@gmail.com"" rel=""nofollow"">sujonhasan1email.com@gmail.com</a> </p>",firefox;backup-recovery-and-sync;,firefox,backup-recovery-and-sync,en-US,"",magurab70
1464158,2024-09-17 16:19:11 -0700,2024-09-17 16:19:11 -0700,Personal Account.,<p>Strong Password. </p>,firefox;browse;,firefox,browse,en-US,"",daleconradalimen581
1464156,2024-09-17 16:05:48 -0700,2024-09-17 16:05:48 -0700,I have used Evernote web clipper for years but its icon has disappeared from my menu and I have been unable to recover it.,"<p>I have used Evernote web clipper for years and Firefox says I am still connected, but its icon has disappeared from my menu bar and I have been unable to recover it. </p>",firefox;performance-and-connectivity;,firefox,performance-and-connectivity,en-US,"",tbarksdl
1464155,2024-09-17 15:52:07 -0700,2024-09-17 15:52:07 -0700,"""Couldn't load XPCOM.""","<p>Greetings,  </p><p>After having been ""On th' Net"", for approx. 6 hours earlier today, with No Issues,......About an hour ago, (And No,.... I didn't recieve a Firefox Update today, to the best of my knowledge, although today has been very chaotic &amp; stressful),....I tried to open a PDF, of which I view on the Firefox Browser, &amp; I got a ""Couldn't load XPCOM.""  </p><p>I then ""Right Clicked"" the Firefox icon &amp; tried to open Firefox as an Administrator, &amp; I got the same message.    </p><p>I then ""Right Clicked"" the Firefox icon, &amp; sought the ""Refresh Button"", But there is none.  </p><p>The ""Installed Browser"" for Windows 10, is how I've managed to get to this Forum, of which I do not trust.  </p><p>My Email is via YAHOO/Frontier, &amp; since I, for the moment, cannot access My email, of which, I'm thinking that to see any replies to this situation that I'm in, that I will have to use YAHOO, so as to access Frontier.    </p><p>I've seen where situations like this have been occurring, &amp; the most recent that I saw is this:   </p><p>cor-el Moderator Top 10 Contributor 1/12/23, 1:08 AM more options An error message about XPCOM missing or about platform version usually happens because of a failed Firefox update that left you with a mixture of old and updated files in the Firefox program folder. This can happen in case security software was keeping a handle of some of the files in the Firefox program folder preventing Firefox from replacing all the files. You need to do a clean reinstall and remove the Firefox program folder to ensure that all files are replaced. You may have to disable security software temporarily in case the problem persists. </p><p>You can find the full installer of the current Firefox release (108.0.2) in all languages and all operating systems here: </p><p><a href=""https://www.mozilla.org/en-US/firefox/all/#product-desktop-release"" rel=""nofollow"">https://www.mozilla.org/en-US/firefox/all/#product-desktop-release</a> <a href=""https://www.mozilla.org/en-US/firefox/108.0.2/releasenotes/"" rel=""nofollow"">https://www.mozilla.org/en-US/firefox/108.0.2/releasenotes/</a>   </p> <hr>  <p>Will I be able to save All of My Favorites? I have several years of Favorites there &amp; many of them are critically needed. I realize that the Add Ons/Themes/Settings will have to be re-installed/adjusted, but I'm good with that.   </p><p>Again,... Keeping My Favorites is critical, &amp; ""If"" they would be deleted, then is there any Possibility of Tech/Engineering accessing My Firefox Folder &amp; saving them?  </p><p>Regards </p>",firefox;performance-and-connectivity;,firefox,performance-and-connectivity,en-US,"",DavidDeBord
1464154,2024-09-17 15:41:49 -0700,2024-09-17 15:41:49 -0700,"Recurring audio issue with Firefox- Audio cutting out when two sounds play at a time, some bitrate settings on computer prevent Firefox from playing audio at all","<p>Hi there- </p><p>On my current Dell laptop (Windows 11) I have had a recurring issue with Firefox wherein any time two sounds play at the same time (say, a Youtube video is playing in the background and I have a sound play in a browser game) it makes one of the audio channels cut out for about a second. This issue only happens with Firefox, and I previously fixed this by changing the bitrate in my audio output settings. However, after an update, this issue has returned, and the bitrate settings I was using that were able to fix this issue now doesn't allow me to play audio on Firefox at all. So now I have no way to avoid the strange bug that causes audio to cut out. </p><p>I would love some advice- is this on Firefox's end, or my computer's? Is there a driver I could install or something to avoid this bug? What causes it? </p><p>Cheers, Noa </p>",settings;firefox;,firefox,settings,en-US,"",wygolvillage
1464153,2024-09-17 15:37:47 -0700,2024-09-17 15:37:47 -0700,mehran zahiri,<p><em><strong></strong></em> </p>,firefox;accounts;,firefox,accounts,en-US,"",mehranzahiri
1464147,2024-09-17 14:49:52 -0700,2024-09-17 14:49:52 -0700,Microsoft Edge Appears to have taken over Firefox.,"<p>I noticed after a forced Microsoft Windows 10 update, AND whilst using CC Cleaner to clean out the cache, I was no longer prompted to close Firefox.  I never opened Microsoft Edge and was not asked to close it to complete the CC Cleaner process.  I don't want Mircosoft Edge and I especially don't like the feeling that Firefox must use Edge to operate.  What can I do to clear this up. </p>",firefox;firefox-1300;performance-and-connectivity;,firefox,performance-and-connectivity,en-US,"",WOMANTIC
1464144,2024-09-17 14:25:40 -0700,2024-09-17 14:25:40 -0700,snelkoppelingen op foxstartpagina in een groep onderbrengen,"<p>LS, op de startpagina van Fox heb ik aantal snelkoppelingen staan. kan ik die koppelingen in één of meerdere groepen opslaan.dus een groep maken waar die koppelingen in staan, en dat ik die groep dan weer zie op de startpagina van Fox. hoor graag, ben benieuwd of dit kan. groet Ben </p>",settings;firefox;,firefox,settings,nl,"",b.eerhart
1464143,2024-09-17 14:25:27 -0700,2024-09-17 14:25:27 -0700,Cannot access websites because I'm using Firefox.,<p>I have 6 websites that I currently cannot sign into using Firefox. Support tells me to use those two crap browsers Chrome and Edge. I end up using Edge because it is embedded in my computer and I cannot delete. I will not install Chrome and have put on Avast Secure Browser and CClean browser. Both are just Chrome with a new gooey. My Father is also having the same trouble. Most of the sites are for Utilities and rewards programs. Avast is also blocked. Are you aware and working on getting this fixed? </p>,firefox;windows-10;firefox-1300;browse;,firefox,browse,en-US,"",anewdawn42
1464141,2024-09-17 14:02:26 -0700,2024-09-17 14:02:26 -0700,all my password before 2 days are gone,<p>I need all my saved logins before 2 days </p>,firefox;backup-recovery-and-sync;,firefox,backup-recovery-and-sync,en-US,"",tabishjawaid5
1464140,2024-09-17 14:01:50 -0700,2024-09-17 14:35:39 -0700,Firefox versions.,<p>I have a IP intercom that only works with Firefox 127.0.2 Now Firefox automatically upgrades to the latest version and I'm unable to prevent this. I'm unable to manage my intercom with the latest version. How do I turn off automatic updates. </p>,firefox;installation-and-updates;,firefox,installation-and-updates,en-US,1675179;1675182;,ryan.plautz
1464138,2024-09-17 13:43:18 -0700,2024-09-17 13:43:18 -0700,"Con Mozilla no me deja entrar a la página www.sede.fnmt.es, para descargarme un certificado electrónica de la fnmt para poder hacer mi declaracion de la renta (por ejemplo) Con otros navegadores no tengo problema alguno","<p>Me gustaría poder hacerlo con este navegador Mozilla, que es el que tengo predeterminado y me gusta. </p>",firefox;privacy-and-security_1;,firefox,privacy-and-security,es,"",lasopedro8
1464135,2024-09-17 13:36:34 -0700,2024-09-17 13:36:34 -0700,Home page (ATT/Yahoo) problem when using Firefox,"<p>ATT/Yahoo is my homepage. When reading an article on the ATT(Currently)/Yahoo homepage, there is a comments section at the end of each article. When trying to access the comments section, it disappears when clicked on. On other homepages (MSN, eg),  it works fine. Any help would be appreciated. </p>",settings;firefox;firefox-1300;,firefox,settings,en-US,"",sid307
1464134,2024-09-17 13:33:47 -0700,2024-09-17 13:33:47 -0700,Amazon Music Ultra HD,"<p>Hello I was listening to a song from amazon music premium like usual but today the website updated and somehow it said the browser didn't support high quality songs... It didn't show it, but it seems it never supported hq music, is there a way to play it on the best quality or is it a limitation on firefox's part? How can I fix it if it's just an error? </p><p>""Browser does not support HD quality"" </p>",firefox;performance-and-connectivity;,firefox,performance-and-connectivity,en-US,"",mineiroclasher20
1464133,2024-09-17 13:28:26 -0700,2024-09-17 16:14:46 -0700,I lost Firefox,<p>I lost my original Firefox. I'm using a Firefox with no original bookmarks or top menus. Everything is gone. </p>,firefox;backup-recovery-and-sync;,firefox,backup-recovery-and-sync,en-US,1675168;1675177;1675198;,pfschmieg17
1464128,2024-09-17 13:11:58 -0700,2024-09-17 14:42:41 -0700,I suddenly have a blinking line in Firefox search bar.,"<p>I just noticed that when I start writing in the Firefox URL bar there is a blinking straight bar that remains at the start. And if I click of somewhere else and then start writing again, the bar remains blinking at the start of the new text. I also don't have the straight line you get when moving left or right in the text using the arrow keys.  </p><p>I couldn't capture the bar with a screen shot so I have edited the images to where the bar is when beginning typing, and then after I have clicked of the text bar and then entered it again and typed some more.  </p><p>Thanks for any help I can get. </p>",firefox;browse;,firefox,browse,en-US,1675173;1675185;,mrsiimc5784
1464115,2024-09-17 12:07:41 -0700,2024-09-17 12:07:41 -0700,Mac OS Sequoia - Local Network Access Issue,"<p>After taking the latest update to Mac OS 15.0 - Sequoia I am not able to pull up any resources on my home network. I'm not sure if it was just added in this latest version, but there appears to be a privacy setting under Settings &gt; Privacy and Security &gt; Local Network that is likely the culprit I've discovered after testing another browser (MS Edge) that was having the same issue. The only issue for me is Firefox doesn't show as an app on that list for me to enable the setting so I can work with my local resources. Hoping someone can help. </p>",firefox;privacy-and-security_1;,firefox,privacy-and-security,en-US,"",bobby.dorman
1464109,2024-09-17 11:35:34 -0700,2024-09-17 11:35:34 -0700,"""Need Help Installing Mini Militia MOD APK on PC""","<p>Hello everyone, I need some gaming type guideline for game installation, I had tried to install mini militia mod apk game in PC but it nor installed, can anyone guide me how to install it. this is site where i have downloaded <a href=""https://theminimilitiamodapk.com/"" rel=""nofollow"">read more</a> </p>","",firefox,installation-and-updates,en-US,"",tr8192131
1464108,2024-09-17 11:31:33 -0700,2024-09-17 16:17:36 -0700,how do i find the gecko id i need to use to be able to install an unsigned extension to my ff dev edition with xpinstall.signatures.required set to false?,"<p>hey, trying to install an unsigned extension in ff dev edition (i disabled xpinstall.signatures.required) but apparently i need a gecko id to do it, as currently when installing the zipped extension i get error ""this addon could not be installed because it appears to be corrupt"". does anyone know how to find the gecko id i need to use? the place i got the files from is <a href=""https://github.com/DavidBuchanan314/Turbo-Recadmiumator"" rel=""nofollow"">https://github.com/DavidBuchanan314/Turbo-Recadmiumator</a> , and here is the link to the zip im trying to sign: <a href=""https://mega.nz/file/EAEX2YQY#HSheD7exHjy1WfEc7dxcmnZ99H7-Gr9fbHePT6cabgc"" rel=""nofollow"">https://mega.nz/file/EAEX2YQY#HSheD7exHjy1WfEc7dxcmnZ99H7-Gr9fbHePT6cabgc</a> . thanks for any &amp; all help! </p>",beta;settings;firefox;firefox-1310;,firefox,settings,en-US,1675201;,astrovink
1464106,2024-09-17 11:24:18 -0700,2024-09-17 11:24:18 -0700,download,<p>pls i want to make download of app  Thanks </p>,firefox;passwords-and-sign-in;,firefox,passwords-and-sign-in,en-US,"",princeteddy724
1464103,2024-09-17 10:51:00 -0700,2024-09-17 10:51:00 -0700,Re Firefox Desktop,<p>Why is Firefox Browser no longer an acceptable browser to access some on-line accounts?  Business entities are no longer recognizing Firefox.  When utilizing another browser connectivity is no issue. </p>,firefox;performance-and-connectivity;,firefox,performance-and-connectivity,en-US,"",Terry5Kelloggs
1464102,2024-09-17 10:50:44 -0700,2024-09-17 16:15:54 -0700,One website is blocked to me,"<p>On my Mac with current OS X update, Firefox is great except for one website:  <a href=""http://kaiserpermanente.org"" rel=""nofollow"">kaiserpermanente.org</a> - it will not respond.  Attached is a copy of the Firefox response page when I try to login, or ask about cookies, or anything besides their home page.  PS, everything works perfectly on my i-phone. </p><p>Thanks.    </p><p>Jane Molony C: [edited phone# from public community support forum] </p>",firefox;performance-and-connectivity;,firefox,performance-and-connectivity,en-US,1675176;1675200;,janekmolony
1464101,2024-09-17 10:44:06 -0700,2024-09-17 10:44:06 -0700,My old data doesn't seem to sync after Windows reinstallation,"<p>Hi! </p><p>I've been a Firefox user ever since I've had an internet connection (probably around 2008). Whenever I would do a clean Windows installation every 1 or 2 years, I remember I would have my passwords, history, and extensions synced. Today I performed a clean reinstall again after maybe 2 years and I don't have any of my old history, passwords, extensions. </p><p>I'm a bit desperate, I have really important stuff saved over the years. I use Tree Style Tabs and I've customized my browser client to fit my needs and it was perfect, but I seem to have lost everything and I don't know what happened. It didn't even cross my mind something like this would happen. </p><p>Is there anything I can do? I have old emails from 2018 and 2021 from Firefox Accounts which show I used the same email. </p><p>Today when I tried to log-in into Firefox Accounts from inside the browser (button at the top right corner) it seemed that none of my passwords worked, so I clicked the ""Forgot email"" password and set-up a better one, but once logged in there was no sync with the old data I had. Then I thought maybe I had the wrong account so I logged in with my Google/Gmail account but there was nothing there as well. </p><p>Is there something I can do? I really need my old history, passwords, extensions, etc. Especially now as I'm graduating from University and I have important events coming up. </p><p>And no, I don't have any local profiles any more since I did a full, clean reinstall on my primary SSD. But I remember I've never used local profiles, everything would sync up again once I logged in. Maybe forgetting and resetting my password logged out my previous session and I lost it forever? </p><p>I hope you can help me sort this out. </p><p>Thank you for your time! </p>",firefox;firefox-1300;backup-recovery-and-sync;,firefox,backup-recovery-and-sync,en-US,"",iacobut_cosmin
1464100,2024-09-17 10:37:21 -0700,2024-09-17 13:30:41 -0700,macOS FireFox Auto-Update in the background?,"<p><em>duplicate of <a href=""/questions/1464099"" rel=""nofollow"">/questions/1464099</a> thread</em>. </p><p>How can I configure the FireFox application on my macOS device (M2 Pro) to auto-update in the background while the app is not running? </p><p>Thanks in advance! </p>",firefox;installation-and-updates;,firefox,installation-and-updates,en-US,"",robert.martin3
1464099,2024-09-17 10:36:54 -0700,2024-09-17 10:36:54 -0700,macOS FireFox Auto-Update in the background?,<p>How can I configure the FireFox application on my macOS device (M2 Pro) to auto-update in the background while the app is not running? </p><p>Thanks in advance! </p>,firefox;installation-and-updates;,firefox,installation-and-updates,en-US,"",robert.martin3
1464097,2024-09-17 10:12:53 -0700,2024-09-17 10:12:53 -0700,"Google Calendar/Drive Error: ""Couldn't preview file. There was a problem displaying this image.""","<p>When previewing an image that was uploaded to a Google Calendar Event, I get an error ""Couldn't preview file. There was a problem displaying this image."" I've spoken to Google support and they suggested I reach out as when I try in Chrome, it works. Firefox is my preferred browser so I would love if I didn't have to switch to Chrome. </p><p>Troubleshooting Done: - Verified Firefox is up to date (130.0 64 bit) - Cleared cache and cookies, closed browser, reopened - Tried in 'Troubleshoot Mode' - Ad Blocker turned off - Uploaded test .png and .jpeg to see if it was a file extension issue - Uploaded smaller versions of images to see if it was a size issue - No issues when doing same steps in Chrome browser </p>",firefox;firefox-1300;performance-and-connectivity;,firefox,performance-and-connectivity,en-US,"",daylgreen
1464095,2024-09-17 10:07:48 -0700,2024-09-17 10:07:48 -0700,Application will not load properly,<p>I have used Firefox for years to use application Availity.  All of a sudden cannot open on FireFox but open it in Chrome.  I sign in to Availity and 'acts' like going to load but goes immediatley to the sign out screen.  Reached out to Availity said to clear Cache...I did restarted and same issue. </p>,firefox;browse;,firefox,browse,en-US,"",rebecca43
1464094,2024-09-17 10:04:12 -0700,2024-09-17 10:04:12 -0700,Surround audio not working,"<p>Hi, </p><p>I've been wanting to switch from Chrome to Firefox for the longest time, but I can't do it since surround audio doesn't seem to be supported natively in Firefox. I'm using a Logitech G733, with ""Surround Audio"" activated in GHub, and on Chromium based browsers, it works, I hear it when watching Youtube videos, Twitch streams..., but on Firefox, it defaults to stereo audio. I haven't been able to find any settings related to audio in Firefox, nor in the concerned websites.  Is it a known issue&nbsp;? </p>",settings;firefox;firefox-1300;,firefox,settings,en-US,"",albin.morel
1464091,2024-09-17 09:56:16 -0700,2024-09-17 09:56:16 -0700,news max will not run,<p>news max mill not run </p>,settings;firefox;,firefox,settings,en-US,"",acenkatz
1464089,2024-09-17 09:46:36 -0700,2024-09-17 09:46:36 -0700,change firefox settings via registry,<p>I need to change the Open previous windows and tabs setting Can I change browser.startup.page through the Windows registry? </p>,settings;firefox;,firefox,settings,pt-BR,"",denilsob
1464087,2024-09-17 09:39:55 -0700,2024-09-17 09:39:55 -0700,Mailto,<p>Why can I not add my Yahoo mail as the mailto default? The only options offered are Outlook or Gmail. </p>,settings;firefox;,firefox,settings,en-US,"",GlennT
1464086,2024-09-17 09:36:28 -0700,2024-09-17 09:36:28 -0700,Acadmay,<p>Naimat Ur Rahman </p>,firefox;passwords-and-sign-in;,firefox,passwords-and-sign-in,en-US,"",naimaturrahman0
1464084,2024-09-17 09:25:42 -0700,2024-09-17 09:25:42 -0700,Asked to wait 15 minutes to sign in,"<p>On my first sign-in attempt I get a message indicating my computer cannot connect to the server.  I am asked to wait 15 minutes and sign  in again.  As long as I wait 15 minutes or more, the second sign-in attempt is successful.  What is going on here?  What do I need to do to be able to connect on my first sign-on attempt? </p>",firefox;passwords-and-sign-in;,firefox,passwords-and-sign-in,en-US,"",xxwr04aX
1464083,2024-09-17 09:09:12 -0700,2024-09-17 10:19:30 -0700,default Search engine,<p>How do I change my default search engine in Firefox browser to DuckDuckgo? </p>,settings;firefox;,firefox,settings,en-US,1675131;1675134;,poly33pop
1464082,2024-09-17 09:05:02 -0700,2024-09-17 09:31:50 -0700,How do I open a special page from within an addon?,"<p>I know that addons have no power on special pages. I understand the security concerns and I agree. I would still like to at least open `about:about` from an addon, like e.g., vimium or just from a bookmark. Is that possible? And if so, how? </p>",settings;firefox;,firefox,settings,en-US,1675121;1675126;,maxim.ritter.von.onciul
1464081,2024-09-17 09:03:41 -0700,2024-09-17 09:03:41 -0700,Why do I NEED to enable two-factor authentication for submitting an extension?,"<p>I don't care about the 'security' of my Firefox account, so why do I NEED two-factor authentication? I don't want to do that. Then I could switch to Google right away. So why are you FORCING people to switch browsers if they don't want to comply? Because I'd rather do that than enable two-factor authentication for such useless accounts </p>",firefox;privacy-and-security_1;,firefox,privacy-and-security,en-US,"",myemailadress
1464077,2024-09-17 08:59:54 -0700,2024-09-17 08:59:54 -0700,Firefox start up,<p>Cannot get into Firefox as of 3 hours ago. Error message see screenshot below. Hope you can  help as Firefox is my default browser.  </p><p>Regards </p><p>Graham Cotton </p>,firefox;performance-and-connectivity;,firefox,performance-and-connectivity,en-US,"",graham105
1464076,2024-09-17 08:56:18 -0700,2024-09-17 13:45:23 -0700,Firefox 128.1.0esr and 128.2.0esr security vulnerabilities,"<p>Tenable is reporting 128.1 and 128.2 as affected by vulnerabilities covered in CVEs' in their plugin 205009 ( <a href=""https://www.tenable.com/plugins/nessus/205009"" rel=""nofollow"">https://www.tenable.com/plugins/nessus/205009</a> ). The rule they are applying is: Mozilla Firefox &lt; 129 That implies that 128.1 and 128.2 are also &lt; then 129 -&gt; therefor vulnerable.  Can you please answer 2 questions: </p> <ul><li> are Firefox 128.1 and 128.2 part of the same branch of product as 129? Or are they necessarily ESR? </li><li> are Firefox 128.1 and 128.2 affected by CVEs' covered in their TENABLE plugin 205009? </li></ul>",firefox;installation-and-updates;,firefox,installation-and-updates,en-US,1675140;1675170;,kristian.sranko
1464074,2024-09-17 08:45:24 -0700,2024-09-17 08:45:24 -0700,Account,"<p>Hello, my computer has crashed and i logged in my account but there is no data/passwords/booksmarks anymore. Can you help me please? </p>",firefox;backup-recovery-and-sync;,firefox,backup-recovery-and-sync,en-US,"",remon2
1464072,2024-09-17 08:42:24 -0700,2024-09-17 08:42:24 -0700,"when a friend changes their email address, how do I delete the old one?","<p>when a friend changes their email address, how do I delete the old one? </p>",settings;firefox;,firefox,settings,en-US,"",David_Dundas
1464068,2024-09-17 08:15:15 -0700,2024-09-17 08:15:15 -0700,extensions,"<p>Good afternoon, In my extensions, I use Cozy Pass. But since weeks ago, Cozy Pass is in grey, not blue as usually. When I try to connect there is this message: "" Une erreur est survenue. NetworkErrorwhen attempting to fetchresource"" Can you say me how to resolve this problem. Best regards Patrick </p>",firefox;performance-and-connectivity;,firefox,performance-and-connectivity,en-US,"",pa.mauri
1464065,2024-09-17 08:12:58 -0700,2024-09-17 08:21:11 -0700,Google Drive,"<p>I use Google Drive with two accounts. </p><p>Thumbnails are displayed on one of them. No matter what I do, thumbnails don't appear on the other one. </p><p>Both appear on Google Chrome. They also appear on my smartphone. </p><p>I would like to know why they don't appear on some accounts. </p>",firefox;browse;,firefox,browse,en-US,"",kanasann86
1464064,2024-09-17 08:04:47 -0700,2024-09-17 09:37:52 -0700,I am using OS 10.10.5 Yosemite. That is the highest OS I can use with this Mac. What is the hightest Firefox I can use?,<p>I am using OS 10.10.5 Yosemite. That is the highest OS I can use with this Mac. What is the hightest Firefox I can use? </p>,firefox;installation-and-updates;,firefox,installation-and-updates,en-US,1675127;,bcarter1066
1464062,2024-09-17 07:58:32 -0700,2024-09-17 07:58:32 -0700,Instagram,"<p>Mi collego regolarmente al mio profilo Instagram utilizzando Opera e Safari all'indirizzo <a href=""https://www.instagram.com"" rel=""nofollow"">https://www.instagram.com</a> Quando provo a collegarmi Firefox allo stesso indirizzo appare la schermata sul consenso per l'uso dei cookie (""consentire l'uso dei cookie di Instagram su questo browser""). Qualunque risposta io fornisca (""consenti tutti i cookie"" oppure ""rifiuta cookie facoltativi"") l'avviso non si chiude e io non posso proseguire con il login. Ho già effettuato: 1) l'avvio di Firefox in modalità risuluzione dei problemi; 2) il riprestino di Firefox; 3) l'eliminazione e il nuovo download il programma; 4) inserito l'indirizzo <a href=""http://ww.instagram.com"" rel=""nofollow"">ww.instagram.com</a> nelle eccezioni della Protezione antitracciamento avanzata Grazie </p>",firefox;firefox-1300;browse;firefox-13001;,firefox,browse,it,"",stefanosalerno
1464061,2024-09-17 07:56:52 -0700,2024-09-17 07:56:52 -0700,Perfiles de firefox desktop,"<p>Tengo 2 perfiles para cuentas de correo distintas. He configurado Firefox para que al reiniciar se abran las últimas pestañas abiertas, sin embargo esto no funciona al abrir cada perfil. Alguna solución&nbsp;? </p>",settings;firefox;firefox-1300;firefox-13001;,firefox,settings,en-US,"",ricardorigg
