id,created,updated,title,content,tags,product,topic,locale,answers,creator
1451929,2024-07-09 13:17:49 -0700,2024-07-09 13:17:49 -0700,"How do I completely disable any ""What's new"" tabs, in any way, forever?","<p>I have browser.messaging-system.whatsNewPanel.enabled set to ""false"". And yet when I update firefox, there's still a new tab opening telling me useless information.  </p><p>I don't want firefox to ever automatically open a new tab ever, for anything, ever. I don't care what's new, I don't care what changed, I just don't care. I want to permanently and completely disable firefox from opening a new tab to tell me literally anything.  </p><p>Please don't try to argue or convince me otherwise. It's such weird and rude behavior. Just please, how do I disable this feature that is annoying to me?  </p><p>Firefox should never be able to open a new tab on its own. Any tab openings should be done by user action. </p>",desktop;windows-10;firefox-1280;customize-settings-and-preferences;,firefox,customize-settings-and-preferences,en-US,"",Anon23940582039458234905
1451928,2024-07-09 13:17:21 -0700,2024-07-09 13:17:21 -0700,Amazon Secure Connection Failed,"<p>I can't connect to <a href=""http://Amazon.com"" rel=""nofollow"">Amazon.com</a>.  I keep getting the following error message:  </p><p>Secure Connection Failed </p><p>An error occurred during a connection to <a href=""http://www.amazon.com"" rel=""nofollow"">www.amazon.com</a>. PR_END_OF_FILE_ERROR </p><p>Error code: PR_END_OF_FILE_ERROR </p><p>I think this is a problem with Firefox.  Any suggestions or should I switch to a new web browser? </p><p>I appreciate any suggestions. </p>",desktop;other;windows-11;firefox-1270;firefox-12702;,firefox,other,en-US,"",mmodak129
1451927,2024-07-09 13:08:48 -0700,2024-07-09 13:08:48 -0700,Some useful Firefox extensions for productivity,"<p>For boosting productivity in Mozilla Firefox, consider these extensions: uBlock Origin for ad-blocking, which improves browsing speed and reduces distractions; Grammarly for real-time grammar and spelling checks; Todoist for task management and to-do lists; Evernote Web Clipper for saving and organizing web content; LastPass for secure password management; Momentum for a personalized and motivational new tab page; and Pocket for saving articles and web pages to read later. Additionally, Toggl Track helps with time tracking, and StayFocusd assists in limiting time spent on distracting websites. <a href=""http://example.com"" rel=""nofollow"">Click here for more details.</a> </p>",desktop;other;windows-10;,firefox,other,en-US,"",frlegendspromodapk
1451925,2024-07-09 13:05:02 -0700,2024-07-09 13:05:02 -0700,Who switched my search from google to YAHOO.com,"<p>Return my search to Google Chrome </p><p><a href=""https://search.yahoo.com/yhs/search?hspart=ata&amp;hsimp=yhs-002&amp;type=type9044149-aal-139990-139991&amp;param1=139990&amp;param2=139991&amp;p=408+area+code&amp;grd=1"" rel=""nofollow"">https://search.yahoo.com/yhs/search?hspart=ata&amp;hsimp=yhs-002&amp;type=type9044149-aal-139990-139991&amp;param1=139990&amp;param2=139991&amp;p=408+area+code&amp;grd=1</a> </p>",desktop;other;windows-10;firefox-1270;firefox-12702;,firefox,other,en-US,"",jimlaliberte1720
1451921,2024-07-09 12:22:09 -0700,2024-07-09 12:22:09 -0700,"Microphone is recognized and works in other sites, but not for a specific site despite being recognized and permitted","<p>I have been using Firefox to join our web conferencing service (Callbridge) for years exactly the same way, but suddenly audio fails to work presumably since a recent Firefox update. (I'm currently running 127.0.2 (64bit) ) The mic in my headset works great in Firefox on other sites including <a href=""http://onlinemictest.com"" rel=""nofollow"">onlinemictest.com</a>. The mic is recognized by Firefox and permission is provided for the site. When I speak, there is an indication that my voice is heard by Firefox, but it is as if the mic is muted...no sound through Firefox even though the mic is not muted. Again, in another tab on a different site, the mic will work. </p><p>If I use Microsoft Edge browser with the same setup for Callbridge, everything works fine.  </p><p>In Firefox it does indicate I have provided mic permission to the site, and the mic is clearly seen and working, but no sound from FF in the web conferences. </p><p>I have tried saving mic permission for the site, as well as removing it from Tools...Settings...Privacy &amp; Security...Permissions...Microphone and permitting Mic use each time the site is launched. Page Info settings are all correct with permission to use the mic and speakers and I have tried enabling autoplay for the site. </p><p>I believe any Windows or hardware causes can be eliminated since the same setup works in Edge browser. It seems to be just a Firefox issue that has appeared recently when using the Callbridge site. </p><p>Any assistance would be appreciated. Thank you in advance. </p>",desktop;windows-10;troubleshooting;firefox-1270;firefox-12702;,firefox,troubleshooting,en-US,"",acpewty
1451920,2024-07-09 12:07:33 -0700,2024-07-09 12:07:33 -0700,What are the current market share trends of Firefox and Chrome globally?,"<p>As of the latest data, Chrome continues to dominate the global browser market with a significant share, estimated around 65% to 70%. Firefox, while still maintaining a loyal user base, has seen a gradual decline in market share, currently holding around 8% to 10%. This trend reflects Chrome's widespread adoption due to its speed, integration with Google services, and extensive ecosystem of extensions. Firefox, known for its emphasis on privacy and open-source ethos, appeals to users valuing these features. Despite its smaller share, Firefox remains a respected alternative, particularly among privacy-conscious users and certain niche communities. <a href=""https://liteblue-usps-gov.com/"" rel=""nofollow"">[[  Click Here for further information </a>] <a href=""http://example.com"" rel=""nofollow"">Click Here for further information</a>] </p>",desktop;tips;windows-10;,firefox,tips,en-US,"",liteblue609
1451918,2024-07-09 11:54:43 -0700,2024-07-09 12:42:32 -0700,why can't I update ..It says that I am up to date on 128,<p>It says I am up to date on 128.  Is that correct? </p>,desktop;windows-10;firefox-1280;install-and-update;,firefox,install-and-update,en-US,1661076;,myrtdunbar
1451915,2024-07-09 11:28:31 -0700,2024-07-09 11:28:31 -0700,"Firefox NO LONGER adheres to ""Ask if you want to Save"" option...","<p>This SAME topic has been asked in MANY of the Threads - And a Moderator has locked EACH of the threads it seems - But NO ONE seems to be able to tell us - <strong>WHY the ""''''</strong><em>Ask whether to open or save files''''</em><strong>"" does not work anymore.</strong> </p><p>I had to reinstall Windows 11 and all my files and programs a few weeks ago - and since then - I found the above does NOT work anymore.  Now, I have a boat-load full of documents in a Downloads folder - when ALL I wanted to do is open and look at the various files that I received - BUT NOT save them. </p><p>I tried to leave or make the """"""""""""Save files to"""""""" field BLANK - which I thought would be a great solution as Then the ""ASK"" prompt would HAVE TO ASK you where you want to save or NOT save the file - but it won't allow you to do that either! </p><p>I've attached screen grabs - lest you think I do not know how to manage the Applications settings. </p><p>WHAT HAPPENED - Why doesn't - ""''''<em><strong>Ask whether to open or save files''''</strong></em>""  work anymore? </p>",desktop;troubleshooting;windows-11;firefox-1270;firefox-12702;,firefox,troubleshooting,en-US,"",bobbi2
1451913,2024-07-09 11:03:12 -0700,2024-07-09 11:03:12 -0700,Get rid of Easy Login browser hacker,"<p><strong>bold text</strong> My firefox browser has somehow gotten the Easy Login browser hacker, and it is causing me numerous problems including; A.  It's icon is blocking part of my firefox screen; B.  When I seek to go to an address, it opens a different address... </p>",desktop;tips;windows-11;firefox-1270;firefox-12702;,firefox,tips,en-US,"",giilll
1451912,2024-07-09 10:54:25 -0700,2024-07-09 10:54:25 -0700,Help un-merging two Firefox (Sync?),"<p>I use Mozilla Firefox browser on my work laptop, and have it Sync'd to my iphone.  Yesterday my sister opened Firefox, logged me out, and logged herself in, to access some things. But instead of closing my profile (bookmarks, saved PWs, etc.) it MERGED hers with mine. Now, on our laptops and phones, we see each others bookmarks, saved PWs, etc. How can I unmerge them? Pls help! </p>",desktop;windows-11;firefox-1280;customize-settings-and-preferences;,firefox,customize-settings-and-preferences,en-US,"",erinmhenry
1451909,2024-07-09 10:42:23 -0700,2024-07-09 10:51:52 -0700,browser is under remote control reason devtools,"<p>Hi! When I bring up my Firefox browser it automatically shuts down and comes up again with two issues: 1.  Do you want to restore pages? 2. A red striped URL with the little robot and the error message: browser is under remote control reason devtools </p><p>I've read all the postings and I don't understand many of what they are suggesting and those that I do, don't work. Please help p.s.  I've already downloaded the newest version. </p>",desktop;windows-10;website-breakages;firefox-1280;,firefox,website-breakages,en-US,1661063;,dmowder
1451908,2024-07-09 10:41:24 -0700,2024-07-09 14:07:59 -0700,"browser.cache.disk.enable, is re-enabling itself on every Firefox update. WHY?!","<p>browser.cache.disk.enable, is re-enabling itself on every Firefox update. WHY?! I disable disk caching and SSL caching because I use a fast NVMe SSD and I don't want to use up all the write cycles to it.. cookies caching is fine with me... </p><p>It has been doing this on every update for a while now.. this is annoying and not ok.. please fix. </p>",desktop;windows-11;firefox-1280;install-and-update;,firefox,install-and-update,en-US,1661065;1661067;1661069;1661074;1661075;1661078;1661079;1661081;1661083;1661084;1661086;1661088;,MelchiorGaspar
1451906,2024-07-09 10:22:10 -0700,2024-07-09 10:22:10 -0700,Tabs wont reopen,"<p>I have ""Open previous windows and tabs"" checked in the settings, And have been using firefox in that manner for years, Like I would close the browser, And would beable to come back to what I was working on. But after an update, I came back to all my tabs gone, And I opened multiple tabs and closed, And opened the browser again and there were no more tabs. I followed the instructions in a earlier post of the same problem but problem persists.   <a href=""https://support.mozilla.org/en-US/questions/1429964"" rel=""nofollow"">https://support.mozilla.org/en-US/questions/1429964</a> Please help I lose productivity without this feature. Thank you, Paul </p>",desktop;tabs;windows-10;firefox-1270;firefox-12702;,firefox,tabs,en-US,"",kkcarey
1451904,2024-07-09 10:08:07 -0700,2024-07-09 10:20:13 -0700,Firefox site at top of login I want to delete,"<p>All of a sudden, a site I visited appeared at the top of my login pages. Just below the search bar. It contains “import bookmarks,” “getting started,” “and this site.” I don’t want any of that there. I thought I had all memory stuff shut off. Can’t figure out a way to delete it. Can you help. </p>",desktop;customize-settings-and-preferences;,firefox,customize-settings-and-preferences,en-US,1661054;1661055;1661056;,chasbeard
1451901,2024-07-09 09:54:08 -0700,2024-07-09 14:10:06 -0700,Latest update caused messed up fonts on pages and tabs,"<p>Updated my Win 11 laptop with latest changes and find the fonts on pages and on tabs is all messed up.  I've tried Settings to choose larger size, set defaults to Arial and/or Arial Round ....    does not help.   </p><p>How do I either fix this, or undo this update, or is there a fix coming ASAP?? </p>",desktop;windows-11;firefox-1280;install-and-update;,firefox,install-and-update,en-US,1661048;1661052;1661077;1661089;,wjnm
1451900,2024-07-09 09:21:26 -0700,2024-07-09 10:05:06 -0700,AutoCorrect,"<p>As part of my job I need to fill in long content into webpages. Many of the words can be long and not so common in everyday language - but are words that I use many times in the report writing I do.  Like with MS Word's AutoCorrect... Could there not be an option for custom work shortcuts, such as: </p><p>cst automatically becomes: custom prg automatically becomes: Pseudomonas aeruginosa </p><p>Crazy or what </p>",desktop;windows-10;firefox-1270;firefox-12701;customize-settings-and-preferences;,firefox,customize-settings-and-preferences,en-US,1661049;1661050;,jim.shubat
1451898,2024-07-09 09:10:15 -0700,2024-07-09 10:28:21 -0700,Substack reloading every few seconds,"<p>Hello, Today I was writing a draft post on Substack and the screen refreshed every few seconds. Possibly when Substack was saving changes. Each time it did this, the screen would go blank for an instant and refresh, and then I would have to click to place my cursor where it had been. </p><p>This is new as of this week. I was not writing on Substack using Firefox last week. </p><p>Firefox version 128.0, on Windows 10 Home v 22H2 </p><p>thanks Chris. </p>",desktop;windows-10;troubleshooting;firefox-1280;,firefox,troubleshooting,en-US,1661051;1661060;,chrisbhammett
1451897,2024-07-09 09:01:58 -0700,2024-07-09 10:26:32 -0700,hello,<p>i am having trouble with the mp3 web sites </p>,desktop;windows-11;website-breakages;firefox-1270;firefox-12702;,firefox,website-breakages,en-US,1661059;,mrdjchad05
1451895,2024-07-09 09:00:01 -0700,2024-07-09 09:01:24 -0700,intall,<p><strong>bold text</strong> </p>,desktop;needsinfo;windows-10;firefox-1280;install-and-update;,firefox,install-and-update,en-US,1661041;1661042;1661043;,aviandrei22
1451894,2024-07-09 08:54:53 -0700,2024-07-09 08:54:53 -0700,BACK UP DATA,"<p>Firefox crashed my profile disappeared. I had to log back in and my bookmarks haven't show up. I verified the profiles folder and all my data is still on my computer but I cannot import it to the browser. Please, help. </p>",desktop;bookmarks;windows-10;firefox-1280;,firefox,bookmarks,es,"",scc.gdretiz
1451892,2024-07-09 08:49:27 -0700,2024-07-09 10:10:52 -0700,Access Denied,"<p>Why am I getting the message below every time I try to go on the The Great Courses website? The Great Courses Customer Service Dept it is Firefox that is blocking me from accessing their website. Please tell me how to correct the problem. </p><p>""You don't have permission to access ""<a href=""http://thegreatcourses.com"" rel=""nofollow"">http://thegreatcourses.com</a>"" on this server. </p><p>Thank you. </p>",desktop;other;windows-10;firefox-1270;firefox-12702;,firefox,other,en-US,1661040;1661053;,rmiller732
1451891,2024-07-09 08:47:19 -0700,2024-07-09 08:48:17 -0700,Computer application technology,<p>'<em><strong>Source and bibliography of how can twitter improve and negatively impact in the area of education'</strong></em> <strong>bold text</strong> </p>,desktop;other;needsinfo;windows-11;firefox-1280;,firefox,other,en-US,1661039;,wandilendiweni8
1451890,2024-07-09 08:42:45 -0700,2024-07-09 10:00:48 -0700,Password security,"<p>OK - I must be missing something. On my previous browser, Opera, if I wanted to see details of my passwords then I needed to put in the computer password, so keeping them quite secure. However, Firefox seems to let <strong>anyone</strong> using the browser to access the full details of all my passwords, even offering to copy them! This has to be the most insecure approach possible - surely this can't be correct, can it? </p>",desktop;windows-10;firefox-1270;firefox-12702;protect-your-privacy;,firefox,protect-your-privacy,en-US,1661045;1661047;,amuntek101
1451881,2024-07-09 07:44:33 -0700,2024-07-09 07:46:08 -0700,Chyba při formátování tisku,"<p>Narazil jsem na problém při tisknutí PDF souborů.  </p><p>Dříve toto ve Firefoxu fungovalo správně než byla provedena úprava tiskového dialogu. Vyzkoušel jsem v Chrome a v Edge a vše funguje korektně.  </p><p>Při snaze vytisknout PDF dokument se tento zmenší  a není možné nijak nastavit velikost tisknutelné plochy. Nefunguje ani změna měřítka. </p><p>V příloze zasílám ukázky chování ve Firefoxu, Chrome i Edge (ten nemám rád) .  PDF soubor nelze nahrát, ale lze si ho stáhnout na  <a href=""https://www.uschovna.cz/zasilka/QD7PTL48KAGN8598-EFR/"" rel=""nofollow"">https://www.uschovna.cz/zasilka/QD7PTL48KAGN8598-EFR/</a> . V Acrobat Reader je velikost korektní a tisk také. </p>",desktop;other;windows-10;firefox-1270;firefox-12702;,firefox,other,cs,1661030;,info11591
1451879,2024-07-09 07:25:00 -0700,2024-07-09 07:25:00 -0700,videos,<ol><li> * Numbered list item </li></ol>,windows-7;desktop;other;,firefox,other,en-US,"",rafeeqbilal714
1451878,2024-07-09 07:20:25 -0700,2024-07-09 08:27:24 -0700,why does facebook open a tab when I start Firefox?,<p>why does facebook open a tab when I start Firefox? This has happened every time I start Firefox since BT updated their mail product a few months ago </p>,desktop;windows-10;firefox-1270;customize-settings-and-preferences;,firefox,customize-settings-and-preferences,en-US,1661033;,chris_burgess
1451872,2024-07-09 06:26:52 -0700,2024-07-09 06:33:42 -0700,synchroniseren met gsm; hoe?,<p>hoe synchroniseren? </p>,desktop;sync;windows-10;firefox-1270;firefox-12702;,firefox,sync,nl,1661012;,viehoffjos
1451870,2024-07-09 05:50:07 -0700,2024-07-09 07:53:23 -0700,"comment section on the bottom of articles do not open in Aol, and JPost","<p>the browser will not open comments sections in Aol, and JPost. But, in other browsers the comments section on the bottom of each article is available. How can i fix it? </p>",desktop;windows-10;troubleshooting;firefox-1270;,firefox,troubleshooting,en-US,1661031;,davids11d
1451869,2024-07-09 05:49:00 -0700,2024-07-09 05:49:00 -0700,why this site load slow only in Firefox but not in others,"<p>I am a web developer and working on speed optimization for a food blog site"" <a href=""http://example.com"" rel=""nofollow"">Menudale</a>"" and I have done all checks for speed of loading but it only shows a slow speed loading in Firefox however I have optimized all its food recipes photos and videos including all food content in it but not found mistake. </p>",desktop;other;windows-10;,firefox,other,en-US,"",draza0858
1451868,2024-07-09 05:47:22 -0700,2024-07-09 05:47:22 -0700,hello,<p>jbkfhjhjjh </p>,desktop;other;windows-10;firefox-1270;firefox-12702;,firefox,other,en-US,"",kasra.abbaspour6670
1451864,2024-07-09 05:27:50 -0700,2024-07-09 05:27:50 -0700,Firefox will not open,"<p>Please help me figure out what is keeping Firefox from opening. I have reinstalled it and it worked yesterday but today after restarting my computer, it will not open. </p>",desktop;windows-10;troubleshooting;,firefox,troubleshooting,en-US,"",ajmcneely
1451862,2024-07-09 05:22:07 -0700,2024-07-09 05:22:07 -0700,DU FRANCAIS,<p>ECRIVEZ MOI EN FRANCAIS COMMENT VIDER LE CACHE ET DESACTIVER LA SYNCHRONISATION SVP </p>,desktop;sync;windows-11;firefox-1270;firefox-12702;,firefox,sync,en-US,"",yvonne.darchis
1451861,2024-07-09 05:20:20 -0700,2024-07-09 07:25:33 -0700,error msg: The page isn’t redirecting properly,"<p>I get this msg from FIrefox when I try to login from the webpage <a href=""http://kp.org"" rel=""nofollow"">kp.org</a>.  I have no problem on Microsoft Edge. </p><p>""The page isn’t redirecting properly"" </p><p>Also on <a href=""http://NBCwashington.com/weather"" rel=""nofollow"">NBCwashington.com/weather</a> the video doesn't play on Firefox but does on Microsoft Edge. I contacted NBC Washington local station and they can find no problem on their web page. </p>",desktop;other;windows-11;firefox-1270;,firefox,other,en-US,1661026;,karenchang27
1451860,2024-07-09 05:18:25 -0700,2024-07-09 05:18:25 -0700,Estensioni recenti non si caricano all'avvio di Firefox,"<p>Recemente ho installato due estensione nuove. Il problema è che ad ogni avvio di Firefox non si caricano... Ad esempio ho aggiunto una estensione Dial, nelle impostazioni Firefox la ho impostata come scelta predefinita, ma ad ogni riavvio Firefox quella scelta si azzera... </p>",desktop;other;windows-10;firefox-1270;firefox-12702;,firefox,other,it,"",ken.kinju
1451851,2024-07-09 04:34:39 -0700,2024-07-09 06:33:17 -0700,Website not responding in normal mode,"<p>Hi, </p><p>Something funny started happening, but only recently. I cannot reach the Super Micro website, or any of it's sub-pages (<a href=""https://www.supermicro.com"" rel=""nofollow"">https://www.supermicro.com</a>) in normal mode. Though when using private mode, I can. I've already cleared cache and cookies, removed add-ons and add blockers and tinkered with the settings. </p><p>Hoping you can help me because I need this website multiple times a day for my job and I don't fancy using 2 browsers, Firefox being my favourite one. </p><p>Looking forward to receiving help. </p><p>Regards </p>",desktop;mac-os-x-1015;website-breakages;firefox-1270;firefox-12702;,firefox,website-breakages,en-US,1661011;,felix60
1451850,2024-07-09 04:25:50 -0700,2024-07-09 06:38:20 -0700,Maintaining login info between tabs,"<p>On Opera and Chrome, I am logged in as a google user. I make a diary available from a web page which is limited as to how the viewer sees it. If I (or another authorised user) is viewing it then they see all the detail. If anyone else sees it then they only see 'busy' against all the bookings. This has worked fine for years. </p><p>On changing to Firefox, though, when the web diary is accessed - even though I am logged in properly - it only shows the 'busy' view. It seems as if it's not maintaining my google login, hence showing the 'incorrect' view. </p><p>Is there anything that I can change to make this work properly? </p><p>TIA </p>",desktop;other;windows-10;firefox-1270;firefox-12702;,firefox,other,en-US,1661010;1661013;,amuntek101
1451849,2024-07-09 04:11:37 -0700,2024-07-09 06:41:02 -0700,Secure Connection Failed,"<p>When I open ""<a href=""http://www.methodistcu.org"" rel=""nofollow"">www.methodistcu.org</a>"" an error message says:  Secure Connection Failed </p><p>An error occurred during a connection to <a href=""http://www.methodistcu.org"" rel=""nofollow"">www.methodistcu.org</a>. PR_END_OF_FILE_ERROR </p><p>Error code: PR_END_OF_FILE_ERROR </p><pre>   The page you are trying to view cannot be shown because the authenticity of the received data could not be verified.    Please contact the website owners to inform them of this problem. </pre>",desktop;troubleshooting;windows-11;firefox-1270;firefox-12702;,firefox,troubleshooting,en-US,1661014;,Peluche85
1451848,2024-07-09 03:42:20 -0700,2024-07-09 07:02:16 -0700,Tabs Unexpectedly Opening in New Windows in Full-Screen Mode on MacOS,"<p>Hi firefox community, </p><p>I am using Firefox version 127.0.2 as my main browser on MacOS Sonoma 14.5. For the past few months, when using Firefox in Mac's full-screen mode, I've been experiencing an issue where one of the multiple open tabs unexpectedly displays in a separate window the moment I click on it. </p><p>This behavior didn't occur previously, and I believe it started happening about 3 months ago. It doesn't happen every time, but occurs a few times a day when I least expect it, making it difficult to identify the specific conditions that trigger it. I use a Magic Trackpad, and after switching to full-screen using the three-finger gesture, the moment I try to activate a specific tab, that tab alone displays as a separate window in full-screen mode. </p><p>Is it possible that a Firefox version update has changed this behavior? If this is a Firefox issue, is there a way to capture debug logs to have the developers investigate it? </p><p>Alternatively, if there's an option to prevent tabs from opening in new separate windows, that would be an effective workaround. Could you please let me know if such an option exists? </p><p>Best regards, </p>",desktop;tabs;,firefox,tabs,en-US,1661021;,ate.fleeced05
1451847,2024-07-09 03:36:42 -0700,2024-07-09 03:36:42 -0700,Okay I understand,<p>I need no help for now </p>,desktop;install-and-update;,firefox,install-and-update,en-US,"",derickfitco
1451845,2024-07-09 03:34:42 -0700,2024-07-09 03:34:42 -0700,playing video on YouTube is always choppy,<p>Browser and any other help </p>,desktop;install-and-update;,firefox,install-and-update,en-US,"",derickfitco
1451844,2024-07-09 03:32:52 -0700,2024-07-09 03:32:52 -0700,cloudfare access,<p>Access my cloudfare and update and install my fire fox. </p>,linux;desktop;firefox-1020;install-and-update;,firefox,install-and-update,en-US,"",boyr35362
1451841,2024-07-09 02:37:11 -0700,2024-07-09 02:37:11 -0700,Windows,<p>Kan jag återställa winows på datorn? </p>,linux;desktop;website-breakages;firefox-1250;firefox-12503;,firefox,website-breakages,en-US,"",a.robertpetersson
1451838,2024-07-09 02:27:17 -0700,2024-07-09 03:28:35 -0700,how to read Google mails,<p>How can i read my mails with firefox </p>,desktop;sync;windows-10;firefox-1270;firefox-12702;,firefox,sync,en-US,1660976;,jean.barraque2
1451835,2024-07-09 01:51:55 -0700,2024-07-09 08:29:07 -0700,how to add a short cut under the search bar?,<p>how to add a short cut under the search bar? </p>,desktop;windows-10;firefox-1270;firefox-12702;customize-settings-and-preferences;,firefox,customize-settings-and-preferences,en-US,1661034;,atcinc47
1451834,2024-07-09 01:29:42 -0700,2024-07-09 01:29:42 -0700,Sports,<p>Sports </p>,desktop;install-and-update;,firefox,install-and-update,en-US,"",nashaan270
