id,created,updated,title,content,tags,product,topic,locale,answers,creator
1470890,2024-10-23 09:26:41 -0700,2024-10-23 09:26:41 -0700,hiçbir sosyal meya sitesi mozillada açılmıyor.,<p>diğer tüm tarayıcılardan denedim sadece mozillada hiçbir sosyal medya sitesi açılmıyor. hergün ayrı bir problem yaşamak zorunda mıyım. </p>,firefox;accounts;,firefox,accounts,tr,"",ayaz_2026
1470889,2024-10-23 09:20:40 -0700,2024-10-23 09:23:52 -0700,फोनपे में शिकायत कैसे दर्ज करें?,"<p>ग्राहक आप PhonePe हेल्पलाइन नंबर ( +91 <em>7077✓742✓950'</em><strong>), (भाषा: हिंदी और अंग्रेजी) पर भी कॉल कर सकते हैं। ग्राहक आप PhonePe हेल्पलाइन नंबर ( +91</strong> </p>",firefox;browse;,firefox,browse,en-US,1683638;1683639;1683640;1683641;1683643;1683644;1683645;1683646;1683647;1683648;1683649;1683650;1683651;1683652;1683653;1683654;,njipshupam
1470888,2024-10-23 09:17:54 -0700,2024-10-23 09:17:54 -0700,TWO WAY MFA STOP Working,"<p>I used to log in to AOL &amp; <a href=""http://Yahoo.com"" rel=""nofollow"">Yahoo.com</a> to check my emails via Firefox browser. </p><p>The two-way MFA stopped working. Why? John </p>",firefox;accounts;,firefox,accounts,en-US,"",jrhelp007
1470886,2024-10-23 09:15:00 -0700,2024-10-23 09:15:00 -0700,no puedo actualizar firefox,<p>No puedo instalar firefox y no sé por qué </p>,linux;firefox;installation-and-updates;,firefox,installation-and-updates,es,"",dolmax2
1470884,2024-10-23 09:04:06 -0700,2024-10-23 09:04:06 -0700,Videos are no longer accessible on the pages of certain websites,"<p>I've been using Firefox for a few months now to follow online training courses or videos on the conversation papillon (<a href=""http://www.conversationpapillon.com"" rel=""nofollow"">www.conversationpapillon.com</a>) and conversation santé (<a href=""http://www.conversationsante.com"" rel=""nofollow"">www.conversationsante.com</a>) websites. For a few weeks now, the videos are no longer accessible on the pages of these two sites. The window of the video is empty. However, if I try the same link in Google Chrome, it works fine. I've contacted the publishers of these two sites, who tell me that nothing has changed on their sites in recent weeks. He advised me to contact you to find out more. Can you help me? I prefer to use Firefox, which protects my privacy better. Thanks in advance. Regards, Jean-Pierre R. </p>",settings;firefox;,firefox,settings,en-US,"",jean-pierre.rousseaux
1470882,2024-10-23 08:49:44 -0700,2024-10-23 08:49:44 -0700,Browsing various business  sites.,"<p>When I down load my bank statements in (PDF) they are not readable.  To get aropund this issue, I have to use Google.  What I see when I try to open the PDF i get a BLACK screen and key board is locked up.  To escape I do a Ctrl,Alt,Delete.  This has been going on for some 5 to 6 months.  When i contacted my bank they sugggested using another browser.  There are other problems which have crept up, but I get around by using Google. </p>",firefox;windows-11;browse;,firefox,browse,en-US,"",HHIGolfGuy
1470881,2024-10-23 08:46:01 -0700,2024-10-23 08:46:01 -0700,A verdade.,"<p><a href=""https://www.youtube.com/watch?v=Ah7D3ziuYlM&amp;pp=ygUqYWZ1bmRlbSBvIGJpc21hcmNrIGZpbG1lIGNvbXBsZXRvIGR1YmxhZG8g"" rel=""nofollow"">https://www.youtube.com/watch?v=Ah7D3ziuYlM&amp;pp=ygUqYWZ1bmRlbSBvIGJpc21hcmNrIGZpbG1lIGNvbXBsZXRvIGR1YmxhZG8g</a> </p>",settings;firefox;,firefox,settings,pt-BR,"",finaews
1470877,2024-10-23 08:32:01 -0700,2024-10-23 08:32:01 -0700,Downloads,<p>I have defined the setting for asking to save or download but all files I choose open are always downloaded as well. How can I avoid this? </p>,settings;firefox;windows-11;,firefox,settings,en-US,"",joanasterisco
1470876,2024-10-23 08:31:46 -0700,2024-10-23 08:31:46 -0700,Microsoft Stream Screen Recording doesn't work in Firefox / Blocked by Microsoft,"<p>It appears that Microsoft Stream's new screen recording feature from browser either doesn't work in Firefox, or Microsoft has blocked usage in Firefox. No attempt is made to gain browser screen-recording permissions for the site prior to the following error message appearing. </p>",firefox;browse;firefox-1310;firefox-13103;,firefox,browse,en-US,"",akillby
1470870,2024-10-23 07:44:42 -0700,2024-10-23 07:44:42 -0700,so good app like this.,<p>default browser show agains  to against  so i disturbed . </p>,firefox;performance-and-connectivity;,firefox,performance-and-connectivity,en-US,"",muhataj9
1470868,2024-10-23 07:38:27 -0700,2024-10-23 07:38:27 -0700,API Calls Blocked in Firefox Private Browsing (CORS Issue),"<p>Hi Team, </p><p>When I try to open the website in Firefox (normal mode), all API calls work fine. However, when I open the same website in Firefox's private browsing mode, all API calls are blocked due to CORS request issues. Could you please provide suggestions to resolve this? </p>",firefox;performance-and-connectivity;,firefox,performance-and-connectivity,en-US,"",jeeva.somasundaram
1470866,2024-10-23 07:33:03 -0700,2024-10-23 08:19:16 -0700,Download Firefox per windows 8.1 da fare su computer diverso da quello dove deve essere installato,<p>Salve. Vorrei fare il download del browser Firefox per Windows 8. Il mio problema e che dovrei installare questo download su  un computer diverso visto che il computer su cui necessito il download al momento non consente alcun collegamento per eseguire il download direttamente. Avrei quindi necessità di scaricare il file di installazione su una chiavetta usb da un computer Windows 10 per poi trasportarla sul computer dove devo appunto installare Firefox per Windows 8.1 x64. Potete aiutarmi e indicarmi dove posso trovare un link per il download. Grazie per l'aiuto. </p>,firefox;installation-and-updates;,firefox,installation-and-updates,it,1683621;,Fabio
1470860,2024-10-23 07:07:38 -0700,2024-10-23 07:28:38 -0700,Want to access website you have deemed unsecure . How do I do that. Time sensitive I know this website,<p>tell me how to access website you have blocked because Not secure. I know this website and need immediate access </p>,firefox;privacy-and-security_1;,firefox,privacy-and-security,en-US,1683607;,marcyh
1470858,2024-10-23 06:57:25 -0700,2024-10-23 06:57:25 -0700,Firefox - gmail sign in doesn't work,"<p>I signed out of my google accounts in Firefox by mistake and can't sign in to my gmail from Firefox. All attempts at following instructions lead back to the same page. Image upload. It's a constant vicious circle and I don't know what to do. </p><p>I cleared the cache since midnight, long before the problem occurred. I've had to use Edge or Chrome to access my gmail and they work. </p><p>I don't know what to do and maybe it is a Firefox issue. It is updated since a few days ago. My gmail is ivangiesen1@gmail.com </p><p><br> Any help will be much appreciated Ivan </p>",firefox;windows-10;passwords-and-sign-in;firefox-1310;firefox-13103;,firefox,passwords-and-sign-in,en-US,"",ivangiesen1
1470856,2024-10-23 06:48:10 -0700,2024-10-23 06:48:10 -0700,IM Translator No Toolbar Button,"<p>Hello, </p><p>I am running FF 131.0.3 (64-bit) on a Dell Laptop with W11 and have installed IM Translator 16.93. </p><p>After the IM Translator installation there is no Button for it on the toolbar. I have confirmed that the show Toolbar button is checked in the Advanced options.  </p><p>Is this just a bad update or is there something else to do to get the button to appear? </p><p>Thanks in advance for your help!! </p>",settings;firefox;,firefox,settings,en-US,"",RHB10
1470851,2024-10-23 06:37:22 -0700,2024-10-23 06:37:22 -0700,actualzacion,<p>horrario </p>,firefox;accounts;,firefox,accounts,es,"",orocorti
1470850,2024-10-23 06:29:47 -0700,2024-10-23 07:27:21 -0700,Censorship of Newsmax,"<p>Firefox returns a ""Secure Connection Failed"" after some (?) time browsing Nesmax articles. After receiving the message, the NEWSMAX website is inaccessible via Firefox. It is clearly not a security issue because I can clear my Firefox history and access Newsmax and the specific article that was specified as insecure. From all appearances, Firefox is censoring Newsmax. WHY? </p>",firefox;browse;,firefox,browse,en-US,1683606;,gmc.bible
1470849,2024-10-23 06:21:30 -0700,2024-10-23 06:21:30 -0700,To access camera,<p>To access the camera </p>,firefox;browse;,firefox,browse,en-US,"",srinitharsrinithar
1470847,2024-10-23 06:15:28 -0700,2024-10-23 06:15:28 -0700,How do I remove the List all Tabs button,"<p>I want to remove the ""List all Tabs button"" as it's pointless bloat. I am following the instructions on </p><p><a href=""https://support.mozilla.org/mk/questions/1394194"" rel=""nofollow"">https://support.mozilla.org/mk/questions/1394194</a>  </p><p>Which says I should set <strong>browser.tabs.tabmanager.enabled = false</strong>  </p><p>I've just upgraded to version 131 and this fix it doesn't work. </p>",settings;firefox;,firefox,settings,en-US,"",stormcloud
1470846,2024-10-23 06:12:43 -0700,2024-10-23 06:12:43 -0700,Can i connect my mail,<p>Can i connect my mail </p>,firefox;backup-recovery-and-sync;,firefox,backup-recovery-and-sync,en-US,"",Munshiram05071967
1470845,2024-10-23 06:11:13 -0700,2024-10-23 06:17:26 -0700,Cannot Widen Vertical Scrollbar in Version 131.0.3,"<p>This is a followup to this post: [<a href=""https://support.mozilla.org/en-US/questions/1443060|Previous"" rel=""nofollow"">Answer</a>] </p><p>I as diligently as possible followed the instructions there as well as in the embedded link to <a href=""https://support.mozilla.org/en-US/kb/about-config-editor-firefox"" rel=""nofollow"">https://support.mozilla.org/en-US/kb/about-config-editor-firefox</a> </p><p>However, there is no change to the width of the vertical scroll bar. Perhaps the protocol has changed since the previous post? Attached are the current settings. Is a width of 20 not a large enough difference to be visible? If any settings are incorrect to achieve the desired result please let me know. Very much appreciated. </p>",firefox;browse;,firefox,browse,en-US,1683592;,marc165
1470844,2024-10-23 06:08:04 -0700,2024-10-23 06:08:04 -0700,nesprávné zobrazování textu,"<p>Zdravím, mám jeden problém- nyní jsem zjistil když chci něco nastavovat ve Firefoxu (v mojem případě hesla) tak mám podivné zobrazení textu-vzorky Vám přikládám:   Zábraniční polovk v na ky k u uz......S dat a jejich křesa na křesí..........Povolte ⁨účtu Mozilla zamrazíza zastásteli ⁨Mozilleho zamračená kraštovka, údaje och. Zaj více informací ...........Povolte ⁨účtu Mozilla zamrazíza zastásteli ⁨Mozilleho zamračená kraštovka, údaje och. Zaj více informací............ Zadejte své heslo k ⁨Ú Mozilla zaustění.............Tom popustka v í, vs, živo, me o., osa, kót, ky..............si k kjeta obnovní oční provize dat vs, zapomenete............VíŤ suša prou. atd. Moc Vás prosím co to může způsobovat??? Poradíte mi prosím?????   Děkuji&nbsp;!!!!!!!!!!!. Josef Zuzjak      pepan2024@seznam.cz </p>",settings;firefox;,firefox,settings,cs,"",pepan2024
1470843,2024-10-23 05:54:17 -0700,2024-10-23 05:54:17 -0700,yes abro nna,<p>'<em><strong>bold text'</strong></em> </p>,firefox;backup-recovery-and-sync;,firefox,backup-recovery-and-sync,en-US,"",tsedeboge100
1470842,2024-10-23 05:53:56 -0700,2024-10-23 06:58:59 -0700,Window drop-down menu with submenu for tabs in front of each window name ?,"<p>Hi! I'm using Firefox as my main browser on Wondows and on MacOS since the beginning, leaving Netscape Navigator 3.0, and Mozilla 1.0 to meet this great project. </p><p>I often have more than 10 windows opened, and each of them has more than ten tabs opened in it, meaning that I need to find the good tab by one hundred... It's really difficult because I can't search by the name of the tab, most of the time, the name of a PDF file that I just loaded and sometime looks like the name given by an MFC scanner ""SKM98392839.pdf"".... But I know in which order I opened it, and what are the neighbor tabs... </p><p>So, my question is&nbsp;: does anyone asked to enhance the drop-down menu ""Window"" in the menu bar, to have Windows name ordered by opening order since the beginning of the session, and for each window name have a drop-down sub-menu containing the names of the tabs, also presented by a special order, the one created in the window by loading, or moving new tabs and also being able to see in this menu the type of container used. </p><p>It would be also interesting to be able to know the parent of a new tab&nbsp;: a user new tab, or an older tab where an http link has been clicked. </p><p>If there are extensions to do this, please, let me know, because I can't find one of them. </p><p>Thank you all&nbsp;!  </p><p>Eric </p>",settings;firefox;,firefox,settings,en-US,1683602;,eric244
1470838,2024-10-23 05:26:10 -0700,2024-10-23 06:05:05 -0700,How to refund a wrong transaction in Phone Pe? -,"<p>To refund money from Phone Pe for a wrong transaction, you should immediately contact PhonePe's customer support:(76007~86212)and (available 24/7) report...How to refund a wrong transaction in PhonePe?To refund money from Phone Pe for a wrong transaction, you should immediately contact PhonePe's customer support:( ... </p>",firefox;needsinfo;installation-and-updates;,firefox,installation-and-updates,en-US,1683570;1683571;1683572;1683573;1683574;1683575;1683576;,r47360980
1470837,2024-10-23 05:24:22 -0700,2024-10-23 05:24:22 -0700,calling,<p>calling </p>,firefox;browse;,firefox,browse,en-US,"",annabellemaraasin76
1470834,2024-10-23 05:14:35 -0700,2024-10-23 05:14:35 -0700,Černá obrazovka,"<p>Dobrý den, v poslední době mám problém při práci s katastrální mapou na <a href=""http://www.cuzk.cz"" rel=""nofollow"">www.cuzk.cz</a> mi najednou zčerná obrazovka a počítač na nic nereaguje. Dokážu akorát přes správce souborů ukončit Firefox. Například u prohlížeče Edge tento problém není. Mohu požádat o radu v čem je problém? </p><p>Děkuji za odpověď. Zdeněk Vyskočil </p>",firefox;browse;,firefox,browse,cs,"",zdenek.w33
1470832,2024-10-23 05:05:18 -0700,2024-10-23 05:05:18 -0700,How to fix an error with a popping up message about the failure of update,"<p>I've come up against a problem of having to switch off a pesky pop-up message every two hours or so that says Firefox failed to update automatically and asks me to download a new version. However, the newest version has been installed and the manual check shows that no further updates are available. How can I switch off this pop-up message? Thanks. </p>",firefox;installation-and-updates;,firefox,installation-and-updates,en-US,"",alexholodaev
1470831,2024-10-23 05:02:46 -0700,2024-10-23 05:03:13 -0700,Be descriptive. Saying “playing video on YouTube is always choppy” will help us understand the issue better than saying “something is wrong” or “the app is broken”.,"<p>Be nice. Our volunteers are Mozilla users just like you, who take the time out of their day to help. Be descriptive. Saying “playing video on YouTube is always choppy” wi </p>",firefox;needsinfo;browse;,firefox,browse,en-US,1683555;1683556;,cluster02ali
1470830,2024-10-23 04:56:14 -0700,2024-10-23 04:56:14 -0700,uploaded photos to Marktplaats.nl using firefox are washed out.,"<p>When I upload pictures to the Dutch website <a href=""http://Marktplaats.nl"" rel=""nofollow"">Marktplaats.nl</a> all pictures are washed out / over exposed. When I upload the same pictures in Chrome, the uploaded pictures look fine in both browsers! So it's not the display, but the upload process that changes the pictures.  </p><p>The added picture shows the same pictures uploaded with Chrome sided with the pictures added with Firefox on a windows 11 PC with NVIDIA Geforce RTX 4070 Ti grafics card </p><p>I already tried all various settings with gfx.colormanagement and disabled hardware acceleration in FF, but that doesn't change anything regarding the upload problem </p>",firefox;performance-and-connectivity;,firefox,performance-and-connectivity,en-US,"",ineke1
1470829,2024-10-23 04:40:20 -0700,2024-10-23 04:40:20 -0700,html1,<p>asdgghgkj </p>,firefox;browse;,firefox,browse,en-US,"",sumaiyaakther85471
1470828,2024-10-23 04:36:52 -0700,2024-10-23 07:30:48 -0700,Meet Google,<p>- cannot get the system to allow me to share Word Documents - any ideas pls? </p>,firefox;privacy-and-security_1;,firefox,privacy-and-security,en-US,1683609;,mary137
1470820,2024-10-23 04:02:36 -0700,2024-10-23 04:10:44 -0700,Sage - username won't save,"<p>Hi folks After manyyears of using Sage accounting software, somehow Firefox no longer saves my Sage username, which is very annoying as now every time I login I have to manually type my Sage username. Clearely I have clicked something I shoudn't and I wonder if anyone can help me save the username again? Thx. </p>",firefox;passwords-and-sign-in;,firefox,passwords-and-sign-in,en-US,1683551;,derrickings
1470816,2024-10-23 03:47:30 -0700,2024-10-23 08:25:07 -0700,non trova pagina,"<p>Buongiorno, vorrei segnalare un blocco che ho trovato anche ieri (22-10-2024) nell'aprire pagina da me visitata frequentemente, dalla schermata di inizio con navigazione  anonima scrivo remixdjpool e non l'ha trovata! Provo con il browser microsoft edge e trova subito la pagina!!! Come mai? Uso solamente mozilla firefox come browser da tempo, pero' questo inconveniente non lo capisco, attendo vostra risposta,saluti </p>",firefox;needsinfo;browse;,firefox,browse,it,1683626;,riochessa
1470814,2024-10-23 03:41:57 -0700,2024-10-23 03:47:18 -0700,I want to turn off ad blocker but cant find it in the add ons or extensions page??,<p>I want to identify where the adblocker is in Firefox so I can turn it off because it's stopping video play in You tube </p>,windows-7;firefox;performance-and-connectivity;,firefox,performance-and-connectivity,en-US,1683549;,wriky
1470813,2024-10-23 03:29:33 -0700,2024-10-23 03:29:33 -0700,""" the bookmarks and history system have been deleted and i dont know how to get them back """,<p>get my bookmarks and history system back </p>,firefox;performance-and-connectivity;,firefox,performance-and-connectivity,en-US,"",ganata428
1470807,2024-10-23 02:40:52 -0700,2024-10-23 02:40:52 -0700,"video starts to play, then disapears",<p>video starts to play. then disappears </p>,firefox;browse;,firefox,browse,en-US,"",chuhoi69
1470805,2024-10-23 02:24:55 -0700,2024-10-23 02:24:55 -0700,"After updating to Xubuntu 24.10, WebGL no longer works on Firefox (v. 131.03.03) due to nvidia-driver-560","<p>After updating to Xubuntu 24.10 from 24.04, WebGL no longer works on Firefox (v. 131.03.03), while it works fine in Chrome. </p><p>In about:support I see: </p><p>Driver Informations WSI WebGL 1 - Renderer driver WebGL 1 WebGL creation failed: </p><pre>  WebglAllowWindowsNativeGl:false restricts context creation on this system. ()   Exhausted GL driver options. (FEATURE_FAILURE_WEBGL_EXHAUSTED_DRIVERS) </pre> <p>Renderer driver WebGL 2 WebGL creation failed: </p><pre>  AllowWebgl2:false restricts context creation on this system. () </pre> <p>webgl.enable-prototype-webgl2 is set to true webgl.force is set to true webgl.osmesalib is set to true </p><p>Wayland has not yet been implemented on Xubuntu, so I am still using X11. </p><p>I have the same issue even when running Firefox in safe mode. </p><p>After a few attempts, it seems the issue is related to the Nvidia drivers. I uninstalled the drivers using the command: </p><p>sudo apt purge nvidia-driver </p><p>rebooted the system (now running with the Nouveau drivers), and the sites with WebGL worked. Then I rebooted into maintenance mode and tried to install the previous drivers, nvidia-driver-535, but it seems they are no longer available in Xubuntu 24.10. In fact, nvidia-driver-560 is installed along with some files from nvidia-driver-535, so the problem reappeared. </p><p>I have an Nvidia GeForce RTX 2070 Super. </p><p>Any suggestions? </p>",firefox;browse;firefox-1310;firefox-13103;,firefox,browse,en-US,"",thereticle
1470802,2024-10-23 02:07:30 -0700,2024-10-23 02:07:30 -0700,New tab '+' icon will not persist on RHS of tabs,<p>I prefer the toolbar new tab '+' icon to be located to the right of the currently open tabs. However each time I customise the toolbar to re-locate the '+' sign to the right it will revert to the extreme left when FF restarts.  How can I make my customisation persist? </p><p>Thanks FF Developer Edition v132.0b9 (aarch64)  Mac OS X Sonoma 14.7 </p>,settings;firefox;,firefox,settings,en-US,"",rich06
1470801,2024-10-23 01:58:04 -0700,2024-10-23 01:58:04 -0700,Guessing correct text encoding from page content,"<p>At random (and believe it has nothing to do with the website, or no evidence) I get garbage text on websites.  The button ""Guessing correct text encoding from page content,"" in which I clicked several times and refreshed the page, doesn't fix this issue.  Though, when I close down Firefox and rerun it, the issue clears.  If that was the only website (tabs) I have up, then I would have no reason to fuss.   </p><p>The computer/system I have is as follows: </p><p>Edition	Windows 11 Home Version	23H2 Installed on	‎Sat, ‎8/‎12/‎2023 OS build	22631.4391 Serial number	PF44P72H Experience	Windows Feature Experience Pack 1000.22700.1047.0 </p><p>Device name	Brandonslaptop Processor	AMD Ryzen 7 5800H with Radeon Graphics            3.20 GHz Installed RAM	64.0 GB (63.9 GB usable) </p><p>System type	64-bit operating system, x64-based processor Pen and touch	No pen or touch input is available for this display (excuse me for removing the Device and Product IDs) </p><p>I am using the Windows 11 Defender as my security and Adguard for Windows (in which should not be of any conflict because this issue happens randomly, and not all the time). </p>",firefox;performance-and-connectivity;firefox-1310;firefox-13103;,firefox,performance-and-connectivity,en-US,"",brandonbowers1966
1470799,2024-10-23 01:52:32 -0700,2024-10-23 02:21:43 -0700,"After updating to Xubuntu 24.10, WebGL no longer works on Firefox (v. 131.03.03) due to nvidia-driver-560","<p>After updating to Xubuntu 24.10 from 24.04, WebGL no longer works on Firefox (v. 131.03.03), while it works fine in Chrome. </p><p>In about:support I see: </p><p>Driver Informations WSI WebGL 1 - Renderer driver WebGL 1 WebGL creation failed: </p><pre>   WebglAllowWindowsNativeGl:false restricts context creation on this system. ()    Exhausted GL driver options. (FEATURE_FAILURE_WEBGL_EXHAUSTED_DRIVERS) </pre> <p>Renderer driver WebGL 2 WebGL creation failed: </p><pre>   AllowWebgl2:false restricts context creation on this system. () </pre> <p>webgl.enable-prototype-webgl2 is set to true webgl.force is set to true webgl.osmesalib is set to true </p><p>Wayland has not yet been implemented on Xubuntu, so I am still using X11. </p><p>I have the same issue even when running Firefox in safe mode. </p><p>After a few attempts, it seems the issue is related to the Nvidia drivers. I uninstalled the drivers using the command: </p><p>sudo apt purge nvidia-driver </p><p>rebooted the system (now running with the Nouveau drivers), and the sites with WebGL worked. Then I rebooted into maintenance mode and tried to install the previous drivers, nvidia-driver-535, but it seems they are no longer available in Xubuntu 24.10. In fact, nvidia-driver-560 is installed along with some files from nvidia-driver-535, so the problem reappeared. </p><p>I have an Nvidia GeForce RTX 2070 Super. </p><p>Any suggestions? </p>",firefox;browse;firefox-1310;firefox-13103;,firefox,browse,it,1683538;,thereticle
1470798,2024-10-23 01:51:26 -0700,2024-10-23 01:51:26 -0700,displaying website,"<p>Hello, Does anyone know why the website is displaying the way it does in the attached screenshot? I’ve tried clearing cookies, resetting site settings, etc., but nothing has worked. It’s only this one website that appears like this. </p>",firefox;browse;,firefox,browse,en-US,"",delph2
1470796,2024-10-23 01:48:47 -0700,2024-10-23 01:48:47 -0700,cannot pin extension to firefox since ver 131 umm why not,<p>Cannot pin extension to firefox since ver 131 umm why not been through the settings add ons and themes no option to pin nothing bloody annoying why could it just be left as is .... </p>,settings;firefox;,firefox,settings,en-US,"",mucko68
1470795,2024-10-23 01:48:04 -0700,2024-10-23 01:48:04 -0700,make my home page firefox,<p>make my home page firefox </p>,firefox;installation-and-updates;,firefox,installation-and-updates,en-US,"",alshirl1
1470793,2024-10-23 01:23:45 -0700,2024-10-23 01:23:45 -0700,Installation,<p>fdgfhgh </p>,firefox;installation-and-updates;,firefox,installation-and-updates,en-US,"",shayekcom
1470791,2024-10-23 00:57:47 -0700,2024-10-23 00:57:47 -0700,firefox,<p>pls download firefox </p>,firefox;browse;,firefox,browse,en-US,"",geetapekhale755
1470787,2024-10-23 00:31:57 -0700,2024-10-23 07:34:40 -0700,After reinstalling Firefox on my laptop I have lost all my bookmarks. How can I get them back?,<p><strong>After reinstalling Firefox on my laptop I have lost all my bookmarks. How can I get them back?</strong> </p>,firefox;installation-and-updates;,firefox,installation-and-updates,en-US,1683611;,nuttree
1470781,2024-10-22 23:41:24 -0700,2024-10-22 23:41:24 -0700,i work,<p>i work </p>,firefox;browse;,firefox,browse,en-US,"",doleyajit540
