id,created,updated,title,content,tags,product,topic,locale,answers,creator
1438725,2024-02-04 00:49:30 -0800,2024-02-04 00:57:00 -0800,last update FF update livestream mjpeg axis cams failed,<p>Since the last FF update I can no longer see live streams from my axis cameras. Only a pic placeholder appears on the HTML page. FF on mac and win are affected. @the win pc the html website axis cam live stream works fine. after update FF the same problem as on the mac. cache clean done. Does anyone have an idea if I need to change a setting? </p>,desktop;customize;windows-10;,firefox,customize,en-US,"",jh111111
1438721,2024-02-03 21:41:48 -0800,2024-02-03 21:51:07 -0800,"打开新标签页的时候提示“哎呀，载入内容时发生错误”，I'm Chinese, so do not use the [redacted] english","<p>fix the bug ASAP，the use of the newest version of firefox is not to sucks me in this way, but to provide customers with a better service, i do not know why i just updated and there is a problem. Fix it right now!!!!!!!!!! </p>",desktop;windows-10;website-breakages;firefox-1220;,firefox,website-breakages,en-US,1634903;,1151358731
1438719,2024-02-03 20:25:14 -0800,2024-02-03 20:25:14 -0800,tamil,<p>firefox downlod </p>,linux;desktop;download-and-install_1;,firefox,download-and-install,en-US,"",gakashpandi
1438718,2024-02-03 20:23:46 -0800,2024-02-03 22:08:07 -0800,Any chance of simple auto debug for plug ins?,"<p>How about logging entry and exit points for each plug in that runs? Then it should be pretty easy to identify which plugin is crashing. Sure, it won't work all the time, but it'll work much of the time. </p><p>This would be SO much easier than taking ages to manually debug by safe mode, trouble shooting, disabling each plugin one at a time. That's no fun, even for IT pros. Think what it's like for regular users! </p><p>What am I missing here? This sounds like a very simple fix, which would offer HUGE wins for little work. </p><p>How does that sound? </p><pre>   Ed </pre>",desktop;fix-problems;windows-10;,firefox,fix-problems,en-US,1634896;1634904;,ed65love
1438717,2024-02-03 20:14:49 -0800,2024-02-03 20:45:00 -0800,Bookmarks glitch,"<p>In Bookmarks, I can no longer title the bookmark.  Now a 2-step process, have to go bback and edit.  A real loss. </p>",desktop;bookmarks;windows-11;firefox-1220;,firefox,bookmarks,en-US,1634893;1634895;,blvnyrslf
1438716,2024-02-03 20:05:05 -0800,2024-02-03 20:17:31 -0800,New Empty Window Problem (Mac),"<p>I am using FF 115.7.0 on a Mac.  I normally use tabs but when I need a new window, it opens with every one of my bookmarks in a tab.  I can open a subject in a new window from an article in a tab from a different window but I just can't open an empty window without getting all of my bookmarks opened in (many!) separate tabs. </p><p>Thanks for any help. </p>",desktop;tabs;mac-os-x-1014;firefox-1157;firefox-11570;,firefox,tabs,en-US,1634892;,omniwin
1438711,2024-02-03 17:28:28 -0800,2024-02-03 20:13:23 -0800,Want back separate boxes for website and search,<p>I used to have separate boxes for website address and for searches. Now there is only one combined web address / search box. How do I get back my old layout? One box had web address. Second had search. </p>,desktop;other;windows-11;firefox-1220;,firefox,other,en-US,1634888;1634891;,PeteAmend
1438709,2024-02-03 16:42:09 -0800,2024-02-03 19:13:06 -0800,Default browser,<p>My Browser is set as default in Settings but Google over rides my setting/ Google is not set to be Default </p>,desktop;other;windows-11;firefox-1220;,firefox,other,en-US,1634889;,halbowles
