id,created,updated,title,content,tags,product,topic,locale,answers,creator
1475991,2024-11-26 05:54:38 -0800,2024-11-26 05:54:38 -0800,cannot concect with various sites,"<p>for the past two days I have been unable to connect to various internet sites usong Mozila while Microsoft Edge has not problem, how can ifix fire fox? </p>",firefox;performance-and-connectivity;,firefox,performance-and-connectivity,en-US,"",martygraff66
1475990,2024-11-26 05:21:57 -0800,2024-11-26 05:22:26 -0800,Music playing,<p>Cookie YouTube please help </p>,firefox;installation-and-updates;,firefox,installation-and-updates,en-US,1690154;,shivmis165
1475989,2024-11-26 05:14:35 -0800,2024-11-26 05:14:35 -0800,Ad blocking and search engine problems.,"<p>For the past week or so I am finding Youtube videos are unavailable because,  I understand from messages that flash on my screen, its ads are being blocked.  This does not occur if I use Chrome.  Also, although I had chosen Duck Duck Go as my search engine, Yahoo seems to be doing the job. Can you please advise me how I can stop ad blocking for Youtube, and yahoo appearing as the search engine, when I use Firefox.  Firefox was my default browser but have changed to Chrome for the present.  The O/S on my PC is Windows 10. </p>",settings;firefox;,firefox,settings,en-US,"",grtate
1475985,2024-11-26 04:50:23 -0800,2024-11-26 06:04:10 -0800,Netflix does not work,"<p>Netflix says I need the the latest version of firefox. At the top of the screen it says ""Firefox is installing components needed to play the audio or video on this page. Please try again later"" </p><p>As far as I can tell nothing is installing and I need to actually do something to resolve this issue. Unfortunately I don't know what. Please help me resolve this issue. </p>",firefox;browse;,firefox,browse,en-US,1690150;1690161;,markus9577
1475984,2024-11-26 04:48:43 -0800,2024-11-26 05:13:00 -0800,Denied access to my mail accounts and MyHeritageaccount,"<p>Page seems to freeze, and mail/google-acces denied out of nowhere. Same message when trying to log in to MyHeritage. Message someone changed phonenumber recently. I didn´t. I am accessing internet via cable to Iphone. No wifi or bluetooth. I suspect someone is trying to get illegitimate access. </p>",firefox;privacy-and-security_1;,firefox,privacy-and-security,en-US,1690151;,elledyring
1475982,2024-11-26 04:37:08 -0800,2024-11-26 04:37:08 -0800,Search Engine Basics A Simple Guide to the Critical Steps in Search Engine Operations,"<p>Understanding the search engine basics is crucial for anyone looking to improve their online presence. Search engines are the gateway to the digital world, enabling users to find information quickly and efficiently. The process behind their functionality revolves around three main activities: crawling, indexing, and ranking. By grasping these core components and processes, you can optimize your content to align with search engine requirements and improve visibility. 1. What Are Search Engines? Search engines are powerful tools that allow users to search for information on the internet by entering keywords or phrases. They return a list of results, called the search engine results page (SERP), ranked based on relevance and quality. Search engines operate through a combination of sophisticated algorithms and vast databases, ensuring users receive accurate and timely results. 2. Crawling: Discovering Web Content The first step in the search engine basics is crawling. Crawlers, also known as spiders or bots, are automated programs that explore the internet to discover new and updated web pages. Here’s how crawling works: Exploration: Crawlers start by visiting known URLs and follow links on those pages to discover additional content. Data Collection: They collect information such as text, metadata, and links for analysis. Regular Updates: Crawlers revisit pages periodically to capture changes or additions. Crawling ensures search engines have a comprehensive and up-to-date view of the web. 3. Indexing: Organizing Information Once the data is collected, it moves to the indexing phase. This process is essential for search engine basics, as it involves analyzing and organizing web content for efficient retrieval. Key aspects of indexing include: Keyword Identification: Recognizing the main topics and phrases on a page. Metadata Processing: Analyzing titles, descriptions, and tags. Storage: Saving the structured information in a database for easy access. The indexed database acts as the foundation for delivering results when users enter a query. 4. Ranking: Delivering Relevant Results Ranking is the final step in the search engine basics, determining the order in which results appear on the SERP. Algorithms evaluate various factors to prioritize the most relevant and authoritative pages. Critical ranking factors include: Content Quality: Pages with informative, original, and engaging content rank higher. Keyword Relevance: Matching the user’s search terms with the indexed content. Backlink Authority: Links from reputable sources boost rankings. User Experience: Mobile-friendly design, fast load times, and secure connections are essential. Ranking ensures users find the most useful and reliable information quickly. 5. The Role of Algorithms in Search Engine Basics Search engines rely on complex algorithms to process and analyze data at every stage. These algorithms are designed to understand user intent, evaluate content, and adapt to changing trends. Key algorithm updates, such as Google’s “BERT” and “RankBrain,” have significantly improved the way search engines interpret natural language and prioritize content. 6. Why Understanding Search Engine Basics Matters For businesses, marketers, and content creators, mastering search engine basics is essential for success in the digital landscape. It enables you to: Optimize Content: Use relevant keywords and high-quality material. Enhance Visibility: Improve rankings and reach a broader audience. Boost User Engagement: Create a seamless browsing experience for visitors. Conclusion Understanding the search engine basics—crawling, indexing, and ranking—provides valuable insights into how these platforms work. These core processes ensure users find accurate and relevant results in seconds, making search engines indispensable tools in our daily lives. For those aiming to improve their online presence, aligning with search engine requirements is key. By creating quality content, optimizing for keywords, and ensuring a positive user experience, you can harness the power of search engines to reach your target audience effectively. </p><p>visit for more info&nbsp;:-<a href=""https://anyblogsview.com/blogs/search-engine-optimization/how-search-engine-work.html"" rel=""nofollow"">https://anyblogsview.com/blogs/search-engine-optimization/how-search-engine-work.html</a> </p>",firefox;browse;,firefox,browse,en-US,"",anyblogsview
1475981,2024-11-26 03:56:44 -0800,2024-11-26 03:56:44 -0800,dovete rivedere i vostri modi di accesso all'account firefox,"<p>non so come gestite gli accessi, ma male, ogni volta che devo entrare su un dispositivo, non mi chiede il codice autenticator, chissa per quale motivo, ma invece mi arriva un'email e puntualmente da errore, devo disattivare l'autenticazione a due fattori e poi riattivarla, ma non finisce qua, mi si rimuove la chiave di recupero e quando la vado a generare da errore, devo aspettare 15 min per poterla ricreare.... </p>",firefox;accounts;,firefox,accounts,it,"",giuseppe4
1475980,2024-11-26 03:51:42 -0800,2024-11-26 03:51:42 -0800,Did firefox disable all http traffic?,"<p>I'm not able to open any HTTP website on firefox (desktop and mobile) and it started about 2 months ago. So, is HTTP traffic not allowed anymore? I'm able to access HTTP over chrome, edge and safari, but firefox (regular and developer edition and ios version) are not working. It keeps loading for about 5 minutes then I see ""ns_error_net_reset"" in the console network tab. </p><p>also, https-only-mode is set to ""don't enable"" in the settings </p>",firefox;browse;,firefox,browse,en-US,"",ahmedsabbagh1192
1475978,2024-11-26 03:44:09 -0800,2024-11-26 03:44:09 -0800,ogni volta che tento di accedere su un dispositivo windows: errore,"<p>ho firefox installato su un mac, sto tentando di installarlo su windows ma ogni volta che tento di accedere all'account mettendo ovviamente email e password corrette: sempre un dannato messaggio qualcosa è andato storto </p><p>ogni volta  ogni santa volta </p>",firefox;accounts;,firefox,accounts,it,"",giuseppe4
1475977,2024-11-26 03:40:09 -0800,2024-11-26 05:14:32 -0800,SMTP Server settings,<p>Is it possible to initiate the same process that discovers the server setting when you add an email account in an already existing email account to avoid making changes in the account manually?? </p>,firefox;accounts;,firefox,accounts,en-US,1690152;,p_manolis
1475974,2024-11-26 03:13:22 -0800,2024-11-26 03:13:22 -0800,RICHIESTA ASSISTENZA FIREFOX 115.17.0esr (64bit),"<p>Buongiorno, desidero segnalarvi un problema che mi si ripresenta molto frequentemente durante la navigazione . mi si chiude la scheda inaspettatamente sia all'apertura della pagina cercata che durante la lettura della pagina , quindi a scheda già aperta. </p><p>COSA DEVO FARE&nbsp;???? </p><p><br> VI RINGRAZIO </p>",firefox;performance-and-connectivity;,firefox,performance-and-connectivity,it,"",gpoidomani
1475969,2024-11-26 02:18:11 -0800,2024-11-26 02:18:11 -0800,Firefox and confluence not working,"<p>Hi, </p><p>I am having some problems going through Confluence Pages with firefox in windows. I found out that I am not the only one. </p><p>Can you check this please? <a href=""https://jira.atlassian.com/browse/CONFSERVER-88208"" rel=""nofollow"">https://jira.atlassian.com/browse/CONFSERVER-88208</a> </p><p>This only happens with firefox, not with other browsers like edge, chrome, opera, vivaldi, brave... </p><p>Thanks. </p>",firefox;browse;,firefox,browse,en-US,"",hugotome
1475967,2024-11-26 02:06:34 -0800,2024-11-26 02:08:36 -0800,@Ardaozkeskin,<p>Ardaozkeskin <strong>bold text</strong> </p>,settings;firefox;,firefox,settings,en-US,1690133;1690134;,ardaozkeskin0
1475966,2024-11-26 02:03:29 -0800,2024-11-26 05:30:57 -0800,Data loss password recovery,"<p>I had to reset my firefox password. When signing in, the account is not synced (no extensions, history, bookmarks etc) and acts like it is the fresh instance. When manually syncing, it spins for a second then stops. Says it last synced 1 second ago. I see no data otherwise. Does resetting password seriously remove all data? What is the point of recovering the account if it gives you a fresh account anyway? There was a disclosure that mentioned some data, but not even including bookmarks or extensions is a little upsetting for me. Disrupted my work day quite a lot. </p>",firefox;backup-recovery-and-sync;,firefox,backup-recovery-and-sync,en-US,1690149;1690155;,mark.adams2
1475964,2024-11-26 01:40:52 -0800,2024-11-26 01:40:52 -0800,Connection speed,"<p>hello I use FF 132.0.2 (64- Bit) and Proton VPN version 3.4.3. since one of the latest updates of FF the connection to the WEB is terrible slow. I tried the Troubleshooting mode and the reset of FF, there is no improvement. Other browers do not have this problem and without running VPN the speed of FF is as it should be. thanks and sorry for my German Englisch HI </p>",firefox;performance-and-connectivity;,firefox,performance-and-connectivity,en-US,"",irhehi
1475963,2024-11-26 01:28:01 -0800,2024-11-26 02:17:42 -0800,accounts,"<p>I have 5 accounts registered with FIREFOX (which I will call A, B, C, D and F). The one I am registered with is A. Every new page I open, it opens with account B but I would like it to open on C by default. How can this be done without changing account B to C each time? </p>",firefox;accounts;,firefox,accounts,it,1690137;,ing.riccardo.dicicco
1475962,2024-11-26 01:20:15 -0800,2024-11-26 01:25:47 -0800,No audio in Firefox 132.0.1,"<p>non funziona più l'audio dei siti su Firefox 132.0.1 installato su Fedora  41 plasma (altri browser ok) io penso che sia dovuto ad un aggiornamento di Fedora  di ieri ,perchè il problema non esisteva. ma non sò da cosa possa dipendere. </p>",firefox;performance-and-connectivity;firefox-1320;firefox-13201;,firefox,performance-and-connectivity,it,1690129;,r.brune
1475959,2024-11-26 00:31:31 -0800,2024-11-26 00:31:31 -0800,Performance + Cache recurrent problems,"<p>I notice that Firefox is slower and crashes my computer more often than usual (Win 11). Sometimes it doesn't let me interact with the start bar, other times it just crashes. On the other hand, the browser cache is really annoying for a web developer. We need some partial cache clearing or another system similar to Chromium. I try to stick with Firefox since I've been using it for over 10 years, but I'm almost forced to switch to Chrome if it has so many problems. Thanks in advance. </p>",firefox;performance-and-connectivity;,firefox,performance-and-connectivity,es,"",jegico93
1475956,2024-11-26 00:00:47 -0800,2024-11-26 03:11:22 -0800,Gah. Your tab just crashed. - tried all suggested solutions,"<p>Greetings. Please help. </p><p>After Win11 update, Firefox started to just show ""Gah. Your tab just crashed."" I've uninstalled multiple times from MS Store and also direct from website. No luck. Safe mode works fine. My normal mode does not work even when all the addons, etc are disable. I'm a simple user with no customisations of the FF browser. </p><p>Tried new profiles, untick performance, etc. </p><p>I've even tried restore win11 update to an earlier date. Same result. </p><p>Other browsers work fine but I want to support Mozilla. I'm at the point of switching to another. </p><p>Crash IDs: bp-0dcff036-72ca-46e1-af89-caad20241126 	26/11/2024, 3:50 pm 	 View bp-37129959-b635-469c-aa2b-2f4910241126 	26/11/2024, 3:50 pm 	 View bp-809cab3e-8068-40bb-93b0-9e5750241126 	26/11/2024, 3:50 pm 	 View bp-e7a27777-15c9-42cd-8618-408230241126 	26/11/2024, 3:50 pm 	 View bp-f005a29a-9c8b-415a-8de1-5e0d30241126 	26/11/2024, 3:50 pm 	 View </p><p>Grateful for your help. Many thanks. </p>",firefox;browse;,firefox,browse,en-US,1690144;,hpyldnuk
1475952,2024-11-25 23:32:56 -0800,2024-11-26 01:01:14 -0800,Overschakelen tussen tabbladen,"<p>Hallo, ik heb een probleem bij het schakelen tussen tabbladen. Wanneer ik bvb vanaf you-tube of eender welke site waar ofwel muziek/geluid wordt afgespeeld, een interview of podcast of andere geluidsfragmenten en switch naar andere site of tabblad loopt het geluid van de site welk ik verlaat enkele fragmenten door, soms met onderbrekingen. Dit vind ik dan geweldig storend en is de reden ook waarom ik Firefox in het verleden reeds heb verwijderd van pc .. Toch weer toe gevoegd en helaas nog steeds zelfde probleem dus heeft u enige bruikbare tips, hoor ik dit graag, ik wil niet onmiddellijk over gaan tot opnieuw verwijderen ... Thx!! </p>",firefox;browse;,firefox,browse,nl,1690126;,Novamativa
1475949,2024-11-25 21:06:49 -0800,2024-11-25 21:06:49 -0800,https://www.facebook.com/ not working properly,"<p>After switching to Mozilla Firefox from Google chrome I am facing a issue which I cant solve. Whenever i try to send message in <a href=""https://www.facebook.com/"" rel=""nofollow"">https://www.facebook.com/</a> it shows ""Couldn't send"". So i though it face Facebook's problem , but after trying this same in the google chrome , it was working smoothly , no issues. Please fix this </p>",firefox;browse;,firefox,browse,en-US,"",farabial4200
1475947,2024-11-25 19:41:18 -0800,2024-11-25 19:41:18 -0800,atualizaçao,<p>obrigado </p>,firefox;installation-and-updates;,firefox,installation-and-updates,pt-BR,"",prsilvasilva
1475946,2024-11-25 19:15:52 -0800,2024-11-25 19:15:52 -0800,cannot log on to a site that I have been doing,"<p>I get this Error message when I try to sign onto my cell providers website. What does this meen and how do I fix it? </p><p>You don't have permission to access ""<a href=""http://www.t-mobile.com/benefits/travel"" rel=""nofollow"">http://www.t-mobile.com/benefits/travel</a>"" on this server. </p><p>Reference #18.1002c417.1732590174.8736632b </p><p><a href=""https://errors.edgesuite.net/18.1002c417.1732590174.8736632b"" rel=""nofollow"">https://errors.edgesuite.net/18.1002c417.1732590174.8736632b</a> </p>",firefox;accounts;,firefox,accounts,en-US,"",srellobo
1475945,2024-11-25 19:12:09 -0800,2024-11-25 19:44:52 -0800,Assistance Needed to Recover Deleted Facebook Business Account,"<p>Dear Facebook Support Team, </p><p>I hope this message finds you well. I am reaching out to request your assistance in recovering a Facebook business account that was accidentally deleted. The account was crucial for our business, HPIT, and we regret having lost access to it. </p><p>We have already created a new account, but we would greatly appreciate it if you could help us retrieve the previous account and its associated data. If possible, we would like to link the recovered account with our new one to ensure continuity for our business operations. </p><p>I have included the link to the deleted account below for your reference: </p><p><a href=""https://www.facebook.com"" rel=""nofollow"">https://www.facebook.com</a> hpitcorp </p><p>Your assistance in this matter would be immensely valuable to us. Please let us know if there are any steps we need to follow or additional information you require from our side to facilitate this process. </p><p>Thank you very much for your support and understanding. </p><p>Best regards, </p><p>John Ezekiel </p><p>Current Account Username: j [edited from public] @gmail.com   &lt;- access to Facebook account </p><p>Business Account </p> <hr> <p>Previous Account   Username: [edited from public] @hpitcorp.com   </p><p>Change to: [edited from public] @hpit<a href=""http://-inc.com"" rel=""nofollow"">-inc.com</a> </p>",firefox;backup-recovery-and-sync;,firefox,backup-recovery-and-sync,en-US,1690101;,johnezekiel.k
1475944,2024-11-25 19:07:52 -0800,2024-11-25 19:07:52 -0800,device input/output,"<p>why is there no way to select audio/video/ microphone input or output? . my headset dies all the time and i would like to change in firefox which output the audio should go into. while skullcandys headphones firmware sucks, firefox has the wherewithal to have a device settings section where i can choose which device has which input and output </p>",settings;firefox;,firefox,settings,en-US,"",crookedthief115
1475943,2024-11-25 18:49:25 -0800,2024-11-25 18:49:25 -0800,college student,<p>long-term existence </p>,firefox;accounts;,firefox,accounts,en-US,"",18797013652
1475941,2024-11-25 18:41:23 -0800,2024-11-25 18:41:23 -0800,Page visually blocked,"<p>When navigating to <a href=""http://msn.com/en-us"" rel=""nofollow"">msn.com/en-us</a>, and about 5S after the page loads, the majority of the page is covered with an ad. This only happens when using an ExpressVPN Santa Monica connection (most reliable and fastest). </p><p>If I use another VPN server location the problem is not present. Additional information: - Location: Dongguan, China - Using Google Chrome does not cause a problem. - ExpressVPN have no solution or explanation at this time. The VPN app is set to block ads but this does not help - If I connect using Surfshark there is no problem. - OS is WIN10 64-bit fully updated. - Equipment is an Asus notebook. - This issue has only appeared on or about 5 Nov which is around the time Firefox updated. - I have updated manually but no luck. </p><p>I have attached a before and after shot. </p><p>Any suggestions will be much appreciated. </p>",firefox;performance-and-connectivity;,firefox,performance-and-connectivity,en-US,"",howard_oldham
1475940,2024-11-25 18:29:27 -0800,2024-11-26 00:37:22 -0800,"missed the update, how do I get it?",<p>I was not able to complete the update when it popped up. I am now trying to find out how to get it. </p>,firefox;installation-and-updates;,firefox,installation-and-updates,en-US,1690124;,bonbon278
1475939,2024-11-25 17:50:50 -0800,2024-11-25 17:50:50 -0800,samsung flow-android projection to pc-freezes Firefoxs,<p>How can one avoid this freezing of Firefox when protecting from Android to laptop pc via Samsung flow?  </p><p>(samsung flow: android projection to pc;  freezes firefox) </p>,firefox;performance-and-connectivity;,firefox,performance-and-connectivity,en-US,"",asanchezpr04
1475938,2024-11-25 16:42:31 -0800,2024-11-25 18:14:22 -0800,Firefox does not open previous tabs,"<p>Firefox does not open previous tabs, after closing Firefox it does not open previously closed tabs, it only opens a new tab, but when I go to Firefox View the tabs are in window 2 but I still cannot open them. </p>",settings;firefox;,firefox,settings,es,1690086;,scarlingz
1475935,2024-11-25 16:10:04 -0800,2024-11-26 03:13:46 -0800,Disable white flash when loading page,"<p>Firefox flashes a white screen when loading a new page. This is a known issue. Is there a way to make it stop? </p><p>I see numerous people looking for answers (on mozilla, on stackoverflow, on superuser, on reddit, and on mozillazine), and I see no answers that work. </p><p>Is there a solution that works? </p><p>Does anyone know why Mozilla programs this in? (Is there a way to ask Mozilla directly?) </p><p>Firefox has been the only browser for me over the years, allowing customizations that free me from the frustrations of Chrome, Safari, et al. But why this flashbang, as <a href=""https://www.reddit.com/r/firefox/comments/1bgt8qg/how_to_disable_the_flashbang_transition_between/?rdt=34937"" rel=""nofollow"">kartana</a> put it on reddit? </p>",firefox;browse;,firefox,browse,en-US,1690146;,bbcc
1475934,2024-11-25 16:08:18 -0800,2024-11-25 16:08:18 -0800,"First connect w/newsmax.com,2nd,receive attached reply ""Secure Connection Failed  An error occurred during a connection to www.newsmax.com.The page you are trying to view cannot be shown because the authenticity of the received data could not be verified.","<p>get 1 connection to site, go to read other articles get this message.  How am I to get rid of this and be able to read articles on <a href=""http://newsmax.com?"" rel=""nofollow"">newsmax.com?</a> Secure Connection Failed </p><p>""An error occurred during a connection to <a href=""http://www.newsmax.com"" rel=""nofollow"">www.newsmax.com</a>."" </p><pre>   The page you are trying to view cannot be shown because the authenticity of the received data could not be verified.    Please contact the website owners to inform them of this problem. </pre>",firefox;performance-and-connectivity;,firefox,performance-and-connectivity,en-US,"",SandraJo
