id,created,updated,title,content,tags,product,topic,locale,answers,creator
1452273,2024-07-11 11:27:55 -0700,2024-07-11 11:27:55 -0700,Fonts in Google Have Turned Japanese I Really Think So ... and more,"<p>A bit of background, I have been working on systems since the Commodore Vic 20, so I'm not 'new' or would typically be helpless as many are if they have system problems. </p><p>Over the last week I decided to format my Mac and re-install the operating system. I have a lot of graphics design that I will be doing for an unknown period of time. I have over the years collected many free fonts and I started installing them about 5 days ago. I don't believe my installing fonts wouldf have affected anything within Firefox, but Firefox is the only browser that I'm having this problem with. I checked Safari and google displays everything as it should as well; my graphics deisgn software forums are displaying fine. I have not used google for anything during the period that I was installing the fonts, so I don't know exactly when this started but yesterday I discovered it. </p><p>I tried going to the menu on the top right hand corner -&gt;  Help -&gt; More Troubleshooting Info -&gt; Refresh Firefox. I then went into MacCleaner Pro -&gt; Clear Cache and Clear Purgable Data. Then restarted the machine. No change. </p><p>I then saved my passwords and bookmarks, then uninstalled Firefox using MacCleaner Pro and then went to Remove Remaining files. </p><p>Downloaded a new copy of Firefox and the problem still exists. </p><p>I tried changing the theme to others. Went to Settings -&gt; General -&gt; Language and Appearance. Set theme to dark, then back to automatic. Changed the main font from (Default) Times to Times New Roman and back to (Default Times) ... but still this problem exists... </p><p>Help... Please and thank you. </p>",desktop;mac-os-x-1015;firefox-1280;customize-settings-and-preferences;,firefox,customize-settings-and-preferences,en-US,"",erik.nica.2019
1452272,2024-07-11 11:24:17 -0700,2024-07-11 11:24:17 -0700,Issues with cut and paste into emails.,<p>When using Firefox mozilla I am unable to cut from a document and paste it into my email.  This has never been an issue before.  If I use another browser I do not have the same difficulty. Please advise. </p>,desktop;other;windows-10;firefox-1280;,firefox,other,en-US,"",drhellen
1452269,2024-07-11 11:14:07 -0700,2024-07-11 11:14:07 -0700,Autofill Passwords,"<p>I am trying to use Firefox secure passwords. I can create a secure password, update it when asked, but it doesn't autofill the password when I try to log in. I have the ""Autofill User Name and Passwords"" box checked in Firefox Preferences. I am on a MacBook Air using Firefox. </p>",desktop;mac-os-x-1015;firefox-1280;customize-settings-and-preferences;,firefox,customize-settings-and-preferences,en-US,"",raylee2484
1452268,2024-07-11 11:05:57 -0700,2024-07-11 11:05:57 -0700,excsso de frequentes atualizações,<p>O excesso de frequentes atualizações é irritante. Penso ABANDONAR o uso do Firefox. </p>,desktop;windows-11;firefox-1270;firefox-12702;install-and-update;,firefox,install-and-update,pt-BR,"",airluz
1452265,2024-07-11 10:22:32 -0700,2024-07-11 11:01:37 -0700,FF (latest version) not loading a local htm file,"<p>Hi, I have local saved html file which loads images from our security cams The html has only code like this </p> <pre>&lt;html&gt; &lt;head&gt;&lt;/head&gt; 	&lt;body&gt; &lt;script type=""text/javascript""&gt;   var height_array = new Array(); &lt;script type=""text/javascript""&gt;   var height_array = new Array();   var width_array = new Array();   width_array[1] = 320;   height_array[1] = 240;  &lt;img src=""http://192.168.2.2:78/livefeed?oid=1&amp;size=640x480&amp;t="" width=""320"" height=""240"" onload='setTimeout(function() {src = src.substring(0, (src.lastIndexOf(""t="")+2))+(new Date()).getTime()}, 1000)' onerror='setTimeout(function() {src = src.substring(0, (src.lastIndexOf(""t="")+2))+(new Date()).getTime()}, 5000)' alt='' /&gt;  &lt;.../script....&gt; </pre> <p>No matter what I change in the ""normal"" settings - Firefox is not loading the page at all.(file:///Users/drew/Downloads/CAM2.html) </p><p>In the left bottom corner it only shows ""Performing a TLS Handshake with 192.168.2.2"". And thats it. Every other browser is able to open the page and show the camera pictures, only Firefox not. Is there a easy fix for this? </p>",desktop;troubleshooting;firefox-1280;,firefox,troubleshooting,en-US,1661382;,hawkins-de
1452261,2024-07-11 09:34:23 -0700,2024-07-11 11:12:48 -0700,Installing components,"<p>When I open a page from Fox I get a message in a ribbon"" Firefox is installing components needed to play the audio or video on this page. Please try again later."" Really everything seems to work and there is an x to close the ribbon. Just wondering if I need to adjust any settings. Thanks </p>",desktop;other;windows-11;firefox-1280;,firefox,other,en-US,1661391;,jcraig9502
1452259,2024-07-11 09:32:51 -0700,2024-07-11 09:32:51 -0700,Doesn`t work web version of Telegram,"<p>Hello! Since 9th of july web version of telegram app doesn`t work. Please, help to solve this issue. Mobile version of telegram works fine, as a web version in another browsers, except Mozilla. In attached file you can see how telegram displayed in Mozilla. </p><p>Thank you </p>",desktop;troubleshooting;windows-11;firefox-1270;firefox-12702;,firefox,troubleshooting,en-US,"",sponger.ebay
1452258,2024-07-11 09:29:10 -0700,2024-07-11 09:29:10 -0700,Installing Firefox in Chromebook (Linux) - choice of refs?,"<p>I'm trying to install Firefox for Chromebook using Flatpak (article <a href=""https://mzl.la/3pbybGW"" rel=""nofollow"">https://mzl.la/3pbybGW</a>) </p><p>But I am faced with choosing a ref. See attached image. I have no idea how to choose, or what this even means.  </p><p>Can anyone provide me with guidance on this? </p><p>My device is a Google Pixelbook with the latest ChromeOS. </p><p>Thanks </p>",linux;desktop;install-and-update;,firefox,install-and-update,en-US,"",jeff227
1452257,2024-07-11 09:13:44 -0700,2024-07-11 09:13:44 -0700,Websockets long load time - connection interrupted,"<p>Hi, </p><p>I am working on a website- one page uses websockets for data sync, activated with a button - and the socket takes a long time to actually connect (to locahost). During that time, an error pops into console- several of the same: </p><p>The connection to [url] was interrupted while the page was loading. </p><p>I found several bug reports in various places - most say to close the socket on page unload. I already have that implemented, and checking network dev tab shows all sockets are closed when the errors occur, and they also appear when tested in a whole new window. Also tested on chromium- no issues there. </p><p>Any help? </p>",linux;desktop;troubleshooting;firefox-115120;firefox-11512;,firefox,troubleshooting,en-US,"",vrtulnik.martin
1452254,2024-07-11 09:02:35 -0700,2024-07-11 09:02:35 -0700,english,<p>help <em>italic text</em> </p>,windows-7;desktop;install-and-update;firefox-11513;firefox-115130;,firefox,install-and-update,en-US,"",Devarajdev379
1452249,2024-07-11 08:27:04 -0700,2024-07-11 08:41:21 -0700,Bookmarks,<p>Is the Bookmarks Manager supposed to be a pop-up window? </p>,desktop;windows-11;firefox-1230;customize-settings-and-preferences;,firefox,customize-settings-and-preferences,en-US,1661367;,msmarjoriecurry
1452247,2024-07-11 08:17:34 -0700,2024-07-11 08:17:34 -0700,Password Fill with Device sign in,"<p>Is there a way to make firefox require a device sign in every time that you want to access a password. Otherwise it is only required after the app is quit, not if the screen turns off of the computer goes to sleep, at least that's how I understand it. I already have checked the require device sign in to manage or fill passwords box and the functionality still isn't as expected. </p>",desktop;windows-11;firefox-1280;customize-settings-and-preferences;,firefox,customize-settings-and-preferences,en-US,"",rpnpackers
1452241,2024-07-11 08:02:38 -0700,2024-07-11 08:02:38 -0700,How can I restore 'History' to the toolbar after mistakenly moving it to the application menu?,<p>How can I restore 'History' to the toolbar after mistakenly moving it to the application menu? </p>,desktop;bookmarks;windows-11;firefox-1270;firefox-12702;,firefox,bookmarks,en-US,"",listers
1452240,2024-07-11 07:56:49 -0700,2024-07-11 07:56:49 -0700,Cannot login to other web sites,"<p>Recently I have not been able to login to other websites from my emails when using FireFox as the browser.  ie: Windows10 Xfinity Comcast email attempting to open a Publix supermarket web site.  Enter email and password and click.  Command accepted but no login.  Still have same page.  Works fine if using Chrome, Edge or DuckDuckGo. </p><p>Also other file download issues from some web sites occasionally hang up, downloading forever unless, stop download and reload the page. </p><p>Have been using FireFox for years with no problem on this system. </p>",desktop;other;windows-10;,firefox,other,en-US,"",krebar01
1452239,2024-07-11 07:44:45 -0700,2024-07-11 08:09:16 -0700,PIP on Twitch,"<p>There doesn't seem to be a way to disable Picture-in-Picture on <a href=""http://Twitch.tv"" rel=""nofollow"">Twitch.tv</a> </p>",desktop;beta;windows-10;troubleshooting;firefox-1290;,firefox,troubleshooting,en-US,1661360;,hawkxz
1452237,2024-07-11 07:31:55 -0700,2024-07-11 07:31:55 -0700,I've been told to check my browser settings,"<p>Because I made a mistake in purchasing a Motorola cell phone I'm having to visit Lenovo/Motorola's website  way more frequently than I'd prefer. So far, each time I arrive at their website I'm greeted with a message that says something akin to ""It looks like you're in Romania. Would you rather use out Romanian website?"" I finally got annoyed enough to ask ""Why?"" and was told to check by browser settings. </p><p>I just checked my Firefox browser settings and the only thing I could see that would make an addled person or programmer think I'm in 'Romania' is the setting for the default font which is set to ""Times New Roman"". To squeeze a font name and come up with ""Romania"" as a location is a bit of a stretch in my opinion, but I've seen more asinine things done... </p><p>(It's a good thing I don't have my default font set to ""Tahoma"" as Motorola might think I'm accessing their website from Washington State's Mount Rainier whose Native American name is Tahoma. But then again, that'd probably be too much of a stretch for Motorola, bless their little hearts. </p><p>Is there any other setting(s) I should check? </p><p>PS  I'm using Windows 10, NOT Windows 8 </p>",desktop;other;windows-10;,firefox,other,en-US,"",mrmks
1452235,2024-07-11 07:21:50 -0700,2024-07-11 08:05:24 -0700,capture entire web page,<p>i am trying to find out how to capture an entire web page. Appparently Edge provides such an option with a camera icon. How can i do a similar function in Firefox. Are there add-ons perhaps? </p>,desktop;tips;windows-11;firefox-1270;firefox-12702;,firefox,tips,en-US,1661358;,johnc48
1452234,2024-07-11 07:16:58 -0700,2024-07-11 07:19:20 -0700,new Firefox account?,"<p>I want to use Firefox on my wife's Windows laptop, but with her own settings, bookmarks etc. Can I create a second profile, or do I need to create another account? </p>",desktop;windows-10;firefox-1280;customize-settings-and-preferences;,firefox,customize-settings-and-preferences,en-US,"",wicorman
1452233,2024-07-11 07:13:44 -0700,2024-07-11 07:13:44 -0700,Tesco App not loading,"<p>When I log into Tesco, it will not load and says, your browser(firefox) has failed security checks. I am using Norton 360 and run a full scan with no indications. All other apps and icons load using Firefox. Tesco refuses to. I have removed it and re-loaded it several time. I worked well untill yesterday when I did some routine windows updates. </p>",desktop;bookmarks;windows-11;,firefox,bookmarks,en-US,"",stevehughes
1452231,2024-07-11 07:07:06 -0700,2024-07-11 07:47:40 -0700,about:blank,"<p>128.0 güncellemesinden sonra linkler tıklandığında yeni sayfa veya yeni sekme açılıyor fakat tıklanan link açılmıyor. arama satırında ""about:blank"" yazısı çıkıyor. </p>",desktop;tabs;windows-11;firefox-1280;,firefox,tabs,tr,1661350;,rehaersavci
1452229,2024-07-11 06:55:04 -0700,2024-07-11 06:55:04 -0700,Open new tab in CURRENT window rather than the window which opened the last tab,"<p>I use multiple windows with multiple tabs in each window. I am wondering if Firefox can be improved so that when I open a link in a new tab it opens in my CURRENT window (the one I'm looking at in front and the one in which I asked to add a new tab) rather than a window in the background or minimized. Firefox chooses to open new tabs in the last window in which I opened a new tab, even if they're in the background or minimized, which gets very annoying because I am constantly switching between windows to work on different topical projects. If this could be fixed I would appreciate it! Thanks. </p>",desktop;tabs;mac-os-x-1015;firefox-1270;firefox-12702;,firefox,tabs,en-US,"",greenthorn
1452228,2024-07-11 06:48:54 -0700,2024-07-11 06:48:54 -0700,Firefox 128.0 (64 bit) has just installed (9/7/24) on my windows 11 machine and I  can no longer log on to the Tesco grocery site.,<p>I get the  message:-  Oops... It looks like something is not right </p><p>If you are seeing this page it is because your browser has failed some security checks. You may still be able to browse our site to find the feature or store you're looking for.  </p><p>The Tesco website works OK with Edge on the same machine and Firefox 127.0 on another machine. I think this is a known problem is there a fix/work around? </p>,desktop;other;windows-11;firefox-1280;,firefox,other,en-US,"",chris.harries
1452227,2024-07-11 06:42:08 -0700,2024-07-11 07:34:49 -0700,Power saving mode for laptops,"<p>this is more of a feature suggestion: can power saving mode for laptops be added to firefox where background usage will be decreased with more focus on less CPU and resource usage to give more battery life, even going to use only the iGPU of the CPU and not using the dGPU at all? </p>",desktop;windows-11;firefox-1280;customize-settings-and-preferences;,firefox,customize-settings-and-preferences,en-US,1661347;,abanoub.samy.s
1452226,2024-07-11 06:26:41 -0700,2024-07-11 08:20:11 -0700,book marks,"<p><i>Locking this thread, please continue here: [<a href=""/questions/1452225"" rel=""nofollow"">/questions/1452225</a>]</i><br> reinstall book marks to tool bar from other book marks </p>",desktop;bookmarks;windows-10;firefox-1280;,firefox,bookmarks,en-US,"",kurtdreynolds
1452225,2024-07-11 06:24:45 -0700,2024-07-11 06:24:45 -0700,book marks tool bar,<p>I have removed book marks from tool bar but cannot reinstall them from other book marks </p>,desktop;windows-10;firefox-1280;customize-settings-and-preferences;,firefox,customize-settings-and-preferences,en-US,"",kurtdreynolds
1452224,2024-07-11 06:18:21 -0700,2024-07-11 06:18:21 -0700,Approve Password Boss plug-in!!!!!!!!,<p>Three weeks ago Mozilla disabled the Password Boss plug-in for Firefox. We contacted the developers about this and a few days later they submitted new code for your approval. It's been almost 3 weeks since then and NOTHING has happened! We used to use Firefox exclusively but had to move to Chrome because you disabled this plug-in (and we use it for EVERYTHING). </p><p>When will this be approved so we can install the Password Boss plug-in again? And why wasn't there ANY notification that you were going to do this? It crippled our work! </p>,desktop;other;windows-10;firefox-1270;firefox-12702;,firefox,other,en-US,"",isdpcman
1452223,2024-07-11 06:14:50 -0700,2024-07-11 06:14:50 -0700,Email,<p>Can’t access the email associated with my pocket 360 </p>,desktop;other;,firefox,other,en-US,"",jeashi.kenvozo1215
1452222,2024-07-11 06:10:57 -0700,2024-07-11 06:10:57 -0700,Firefox 128 facebook games no longer loading,"<p>Since updating to 128, facebook games 8 ball pool  / classic slots are stuck on loading at 0%. With extensions disabled or active. Attempted to clear the cache and an app update, load fine in another browser. </p>",desktop;windows-10;website-breakages;firefox-1280;,firefox,website-breakages,en-US,"",mistersmithsalias
1452221,2024-07-11 06:10:40 -0700,2024-07-11 06:10:40 -0700,How can I view a past Web Push Notification?,"<p>Hi </p><p>When a site sends a Web Push Notification to my browser, it flashes up at the top of the screen for 2 or 3 seconds and then is gone.  Sometimes I'm busy with something else and once I see it, it's gone, or I just catch the first word or two.   </p><p>How can I display the Web Push Notification again? </p><p>I'm running Firefox on Fedora Linux, if that matters. </p><p>Thanks! </p>",linux;desktop;other;firefox-1270;firefox-12702;,firefox,other,en-US,"",louis.vandyk
1452220,2024-07-11 06:03:31 -0700,2024-07-11 06:04:10 -0700,weather network radar map fails to load,"<p>Hello, </p><p>The Radar map fails, (attached) when View Radar click. I am on a TOSHIBA laptop and I do not notice any other graphics issue. I am using Firefox but other Browsers (Chrome etc) do the same. I am always up to date. There are no add-blockers enabled. I have to mention that on other machine Radar is loaded properly. I have this issue for more than 2 years at least. Can you help me with this please? Thanks! </p><p>Regards, </p><p>Brad </p>",linux;desktop;website-breakages;firefox-1150;,firefox,website-breakages,en-US,"",lattimro
1452219,2024-07-11 05:58:23 -0700,2024-07-11 05:58:23 -0700,Themes are bugged,"<p>I have the latest FireFox Nightly, and i'm using a theme from firefox's themes store, and it has all tabs ""marked"" for some reason, which is really annoying and I can't really identify on which tab i'm currently at </p><p>I'm pretty sure it wasn't like that before </p>",desktop;windows-10;troubleshooting;,firefox,troubleshooting,en-US,"",taysonico
1452217,2024-07-11 05:39:28 -0700,2024-07-11 05:39:28 -0700,Synchronized Bookmarks,<p>I've just reinstalled Windows and Firefox browser so how can I get back my Synchronized bookmarks??Are they all lost?Because I sing in and trying ot synch but nothing changes.Thank you. </p>,desktop;bookmarks;windows-11;firefox-1280;,firefox,bookmarks,en-US,"",routezero
1452216,2024-07-11 05:33:59 -0700,2024-07-11 05:33:59 -0700,This not supported,<p>This not supported </p>,desktop;install-and-update;,firefox,install-and-update,en-US,"",dineshkadali33
1452214,2024-07-11 05:23:38 -0700,2024-07-11 05:23:38 -0700,Embedded sites,"<p>Prior to today, on my Edwards Jones site, I could click on market commentary or check on latest CD rates and see results.  But today, you have apparently changed the way 'embedded sites work and it traps an error.  Right clicking on the link does not work ... So this obviously your latest new and  improved feature to protect my security does not work as intended . . . what are you going to do to fix it? Larry Schelhorse gooddoc1@live.com 760-429-0481 </p>",desktop;windows-11;firefox-1280;protect-your-privacy;,firefox,protect-your-privacy,en-US,"",gooddoc1
1452213,2024-07-11 05:22:06 -0700,2024-07-11 06:21:24 -0700,"Windows 7, 8.x Support (ESR 115) ends in september - right?","<p>Hello everyone, </p><p>support for Windows 7, 8 and 8.1 will end in September with the end of the ESR 115 branch. <a href=""https://support.mozilla.org/en-US/kb/firefox-users-windows-7-8-and-81-moving-extended-support"" rel=""nofollow"">Corresponding support article</a>  </p><p>Is this still the current status or are there any plans to support the old Windows versions for a little longer? </p><p>Thanks and regards, Martin </p>",desktop;windows-10;firefox-1280;install-and-update;,firefox,install-and-update,en-US,1661339;,m.fessler1
1452212,2024-07-11 05:14:12 -0700,2024-07-11 05:14:12 -0700,"ver articulos de ayuda-mi cuenta de banco,etc",<p>POR AHORA TODO OK. MYCHAS GRACIAS </p>,desktop;windows-10;troubleshooting;firefox-1270;firefox-12702;,firefox,troubleshooting,es,"",carlosagudo93
1452209,2024-07-11 05:00:08 -0700,2024-07-11 05:00:08 -0700,can not used,<p><strong>bold text</strong> </p>,desktop;mac-os-x-1015;firefox-1260;firefox-12601;install-and-update;,firefox,install-and-update,en-US,"",anuchareev
1452208,2024-07-11 04:53:42 -0700,2024-07-11 04:53:42 -0700,GOOD UI,<p>GOOD  IU </p>,desktop;windows-10;firefox-1270;install-and-update;,firefox,install-and-update,en-US,"",sunilpararker1171
1452203,2024-07-11 04:14:28 -0700,2024-07-11 04:14:28 -0700,Problema al instalar complemento,"<p>Necesito instalar un complemento para poder firmar documentos digiales en una plataforma, dicho complemento pudo ser instalado en algunas computadoras pero en pocas ocasiones, en chrome puede instalarse pero es necesario usar mozilla para la plataforma que tengo que usar </p>",desktop;troubleshooting;windows-11;firefox-1280;,firefox,troubleshooting,es,"",hernan.folik
1452202,2024-07-11 03:41:33 -0700,2024-07-11 05:18:02 -0700,403 Forbidden,"<p>Sinds enige tijd krijg ik wanneer ik met een van mijn PC's met Firefox de site van de firma <a href=""http://Schoonenberg.nl"" rel=""nofollow"">Schoonenberg.nl</a> zoek voor sommige subsites ervan een pagina met de titel 403 Forbidden en andere een pagina met vreemde zwart-wit figuren. Op een andere PC heb ik dit probleem niet. Navraag bij de firma Schoonenberg leerde mij dat dit probleem bij hen niet bekend is. Alvast veel dank voor uw hulp hoe dit probleem op te lossen. Lau Wachters </p>",desktop;windows-10;troubleshooting;firefox-1280;,firefox,troubleshooting,nl,1661332;,l.wachters
1452201,2024-07-11 03:41:23 -0700,2024-07-11 03:41:23 -0700,ehsan,<p><strong>bold text</strong> </p>,desktop;windows-10;troubleshooting;firefox-1280;,firefox,troubleshooting,en-US,"",ehsan133op
1452197,2024-07-11 02:38:27 -0700,2024-07-11 05:04:14 -0700,icloud acount mail,<p>beste ik kan niet meer online op mijn icloud mail </p>,desktop;windows-10;troubleshooting;firefox-1280;,firefox,troubleshooting,nl,1661329;,debbymonroe
1452196,2024-07-11 02:34:55 -0700,2024-07-11 02:34:55 -0700,Deleting and reinstalling browser on my Mac,<p>How can I delete and then reinstall Firefox so it will allow me to use it? </p><p><br> </p><p><br> </p><p><br> </p><p><br> </p><p><strong></strong> </p>,desktop;install-and-update;,firefox,install-and-update,en-US,"",terinocom
1452195,2024-07-11 02:23:21 -0700,2024-07-11 04:46:55 -0700,Serious New Privacy Issue,"<p>I recently got seriously worried when I became aware about the new AI firewalls these days, which monitors or inspect SSL encrypted packets, before the packets reach to the main website. These new AI firewall systems are installed in some countries by their governments to suppress free speech, or just spy on its people. These firewalls, as you may already know, uses DPI-SSL system, which decrypts packets traveling from user to the main website. To decrypt the HTTPS packets, these firewalls uses its own self signed CA certificates.  So I am asking the firefox developers, that why you guys allow this privacy issue? Does the packets sent from a firefoxe browser to other websites are also decrypted, by these firewalls? If yes, then why you guys allow this? Firefox must ONLY allow a specific CA certificate made for firefox browser only. Firefox browser must never let other third party softwares, or any software, to decrypt its encrypted packets. This is a serious privacy issue. With these firewalls, they can see what users write in chats, or posts, they can see witch content we are watching on a website, they can see who we follow on social media platforms, they can see which content or posts we like and etc. Even passwords are not safe anymore, which e use for any website of platform. When passwords are not safe, so does our accounts of various websites. This is a serious privacy breach.  </p><p>These firewalls is a weapon for those countries which want to suppress free speech or suppress opposition sides in a government or spy on its own people.  </p><p>Please let me know if I am mistaken or my concerns are genuine. </p>",desktop;needsinfo;windows-10;firefox-1280;protect-your-privacy;,firefox,protect-your-privacy,en-US,1661307;1661308;1661309;1661327;,ivonikzoraf
1452192,2024-07-11 02:17:21 -0700,2024-07-11 02:17:21 -0700,Cannot install extensions that existed before a reinstall,"<p>Hello, I originally installed Firefox in my work laptop and logged in to sync my stuff. Due to some company policies, I had to uninstall it. Eventually, I was able to overcome some oddities and finally could reinstall Firefox. But when I logged in, sync was neverending (matter of hours, if was just stuck); thus I refreshed it, but no luck whatsoever, still neverending sync. Tried a few refreshes and reinstalls until eventually everything was fine.  </p><p>Unfortunately, during this process something must have been damaged as I lost most of my extensions and themes. So I decided to reinstall them one by one. For some of them everything went just OK, but some others (e.g. FoxyTabs) cannot be installed anymore, see screenshot. The path is: </p> <ol><li> Click add button </li><li> confirm I want to add the extension </li><li> that error is shown (translate from italian: An unexpected error occurred during the installation) </li></ol> <p>I really don't know what to do. Did my Firefox installation get corrupted or what? </p><p>Thanks a lot! </p>",desktop;windows-10;firefox-1280;install-and-update;,firefox,install-and-update,en-US,"",gbuffolino
