id,created,updated,title,content,tags,product,topic,locale,answers,creator
1481098,2024-12-23 14:24:04 -0800,2024-12-23 14:24:04 -0800,delete all passwords,<p>Delete all passwords </p>,firefox;passwords-and-sign-in;,firefox,passwords-and-sign-in,en-US,"",ewing.gloria
1481097,2024-12-23 14:20:26 -0800,2024-12-23 14:25:10 -0800,Cheating,<p>How do I find my husband on date sites for zero $ </p>,firefox;search-tag-and-share;,firefox,search-tag-and-share,en-US,1697174;,fucuj2
1481096,2024-12-23 14:11:38 -0800,2024-12-23 14:11:38 -0800,apple computer open up,<p>no goog my apple computer in pause </p>,firefox;installation-and-updates;,firefox,installation-and-updates,en-US,"",sh4dcbqjyz
1481095,2024-12-23 14:05:47 -0800,2024-12-23 14:05:47 -0800,A few times I need to use Chrome to complete operations,"<p>Windows computer. 2024-12 Cumulative Update for Windows 11 Version 23H2 for x64-based Systems (KB5048685) </p><p>Firefox: Version 133.0.3 (64-bit) </p><p>Sometimes I am asked to complete a Google Forms form to register for an event. This seems to work fine with all but one business. For that business, Chrome works just fine. Firefox does honor the submit button on this company's form. It used to last year and did in early September, but not since. </p><p>Also, I recently purchased a used car from Chevy. When I need to log in to their portal to sign up for service, I need to use Chrome. When I try to log in using Firefox, a new window opens but does not offer me the username or pwd prompts. </p>",firefox;performance-and-connectivity;,firefox,performance-and-connectivity,en-US,"",DanP45
1481094,2024-12-23 13:50:00 -0800,2024-12-23 13:50:00 -0800,"I can'r find my save to pocket button; please reinstall it, thanks",<p>install my save to pocket button </p>,firefox;settings;,firefox,settings,en-US,"",Carterwstcvn
1481093,2024-12-23 13:47:30 -0800,2024-12-23 13:47:30 -0800,just beckup,<p><strong> </strong> </p><p><strong>Anything</strong> </p>,firefox;backup-recovery-and-sync;,firefox,backup-recovery-and-sync,en-US,"",thibanboy09
1481092,2024-12-23 13:35:46 -0800,2024-12-23 13:58:01 -0800,Can we please have the right to BLOCK Donald Trump from ALL our news feeds ????,"<p>I don't live in the U.S. and I LOATHE Donald Trump.  </p><p>I would like the right to BLOCK ALL Donald Trump news, references, and any other reports that include his name or are written about him. I think it is propaganda forced upon the masses to have to see this jackass day in and day out. And for the next four years he will be front page news on every single God Damned channel, paper, report and internet news feed.  </p><p>Please allow us to put him on a BLACK LIST and give us the right to Black List anyone we see fit to put on that list. I curate my YT feeds, specifically, and I have black listed several people and topics from any and all of my feeds. I think the internet should allow us to do so for ourselves, and not be forced by internet providers and search engines and web browsers to out up with that jackass for another four years&nbsp;!! </p><p>STOP THE INSANITY&nbsp;!!!!  Thank you Jeremiah Andrews Montreal, Canada </p>",firefox;accounts;,firefox,accounts,en-US,1697168;,jeremy1350
1481088,2024-12-23 12:48:20 -0800,2024-12-23 12:57:01 -0800,No connection  at all,"<p>I just paid for a yearly subscription,  after I  installed [  via command window] mozilla vpn nothing is working, do i need to run some special set up? I ám using firefox </p>",firefox;performance-and-connectivity;,firefox,performance-and-connectivity,en-US,1697152;,mibelt
1481087,2024-12-23 12:29:38 -0800,2024-12-23 12:29:38 -0800,shohoz,<p><strong>bold text</strong>me out of their day to help. Be descriptive. Saying “playing video on YouTube is always choppy” will help us understand the issue better than saying “something is wrong” or “the app is broken”. </p>,firefox;accounts;,firefox,accounts,en-US,"",eliyasshake111
1481086,2024-12-23 12:23:21 -0800,2024-12-23 14:13:09 -0800,Disable Create New Profile,"<p>Can you add a configuration setting to Mozilla Firefox to disable Create New Profile, configurable in the policies.json file?  (A second option but a much uglier one would be to disable being able to select a file location for a new profile.  Then you could make the default profile directory write only, which would also accomplish the same thing.) (A third option would be to able to configure extensions by default upon installation in the ExtensionSettings policy.) </p><p>To explain, I use LeechblockNG on Firefox on Ubuntu.  Very helpful.  By placing a policies.json file (see at bottom) in /etc/firefox/policies/ directory, I can create a system wide policy.  I can make the LeechblockNG extension mandatory and to be installed upon every new profile creation.  That all works very well.  HOWEVER, there is NO way to be able to set those options in the new profile.  So LeechblockNG is installed with default options (which are no blocking at all), which effectively bypasses the addon. </p><p>I am also writing the author of the leechblock extension to see if there is any way to set the options for leechblock upon installation (the third option above).   </p><p>But I know other people have this same question, and at present, if I am correct, there is no way to block new profile creation, or the Profile Manager window in Firefox.   </p><p>So could you please add that option to the Firefox policies.json configuration?  Something like ""DisableNewProfiles"": true would do it. </p><p>Thanks!   </p><p>My current policies.json file in /etc/firefox/policies/ directory: { 	""policies"": { 		""BlockAboutConfig"": true, 		""BlockAboutProfiles"": true, 		""PrivateBrowsingModeAvailability"": 1, 		""DisableSafeMode"": true,  		""ExtensionSettings"":{ 			""*"": { 				""installation_mode"": ""blocked"", 				""blocked_install_message"": ""Prohibited install more extensions."" 			}, 			""leechblockng@proginosko.com"": { 				""installation_mode"": ""force_installed"", 				""install_url"": ""<a href=""https://addons.mozilla.org/firefox/downloads/file/4374316/leechblock_ng-1.6.6.xpi"" rel=""nofollow"">https://addons.mozilla.org/firefox/downloads/file/4374316/leechblock_ng-1.6.6.xpi</a>"" 			} 		} 	} } </p>",firefox;accounts;,firefox,accounts,en-US,1697172;,pqwoenqr34
1481085,2024-12-23 11:59:14 -0800,2024-12-23 11:59:14 -0800,my saved passwords on Firefox,"<p>Hello, It's been like....forever.....that when I log onto a sight, a window pops up asking whether if I want to save the id and password for that sight. All of a sudden, a week or so ago, all of my passwords just vanished! It has been saving them for every site that I chose to save. I would, on occasion, go in and manually delete one or some, but I have really come to depend on Firefox for saving the info. I just don't know what has happened. Any ideas on how I can remedy this? Thanks..... </p>",firefox;passwords-and-sign-in;,firefox,passwords-and-sign-in,en-US,"",alrebel122060
1481084,2024-12-23 11:52:25 -0800,2024-12-23 13:49:50 -0800,Certificate Question,"<p>In the ""General"" section of my Firefox Settings, it states that ""Your browser is being managed by your organization."" </p><p>When I click on that, it shows the word ""Certificates"" under Policy Name, and ""ImportEnterpriseRoots"" under Policy Value. </p><p>Is this something that Firefox installed, or is it something a third-party (like my former company) installed on my computer. </p><p>Also, would this possibly slow down my computer? </p><p>Thanks for your feedback. </p>",windows-10;firefox-13303;firefox-1330;firefox;privacy-and-security_1;,firefox,privacy-and-security,en-US,1697166;,joandarren
1481078,2024-12-23 11:38:13 -0800,2024-12-23 11:38:13 -0800,authentic code,<p>What is Authentic  code </p>,firefox;accounts;,firefox,accounts,en-US,"",nazrul.sec
1481077,2024-12-23 11:34:37 -0800,2024-12-23 12:19:53 -0800,Windows 11 Audio Driver Error,"<p>After a Windows 11 update, every time I play some video/sound and stop the playback, my whole computer audio doesn't work anymore. When I reset my computer, the audio comes back again. I tried using other browsers (Edge, Chrome, etc.) and other programs/applications, but this only happens in Firefox. </p><p>Any ideas on what can I do to solve this issue? </p><p><br> Basic information: </p><p>Firefox version: 133.0.3 (64-bits) Operation System: Microsoft Windows 11 Home Single Language OS Version: 10.0.26100 Compilation 26100 Computer Brand: Alienware m16 R2 Sound drivers: Realtek Semiconductor Corp. version 6.0.9738.1 </p>",firefox;settings;windows-11;audio-and-video;,firefox,settings,en-US,1697147;,fabricio.n.godoi
1481076,2024-12-23 11:30:11 -0800,2024-12-23 13:52:43 -0800,how to install and use javascript,<p>how to install and use javascript? </p>,firefox;installation-and-updates;,firefox,installation-and-updates,en-US,1697167;,karl.felder
1481075,2024-12-23 11:27:21 -0800,2024-12-23 11:58:09 -0800,Firefox Update,"<p>Will I be able to use Firefox with my computer? It's an older model and I just received an update message. Here's my specs Mac OS 10.10.5 Model Name:	Mac Pro </p><pre> Model Identifier:	MacPro3,1  Processor Name:	Quad-Core Intel Xeon  Processor Speed:	2.8 GHz </pre>",firefox;installation-and-updates;,firefox,installation-and-updates,en-US,1697138;,jackperno
1481074,2024-12-23 11:27:19 -0800,2024-12-23 14:03:52 -0800,Disable AI chatbot via json,"<p>I see the new AI chatbox feature buried within Firefox Labs.  Is there not a way through a policies.json to disable that feature if it's unwanted?  If there isn't, when would that be added (and hopefully before this feature becomes live in a future release)? </p>",firefox;settings;,firefox,settings,en-US,1697171;,xzzatgrv
1481072,2024-12-23 11:23:19 -0800,2024-12-23 11:23:19 -0800,hallo,<p>if i have qustions </p>,firefox;accessibility;,firefox,accessibility,en-US,"",taferetesfai
1481071,2024-12-23 11:16:21 -0800,2024-12-23 12:42:37 -0800,Hulu on a different device,<p>Help me gain access to Hulu on a tv farther from the internet box at home but it is connected to wifi </p>,firefox;installation-and-updates;,firefox,installation-and-updates,en-US,1697149;,monicajorg
1481068,2024-12-23 11:15:34 -0800,2024-12-23 12:43:07 -0800,Hulu on a different device,<p>Help me gain access to Hulu on a tv farther from the internet box at home but it is connected to wifi </p>,firefox;installation-and-updates;,firefox,installation-and-updates,en-US,1697150;,monicajorg
1481067,2024-12-23 11:06:01 -0800,2024-12-23 11:06:01 -0800,The upload window left sidebar went missing,"<p>In Gmail, when I try to attach a file, the Firefox upload window opens.  It used to have a sidebar on the left (see picture from another computer) with a directory, including the option ""Quick access.""  That is gone now, and I don't see any setting to restore it, not can I find any instructions online on how to restore that sidebar. </p>",firefox-13303;firefox-1330;firefox;settings;,firefox,settings,en-US,"",dschirch
1481066,2024-12-23 11:05:33 -0800,2024-12-23 11:05:33 -0800,Old Account,<p>I want to link to my old accounts </p>,firefox;backup-recovery-and-sync;,firefox,backup-recovery-and-sync,en-US,"",knarf606
1481064,2024-12-23 11:00:59 -0800,2024-12-23 11:10:04 -0800,my you tube premium acct..,<p>I use 2computers and you are charging me on each one 12.99 X2.....you tole me to be sure they are both under the same account number...they are both under [edited] @gmail.com </p>,firefox;accounts;,firefox,accounts,en-US,1697125;1697127;,voymm1943
1481063,2024-12-23 10:59:34 -0800,2024-12-23 11:00:38 -0800,Privacy Concern,<p>I got an email stating someone logged into my account. I just changed my password. Is there a way to delete my mozilla account? </p>,firefox;accounts;,firefox,accounts,en-US,1697122;,arny9130
1481061,2024-12-23 10:52:58 -0800,2024-12-23 10:52:58 -0800,"When I use Firefox133.0.3 to connect to my router at http://192.168.0.1 , I get ""Unable to connect"". Safari has no problem connecting.","<p>When I use Firefox133.0.3 to connect to my router at http://192.168.0.1 , I get ""Unable to connect"". Safari has no problem connecting. </p>",firefox-13303;firefox-1330;firefox;browse;,firefox,browse,en-US,"",clandau
1481060,2024-12-23 10:52:32 -0800,2024-12-23 10:54:44 -0800,ERROR MESSAGE,"<p>when i try to enter an internet site, i recieve and 403 ERROR message that i dont really understand. </p>",firefox;browse;,firefox,browse,en-US,1697115;,bziaferard
1481058,2024-12-23 10:40:26 -0800,2024-12-23 10:40:26 -0800,cripto market cap,<p><strong>bold text</strong> </p>,firefox;performance-and-connectivity;,firefox,performance-and-connectivity,en-US,"",asifjatt626
1481055,2024-12-23 10:32:42 -0800,2024-12-23 10:34:51 -0800,beat buddy manager,"<p>""Please create a new version of the browser app that supports the ability to use FileSystemAPI on directories, this is essential for working with a BeatBuddy project and SD cards that are saved on my computer using the online editor.""  <strong>bold text</strong> </p>",firefox;browse;,firefox,browse,en-US,1697108;,jeanmarie19121971
1481054,2024-12-23 10:20:11 -0800,2024-12-23 10:24:30 -0800,Not sure how to secure my account,<p>I’m not very good with working these phones. Mine has been hacked a Mac keeps logging into my email and I do not own a Mac. I just have my iPhone 15 plus. What do I need to do to secure my phone more? </p>,firefox;privacy-and-security_1;,firefox,privacy-and-security,en-US,1697099;,ttabathathompson
1481053,2024-12-23 10:11:57 -0800,2024-12-23 13:35:55 -0800,have to sign in to daily websites each session,"<p>i have icloud (apple) and comcast (xfinity) email tabs that appear on my firefox home page and they open with me logged in, but about a week ago i started having to login to them. what changed? </p>",firefox;passwords-and-sign-in;,firefox,passwords-and-sign-in,en-US,1697163;,ldecola
1481050,2024-12-23 09:34:32 -0800,2024-12-23 09:34:32 -0800,Pocket,"<p>I just installed pocket, then created a Mozilla account and for whatever reason cannot get pocket to log in to that account. </p>",firefox;accounts;,firefox,accounts,en-US,"",blaczac7623
1481049,2024-12-23 09:32:31 -0800,2024-12-23 09:32:31 -0800,why do I have to select  firefox as my default browser when it is already my default browser. Too tedious.,<p>Over and over it wants me to select Firefox as the default browser </p>,firefox;accessibility;,firefox,accessibility,en-US,"",engrmud
1481048,2024-12-23 09:23:00 -0800,2024-12-23 09:23:00 -0800,Problème de connexion,<p>S’il vous plait donner moi des conseils pour que le jeu roblox marche il ne fais que buger </p>,firefox;accessibility;,firefox,accessibility,en-US,"",mdgrcsgyqq
1481047,2024-12-23 09:20:11 -0800,2024-12-23 09:20:52 -0800,banglar shiksha,<p>I can open banglar shiksha portal </p>,firefox;browse;needsinfo;,firefox,browse,en-US,1697079;,nmdkaji
1481046,2024-12-23 09:15:47 -0800,2024-12-23 09:15:47 -0800,No connection  at all,"<p>I just paid for a yearly subscription,  after I  installed [  via command window] mozilla vpn nothing is working, do i need to run some special set up? I ám using firefox </p>",firefox;performance-and-connectivity;,firefox,performance-and-connectivity,en-US,"",mibelt
1481045,2024-12-23 09:15:03 -0800,2024-12-23 09:15:03 -0800,Trouble with website log on,"<p>Login failure with a life insurance/annuity company.  It takes my login information, then flashes a screen for one second then redirects to another page.  The company is <a href=""https://www.unitedlife.com/"" rel=""nofollow"">https://www.unitedlife.com/</a>.  I can open this site on my chromebook, using Chrome OS, but not in firefox on my PC.  I am running 8.1 on my windows pc, and don't wish to upgrade to 10 (PC not compatible to 11).  Note: the PC windows pc will not update to a current revision chrome browser any more.  Any options/changes that can be done on the Firefox browser settings on the PC? </p><p>Version: 115.18.0 Firefox ESR </p><p>November 26, 2024 (Says this is up to date) </p>",firefox;accessibility;,firefox,accessibility,en-US,"",geaker1
1481044,2024-12-23 09:15:03 -0800,2024-12-23 09:15:03 -0800,Bonsa Abdurahamaan,"<p><a href=""http://example.com"" rel=""nofollow"">link text</a> </p>",firefox;installation-and-updates;,firefox,installation-and-updates,en-US,"",bonsaabdurahamaan
1481042,2024-12-23 08:52:44 -0800,2024-12-23 08:52:44 -0800,Bookmark for this page,"<p>Bookmarked this page. The blue star is on the top right of my screen. The page is saved to my bookmark library. After opening my library and selecting this bookmark, the blue star on my screen disappeared. </p><p>Help. </p><p><br> Fred </p>",firefox;browse;,firefox,browse,nl,"",fstrang
1481040,2024-12-23 08:44:03 -0800,2024-12-23 08:46:19 -0800,something is wrong,<p>fix it IDM </p>,firefox;browse;,firefox,browse,en-US,1697066;,shewangezawgbre024
1481039,2024-12-23 08:42:43 -0800,2024-12-23 08:47:21 -0800,Support,<p>Thank you 😊 </p>,firefox;settings;,firefox,settings,en-US,1697067;,osamamohamedraslansuleiman
1481037,2024-12-23 08:38:28 -0800,2024-12-23 10:33:19 -0800,Installation,"<p>necesito actualizar Mozzilla, pero para MAC OS x 10.10 </p>",firefox;installation-and-updates;,firefox,installation-and-updates,en-US,1697073;1697107;,girlm84
1481035,2024-12-23 08:34:19 -0800,2024-12-23 08:34:19 -0800,Nastavitve,"<p>Pozdrav! Imam problem, ki ga ne znam rešiti sama. V Firefox sem odprla MetaMask in v razširitev za Firefox. </p><pre>Nato sem obnovila denarnico, ki se mi normalno odpre in poveže z MetaMask. Nato odprem OpenSea. Ko pa hočem povezati Opensea in MetaMask pa me preusmeri na stran Namesti Metamask za svoj brskalnik. Kaj delam napačno? Prosim za pomoč!     Milena </pre>",firefox;settings;,firefox,settings,sl,"",milenainkret7
1481030,2024-12-23 08:23:11 -0800,2024-12-23 14:16:09 -0800,Sites want to disable AdBlock but I don't have it,"<p>Sites tell me they won't show the page unless I disable AdBlock. I had it many years ago, but uninstalled it years ago. It does not show up in my extensions list. So, what do I do? Thanks, Bob K </p>",firefox;browse;,firefox,browse,en-US,1697062;1697145;1697161;1697173;,bobklauber
1481028,2024-12-23 08:16:13 -0800,2024-12-23 08:16:13 -0800,the sound of the websites,"<p>Hello, I am contacting you about the non-functioning sound of some websites. It is manifested as if Firefox does not perceive that the page is playing sound at all. For example, YouTube works as it should, but Instagram is completely without sound. </p>",firefox-13303;firefox-1330;firefox;performance-and-connectivity;,firefox,performance-and-connectivity,en-US,"",radimchmela
1481026,2024-12-23 08:04:05 -0800,2024-12-23 08:04:05 -0800,will not load half of web site,<p>will not load half of site </p>,firefox;accessibility;,firefox,accessibility,en-US,"",alexanderbritt197
1481025,2024-12-23 08:02:18 -0800,2024-12-23 08:02:18 -0800,will not load half of web site,"<p><a href=""http://www.nativefamilyradio.com"" rel=""nofollow"">www.nativefamilyradio.com</a> will not load the chat </p>",firefox;privacy-and-security_1;,firefox,privacy-and-security,en-US,"",alexanderbritt197
1481024,2024-12-23 07:42:21 -0800,2024-12-23 07:42:21 -0800,Lag/Freezing with tabs open - Never happened before,"<p>This problem started maybe 2-3 months ago. I used to have hundreds of tabs open for months and Firefox never lagged, never chugged even once. In the last few months this has been happening almost daily with only a small number of tabs open, as few as 10. The tabs I leave open are from only two websites (one of them is YouTube). Basically Firefox becomes unusably slow and needs to be restarted, so there is clearly a memory leak. I do not know if the memory leak is from Firefox, YouTube, or from the one other website I leave tabs open from, but I do know that this never happened before with vastly higher volume from the same websites. </p><p>The issue is not my computer hardware, which is in excellent condition and of excellent quality. This lag / freezing does not happen in any other application. </p>",firefox;performance-and-connectivity;,firefox,performance-and-connectivity,en-US,"",Shoedad
1481023,2024-12-23 07:41:50 -0800,2024-12-23 07:41:50 -0800,bing app,"<p><a href=""/en-US/kb/new?title=Knowledge+Base+Article"" class=""new"" title=""Page does not exist."" rel=""nofollow"">Knowledge Base Article</a> </p>",firefox;accounts;,firefox,accounts,en-US,"",zz8926687
1481022,2024-12-23 07:41:16 -0800,2024-12-23 07:41:16 -0800,video issues with last 2 updates,<p>scrambled video on auto play sites with the last 2 updates. no issues with other browsers or on mobile firefox browser. no issues with audio and work after a few page refreshes </p>,firefox-1340;beta;firefox;browse;,firefox,browse,en-US,"",roderickfulton88
1481021,2024-12-23 07:30:54 -0800,2024-12-23 13:25:03 -0800,why x is blcoked,<p><strong>bold text</strong>why x is blcoked </p>,firefox;accessibility;,firefox,accessibility,en-US,1697063;1697160;,sailanamr
1481020,2024-12-23 07:23:26 -0800,2024-12-23 07:23:26 -0800,Bitwarden extension,"<p>Have been using Bitwarden ext. with Firefox, but it stopped working for some reason.  I can't seem to figure it out. Thanks </p>",firefox;passwords-and-sign-in;,firefox,passwords-and-sign-in,en-US,"",maryrahilly
1481019,2024-12-23 07:20:10 -0800,2024-12-23 07:20:10 -0800,newusser,<p>newusser </p>,firefox;browse;,firefox,browse,en-US,"",clickon.typing
1481016,2024-12-23 06:58:37 -0800,2024-12-23 07:48:54 -0800,firefox,"<p>buongiorno, da ieri al posto di firefox c'è microsoft bing, come faccio a rimettere firefox? grazie </p>",firefox;browse;,firefox,browse,it,1697051;,danielaf.uno
1481015,2024-12-23 06:49:19 -0800,2024-12-23 06:49:19 -0800,scam website - https://boir.com/,"<p><a href=""https://boir.com/"" rel=""nofollow"">https://boir.com/</a>  and <a href=""https://boir.org/file/?gad_source=1"" rel=""nofollow"">https://boir.org/file/?gad_source=1</a> are scam websites and both come up as sponsored sites on Firefox. They look official, but charge you money to file a report that can be accomplished on the government website for no charge. These should not be at the top of the list of search results. </p>",firefox;privacy-and-security_1;,firefox,privacy-and-security,en-US,"",rh1021
1481013,2024-12-23 06:35:10 -0800,2024-12-23 06:35:10 -0800,"""Never Save"" passwords","<p>When Firefox asks if I want to save a password, sometimes I do want it to save the password and I select that option; it saves the pswd just fine.  If it happens to be a password I don't want it to save and choose that option, it too works fine. BUT - if I chose the ""Never Save"" option, well the next time I go to that website, it stills asks me if I want to save or not.  Before about 2 updates ago, when the ""Never Save"" option was selected, I was not asked for what I wanted to do with the password when going back to that site.  So, it was working the way I think it should.  Thanks. </p>",firefox;passwords-and-sign-in;,firefox,passwords-and-sign-in,en-US,"",towpilot
1481011,2024-12-23 06:31:44 -0800,2024-12-23 06:31:44 -0800,Love.,<p>Permitiendo la entrada de localización </p>,firefox;accessibility;,firefox,accessibility,es,"",gomaira401
1481010,2024-12-23 06:30:16 -0800,2024-12-23 06:30:16 -0800,Love.,<p>Permitiendo la entrada de localización </p>,firefox;accessibility;,firefox,accessibility,es,"",gomaira401
1481008,2024-12-23 06:11:48 -0800,2024-12-23 08:41:51 -0800,"I wish to make my payment for VPN, issue with credit card","<p>Hi,  </p><p>I wish to make my payment for VPN, and I am getting this issue with my credit card payment.  I constantly get this message ""Something went wrong. Please try again later."" Can you assist? </p><p>Thanks </p><p>Stephan </p>",firefox;installation-and-updates;,firefox,installation-and-updates,en-US,1697064;,bougxx
1481004,2024-12-23 06:05:43 -0800,2024-12-23 06:05:43 -0800,Facebook Containe,"<ul><li> Elemento de lista <a href=""/es/kb/new?title=Art%C3%ADculo+de+la+Base+de+Conocimientos"" class=""new"" title=""La página no existe."" rel=""nofollow"">Facebook Containe</a>con viñetas </li></ul>",firefox;backup-recovery-and-sync;,firefox,backup-recovery-and-sync,es,"",anachade17
1481000,2024-12-23 05:54:38 -0800,2024-12-23 05:54:38 -0800,INFORMACIÓN ACTUALIZADA,<p>Brindando todo vuestro apoyo </p>,firefox;accessibility;,firefox,accessibility,es,"",almanzaorlando60
1480999,2024-12-23 05:53:23 -0800,2024-12-23 08:44:24 -0800,The only thing that makes sense about this is the fact that I have a lot more money in my bank account than my own account right now,<p>I don’t know if it’s the right time to go back and check on the accounts </p>,firefox;accounts;,firefox,accounts,en-US,1697065;,wzycyg5yd7
1480998,2024-12-23 05:51:53 -0800,2024-12-23 05:51:53 -0800,firefox paswords,"<p>Hello </p><p>After I have installed the latest ubuntu version on my laptop, I can no longer find any previously used passwords in my firefox account after logging in again. - which means that I now have to log in again everywhere, which is time-consuming and in principle unnecessary, as I had already saved all the passwords in my firefox account before ... </p><p>Can you please tell me how I can access my passwords so that I can continue to use them with firefox as I did before? </p><p>I thought that even after I update the linux ubuntu operating system on my laptop, I would still have full access to my passwords after logging back into my firefox account, but as I said, this is not the case. </p><p><br> best regards from switzerland </p><p>reto </p>",firefox;installation-and-updates;,firefox,installation-and-updates,en-US,"",reto.gatschet
1480997,2024-12-23 05:49:43 -0800,2024-12-23 05:50:50 -0800,Playing YouTube videos,<p>I don’t know if I can go to the bank and get my check today </p>,firefox;accounts;needsinfo;,firefox,accounts,en-US,1697020;,wzycyg5yd7
