id,created,updated,title,content,tags,product,topic,locale,answers,creator
1451830,2024-07-09 01:16:00 -0700,2024-07-09 01:16:00 -0700,The old settings will return,"<p>Greeting! </p><p>Firefox is the latest version and runs on Windows 10. Sometimes old settings come back, for example older start pages, even if I change it to the default firefox page, at varying intervals the setting reverts to a setting from several years ago. Also, the machine comes from Germany and was installed in German. It should be used in Hungarian, but after changing the language, it forgets the Hungarian language days, weeks, months later. As time changes, the Hungarian language disappears from the installed ones and reverts to German. Also, the German language cannot be removed from the list. </p><p>I have a question, is it possible to permanently delete the settings and restore the default settings without having to harm the profile. I can't find the button to reset everything. Although, since changing the settings doesn't usually help for a long time, it probably wouldn't help either. </p><p>I think the machine was installed by a German internet service provider with its own settings. The user does not want to reinstall </p>",desktop;windows-10;customize-settings-and-preferences;,firefox,customize-settings-and-preferences,hu,"",laszlo.bakoczy
1451829,2024-07-09 00:54:50 -0700,2024-07-09 00:54:50 -0700,conta,<p>Trocar navegador </p>,desktop;other;,firefox,other,pt-BR,"",virlanevieira521
1451828,2024-07-09 00:33:08 -0700,2024-07-09 00:33:08 -0700,القاهرة,<p>التصفح </p>,desktop;sync;windows-10;firefox-1270;firefox-12702;,firefox,sync,en-US,"",arafatshamardal111
1451827,2024-07-09 00:31:36 -0700,2024-07-09 07:03:36 -0700,app passwoed,<p><strong> </strong> app password<strong></strong> </p>,desktop;sync;windows-10;firefox-1270;firefox-12702;,firefox,sync,en-US,1661022;,rakibhasany167
1451826,2024-07-09 00:23:21 -0700,2024-07-09 00:23:21 -0700,keresési hiba,<p>Miért nem tudom megnyitni a webes úgysegéd oldalt? Mást sem. </p>,desktop;install-and-update;,firefox,install-and-update,hu,"",frankygth2007
1451823,2024-07-08 23:25:35 -0700,2024-07-08 23:25:35 -0700,I 3iheu,<p>Hdheihrb </p>,desktop;other;,firefox,other,en-US,"",danzrtai27
1451822,2024-07-08 22:57:13 -0700,2024-07-08 22:57:13 -0700,Firefox sometimes consumes extra CPU at startup for several minutes,"<p>Occasionally, and typically only after a reboot, Firefox starts consuming a significant amount of CPU time. This typically goes on for several minutes, and if I close and reopen Firefox, the process begins again. It's enough CPU that the fans kick on high through most of the process, and considering I'm only opening the browser (not even switching tabs to actively load any other pages), I don't know why it would do this. Similarly, if it were related to typical startup behavior, why doesn't it do this every time? </p><p>While I generally trust that this is intentional and is unlikely the result of malware, I'd still like to know why Firefox does this at all and what it's doing. I'm not sure if I can collect any logs or get any other info about this. From process monitors, it appears to be the main executable that's consuming the additional CPU and not any of the isolated instances. </p><p>I collected the troubleshooting information, and saved it, but I am hesitant to share without knowing what type of information is contained (and I can see some sensitive stuff like file paths) </p><p>OS: Ubuntu 24.04 LTS (Linux 6.8.0-36-generic) Firefox Version: 127.0.2 (deb) Build ID: 20240624183754 </p>",linux;desktop;troubleshooting;firefox-1270;firefox-12702;,firefox,troubleshooting,en-US,"",Silntknight
1451821,2024-07-08 22:46:30 -0700,2024-07-08 22:46:30 -0700,"Firefox logouts every account after i close and open the browser, why does this happen?","<p>Firefox logouts every website account that i logged in after i close and open the browser, I have been facing this issue since a month now. I have checked all the cookies, and other settings, they are all fine, still am unable to figure out where the issue is. This has become very frustrating lately, each and every time several of the website i have to login again and again. How to get this issue solved please? </p>",windows-7;desktop;troubleshooting;firefox-115120;firefox-11512;,firefox,troubleshooting,en-US,"",chaitanyacharya89
1451818,2024-07-08 22:35:14 -0700,2024-07-08 22:35:14 -0700,Plugin not working even with all the required permissions provided,"<p>I have created a firefox plugin, whose job is to get the cookie from the server and set it for a particular website. I have plugin with same logic for chrome as well. For firefox, I need to sometimes toggle the permissions to make it work, but suddenly the plugin has stopped working. Its not even working even with toggling the permissions, earlier this plugin was working fine. The similar plugin for chrome works perfectly well, and for that I dont need to change or toggle any permissions. I am not able to identify the issue. It would be great if someone could help me with this. </p>",desktop;other;mac-os-x-1015;firefox-1270;firefox-12702;,firefox,other,en-US,"",amensodhi
1451816,2024-07-08 22:26:02 -0700,2024-07-08 22:26:02 -0700,Bookmarks Error,"<p>I can't recover my bookmarks. I've used both available sites and it still isn't working. ""Unable to process the backup file."" And when I try to recover the HTML using the converter, it says; ""JSON.parse: unexpected end of data at line 1 column 1 of the JSON data"". </p>",desktop;bookmarks;windows-11;firefox-1270;firefox-12702;,firefox,bookmarks,en-US,"",deijalyn
1451815,2024-07-08 22:14:19 -0700,2024-07-08 23:44:59 -0700,Lost codes,"<p>Firefox Motzilla code question  I’m signing into Printify using my Firefox account. Everything was good getting my Etsy shop as it was. But all of this came to a halt because I needed to pare my IPhone with my MacBook Pro. Couldn't get anywhere. Couldn't login to Prinitfy.  It asked me for my code and this brought everything to a halt.  I hunted everywhere. I don't have them.   Needing codes is relatively new to me. I have been mostly working on designing and publishing products for Etsy.  End of last year and this one, I've been hacked (4 months to repair) Right now I’m working on retrieving nearly everything including my identity. which happened last week.  I believe over half of what I lost has been fixed. It is slowly coming to completion, but I need the codes or possibly new ones please, now to get into Printify.  I have 73 products in my store..  To finish. the codes, where would they be?  What do I do?   I don""t know.  I have much time to fulfill my mission, I've gone broke because of all the problems I've had, but I keep trying.  Please help me.  FYI, I work on a 2019 16"" MacBook Pro: Sonoma 14.5.   </p><p>My best to you all, Jane Magarigal </p>",desktop;troubleshooting;mac-os-x-1015;firefox-1270;firefox-12702;,firefox,troubleshooting,en-US,1660960;,jmcgarigal
1451812,2024-07-08 21:40:24 -0700,2024-07-08 21:40:24 -0700,unable to access new version for uptime robot,"<p>Hello,  </p><p>We would like to report on unable to access for the new version.  </p><p>Email&nbsp;: it.services@bestinet.com.my </p><p>Above email is given that we can only access for the old version but unable access to new version. </p><p>Is the issues relate with the cookies or enhanced tracking protection? </p><p>Kindly advise regarding this matter.  </p><p>Your assistance to remediate this matter is highly regarded and appreciated. </p><p>Thank You </p>",desktop;other;windows-10;firefox-1270;firefox-12702;,firefox,other,en-US,"",izzati.razali
1451811,2024-07-08 21:25:47 -0700,2024-07-08 21:25:47 -0700,"Logging into statefarm.com, immediately logged out","<p>Starting on <a href=""https://www.statefarm.com/"" rel=""nofollow"">https://www.statefarm.com/</a> </p><p>When I click on ""Log in"" to the top right of the page, it brings up <a href=""http://statefarm.com"" rel=""nofollow"">statefarm.com</a>'s login page  <a href=""https://proofing.statefarm.com/login-ui/login?"" rel=""nofollow"">https://proofing.statefarm.com/login-ui/login?</a> </p><p>My userid and password are pre-populated, thank you Firefox!  So far so good. </p><p>But when I press the Login button, the page blinks to the Logout page, blinks again, and settles on the Logout page <a href=""https://proofing.statefarm.com/login-ui/logout"" rel=""nofollow"">https://proofing.statefarm.com/login-ui/logout</a> </p><p>Tried the same thing in Chrome, but this doesn't happen, and I am able to log in normally. </p>",desktop;windows-10;website-breakages;firefox-1270;firefox-12702;,firefox,website-breakages,en-US,"",Zabadoh
1451810,2024-07-08 21:13:57 -0700,2024-07-08 21:13:57 -0700,log in problem,<p>Cannot log into Ali Express  can log in to site via safari. Problem only in the last few days </p>,desktop;mac-os-x-1012;website-breakages;firefox-115120;firefox-11512;,firefox,website-breakages,en-US,"",mignani
1451809,2024-07-08 19:45:53 -0700,2024-07-09 01:25:41 -0700,Passkey protection,"<p>Hi, I do not want password or passkey saved on any website. is there a way in Firefox  browser to disable that </p>",desktop;windows-10;firefox-1270;protect-your-privacy;,firefox,protect-your-privacy,en-US,1660967;,Qureshig
1451807,2024-07-08 19:27:51 -0700,2024-07-08 19:27:51 -0700,Firefox is already running but is not responding,"<p>Twice, I have tried the following sequence: </p><p>1. Manually close browser 2. Closed Firefox in Task Manager 3. Refresh Firefox 4. Uninstall parent.lock and .parentlock files 5. Reinstall Firefox </p><p>Also observed several iterations of Firefox running simultaneously and using significant CPU and Memory resources. </p><p>This ""Firefox is already running but is not responding"" has gotten out-of-hand and I have switched back to MS Edge until Mozilla fixes their problem. </p>",desktop;windows-10;troubleshooting;,firefox,troubleshooting,en-US,"",prag
1451801,2024-07-08 18:25:28 -0700,2024-07-08 18:25:28 -0700,Account disconnected,"<p>How do I get my Firefox browser account reconnected?. I've tried several re-installs (of Firefox) and now I've lost all my data, plus get a ""Account disconnected"" message; showing my correct email adress. </p><p>Any help greatly appreciated. I used to sync to my mobile, is there a way I can get my data back from maybe there; after I get the account reconnected please? </p>",desktop;other;windows-10;,firefox,other,en-US,"",nbrettoner
1451800,2024-07-08 18:23:15 -0700,2024-07-08 18:23:15 -0700,Pop up download windows.,"<p>Certain websites I use such as for cities, files will not show up in pop up download windows. Where as they will if I'm using chrome. I could not find anything in settings to adjust. </p>",desktop;windows-10;firefox-1270;firefox-12702;customize-settings-and-preferences;,firefox,customize-settings-and-preferences,en-US,"",ron190
1451799,2024-07-08 18:22:57 -0700,2024-07-08 18:22:57 -0700,SITE BLOCKED,<p>please help me to proceed for the site </p>,get-started;,firefox,basic-browsing-firefox,en-US,"",arwinsalongacute26
1451798,2024-07-08 18:18:15 -0700,2024-07-08 18:18:15 -0700,enabled extensions cannot be accessed,"<p>When I use the puzzle icon to access my extensions, my view is completely different from the images provided  in various posts.  i do recall the screen shots that were posted as similar to earlier extension management methods used on my previous Firefox. There is no gear to the right of my extensions; i show an  enable/disable switch and a 3 dot menu ""..."" remove/report/manage. I have attempted to reinstall both extensions without success.  I have never had problems installing any of my previous extensions, so this has been interesting.  firefox esr&nbsp;?..  Current version is installed.   </p><p>Why do i have a different extensions page than described, and is there a way to pin my extensions differently? </p>",linux;desktop;other;firefox-115120;firefox-11512;,firefox,other,en-US,"",whynot.pclinux
1451797,2024-07-08 18:17:26 -0700,2024-07-08 18:17:26 -0700,Tabs closed before don't open on firefox start up,"<p>Hi, </p><p>Since the last update (I'm on 127.0.2) or at least very recently in the last 2 weeks, my tabs previously closed with Firefox as a whole that should open with Firefox, on start up, don't and I'm redirected to my homepage. </p><p>(I have tried finding help on other posts of the same nature but can't seem to make it work hence the new post.) </p><p>I have tried changing my homepage to verify it was redirecting me to it. It did. I have tried restarting my computer. Didn't work. I have tried disabling and re-enabling the options. Didn't work. I have tried all this on my work and personal computer. Same results. (They do not share the same settings) </p><p>I feel like Firefox opens my previous tabs, opens Firefox once again on the homepage and then closes the window with all tabs. I'm saying this because it happened 2 to 4 times that after I restart my computer, it opens 2 windows on 2 different windows desktops like I did when I worked before. (with the previously closed window on the second window opened...) Also, another reason for me to believe this is&nbsp;: the newly opened windows have a format which I used to open my second and third Firefox windows with that were very different from my first one (usually full screen). </p><p>I am lost at what I could try to do to fix the issue. I'm not sure how much of what I shared can help to find a solution so I tried to dump as much related info as I could. </p><p>Thanks for reading me, Ludovic </p>",desktop;tabs;windows-10;firefox-1270;firefox-12702;,firefox,tabs,en-US,"",l.eugenot
1451796,2024-07-08 18:11:20 -0700,2024-07-08 18:11:20 -0700,firefox closes,"<p>Hello, I am using firefox on a desktop with linux manjaro. Everytime I minimize the browser it's closed instead. I have gone through the setting of my operating system, and firefox. I cannot find any reason why the browser would close instead of minimize. </p><p>Thank you, Gary </p>",linux;desktop;other;firefox-1270;firefox-12701;,firefox,other,en-US,"",gfranks5033
1451793,2024-07-08 18:00:10 -0700,2024-07-08 18:00:10 -0700,Unable to access two sites - Tech Radar & Android Cenral,"<p>When I try to access both sites from the email links &amp; browsers (both FireFox &amp; Chrome), get blank page with a large black Q. Delete history &amp; cache - no change. But able to access via my generic Android phone. Did just email one of those sites - via my phone. (Noticed both sites are somehow related when I found a contact email.) Have already tried Apple Community but no help there. </p><p>Is there anything I could be trying via FireFox.  Have the most current update for my older MAC - El Capitan OS 10.11.6 - have tons of memory. Thanks for your help! Tried screen shots - think only the bottom of the Q comes up but you get the idea. </p>",desktop;other;mac-os-x-1011;firefox-7815;firefox-78150;,firefox,other,en-US,"",CharlotteSterling
