id,created,updated,title,content,tags,product,topic,locale,answers,creator
1460672,2024-08-27 11:19:29 -0700,2024-08-27 11:19:29 -0700,Update Firefox not working,<p>I am on my iPad trying to update Firefox and Safari so I can access my chase credit card account. I am not sure what is stopping it. I downloaded the correct software for each and then nothing happened. Help please! </p>,desktop;install-and-update;,firefox,install-and-update,en-US,"",scboyntonweb
1460671,2024-08-27 11:15:01 -0700,2024-08-27 11:15:01 -0700,GoDaddy,<p>I don't know how GoDaddy got onto my computer but I know that it came through Firefox. I'm 89-years-old and not great with computer technology. Does anyone know how to get GoDaddy off my computer? Will it disappear if I unsubscribe to Firefox? Please help. Thanks. </p>,desktop;windows-10;troubleshooting;,firefox,troubleshooting,en-US,"",rmblock83
1460667,2024-08-27 10:50:18 -0700,2024-08-27 10:50:18 -0700,tabs crashing,"<p>Hello,  I did everything mentioned in support articles, but the tabs on firefox are still crashing frequently, sometimes the first I open, sometimes it's the third... But it is making my work really difficult. Here are IDs of some of the crash reports (i found that I should post them here to get help) bp-1362556a-479e-4d29-8d25-24d060240827 bp-f743f721-6668-44af-a590-f058d0240827 bp-abbc2e52-a121-41f2-9275-d73e60240827 bp-74137ee7-cfe7-4362-a450-567500240827 bp-ca2327bf-99b5-4f2d-9e08-42dd00240719 </p><p>Please help Thanks </p>",desktop;windows-10;troubleshooting;firefox-1290;firefox-12902;,firefox,troubleshooting,en-US,"",trimysivpytli
1460666,2024-08-27 10:38:20 -0700,2024-08-27 10:38:20 -0700,.ics files,"<p>I used to be able to download an .ics file directly from a Gmail email, then click on it in the download folder shown on the top menu bar to import it. It would automatically open my Google calendar and import the event. NOT NOW! I got rid of everything Outlook, only want Firefox and Google. What do I need to use, to get my .ics files to work properly again? In the screenshot, you can see I associated it with Firefox because I did not know which app to use that is NOT OUTLOOK!! Thanks, Lynda </p>",desktop;troubleshooting;windows-11;firefox-1290;,firefox,troubleshooting,en-US,"",lynda.valliere
1460665,2024-08-27 10:35:22 -0700,2024-08-27 10:35:22 -0700,FIREFOX STOPS WORKING,"<p>Since some days Firefox stops working. My query appears in the field but when I click on Enter nothing happens. I have tried to repair, to delete the cookies, to desintall, nothing helps. I therefore keep Firefox only for some websites (my favorites as mail). I do all other researches on another navigator. Do you at least have an explanation&nbsp;? </p>",desktop;windows-10;troubleshooting;firefox-1290;,firefox,troubleshooting,en-US,"",landau.liliane
1460663,2024-08-27 09:34:56 -0700,2024-08-27 09:34:56 -0700,Suddenly unable to access website,"<p>I am unable to access <a href=""http://Spectrum.net"" rel=""nofollow"">Spectrum.net</a>. I was able to access until a couple of days ago. Now I get the error ""Feature Unavailable This feature is currently unavailable. Please try again from home or contact us for assistance. IDID-4000."" I have contacted Spectrum and since I can access from Edge they say it is your fault. I really don't want to use Edge. Can you please help? Thanks, </p><pre>Cindy Manning  </pre> <p>cmanning@elmore.rr.com 334-651-8678 </p>",desktop;windows-11;website-breakages;firefox-1290;firefox-12902;,firefox,website-breakages,en-US,"",z9x8sxkp5z
1460661,2024-08-27 09:30:26 -0700,2024-08-27 09:30:26 -0700,why is x-finity being blocked on my website,<p>My x-finity account will not open any more.  It say not available on this website </p>,desktop;other;windows-10;firefox-1290;firefox-12902;,firefox,other,en-US,"",sondrabrown48
1460660,2024-08-27 09:26:15 -0700,2024-08-27 09:26:15 -0700,Requesting a Way to Sort Bookmarks...,"<p>Hello, </p><p>I am hoping that there is a way in which I can organise (permanently, not just the current display) my bookmarks alphabetically though still separated by folders and bookmarks. In case that isn't clear, the order would be: </p> <ol><li> 1 all of the folders grouped together in alphabetical order, then </li><li> 2 all the bookmarks grouped together in alphabetical order. </li></ol> <p>Thanks in advance for any assistance you can offer.  </p><p>Sam </p>",desktop;other;firefox-1270;firefox-12702;,firefox,other,en-US,"",OpenSourceSam
1460656,2024-08-27 09:12:26 -0700,2024-08-27 09:12:26 -0700,En que año me gradué del colegio?,<p>Pueden ayudarme con lo relacionado al bloque de mi cuenta. </p>,desktop;windows-10;protect-your-privacy;,firefox,protect-your-privacy,es,"",csalgadot75
1460655,2024-08-27 09:12:05 -0700,2024-08-27 09:12:05 -0700,Something is wrong,"<p>Hello  </p><p>I am having troubles accessing the browser. I get to do endless security check every time I open Firefox for anything. I have to undergo several puzzles ""I am not a robot"" before any page opens and this happens every time I go on the web. even if I did this a Mn ago am being asked again and not only one puzzle to resolve but sometimes up to 10 in a row. This is so time consuming that I am now considering leaving Firefox to work on other browsers although I always had Firefox as my default browser. Thank you </p>",desktop;troubleshooting;mac-os-x-1015;firefox-1290;firefox-12902;,firefox,troubleshooting,en-US,"",joyce33
1460653,2024-08-27 09:04:45 -0700,2024-08-27 09:04:45 -0700,previous tabs are not opening when turning firefox back on,"<p>I would like to have my tabs I use everyday reopen when I turn the browser back on. In settings I have checked the box for ""open previous windows &amp; tabs"" However, when I reopen the browser the previous tabs are not there and I have to recreate the line-up of my tabs which takes time etc.  How do I fix this? Thank you so much for any help! Lucinda </p>",desktop;tabs;mac-os-x-1015;firefox-1290;firefox-12902;,firefox,tabs,en-US,"",lucindamacy
1460652,2024-08-27 09:04:29 -0700,2024-08-27 09:22:05 -0700,Looking for an older version of FF,<p>I am looking for an older ver. of FF 115.12 so I can Remedy. Any help would be appreciated. </p>,desktop;other;windows-11;,firefox,other,en-US,1670982;1670984;,cschaeffer30.cs
1460649,2024-08-27 08:53:08 -0700,2024-08-27 08:53:08 -0700,Submit Form,"<p>Good Morning, I have always used Firefox for my online banking. I could pull up my bank, put in log in information, put in my Authenticator code and I would be in. Now.... After putting in the authenticator code it gives me a white blank page with the tab Submit Form. Over the weekend with working with the Bank, trying all types of scenarios, closing cookies and history, shutting down the computer, etc. they suggested installing and using Google Chrome and I was able to get it to work.   My question.... I still tried Firefox and I can't get it to work....did something change? Did I mess something up?  I am ok with using Google Chrome just have always used Firefox. Thanks for you help and input.   A. Miller </p>",desktop;tabs;mac-os-x-1010;firefox-7815;firefox-78150;,firefox,tabs,en-US,"",schnipkellc
1460648,2024-08-27 08:44:53 -0700,2024-08-27 08:44:53 -0700,shree clothing,<p>i am busnissmen </p>,desktop;windows-11;install-and-update;firefox-1290;firefox-12902;,firefox,install-and-update,en-US,"",mustakkhan81465
1460647,2024-08-27 08:43:16 -0700,2024-08-27 08:43:16 -0700,shree cloting,<p>i am busnissmen </p>,desktop;sync;windows-11;firefox-1290;firefox-12902;,firefox,sync,en-US,"",mustakkhan81465
1460646,2024-08-27 08:37:45 -0700,2024-08-27 08:37:45 -0700,Devolver o moldem,<p>Devolver o moldem </p>,desktop;other;,firefox,other,pt-BR,"",lucianojosesil2013
1460645,2024-08-27 08:36:10 -0700,2024-08-27 08:36:10 -0700,Thunderbird,"<p>I had to reset my pc as it wasn't performing properly . I am using windows 11. When the reset was finished a new windows version installed itself on my pc . I now have 2 windows 11 installations on my pc - an old windows 11 and a new windows 11 . My desktop and documents , etc , pulled through into the new windows 11 installation , but my Thunderbird did not . I never backed up my Thunderbird as I presumed that with the pc reset , it would automatically pull Thunderbird into the new windows  after the reset. I then reinstalled Thunderbird onto the new windows , but it did not pull through my Thunderbird data from the old windows installation. </p><p>Please could you assist in helping me to retrieve all of my Thunderbird Data from the old windows installation into the new windows installation. </p><p>Thanks Gary Email  -  gme@hixnet.co.za </p>",desktop;troubleshooting;windows-11;firefox-1290;firefox-12902;,firefox,troubleshooting,en-US,"",garyepstein100
1460641,2024-08-27 08:08:03 -0700,2024-08-27 09:25:52 -0700,how do I get rid of that wretched pocket thing that was shoved down my throat?,<p>Please help me get rid of that horrible pocket thing that ruined my firefox! </p>,desktop;other;mac-os-x-1015;firefox-1290;firefox-12902;,firefox,other,en-US,1670987;,wilhams9
1460640,2024-08-27 08:00:00 -0700,2024-08-27 08:00:00 -0700,Download - Failed,"<p>Hey! </p><p>When I try to download any file it says ""Failed"".  I changed the direction of the folder where the files are saved, checked every download setting in about:config, reinstalled Firefox, gave Firefox administrator privileges but nothing helped. </p><p>This error has been occurring since I switched from a NVIDIA gpu to an AMD gpu.  </p><p>Thanks for the help in advance! </p>",desktop;windows-10;install-and-update;firefox-1290;,firefox,install-and-update,en-US,"",petgamerwot
1460638,2024-08-27 07:44:38 -0700,2024-08-27 07:44:38 -0700,Parts of web sites will not open,"<p>Parts of some web sites will not open. </p><p>See below, there is no button. </p><p>If i log in to Scottish Power through my Ipad there is a button. </p><p><br> </p><p>""Log into your ScottishPower online account Hi M M, this email will let you access your online account. <em>Simply click the button below.</em> </p><p>Please do not share or forward this email to anyone else, including us."" </p><p><br> </p><p>Regards </p><p>Michael </p>",desktop;windows-10;troubleshooting;firefox-1290;,firefox,troubleshooting,en-US,"",mm.s.knight
1460636,2024-08-27 07:38:02 -0700,2024-08-27 07:56:33 -0700,errore in risposta a invio mail,"<p>Salve, spesso cercando di rispondere a messaggi email viene visualizzato qs messaggio: Errore dal server di posta 200 syntaxerror: json.parse: unexpected character at line 1 column 1 of the json data. Come è possibile risolvere?   Grazie </p>",desktop;windows-10;troubleshooting;firefox-1290;firefox-12902;,firefox,troubleshooting,it,1670965;,vanni.com
1460629,2024-08-27 07:09:43 -0700,2024-08-27 07:09:43 -0700,disc space increase,<p>Yahoo people recommended to contact you to increase my disc space because I am unable to send messages using the accounts I have set up in my computer. Please tell me what  I need to do to increase my disk space. Thanks. </p>,desktop;other;windows-10;,firefox,other,en-US,"",bumbabella
1460626,2024-08-27 06:56:28 -0700,2024-08-27 06:56:28 -0700,VRAGEN,<p>GEEN VRAGEN MEER </p>,desktop;tips;windows-11;firefox-1290;firefox-12902;,firefox,tips,nl,"",jscw541
1460625,2024-08-27 06:43:02 -0700,2024-08-27 06:43:02 -0700,TV not support,<p>Not support </p>,desktop;install-and-update;,firefox,install-and-update,en-US,"",ratneshchaurasia121
1460624,2024-08-27 06:35:40 -0700,2024-08-27 06:35:40 -0700,subject dan hewan,<p>terimakasih siap untuk mengistal dan sipa untuk pakai </p>,desktop;windows-11;install-and-update;firefox-1290;firefox-12902;,firefox,install-and-update,en-US,"",amostenouye01
1460618,2024-08-27 05:20:33 -0700,2024-08-27 05:20:33 -0700,Gmail printing issue,"<p><strong> </strong> </p><p><br> When I click on the print icon of an email (on MacBook Pro, Mac OS 14.6.1), it gets stuck on the message ""preparing document"". Any suggestion on how to solve this?' </p>",desktop;troubleshooting;mac-os-x-1015;firefox-1290;firefox-12902;,firefox,troubleshooting,en-US,"",rzachau
1460616,2024-08-27 05:16:23 -0700,2024-08-27 06:09:17 -0700,update and install,<p>please update my firefox browser please update and install firefox browser </p>,windows-7;desktop;install-and-update;firefox-115140;firefox-11514;,firefox,install-and-update,en-US,1670925;,ekam.sidhupuria0008
1460615,2024-08-27 05:07:41 -0700,2024-08-27 05:07:41 -0700,Firefox ignores zero-width space - &#8203; aka &#x200b;,<p>For languages that don't put spaces between words there's a Unicode character zero-width space - &#8203; aka &#x200b;  - that a browser is supposed  to use as a cue to break a line.  Firefox ignores it. </p>,linux;desktop;troubleshooting;,firefox,troubleshooting,en-US,"",RandomTroll
1460614,2024-08-27 05:04:04 -0700,2024-08-27 07:06:07 -0700,HOW TO UPDATE FIREFOX,<p><strong>bold text</strong>HOW TO UPDATE&nbsp;? </p>,linux;desktop;install-and-update;firefox-1290;firefox-12901;,firefox,install-and-update,en-US,1670943;,dduran1210
1460605,2024-08-27 04:23:23 -0700,2024-08-27 07:30:54 -0700,Firefox 129.2 x64,"<p>Dobry den, instalace firefoxu x64 ve win10 je bez problem-nejde vsak nacist.  Po asi 10 odinstalaci a opetovne instalaci uz nevim co delat. Resil nekdo stejny problem. Dekuji. </p>",desktop;windows-10;website-breakages;,firefox,website-breakages,cs,1670902;1670950;,xjankub
1460604,2024-08-27 04:23:11 -0700,2024-08-27 04:23:11 -0700,Install and update,<p>Install and update </p>,desktop;windows-10;install-and-update;firefox-1290;firefox-12902;,firefox,install-and-update,en-US,"",twanmrontoo
1460603,2024-08-27 04:19:11 -0700,2024-08-27 04:19:11 -0700,Presentation etc,"<p>Hello Everyone! I have been using Firefox (and a computer!)since about 2004! I am also well past my 'sell-by' date and would appreciate if any details are included in a reply, that they are explicit, my technical ability is around ""O"" ish! </p><p>Suddenly, a couple of months ago, my Emails in FireFox started opening to the right of the main 'panel' and were foreshortened. </p><p>Replying to any of them reduces the visible reply area to either one or two lines of text, making it difficult to see and be able to judge any editing. </p><p>I have been using Facebook Messenger to video chat with my close friends and family in UK and as I live outside UK, I have found this necessary. Firefox has just stopped allowing this facility. I now have had to install a different browser to be able to carry on this method of communication. </p><p>With all these difficulties, I am considering uninstalling Firefox, which I am unsure about any longer. </p><p>If there is/are any advice or suggestions, I would be grateful to see it or them. </p><p>Thank you in advance. </p><p>Colin. </p>",desktop;other;windows-11;firefox-1290;firefox-12902;,firefox,other,en-US,"",colinthejazzman
1460600,2024-08-27 03:56:32 -0700,2024-08-27 03:57:03 -0700,english,<p>privacy </p>,windows-7;desktop;firefox-1150;protect-your-privacy;,firefox,protect-your-privacy,en-US,1670896;,ranjitkhatkar06
1460598,2024-08-27 03:41:14 -0700,2024-08-27 03:42:03 -0700,coding,<p>i want to code </p>,desktop;windows-11;install-and-update;,firefox,install-and-update,en-US,1670895;,danquahclaudia97
1460597,2024-08-27 03:40:24 -0700,2024-08-27 03:40:24 -0700,coding,<p>i want to use it to code </p>,desktop;windows-11;install-and-update;,firefox,install-and-update,en-US,"",danquahclaudia97
1460596,2024-08-27 03:31:20 -0700,2024-08-27 03:31:20 -0700,browser does not support voice calls,"<p>browser does not support voice calls, how can i fix this issue? </p>",desktop;other;windows-10;firefox-1290;firefox-12902;,firefox,other,en-US,"",fine.illdoitmyself
1460595,2024-08-27 03:21:30 -0700,2024-08-27 03:21:30 -0700,Log-in difficulties in Firefox for Mac 129.0.2,"<p>Ever since I upgraded to Firefox for Mac 129.0.2, I've been getting errors trying to log in pretty much everywhere. Not Mozilla, but Chase, Reddit, etc. On the first try, I always get an error about not being able to establish a secure connection, along with the offensive suggestion that I try a different browser or the site's app. It generally works on the second attempt, but it's not working for Reddit today, although I get the same ""different browser"" message. Also my sister has been locked out of Chase using Firefox for iOS 129.1 (and I think also .2), so I am worried about where this is going. </p><p>My system is old: a late 2012 MacBook Pro, running Catalina (macOS 10.15.7), the highest system it can run. Please don't suggest I upgrade my hardware unless you are personally willing to pay for it; I can't. </p>",desktop;troubleshooting;mac-os-x-10157;firefox-1290;firefox-12902;,firefox,troubleshooting,en-US,"",khindall
1460593,2024-08-27 02:54:16 -0700,2024-08-27 02:54:16 -0700,Appearance of text size in composing emails,"<p>I have just got a new machine running Win 11 and installed Firefox. When I compose a new email the text appears very small, despite the size for text that I've set. The only way I can change that is to Zoom, which I have to do for each new email that I write. </p>",desktop;troubleshooting;windows-11;,firefox,troubleshooting,en-US,"",jffield1
1460591,2024-08-27 02:35:57 -0700,2024-08-27 03:10:49 -0700,Translate selection,"<p>Hello when i try to translate a word or phrase, doesnt have in list my language, which is Greek. For example i want to translate a word from english to greek and there is no option in menu to choose my language. How can i add my language to this list? Thank you! </p>",desktop;other;mac-os-x-1015;firefox-1290;,firefox,other,en-US,1670887;,tehsn0u
1460589,2024-08-27 02:26:23 -0700,2024-08-27 07:36:55 -0700,Nelze načíst stránky firmy kde nakupuji    www.maro.cz   na telefonu jdou načíst.,"<p>Toto se mi objevuje na obrazovce a dříve vše fungovalo. Moc děkuji za rady jak odstranit závadu ,aby vše zase fungovalo. Nejde mi to ani na prohlížeči Google. S pozdravem Pavel Šmíd  tel. 603789398 pavsmid@centrum.cz </p><p><br> </p><p><br> Chyba zabezpečeného spojení </p><p>Při spojení s <a href=""http://www.maro.cz"" rel=""nofollow"">www.maro.cz</a> nastala chyba. PR_CONNECT_RESET_ERROR </p><p>Kód chyby: PR_CONNECT_RESET_ERROR </p><pre>   Požadovanou stránku nelze zobrazit, protože nelze ověřit autenticitu přijatých dat.    Kontaktujte prosím vlastníky webového serveru a informujte je o tomto problému. </pre> <p>Zjistit více… </p>",desktop;windows-11;website-breakages;firefox-1290;firefox-12902;,firefox,website-breakages,cs,1670904;1670908;1670909;1670957;,pavsmid
1460587,2024-08-27 01:41:21 -0700,2024-08-27 07:04:39 -0700,Firefox - vždy po zapnutí startuje jako nová instalace,"<p>Dobrý den, po vypnutí notebooku, a jeho zapnutí se - Mozilla Firefox (129.0.2) vždy naběhne jako nová, čistá instalace (viz screen v příloze). Bez uložených záložek, hesel a pod. Stav je poslední 3 dny, po aktualizaci. Nikdy se mi to za posledních 5 let nestalo. Nějaké nápady, čím to může být? Děkuji, Mirek. </p><p>Hello, after switching off my laptop and switching on - Mozilla Firefox (129.0.2) starts as new instalation, without any folders and passwords, everything is gone (see screen). It starts 3 day ago, after last update. Never happend in last 5 years. Any suggestions? Thank you, Mirek. </p>",desktop;windows-10;troubleshooting;firefox-1290;firefox-12902;,firefox,troubleshooting,cs,1670872;1670905;1670907;1670910;1670917;1670942;,mir69
1460582,2024-08-27 01:13:16 -0700,2024-08-27 01:13:16 -0700,Avast Passwords Extension not working,"<p>Hi there,  I don't know if it was from a recent update to Firefox or to Avast passwords but the Passwords extension will not install.  I've been in contact with Avast and tried uninstalling Firefox, Avast Premium Security, Avast Passwords and tried re-installing them but nothing has fixed the issue.  Previously the extension wasn't working in Chrome and I couldn't reinstall it, but I have managed to reinstall it and it is working in Chrome now.  I'd prefer to use Firefox if I can get it working there again.  </p><p>This is the error message that comes up when I try installing it, and the install fails (in Firefox). </p><p>An error occurred while processing your request. Reference #30.46f3ce17.1724388053.19bc10d  <a href=""https://errors.edgesuite.net/30.46f3ce17.1724388053.19bc10d"" rel=""nofollow"">https://errors.edgesuite.net/30.46f3ce17.1724388053.19bc10d</a> </p><p>Thanks for any assistance you can offer.  Nick. </p>",desktop;other;windows-10;firefox-1290;,firefox,other,en-US,"",nick.w
1460580,2024-08-27 00:50:19 -0700,2024-08-27 00:50:19 -0700,bookmarks gone,<p>This morning all my bookmarks are gone! What happened and how can i have them back? there were important list with my master and work. </p>,desktop;bookmarks;windows-10;firefox-1290;,firefox,bookmarks,en-US,"",foperam
1460578,2024-08-27 00:42:09 -0700,2024-08-27 00:42:09 -0700,Code d’erreur : PR_CONNECT_RESET_ERROR,"<p>Bonjour,  </p><p>Depuis 3-4 jours ce message s'affiche sur quasiment tous les sites web que j'ai l'habitude d'utiliser. Avec un autre navigateur internet ils fonctionnent mais pas avec Firefox.  </p><p>Échec de la connexion sécurisée </p><p>Une erreur est survenue pendant une connexion à <a href=""http://duckduckgo.com"" rel=""nofollow"">duckduckgo.com</a>. PR_CONNECT_RESET_ERROR </p><p>Code d’erreur&nbsp;: PR_CONNECT_RESET_ERROR </p><pre>   La page que vous essayez de consulter ne peut pas être affichée car l’authenticité des données reçues ne peut être vérifiée.    Veuillez contacter les propriétaires du site web pour les informer de ce problème. </pre>",desktop;windows-11;website-breakages;,firefox,website-breakages,en-US,"",camille.ponnelle
1460575,2024-08-26 23:10:14 -0700,2024-08-26 23:34:46 -0700,autofill forms,"<p><em>duplicate of <a href=""/questions/1460574"" rel=""nofollow"">/questions/1460574</a> thread.</em> </p><p>the internet has many sites that say that firefox has an auto fill in form with password, but it is not included in settings. How do I get it? I am tired of typing in my email address on web pages. </p>",desktop;troubleshooting;windows-11;firefox-1290;firefox-12902;,firefox,troubleshooting,en-US,"",suzidowner
1460574,2024-08-26 23:08:40 -0700,2024-08-26 23:08:40 -0700,how do i install firefox autofill forms,"<p>the internet has many sites that say that firefox has an auto fill in form with password, but it is not included in settings. How do I get it? I am tired of typing in my email address on web pages. </p>",desktop;other;windows-11;firefox-1290;firefox-12902;,firefox,other,en-US,"",suzidowner
1460572,2024-08-26 22:36:43 -0700,2024-08-26 22:36:43 -0700,Be descriptive. Saying “playing video on YouTube is always choppy” will help us understand the issue better than saying “something is wrong” or “the app is broken”.,<p>Be descriptive. Saying “playing video on YouTube is always choppy” will help us understand the issue better than saying “something is wrong” or “the app is broken”. </p>,windows-vista;desktop;install-and-update;firefox-115140;firefox-11514;,firefox,install-and-update,en-US,"",arunanamalla
1460571,2024-08-26 22:25:09 -0700,2024-08-26 22:25:09 -0700,unable to sign in yahoo mail,<p>unable to open yahoo mail. when I open sign in page It is asking to prove you are not a robot every time </p>,desktop;other;,firefox,other,en-US,"",prabhudevaraj353
1460569,2024-08-26 21:52:00 -0700,2024-08-26 21:52:00 -0700,Vulnerablity risk from NordVPN,"<p>I use both Firefox and DuckDuckGo.  I also have NordVPN.  Recently, I have been getting warnings through NordVPN that both Firefox and DuckDuckGo represent vulnerability risks.  I have been using all three programs for some time now.  This warning from NordVPN is something new.  Is there a vulnerability risk or is there some in compatibility between new versions of these software packages? </p><p>I am using Windows 11 on a Microsoft Surface Pro 9. </p><p>Thanks for your help. </p><p>Denis </p>",mobile;protect-your-privacy;,firefox,install-and-update,en-US,"",isstrachan
1460568,2024-08-26 21:37:26 -0700,2024-08-26 21:37:26 -0700,Google es culero y me hakeos asé 4años y todos son sus pendejod,<p><strong>texto en negrita</strong> </p>,desktop;install-and-update;,firefox,install-and-update,es,"",juanlozano01534
1460566,2024-08-26 21:24:46 -0700,2024-08-26 21:24:46 -0700,Firefox HTTPS Issue.,"<p>I am having trouble when logging into a specific website. </p><p>The login process is to use login URL(<a href=""https://online.torfx.com.au/CustomerPortal/login.htm"" rel=""nofollow"">https://online.torfx.com.au/CustomerPortal/login.htm</a>), then enter my email address and password. </p><p>Once I select Login, the website should then show my dashboard  URL(<a href=""https://online.torfx.com.au/CustomerPortal/dashboard.htm"" rel=""nofollow"">https://online.torfx.com.au/CustomerPortal/dashboard.htm</a>) but when I use Firefox, I get the Secure Site Not Available error (see attached screenshot). </p><p>If I use either Chrome or Edge, I do not have this problem and if you check the status of the connection on both these browers, they say that the Connection is Secure and the URL shows as HTTPS:// , so it appears that Firefox has this issue. </p><p>Does any one have any suggestions/advice etc? </p><p>Thanks. </p>",desktop;windows-10;troubleshooting;,firefox,troubleshooting,en-US,"",RedJock_46
1460561,2024-08-26 20:29:07 -0700,2024-08-26 22:17:11 -0700,results per page,<p>Please advice how I can change number of results per page from 10 to 100.   In the past it was a simple slider but it is gone now? </p>,desktop;mac-os-x-1013;customize-settings-and-preferences;firefox-115140;firefox-11514;,firefox,customize-settings-and-preferences,en-US,1670842;1670843;1670850;,jz5078
