id,created,updated,title,content,tags,product,topic,locale,answers,creator
1460081,2024-08-23 20:04:19 -0700,2024-08-23 20:08:40 -0700,I need to search for more than one search term in about:config. How can I do this?,<p>I need to search for more than one search term in about:config. How can I do this? </p><p>Is there some kind of syntax I can use like the pipe symbol to do something like oneword|anotherword or do I have to know literally the exact thing I'm looking for before looking? </p><p>thanks in advance </p>,linux;desktop;customize-settings-and-preferences;,firefox,customize-settings-and-preferences,en-US,1670190;,automaticmath
1460079,2024-08-23 19:16:06 -0700,2024-08-23 19:16:06 -0700,how to change the color of desktop shortcuts,"<p>I was making something is firefox color, and I'd like to change the color of the buttons on the desktop shortcuts is there anyway to do this? </p>",desktop;windows-10;customize-settings-and-preferences;firefox-1290;firefox-12902;,firefox,customize-settings-and-preferences,en-US,"",brittandfam1066
1460078,2024-08-23 19:01:36 -0700,2024-08-23 19:02:13 -0700,signing into my account,<p>Please help with backing up my data </p>,desktop;tips;needsinfo;,firefox,tips,en-US,1670175;,allanderson582
1460074,2024-08-23 18:42:35 -0700,2024-08-23 18:42:35 -0700,"""Share screen"" needs to let you see all the available tabs","<p>First at all, i´m starting to like this browser but as a college student when doing online expos i only want to show only 1 tab in especific and not my entire screen for privacy. Example: I have Canva open, yet the browser doesn´t allowed the option. </p>",desktop;other;windows-11;firefox-1290;firefox-12902;,firefox,other,es,"",antonioaragon5
1460073,2024-08-23 18:38:08 -0700,2024-08-23 18:38:08 -0700,error message,<p>getting this message on Mozilla  browser trying to access email thru comcast </p>,desktop;troubleshooting;windows-11;firefox-1290;firefox-12902;,firefox,troubleshooting,en-US,"",meyerviann
