id,created,updated,title,content,tags,product,topic,locale,answers,creator
1463412,2024-09-12 15:49:27 -0700,2024-09-12 15:49:27 -0700,Recent search history,<p>Recent search history </p>,firefox;browse;,firefox,browse,en-US,"",divyasamadi23
1463411,2024-09-12 15:38:14 -0700,2024-09-12 15:38:14 -0700,Firefox fails to render .heic images,"<p>Dear colleagues: </p><p>I have made a page with a stack of z-indexed .heic images.  The viewer clicks (jQuery) on the top image to reveal the next. </p><p>The page is local, not online. I'm on a Mac mini 2018, OS Ventura 13.6.1, Firefox 13.0. </p><p>Safari renders the operation correctly. Firefox fails to load the .heic images. Chrome also fails to load the images.  </p><p>Any suggestions welcome. My 83yo brain sometimes misses things. cheers Chris </p>",firefox;performance-and-connectivity;,firefox,performance-and-connectivity,en-US,"",976hyfjhsy
1463410,2024-09-12 15:37:40 -0700,2024-09-12 15:37:40 -0700,My account is blocked and I have no idea to reset my password.  I am going through chemo and need help to reset my password.  It is all so confusing.,"<p>Please assist me resetting my password,  Chemo brain is making me cloudy how to do it. </p>",firefox;passwords-and-sign-in;,firefox,passwords-and-sign-in,en-US,"",BarDElec
1463409,2024-09-12 15:27:52 -0700,2024-09-12 15:27:52 -0700,Can't login to my accounts on my browser,"<p>I reinstalled windows on my PC. I had to password reset because I forgot it and then it made my login back on my phone. I go through the login process on my phone and I first get my Email verification then I get my Auth app and it tells me it was logged in, but doesn't actually log me in. It does this both on my phone and PC now so I am trying to get logged in on my phone to be able to bring my bookmarks over. </p>",firefox;accounts;,firefox,accounts,en-US,"",andrew.welsh022600
1463407,2024-09-12 15:09:40 -0700,2024-09-12 15:09:40 -0700,softwear,<p><strong>bold text</strong>The<strong> </strong> </p><p><br> </p><p><br> </p><p><br> </p><p><br> </p><p><br> </p><p><br> </p><p><br> </p><p><br> </p><p><br> </p><p><br> </p><p><br> </p><p><br> </p><p><strong></strong> </p>,firefox;installation-and-updates;,firefox,installation-and-updates,en-US,"",adilhashmi246
1463405,2024-09-12 14:52:16 -0700,2024-09-12 14:52:16 -0700,Metamask,<p>My metamask doesn't want to open but it just keeps loading. I can't reinstall it because I didn't save the private key </p>,firefox;browse;,firefox,browse,pt-BR,"",jodilio1
1463401,2024-09-12 14:24:19 -0700,2024-09-12 14:24:19 -0700,firefox,<p>Tornar o FireFox padrão. </p>,firefox;privacy-and-security_1;,firefox,privacy-and-security,pt-BR,"",raymundo.ngferreira
1463400,2024-09-12 14:22:44 -0700,2024-09-12 15:16:19 -0700,I love Firefox but it continues to open in MSN even though I deleted all the files for MSN I thought! Any ideas?,<p>Please help me out of MSN even though I use the Firefax icon to sign in and the top is firefox the opening page is MSN.  I do NOT want that.  Can you help me? </p>,firefox;browse;,firefox,browse,en-US,1674207;,sylviashalie
1463397,2024-09-12 13:58:17 -0700,2024-09-12 13:58:17 -0700,YouTube button layout broken,<p>YouTube buttons layout is broken on regular tab but works fine on incognito. Also the three dotted button shows different options in regular vs incognito mode. </p>,firefox;browse;,firefox,browse,en-US,"",heroalom0511
1463395,2024-09-12 13:45:06 -0700,2024-09-12 13:45:06 -0700,WebGL,"<p>Update kills WebGL function... last time had to strip everything FireFox out of the registry, erase anything FireFox from anywhere, and do a clean download and installation... Auto Update came yesterday... problem again!!! WHY  This is the second time this has occured. </p><p>Ref: webgl. disabled	false	 webgl. force-enabled	true </p><p>Video: Intel Q45/Q43 Express Chip, Integrated </p><p><br> Thanks - Ron k4fzu@aol.com 813-380-6873 </p>",firefox;installation-and-updates;,firefox,installation-and-updates,en-US,"",k4fzu
1463392,2024-09-12 13:25:50 -0700,2024-09-12 13:25:50 -0700,085930278007 cari tau kode aplikasi dana,<p>Hp Aku  dan aku punya aplikasi dana di kartu telfon ku yg ada di hp tersebut tolong cari tau kode atau sandi dana sy yang saya lupa dana saya hilang dan nomorn 085930278007 </p>,firefox;accounts;,firefox,accounts,en-US,"",kalfinbaladia
1463384,2024-09-12 12:33:54 -0700,2024-09-12 12:33:54 -0700,Firefox won't open at all.,<p>I tried downloading Firefox again and I still can't open it.  There must be something in my computer (Windows 11) that is stopping it from opening.  It is the browser that I prefer.  I have used it for many years and everything is on it.  Please help. </p>,firefox;windows-11;installation-and-updates;,firefox,installation-and-updates,en-US,"",suzq278
1463382,2024-09-12 12:25:26 -0700,2024-09-12 16:08:32 -0700,Youtube video not playing when I am opening it from google search,"<p>For past few weeks, I am facing a problem, whenever I try to open an YouTube video from google search it dose not play. When I click on play/pause button or press spacebar, the video plays for one frame and then again pauses. But the video plays fine, If I search <a href=""http://youtube.com"" rel=""nofollow"">youtube.com</a> and open a video from there, I am don't understand why this is happening, I tried restarting firefox and I also restarting my pc, but that is also not working. </p>",firefox;needsinfo;browse;,firefox,browse,en-US,1674216;,vmsquared
1463381,2024-09-12 12:24:32 -0700,2024-09-12 12:24:32 -0700,thank,<p>all problem </p>,firefox;backup-recovery-and-sync;,firefox,backup-recovery-and-sync,en-US,"",bimalpradhan50
1463374,2024-09-12 11:42:27 -0700,2024-09-12 11:42:27 -0700,Firefox keeps forgetting passwords,"<p>I have one login saved to Firefox. Firefox, for some unfathomable reason, will sometimes delete that login from its records entirely and I'll have to set up a new entry. This has happened a total of six times over the last three months/ </p>",firefox;privacy-and-security_1;firefox-1300;,firefox,privacy-and-security,en-US,"",orthodoxchristian988
1463371,2024-09-12 11:36:16 -0700,2024-09-12 11:36:16 -0700,Manca l'audio nell'ambiente di Firefox,"<p>Buon giorno Da qualche giorno se utilizzo Firefox non ho l'audio su nessun sito.  Con gli altri browser il problema non sussiste.  Ho provato già tutte le soluzioni e le impostazioni consigliate per i problemi audio consigliate nell'Help di Firefox, ho fatto il ripristino, l'ho disinstallato e reinstallato, ma non cambia niente.  L'unica cosa che non ho fatto e la disinstallazione/reinstallazione con rimozione dei dati. La problematica riguarda solo l'audio in Firefox, tutte le altre funzioni vanno bene. </p><p>nootebook Acer swift 3 (2017) Windows 10 </p><p>Attendo un eventuale consulenza. Grazie Giuseppe </p>",firefox;performance-and-connectivity;,firefox,performance-and-connectivity,it,"",giuseppe.sandroid
1463368,2024-09-12 11:30:17 -0700,2024-09-12 11:30:17 -0700,"When using Firefox to login to ""artstorefronts.com"" I get message: ""reCAPTCHA verification failed. Try again.""","<p>I have been using Firefox to access the following website for years: ""<a href=""http://artstorefronts.com"" rel=""nofollow"">artstorefronts.com</a>"", which requires appropriate login credentials, but suddenly Firefox will not open the website. Instead, I get the following message after submitting with proper credentials: ""reCAPTCHA verification failed. Try again."" There is not a reCAPTCHA ""test"" associated with this login page, so there is no reason to get this message on my end. However, please note that I AM able to access the subject website using Chrome, Edge and Firefox IOS. I don't access the subject website frequently so I just noticed this problem about a week or so ago, so I suspect the problem began after the latest Firefox update (130.0, 64 bit) a short time ago. Firefox is my default browser and have been using it for years, so would hope to get some resolution to this problem. Thanks, Ralph Liliedahl, liliedahl@gmail.com. </p>",firefox;privacy-and-security_1;,firefox,privacy-and-security,en-US,"",TooShort
1463366,2024-09-12 11:03:14 -0700,2024-09-12 15:19:45 -0700,For some reason my .mozilla directory is more than 100gigabytes! What should i do to reduce it,"<p>So i use garuda linux(not sure if necessary but still telling). The "".mozilla"" folder is about 134 GB! I have browsed it a bit and found a lot of this folders ""vuzpdtyn.default-release-backup-crashrecovery"", ""tor50voj.default-backup-crashrecovery-"", ""profile-somestuff-backup-crashrecovery"" Is it safe to delete the old ones from this? </p>",firefox;performance-and-connectivity;,firefox,performance-and-connectivity,en-US,1674209;,aryasonalk
1463364,2024-09-12 10:32:25 -0700,2024-09-12 10:32:25 -0700,Account Disconnected,"<p>got a new laptop and downloaded firefox. i sign in and enter the authentication code sent to my email, but it automatically disconnects me. i complete another log in and it continues to go in a loop. any help appreciated.  thank you. </p>",firefox;accounts;,firefox,accounts,en-US,"",ra_garcia
1463363,2024-09-12 10:28:01 -0700,2024-09-12 10:28:01 -0700,Video Download Helper,<p>I can't open up Video Download Helper </p>,firefox;installation-and-updates;,firefox,installation-and-updates,en-US,"",lobolvr1
1463361,2024-09-12 10:19:51 -0700,2024-09-12 10:19:51 -0700,autofill addreses won't turn off when unchecked,<p>autofill address will not turn off when unchecked in privacy setting. Tried many times over many days. It's very annoying. </p>,settings;firefox;,firefox,settings,en-US,"",edlannon
1463357,2024-09-12 10:06:01 -0700,2024-09-12 10:06:01 -0700,how to delete user id in aol mail,<p>How can I get an AOL user ID deleted? </p>,firefox;passwords-and-sign-in;,firefox,passwords-and-sign-in,en-US,"",gregmcmasters
1463356,2024-09-12 09:54:00 -0700,2024-09-12 15:49:32 -0700,I can't watch any videos on pw.live on linux.,"<p>So, There's this website called pw.live and I use it for study purposes.  And I've recently switched to linux and installed firefox. But that website loads but any videos or live streams don't. Even though it works perfectly fine on Windows version of firefox.  </p><p>I tried to search about this and it may be because the content is DRM protected. I'm just speculating though it may be broken for some very different reason. I also looked into solutions to fix DRM related issues. And found some solutions but the plugin <em>Widevine Content Decryption Module provided by Google Inc.</em> just doesn't exist in the plugins tab. There is only ""OpenH264 Video Codec"" there. And I think that might be the problem. </p><p>Thanks in advance. </p>",settings;firefox;firefox-1300;,firefox,settings,en-US,1674215;,prateekvarshney0403
1463355,2024-09-12 09:48:40 -0700,2024-09-12 09:48:40 -0700,can't sign-in to social security site,"<p>This worked previously, but now I can't login to the <a href=""http://ssa.gov"" rel=""nofollow"">ssa.gov</a> site. I am using desktop firefox 130.0 (64-bit) on windows. Using <a href=""http://login.gov"" rel=""nofollow"">login.gov</a> to authenticate I get the OTP text and enter it, <a href=""http://login.gov"" rel=""nofollow"">login.gov</a> accepts but does not redirect to the social security site. Firefox just refreshes the <a href=""http://login.gov"" rel=""nofollow"">login.gov</a> page. I tried this on chrome and it works fine. Image of <a href=""http://login.gov"" rel=""nofollow"">login.gov</a> page attached. </p>",firefox;passwords-and-sign-in;,firefox,passwords-and-sign-in,en-US,"",becyclist-temp
1463350,2024-09-12 09:25:53 -0700,2024-09-12 09:25:53 -0700,FB crashes tab AND 1Password disappeared,"<p>FB crashes tab every time I open it in Firefox, and my 1Password has dissapeared.  I can get in to FB on my iPad and iPhone firefox, and on my desktop in Google Chrome (ick). What happened? </p>",firefox;firefox-1300;performance-and-connectivity;,firefox,performance-and-connectivity,en-US,"",whowland
1463337,2024-09-12 08:09:40 -0700,2024-09-12 10:38:32 -0700,Problem z przeglądarka,"<p>Dzień dobry, Napotkałem dzisiaj dziwny problem. Nie wiem od czego on zależy, ale to mało istotne, najbardziej zależy mi na przywróceniu zakładek. Już raz miałem podobny problem, ale przymknąłem na to oko i zacząłem ustawiać wszystko od nowa i machnąłem ręką na zakładki. Teraz po raz kolejny mam ten sam problem. Włączyłem laptopa (był w uśpieniu), miał już włączoną przeglądarkę i jakieś dwie karty (nic nadzwyczajnego), chciałem jeszcze coś wyszukać otworzyłem więc nową kartę, wpisałem co tam chciałem w pasku wyszukiwania i nic... ładuje się bez końca, włączam kolejną kartę i to samo po wpisaniu czegoś innego. Wróciłem na te pierwsze dwie karty otworzone już wcześniej, one działały normalnie. Więc sobie pomyślałem że jak wyłączę przeglądarkę i włączę ponownie to zadziała... Nic bardziej mylnego. Wyłączyłem, i klikam tam gdzie zawsze włączam żeby ją uruchomić. Wyskakuje błąd że skrót jest w innym miejscu czy coś takiego. Na pulpicie jest jakby plik podpisany jako Firefox ale bez ikonki (jest tylko ikona pustej kartki), na pasku zadań już ikonka była ale błąd ten sam. Wpisałem więc w pasku zadań Firefox wyskoczył mi instalator, zainstalowałem ponownie, i przeglądarka w tym momencie działa ale nie mam wcześniejszych zakładek. Zalogowałem się na konto Firefox ale przywróciło mi jakieś bardzo stare zakładki (nie te co miałem ostatnio). Proszę o pomoc w przywróceniu tych zakładek które miałem jeszcze kilka godzin temu, oraz ewentualnie o wyjaśnienie przyczyny takiego problemu.<strong>bold text</strong> </p>",firefox;installation-and-updates;,firefox,installation-and-updates,en-US,1674166;1674167;,kacper.tokarz01
1463333,2024-09-12 07:58:06 -0700,2024-09-12 16:22:40 -0700,Lock Out,"<p><a href=""https://reservecalifornia.com/Web/"" rel=""nofollow"">https://reservecalifornia.com/Web/</a>   This web site has blocked the use of Fire Fox.  Google Chrome is the only one you can use.  Use Chrome or make no reservations.  Is there a work around? </p>",firefox;browse;,firefox,browse,en-US,1674218;,Portagie68
1463332,2024-09-12 07:56:41 -0700,2024-09-12 07:56:41 -0700,Signing into Amazon.com,"<p>New problem. I have correct Amazon password and sign in. I keep getting a message to sign in to Amazon but not allowed to do so. Message says “this request comes from Firefox, published by Mozilla “. This does not happen on phone but only on computer. How resolve? </p>",firefox;accounts;,firefox,accounts,en-US,"",tqkfq2xbnp
1463331,2024-09-12 07:56:25 -0700,2024-09-12 07:56:25 -0700,letzte sitzung wiederherstellen fehlt nach,<p>Der button 'letzte sitzung wiederherstellen' fehlte nach update. Wie komme ich jetzt an die letzte Sitzung (ca 100 tabs!!!)? </p>,firefox;backup-recovery-and-sync;,firefox,backup-recovery-and-sync,en-US,"",raireb67
1463329,2024-09-12 07:52:02 -0700,2024-09-12 07:52:02 -0700,compatibility error,"<p>After today's W10 update, I'm getting an error on Firefox:  </p><p>XULRunner: Error: Platform version 129.0.2 not compatible with </p><pre>minVersion &gt;= 128.0.2 maxVersion &lt;=128.0.2 </pre> <p>What do I do now? It's a Lenovo 64 bit machine. </p>",firefox;installation-and-updates;,firefox,installation-and-updates,en-US,"",berkell990
1463322,2024-09-12 07:32:36 -0700,2024-09-12 07:32:36 -0700,i keep getting direct messages coming from firefox,"<p>Hi,  </p><p>I am was looking for jobs and ran across a website called <a href=""http://Lensa.com"" rel=""nofollow"">Lensa.com</a>.   Well i setup an account and I wish i didn't.  </p><p>I don't think the site is legit. I have deleted my account, but I keep getting messages from them, and they are coming directly through firefox.  I have added a picture below.    </p><p>I don't see any browser extensions that would be doing this.   How are they able to do this? </p><p>There is nothing in my ubuntu startup.   </p><p>I am very concerned about this.   </p><p>I am running ubuntu 24.04 with all updates. </p>",firefox;privacy-and-security_1;firefox-1300;,firefox,privacy-and-security,en-US,"",don.tegnelia
1463320,2024-09-12 07:27:01 -0700,2024-09-12 07:27:01 -0700,Access to MyHeritage acct using Firefox,"<p>I am a longterm Firefox user, currently using <strong>version 130.0 on Windows10</strong>.   </p><p>I have been unable to access my MyHeritage account using Firefox, though I have access from other browsers.  The message that appears is ""Access has been temporary disabled Access has been temporarily disabled, this occurred due to suspicious activity. Please try again later"".  This has been going on for several weeks.   </p><p>My Heritage says they have not blocked the account.  This is confirmed by my being able to access from Safari and Chrome. </p><p>This problem has appeared before, but resolved within a week or so.  Not this time.  If it cannot be fixed, I will have to change to another browser for my default.  Any help? </p>",firefox;privacy-and-security_1;,firefox,privacy-and-security,en-US,"",hajones
1463316,2024-09-12 07:19:19 -0700,2024-09-12 07:19:19 -0700,välilehti kaatuu,<p>nostamalla välilehden </p>,firefox;firefox-1300;installation-and-updates;,firefox,installation-and-updates,fi,"",asalecki
1463309,2024-09-12 06:54:49 -0700,2024-09-12 06:54:49 -0700,I can not get into files folder,"<p>I´m in my Folders account, or files account </p>",firefox;accounts;,firefox,accounts,es,"",marvinem55
1463307,2024-09-12 06:39:58 -0700,2024-09-12 08:09:01 -0700,Tastiera su Firefox,"<p>A seguito di un aggiornamento firefox la tastiera, che funziona al di fuori di questo motore di ricerca, inserisce caratteri differenti da quelli premuti sulla tastiera. Ho ripristinato più volte firefox, per infine disintallarlo e reinstallarlo ma nulla, controllando nei forum non ho trovato risposta se non qualche problema con alcune estesioni , ma non può essere il mio caso dato che non ne ho alcuna. Come posso risolvere? </p>",firefox;needsinfo;installation-and-updates;,firefox,installation-and-updates,it,1674093;1674130;,bblestagioni
1463304,2024-09-12 06:05:32 -0700,2024-09-12 06:06:06 -0700,Firefox deleted my passwords and account,<p>I have no passwords now because firefox just decided I didn’t need them. And my account too. </p>,firefox;accounts;,firefox,accounts,en-US,1674084;,ohkunuk330
1463303,2024-09-12 05:55:02 -0700,2024-09-12 05:55:02 -0700,BARRA DE TÍTULO,"<p>Olá. </p><p>Não estou encontrando a configuração de barra de título para escondê-la. No Chromium, eu achei essa configuração fácil, mas no FF (FireFox) não. </p><p>Isso me passou desapercebido ou, de fato, ela não existe no FF? Estou usando o FF para Linux Mint. </p><p>Obrigado </p>",settings;firefox;,firefox,settings,pt-BR,"",cacaedu
1463302,2024-09-12 05:53:23 -0700,2024-09-12 05:53:23 -0700,Firefox não salva as preferências,"<p>Uso o Firefox no meu celular, computador pessoal e no computador do trabalho. Todos com a sincronização ativada, porém no do trabalho toda vez que reinicia a máquina é como se eu não tivesse configurado nada, as extensões estão lá mas desativadas, as preferências da barra de ferramentas voltam ao padrão de fábrica e abre a tela de informações de privacidade do Mozilla. </p>",settings;firefox;firefox-1300;,firefox,settings,pt-BR,"",iuripicchi
1463300,2024-09-12 05:45:31 -0700,2024-09-12 05:45:31 -0700,Expected redirect cookie to exist,"<p>hello, im trying to login to my ""Valorant account"" through Riot Games website, and i get this error: <strong>Expected redirect cookie to exist</strong> i have attached screenshot as rreference. Please i need solution for this asap. Thanks </p>",firefox;browse;,firefox,browse,en-US,"",egzonmehmedi38
1463299,2024-09-12 05:30:25 -0700,2024-09-12 05:30:25 -0700,Video not working,<p>Video not working </p><p>MacOS: 14.6.1 Firefox: 130.0 (64-bit) </p>,firefox;performance-and-connectivity;,firefox,performance-and-connectivity,en-US,"",tsnight
1463298,2024-09-12 05:26:54 -0700,2024-09-12 05:50:11 -0700,Groene bolletje met getal in Firefox logo,<p>Wat betekent het groene bolletje met een getal erin in het Firefox logo? </p>,settings;firefox;needsinfo;,firefox,settings,nl,1674082;,ron.franken
1463294,2024-09-12 04:15:25 -0700,2024-09-12 04:15:25 -0700,Browser does not work with all websites,<p>I am finding an increasing number of websites which do not work correctly with Firefox. What are you doing to resolve this? </p>,firefox;performance-and-connectivity;,firefox,performance-and-connectivity,en-US,"",steveand25
1463292,2024-09-12 04:04:55 -0700,2024-09-12 15:25:51 -0700,Troubles with Video playback on you tube,"<p>I use Libre <a href=""http://Wolf.In"" rel=""nofollow"">Wolf.In</a> the last week I started having problems with video playback on YouTube.The video is constantly interrupted or the image freezes, but the sound continues to play.This is not always the case, but about half of the time.I have tried many options, including disabling plugins and changing the resolution, but nothing helped.I have no problems with the speed of the connection.When I changed the browser (to Opera), then the problem with playback immediately <a href=""http://disappeared.So"" rel=""nofollow"">disappeared.So</a> the problem is in the browser.Tell me how to solve it. </p>",firefox;needsinfo;browse;,firefox,browse,en-US,1674078;1674211;,hamuut
1463290,2024-09-12 03:57:44 -0700,2024-09-12 03:57:44 -0700,When i open my site in Mozila i get error meesage like,"<p>Secure Connection Failed </p><p>An error occurred during a connection to <a href=""http://www.zealousys.com"" rel=""nofollow"">www.zealousys.com</a>. Peer’s Certificate has been revoked. </p><p>Error code: SEC_ERROR_REVOKED_CERTIFICATE </p><pre>   The page you are trying to view cannot be shown because the authenticity of the received data could not be verified.    Please contact the website owners to inform them of this problem. </pre>",firefox;performance-and-connectivity;,firefox,performance-and-connectivity,en-US,"",marketing108
1463289,2024-09-12 03:31:45 -0700,2024-09-12 03:31:45 -0700,windows security pin verify keeps popping up when ever i try to login to anything,<p>how do i turn this off. im the only person that uses this computer and this is very annoying. </p><p>thank you for any help you can give me. </p>,firefox;passwords-and-sign-in;,firefox,passwords-and-sign-in,en-US,"",vinegaryocean0
1463287,2024-09-12 03:21:54 -0700,2024-09-12 03:22:24 -0700,Upload files,<p>I will do to upload my documents </p>,firefox;browse;,firefox,browse,en-US,1674065;,harshborkar22
1463286,2024-09-12 03:17:44 -0700,2024-09-12 03:17:44 -0700,Firefox does not create defaults/pref folder on MacOS,"<p>Starting with version 126.0.0, firefox for MacOS stopped creating a defaults/pref folder during installation. If you create it yourself and add the autoconfig.js there, and add firefox.cfg to the root, firefox reads them perfectly and applies the settings. However, if you create folders before the first launch of the browser after installation, the file integrity check fails (see screenshot). </p><p>I couldn't find any information about why the folders stopped being created. Maybe someone knows? </p><p>The newest article regarding the configuration seems to be this one: </p><p><a href=""https://support.mozilla.org/en-US/kb/customizing-firefox-using-autoconfig"" rel=""nofollow"">https://support.mozilla.org/en-US/kb/customizing-firefox-using-autoconfig</a> </p>",settings;firefox;,firefox,settings,en-US,"",maxmtrushin
1463283,2024-09-12 02:55:11 -0700,2024-09-12 02:55:11 -0700,Facebook Group Calls Problem,"<p>Whenever I use FaceBook group calls, most of time I am not able to hear other FB users but they can hear me. This typically happens for the 2nd group call in login session. the way I am trying to resolve currently is log off, clear data and history in Firefox browser and then re-login and there is no problem. I do not know why this problem occurs only in Firefox, I do not see this issue in other browsers such as Chrome or Edge. can you please identify the cause and resolve it, it is very irritating. or let me know the solution for this issue. </p>",firefox;performance-and-connectivity;,firefox,performance-and-connectivity,en-US,"",bhushan.mnkh
1463281,2024-09-12 01:53:15 -0700,2024-09-12 16:14:35 -0700,Zaklikávání na Srealitách ve vyhledávání,"<p>Dobrý den, prosím o radu. Na stránkách <a href=""http://sreality.cz"" rel=""nofollow"">sreality.cz</a> mi nejdou označovat kolonky pro zakliknutí (např. výběr kraje). V jiném prohlížeči mi to funguje. Je potřeba v Firefoxu něco zapnout? Děkuji J. </p>",firefox;browse;,firefox,browse,cs,1674217;,jradous
1463274,2024-09-12 00:36:47 -0700,2024-09-12 00:36:47 -0700,Exporting a certificate,"<p>Hi! I have a new laptop and want to export a certificate I had installed in my previous laptop. When trying to do so, I'm asked to choose a certificate backup password which I need to enter twice to validate. Once I do it, this message comes up, ""Failed to create the PKCS #12 backup file for unknown reasons"". I've tried several times with different passwords but the same issue remains. Can you please help me out with this? Many thanks! Alex </p>",firefox;privacy-and-security_1;,firefox,privacy-and-security,en-US,"",artaboas
1463272,2024-09-12 00:17:00 -0700,2024-09-12 00:17:00 -0700,Paypal not processing,"<p>Hello, for two months now I've been unable to use Paypal to buy anything on Firefox. Nothing I have done has changed and it's gone from a nuisance to me considering new browsers. I need to be able to pay for things.  </p><p>I've attached an image to show where it always freezes. </p>",firefox;performance-and-connectivity;,firefox,performance-and-connectivity,en-US,"",madeline.gross
