id,created,updated,title,content,tags,product,topic,locale,answers,creator
1472154,2024-10-31 05:33:47 -0700,2024-10-31 05:50:10 -0700,Forced upgrades are new ... and annoying,"<p>I've always chosen the Settings option to notify me about updates but let me choose to install them.  Those notifications still give me the option to ""dismiss,"" but these days ignore that and proceed to install the updates anyway.  Worse, I can't even choose to restart at my convenience: The browser basically stops working until I do that, displaying the message I've attached here. (There used to be a Settings option to ""Use a background service to install updates"" that could be unchecked, but it's not there any more.) </p><p>This is not only obnoxious but a practical inconvenience because every time it happens I have to repopulate my Private Browsing sites.  I'd hoped that there would be a fix in the latest update (that just forced itself on me) - 132.0 - but no. </p><p>Anyone else experiencing this? </p>",firefox;windows-10;installation-and-updates;firefox-1320;,firefox,installation-and-updates,en-US,"",BlebNevus1015
1472153,2024-10-31 05:17:47 -0700,2024-10-31 14:09:18 -0700,Latest update broke the Firefox Colors plugin,<p>I have a custom pitch black theme ( pls add it without addons ) which now only flashes for a second when i open the browser and returns to the normal greyish dark mode. When i go to Firefox Color addon page and load it again in saved themes it stays pitchblack even if i open another browser window until i close all the browser windows . </p>,firefox;installation-and-updates;firefox-1320;,firefox,installation-and-updates,en-US,1685164;1685201;,pawelparyga
1472150,2024-10-31 05:05:28 -0700,2024-10-31 10:26:36 -0700,I am installing a new desk top computer shortly.,<p><strong>When I log into my Mozilla account will the contents be transferred to the drive?</strong> </p>,firefox;installation-and-updates;,firefox,installation-and-updates,en-US,1685165;,rsgbrowne
1472148,2024-10-31 04:31:53 -0700,2024-10-31 04:31:53 -0700,Firefox 132.0,<p>Uusin Firefox 132.0 ei toimi jos VPN on päällä! </p>,firefox;performance-and-connectivity;,firefox,performance-and-connectivity,fi,"",penacanon
1472146,2024-10-31 04:25:48 -0700,2024-10-31 04:38:59 -0700,"browser zoomed in , in maximise mode (not in fullscreen), unusable","<p>1/3rd part of title bar is cut off my display this is fixed when f11'd , it randomly went away on updating now its back i made it come back by clicking ctrl + tab several times &gt; </p>",settings;firefox;,firefox,settings,en-US,1685114;,mhahmadayub
1472145,2024-10-31 03:48:31 -0700,2024-10-31 03:48:31 -0700,i get an error from CNBC referending ad blocker.,<p>I thought I disabled ad blocker. I no longer have an idon for it on my task bar. </p><p>f </p>,firefox;privacy-and-security_1;,firefox,privacy-and-security,en-US,"",steiny1
1472144,2024-10-31 03:35:56 -0700,2024-10-31 03:35:56 -0700,CPU busy,"<p>Hello, I have 3 PCs.  One is Windows 10, Firefox 131.0.3 One is Windows 10 firefox 131.0 One is windows 11 firefox 131.0.3 </p><p>All 3 PCs are running BOINC, using the remaining CPU power up to 100% </p><p>On PC W10 + FF 131.0 and PC W11 + FF131.0.3 OINC and FF share the processor time up to 100% On the PC W10 + FF 131.0.3 when FF is dispatched, nno processor time is assigned to BOINC and CPU busy is no more 100%. This situation occurs frequently and can last several minutes. </p>",firefox;performance-and-connectivity;firefox-1310;firefox-13103;,firefox,performance-and-connectivity,en-US,"",jlbcs
1472137,2024-10-31 02:32:59 -0700,2024-10-31 02:56:00 -0700,Closing Last Tab Witouht exiting Firefox,"<p>I use Firefox 128.3.1esr in my Debian 12.7  Is there anyway to close last tab without exiting the browser? I mean after closing all tabs, I want Firefox jumps to homepage. Thanks for your help. </p>",firefox;browse;,firefox,browse,en-US,1685095;1685102;,30sorkh
1472136,2024-10-31 02:28:27 -0700,2024-10-31 02:28:27 -0700,Firefox for mac,"<p>Hello friends, some internal accesses are not accesses. I want to reach an internal NAS. It is not possible to access it with firefox. This works easily with safari. My firefox is up to date! </p><p>Please help me. Best regards Jochen Reußner </p>",firefox;browse;,firefox,browse,en-US,"",reussner1
1472132,2024-10-31 01:31:47 -0700,2024-10-31 01:31:47 -0700,Cookie-delete-prompt is very small,"<p>Hi, </p><p>since today my cookie-deletion-prompt is super small and therefore not usable. I cannot resize the window or scroll etc. </p><p>Does anyone else has this problem? I already updated Firefox but that did not help. </p><p>Greetings </p>",firefox;privacy-and-security_1;,firefox,privacy-and-security,en-US,"",dominik.baljan
1472131,2024-10-31 01:27:59 -0700,2024-10-31 01:51:31 -0700,Make text appear in the web page/search bar and NOT in the address bar.,"<p>How do I make it put the text back in the search field and not in the address bar, I despise this new feature. Make it stop. </p>",settings;firefox;,firefox,settings,en-US,1685091;,bcashton
1472128,2024-10-31 00:41:58 -0700,2024-10-31 08:40:45 -0700,YouTube keeps crashing,<p>Hi </p><p>Any help will be appreciated as I have this issue over a year. I thought with the updates it would be fixed but it seems like its only my firefox browser issue. </p><p>Every time I try to view a YouTube video it keeps crashing. I get this message - <strong>Gah. Your tab just crashed. </strong> We can help! Choose Restore This Tab to reload the page.<strong> </strong> YouTube works in other browsers though. </p>,firefox;performance-and-connectivity;,firefox,performance-and-connectivity,en-US,1685084;1685092;1685139;,previsha03
1472122,2024-10-30 23:44:25 -0700,2024-10-30 23:44:25 -0700,How to unfocus url upon adding new tab?,"<p>I'm facing an issue in Firefox where the URL bar automatically gains focus whenever I open a new tab. I’m using my own HTML file as a custom new tab page, and I’ve designed it to load specific content and tools that I frequently use. The problem I’m facing is that when the new tab loads, the URL bar automatically takes focus, which disrupts my workflow. Instead, I want the focus to shift to my custom search bar so I can start searching immediately without additional clicks. How can I accomplish this? </p>",firefox;browse;,firefox,browse,en-US,"",elburritosupremospam
1472121,2024-10-30 23:18:48 -0700,2024-10-30 23:18:48 -0700,Why occurd this problem,<p>Solved my server </p>,firefox;browse;,firefox,browse,en-US,"",hasantareq31289
1472120,2024-10-30 23:17:00 -0700,2024-10-31 15:08:42 -0700,Eşitleme sonrası cihazlarımda yer imleri silindi,"<p>Bilgisayarımda ve android telefonumda firefoxu, heasbımla birlikte aktif olarak kullanıyordum ve eşitleme düzgün çalışıyordu. Ancak bilgisayara format atmak zorunda kaldım. Format sonrası firefoxu kurup hesabımla giriş yaptığımda yer imlerini eşitledi ve yer imi yöneticisinde görebildim. Ancak ne olduysa anlamadım tüm yer imlerim hesabımdan silindi ve eşitleme açık olduğu için telefonumdan da silindi malasef.  Profil kısmında bilgisayarım ve telefonum aktif görünüyor ve sık sık online ve eşitlenmiş görünüyor. Hesaptan çıkıp tekrar giriş yaptığımda sorun çözülmüyor, yüklediğim eklentiler yükleniyor ancak yer imleri geri gelmiyor. Forumlarda söylenen birkaç yolu denedim ama çözüm olmadı. Bu yer imlerinin online bir yedeği yok mudur veya sabit disk üzerinden kurtarmanın başka yolu yokmudur? Yardım bekliyorum. </p>",firefox;backup-recovery-and-sync;,firefox,backup-recovery-and-sync,tr,1685113;1685186;1685187;1685189;1685207;,serhat.vurgun41
1472119,2024-10-30 23:00:26 -0700,2024-10-30 23:00:26 -0700,Open downloaded images do not get focus,"<p>Using latest Firefox version (132.0) on Windows 10. For a few days now, something weird is happening with my Firefox. On browsing the internet with an image on a page and I right-click and save it, it gets properly saved to my downloads folder. Then, on Firefox, when I click on the downloads button and pick the just downloaded image, it opens the app with the image (in my case, irfanview), but the iview window does not get focus, it stays behind the Firefox window. If I click on the iview window on the taskbar, or minimize the Firefox window, I can see the image, the iview window is not minimized or anything. The problem is definitely with Firefox. I went to Windows settings, changed the image handling app to Windows Photos and the same thing happened. I have disabled all Firefox extensions and the issue still surfaces. Same thing if I start a new Firefox private window, so I am clueless as what is causing this. Even more puzzling, the problem only happens with images, PDF files, for example, open fine and Adobe Reader window gets focus and I can see the file right away. Tried to create a new Firefox profile, just in case, and I have the same problem. What changed since this was working fine? Just Firefox and Windows updates, nothing else changed, I didn't touch Firefox settings at all. Any ideas? Thanks for your help. </p>",firefox;browse;,firefox,browse,en-US,"",jcpinto0
1472116,2024-10-30 22:14:23 -0700,2024-10-31 10:27:15 -0700,to show extension on toolbar and activate them,"<p>Dear support team, </p><p>I used to be able to pin my extension on the toolbar of my firefox browser, now I cannot do it. So how do I activate my extension? </p><p>Your sincerely, </p><p>Dexter Cheng </p>",settings;firefox;,firefox,settings,en-US,1685166;,dextercheng
1472115,2024-10-30 21:51:11 -0700,2024-10-30 21:51:11 -0700,a problem with loading the page -,<p>Please advise how to solve the problem with loading the page </p>,firefox;privacy-and-security_1;,firefox,privacy-and-security,en-US,"",rvbgcrhpd4
1472112,2024-10-30 19:24:32 -0700,2024-10-30 19:24:32 -0700,Eduardo cesar,<p>Esta muy enredado </p>,firefox;privacy-and-security_1;,firefox,privacy-and-security,es,"",sm4992161
1472111,2024-10-30 19:22:06 -0700,2024-10-30 19:22:06 -0700,Rupees Symbols overlapping in youtube while using Roboto,<p>While browsing I get this issue with multiple websites where Rupees sign is getting overlapped with other texts. this doesn't happens with chrome or edge browser. </p><p>Using Firefox Desktop for Linux Ubuntu 20.04 Version info 132.0 (64-bit) </p>,firefox;browse;firefox-1320;,firefox,browse,en-US,"",rohan42010
1472107,2024-10-30 18:24:44 -0700,2024-10-30 18:24:44 -0700,"""Enter"" don't execute search in Firefox","<p>There is still an issue with this - I have seen this function (pressing enter) not work in firefox for many many years.... can firefox be updated so pressing enter works? </p><p>jesperbobbel 8/4/23, 2:41 PM </p><p>Today 05-08-2023 when useing Firefox, im no longer able to use enter key to execute a simple google search. But it works fine on Edge. I don't want to be forced to switch to Edge, how to i fix it?? it just happened randomly.  More precisely it's the center of screen search-bar that don't work. I can still use the standard (top) search-bar  </p><p>I have already tried to update it, close it, nothing works. And i would really like to not lose all my settings by uninstalling it. </p>",firefox;browse;firefox-1320;,firefox,browse,en-US,"",pushka
1472106,2024-10-30 18:17:16 -0700,2024-10-30 19:32:40 -0700,URL copying without tracking,<p>Why did Mozzila stop offering the option of copying without site tracking? </p>,firefox;browse;,firefox,browse,en-US,1685076;,cleancoal.bob
1472105,2024-10-30 17:49:21 -0700,2024-10-31 02:20:05 -0700,How to update ?,<p>How to update? </p>,firefox;browse;,firefox,browse,en-US,1685094;,taosun2
1472104,2024-10-30 17:48:52 -0700,2024-10-30 17:48:52 -0700,No Longer Able to Print Emails (Gmail and AOL) or Save Them as PDF (works in other browsers; doesn't work in safemode either),"<p>I've never had this issue before, but as of this evening I am no longer able to Print Emails in Firefox. I can't print them to a physical printer nor save them as PDF. Once I select to print an email the ""Preparing Preview"" page loads, but then get stuck.  </p><p>This happens even in Firefox Safe Mode.  </p><p>This happens with any email client - happens with Gmail and with AOL email accounts.  </p><p>I have no problems printing these same emails in Google Chrome browser.  </p><p>In addition, if I follow Firefox's steps to ""Clear saved print settings"" the problem is solved for only a single printing before reverting to getting stuck again.  </p><p>Any help is greatly appreciated.  I have no idea how to get around this issue. I need to save multiple emails as PDF files and physically print them every day. This issue makes Firefox unusable to me. </p>",firefox;performance-and-connectivity;,firefox,performance-and-connectivity,en-US,"",LK85
1472103,2024-10-30 17:31:17 -0700,2024-10-31 02:39:39 -0700,The 'Search' option has disappeared from the toolbar.  HELP!,<p>The 'Search' option has disappeared from the toolbar.  HELP! </p>,firefox;browse;,firefox,browse,en-US,1685096;,ski_gpsy
1472102,2024-10-30 17:18:05 -0700,2024-10-30 17:27:36 -0700,Opening Tabs By Itself,"<p>Honestly, I feel that this is more of a security question, but this is what happened: I had locked my laptop and walked away for a few hours.  When I came back, Firefox had closed two of my tabs and opened three new ones, 2 of which were youtube videos that were playing music <em>while my computer was locked</em>.  All of the tabs were centered around a gif that I looked up using a chat site's tenor keyboard and never actually sent.  Why in the world did my locked laptop have a bunch of random tabs open?  How do I stop this from happening in the future so I don't have to switch browsers?  I did not like coming home to this at all.  I ran a virus scan, but the only thing on my computer that was off was Firefox itself, so that's why I'm asking.  This has never happened before, but I had to reinstall this browser a couple days ago so I'm wondering if there's some sort of bug or something that came with the new install.  Please ease my mind about this. </p>",firefox;browse;,firefox,browse,en-US,1685074;,loseyourhands
