id,created,updated,title,content,tags,product,topic,locale,answers,creator
1472248,2024-10-31 15:21:57 -0700,2024-10-31 15:21:57 -0700,Videos pause when Firefox isn't the focus,"<p>Videos pause when Firefox isn't the focus, most often I'll have it playing on my second monitor when doing something else. I find this most often happens with streams but not exclusively. I also find that it's more likely to happen when I have a game in the focus on my main monitor. If I have the game open but not in focus I find that this issue happens significantly less (even if that doesn't significantly change the impact the game has on my computer). This is a new issue that appeared sometime within the last month or so and wasn't there for years prior. </p>",firefox;performance-and-connectivity;,firefox,performance-and-connectivity,en-US,"",Gron
1472247,2024-10-31 15:20:15 -0700,2024-10-31 15:20:15 -0700,Disable dialog asking to open a link in application,"<p>Some application registered links to a certain pattern of URLs to itself. Now every time I try to go to such address, a dialog pops up and asks to open that link in that application, but I neither have that application anymore nor am I interested in doing that. How can I make FF forget that application's setting? </p>",firefox;browse;,firefox,browse,en-US,"",pulolane
1472246,2024-10-31 15:18:55 -0700,2024-10-31 15:18:55 -0700,no typing scale to win login,"<p>Hi, w11p laptop. Dev build 133b2 &amp; older (dev builds all).   </p><p><a href=""https://united4respect.app.scaletowin.com/?inviteEmail=psldda%40gmail.com&amp;loginImmediately=true&amp;inviteHasAccount=true"" rel=""nofollow"">https://united4respect.app.scaletowin.com/?inviteEmail=psldda%40gmail.com&amp;loginImmediately=true&amp;inviteHasAccount=true</a> </p><p>This issue is not just for united4respect. I've encountered it in DNC phone banking login as well, it does seem to be a scale to win set of pages. </p><p>Issue:  in order to log in to scale to win web pages, it requires me to type in my email address in the provided field in the link above. What I get:  nothing. Typing does not happen What I did not do: go into troubleshoot mode What I want:  is this an extension issue? Is it a FF Dev build issue? I don't have stable FF here. It's iffy troubleshoot mode fixes, depends on problem. What I did:  use chrome. It worked. I prefer FF. </p><p>Advise, please. Thank you. </p>",firefox;performance-and-connectivity;,firefox,performance-and-connectivity,en-US,"",linusr
1472245,2024-10-31 15:16:20 -0700,2024-10-31 15:16:20 -0700,Inhibits Power Management,"<p>Firefox inhibits power management, causing the screensaver to not activate. This happens when I am not running a video. It happens if I open a website that has video but I do not run the video. If I turn off Firefox the screensaver works. Screensaver is set to activate at 5 minutes. Power Management is set to turn off screen when inactive for 7 minutes. Linuxmint 21.3. and on another computer - Linuxmint 22.0 </p>",settings;firefox;firefox-1320;,firefox,settings,en-US,"",borgward
1472236,2024-10-31 13:57:15 -0700,2024-10-31 13:57:15 -0700,Firefox 132.0 update deleted all of my bookmarks!,"<p>Firefox updated from 131 to 132 and deleted all bookmarks, history and emptied the bookmarkbackups folder.  It displays a message that a Firefox file is open by another application and that some security software can cause this problem.  According to Task Manager there are no other applications running, nor is security software running. (I turned off Windows Defender and rebooted.)  The problem persists.  If I can't recover the 80 or so complex bookmarks, I'll have to try MS Edge browser.  I'm sure that months of history is not recoverable and is lost forever. </p><p>Was this software quality tested prior to distribution?  If so, it wasn't very thorough. </p><p>Why does Firefox delete files and folders during an update?  It would be better to make a backup copies prior to unleashing a destructive update on unsuspecting users. </p><p>Before you ask, no I don't create full backups because a) my laptop is used 12 x 7 weekly, b) a 4TB SSD full backup takes days, not hours depending on the destination and c) a 4TB SSD differential backup takes more than a day.  I've tried both and they are not practical. </p>",firefox;installation-and-updates;,firefox,installation-and-updates,en-US,"",tech64
1472231,2024-10-31 13:48:07 -0700,2024-10-31 13:48:07 -0700,Options for bookmark dialog pop-up window - its too small,"<p>Hello - I love and always recommend firefox, thank you! </p><p>One small aspect that I frequently struggle with is the small size of the bookmarks dialog pop-up window. When adding or editing a bookmark, the window only shows a very small view of the folders which makes it hard to navigate to the folder I want to place the bookmark in. </p><p>I have search extensively for extensions and settings which could provide a larger visualization, so that more of the folder browser could be seen at once, but not found any options. </p><p>Can the mozilla team suggest any work around for this, or submit this as a request to increase the size of the viewable folder tree when adding a bookmark? </p>",settings;firefox;firefox-1320;,firefox,settings,en-US,"",markcmcatee
1472229,2024-10-31 13:35:11 -0700,2024-10-31 13:35:11 -0700,Folders,"<p>How do I create folders and then move all of my bookmarks to the new folders. Please review the screenshot and my question will make more sense.  I highlighted the area in yellow.  </p><p>Thanks, Larry </p>",settings;firefox;,firefox,settings,en-US,"",combs.larry
1472227,2024-10-31 13:19:08 -0700,2024-10-31 13:19:37 -0700,activate microphone,<p>I want activate microphone on Google translate web site </p>,settings;firefox;,firefox,settings,en-US,1685196;,easton11
1472221,2024-10-31 12:51:40 -0700,2024-10-31 12:51:40 -0700,"Problemi sincronizzazione cronologia, scorciatoie e navigazione su alcune pagine","<p>Ripropongo il post in oggetto in quanto sono stato invitato a creare un bug via posta attraverso un link su ""bugzilla"" ma, pur dopo l'accesso, non è possibile trovare nulla che faccia riferimento in modo chiaro ed esplicito sul come inserie un bug! Vengo nuovamente rimandato a questa pagine. In sostanza da un pò di tempo o in seguito ad un aggiornamento di Firefox o in seguito (ma non credo) all'aggiornamento sistema operativo in Ubuntu 24.04.1, non viene più sincronizzata la cronologia così come le scorciatoie se non dopo tempi lunghi. Aprire libero diventa inoltre molto lungo. Si attendono minuto prima di vedere la pagina iniziale. La cronologia dopo diverso tempo appare così come le icone delle scorciatorie che comunque non appaiono tutte ma in parte e comunque senza nome o anteprima. Da questo browser ultimamente continuo ad avere solo guai e mi piacerebbe ritornare ad una versione precedente piuttosto che continuare con questo delirio. Inutile andare a cancellare il profilo o crearne uno nuovo. Nulla! Questo accade anche su altri PC sincronizzati con firefox! Potete aiutarmi? Grazie </p>",firefox;performance-and-connectivity;,firefox,performance-and-connectivity,it,"",rado5
1472219,2024-10-31 12:33:55 -0700,2024-10-31 12:33:55 -0700,Opção: copiar sem rastreamento de site,<p>A opção (copiar sem rastreamento de site) não está mais funcionando. Detectei isso hoje em 31/10/24. Alguém pode ajudar para informar o que aconteceu e quais são as possíveis soluções? </p>,firefox;browse;,firefox,browse,pt-BR,"",alomafd
1472218,2024-10-31 12:33:09 -0700,2024-10-31 12:33:09 -0700,Youtube oynatma listelerinde sorun,"<p>Merhabalar, bir iki gün önce Firefox güncelledi. Bu güncellemeden sonra herhangi bir Youtube kanalının oynatma listesini açtığımda birkaç saniye içinde kendiliğinden sonraki videoya geçiyor. Ayn sorunu bir önceki gün yaşamıştım. Bugün bilgisayarı açıp denediğimde sorun yoktu fakat daha sonra aynı şey olmaya başladı. Başka (Brave, Opera, Edge vs.) tarayıclarda bu sorun olmuyor. İsterseniz sorunu gösteren video gönderebilirim. Kısa zamanda soruma çözüm bulunur diye umuyorum. Saygılarımla. </p>",firefox;browse;,firefox,browse,tr,"",sinandinctr
1472217,2024-10-31 12:32:26 -0700,2024-10-31 12:32:26 -0700,firefox is bijgewerkt tab,"<p>Hi Team, Bij de start van firefox krijg ik keer op keer 2 tabs&nbsp;: Tab 1 is een niet gevraagde melding dat mijn Firefox is bijgewerkt en de uitnodiging 'Download Firefox voor uw smartphone en tablet'. URL&nbsp;: <a href=""https://www.mozilla.org/nl/firefox/132.0/whatsnew/?oldversion=123.0&amp;utm_medium=firefox-desktop&amp;utm_source=update&amp;utm_campaign=132"" rel=""nofollow"">https://www.mozilla.org/nl/firefox/132.0/whatsnew/?oldversion=123.0&amp;utm_medium=firefox-desktop&amp;utm_source=update&amp;utm_campaign=132</a>. Mijn firefox is de laatste versie  132.0 (64-bits) De tweede tab is mijn statpagina In de instellingen/ startpagina staat  aangepaste URL naar mijn lokale htm pagina&nbsp;: file:///C:/Users/janbu/documents/mystartpage.htm </p><p>Hoe kom ik van deze vervelende firefox-tab af? </p><p>Dank op voorhand </p>",firefox;installation-and-updates;,firefox,installation-and-updates,nl,"",jan265
1472215,2024-10-31 12:10:02 -0700,2024-10-31 12:10:02 -0700,how to set about:newtab to close when switching to another tab in firefox,<p>how to set about:newtab to close when switching to another tab in firefox or prevent about:newtab from duplicating. </p>,settings;firefox;,firefox,settings,en-US,"",Pako7787
1472212,2024-10-31 12:03:54 -0700,2024-10-31 12:03:54 -0700,Google search will not work at all. Bing search does work,<p>Google search quit working a couple of weeks ago-. When I try it nothing happens. Bing search works ok. Google search is ver 132.0. Win 11 ver 23H2. Firefox ver 132.0 </p>,firefox;browse;,firefox,browse,en-US,"",artsiii
1472206,2024-10-31 11:28:40 -0700,2024-10-31 11:28:40 -0700,Firefox browser will not load streaming video,"<p>If I visit <a href=""https://www.corvettemuseum.org/live-stream"" rel=""nofollow"">https://www.corvettemuseum.org/live-stream</a> in an attempt to view the multiple live streaming cameras at the National Corvette Museum, my Firefox browser will not open any of the cameras or this page.  However, the page/cameras open just fine using Microsoft Edge and Microsoft Chrome browser and any other browsers that I have tried.  Only Firefox will not open these live cameras.  Can you let me know why?  I contacted the IT department at the Museum to ask why they block the Firefox browser and they said they don't.  Any ideas? </p>",firefox;performance-and-connectivity;,firefox,performance-and-connectivity,en-US,"",jdub22451
1472205,2024-10-31 11:21:57 -0700,2024-10-31 11:25:51 -0700,Search bar shows on Full screen mode,"<p>Every time I try to use full screen mode, either by pressing the <strong>F11</strong> key or using the full screen Tool Bar button, the Search Bar keeps showing. </p>",settings;firefox;,firefox,settings,en-US,1685183;,jlubrano97
1472204,2024-10-31 11:13:50 -0700,2024-10-31 11:13:50 -0700,Firefox desktop updates changing a parameter in LastPass that opens a security hole,"<p>When I install a desktop firefox update, the extension parameter in LastPass, that will let me close LastPass if not used for 30 minutes, is changed.  The option is unclicked and the time removed.  So every update, I have to check the LastPass extension parameters - a total pain. </p><p>If I don't notice, this means lastpass and all my passwords are left open and available to a hacker all the time.  I chose a close time because I want to.  Probably others do, too.   </p><p>Please try to identify and find what in your updates is changing this option and STOP doing that.  Or provide a warning of what parameters need to be checked/will be changed.  Thanks </p>",firefox;privacy-and-security_1;,firefox,privacy-and-security,en-US,"",caffreyc1945
1472203,2024-10-31 11:08:44 -0700,2024-10-31 11:08:44 -0700,Some extensions not syncing?,"<p>Tried to sync my extensions to a new computer, but some of them don't appear. It seems they have been officially taken down by Firefox. I tried to manually transfer the xpi file from one profile to the other but it says ""this addon could not be installed because it appears to be corrupt"". The new computer I'm trying to transfer the extensions is running Ubuntu and the old one Windows 10 (not sure if it was relevant, but anyways).  </p><p>Thanks for your help. </p>",firefox;installation-and-updates;,firefox,installation-and-updates,en-US,"",SomeGuy013
1472201,2024-10-31 10:56:59 -0700,2024-10-31 10:56:59 -0700,Bookmark Recovery,"<p>I recently lost access to my main PC, and with it, all of my bookmarks from that comp's Firefox. Lo and behold, I have every single bookmark available on my phone's Firefox browser. I cannot for the life of me get them on my new PC's browser, however. Sync doesn't do anything, and I am unable to get them to transfer. What am I doing wrong? Thank you in advance for your help! </p>",firefox;backup-recovery-and-sync;,firefox,backup-recovery-and-sync,en-US,"",Zack_Sephiroth
1472199,2024-10-31 10:43:19 -0700,2024-10-31 10:43:19 -0700,Senhas salvas,"<p>Todas as senhas salvas e os favoritos desapareceram do navegador. Tentei seguir os passos indicados pelo Mozilla para recuperá-los, mas não consegui ir até o fim, por não entender com clareza o passo a passo. Gostaria de ajuda para recuperar as senhas. </p>",firefox;backup-recovery-and-sync;,firefox,backup-recovery-and-sync,pt-BR,"",guaclopes
1472191,2024-10-31 09:59:57 -0700,2024-10-31 10:16:47 -0700,E*trade and adobedtm.com,"<p>I have struggled with logging into E*trade using Firefox with no real solution other than clearing cache and cookies each time. After downloading No Script extension, I have identified <a href=""http://adobedtm.com"" rel=""nofollow"">adobedtm.com</a> to be the cause of the eternal white page hangup when trying to access E*Trade. Wanted to make this info available in case a fix can be made without the extension. </p>",firefox;performance-and-connectivity;,firefox,performance-and-connectivity,en-US,1685155;,troybuckler
1472189,2024-10-31 09:58:48 -0700,2024-10-31 11:12:48 -0700,White bordered-buttons in Firefox,"<p>Hello. </p><p>I just got a new PC and installed Firefox right away. For some reason, I now have lines around every single button in my browser - except unselected browsers. </p><p>For example, the tabs in the top of the browser: On my old computer I got an X with no frame, but if I moused over it, a square area would light slightly up. New PC has the same x but with a soft-cornered line around it, completely matching the area that the old one with light up. </p><p>How do I remove the line/frame of the x-buttons and around my bookmarks? See pic included. </p><p>Thanks. </p>",settings;firefox;,firefox,settings,en-US,1685176;,mettelolzjacobsen
1472186,2024-10-31 09:35:07 -0700,2024-10-31 09:35:07 -0700,Can no longer use Firefox on Mac Book Pro.,"<p>After Upgrading to Sequoia operating system on Mac Book Pro, I could not longer open Firefox.  After over an hour on the phone with Apple, the problem could not be resolved.  At Apple's suggestion,  I eliminated Firefox and downloaded a fresh version of Firefox for Mac but I cannot upload it. </p>",firefox;installation-and-updates;,firefox,installation-and-updates,en-US,"",rdh979
1472184,2024-10-31 09:21:35 -0700,2024-10-31 09:21:35 -0700,Auto filling of addresses,"<p>I am getting a very annoying screen that asks if I want to autofill an address.  Since I am part of a registration team that has sometimes several hundred applications to process, it is VERY VERY ANNOYING to be asked if I want to save an address of a person on the application (most of whom I don't even know).  I have ""unchecked"" the ""autofill address"" under Privacy &amp; Security, but I'm still getting the screen.  Any help that can provide would be greatly appreciates. </p>",firefox;privacy-and-security_1;,firefox,privacy-and-security,en-US,"",shantidevi6307
1472183,2024-10-31 09:10:04 -0700,2024-10-31 09:10:04 -0700,Modifiche indesiderate alle impostazioni di Firefox dopo aggiornamento,"<p>Con la presente segnalo una problematica ricorrente relativa al browser Firefox.  </p><p>Normalmente, dopo un aggiornamento, il browser si apre su una pagina di Mozilla contenente le novità della nuova versione. Questa volta, invece, all'apertura del browser dopo l'aggiornamento: - Si è caricata una pagina Microsoft  - Sono stato automaticamente reindirizzato al motore di ricerca Bing (che ho cancellato dalle impostazioni) </p><p>Non è la prima volta che, successivamente a un aggiornamento, succede. Questo evento si verifica con cadenza pressoché annuale. </p><p>Ho già effettuato verifiche preventive utilizzando il software antivirus AVG, che non ha riscontrato alcun problema di malware. </p><p>Chiedo cortesemente un chiarimento in merito a questi reindirizzamenti non richiesti. </p><p>Cordiali saluti, Renzo </p>",firefox;installation-and-updates;,firefox,installation-and-updates,it,"",rzsch
1472179,2024-10-31 08:51:33 -0700,2024-10-31 10:17:58 -0700,Roboform,"<p>I was stupid enough to download Roboform Password manager, but it's just not for me.  I was using Firefox password manager and would like to go back to it but I cannot delete Robo Form.  I've tried disabling Roboform, but that doesn't work.  Do I have to cancel Firefox in order to get rid of this nasty program? </p>",firefox;passwords-and-sign-in;,firefox,passwords-and-sign-in,en-US,1685158;,pyadkins
1472177,2024-10-31 08:48:52 -0700,2024-10-31 08:48:52 -0700,Updates,"<p>wtf is going on with you guys. I have automatic updates turned on, and yet FF is demanding to check (literally 5 minutes after the update) to see if a new update is needed. If you guys can't control your updaters, then perhaps I will switch to google chrome.  </p><p>you have to realize that this issue is causing you to lose 100% of your loyal fans in lieu of a different browser. I'm halfway out the door already. Either fix the issues, or I'm gone. </p>",firefox;installation-and-updates;,firefox,installation-and-updates,en-US,"",rj746
1472175,2024-10-31 08:39:14 -0700,2024-10-31 08:39:14 -0700,Dificuldade para criar chave de recuperação de conta no firefox,"<p>Estou tentando criar uma chave para recuperação da conta, mas sempre recebo a mesma mensagem: ""Você já tentou vezes demais. Tente novamente ⁨em 15 minutos⁩."". Eu espero 15 minutos ou mais, mas recebo a mesma mensagem. Alguma sugestão sobre como devo proceder nesse caso? </p>",firefox;backup-recovery-and-sync;,firefox,backup-recovery-and-sync,pt-BR,"",mpivetta
1472173,2024-10-31 07:48:46 -0700,2024-10-31 07:48:46 -0700,windows taskbar autohide - taskbar not unhiding with Firefox window maximised,<p>To fix this&nbsp;:  Find firefox.exe  (right click the firefox icon on taskbar - if you have one - then right click again on the firefox icon in dialog) </p><p>Firefox.exe &gt; properities &gt; compatibility tab &gt;  change high dpi settings &gt; high dpi setting override &gt; set to system  </p><p>This appears to fix the issue (for me anyway on latest win11 pro) I cant be the only one for whom this was a daily frustration - and couldn't find an answer on this forum. If someone knows another fix please let me know. Cheers. </p>,settings;firefox;,firefox,settings,en-US,"",atriptothemoon
1472171,2024-10-31 07:40:50 -0700,2024-10-31 10:17:56 -0700,"Amazon search by ""Featured"" not changing to ""Low to High price""","<p>For three weeks, whilst using Amazon on the Firefox desktop app, I cannot change Amazon search by ""Featured"" to ""low to high price"" It just changes back to ""Featured"" Works OK on Safari. I'm baffled! Help! Thanks in advance </p>",firefox;browse;,firefox,browse,en-US,1685153;1685157;,vintageb3
1472166,2024-10-31 07:20:00 -0700,2024-10-31 07:20:00 -0700,视频浏览器,<p>加速视频听课 </p>,firefox;browse;,firefox,browse,en-US,"",923486569
1472165,2024-10-31 07:16:43 -0700,2024-10-31 09:41:09 -0700,HEB.com site error,"<p>I have use the <a href=""http://HEB.com"" rel=""nofollow"">HEB.com</a> site almost every day...then today I get this and I have no idea how to correct this. </p><p>Pardon Our Interruption </p><p>As you were browsing something about your browser made us think you were a bot. There are a few reasons this might happen: You're a power user moving through this website with super-human speed. You've disabled cookies in your web browser. A third-party browser plugin, such as Ghostery or NoScript, is preventing JavaScript from running. Additional information is available in this support article. </p><p>To regain access, please make sure that cookies and JavaScript are enabled before reloading the page. </p>",firefox;browse;,firefox,browse,en-US,1685143;,fsmack
1472164,2024-10-31 07:11:47 -0700,2024-10-31 10:21:45 -0700,Restore previous session after a Bios update,"<p>Hello Mozilla users, </p><p>I have a weird question, i want to update my bios for the microcode error, and i wonder if updating my bios will make my ""restore your previous session"" tabs go poof, or that will still stay there? And if it will disappear is there a way to back it up? </p><p>I want to mention that i have the Sync on and i have the Open Tabs selected. </p><p>Thank you, Gabriel </p>",firefox;backup-recovery-and-sync;,firefox,backup-recovery-and-sync,en-US,1685162;,gabycstrike
1472162,2024-10-31 06:46:51 -0700,2024-10-31 07:09:27 -0700,Can I add shortcuts to web sites to search?,<p>Can I add shortcuts to web sites to search like in the image? </p>,firefox;browse;,firefox,browse,en-US,1685132;,yasinkara99
1472161,2024-10-31 06:22:17 -0700,2024-10-31 10:24:28 -0700,Firefox Color Extension resets after restarting computer,"<p>I have been using the Firefox Color extension for a while with no problems. I noticed that in the last few days, when I restart my computer, the theme resets. Specifically, when I first open Firefox, I very briefly see my saved theme but after just a second it reverts back to the default colors/theme.  </p><p>When I go to the Firefox Color page, my theme is still saved and once I click on it, it takes effect until I restart the computer.  </p><p>This only started in the last few days and I know there was a Firefox update (132) as well as a Windows update both in the last week or so.  </p><p>I'm using Windows 10 Home, version 22H2, OS build 19045.5011. </p><p>Is anyone else having this problem or know what might be causing it? </p>",firefox;installation-and-updates;firefox-1320;,firefox,installation-and-updates,en-US,1685163;,office389
1472160,2024-10-31 06:19:40 -0700,2024-10-31 06:19:40 -0700,Problem with bookmarks after reinstalled Firefox,<p>I got an error with firefox. Saw it was not latest. Couldn't uninstall. Installed correct version over old one. Didn't have latest bookmarks. I see Imported bookmarks at top and imported(2) which are probably from when I got my new laptop although I have added many since.. How do I at least get the imported ones into my bookmarks and can I then delete those two files? and how do I get my latest bookmarks back? I went to manage bookmarks and mistakenly selected 10/31 and now I don't see the old ones. Windows 11 </p>,firefox;installation-and-updates;,firefox,installation-and-updates,en-US,"",SueJohnson
1472158,2024-10-31 06:02:53 -0700,2024-10-31 07:38:58 -0700,MOZILLA FUNCTIONALITY ISSUES,"<p>Hi there, since yesterday I'm dealing with numerous functionality issues when I use Mozilla Firefox on my laptop. I've noticed that the last update was on 29/10/2024, so that could be the problem. The problem is that when I browse the tabs are crashing and that happens almost every time I browse after  a few minutes (sometimes seconds) and it happens with many different web sites. Since mozilla is the browser that I use most this is making my life real difficult. Thank you in advance, Sotiris </p>",firefox;browse;,firefox,browse,en-US,1685122;1685127;1685133;,sotiris10
1472156,2024-10-31 05:55:09 -0700,2024-10-31 05:55:09 -0700,URL loading issue,"<p>FF v131.0.3 </p><p>Just started seeing this issue when selecting a news item video in emails from <strong>Haystack News Midweek Report &lt;founders@haystack.tv&gt;.</strong> </p><p>Normally, selecting an item in the email message would open the subject story video in a new tab where I can 'play' the video. Now I get the new tab opened with a blank (white) screen, but noticed something strange in the URL. Here's an example: <a href=""https://notifications.haystack.tv/CL0/https://www.haystack.tv/v/economy-grew-robust-pace-quarter"" rel=""nofollow"">https://notifications.haystack.tv/CL0/https://www.haystack.tv/v/economy-grew-robust-pace-quarter</a>. </p><p><strong><a href=""https://notifications.haystack.tv/CL0/"" rel=""nofollow"">https://notifications.haystack.tv/CL0/</a> </strong>is leading the normal URL address. If I take this part out the video loads and plays as expected. </p><p>Anyone have an idea what caused this? Thx. </p>",firefox;browse;,firefox,browse,en-US,"",Shellback2348
1472155,2024-10-31 05:51:03 -0700,2024-10-31 05:51:03 -0700,Passwords not saving,<p>ERROR </p>,firefox;passwords-and-sign-in;,firefox,passwords-and-sign-in,en-US,"",badinithin
