id,created,updated,title,content,tags,product,topic,locale,answers,creator
1463320,2024-09-12 07:27:01 -0700,2024-09-12 07:27:01 -0700,Access to MyHeritage acct using Firefox,"<p>I am a longterm Firefox user, currently using <strong>version 130.0 on Windows10</strong>.   </p><p>I have been unable to access my MyHeritage account using Firefox, though I have access from other browsers.  The message that appears is ""Access has been temporary disabled Access has been temporarily disabled, this occurred due to suspicious activity. Please try again later"".  This has been going on for several weeks.   </p><p>My Heritage says they have not blocked the account.  This is confirmed by my being able to access from Safari and Chrome. </p><p>This problem has appeared before, but resolved within a week or so.  Not this time.  If it cannot be fixed, I will have to change to another browser for my default.  Any help? </p>",firefox;privacy-and-security_1;,firefox,privacy-and-security,en-US,"",hajones
1463316,2024-09-12 07:19:19 -0700,2024-09-12 07:19:19 -0700,välilehti kaatuu,<p>nostamalla välilehden </p>,firefox;firefox-1300;installation-and-updates;,firefox,installation-and-updates,fi,"",asalecki
1463309,2024-09-12 06:54:49 -0700,2024-09-12 06:54:49 -0700,I can not get into files folder,"<p>I´m in my Folders account, or files account </p>",firefox;accounts;,firefox,accounts,es,"",marvinem55
1463307,2024-09-12 06:39:58 -0700,2024-09-12 06:43:51 -0700,Tastiera su Firefox,"<p>A seguito di un aggiornamento firefox la tastiera, che funziona al di fuori di questo motore di ricerca, inserisce caratteri differenti da quelli premuti sulla tastiera. Ho ripristinato più volte firefox, per infine disintallarlo e reinstallarlo ma nulla, controllando nei forum non ho trovato risposta se non qualche problema con alcune estesioni , ma non può essere il mio caso dato che non ne ho alcuna. Come posso risolvere? </p>",firefox;installation-and-updates;,firefox,installation-and-updates,it,1674093;,bblestagioni
1463304,2024-09-12 06:05:32 -0700,2024-09-12 06:06:06 -0700,Firefox deleted my passwords and account,<p>I have no passwords now because firefox just decided I didn’t need them. And my account too. </p>,firefox;accounts;,firefox,accounts,en-US,1674084;,ohkunuk330
1463303,2024-09-12 05:55:02 -0700,2024-09-12 05:55:02 -0700,BARRA DE TÍTULO,"<p>Olá. </p><p>Não estou encontrando a configuração de barra de título para escondê-la. No Chromium, eu achei essa configuração fácil, mas no FF (FireFox) não. </p><p>Isso me passou desapercebido ou, de fato, ela não existe no FF? Estou usando o FF para Linux Mint. </p><p>Obrigado </p>",settings;firefox;,firefox,settings,pt-BR,"",cacaedu
1463302,2024-09-12 05:53:23 -0700,2024-09-12 05:53:23 -0700,Firefox não salva as preferências,"<p>Uso o Firefox no meu celular, computador pessoal e no computador do trabalho. Todos com a sincronização ativada, porém no do trabalho toda vez que reinicia a máquina é como se eu não tivesse configurado nada, as extensões estão lá mas desativadas, as preferências da barra de ferramentas voltam ao padrão de fábrica e abre a tela de informações de privacidade do Mozilla. </p>",settings;firefox;firefox-1300;,firefox,settings,pt-BR,"",iuripicchi
1463300,2024-09-12 05:45:31 -0700,2024-09-12 05:45:31 -0700,Expected redirect cookie to exist,"<p>hello, im trying to login to my ""Valorant account"" through Riot Games website, and i get this error: <strong>Expected redirect cookie to exist</strong> i have attached screenshot as rreference. Please i need solution for this asap. Thanks </p>",firefox;browse;,firefox,browse,en-US,"",egzonmehmedi38
1463299,2024-09-12 05:30:25 -0700,2024-09-12 05:30:25 -0700,Video not working,<p>Video not working </p><p>MacOS: 14.6.1 Firefox: 130.0 (64-bit) </p>,firefox;performance-and-connectivity;,firefox,performance-and-connectivity,en-US,"",tsnight
1463298,2024-09-12 05:26:54 -0700,2024-09-12 05:50:11 -0700,Groene bolletje met getal in Firefox logo,<p>Wat betekent het groene bolletje met een getal erin in het Firefox logo? </p>,settings;firefox;needsinfo;,firefox,settings,nl,1674082;,ron.franken
1463296,2024-09-12 04:53:49 -0700,2024-09-12 04:53:49 -0700,Play Store,<p>MD.Tansin Rana </p>,firefox;browse;,firefox,browse,en-US,"",ranatanvir2006
1463294,2024-09-12 04:15:25 -0700,2024-09-12 04:15:25 -0700,Browser does not work with all websites,<p>I am finding an increasing number of websites which do not work correctly with Firefox. What are you doing to resolve this? </p>,firefox;performance-and-connectivity;,firefox,performance-and-connectivity,en-US,"",steveand25
1463292,2024-09-12 04:04:55 -0700,2024-09-12 05:13:11 -0700,Troubles with Video playback on you tube,"<p>I use Libre <a href=""http://Wolf.In"" rel=""nofollow"">Wolf.In</a> the last week I started having problems with video playback on YouTube.The video is constantly interrupted or the image freezes, but the sound continues to play.This is not always the case, but about half of the time.I have tried many options, including disabling plugins and changing the resolution, but nothing helped.I have no problems with the speed of the connection.When I changed the browser (to Opera), then the problem with playback immediately <a href=""http://disappeared.So"" rel=""nofollow"">disappeared.So</a> the problem is in the browser.Tell me how to solve it. </p>",firefox;needsinfo;browse;,firefox,browse,en-US,1674078;,hamuut
1463290,2024-09-12 03:57:44 -0700,2024-09-12 03:57:44 -0700,When i open my site in Mozila i get error meesage like,"<p>Secure Connection Failed </p><p>An error occurred during a connection to <a href=""http://www.zealousys.com"" rel=""nofollow"">www.zealousys.com</a>. Peer’s Certificate has been revoked. </p><p>Error code: SEC_ERROR_REVOKED_CERTIFICATE </p><pre>   The page you are trying to view cannot be shown because the authenticity of the received data could not be verified.    Please contact the website owners to inform them of this problem. </pre>",firefox;performance-and-connectivity;,firefox,performance-and-connectivity,en-US,"",marketing108
1463289,2024-09-12 03:31:45 -0700,2024-09-12 03:31:45 -0700,windows security pin verify keeps popping up when ever i try to login to anything,<p>how do i turn this off. im the only person that uses this computer and this is very annoying. </p><p>thank you for any help you can give me. </p>,firefox;passwords-and-sign-in;,firefox,passwords-and-sign-in,en-US,"",vinegaryocean0
1463287,2024-09-12 03:21:54 -0700,2024-09-12 03:22:24 -0700,Upload files,<p>I will do to upload my documents </p>,firefox;browse;,firefox,browse,en-US,1674065;,harshborkar22
1463286,2024-09-12 03:17:44 -0700,2024-09-12 03:17:44 -0700,Firefox does not create defaults/pref folder on MacOS,"<p>Starting with version 126.0.0, firefox for MacOS stopped creating a defaults/pref folder during installation. If you create it yourself and add the autoconfig.js there, and add firefox.cfg to the root, firefox reads them perfectly and applies the settings. However, if you create folders before the first launch of the browser after installation, the file integrity check fails (see screenshot). </p><p>I couldn't find any information about why the folders stopped being created. Maybe someone knows? </p><p>The newest article regarding the configuration seems to be this one: </p><p><a href=""https://support.mozilla.org/en-US/kb/customizing-firefox-using-autoconfig"" rel=""nofollow"">https://support.mozilla.org/en-US/kb/customizing-firefox-using-autoconfig</a> </p>",settings;firefox;,firefox,settings,en-US,"",maxmtrushin
1463283,2024-09-12 02:55:11 -0700,2024-09-12 02:55:11 -0700,Facebook Group Calls Problem,"<p>Whenever I use FaceBook group calls, most of time I am not able to hear other FB users but they can hear me. This typically happens for the 2nd group call in login session. the way I am trying to resolve currently is log off, clear data and history in Firefox browser and then re-login and there is no problem. I do not know why this problem occurs only in Firefox, I do not see this issue in other browsers such as Chrome or Edge. can you please identify the cause and resolve it, it is very irritating. or let me know the solution for this issue. </p>",firefox;performance-and-connectivity;,firefox,performance-and-connectivity,en-US,"",bhushan.mnkh
1463281,2024-09-12 01:53:15 -0700,2024-09-12 01:53:15 -0700,Zaklikávání na Srealitách ve vyhledávání,"<p>Dobrý den, prosím o radu. Na stránkách <a href=""http://sreality.cz"" rel=""nofollow"">sreality.cz</a> mi nejdou označovat kolonky pro zakliknutí (např. výběr kraje). V jiném prohlížeči mi to funguje. Je potřeba v Firefoxu něco zapnout? Děkuji J. </p>",firefox;browse;,firefox,browse,cs,"",jradous
1463274,2024-09-12 00:36:47 -0700,2024-09-12 00:36:47 -0700,Exporting a certificate,"<p>Hi! I have a new laptop and want to export a certificate I had installed in my previous laptop. When trying to do so, I'm asked to choose a certificate backup password which I need to enter twice to validate. Once I do it, this message comes up, ""Failed to create the PKCS #12 backup file for unknown reasons"". I've tried several times with different passwords but the same issue remains. Can you please help me out with this? Many thanks! Alex </p>",firefox;privacy-and-security_1;,firefox,privacy-and-security,en-US,"",artaboas
1463272,2024-09-12 00:17:00 -0700,2024-09-12 00:17:00 -0700,Paypal not processing,"<p>Hello, for two months now I've been unable to use Paypal to buy anything on Firefox. Nothing I have done has changed and it's gone from a nuisance to me considering new browsers. I need to be able to pay for things.  </p><p>I've attached an image to show where it always freezes. </p>",firefox;performance-and-connectivity;,firefox,performance-and-connectivity,en-US,"",madeline.gross
1463270,2024-09-11 23:47:30 -0700,2024-09-11 23:47:30 -0700,segnalibro preferiti,"<p>ho attivato la sincronizzazione firefox perchè ho altri PC cn firefox e invece si è attivata quella di google e mi ha distrutto i segnalibri preferiti scaricandomi 4 liste di quelli che in 20 anni avevo accumulato su google. Come ripristinare&nbsp;? se nonè possibile come cancellare in blocco centinaia di preferiti inutili? ho cercato nelle impostzioni ""gestione preferiti"" senza risultato.Grazie </p>",firefox;firefox-1300;browse;,firefox,browse,it,"",alibertocaforio
1463267,2024-09-11 23:37:22 -0700,2024-09-12 00:08:54 -0700,PDFPrinting,"<p>I cannot print anything on my computer since this PDF Print appeared. Everything was going along as per normal, now this. How do I get it back to the ""normal"" situation for me. Receive an email, hit the print button and lo and behold a printed sheet, etc. It is driving me to distraction. I have been using FireFox since whenever, no problems. I'm not too computer savvy but enjoy its use like anyone else. Something I will be able to follow and implement. I have seen a delete article but couldn't get it to do anything for. I just want to delete it.  I cannot even print a normal letter I have written. Than kyou most sincerelyTimothy Barclay teejay1949@gmail.com </p>",firefox;installation-and-updates;,firefox,installation-and-updates,en-US,1674043;,teejay1949
1463265,2024-09-11 23:23:59 -0700,2024-09-11 23:23:59 -0700,ivars,<p>for all </p>,firefox;browse;,firefox,browse,en-US,"",vilks
1463264,2024-09-11 23:20:39 -0700,2024-09-11 23:20:39 -0700,Hourglass of death after updates,"<p>Currently running Version 130, x64 on Windows 10, but this is not the first time this happens. After update, all tabs of the previous saved sessions display a hourglass icon and nothing gets loaded. Same thing happens if you open a new tab to load a new website. After a kajillion restarts this seems to fix itself, but it is as annoying as it gets. </p>",firefox;browse;,firefox,browse,en-US,"",andgold
1463263,2024-09-11 23:02:38 -0700,2024-09-11 23:02:38 -0700,Ing to you and my self and others,<p>Yes sir I am available working on the way </p>,firefox;accounts;,firefox,accounts,en-US,"",kashyamanoj88670
1463262,2024-09-11 23:00:21 -0700,2024-09-11 23:00:21 -0700,Movie,<p>Yes sir I am available on this movie see </p>,firefox;browse;,firefox,browse,en-US,"",kashyamanoj88670
1463260,2024-09-11 22:50:03 -0700,2024-09-11 22:50:03 -0700,phoneinfo,<p>phoneinfo </p>,firefox;installation-and-updates;,firefox,installation-and-updates,en-US,"",sahanajmallick24
1463259,2024-09-11 22:44:20 -0700,2024-09-11 22:44:20 -0700,fluncy and accuracy,<p><strong>bold text</strong>ah ok </p>,firefox;browse;,firefox,browse,en-US,"",drprakashthapa200
1463256,2024-09-11 22:32:06 -0700,2024-09-11 22:32:06 -0700,Reactivate account - Deleted by mistake,"<p>Hi, My mozilla account (swetank000@gmaIl.com) is deleted by mistakes or might be hacked.  Also the pocket account got deleted.  </p><p>Please restore my account so that I can secure it.  </p><p>Regards Swetank Singh </p>",firefox;accounts;,firefox,accounts,en-US,"",swetank000
1463253,2024-09-11 21:11:28 -0700,2024-09-12 01:46:26 -0700,Denied access when trying to access Comcast email,"<p>Today I keep on getting messages like this when trying to sign into my Comcast email.  I've never had this issue before signing in: </p><p>You don't have permission to access ""<a href=""http://login.xfinity.com/login"" rel=""nofollow"">http://login.xfinity.com/login</a>"" on this server. </p><p>Reference #18.d1b03b17.1726113962.42f055dc </p><p><a href=""https://errors.edgesuite.net/18.d1b03b17.1726113962.42f055dc"" rel=""nofollow"">https://errors.edgesuite.net/18.d1b03b17.1726113962.42f055dc</a> </p>",firefox;needsinfo;,firefox,passwords-and-sign-in,en-US,1674049;,alan52dp
1463250,2024-09-11 20:31:49 -0700,2024-09-11 20:31:49 -0700,brower,<p><strong>sign me into firefox </strong> <strong></strong> </p>,firefox;passwords-and-sign-in;,firefox,passwords-and-sign-in,en-US,"",Dadrocks1235
1463248,2024-09-11 20:15:52 -0700,2024-09-11 20:15:52 -0700,Search for NOT term,"<p>Hi, </p><p>I would like to search for ""CV."" in a page. However in the page there are plenty of ""CV. xxxxx"" </p><p>So question is how could I search for the term NOT ""CV. xxxxx"" and that would yield only ""CV."" </p><p><br> Thank you Henry </p>",firefox;browse;,firefox,browse,en-US,"",gnulab
1463246,2024-09-11 19:33:16 -0700,2024-09-11 19:33:16 -0700,codeing in thr c++,<p>code not work </p>,firefox;browse;,firefox,browse,en-US,"",ghdyrbdallh53
1463240,2024-09-11 18:29:51 -0700,2024-09-11 19:14:27 -0700,"Firefox starting as normal, operating as normal for ninety seconds to two or three minutes, then shuts down","<p>Last night I was using Firefox normally when it abruptly closed all windows and turned off. I turned it back on again. It told me it could not restore the tabs, so I started a new session. Firefox behaved normally, went to the sites I asked, and in approximately two minutes, did the same thing.  Simply closed as if I had closed it.  Turn it back on. It says it cannot restore previous tabs.  It will come on, go to requested site, operate normally for a very short time, then close without warning. Made sure I had the latest version of Firefox. I do. Have tried hard restart, turn computer off, turn it back on. Same.  Have tried uninstalling and reinstalling Firefox. Behaves the same on reinstall. Says it cannot restore tabs. Start new session. Brief period of normal behavior, then all windows close as if turned off.  Does not matter what the site is I go to. </p><p>Please note that I am an older autistic person who is very computer illiterate and is extremely distressed by these events. Please bear with me and please be patient with me. </p>",firefox;windows-10;performance-and-connectivity;,firefox,performance-and-connectivity,en-US,1674017;,godunderfoot
1463237,2024-09-11 17:46:32 -0700,2024-09-11 18:09:25 -0700,.....,<p>..... </p>,firefox;backup-recovery-and-sync;,firefox,backup-recovery-and-sync,en-US,"",user336766586046238315507192374140326591032
1463236,2024-09-11 17:29:11 -0700,2024-09-11 17:29:11 -0700,facebook sign in,<p>It seems like when ever I make a mistake signing in to facebook firefox lists that mistake as a sign in or it mines other emails from other activity. How can i  get rid of all of the other user ids from my sign in? BTW I am not very savvy with computers </p>,firefox;passwords-and-sign-in;,firefox,passwords-and-sign-in,en-US,"",damstraightostate
