id,created,updated,title,content,tags,product,topic,locale,answers,creator
1464060,2024-09-17 07:55:05 -0700,2024-09-17 09:43:27 -0700,Password Manager,"<p>I am trying to add a password to the password manager for a specific URL like <a href=""https://example.com/page"" rel=""nofollow"">https://example.com/page</a>. However after I save the password it save it to the address <a href=""https://example.com"" rel=""nofollow"">https://example.com</a> and removes /page. Is there a way to change this? </p>",firefox;privacy-and-security_1;,firefox,privacy-and-security,en-US,1675128;,poehman
1464058,2024-09-17 07:53:27 -0700,2024-09-17 08:43:35 -0700,I Lost My Bookmarks,<p>I just received an upgrade and my bookmarks are gone.  All of them! </p><p>How do I recover my bookmarks without starting over? </p><p>Thank you! </p><p>Wesley </p>,settings;firefox;,firefox,settings,en-US,1675106;1675114;,wesconnie55
1464057,2024-09-17 07:51:03 -0700,2024-09-17 08:43:08 -0700,Feature Request: Custom images for bookmarks!,<p>I have multiple bookmarks on the same website and it would be nice to be able to differentiate them at a glance. </p>,firefox;browse;,firefox,browse,en-US,1675113;,cernycole
1464056,2024-09-17 07:50:49 -0700,2024-09-17 07:50:49 -0700,how can I use mij iCloud passwords in Firefox,<p>how can I use mij iCloud passwords in Firefox </p>,firefox;passwords-and-sign-in;,firefox,passwords-and-sign-in,en-US,"",paulmekking
1464054,2024-09-17 07:47:09 -0700,2024-09-17 09:25:44 -0700,Have stopped getting some mails recently,"<p>I am not getting some mails and my complaint has resulted in the following reply&nbsp;: - using a VPN/anonymous proxy; - some settings on your device/browser flagged for being inconsistent with your country of residence; - your IP address being flagged as a threat by the IP databases we use. </p><p>While we regret the inconvenience caused, our system is designed in such a manner that it will not generally allow these attempts, as these flags are associated with a high possibility of fraud. In order for you to be able to properly use your Toluna account, we strongly recommend that you review your internet connection, as well as your device/browser's settings, and ensure that all details match your country of residence so this will not happen going forward. </p><p>You can check the details of your connection at any time via any free IP checking tools that can be found online. Is there something wrong with my browser? </p>",firefox;windows10;accounts;,firefox,accounts,en-US,1675116;1675125;,narnal
1464052,2024-09-17 07:31:36 -0700,2024-09-17 10:52:18 -0700,"Google default account not ""defaulting""","<p>How do I change the google account that Firefox visits first? Context: I have my work email set up for sync, but whenever I go to any google specific site or tool (Calendar, gmail, docs, etc.) it defaults to my personal account instead of my work account. </p>",firefox;accounts;,firefox,accounts,en-US,1675117;1675137;,dave422
1464050,2024-09-17 07:27:06 -0700,2024-09-17 09:23:06 -0700,How to fix my firefox after refresh?,"<p>I opened my Firefox this morning just to be greated with a pop-up that said something like ""do you want to refresh Firefox"" I clicked no but i guess it didn't care because it refreshed it anyways. Post-refresh my Firefox was blank with none of the settings and custom css it had before. I then tried to fix it by pasting all of the contents from my 'Old Firefox Data' file into where they would be in this new one. Long story short, I tried to open Firefox and all that comes up is ""Profile Missing, Your Firefox profile cannot be loaded. It is missing or inaccessable"". I just want everything I had before how do I put it in? I've attached screenshots of the error, Old Firefox Data, and Profiles. I'd be very thankful if anyone can help because i just really want all of my data back </p>",firefox;backup-recovery-and-sync;,firefox,backup-recovery-and-sync,en-US,1675115;1675124;,Sonicjoe37
1464047,2024-09-17 06:25:40 -0700,2024-09-17 10:59:38 -0700,Bring back Reopen Closed Tab hotkey,"<p>Right now there is an annoying hybrid Reopen Closed Window or Tab feature on the Ctrl+Shift+T hotkey. But Reopen Closed Window already had the Ctrl+Shift+N hotkey, even prior to this change. I can't find anywhere to change this behavior. </p>",firefox;browse;,firefox,browse,en-US,1675110;1675138;,xiazee
1464046,2024-09-17 06:20:23 -0700,2024-09-17 06:20:23 -0700,SITE NÃO ABRE,"<p>Se isso não ajudar, contate sua equipe de suporte e inclua estes detalhes técnicos: ID de Correlação: b92451a1-00cb-6000-89cf-7fde3cb799eb Data e Hora: 17/09/2024 06:14:29 URL: <a href=""https://uniasselvi01.sharepoint.com/sites/LeoWeb"" rel=""nofollow"">https://uniasselvi01.sharepoint.com/sites/LeoWeb</a> Usuário: dida_spfc13@hotmail.com Tipo de Problema: O usuário não está no diretório. </p>",firefox;performance-and-connectivity;,firefox,performance-and-connectivity,pt-BR,"",santoseliorsantos
1464042,2024-09-17 05:45:47 -0700,2024-09-17 07:12:17 -0700,Adobe Express,"<p>Adobe Express vraagt machtiging voor een klankopname, hoe kan ik die instellen in Mozille Firefox? </p>",firefox;browse;,firefox,browse,nl,1675095;,Lma21
1464041,2024-09-17 05:42:19 -0700,2024-09-17 05:43:56 -0700,session restore not working,"<p>I've read articles here about session restore, and in the menus I think I've made the right choices, but cannot get session restore to work. </p>",firefox;firefox-1300;performance-and-connectivity;,firefox,performance-and-connectivity,en-US,1675081;,tkaufman1
1464040,2024-09-17 05:29:27 -0700,2024-09-17 05:30:45 -0700,How can I enhance privacy and security while using Firefox on Android?,"<p>Hello everyone, I’ve been using Firefox for Android and I’m curious about the best ways to ensure my online privacy and security. I’ve heard about different settings and extensions, but I’m not sure which ones are most effective. Can anyone guide me on how to configure Firefox for maximum privacy and security? Also, are there any additional steps I should take to protect my data while browsing? Any recommendations or tips would be appreciated. Thank you! </p>",firefox;privacy-and-security_1;needsinfo;,firefox,privacy-and-security,en-US,1675079;,merijan876969
1464039,2024-09-17 05:13:48 -0700,2024-09-17 05:16:09 -0700,Chrome Remote Desktop stops working in the middle of summer 2024.,"<p>Greeting Mozilla Community. </p><p>Chrome Remote Desktop stops working in the middle of summer 2024.  It neither works in ESR nor the Current channel, private or not private mode or Mobile Firefox. </p><p>Could I kindly ask you to help fix that?  Or better ask Google back Firefox as a supported browser? </p>",firefox;browse;,firefox,browse,en-US,"",WinklerCanvas
1464038,2024-09-17 05:12:12 -0700,2024-09-17 09:08:57 -0700,İNTERNET BANKACILIĞI GÜVENLİK KODU,"<p>Merhabalar, </p><p>vakıf katılım bankası internet bankacılığına girişteki güvenlik kodu resmi gelmiyor, başka bankalarda bu sorunu yaşamıyorum. konu ile ilgili desteklerinizi rica ederim. </p><p><br> Teşekkürler, Yılmaz KALÇIN </p>",firefox;browse;,firefox,browse,tr,1675120;,yilmazkalcin
1464037,2024-09-17 05:10:13 -0700,2024-09-17 09:18:21 -0700,Gmail randomly refuses to accept cookies,"<p>I have multiple gmail accounts and I don't always have them open on every tab. For some reason, every few days at random, whenever I swap to a different gmail account I keep receiving the message. </p><p><br> ""The page isn’t redirecting properly </p><p>An error occurred during a connection to <a href=""http://mail.google.com"" rel=""nofollow"">mail.google.com</a>. </p><p>This problem can sometimes be caused by disabling or refusing to accept cookies."" </p><p><br> I double checked if my cookies are blocked, and they werent. I am currently on standard tracking protection. I have tried removing my cookies and history and they work temporarily, but then the issue happens again after a few days.  </p><p>I don't think my extensions are causing the problem either unless Adnauseum is changing something? I don't have any scripts running from Tampermonkey either.  </p><p>Please help, this is getting irritating having to delete my history and cookies over and over again. </p>",firefox;passwords-and-sign-in;,firefox,passwords-and-sign-in,en-US,1675084;1675123;,ethan.yuric
1464034,2024-09-17 04:58:35 -0700,2024-09-17 04:58:35 -0700,default tab when switching between open apps,"<p>This only happens when i switch back to FF desktop on win11. FF desktop on win 11 FF running and is not in focus when i hit Windows + 2 (2 is my setting for FF on the task bar), FF comes to the foreground in focus BUT IT ALSO SWITCHES TO TAB1.  I cant get it to stay on the tab i was on last. I don't see the setting for that. Again this only happens with i use the WIN + taskbar digit that represents FF. Nic </p>",settings;firefox;,firefox,settings,en-US,"",racernic
1464032,2024-09-17 04:51:58 -0700,2024-09-17 04:51:58 -0700,ad block,<p>I am not able to unblock ads on NBC website </p>,firefox;privacy-and-security_1;,firefox,privacy-and-security,en-US,"",CarolynKranchalk
1464031,2024-09-17 04:23:19 -0700,2024-09-17 04:23:19 -0700,Remove ads by default,"<p>On fresh Firefox install that I setup using [<a href=""https://mozilla.github.io/policy-templates/#preferences|preferences"" rel=""nofollow"">https://mozilla.github.io/policy-temp.../#preferences|preferences</a>] Which is option to disable those default ads? </p><p>Namely: twitter, youtube, facebook, Wikipedia and reddit. </p><p>I know I can do it manually with 5 x 2 clicks but that's 10 click every time I install browser.  </p><p>Image showing YouTube as example what I want to get rid of. </p>",firefox;installation-and-updates;,firefox,installation-and-updates,en-US,"",rafal9ck
1464027,2024-09-17 04:02:22 -0700,2024-09-17 04:02:22 -0700,Cottbus,<p><strong>1 safa </strong> <strong></strong> </p>,settings;firefox;,firefox,settings,tr,"",azimiimran3
1464025,2024-09-17 03:53:39 -0700,2024-09-17 07:23:40 -0700,Non riesco ad accedere a Banca Intesa Sanpaolo sul mio c/c on line.,"<p>Perché non riesco ad accedere a Banca Intesa Sanpaolo sul mio c/c on line?  Accedo al sito, inserisco le mie credenziali, faccio la verifica con il codice sul telefonino e, dopo poco, mi appare la scritta che c'è un errore e quindi riproivare più tardi o contattare l'assistenza della banca. Ho ocontattato l'assistenza e mi dicono che è tutto ok. Mi hanno fato provare con Google Chrome e funziona. Grazie per la vostra risposta ed a presto. </p>",firefox;needsinfo;browse;,firefox,browse,it,1675097;,studio.schillaci
1464021,2024-09-17 03:28:04 -0700,2024-09-17 03:28:04 -0700,bookmark syncing issue,<p>I use firefox on my windows laptop and on my ipad. I had set up bookmark syncing so that I could access the same bookmarks on both my laptop and ipad. At first it worked! But today I added some new folders and bookmarks and despite checking that the syncing had happened the new bookmarks added on my ipad are not visible on my laptop - what can I do to fix this? </p>,firefox;backup-recovery-and-sync;,firefox,backup-recovery-and-sync,en-US,"",ceebarthram+teach
1464020,2024-09-17 03:06:54 -0700,2024-09-17 15:32:37 -0700,Multiple bookmarks in different folders?,"<p>Hi.  I have various folders, for different businesses..  And when browsing I need to save a certain website for both businesses, like a trade show for example.  But a bookmark can only be saved in one folder.  I refuse to belive this is a thing in 2024.. Is there a solution? A hack? I know if I click on a different page of a webiste it will save, but some pages only have one page url.. I thought maybe changing the name of the bookmark might work but it doesn't. Any help appreciated. </p>",firefox;browse;,firefox,browse,en-US,1675061;1675105;1675164;1675166;1675188;1675194;,hamster540
1464014,2024-09-17 02:46:38 -0700,2024-09-17 04:21:50 -0700,Firefox is brokewn after updating to macOS 15,"<p>Yesterday I have updated tp macOS 15. Sine then I have trupuble displaying any webpages in Firefox 130. Th econnection just times out. Any other browser such as Brave, Safari, Home, Edge are still working as before teh update. How to fix this please? </p>",firefox;macos;firefox-1300;performance-and-connectivity;,firefox,performance-and-connectivity,en-US,1675070;1675071;1675074;,n5k9kdntmw
1464012,2024-09-17 02:38:18 -0700,2024-09-17 02:38:18 -0700,firefox does not load on a mac unless I totally reboot ...any ideas,<p>Once PC is running Firefox stalls and will not load or fails to repond unless I totally reboot on Mac Mini ...yet works fine on Mac Pro notebook&nbsp;? </p>,mac-os;firefox;firefox-1300;installation-and-updates;,firefox,installation-and-updates,en-US,"",uh2239
1464011,2024-09-17 02:34:49 -0700,2024-09-17 07:24:36 -0700,Caratteri non rischiesti,"<p>Buongiorno. Chiedo scusa per la mia incapacità nel gestire queste operazioni ma è la seconda volta che ripropongo questo malfunzionamento. La prima erroneamente ho dato per risolto il tutto. Non è cosi il problema si ripresenta e quindi sono ancora chiedervi l'aiuto. Usando Thunderbird quando scrivo una nuova mail o rispondo ad una mail, si presentano caratteri non richiesti (allego uno screen-shot). Non ho una firma particolare, ho un solo componente aggiuntivo che è Web Translate e compaiono automaticamente senza nessuna azione da parte mia. Anche nella modalità risoluzione problemi succede la stessa cosa. Vi chiedo di aiutarmi. Uso Windows 10  Grazie </p>",settings;firefox;firefox-1300;,firefox,settings,it,1675098;,giancarlo.biasi
1464010,2024-09-17 02:25:48 -0700,2024-09-17 02:25:48 -0700,security.tls.insecure_fallback_hosts keeps being reset (not by me),"<p>I need to use one website that has an out of date certificate. I found out about adding the hostname to security.tls.insecure_fallback_hosts in about:config.  </p><p>However, Firefox keeps clearing that setting when I'm not looking, sometimes in the same session! How can I make it persist? </p>",settings;firefox;,firefox,settings,en-US,"",adam186
1464005,2024-09-17 01:46:27 -0700,2024-09-17 01:46:27 -0700,Firefox does not remember approved websites,<p>There are websites that I go on that require verification codes. After entering the code I check the  box to remember this device. So then the next time I go on the website I would not have to deal with a verification code. I've used Firefox for years and had no problem with the browser not remembering an approved website  but now I'm experiencing this problem. </p>,firefox;privacy-and-security_1;,firefox,privacy-and-security,en-US,"",ra4356-direct
1464003,2024-09-17 01:33:50 -0700,2024-09-17 01:33:50 -0700,text colour,<p>how to change text colour# # Numbered list item </p>,firefox;performance-and-connectivity;,firefox,performance-and-connectivity,en-US,"",dave.jenkins98
1464002,2024-09-17 01:28:14 -0700,2024-09-17 01:29:40 -0700,Updating Firefox to the latest version,<p>Updating Firefox to the latest version </p>,firefox;needsinfo;installation-and-updates;,firefox,installation-and-updates,en-US,1675045;,ttu3bi
1464001,2024-09-17 01:21:40 -0700,2024-09-17 07:26:13 -0700,rimozione di una immagine del politico Matteo Renzi,<p>Quando clicco sulla f di fb ( in alto a sinistra dove c'è l'indicazione https) per entrare direttamente in fb appare per pochi secondi l'immagine dell'Ex premier Matteo Renzi. Ho tentato di toglierla  ma non riesco anche perchè appare per pochi secondi. </p><pre>mi aiutate a toglierla per favore  </pre> <p>Cordiali saluti </p>,firefox;browse;,firefox,browse,it,1675099;,salvatoreantonio.palermo
1464000,2024-09-17 01:09:54 -0700,2024-09-17 01:09:54 -0700,BT email,"<p>I can log in to my BT emails using Firefox, &amp; they appear on the screen, but are 'greyed out' &amp; I can't read them or do anything with them. To read them, I have to use Microsoft Edge as my browser. </p>",firefox;passwords-and-sign-in;,firefox,passwords-and-sign-in,en-US,"",colin.bryant435
1463998,2024-09-17 00:52:14 -0700,2024-09-17 00:52:14 -0700,"Does Firefox v115.15.0esr retain cookies from ""legitimate interest"" companies please?","<p>I'm using Firefox v115.15.0esr because I'm using Windows 7. I'm in the UK. Every now and then I get to a website which asks about cookies permissions and then proceeds to give me a huge list, hundreds of alleged companies which have a ""legitimate interest"" in me having their cookie, which I have to individually search through and deselect. Is there a way around this please? Does firefox ignore/prevent the cookies under the ""Enhanced Tracking Protection"" policy? or by accepting them do I still get them? I have ticked ""Delete cookies and site data when Firefox is closed"" so am I correct to assume that all cookies that make it to my PC get erased anyway when I close the browser? </p>",firefox;privacy-and-security_1;,firefox,privacy-and-security,en-US,"",andy24
1463996,2024-09-17 00:24:37 -0700,2024-09-17 00:24:37 -0700,Unreponsive Firefox send tab to device,"<p>I have a situation where I constantly have to send tabs from mobile Firefox to desktop Firefox. So I use <strong>Send tab to device</strong> feature. But when sending, manually clicking on the <strong>Synchronise now</strong> button in the <strong>Account</strong> menu of the <strong>toolbar</strong> of the receiving device is often needed, or else it would take a while for the tabs to be received. But I find that annoying and unintuitive. </p><p>Is there a solution for it? For instance, syncing Firefox devices more often, maybe just for the sending tabs feature because <strong>sync-now</strong> also syncs history, and bookmarks. </p>",firefox;backup-recovery-and-sync;,firefox,backup-recovery-and-sync,en-US,"",naykuku228
1463993,2024-09-17 00:18:17 -0700,2024-09-17 00:18:17 -0700,Mozilla Firefox Keeps Crashing on My Intel Laptop – Need Help!,"<p>Hey everyone, </p><p>I'm having a frustrating issue with Mozilla Firefox on my Intel-powered laptop. Every time I try to use Firefox, it crashes randomly, especially when I'm loading multiple tabs or watching videos. I'm running the latest version of Firefox, Version 130.0 and my laptop is using an Intel laptop <a href=""https://www.lenovo.com/au/en/faqs/intel/best-intel-processor-laptops/"" rel=""nofollow"">https://www.lenovo.com/au/en/faqs/intel/best-intel-processor-laptops/</a> i7 processor with 8GB of RAM. </p><p>I've tried some basic troubleshooting like clearing cache, disabling add-ons, and updating drivers, but the issue keeps happening. My laptop runs everything else just fine, and other browsers like Chrome work without any issues. I'm not sure if it’s a Firefox bug or something specific to my system. Has anyone else faced this issue with Firefox on an Intel machine? Any suggestions on how to resolve this? I would appreciate any help or advice on what to try next! Thanks in advance! </p>",firefox;browse;,firefox,browse,en-US,"",daniellemorriss1999
1463992,2024-09-17 00:16:00 -0700,2024-09-17 00:16:00 -0700,Lost my Search History after Hardware Change,<p>I changed my hardware and reinstalled Firefox. I signed-in using the same google account but my search history and saved passwords are now lost. I need them back. What should i do? </p>,firefox;installation-and-updates;,firefox,installation-and-updates,en-US,"",doda.omar90
1463987,2024-09-16 22:13:06 -0700,2024-09-16 22:13:06 -0700,Firefox Opens in a Half Screen Window After Windows 10 Restart,"<p>Every time I have to restart the microsoft nightmare called windows 10, the 1st time I open Firefox it opens in a half screen window on the right side of my screen. It's set to open maximized and run as administrator but still won't do so immediately after a restart. Is there a fix for this? </p>",firefox;windows-10;performance-and-connectivity;,firefox,performance-and-connectivity,en-US,"",m2ndgmun
1463985,2024-09-16 21:49:34 -0700,2024-09-16 21:49:34 -0700,historico,<p>o navegador estão deslogando das minhas contas automaticamente ao fechar </p>,firefox;accounts;,firefox,accounts,pt-BR,"",dudutintino
1463984,2024-09-16 21:39:55 -0700,2024-09-16 21:39:55 -0700,Videos randomly swapping between HDR and SDR,"<p>Hey, I just recently started using Firefox, and I've started to notice some odd behavior. When watching videos and reels on Facebook (Desktop version), videos will flip-flop between normal and really bright and washed-out. I'm currently on Firefox 130.0 on Windows 11, and I always have HDR on. The imagery is silly, but these two screenshots (using win-shift-s) are from the same video only seconds apart, and this happens on almost all of them. Not yet tested to see if it also happens on Youtube or Twitter videos. </p>",firefox;windows-11;firefox-1300;performance-and-connectivity;,firefox,performance-and-connectivity,en-US,"",piccolo113
1463983,2024-09-16 21:38:06 -0700,2024-09-16 21:38:06 -0700,when I change my starrt up program in settings to default it still opens with MSN,<p>I have changed my settings in Firefox to have Firefox the default when computer opens but it still opens with MSN which I don't want.  Every time I go into settings even after re-boot it still shows to start with MSN . I change it again and same thing over and over.   </p><p>thanks for any help and I have a feeling I have to delete firefox and re-install but worried all my links and bookmarks ect  will go away. </p>,settings;firefox;windows-10;firefox-1300;,firefox,settings,en-US,"",chattykathy1000
1463981,2024-09-16 21:25:31 -0700,2024-09-16 21:25:31 -0700,Firefox gets stuck on checking for updates after upgrading to Mac Sonoma,"<p>After upgrading my Mac to Sonoma, Firefox quit working. It gets stuck on checking for updates. I have searched the web for answers and I have:  </p><p>Changed my proxy settings - made no difference Opened in trouble shooting mode - no difference Deleted all cache etc - no difference Re-installed Firefox - no difference Set up a new profile (multiple times) - no difference Reset Firefox (multiple times) - no difference Ran a check for Malware - none found A few other things - no difference Firefox has been my main browser for about 15 years and it is now useless. Please let me know if there is a fix. I hate using Safari but I have spent days on this. </p><p>thanks </p>",firefox;installation-and-updates;,firefox,installation-and-updates,en-US,"",wlhathome
1463980,2024-09-16 20:57:50 -0700,2024-09-17 06:14:28 -0700,Cannot access crash-stats.mozilla.org,"<p>Hi team, </p><p>I am a researcher and trying to collect data from <a href=""http://crash-stats.mozilla.org"" rel=""nofollow"">crash-stats.mozilla.org</a> for my research. However, I got 403 Forbidden for several days. Can you help me to resolve this? Thank you in advance. </p>",firefox;browse;,firefox,browse,en-US,1675086;,hoangtnm.cse
1463979,2024-09-16 20:50:57 -0700,2024-09-16 20:50:57 -0700,Youtube lags when running minecraft.,"<p>Hello all, I recently made the change from chrome to firefox and have been loving it so far. The only issue is; when I have a youtube video open while playing minecraft, the video lags and the audio skips. It never buffers and I have a great fibre Ethernet connection. When I try on chrome it doesn't happen. Only on firefox. </p>",firefox;firefox-1290;firefox-12902;performance-and-connectivity;,firefox,performance-and-connectivity,en-US,"",maxzalinko
1463976,2024-09-16 20:23:04 -0700,2024-09-17 05:43:55 -0700,Sazka.cz,<p>Dosažení finanční prostředky </p>,firefox;backup-recovery-and-sync;,firefox,backup-recovery-and-sync,cs,1675080;,Danecek0319
1463974,2024-09-16 20:04:33 -0700,2024-09-16 20:04:33 -0700,Firefox is not working properly with some websites while Chrome is fine with them,"<p>Lately I have been having some real problems with Firefox.  PG&amp;E (Pacific Gas &amp; Electric) does not support Firefox (I get a message telling me that Firefox is not a supported browser and I need to use Chrome, Edge.  I also am having problems with sites like Petsmart where I keep getting logged off and nothing actually ends up in my cart.  I don't like Chrome and I won't use Edge under any circumstances.  What is the problem that these sites are having with Firefox?  I have been using Firefox from it's first being offered (yes I'm that old) and I don't want to change.  I use DuckDuckGo with both Firefox and Chrome so I'm reasonably certain that the issues I am experiencing are Firefox issues.  I have tried turning off the add blocking extensions and even my firewall but that hasn't helped. I get the feeling that these sites (and others) are part of an effort to get rid of Firefox in favor of the 2 giants Google and Microsoft.  Am I just paranoid or what? </p><p>I use Windows 10, McAfee Security software,  Firefox browser with DuckDuckGo search engine.  I also use Chrome browser with DuckDuckGo search engine.  Everything works fine with Chrome. </p>",firefox;performance-and-connectivity;,firefox,performance-and-connectivity,en-US,"",jjobuild
1463973,2024-09-16 19:36:48 -0700,2024-09-16 19:36:48 -0700,தமிழ்,<p>Sttyyyfsjlowwyuooerhkfdji444 </p>,firefox;browse;,firefox,browse,en-US,"",jakerjaker889
1463972,2024-09-16 19:36:32 -0700,2024-09-16 19:36:32 -0700,youtube search,<p>to log on </p>,firefox;performance-and-connectivity;,firefox,performance-and-connectivity,en-US,"",hlavi9950
