id,created,updated,title,content,tags,product,topic,locale,answers,creator
1470780,2024-10-22 23:40:35 -0700,2024-10-23 07:33:35 -0700,How can I manage multiple profiles in Firefox desktop for different browsing experiences?,"<p>With more people using Firefox for a variety of tasks (work, personal, study), managing different profiles on the desktop version of Firefox has become a popular method to separate browsing data, extensions, and settings. This feature allows users to keep their work and personal browsing completely distinct. The question focuses on how users can set up, switch, and manage these profiles efficiently. </p><p>Key follow-up considerations could include: </p><p>How do profiles work within Firefox's ecosystem? What benefits do multiple profiles offer? Can Firefox profiles sync across devices? This question addresses the need for better organization in browsing and taps into a feature that isn't always utilized to its full potential. </p>",firefox;performance-and-connectivity;,firefox,performance-and-connectivity,en-US,1683610;,alenmark388
1470778,2024-10-22 23:34:57 -0700,2024-10-22 23:34:57 -0700,Much too easy to tear tabs,"<p>Hi, this has been happening for a while now, and is very frustrating - it's much too easy to tear off tabs into new a new window; the tinyest drag whilst the left mouse button is clicked is enough to pull the tab into a new window; I've tried turning off tear tab behaviour, but that is more annoying than the tabs tearing itself, since it doesn't stop the action, it just means that the tab doesn't go to a new window but stays where it is, after messing with Tree Style Tab a bit (it removes the tab from any tree its in, and bugs the tree so it won't accept new child tabs). That setting also stops you moving a tab to a new window at all - you have to copy the url and open a new window and navigate to the URL. </p><p>Any idea what might be happening? I've searched several times over the last few months and the only hits I get are 4 years old (and recommend turning off tab tearing at all). </p><p>Thanks, </p>",firefox;browse;,firefox,browse,en-US,"",wgmoffatt
1470777,2024-10-22 23:32:37 -0700,2024-10-22 23:32:37 -0700,Developer tools shows only bar when docking to the bottom.,"<p>All of a sudden, when docking the developer tools to the bottom, only the top bar is showing, with nothing below it. It shows fine when docking to the side. What may be the problem? </p>",settings;firefox;,firefox,settings,en-US,"",ohad578
1470776,2024-10-22 23:25:51 -0700,2024-10-22 23:25:51 -0700,Firefox apt repository is torture,"<p>First Firefox collaborated with canonical to monopolize ubuntu's wish to force users into running proprietary non-interoperable packaging system on their OS. This is evil in itself. I know a flatpak version exists but it has performance and constant video playback issues. The .deb package is superior for obvious reasons. So you follow the official <a href=""https://support.mozilla.org/en-US/kb/install-firefox-linux#w_install-firefox-deb-package-for-debian-based-distributions-recommended"" rel=""nofollow"">installation instruction</a> only to get hit in the punch once more: </p><p>`Get:11 <a href=""https://packages.mozilla.org/apt"" rel=""nofollow"">https://packages.mozilla.org/apt</a> mozilla/main all Packages [27.4 MB] Get:12 <a href=""https://packages.mozilla.org/apt"" rel=""nofollow"">https://packages.mozilla.org/apt</a> mozilla/main amd64 Packages [479 kB]` </p><p>Yeah so every time you run apt update from now, you are going to have to download 30 megabytes of garbage. This is waste of bandwidth, but more importantly, waste of time for those of us living in parts of world with slow internet. I thought it was ubuntu, but Mozilla is officially moron. </p>",firefox;installation-and-updates;,firefox,installation-and-updates,en-US,"",forkbun
1470771,2024-10-22 22:33:38 -0700,2024-10-22 22:33:38 -0700,Need support to type indic language on firefox browser,"<p>Hi, </p><p>I have been using both Ubuntu with firefox as my default browser. To type any indic language I have ibus framework and m17n-db engine to type the indic language. Now the problem is the system where it will be used is login as root user. And it is being advised not to open the firefox with root user. However, there is command which actually allow the user to open with any user other than root. I am using this command  ""sudo -H -E -u user firefox test.html""  The test.html is just textarea where I want to type an indic language available in m17n engine. This is perfectly working fine in Ubuntu 16 with firefox version 54. But the same this is not working in Ubuntu 22 with any latest or inbuilt firefox comes with Ubuntu 22. However, if I logged in as normal user , then it works perfectly fine.  </p><p>I have tried many thing , setting environment in .bashrc of root user so that it get the m17n language but still not working. The one thing which I noticed is , XKB layout is working in both the case with or without user. I am not sure what exactly changes are implemented in the build of firefox which is stopping to type the indic language in the firefox if open with above command. Any specific security check which is causing the problem. Can I just disable it from config page&nbsp;? Any help would be appreciated.  </p><p>Thanks </p>",linux;settings;firefox;,firefox,settings,en-US,"",fskhan
1470768,2024-10-22 22:23:28 -0700,2024-10-22 22:43:39 -0700,E CHALLAN WEBSITE NOT WORK,<p>THIS BROWSER NOT WROK ECHALLAN WEBSITE PLEASE HELP ME . CALL ME [edited phone# from community support forum] </p>,firefox;performance-and-connectivity;,firefox,performance-and-connectivity,en-US,"",spo.traffic.bla
1470766,2024-10-22 22:09:10 -0700,2024-10-22 22:10:55 -0700,फोनपे गलत ट्रांजेक्शन रिफंड कैसे करें?--,"<p>फोनपे से पैसा कट जाए तो क्या करें? ग्राहक आप PhonePe हेल्पलाइन नंबर (+91879- 7160-658), (भाषा: हिंदी और अंग्रेजी) पर भी कॉल कर सकते हैं। ग्राहक आप PhonePe हेल्पलाइन नंबर (+91 740- 762- 8017), (भाषाः हिंदी और अंग्रेजी) पर भी कॉल कर सकते हैं।∆∆ </p>","",firefox,installation-and-updates,en-US,1683513;1683514;,sunilzfxgh8568
1470765,2024-10-22 22:08:36 -0700,2024-10-22 22:08:36 -0700,I cannot open a website in Firefox which I can in MS EDGE. What is wrong?,<p>Please how I can use my Firefox all the time as i have used it over 20 year and only recently I am having problems accessing  certain websited It says ERROR </p>,firefox;browse;,firefox,browse,en-US,"",p.bamji
1470761,2024-10-22 22:01:00 -0700,2024-10-22 22:02:34 -0700,Market,"<p>फोनपे से पैसा कट जाए तो क्या करें? ग्राहक आप PhonePe हेल्पलाइन नंबर (+91879- 7160-658), (भाषा: हिंदी और अंग्रेजी) पर भी कॉल कर सकते हैं। ग्राहक आप PhonePe हेल्पलाइन नंबर (+91 740- 762- 8017), (भाषाः हिंदी और अंग्रेजी) पर भी कॉल कर सकते हैं।.... </p>","",firefox,accounts,en-US,1683510;1683511;,bariksahdool
1470760,2024-10-22 21:56:44 -0700,2024-10-22 21:56:44 -0700,फोनपे गलत ट्रांजेक्शन रिफंड कैसे करें?,"<p>ग्राहक आप PhonePe हेल्पलाइन नंबर ( +91 740-7628-017), (भाषा: हिंदी और अंग्रेजी) पर भी कॉल कर सकते हैं। ग्राहक आप PhonePe हेल्पलाइन?.. </p>","",firefox,accounts,en-US,"",bariksahdool
1470758,2024-10-22 21:27:27 -0700,2024-10-22 21:27:27 -0700,Maths,<p>Maths </p>,firefox;browse;,firefox,browse,en-US,"",khandekaryuvraj32
1470757,2024-10-22 20:43:51 -0700,2024-10-22 20:43:51 -0700,I have a problem in getting info about my new arxiv++ account,<p>I have a problem in getting info about my new arxiv++ account </p>,firefox;accounts;,firefox,accounts,en-US,"",felixlev314
1470753,2024-10-22 19:20:43 -0700,2024-10-22 19:20:43 -0700,YouTube search bar missing from YT homepage,"<p>Hello and thank you for being here. I have been a Firefox user for many years.  It is my preferred browser. I also use YouTube a lot. Recently, when I go to YouTube home page I get video suggestions but no search bar to search for vids. If I click on one of the videos and bring one up then the YouTube search bar appears above that video. However, this is a deal breaker for me.  I am not willing to take that extra step every time I want to search for a particular video. If I open up YouTube in the Chrome browser I get the search bar which is great but pisses me off as I feel that Google has forced me to use their browser.  I pay for YouTube Premium and I will cancel it if I cannot resolve the problem of the missing search bar in Firefox. I have added no extensions since well before this problem has occurred and I have searched the web for a solution to no avail. If anyone has a suggestion for how to resolve this It would be greatly appreciated. Thank you. </p>",firefox;browse;firefox-1310;firefox-13103;,firefox,browse,en-US,"",kdautel9
1470752,2024-10-22 19:19:25 -0700,2024-10-22 19:19:25 -0700,Disable Cookies in Tracking Protection,"<p>Trying to disable ""Cookies"" in Tracking Protection via group policy but not sure what setting I need to set in Active Directory ""Group Policy"". I cannot disable using the browser... too many people and too much overhead... so I need to do via group policy... I think it is under ""Cookies"" but not sure which setting to utilize... Any help would be greatly appreciated... </p>",firefox;privacy-and-security_1;,firefox,privacy-and-security,en-US,"",lgonzales1138
1470749,2024-10-22 18:46:12 -0700,2024-10-22 18:46:12 -0700,"Extremely slow download speeds, below 50 kB/s","<p>This is my first download using Firefox, a roughly 100 MB video file. On Chrome, these downloads take about 10 seconds at most, even with other tabs and applications open. This one took around 45 minutes. </p>",firefox;performance-and-connectivity;,firefox,performance-and-connectivity,en-US,"",darthjayder427
1470748,2024-10-22 18:41:43 -0700,2024-10-22 18:41:43 -0700,sizing pages for desktop,"<p>Hi all,  I'm having a problem I don't know how to fix. I was playing around with display settings for testing purposes, and now Firefox is using a window size that apparently is for mobile devices, as I'm getting mobile toggle menus on certain websites. How do I fix this? </p>",settings;firefox;,firefox,settings,en-US,"",cavbob1993
1470740,2024-10-22 17:42:34 -0700,2024-10-22 17:42:34 -0700,Can't log into Firefox sync,"<p>Hi, </p><p>I can't log into Firefox sync if logged out. I bought a new laptop that I'm trying to sync, and every time I try, it either claims the password is wrong or the 2fa code is wrong. Every so often it will work, I will get the prompt to download Firefox for mobile too, but then after that screen it appears I'm disconnected again. I tried resetting the password and I got an ""unexpected error"". Any idea what's going on? </p>",firefox;backup-recovery-and-sync;,firefox,backup-recovery-and-sync,en-US,"",alex2iou
1470739,2024-10-22 17:41:18 -0700,2024-10-22 18:07:48 -0700,RECOVER BOOKMARKS,"<p>Hello, </p><p>How can I recover my bookmarks ( likely lost during a recent storm surge)&nbsp;? </p><p>I use the FIREFOX browser on my macOS MONTEREY desk-top.   </p><p>Kindly contact me @ [telephone number] or preferably via e-mail @ [email address] with any suggestions. </p><p>Thank you in advance for your help with this very important matter. </p><p>Alex </p><p><i>(email address/telephone number removed; please do not post personal information on a public website; <a href=""https://support.mozilla.org/en-US/kb/mozilla-support-rules-guidelines"" rel=""nofollow"">Mozilla Support rules and guidelines</a>)</i> </p>",firefox;backup-recovery-and-sync;,firefox,backup-recovery-and-sync,en-US,1683467;,MARCOANCHOR
