id,created,updated,title,content,tags,product,topic,locale,answers,creator
1443060,2024-03-23 05:12:54 -0700,2024-03-23 05:12:54 -0700,How to Widen Firefox Vertical-Scroll-Bars on Windows-11 Laptop?,"<p>On my Windows-11 Laptop, the Vertical-Scroll-Bars in Firefox are too narrow for me to use comfortably.  I am struggling with the Touch-Pad, Mouse Pointers, causing the frequently needed act of Scrolling to become a dreaded ordeal? If someone would provide clear and concise instruction on how to make the Vertical-Scroll-Bars the Classic Width of old, it would be greatly appreciated. Thank you! lg </p>",desktop;customize;windows-11;firefox-1240;firefox-12401;,firefox,customize,en-US,"",LG3
1443059,2024-03-23 05:10:46 -0700,2024-03-23 05:10:46 -0700,"when I work on my second display, Firefox is no longer topped on my first display. Why?","<p>When a firefox window is active on my second display, I lose the firefox menubar on my main display. I haven't noticed this before, is it something new, or have I inadvertently changed a setting? </p><p>pete </p>",desktop;beta;other;firefox-1250;,firefox,other,en-US,"",peterlemer
1443057,2024-03-23 04:49:59 -0700,2024-03-23 05:03:52 -0700,ACESSO SISTEMA GESP DA POLÍCIA FEDERAL,"<p>Bom dia, </p><p>Preciso acessar o Sistema GESP, da policia federal, é através do site <a href=""https://servicos.dpf.gov.br/gesp/"" rel=""nofollow"">https://servicos.dpf.gov.br/gesp/</a> utilizando certificado digital, quando selecionado o perfil do certificado e colocada a senha, automaticamente é redirecionado para o site <a href=""http://gov.br"" rel=""nofollow"">gov.br</a> para com o certificado e senha poder ser redirecionado para o sistema, no entanto não consigo entrar no <a href=""http://gov.br"" rel=""nofollow"">gov.br</a>. Então acesso com o certificado no primeiro momento, no entanto, logo em seguida não consigo prosseguir, pois não consigo entrar com o certificado digital. Mas se acessar diretamente o site <a href=""http://gov.br"" rel=""nofollow"">gov.br</a> consigo entrar na minha conta utilizando o certificado digital, através do sistema da policia federal não consigo o acesso, porém, direto na mesma página o acesso é realizado normalmente. </p><p>Gostaria de um auxílio para solucionar esse problema, uma vez que tenha prazo para cumprir no sistema da polícia federal. </p><p>Obrigado. </p>",desktop;privacy-and-security_1;windows-10;firefox-1240;,firefox,privacy-and-security,pt-BR,1643678;,lotufovalli.adv
1443056,2024-03-23 04:47:52 -0700,2024-03-23 04:47:52 -0700,Firefox closes all tabs when I click on a new link on mail or address icon on mac,"<p>I noticed that a couple of times when I click on an external link on a mail or a bookmarked site as icon on my mac, Firefox closes all the tabs and open that link in a new window, so I lose all the tabs and address... Sometime I have more than 30 tabs open and i't difficult to reopen all from history. What happen? Why? I can't see also the ""restore last session"" command into History menu. Can be fix it? Thank you. </p><p>Federico </p>",desktop;fix-problems;mac-os-x-1015;firefox-1240;firefox-12401;,firefox,fix-problems,en-US,"",info11063
1443054,2024-03-23 04:34:16 -0700,2024-03-23 04:34:16 -0700,Sito web che non carica tutti i contenuti.,"<p>Buongiorno, volevo segnalare che già dalla versione 123.0 di Firefox per Windows 10, nella pagina di accesso al proprio profilo del sito web di Eniplenitude (<a href=""https://eniplenitude.com/my-eni"" rel=""nofollow"">https://eniplenitude.com/my-eni</a>), non si carica il form di inserimento delle proprie credenziali. Il problema permane anche con la versione 124.0.1 di Firefox. </p><p>Vi ringrazio anticipatamente. Rosario </p>",desktop;windows-10;website-breakages;firefox-1240;firefox-12401;,firefox,website-breakages,it,"",alros1927
1443053,2024-03-23 04:33:42 -0700,2024-03-23 04:33:42 -0700,"miss-type emaill address, how to remove them?","<p>My vision is not good, so I often miss type things. So I enter things like[email@mail.com] instead of {email@gmail.com} and variations there of. So every time I go to a new site, and I gave to enter my email address I get a list of miss-typed addresses with the correct one. Everything I try to search on how to to delete these erroneous entries, comes back on how  turn off the option to use this function. I have how to delete old CC information and thing like that. but not miss-typed email address. Thanks in advance. McK </p>",desktop;other;windows-10;firefox-1230;,firefox,other,en-US,"",Goodtimebyall
1443052,2024-03-23 04:30:56 -0700,2024-03-23 04:30:56 -0700,Installation 124 wiped out my pinned and opened tabs,"<p>This is the 2nd time in the last year or two that the auto-update deleted all my pre-defined tabs, including those that were pinned. All that I had was a single tab. </p><p>Why? </p>",desktop;other;windows-11;firefox-1240;,firefox,other,en-US,"",gwp99
1443050,2024-03-23 03:32:38 -0700,2024-03-23 03:32:38 -0700,2FA security,<p>I am an 84-year-old newbie! I have enabled 2 FA. But...  when I click on Firefox in the taskbar F/fox opens and I can access all the bookmarks in the bookmark bar without any more security. </p><p>When does the 2FA come into this? </p>,desktop;privacy-and-security_1;windows-10;firefox-1240;firefox-12401;,firefox,privacy-and-security,en-US,"",chris.arme
1443048,2024-03-23 03:19:13 -0700,2024-03-23 03:35:54 -0700,antivirus non mi protegge quando entro nella banca on-line,"<p>Buongiorno, da un pò di giorni non riesco ad entrare con protezione nel sito della banca (antivirus Kaspersky). Ho chiamato la banca pensando che fosse un loro problema, ma mi hanno fatto provare con un'altro browser e con quello la protezione funziona; mi hanno detto che è un problema di Firefox. Vorrei capire come devo fare per ripristinare la protezione , che ha sempre funzionato; grazie. </p><p>Cordialmente                                                                                                       Mauro </p>",desktop;privacy-and-security_1;needsinfo;windows-10;firefox-1240;,firefox,privacy-and-security,it,1643662;,maurogaffurini430
1443047,2024-03-23 02:55:11 -0700,2024-03-23 04:26:02 -0700,"Instant crash on startup, including safe mode","<p>CrashID: bp-5b2cb490-913f-4ffa-8f1b-35cba0240323 </p><p>Hello, since today I am experiencing instant crash on start up. It was perfectly fine yesterday (10 hours ago). Even attempting to open safe mode when offered also instant crash. Firefox is currently unuseable. </p><p>I believe the recent 124.0.1 is the issue&nbsp;? Can this be confirmed, where can I check if this issue is widespread &amp; the ETA to an eventual fix&nbsp;? </p>",desktop;fix-problems;windows-10;,firefox,fix-problems,en-US,1643656;1643658;1643660;1643665;1643671;1643672;1643674;,diego.mrnj
1443045,2024-03-23 02:44:09 -0700,2024-03-23 02:44:09 -0700,Warning on Mac but not on iPhone,"<p>A friend posted a link in our WhatsApp chat about free flights. I went to access it via my Mac, but FF immediately showed a warning message. However I was able to clink on the link via my iPhone. Why did I not get the same warning message on the phone? </p><p>I really wish I had taken a screenshot. Time to learn! </p>",macos;firefox-1240;,firefox,basic-browsing-firefox,en-US,"",non-tech
1443043,2024-03-23 01:29:57 -0700,2024-03-23 02:58:39 -0700,html5 player directional keys rebind,"<p>when pressing the left or right arrows keys, the video is skipped like 5s or whatever. iIs there a way to change that amount? </p>",linux;desktop;customize;firefox-1240;,firefox,customize,en-US,1643654;,Yinmin
1443038,2024-03-22 22:59:56 -0700,2024-03-23 02:51:11 -0700,Video download helper icon does not appear on Firefox toolbar,"<p>I am setting up a new mac computer (Mac book Air M3 with Sonoma 14.3). I have installed Video Download Helper. The icon appears in the Applications folder and the Dock, but not in the Firefox toolbar. How can I get the icon back? Many thanks. </p>",desktop;customize;mac-os-x-1015;firefox-1240;firefox-12401;,firefox,customize,en-US,1643652;,ronvernon
1443037,2024-03-22 22:36:22 -0700,2024-03-23 05:26:46 -0700,New PDF Editor,"<p>How do I perform very basic editor functions like add/remove/move a page in the new Firefox PDF document editor? I am in the Mainstream Firefox 124.0.1 64-bit. Thank You, David </p>",desktop;other;windows-11;firefox-1240;firefox-12401;,firefox,other,en-US,1643681;,Drone
1443036,2024-03-22 22:18:13 -0700,2024-03-23 02:53:25 -0700,Bookmark Smart Shortcut - Not open in new tab,"<p>Hi, When I use a shortcut for a bookmark (e.g., typing ""yt"" to activate my youtube search bookmark with URL set to ""https://www.youtube . com/results?search_query=%s"" and shortcut set to ""yt"") it opens in a new tab. I am in the habit of making a new tab before using a shortcut to search using a bookmark. How can I change the shortcut bookmark behavior to open in the same tab where i typed the query into the URL bar? </p>",desktop;customize;windows-10;firefox-1230;firefox-12301;,firefox,customize,en-US,1643653;,sgbhagwandin
1443035,2024-03-22 22:14:26 -0700,2024-03-22 22:14:26 -0700,Tabs crashing after an unknown period of time,<p>I have a very annoying issue.  </p><p>I am on the Firefox ESR version which is deployed via Intune. I am on the latest 115.9.0 and on Windows 11 22H2 </p><p>After a certain period of time (never took note of it sadly) tabs start crashing and keep crashing. The only way to fix this issue is to terminate firefox via task manager and relaunch. </p><p>What is the best way to start investigating this and try to understand what is causing the tab crashes. </p>,desktop;fix-problems;windows-11;,firefox,fix-problems,en-US,"",jaquilina
1443033,2024-03-22 20:07:51 -0700,2024-03-23 03:17:01 -0700,Hardware acceleration after GPU upgrade,"<p>After Ubuntu updated the GPU driver, Firefox stopped rendering and only works when disabling hardware acceleration. See screenshot attached. I'm using ubuntu/ RTX4090 and nvidia-driver-535 (propietary, tested). Attaching the apt upgrade logs that caused this to happen. Firefox is the only application that suffers from this.  </p><p>Is there any fix happening soon for this? </p><p><br> ``` Install: linux-modules-nvidia-535-6.5.0-26-generic:amd64 (6.5.0-26.26~22.04.1, automatic), linux-modules-extra-6.5.0-26-generic:amd64 (6.5.0-26.26~22.04.1, automatic), linux-objects-nvidia-535-6.5.0-26-generic:amd64 (6.5.0-26.26~22.04.1, automatic), nvidia-firmware-535-535.161.07:amd64 (535.161.07-0ubuntu0.22.04.1, automatic), linux-signatures-nvidia-6.5.0-26-generic:amd64 (6.5.0-26.26~22.04.1, automatic), linux-hwe-6.5-headers-6.5.0-26:amd64 (6.5.0-26.26~22.04.1, automatic), linux-modules-6.5.0-26-generic:amd64 (6.5.0-26.26~22.04.1, automatic), linux-image-6.5.0-26-generic:amd64 (6.5.0-26.26~22.04.1, automatic), linux-headers-6.5.0-26-generic:amd64 (6.5.0-26.26~22.04.1, automatic), ubuntu-pro-client:amd64 (31.2~22.04, automatic) Upgrade: dpkg:amd64 (1.21.1ubuntu2.2, 1.21.1ubuntu2.3), libsynctex2:amd64 (2021.20210626.59705-1ubuntu0.1, 2021.20210626.59705-1ubuntu0.2), tcpdump:amd64 (4.99.1-3ubuntu0.1, 4.99.1-3ubuntu0.2), libcups2:amd64 (2.4.1op1-1ubuntu4.7, 2.4.1op1-1ubuntu4.8), libcups2:i386 (2.4.1op1-1ubuntu4.7, 2.4.1op1-1ubuntu4.8), libxtables12:amd64 (1.8.7-1ubuntu5.1, 1.8.7-1ubuntu5.2), libnvidia-common-535:amd64 (535.154.05-0ubuntu0.22.04.1, 535.161.07-0ubuntu0.22.04.1), libgpgmepp6:amd64 (1.16.0-1.2ubuntu4.1, 1.16.0-1.2ubuntu4.2), coreutils:amd64 (8.32-4.1ubuntu1, 8.32-4.1ubuntu1.1), libnvidia-fbc1-535:amd64 (535.154.05-0ubuntu0.22.04.1, 535.161.07-0ubuntu0.22.04.1), libnvidia-fbc1-535:i386 (535.154.05-0ubuntu0.22.04.1, 535.161.07-0ubuntu0.22.04.1), bind9-host:amd64 (1:9.18.18-0ubuntu0.22.04.1, 1:9.18.18-0ubuntu0.22.04.2), libnvidia-gl-535:amd64 (535.154.05-0ubuntu0.22.04.1, 535.161.07-0ubuntu0.22.04.1), libnvidia-gl-535:i386 (535.154.05-0ubuntu0.22.04.1, 535.161.07-0ubuntu0.22.04.1), iptables:amd64 (1.8.7-1ubuntu5.1, 1.8.7-1ubuntu5.2), libglx-mesa0:amd64 (23.0.4-0ubuntu1~22.04.1, 23.2.1-1ubuntu3.1~22.04.2), libglx-mesa0:i386 (23.0.4-0ubuntu1~22.04.1, 23.2.1-1ubuntu3.1~22.04.2), python3-distupgrade:amd64 (1:22.04.17, 1:22.04.19), language-pack-en-base:amd64 (1:22.04+20230801, 1:22.04+20240212), update-manager:amd64 (1:22.04.18, 1:22.04.19), libctf-nobfd0:amd64 (2.38-4ubuntu2.5, 2.38-4ubuntu2.6), libnvidia-extra-535:amd64 (535.154.05-0ubuntu0.22.04.1, 535.161.07-0ubuntu0.22.04.1), nvidia-compute-utils-535:amd64 (535.154.05-0ubuntu0.22.04.1, 535.161.07-0ubuntu0.22.04.1), cups-bsd:amd64 (2.4.1op1-1ubuntu4.7, 2.4.1op1-1ubuntu4.8), nvidia-driver-535:amd64 (535.154.05-0ubuntu0.22.04.1, 535.161.07-0ubuntu0.22.04.1), tzdata:amd64 (2023d-0ubuntu0.22.04, 2024a-0ubuntu0.22.04), cups-common:amd64 (2.4.1op1-1ubuntu4.7, 2.4.1op1-1ubuntu4.8), libldap-common:amd64 (2.5.16+dfsg-0ubuntu0.22.04.2, 2.5.17+dfsg-0ubuntu0.22.04.1), openjdk-17-jdk:amd64 (17.0.9+9-1~22.04, 17.0.10+7-1~22.04.1), libnvidia-encode-535:amd64 (535.154.05-0ubuntu0.22.04.1, 535.161.07-0ubuntu0.22.04.1), libnvidia-encode-535:i386 (535.154.05-0ubuntu0.22.04.1, 535.161.07-0ubuntu0.22.04.1), openjdk-17-jre:amd64 (17.0.9+9-1~22.04, 17.0.10+7-1~22.04.1), openjdk-17-jdk-headless:amd64 (17.0.9+9-1~22.04, 17.0.10+7-1~22.04.1), libgbm1:amd64 (23.0.4-0ubuntu1~22.04.1, 23.2.1-1ubuntu3.1~22.04.2), libgbm1:i386 (23.0.4-0ubuntu1~22.04.1, 23.2.1-1ubuntu3.1~22.04.2), xxd:amd64 (2:8.2.3995-1ubuntu2.15, 2:8.2.3995-1ubuntu2.16), libkpathsea6:amd64 (2021.20210626.59705-1ubuntu0.1, 2021.20210626.59705-1ubuntu0.2), libgdm1:amd64 (42.0-1ubuntu7.22.04.3, 42.0-1ubuntu7.22.04.4), nvidia-utils-535:amd64 (535.154.05-0ubuntu0.22.04.1, 535.161.07-0ubuntu0.22.04.1), libexpat1:amd64 (2.4.7-1ubuntu0.2, 2.4.7-1ubuntu0.3), libexpat1:i386 (2.4.7-1ubuntu0.2, 2.4.7-1ubuntu0.3), libbinutils:amd64 (2.38-4ubuntu2.5, 2.38-4ubuntu2.6), ubuntu-release-upgrader-gtk:amd64 (1:22.04.17, 1:22.04.19), xserver-xorg-video-nvidia-535:amd64 (535.154.05-0ubuntu0.22.04.1, 535.161.07-0ubuntu0.22.04.1), firmware-sof-signed:amd64 (2.0-1ubuntu4.4, 2.0-1ubuntu4.5), cups-client:amd64 (2.4.1op1-1ubuntu4.7, 2.4.1op1-1ubuntu4.8), cups-ppdc:amd64 (2.4.1op1-1ubuntu4.7, 2.4.1op1-1ubuntu4.8), alsa-ucm-conf:amd64 (1.2.6.3-1ubuntu1.10, 1.2.6.3-1ubuntu1.11), cups-daemon:amd64 (2.4.1op1-1ubuntu4.7, 2.4.1op1-1ubuntu4.8), linux-image-generic-hwe-22.04:amd64 (6.5.0.17.17~22.04.9, 6.5.0.26.26~22.04.13), vim-common:amd64 (2:8.2.3995-1ubuntu2.15, 2:8.2.3995-1ubuntu2.16), libtiff5:amd64 (4.3.0-6ubuntu0.7, 4.3.0-6ubuntu0.8), libtiff5:i386 (4.3.0-6ubuntu0.7, 4.3.0-6ubuntu0.8), libip4tc2:amd64 (1.8.7-1ubuntu5.1, 1.8.7-1ubuntu5.2), tracker-miner-fs:amd64 (3.3.3-0ubuntu0.20.04.1, 3.3.3-0ubuntu0.20.04.2), gir1.2-javascriptcoregtk-4.0:amd64 (2.42.4-0ubuntu0.22.04.1, 2.42.5-0ubuntu0.22.04.2), binutils-x86-64-linux-gnu:amd64 (2.38-4ubuntu2.5, 2.38-4ubuntu2.6), gir1.2-webkit2-4.0:amd64 (2.42.4-0ubuntu0.22.04.1, 2.42.5-0ubuntu0.22.04.2), language-pack-en:amd64 (1:22.04+20230801, 1:22.04+20240212), language-pack-gnome-en-base:amd64 (1:22.04+20230801, 1:22.04+20240212), libxatracker2:amd64 (23.0.4-0ubuntu1~22.04.1, 23.2.1-1ubuntu3.1~22.04.2), libxml2:amd64 (2.9.13+dfsg-1ubuntu0.3, 2.9.13+dfsg-1ubuntu0.4), libxml2:i386 (2.9.13+dfsg-1ubuntu0.3, 2.9.13+dfsg-1ubuntu0.4), less:amd64 (590-1ubuntu0.22.04.1, 590-1ubuntu0.22.04.2), python-apt-common:amd64 (2.4.0ubuntu2, 2.4.0ubuntu3), libgpgme11:amd64 (1.16.0-1.2ubuntu4.1, 1.16.0-1.2ubuntu4.2), libldap-2.5-0:amd64 (2.5.16+dfsg-0ubuntu0.22.04.2, 2.5.17+dfsg-0ubuntu0.22.04.1), libldap-2.5-0:i386 (2.5.16+dfsg-0ubuntu0.22.04.2, 2.5.17+dfsg-0ubuntu0.22.04.1), libnvidia-decode-535:amd64 (535.154.05-0ubuntu0.22.04.1, 535.161.07-0ubuntu0.22.04.1), libnvidia-decode-535:i386 (535.154.05-0ubuntu0.22.04.1, 535.161.07-0ubuntu0.22.04.1), mesa-va-drivers:amd64 (23.0.4-0ubuntu1~22.04.1, 23.2.1-1ubuntu3.1~22.04.2), openjdk-8-jre:amd64 (8u392-ga-1~22.04, 8u402-ga-2ubuntu1~22.04), libgl1-mesa-dri:amd64 (23.0.4-0ubuntu1~22.04.1, 23.2.1-1ubuntu3.1~22.04.2), libgl1-mesa-dri:i386 (23.0.4-0ubuntu1~22.04.1, 23.2.1-1ubuntu3.1~22.04.2), cups-ipp-utils:amd64 (2.4.1op1-1ubuntu4.7, 2.4.1op1-1ubuntu4.8), libosmesa6:amd64 (23.0.4-0ubuntu1~22.04.1, 23.2.1-1ubuntu3.1~22.04.2), libosmesa6:i386 (23.0.4-0ubuntu1~22.04.1, 23.2.1-1ubuntu3.1~22.04.2), nvidia-kernel-common-535:amd64 (535.154.05-0ubuntu0.22.04.1, 535.161.07-0ubuntu0.22.04.1), gdm3:amd64 (42.0-1ubuntu7.22.04.3, 42.0-1ubuntu7.22.04.4), dnsmasq-base:amd64 (2.86-1.1ubuntu0.5, 2.90-0ubuntu0.22.04.1), dpkg-dev:amd64 (1.21.1ubuntu2.2, 1.21.1ubuntu2.3), ubuntu-pro-client-l10n:amd64 (30~22.04, 31.2~22.04), libssl3:amd64 (3.0.2-0ubuntu1.14, 3.0.2-0ubuntu1.15), libssl3:i386 (3.0.2-0ubuntu1.14, 3.0.2-0ubuntu1.15), gir1.2-accountsservice-1.0:amd64 (22.07.5-2ubuntu1.4, 22.07.5-2ubuntu1.5), linux-modules-nvidia-535-generic-hwe-22.04:amd64 (6.5.0-17.17~22.04.1+1, 6.5.0-26.26~22.04.1), bash:amd64 (5.1-6ubuntu1, 5.1-6ubuntu1.1), openjdk-8-jre-headless:amd64 (8u392-ga-1~22.04, 8u402-ga-2ubuntu1~22.04), vim-tiny:amd64 (2:8.2.3995-1ubuntu2.15, 2:8.2.3995-1ubuntu2.16), update-manager-core:amd64 (1:22.04.18, 1:22.04.19), libctf0:amd64 (2.38-4ubuntu2.5, 2.38-4ubuntu2.6), bind9-dnsutils:amd64 (1:9.18.18-0ubuntu0.22.04.1, 1:9.18.18-0ubuntu0.22.04.2), mesa-vulkan-drivers:amd64 (23.0.4-0ubuntu1~22.04.1, 23.2.1-1ubuntu3.1~22.04.2), mesa-vulkan-drivers:i386 (23.0.4-0ubuntu1~22.04.1, 23.2.1-1ubuntu3.1~22.04.2), base-files:amd64 (12ubuntu4.5, 12ubuntu4.6), python3-apt:amd64 (2.4.0ubuntu2, 2.4.0ubuntu3), login:amd64 (1:4.8.1-2ubuntu2.1, 1:4.8.1-2ubuntu2.2), linux-headers-generic-hwe-22.04:amd64 (6.5.0.17.17~22.04.9, 6.5.0.26.26~22.04.13), linux-generic-hwe-22.04:amd64 (6.5.0.17.17~22.04.9, 6.5.0.26.26~22.04.13), libjavascriptcoregtk-4.0-18:amd64 (2.42.4-0ubuntu0.22.04.1, 2.42.5-0ubuntu0.22.04.2), libcupsimage2:amd64 (2.4.1op1-1ubuntu4.7, 2.4.1op1-1ubuntu4.8), tracker-extract:amd64 (3.3.3-0ubuntu0.20.04.1, 3.3.3-0ubuntu0.20.04.2), linux-firmware:amd64 (20220329.git681281e4-0ubuntu3.26, 20220329.git681281e4-0ubuntu3.29), libip6tc2:amd64 (1.8.7-1ubuntu5.1, 1.8.7-1ubuntu5.2), gir1.2-gdm-1.0:amd64 (42.0-1ubuntu7.22.04.3, 42.0-1ubuntu7.22.04.4), binutils-common:amd64 (2.38-4ubuntu2.5, 2.38-4ubuntu2.6), libdpkg-perl:amd64 (1.21.1ubuntu2.2, 1.21.1ubuntu2.3), libglapi-mesa:amd64 (23.0.4-0ubuntu1~22.04.1, 23.2.1-1ubuntu3.1~22.04.2), libglapi-mesa:i386 (23.0.4-0ubuntu1~22.04.1, 23.2.1-1ubuntu3.1~22.04.2), bind9-libs:amd64 (1:9.18.18-0ubuntu0.22.04.1, 1:9.18.18-0ubuntu0.22.04.2), accountsservice:amd64 (22.07.5-2ubuntu1.4, 22.07.5-2ubuntu1.5), cups-core-drivers:amd64 (2.4.1op1-1ubuntu4.7, 2.4.1op1-1ubuntu4.8), python3-update-manager:amd64 (1:22.04.18, 1:22.04.19), language-pack-gnome-en:amd64 (1:22.04+20230801, 1:22.04+20240212), code:amd64 (1.86.1-1707298119, 1.87.2-1709912201), libnvidia-cfg1-535:amd64 (535.154.05-0ubuntu0.22.04.1, 535.161.07-0ubuntu0.22.04.1), unzip:amd64 (6.0-26ubuntu3.1, 6.0-26ubuntu3.2), libwebkit2gtk-4.0-37:amd64 (2.42.4-0ubuntu0.22.04.1, 2.42.5-0ubuntu0.22.04.2), libexpat1-dev:amd64 (2.4.7-1ubuntu0.2, 2.4.7-1ubuntu0.3), nvidia-kernel-source-535:amd64 (535.154.05-0ubuntu0.22.04.1, 535.161.07-0ubuntu0.22.04.1), cups:amd64 (2.4.1op1-1ubuntu4.7, 2.4.1op1-1ubuntu4.8), libegl-mesa0:amd64 (23.0.4-0ubuntu1~22.04.1, 23.2.1-1ubuntu3.1~22.04.2), libnvidia-compute-535:amd64 (535.154.05-0ubuntu0.22.04.1, 535.161.07-0ubuntu0.22.04.1), libnvidia-compute-535:i386 (535.154.05-0ubuntu0.22.04.1, 535.161.07-0ubuntu0.22.04.1), ubuntu-release-upgrader-core:amd64 (1:22.04.17, 1:22.04.19), python3-cryptography:amd64 (3.4.8-1ubuntu2.1, 3.4.8-1ubuntu2.2), ubuntu-advantage-tools:amd64 (30~22.04, 31.2~22.04), mesa-vdpau-drivers:amd64 (23.0.4-0ubuntu1~22.04.1, 23.2.1-1ubuntu3.1~22.04.2), cups-server-common:amd64 (2.4.1op1-1ubuntu4.7, 2.4.1op1-1ubuntu4.8), libaccountsservice0:amd64 (22.07.5-2ubuntu1.4, 22.07.5-2ubuntu1.5), libde265-0:amd64 (1.0.8-1ubuntu0.1, 1.0.8-1ubuntu0.3), openjdk-17-jre-headless:amd64 (17.0.9+9-1~22.04, 17.0.10+7-1~22.04.1), binutils:amd64 (2.38-4ubuntu2.5, 2.38-4ubuntu2.6), libuv1:amd64 (1.43.0-1, 1.43.0-1ubuntu0.1), dns-root-data:amd64 (2021011101, 2023112702~ubuntu0.22.04.1), openssl:amd64 (3.0.2-0ubuntu1.14, 3.0.2-0ubuntu1.15), passwd:amd64 (1:4.8.1-2ubuntu2.1, 1:4.8.1-2ubuntu2.2), linux-libc-dev:amd64 (5.15.0-94.104, 5.15.0-101.111) End-Date: 2024-03-22  17:16:51 </p><p>Start-Date: 2024-03-22  17:20:25 Commandline: aptdaemon role='role-commit-packages' sender=':1.152' Remove: linux-modules-nvidia-535-6.5.0-15-generic:amd64 (6.5.0-15.15~22.04.1+1), linux-objects-nvidia-535-6.5.0-15-generic:amd64 (6.5.0-15.15~22.04.1+1), linux-modules-extra-6.5.0-15-generic:amd64 (6.5.0-15.15~22.04.1), linux-hwe-6.5-headers-6.5.0-15:amd64 (6.5.0-15.15~22.04.1), linux-modules-6.5.0-15-generic:amd64 (6.5.0-15.15~22.04.1), linux-signatures-nvidia-6.5.0-15-generic:amd64 (6.5.0-15.15~22.04.1+1), linux-image-6.5.0-15-generic:amd64 (6.5.0-15.15~22.04.1), linux-headers-6.5.0-15-generic:amd64 (6.5.0-15.15~22.04.1) ``` </p>",linux;desktop;other;firefox-1240;firefox-12401;,firefox,other,en-US,1643657;,elias__
1443031,2024-03-22 19:55:55 -0700,2024-03-23 03:50:54 -0700,https://timesofindia.indiatimes.com/technology/tech-news/government-issues-important-warning-for-mozilla-firefox-web-browser-details/articleshow/108710664.cms,"<p>The news appleared in Indian press and it says do not use mozzila . Please advise:  the link follows; </p><p><a href=""https://timesofindia.indiatimes.com/technology/tech-news/government-issues-important-warning-for-mozilla-firefox-web-browser-details/articleshow/108710664.cms"" rel=""nofollow"">https://timesofindia.indiatimes.com/technology/tech-news/government-issues-important-warning-for-mozilla-firefox-web-browser-details/articleshow/108710664.cms</a> </p><p>Please advise  </p><p>Avi </p>",desktop;privacy-and-security_1;windows-11;firefox-1240;firefox-12401;,firefox,privacy-and-security,en-US,1643666;,avtareto
1443028,2024-03-22 17:56:21 -0700,2024-03-23 05:28:51 -0700,"Huge gaps in MathML's ""mtable"" render output","<p>I don't know if that was supposed to look like, but when rendering MathML in Firefox 124.0.1 when one uses ""mtable"" element the browser adds very huge gaps around. </p><p>The included image shows output for the following code: </p><p>&lt;math display=""block""&gt; </p><pre> &lt;mfrac&gt;    &lt;mi&gt;A&lt;/mi&gt;    &lt;mn&gt;2&lt;/mn&gt;  &lt;/mfrac&gt;  &lt;mo&gt;=&lt;/mo&gt;  &lt;mrow&gt;  &lt;mo&gt; ( &lt;/mo&gt;  &lt;mtable&gt;&lt;mtr&gt;&lt;mtd&gt;&lt;mn&gt;1&lt;/mn&gt;&lt;/mtd&gt;&lt;mtd&gt;&lt;mn&gt;0&lt;/mn&gt;&lt;/mtd&gt;&lt;mtd&gt;&lt;mn&gt;0&lt;/mn&gt;&lt;/mtd&gt;&lt;/mtr&gt;&lt;mtr&gt;&lt;mtd&gt;&lt;mn&gt;0&lt;/mn&gt;&lt;/mtd&gt;&lt;mtd&gt;&lt;mn&gt;1&lt;/mn&gt;&lt;/mtd&gt;&lt;mtd&gt;&lt;mn&gt;0&lt;/mn&gt;&lt;/mtd&gt;&lt;/mtr&gt;&lt;mtr&gt;&lt;mtd&gt;&lt;mn&gt;0&lt;/mn&gt;&lt;/mtd&gt;&lt;mtd&gt;&lt;mn&gt;0&lt;/mn&gt;&lt;/mtd&gt;&lt;mtd&gt;&lt;mn&gt;1&lt;/mn&gt;&lt;/mtd&gt;&lt;/mtr&gt;&lt;/mtable&gt;  &lt;mo&gt; ) &lt;/mo&gt; </pre> <p>&lt;/mrow&gt; &lt;/math&gt; </p>",linux;desktop;other;firefox-1240;firefox-12401;,firefox,other,en-US,1643682;,felix.leg
