id,created,updated,title,content,tags,product,topic,locale,answers,creator
1437291,2024-01-20 09:21:54 -0800,2024-01-20 09:21:54 -0800,"""Bookmark  Current Tab"" automatically save the bookmark in the ""Other Bookmarks"" folder instead of allowing me to save it in my desired folder.","<p>Prior to updating to Windows 11 I was able to specify the bookmark folder that I wanted to save the bookmark in when I pressed ""Bookmark Current Tab"" or ""Ctrl-D"". Now it automatically saves the bookmark in the ""Other Bookmarks"" folder instead of allowing me to save it in my desired folder? I then have to find the saved bookmark and manually move it to the desired folder. Is there a fix for this or is this a permanent feature change? Thanks for your help. </p>",desktop;bookmarks;windows-11;firefox-1210;firefox-12101;,firefox,bookmarks,en-US,"",johnschlo
1437286,2024-01-20 07:58:23 -0800,2024-01-20 07:58:23 -0800,inteference between : bookmarks shorcut of firefox (alt+number) and unicode shorcut (alt + number),"<p>Hi everyone,  </p><p>First of all, thank you for your help you brought me long time ago reading yours answers concerning different others issues. Today, I didn't find the answer to my issue in the historic base of questions/answers...Maybe, I also missed the answer... anyway... </p><p>My problem is the following: I have habits to use the unicode shortcut every day (exemple&nbsp;: ä &lt;--&gt; alt+132) but this is not possible if the ""Bookmark Toolbar Shortcuts"" add-ons of firefox is active because I suppose there inteference with bookmarks shorcut that I also use a lot. So, I have to disable every time the add-ons, which is a boring operation... I tried to modify the shorcut of the ""bookmark toolbar shorcut"" add-ons but, Firefox send me ""you can't override firefox shorcut"".... </p><p>Does someone find a solution to this problem&nbsp;?  </p><p>I found this link which talk about of the subject but without a real answer&nbsp;: <a href=""https://superuser.com/questions/1322464/how-to-prevent-firefox-keyboard-shortcuts-from-interfering-with-unicode-input"" rel=""nofollow"">https://superuser.com/questions/1322464/how-to-prevent-firefox-keyboard-shortcuts-from-interfering-with-unicode-input</a> </p><p>I thank you in advance for you help! </p><p>kind regards, </p><p>Simon </p>",desktop;tips;windows-10;firefox-1210;firefox-12101;,firefox,tips,en-US,"",Simon463.
1437284,2024-01-20 07:40:24 -0800,2024-01-20 07:40:24 -0800,Pictures looking dark ish,<p>Firefox task on left. Edge on right. </p>,desktop;other;windows-10;firefox-1210;firefox-12101;,firefox,other,en-US,"",ozelkuvv42
1437281,2024-01-20 06:57:30 -0800,2024-01-20 06:57:30 -0800,How to configure scroll speed deceleration when using touch screen,"<p>I am having a hard time getting accustomed to the Firefox scrolling experience. I am only using the touch pad and the touch screen. When I release the finger the time it takes for the scroll speed to come to a halt is way longer than on Chromium browsers and uncomfortable. I want to configure this to decelerate faster or to remove the smoothing completely. </p><p>I have tried playing around with scroll configurations and I found that setting <strong>apz.gtk.kinetic_scroll.enabled</strong> =false disables smoothing correctly, but only works for touch pad, not for touch screen. </p><p>- Is there some config I am missing to disable this kinetic scroll using touch screen? - Is there a preference where I can halve the time it takes to decelerate, rather than disable it completely? </p><p>I am running Ubuntu 22.04 on Wayland if that makes a difference. </p>",linux;desktop;customize;,firefox,customize,en-US,"",sirdorius
1437280,2024-01-20 06:47:13 -0800,2024-01-20 06:47:13 -0800,Now warning Win10 crash on closing tab in Firefox,"<p>Hi, </p><p>Firefox = 121.0.1 64-bit Win10 = 22H2 (19045.3930) </p><p>Not for the first time but the 3rd in the past few months I was closing a tab in Firefox and my PC immediately reset. No warning, just straight to blank screen as soon as I closed a tab (I had 4 open). Next thing I knew it was going through re-boot. No crash report in Firefox. </p><p>This last time I had Facebook open, I had a video in Facebook popped-out, it had finished playing and I went to close the FB tab. </p><p>Ian. </p>",desktop;tabs;windows-10;firefox-1210;,firefox,tabs,en-US,"",ian120
1437279,2024-01-20 06:39:54 -0800,2024-01-20 06:39:54 -0800,"*.htm.part file malware file downloaded withoout my knowledge / authority, and now I can't remove. Any thoughts??","<p>Hi Recently my MS Windows Security app told me that I had malware which I'm very confident from was from using Firefox. The filename is: 3wabt6OY.htm.part and it went to a standard ""download"" folder on om win 10 PC. </p><p>Firstly I just wanted to flag this as a possible bug issue for Firefox? </p><p>Secondly I wondered if there was any thoughts on how to avoid this happening again and how to remove it please?! As Although MS Security identifies the file, it doesn't seem to be able to actually get rid of it!! Nor does SuperAntiSpyware. </p><p>Many thanks in advance </p>",desktop;other;windows-10;firefox-1210;,firefox,other,en-US,"",eddybaby
1437278,2024-01-20 06:32:20 -0800,2024-01-20 06:32:20 -0800,Add-ons Manager Tab,<p>The Add-ons Manager tab is automatically presented as one of the tabs when I start Mozilla.  How do I configure Mozilla so that the Add-ons Manager tab is not presented? </p>,desktop;customize;windows-11;firefox-1210;firefox-12101;,firefox,customize,en-US,"",David.Conway
1437277,2024-01-20 06:21:45 -0800,2024-01-20 06:21:45 -0800,Outlook.com,"<p>I want to order products from based tomorrow <a href=""http://12.PM"" rel=""nofollow"">12.PM</a> I come to pick up please and I want to order payment for me some money please </p>",desktop;bookmarks;,firefox,bookmarks,en-US,"",amynguyen1010
1437275,2024-01-20 04:43:52 -0800,2024-01-20 05:18:35 -0800,"when I browse on a website,a banner is displayed on top of the page and it does not load the page properly","<p>Browsing a webpage, it does not load the following tab is displayed on top of the page&nbsp;: This page is slowing down Firefox. To speed up your browser,stop this page. When clicking on the stop button, the page displays all infotmation but nothing is clickable </p>",desktop;website-breakages;,firefox,website-breakages,en-US,1631719;,Div
1437270,2024-01-20 02:55:19 -0800,2024-01-20 05:27:34 -0800,"Go back one page, not working on Microsoft forum website","<p>I searched Microsoft forum and opened the first link (<a href=""https://answers.microsoft.com/en-us"" rel=""nofollow"">https://answers.microsoft.com/en-us</a>). On Firefox, Go back one page (back arrow) button was not working on this website. </p>",desktop;windows-11;website-breakages;firefox-1210;firefox-12101;,firefox,website-breakages,en-US,1631721;,maliksaad
1437269,2024-01-20 02:53:16 -0800,2024-01-20 02:53:16 -0800,How to focus content instead of address bar when (custom) Home page is opened?,"<p>Hi. </p><p>Similar to this question: <a href=""https://support.mozilla.org/ln/questions/1291938"" rel=""nofollow"">https://support.mozilla.org/ln/questions/1291938</a> </p><p>I would like to know how to customize ""autoconfig.js"" or ""firefox.cfg"" so that the home page is focused instead of the address bar when I open Firefox. </p><p>I the linked question, the following solutions works fine for focus content on New Tab: </p><pre>    Services.obs.addObserver((event) =&gt; {       window = BrowserWindowTracker.getTopWindow();       window.gBrowser.selectedBrowser.focus();     }, ""browser-open-newtab-start"");   } catch(e) { Cu.reportError(e); } </pre> <p>It works fine, but I can't make it work for the Homage page when it's configured to open a local file. </p><p>I tried to bind the ""window.gBrowser.selectedBrowser.focus();"" action on the ""browser-open-homepage-start"" event but it has not effect. </p><p>Thanks. </p>",linux;desktop;customize;firefox-1210;firefox-12101;,firefox,customize,en-US,"",ADGB
1437267,2024-01-20 01:41:28 -0800,2024-01-20 07:53:08 -0800,firefox won't play prime video,<p>says video is not available. amazon prime video won't play. mac studio running sonoma. </p>,desktop;fix-problems;mac-os-x-1015;firefox-1210;firefox-12101;,firefox,fix-problems,en-US,1631741;1631743;,tlandis100
1437264,2024-01-20 00:37:55 -0800,2024-01-20 00:37:55 -0800,Firefox thinks I am in India,<p>Why does Firefox think me location is India when I am not? </p><p>Pocket gives me mostly stories about India. British Airways website also gave me India as my location. </p><p>I went to Settings &gt; Cookies and Site Data And clear all the data. </p><p>But still getting India stories in Pocket. </p><p>or does everyone get loads of stories about India in Pocket? </p>,desktop;other;windows-10;firefox-1210;,firefox,other,en-US,"",guyldn
1437260,2024-01-19 23:17:34 -0800,2024-01-19 23:17:34 -0800,How to recover vanished history???,"<p>Computer stopped responding to wireless keyboard &amp; mouse. I tried turning it off &amp; back on, unplugging &amp; replugging, switching dongles around; no good. Went out &amp; bought a cabled mouse; seems to be working OK now. Except that the history of my last session HAS VANISHED. HELP, PLEASE! </p>",desktop;fix-problems;,firefox,fix-problems,en-US,"",Joe.New
1437259,2024-01-19 22:43:04 -0800,2024-01-20 01:11:49 -0800,Won't connect to the internet and doesn't load pages at all,"<p>Hello, this is a problem I've been dealing with for nearly 2 months now. Currently using Linux Mint Cinnamon </p><p>The browser won't connect to any websites or even try to load them, anytime I search for something it immediately goes to the error page. I've been struggling with internet on my PC for months and all was fixed when I hooked up ethernet, except for Firefox. </p><p>I've gone into about:config countless times. I've restarted it twice, I've tried installing the flatpak version and it's exactly the same result. I've deleted it and reinstalled, nothing. I've unchecked everything I've changed in about:config, once again nothing. </p><p>I can't update it as for some reason it says it's disabled by system administrator, which I don't remember enabling. I checked the firewall and it's perfectly fine. No infections were found when I scanned as well. </p><p>It's starting to become frustrating and I can't even do anything on my PC because it's acting up. Any and all help is more than appreciated and welcome. Thank you. </p>",desktop;fix-problems;,firefox,fix-problems,en-US,1631688;,floofiebloonket
1437257,2024-01-19 22:33:43 -0800,2024-01-20 02:41:26 -0800,view two or more tabs side by side in full screen,<p>I would like to view two separate you tube videos side by side in full screen mode. Is it possible to split them in a screen side by side? </p>,desktop;tabs;windows-11;firefox-1210;firefox-12101;,firefox,tabs,en-US,1631693;,jdowning
1437256,2024-01-19 22:29:38 -0800,2024-01-19 22:29:38 -0800,"playing movies, videos or pod casts is always choppy","<p><strong>When I try to watch movies, videos or pod casts my screen is half choppy.</strong> </p>",desktop;fix-problems;windows-10;firefox-1210;firefox-12101;,firefox,fix-problems,en-US,"",laromantica4
1437253,2024-01-19 20:58:49 -0800,2024-01-19 22:37:27 -0800,All versions after 121 are corrupting my profile . Tested multiple times,"<p>I'm a long time FF user.    Version 121 works perfectly . </p><pre> Ever since 121.01 , updating breaks EVERYTHING.   Most of my add ons cant access their data, websites dont work, etc.   </pre> <pre> Not only that ,  but reverting to 121 does not help.   So the profile data itself is being trashed.  </pre> <pre> Restoring the full profile from a backup is successful, but only with version 121.   Any version beyond that breaks it.  </pre> <pre> I also tried a full delete and reinstall of Firefox, but that did not work.  Same problem. </pre> <pre> A full rebuild of all the add ons from scratch  might be my only option at this point if we cant figure out why this is happening. </pre>",desktop;fix-problems;windows-10;firefox-1210;,firefox,fix-problems,en-US,1631663;1631673;1631677;,jdop
1437251,2024-01-19 20:21:36 -0800,2024-01-19 20:21:36 -0800,Forgot my PIN and now can't export passwords,<p>I'm trying to export my passwords and it's asking for an old email and pin. I have created a new account when old email was disabled. I have no idea what PIN it's asking for. </p>,desktop;privacy-and-security_1;windows-10;firefox-1210;firefox-12101;,firefox,privacy-and-security,en-US,"",ekelly490
1437245,2024-01-19 18:07:13 -0800,2024-01-19 18:14:09 -0800,Firefox Browser,"<p>I'm trying to open Directv Stream but all I get is a line saying ""Old Browser"" </p>",desktop;other;windows-11;firefox-1210;firefox-12101;,firefox,other,en-US,1631635;,eljaymas
1437243,2024-01-19 17:51:56 -0800,2024-01-19 22:16:53 -0800,cut and paste,"<p>While using MS Outlook in FF, it will not cut and paste. However, it does it easily on Yahoo Mail. Please help solve this issue. Jay </p>",desktop;other;needsinfo;windows-10;firefox-1210;firefox-12101;,firefox,other,en-US,1631650;1631676;,drpuccio
1437241,2024-01-19 17:17:54 -0800,2024-01-19 22:16:38 -0800,Dragging and dropping files collapses and locks Firefox bookmarks menu,"<p>121.0.1 (64-bit) on Windows 10 Professional. I'm a Leo and like long walks on the beach. </p><p>For months, I've experienced the Bookmarks menu collapsing (Bookmarks Toolbar, Bookmarks Menu, and Other Bookmarks headings appear but all bookmarks are just gone) and locking up (those headings cannot be opened and closed). </p><p>I have finally noticed that this happens when I am using Windows File Explorer to drag and drop files into my Google Drive opened with an entirely separate Google Chrome browser running concurrently with Firefox. </p><p>To be clear, I have Google Chrome and Explorer at the top of my desktop, with Firefox running behind them. When I drag a file from Windows Explorer over to the Google Chrome browser, the side bookmarks window in Firefox goes haywire. Close and reopening the bookmarks menu brings it back, but the issue remains. </p>",desktop;fix-problems;needsinfo;windows-10;firefox-1210;,firefox,fix-problems,en-US,1631652;1631675;,iamwileecoyote
1437238,2024-01-19 16:41:18 -0800,2024-01-19 19:42:43 -0800,"weird sound plays when typing "";"" or any special character","<p>When i click "";"" or "":"" a weird trumpet like sound plays. </p>",desktop;other;windows-11;firefox-1210;firefox-12101;,firefox,other,en-US,1631653;1631654;,alexstufyt
1437236,2024-01-19 16:27:07 -0800,2024-01-19 21:46:04 -0800,Firefox Tab Groups Would be Very Helpful,"<p>Yes, I know addons exist for it but many work places don't allow installing addons, security wise they can be a concern and these addons have poor UI/UX. I am genuinely considering using Edge over Firefox due to them having better tab groups which I never though I would say. Please implement a simple tab folder, literally just what current Edge has. It is a very useful basic feature and I would really love to have it included in my favorite browser I have been using for over a decade. Thank you. </p>",desktop;customize;needsinfo;windows-11;firefox-1210;,firefox,customize,en-US,1631655;1631662;1631669;,ftwelve
