id,created,updated,title,content,tags,product,topic,locale,answers,creator
1449582,2024-06-11 04:17:12 -0700,2024-06-11 04:17:12 -0700,Firefox crashes when rearranging tabs,"<p>Mozilla firefox crashes very often when rearranging tabs. </p><p>Environment: Ubuntu 22.04, xfce Version: 126.0.2 </p>",desktop;fix-problems;windows-10;,firefox,fix-problems,en-US,"",kaddkaka
1449572,2024-06-11 02:00:53 -0700,2024-06-11 02:00:53 -0700,Words with friends werkt niet meer,"<p>Hallo,   ik speel ""words with friends"" dagelijks.  Browser Firefox via Facebook Sinds een paar weken opent het spel  niet meer. Andere spellen openen wel. Words with friends werkt perfect met Chrome of Edge.   Maar ik werk liever met Firefox. Weet iemand wat de reden is aub&nbsp;?    ik heb al een paar keer de vraag gesteld, maar tot op vandaag noch antwoord, noch oplossing ontvangen. Graag hulp. Met dank bij voorbaat <a href=""https://www.facebook.com/gaming/play/383041995381848/?source=www_homepage_shortcut"" rel=""nofollow"">https://www.facebook.com/gaming/play/383041995381848/?source=www_homepage_shortcut</a> </p>",desktop;windows-10;website-breakages;firefox-1260;firefox-12601;,firefox,website-breakages,nl,"",lieveha
1449565,2024-06-10 22:02:25 -0700,2024-06-10 22:02:25 -0700,Centrum poradenstva a prevencie,"<p>Varovanie: možné bezpečnostné riziko Ako to napraviť, ďakujem Aplikácia Firefox rozpoznala problém a stránku <a href=""http://poradenstvo-mikulas.lepsiweb.sk"" rel=""nofollow"">poradenstvo-mikulas.lepsiweb.sk</a> nenačítala. Webová stránka je buď zle nastavená alebo hodiny na vašom počítači nejdú správne. </p><p>Pravdepodobne stránke vypršala platnosť certifikátu, čo bráni aplikácii Firefox bezpečne sa pripojiť. Ak sa napriek tomu rozhodnete stránku navštíviť, útočníci sa môžu pokúsiť ukradnúť vaše informácie, ako sú heslá, e‑mailové adresy alebo čísla platobných kariet. </p><p>Čo s tým môžete urobiť? </p><p>Tento problém je pravdepodobne na strane webovej stránky a vy ho, bohužiaľ, nedokážete vyriešiť. O probléme môžete informovať správcu webovej stránky. </p><p>Ďalšie informácie… </p>",desktop;download-and-install_1;windows-11;firefox-1260;firefox-12601;,firefox,download-and-install,en-US,"",frajtova
1449563,2024-06-10 21:29:25 -0700,2024-06-10 22:18:17 -0700,images don't load because hyperlink too long FF 126.0.1,"<p>I receive e-mail from websites where I subscribe. Many times, the message from the sites (<a href=""http://kelbyone.com"" rel=""nofollow"">kelbyone.com</a>, to name one) contain a graphic (jpg) that does not display in <a href=""http://Outlook.com"" rel=""nofollow"">Outlook.com</a>. Microsoft Tech Support is unresponsive. The sending websites refuse to help. </p><p>It seems to me that FF chokes on the length of the hyperlink. Here is a sample: <a href=""https://kelbyone.acemlnb.com/lt.php?x=3DZy~GE2JaTN5XV.-wy5heOd~nAnuwAjluw2Z5PEIaOb5p8qy0y.0uJz2nRzit~yjvYwXncWJXCf657"" rel=""nofollow"">https://kelbyone.acemlnb.com/lt.php?x=3DZy~GE2JaTN5XV.-wy5heOd~nAnuwAjluw2Z5PEIaOb5p8qy0y.0uJz2nRzit~yjvYwXncWJXCf657</a> </p><p>If I paste the hyperlink into the search window, the page will load.  When I forward the e-mail from Outlook to yahoo mail, the image displays. </p><p>I am running extensions Adblocker Ultimate and DuckDuckGo Privacy Essentials.  </p><p>I would like help with this, at least, to identify where the problem is. </p>",desktop;fix-problems;mac-os-x-1015;firefox-1260;firefox-12601;,firefox,fix-problems,en-US,"",lcdebaca52
1449562,2024-06-10 21:01:20 -0700,2024-06-10 21:01:20 -0700,Random Total Freezes,"<p>For a while now, I've been having recurring issues with Firefox desktop freezing and becoming totally unresponsive. If there's any pattern to what causes it, I haven't been able to notice it; sometimes it happens as soon as I open the browser, sometimes it happens after several hours, sometimes it happens twice in ten minutes, sometimes it happens twice in a few hours (however, I can count the number of days it's happened less than twice in one day in the past few weeks on the fingers of one hand). When the browser freezes, it becomes totally unresponsive - it doesn't fade or display ""Not Responding"", and Task Manager shows nothing abnormal, but it doesn't accept any input at all, any video or other animated material that may have been displaying freezes, and it can only be ""fixed"" by force quitting from the task manager and reopening. This is exclusively a firefox issue; other programs open at the same time as the browser freezes are not affected. </p><p>The only real lead I have as to what could be going on is that sometimes, things don't freeze all at once, but in a cascading effect. For example, tabs, bookmarks, etc. might not highlight when moused over, but still accept the clicks, or selecting another tab might causes the address bar to display the URL of the selected tab, but the screen displayed in the window will not change. Once these cascading changes start, they generally progress to total freeze before I have a chance to do much with that information (only a few seconds), but it's unusual enough behavior to be worth noticing. </p><p>Things I've already tried that haven't fixed the issue: </p> <ul><li> Reducing the number of tabs used and otherwise reducing Firefox's system resource usage has not impacted the problem in any way. </li><li> Running in Troubleshoot Mode has not had a consistent effect on the problem (the most recent time I did, the browser ran stably for longer than I could stand to use the internet without my ad blocker, but this is only one data point in an already inconsistent spread; prior instances of the problem have occurred in Troubleshoot Mode) </li><li> Disabling hardware acceleration has not fixed the issue. </li><li> The issue has persisted through multiple refreshes and at least one full uninstall and clean reinstall. </li><li> The issue persisted after creating and switching to a new profile multiple times. </li><li> The issue persisted after renaming places.sqlite </li><li> The issue persisted after clearing cache and cookies multiple times. </li><li> The issue persisted after clearing downloads and history. </li><li> And very likely some other stuff that I'm forgetting, I've been trying to fix this on my own for a while now. </li></ul>",desktop;fix-problems;windows-10;firefox-1260;firefox-12601;,firefox,fix-problems,en-US,"",8bitorne
1449559,2024-06-10 18:44:08 -0700,2024-06-10 18:44:08 -0700,Sidebar unlocatable,"<p>Bought a new computer. All my toolbar bookmarks migrated across successfully. Sidebar symbol missing from the menu bar and I couldn't find where these Book Marks were at first. But then I right clicked on the menu bar, clicked on Manage Book Marks  which opened a Library box and there they were. Does anyone know an easier way to access them please? Any tips gratefully received. Thanks, Bob </p>",desktop;bookmarks;windows-11;firefox-1260;firefox-12601;,firefox,bookmarks,en-US,"",bobofalex
1449558,2024-06-10 18:30:53 -0700,2024-06-10 18:30:53 -0700,Perms cant be given sites,"<p>as you can see in the screenshot it says the mic is only""allowed temporarily"" and when i go to permissions it doesn't let me add a site to grant perms i can just search for sites and thats it. its annoying cuz on textnow i have to keep granting perms </p>",desktop;privacy-and-security_1;windows-10;firefox-1260;firefox-12601;,firefox,privacy-and-security,en-US,"",STERBEN_BLADE
1449555,2024-06-10 17:05:21 -0700,2024-06-10 17:05:21 -0700,COOKIES FOR STREAMING VIDEOS,"<p>Good morning/afternoon/evening!  Can you please say to me where the cookies/cache of websites with P2P(PICTURE TO PICTURE) or how is called the player to view outside the page on PC/LAPTOP in WINDOWS 11? I want to see a video 📹,I mean the cache of a video from a TV stream that I couldn't see and my AMD Graphics Video card crushed. Do you understand what I'm asking? 🤔  Where are temporary stored/saved the cache of videos of the sites I see in private browser Mozilla Firefox? You know what I want to ask you? 🤔 În what folder/file are stored the temporary Internet files of a opened website private browser? Sorry my bad English. Do you know? Give me please the steps. I ask your help to all community. </p>",mobile;other;android;firefox-1260;,firefox,basic-browsing-firefox,en-US,"",MINDFREAK85
