id,created,updated,title,content,tags,product,topic,locale,answers,creator
1435596,2024-01-03 00:25:57 -0800,2024-01-03 00:25:57 -0800,My Upspot Account doesn't Open,"<p>Secure Connection Failed </p><p>An error occurred during a connection to <a href=""http://m.upspotacademy.com"" rel=""nofollow"">m.upspotacademy.com</a>. PR_END_OF_FILE_ERROR </p><p>Error code: PR_END_OF_FILE_ERROR </p><pre>   The page you are trying to view cannot be shown because the authenticity of the received data could not be verified.    Please contact the website owners to inform them of this problem. </pre>",desktop;windows-10;website-breakages;firefox-1210;,firefox,website-breakages,en-US,"",halim.cd.62
1435595,2024-01-03 00:09:21 -0800,2024-01-03 00:09:21 -0800,Firefox jumps at random intervals when scrolling?,"<p>At first I thought it was my mouse, but then I tried scrolling with the arrow keys and it does it still. </p><p>It's not in any specific website, it'll happen anywhere at any time.. I'll be scrolling and suddenly the page jumps about 10-20 lines in any direction. </p>",desktop;other;windows-10;firefox-1210;,firefox,other,en-US,"",muntwiler
1435593,2024-01-03 00:04:21 -0800,2024-01-03 00:11:05 -0800,Tabs remembered contrary to settings,"<p>Even though i\I have the option to remember tabs and opened windows UNticked, Firefox opens will all previous tabs remembered. How to prevent that&nbsp;? </p>",desktop;tabs;windows-10;firefox-1210;,firefox,tabs,en-US,1627975;,Sebastian42
1435592,2024-01-02 23:50:31 -0800,2024-01-02 23:50:31 -0800,How to make FireFox suggest default selection in search bar,<p>How to make first firefox suggest default (instead of search in search bar). Attached image for reference. </p>,desktop;tips;mac-os-x-1015;firefox-11550;firefox-1155;,firefox,tips,en-US,"",mksingh458
1435591,2024-01-02 23:38:40 -0800,2024-01-02 23:59:31 -0800,I'm looking for a way that I can get print result after user click the confirm button in the print dialog.,"<p>I'm currently developing a website that use user printer. And I'm looking for a hook that I can use to know user click the confirm or cancel in print dialog(or print preview window). the onafterprint method will trigger before user click confirm so I guess it's not an option. </p><p>Also, someone please tell me the topic describes my questions, I really don't know which topic is best for my question. </p>",desktop;tips;windows-10;firefox-1210;,firefox,tips,en-US,1627970;1627974;,979597463
1435590,2024-01-02 23:38:33 -0800,2024-01-02 23:38:33 -0800,How to view notifcations of firefox that are not even 3 days old but are no longer in action center of windows 10,"<p>someone on microsoft told me about this </p><p>but i couldnt find it </p><p><br> </p><p>Forum helper </p><p>Review the information below. Hope it helps </p><pre>                    Where do I find Firefox notifications </pre> <p>Go to the FFox settings - select ""Settings"" on the left &gt; click on  </p><pre>   ""Privacy &amp; Security"" Scroll down to the ""Permissions""  </pre> <pre>                    window and select ""Notification"" </pre> <pre>                      Where can I find all my notifications </pre> <p>You can then proceed, with the following steps&nbsp;: Go to Settings and click </p><pre>             Notifications. From the notifications toggle &gt; click on </pre> <p>Advanced settings. Then navigate to - Notification history </p><p>``````````````````````````````````````````````````` if my answer is helpful&nbsp;: Marked with,.Yes on this reply page. Thanks </p><p><br> </p><p>this is all i saw when i went to permissions and then notifcations </p>",desktop;fix-problems;windows-10;firefox-1210;,firefox,fix-problems,en-US,"",thespiankyle550086
1435586,2024-01-02 22:39:25 -0800,2024-01-02 22:39:25 -0800,Alternate event for Window unload event,"<p>In my web application we have unload event of window which is working correctly in chrome and Edge, it is not working with Firefox browser. I had written a logic to close a batch which is in progress inside unload event, because of this issue all of my batches are stuck in progress state. So please help me to handle this issue is there any alternative for unload event. </p><p>My code in Extjs application&nbsp;: window.addEventListener('unload', this.handleBrowserClose); </p><pre> handleBrowserClose: function (e) {      if (!this.loggingOut) {          Ext.getApplication().logOut(              {                  suppressMessage: true,                  async: true              }          );          this.loggingOut = true;      }  } </pre>",desktop;windows-11;website-breakages;,firefox,website-breakages,en-US,"",seshusrinivasraju
1435584,2024-01-02 21:22:30 -0800,2024-01-02 21:22:30 -0800,somehow disabled search suggestions,"<p>When i try to open <a href=""http://youtube.com"" rel=""nofollow"">youtube.com</a> for example i used to only type in you or even you y for firefox to finish the whole URL for me, but sometime last month it dissapeared and never figuered out why after ALOT of trouble shooting to the point where I felt the need to create a new firefox account. Can you fix this for me? or just make everything deafult? </p>",desktop;customize;mac-os-x-1015;firefox-1210;,firefox,customize,en-US,"",ask.davidsen1
1435583,2024-01-02 21:11:46 -0800,2024-01-02 21:39:50 -0800,reader mode not working on a web site,"<p><a href=""https://arstechnica.com/cars/2023/12/here-are-the-10-best-cars-we-drove-in-2023/"" rel=""nofollow"">https://arstechnica.com/cars/2023/12/here-are-the-10-best-cars-we-drove-in-2023/</a> The reader mode doesn't work on the above web site. </p>",desktop;website-breakages;,firefox,website-breakages,en-US,1627961;,aoctovian
1435582,2024-01-02 20:38:39 -0800,2024-01-02 20:38:39 -0800,Barra espaço,<p>tem como tirar esse espaço embaixo da guia? achei a barra exageradamente grande... e com isso ela ficaria menor e mais agradavel </p>,desktop;customize;windows-10;firefox-1210;,firefox,customize,pt-BR,"",alexsilva1101
1435580,2024-01-02 20:05:51 -0800,2024-01-02 20:05:51 -0800,Strange problem uploading images,"<p>A very strange problem uploading images to Facebook and also to a forum from my desktop produces a washed out image.  If I upload the same image file to the same location from another computer (laptop) it looks completely normal. </p><p>I am running latest build freshly installed of Firefox (did this as part of trouble shooting).  I tried it on Firefox ESR and it still did it.  Version is 121.0 64 bit. </p><p>Both Facebook and the forum save a compressed version of the image, I have copied the original and downloaded version from the forum below.  The forum version has increased in size but the histogram has changed,  They are both tagged sRGB so it doesn't appear to be a color management issue. </p><p>I tried uploading the same file from my desktop using edge browser and this worked fine.  It is only the combination of my desktop and Firefox that has this problem and it has the issue in two places so far Facebook and on online forum I frequent.  Uploads to Google drive are working fine. </p><p>Does anyone have any thoughts on what the issue might be? -  it is clearly connected to Firefox which seems to be triggering something in the forum software and in Facebook, that does not occur from the laptop as I can upload things from edge browser just fine.  Firefox should just deliver the image to the new location I would think??? </p>",desktop;other;windows-10;firefox-1210;,firefox,other,en-US,"",chrisx21
1435578,2024-01-02 19:19:53 -0800,2024-01-02 19:19:53 -0800,Need improvemen.,<p>Central Bank Of India Internet Bank fund transfer's processing of NEFt transfer webpage second page isn’t working in Hp probook 440 g8 notebook. </p>,desktop;fix-problems;,firefox,fix-problems,en-US,"",sen11an
1435576,2024-01-02 17:57:13 -0800,2024-01-02 19:15:11 -0800,fonts,<p>I am vainly trying to increase size of fonts in Firefox in Linux cannot find GENERAL TAB help </p>,linux;desktop;other;firefox-1210;,firefox,other,en-US,1627955;,schutte2021
1435574,2024-01-02 17:42:45 -0800,2024-01-02 18:47:49 -0800,"Firefox won’t open on my desktop, just an error message",<p>Error message is XULRunner Error:Platform version’121.0’ is not compatible with Min version&gt;=120.01 Max version&lt;=120.01 </p>,desktop;fix-problems;needsinfo;,firefox,fix-problems,en-US,1627949;1627953;,d.bott5
1435570,2024-01-02 17:17:21 -0800,2024-01-02 17:17:21 -0800,"Missing ""restore closed tab"" Button in Toolbar","<p>I use Firefox on my Win11 and Win10 PCs. The Win11 version of Firefox has a button to restore the recent closed button, but the Win10 version doesn't. I wonder why? </p>",desktop;customize;windows-10;toolbar;firefox-1210;,firefox,customize,en-US,"",942371623
1435568,2024-01-02 17:13:32 -0800,2024-01-02 17:13:32 -0800,No Comments from TownHall VIP Membership,"<p>I run Firefox 121.0 on Windows 10 Pro.  I use a VPN (ExpressVPN) and normally run Ghostery and uBlock Origin.  When I log onto <a href=""http://Townhall.com"" rel=""nofollow"">Townhall.com</a> and enter my VIP credentials all is fine.  However, when I read an article I should be able to access the comments.  I cannot in Firefox and this is something that has occurred about 3-4 weeks ago.  For years I have not had any problem like this with Firefox. </p><p>I tested VIP access with my iPhone - works fine.  I tried Vivaldi - works fine.  I tried Chrome - works fine.  I try Firefox - fails! </p><p>I ran Firefox in ""TroubleShoot"" mode, with all add-ons turned off and it also fails.  Even when I run Vivaldi I have Ghostery and ad blocking turned on, but Ghostery does allow <a href=""http://townhall.com"" rel=""nofollow"">townhall.com</a> on their whitelist. </p><p>I've send emails to <a href=""http://Townhall.com"" rel=""nofollow"">Townhall.com</a> and am not getting any responses.  However, I was having the issue with all devices but all have been fixed except with Firefox.  So, I have no idea why this is an issue with Firefox but not with any other device. </p><p>Any thoughts? </p>",desktop;windows-10;website-breakages;firefox-1210;,firefox,website-breakages,en-US,"",BPaul_H
1435566,2024-01-02 16:32:21 -0800,2024-01-02 18:14:50 -0800,Trojan:HTML/Phish!pz,"<p>Below are communication I have had with both Glarysoft Support and Hideaway VPN by Firetrust Limited. I have narrowed the issue of detection of Trojan:HTML/Phish!pz by MS Defender While running Glary Utilities. (see screenshot). </p> <hr> <p>Jeremy, Thank you for your rapid response. I connected to 3 different VPN servers, and used the link you provided (<a href=""https://user-support.firetrust.com/Tickets/Reply/36314"" rel=""nofollow"">https://user-support.firetrust.com/Tickets/Reply/36314</a>) below via Firefox, Chrome, and Edge. Connections to Seattle, Dallas, and Washington DC all produced the same result as before ONLY with Firefox. The issue WAS NOT reproduced by Chrome or Edge. I hope this helps resolve the problem because, I have issues with both Edge and Chrome. Particularly with their self-serving propensities. </p><p>Rodman L Browning [edited] @hotmail.com ________________________________________ -System: -Processor: Intel(R) Core(TM) i7-3770 CPU @ 3.40GHz   3.40 GHz -Installed RAM: 32.0 GB -Device ID  3B29AE3B-C784-4651-9123-A91B7C41393A -Product ID 00330-80000-00000-AA737 -System OS: Windows 10 Pro 64-bit operating system, x64-based processor - -MS Defender v1.403.1528.0 -Created 1/2/2024 3:58am -Last updated 01/02/2024 11:51am - -Glary Utilities Pro v6.4.0.7 -VPN: Hideaway by Firetrust Limited v4.20.4 </p><p>- <img> - This MS Defender notice occurred during a 1-Click Maintenance/Temporary File Cleaner; - file: C:\Users\Rodman\AppData\Local\Mozilla\Firefox\Profiles\wg6stjgb.default-release-1640201893394 \cache2\entries\08D20F0659D23D2EF0621F044374EA076FED5146 -An immediate 1-Click Maintenance/Temporary File Cleaner produces no notices (I assume because the Trojan has been quarantined). However, on further investigation I discovered that this notice occurs when the VPN (Hideaway by -Firetrust Limited) is active. Turning off the VPN then opening Firefox and visiting the same site produced ""No notice"" from MS Defender during a 1-Click Maintenance/Temporary File Cleaner procedure. -Therefore, I am CCing a copy of this to Hideaway Support. Please contact them ([edited] @firetrust.com) to see if together a resolution can be obtained. - </p><p>From: Firetrust Support &lt;[edited] @firetrust.com&gt;  Sent: Tuesday, January 2, 2024 4:52 PM To: [edited] @hotmail.com Subject: New reply added to Ticket # 36314 - Trojan:HTML/Phish!pz on version 6.4.0.7 Pro - Further investigation </p> <ol><li>-- Please type your reply above this line --# </li></ol> <p>Hi there, Yes, that is odd, as nothing in Hideaway itself could cause this, possibly however it is due to the IP address of the server you are connected to via Hideaway? </p><p>You can see what IP address it is in Hideaway while it is connected on the main Hideaway screen, eg the below screenshot for the NZ server: </p><pre><img> </pre> <p>You can reply to this email to add your response or you can view/answer the ticket by clicking here: <a href=""https://user-support.firetrust.com/Tickets/Reply/36314"" rel=""nofollow"">https://user-support.firetrust.com/Tickets/Reply/36314</a> . </p><p><br> Current email has been sent to the next addresses: [edited] @glarysoft.com </p><p><br> </p> <hr> <p>Jeremy Clark&nbsp;:. Firetrust Support firetrust INTERNET SECURITY Christchurch, New Zealand <a href=""http://www.firetrust.com"" rel=""nofollow"">www.firetrust.com</a> </p><p>[ref#:e2aab13a-9be6-48d1:ref] </p>",desktop;privacy-and-security_1;windows-10;firefox-1210;,firefox,privacy-and-security,en-US,1627947;,rodmanlb
1435565,2024-01-02 16:29:52 -0800,2024-01-02 16:29:52 -0800,Launch parallel independent firefox instances,"<p>Hi I need to run multiple firefox instances, each with a dedicated profile The following used to work before version 121 on MacOS: /Applications/Firefox.app/Contents/MacOS/firefox-bin -no-remote -p &amp; </p><p>The above method is not perfect, but it works. Since Firefox upgraded to 121, the above method stopped working. </p><p>Any way to launch multiple instances as before? Hate to switch to Chrome, but Chrome allow you to switch easily. </p>",desktop;fix-problems;,firefox,fix-problems,en-US,"",Riordan
1435564,2024-01-02 16:02:39 -0800,2024-01-02 17:32:41 -0800,Unable to redeem Microsoft rewards since late June.,"<p>The title says it all.  Microsoft writes back stating no voip phones, no VPN, no multiple users, no searching in multiple markets.  I do NONE of those things, and NEVER have.  I have a feeling it is somehow in my Firefox settings, although they are not looking amiss to me; or perhaps when my cellular company went to full time 5G (Google Pixel 6;) it is US Cellular (USA) and I've never had a problem before.   </p><p>I get all of the way to the confirmation screen (with my phone number.)  When I click it says ""there is a problem with my account of ofer."" </p><p>I got a new to me laptop in February, and about a month later windows 11 was auto downloaded.  I use Ublock Origin, and Privacy Possum (they were never a problem prior to June) and have disabled them to try to redeem.  I have tried with Chrome, Edge, and Bing on Firefox, on my PC.  Bing on Firefox, and Chrome on my phone.  I talked to Google, US Cellular, and (my ISP) Spectrum; all say they do not have settings which would cause the problem.  I am at my wits end, many other folks are complaining of this too.  Please help. </p>",desktop;other;windows-11;firefox-1210;,firefox,other,en-US,1627944;,newsie2000
