id,created,updated,title,content,tags,product,topic,locale,answers,creator
1308754,2020-10-16 01:01:31 -0700,2020-10-16 01:01:31 -0700,Avast (pro) blocks then reports: https://rclick.site/3LtGKV  ... reporting it as a phlishing site/bot whatever - [[FF vs. 81.0.2 (64 bit).]],"<p><strong>Avast (pro) blocks then reports: https://rclick.site/3LtGKV  ... reporting it as a phlishing site/bot whatever - <a class=""new"" href=""/en-US/kb/new?title=FF+vs.+81.0.2+%2864+bit%29."" rel=""nofollow"" title=""Page does not exist."">FF vs. 81.0.2 (64 bit).</a></strong> </p><p>Dear Girls and Guys, </p><pre>As detailed above, Firefox starts then the first thing seen is a Avast warning screen saying it has ""blocked an rclick site due to phlishing risk."" </pre> <pre>OK - not a drama - find the URL or add-on causing or calling that site, then bin (secure shred) it; followed by reporting it to folks like you, Avast, IObit, etc. {ie. normal practice}. </pre> <p>Issues. 1. I cannot find the site referenced in bookmarks. 1.1. Looked/searched manually running FF; 1.2. Saved all BM's to a HTML file (secured directory); then ran string searches (full and partial). ... Could not find it. 2. Tried to find reference to it at Avast (= failed, response bot is not designed for technical stuff - above finger painting or 'mud-pies' or 'how to change nappy'). 3. I have been working through my Firefox add-on apps - mainly because I think (fits logically) one of those is doing the site call (internal function) to this 'r-click' site ... thus far without luck. 3.1 I'm not young (though dementure might help that) - thus also have Seamonkey and Waterfox, etc., installed to look at/watch (progress, developments, teams talking, etc). As a rule all those have the same groupings of Apps/ext's - because I look at and rate those also. (have done, since the early Mozilla days). </p><p>The https:rclick.site/3LtGKV (phlishing) message/reaction does not come-up in Seamonkey, Waterfox or Tor browsers (using many of the same plug-in apps/ext's). </p><p>3.2 I was going to enter it in my firewall black list (added preventative), but would prefer to enter the actual calling application or URL; then report the same elsewhere. </p><p>Concluding and question. </p><pre>In theory - I think it is an extention or application 'calling home' - possibly innocently - in which case I would like to remove it, then report it (as either problematic or malicious - in the extentions &amp; apps reporting system). </pre> <pre>Thing is I cannot find it/what is causing it. </pre> <pre>It cannot damage me/my systems; however it can - if malicious - damage innocent/unsuspecting others. </pre> <pre>Thank you and much sincere grovelling ... for clever tips and thoughts you may wish to bestow, </pre> <pre>Be safe, keep well and keep smiling, </pre> <pre>Rick. </pre>",desktop;other;windows-10;firefox-810;,firefox,other,en-US,"",richardvfinney
1308753,2020-10-16 00:56:54 -0700,2020-10-16 00:56:54 -0700,Edge starts unallowed,"<p>Free YouTube to MP3 Converter starts Microsoft Edge although Firefox is defined as Browser. Only an Uninstall of Microsoft Edge ends that behaviour. But after next update Edge is again installed and again Edge is started, what I don't want. Have you the possibility to avoid that? I don't know, where that behaviour can be ended. </p>",desktop;download-and-install_1;windows-10;firefox-810;,firefox,download-and-install,en-US,"",wolfgang_quartz
1308752,2020-10-16 00:40:11 -0700,2020-10-16 00:40:11 -0700,"I lose open tabs and pinned tabs if I close the basic FF window first (for example, the private window remains active)","<p>hi </p><p>FF lose all open and pinned tabs if I close the basic FF window first (for example, the private window or other window remains active)  </p><p>Can anything be done about it? Manually re-creating all (more than few) pinned and lost tabs takes a really long time :( </p><p>Piotrek </p>",desktop;bookmarks;,firefox,bookmarks,en-US,"",myszoor
1308748,2020-10-16 00:08:37 -0700,2020-10-16 00:08:37 -0700,Bookmarks unavailable and non-creatable after upgrade,"<p>I just did an upgrade to 81.0.2.  All of my bookmarks disappeared.  Fortunately I was able to retrieve the last window but I am unable to create new bookmarks.  Whether I right click on the tab to bookmark or Ctrl+D to bookmark, I get a window that says New Bookmark with options of Save or Cancel.  However, the only option I can choose is Cancel.  This is not good. </p>",desktop;bookmarks;windows-10;firefox-810;,firefox,bookmarks,en-US,"",jpickett
1308747,2020-10-16 00:03:19 -0700,2020-10-16 00:03:19 -0700,Error #3000 when trying to play a twitch vod.,"<p>Whenever I try to play a vod, any vod, I get ""Your browser encountered an error while decoding the video. (Error #3000)"" And this is like this only on Firefox, I've switched to it a week ago and it's been like that ever since and it currently works on chrome. I've tried incognito mode, and to disable trackers, but nothing worked as of yet. What could be the problem and how can I fix it? </p><p>thanks, doxi. </p>",desktop;fix-problems;windows-10;firefox-810;firefox-8102;,firefox,fix-problems,en-US,"",kalo39570
1308746,2020-10-16 00:01:27 -0700,2020-10-16 00:01:27 -0700,Newspaper articles on new tab,"<p>I am an Austrian living in Vienna, the capitol. When I start the browser the location can be detected in many different ways. Wenn I open the browser or a new tab I am getting articles from GERMAN newspapers. This is nice but not really relevant. It is like when US users receive australian newspapers just becaus the language is equal. Please correct that bug! </p>",desktop;other;windows-10;firefox-810;,firefox,other,en-US,"",peter.benovic.01
1308743,2020-10-15 23:38:45 -0700,2020-10-15 23:38:45 -0700,"""mailto"" option","<p>Hello, </p><p>When I try to e-mail a topic from the Firefox browser, I don't have access to my default email program - Microsoft Outlook. </p><p>I've tried: Applications Choose how Firefox handles the files you download from the web or the applications you use while browsing by choosing the mailto option but no luck accessing Outlook.  I would appreciate any help, please. </p><p>Thx Phil </p>",desktop;customize;windows-10;firefox-810;,firefox,customize,en-US,"",dp1979
1308740,2020-10-15 22:55:37 -0700,2020-10-15 22:55:37 -0700,User login or Username,<p>How to delete or remove nazeer_urs@hotmail.com from the drop down list. IT is not visible in privacy saved logins </p>,desktop;privacy-and-security_1;windows-10;firefox-810;,firefox,privacy-and-security,en-US,"",nazeer_urs
1308738,2020-10-15 22:13:52 -0700,2020-10-15 22:39:38 -0700,Website Crashing,"<p>Hello </p><p>My Website <a href=""https://packagessite.pk/"" rel=""nofollow"">https://packagessite.pk/</a> is not opening correctly in Firefox. I do not know why. When I open the website, some pages not showing properly. </p><p>Please Guide me what to do. </p>",desktop;fix-problems;,firefox,fix-problems,en-US,1358531;,iamvicky9588
1308737,2020-10-15 21:24:20 -0700,2020-10-15 21:24:20 -0700,suddenly unable to log into wells fargo .com from pc 8.1,"<p>Is any one else experiencing an inability to log in to <a href=""http://wellsfargo.com"" rel=""nofollow"">wellsfargo.com</a>.  I have latest version of firefox and have no new add-ons or changes in security/anti-virus or malware programs. </p><p>Their tech support said ""sounds like a browser issue"" .  I switched to ie and logged right in.  I use to log in a dozen times a week and have not ever been denied.  When I try to log in the screen re-freshens and is blank.  No bad log in script or any other prompts, just a waiting log in screen. </p><p>Thanks for any thoughts or similar experiences. </p><pre>Tyree W. </pre>",desktop;websites;windows-81;firefox-810;,firefox,websites,en-US,"",etyree
1308736,2020-10-15 21:21:41 -0700,2020-10-15 21:21:41 -0700,Webpage translation error!,<p>There has been a problem of webpage translation errors for a long time! When will it be resolved? </p>,desktop;fix-problems;,firefox,fix-problems,en-US,"",520ignite
1308735,2020-10-15 20:58:53 -0700,2020-10-15 20:58:53 -0700,Managing Cookie Exceptions,"<p>Need help configuring Firefox exceptions for Cookies and Other site Data so sites like the NY Times can remember me so I don't have to log-in to them multiple times per day.   </p><p>I've even deleted Firefox and started over, but that did not resolve the issue.   </p><p>I need an expert in this to help me as I'm just not getting it...though I have tried many different configurations of FireFox's settings.   </p><p>Thanks </p><p>Tim </p>",mac-os;desktop;privacy-and-security_1;firefox-810;,firefox,privacy-and-security,en-US,"",tleahy+ffox
1308733,2020-10-15 20:35:55 -0700,2020-10-15 20:35:55 -0700,"How do I disable the page actions menu, and return the icons to the address bar?","<p>To clarify, want to put the icons where the three-dot context menu button is, and remove the menu altogether. It's been bugging me for months. </p>",desktop;customize;firefox-690;,firefox,customize,en-US,"",r0tekatze
1308732,2020-10-15 20:28:23 -0700,2020-10-15 20:28:23 -0700,location of different types of cache data,"<p>hey guys, </p><p>Can you guys list for me, where each one of the following types of data is in the cache location in win 10?  the locations for me are as follows: </p><p>LOCAL DIR =&gt; C:\Users\Owner\AppData\Local\Mozilla\Firefox\Profiles\pbnbougs.default-1580885455126 ROAMING DIR =&gt; C:\Users\Owner\AppData\Roaming\Mozilla\Firefox\Profiles\pbnbougs.default-1580885455126 </p><p>so....my question for you experts is....in which dirs are the following pieces of info? </p><p>=&gt; passwords =&gt; cookies =&gt; history =&gt; temp files that are junk (for instance, image files for quicker future page loads, etc...) </p><p>attached are images of the 2 dirs I mentioned above.  I'd like to know where these things are, whether they be in un-extensioned files, sqlLite DBs or anything else.  thanks! </p><p>Adam </p>",desktop;tips;windows-10;firefox-810;,firefox,tips,en-US,"",adam-evanovich
1308730,2020-10-15 19:54:55 -0700,2020-10-15 19:54:55 -0700,Launching firefox app on android starts on home screen,"<p>How can i set firefox to launch directly to my previous tab? (Like i could do in previous versions). I dont want to see the firefox home screen every time i launch the app, it is annoying and bothersome since i literally never use it. </p>",desktop;customize;,firefox,customize,en-US,"",hindert47
1308729,2020-10-15 19:52:41 -0700,2020-10-15 20:47:37 -0700,Updates,"<p>I want to turn off your automatic updates. I am not ready for the new version yet. I was using v58 for a good reason, and now I have v81+. I am not ready to learn the new ff.  I want it shut off. For 3 weeks, every time I reboot, my version of FF changes. I want it to stop, as I spend a great deal of time getting back to my older version </p>",desktop;windows-10;firefox-810;,firefox,other,en-US,1358522;,Garrysch
1308728,2020-10-15 19:36:15 -0700,2020-10-15 19:36:15 -0700,"Disk usage, access to Amazon pages","<p>firefox 64 bit was using 100 % Disc usage, tried 32 bit - was great except I can't access drop down menus on sites like Amazon, also Wish List page wont load. I reinstalled 64 bit and i can access drop down list but won't load wish list page -using  Windows 10 </p>",desktop;fix-problems;,firefox,fix-problems,en-US,"",jstacy1132
1308727,2020-10-15 19:18:07 -0700,2020-10-15 20:40:33 -0700,end of life for  adobe  flash and  shockwave,<p>I use facebook games and words with friends mostly what happens when  Flash and shockwave  end. How  will we be able to play  facebook and other games.  is there and add on for this in Firefox and all  other browsers? I love  words with friend and   I use many other games both paid for and non  wil i be able to use them  when adobe flash and shockwave are done </p>,desktop;other;windows-10;firefox-810;,firefox,other,en-US,1358520;,mdm54
1308726,2020-10-15 19:08:58 -0700,2020-10-16 01:12:35 -0700,Bad upgrade to Firefox 81.0.2,"<p>I've just upgraded to FIrefox 81.0.2.  Now, everything on the page is the width of the screen, and it all looks like it does on a mobile device.  I can't hover over any Like link and get any of the other options to click on.  Why doesn't FIrefox have a simple option to revert back to the previous version that worked? </p>",windows-7;desktop;fix-problems;firefox-810;,firefox,fix-problems,en-US,1358515;1358545;1358546;1358547;,shoeless.photographer
1308722,2020-10-15 18:39:16 -0700,2020-10-15 20:50:18 -0700,Cannot watch Channel 4 On Demand even though I am in the UK.,"<p>When I try to access content from channel 4, it says that I am not in the UK. <a href=""https://www.channel4.com/programmes/first-dates/on-demand/55507-004"" rel=""nofollow"">https://www.channel4.com/programmes/first-dates/on-demand/55507-004</a> All add-ons disabled. Same issue. </p><p>I am connected to a vpn and it is located in the UK. See the attached images. </p><p>I know that the vpn is fine because this works flawlessly in the google garbage browser. Actually, any browser at all. Just firefox remains blocked. </p><p>I tried with geo.enabled set to true and false as well. </p>",desktop;websites;windows-10;firefox-810;,firefox,websites,en-US,1358523;,matthewjmatthiesen
1308720,2020-10-15 18:21:04 -0700,2020-10-15 18:26:32 -0700,How to add this file to my mozilla firefox?,"<p>I have a file called mozilla firefox backup preferences and in the rar file there is a srtt10ca.default folder. then when you open the folder there are several folders, be it bookmark backup, lwtheme to other files. my question is how to integrate the srtt10ca.default folder into my latest firefox? Please help. </p>",desktop;customize;windows-10;firefox-810;,firefox,customize,en-US,1358502;,dnbass90
1308719,2020-10-15 18:19:41 -0700,2020-10-15 19:16:15 -0700,Delete all cookies when Firefox closes except some specific ones,"<p>Using Firefox 68.12.0ESR. I know 78 is available, I just haven't had the time to test it yet. I delete cookies when I exit Firefox. I want to keep some for sites that I trust, such as this site. I've added exceptions to Allow these trusted sites as documented on a thread somewhere else, but it doesn't work. All cookies are deleted. </p><p>Is it possible to keep cookies only for a select group of sites. eg. <a href=""http://support.mozilla.com"" rel=""nofollow"">support.mozilla.com</a>, <a href=""http://tomshardware.com"" rel=""nofollow"">tomshardware.com</a>, <a href=""http://mydigitallife.net"" rel=""nofollow"">mydigitallife.net</a>, <a href=""http://speedtest.net"" rel=""nofollow"">speedtest.net</a> and so on. </p><p>Thank you. </p>",desktop;privacy-and-security_1;windows-10;firefox-680;,firefox,privacy-and-security,en-US,1358510;,imarobot124
1308716,2020-10-15 17:29:47 -0700,2020-10-15 18:12:53 -0700,URL Autocorrect,"<p>We have a split domain here and I have .dmz and .ent domains ie. nas1.ent, vpn.dnz and since the last update of firefox my URLS keep autocorrecting to <a href=""http://nas1.net"" rel=""nofollow"">nas1.net</a> which does not resolve or worse resolves to an external server (my linux systems have star wars names which some .net's resolve to cybersquatter sites.) how do I disable this Feature, I have tried adding hosts to whitelist and to trusted sites </p>",desktop;other;windows-10;firefox-810;,firefox,other,en-US,1358497;1358499;,bob.pcnet
