id,created,updated,title,content,tags,product,topic,locale,answers,creator
1364106,2022-01-13 00:51:44 -0800,2022-01-13 12:52:17 -0800,Not working...,"<p>Not working... updated this morning (CET)... at 07:48, and webpages are no longer opening. Firefox 96.0. </p>",desktop;websites;windows-10;firefox-910;incident13012022;,firefox,websites,en-US,1473448;1473583;1473735;1473802;1473804;1473858;,bredgeo1
1364105,2022-01-13 00:49:03 -0800,2022-01-13 06:22:10 -0800,Stuck on checking for updates,"<p>Checking for updates is running nonstop, I tried to install newest version over the current one but same problem, it says version 96.0 and still checking for updates </p>",desktop;fix-problems;,firefox,fix-problems,cs,1473455;1473672;,maklmape
1364104,2022-01-13 00:47:57 -0800,2022-01-13 03:02:16 -0800,Firefox not loading webpages,"<p>Hi, </p><p>I'm running on macOS 12.1 with firefox 95 (and also 96). Suddenly everywhere I try to browse it will not load the webpage. I did not change any settings while it happend. </p><p>I already tried disabling al my extensions without luck. I also removed all cache etc. </p><p>Is there anything else I can try? </p><p>Kind regards. </p>",desktop;fix-problems;incident13012022;,firefox,fix-problems,en-US,1473446;1473580;,nickjannes101
1364103,2022-01-13 00:46:21 -0800,2022-01-13 01:07:11 -0800,"Firefox non funziona più, carica all'infinito.","<p>Buongiorno, di punto in bianco Firefox non funziona più. Ha cominciato a caricare le pagine all'infinito. Ho provato di tutto. Premetto che utilizzavo la versione 95 su un MacBook Pro 14 pollici con processore M1Max. Il browser ha sempre funzionato senza problemi. Il collegamento internet è attivo, Firefox funziona su un secondo computer e tutti gli altri browser sono funzionanti. Ho provato a riavviare il computer senza risolvere, ho svuotato cronologia e cache senza risultati. Ho provato a reinstallare firefox, ma non ho risolto nulla. Ho provato ad utilizzare la funzione di aiuto per caricare il browser senza componenti aggiuntivi ma non funziona. Ho provato a disattivare tutti i componenti aggiuntivi uno alla volta e anche in blocco ma non si risolve nulla. Dal browser non funziona neanche la funzione per contattarvi. Alla fine ho dovuto usare Safari per mandarvi questo messaggio. </p>",desktop;fix-problems;,firefox,fix-problems,it,1473461;,info6787
1364102,2022-01-13 00:46:16 -0800,2022-01-13 07:52:00 -0800,Firefox does not open pages,<p>Hi  </p><p>I can not open pages at all with firefox. With google chrome pages are opening correctly .This happens to many computers in different networks.  I have also tried to disable all addons and restart firefox same thing happens. I have tried also in network settings with no proxy same thing happens. I have tried also to enable network.dns.disablePrefetch again same thing happens. </p>,desktop;websites;incident13012022;,firefox,websites,en-US,1473450;1473585;1473695;,gpetrom
1364101,2022-01-13 00:45:00 -0800,2022-01-13 09:11:08 -0800,Firefox not connecting to websites.,"<p>I have cleared the cache and cookies and I have reinstalled Firefox but I am not able to connect to any site. Reinstalling fixed the issue for about 15 minutes but it is now not connecting again. I remoted onto my work machine, and that machine also has the same issue with fire fox. Chrome is working fine on both machines. I have restarted my machines and my router. </p>",desktop;websites;incident13012022;,firefox,websites,en-US,1473447;1473582;1473736;,imartinson
1364100,2022-01-13 00:43:56 -0800,2022-01-13 08:55:27 -0800,Non si connette ad internet,<p>Ho problemi da stamattina (13.01.2022) con il browser. Non si connette ad internet. </p>,desktop;fix-problems;,firefox,fix-problems,it,1473462;1473559;1473717;,mizio4
1364099,2022-01-13 00:43:30 -0800,2022-01-13 01:31:24 -0800,Web siteleri Firefox'ta açılmıyor ama diğer tarayıcılarda açılıyor,<p>Web siteleri Firefox'ta açılmıyor ama diğer tarayıcılarda açılıyor </p>,desktop;websites;,firefox,websites,tr,1473514;,farukolgun
1364098,2022-01-13 00:41:14 -0800,2022-01-13 00:41:14 -0800,'dark' mode after Firefox update 12 July,"<p>Hi, since 12 July update, any theme with a darkish colour is now leading to full dark mode on screen, i.e. web page is in dark mode, sidebar is dark mode etc. Whereas pre-update the screen/sidebar were light, which is how I like it. </p><p>The only way I can keep light mode now is have a 'bright' i.e. light coloured theme.  </p><p>This doesn't seem right does it? </p><p>How can I keep my old, pre 12 July theme(s), or new ones and still work with light screen? </p><p>Thanks </p>",desktop;customize;windows-10;firefox-960;,firefox,customize,en-US,"",jamesxjclapham
1364097,2022-01-13 00:41:08 -0800,2022-01-13 09:11:42 -0800,Firefox won't open any webpages,"<p>Firefox won't open any websites at all and I'm not sure why? i've cleared the cache, refreshed, reinstalled, all to no avail. </p>",desktop;fix-problems;incident13012022;,firefox,fix-problems,en-US,1473442;1473578;1473737;,nainialerts
1364096,2022-01-13 00:40:29 -0800,2022-01-13 04:40:05 -0800,Firefox,"<p>As of today Firefox does not open any websites, though Safari does. I am on an iMac and on High Sierra and until today all was well and has been for very many years. </p><p>There is no error message, just New Tab with a dot moving left and right </p>",desktop;websites;incident13012022;,firefox,websites,en-US,1473544;1473571;1473573;1473575;1473599;1473628;,robin.frith
1364095,2022-01-13 00:40:05 -0800,2022-01-13 02:50:24 -0800,"Pages won't load on laptop even after refresh and uninstall, can't use troubleshoot mode","<p>While using Firefox my web pages suddenly stopped loading. Checked my wifi, it's all good. I rebooted my computer, still they won't load. Ran a malware scan, pc is clean. Checked other apps that use internet, they all work. Tried to open Firefox in troubleshoot mode since I figure it's probably an add on. When I hit the restart button, instead of confirming I want to use troubleshoot mode, nothing happens. Go to uninstall it, they ask if I want to refresh instead so I say yes. Browser refresh works for about 30 seconds and then stops loading the pages again. This time I completely uninstall and reinstall it, same thing, works a few seconds and then breaks again. If anyone has more solutions I can try, I'd be very grateful. Thanks in advance. </p>",desktop;fix-problems;incident13012022;,firefox,fix-problems,en-US,1473441;1473542;1473569;,bethanie_lane
1364094,2022-01-13 00:38:46 -0800,2022-01-13 03:11:27 -0800,FireFox is not working,"<p>After last update 12/01/2022, the Firefox browser stopped accessing the internet </p>",desktop;fix-problems;incident13012022;,firefox,fix-problems,en-US,1473549;1473584;1473587;,eng.hassan.262015
1364093,2022-01-13 00:38:20 -0800,2022-01-13 02:25:44 -0800,Firefox 96.0 cannot connect to internet,"<p>Hi Firefox, Since this morning, Firefox updated itself to version 96.0, but it doesn't work now. It cannot connect to any website and with different browser it's working okay. Please have look this urgently as every uses in our company not able to use firefox and we are using firefox as main browser by default.  </p><p>Many Thanks  Imam Anshory </p>",desktop;fix-problems;incident13012022;,firefox,fix-problems,en-US,1473551;,imam.anshory
1364092,2022-01-13 00:37:13 -0800,2022-01-13 02:24:26 -0800,Firefox cannot seem to connect with any website out of the blue,"<p>I was browsing without any problem  when suddenly just firefox on my PC stops being able to load any pages. </p><p>I tried clearing the startup cache and it managed to work once but when I checked firefox to install the latest version, the problem returned. Now even the version check is in infinite loading. </p><p>Troubleshooting mode is the same, so it is not addon related. </p><p>When I close  firefox, the process lingers on the task manager for a while until it gives the firefox has crashed window. Even that seems to have a difficulty in sending its error report </p><p>Is there any way to deal with this? I do not want to use the refresh firefox option cause its sounds like it will remove my add-ons </p>",desktop;fix-problems;incident13012022;,firefox,fix-problems,en-US,1473548;,e.sperelakis
1364091,2022-01-13 00:37:02 -0800,2022-01-13 04:33:32 -0800,Mozzila stopped working suddenly.,"<p>So FireFox just randomly stopped working all of a sudden. </p><p>It cant load any web page what so ever. (Like there is no internet, except that other browsers work normally.) </p><p>Ive tried everything from the support page, (Disabled all of the protection in firefox itself, removed and added it back in onto firewall safe-list), ive refreshed it (the option  before removing), and  Ive reinstalled it as well.  </p><p>Nothing seems to fix the issue, the only way I got it working, and it was just for a little while before it blocked up again, is by running it in safe mode with SHIFT key. But it opened youtube, and then blocked up again. </p><p>I have not installed any anti malware programs or anything new that would cause the issue, neither have i updated my system recently. </p><p>When i reinstalled firefox (and started it completely blank and new) I started getting ""sec_error_unknown_issuer"" on every website I tried to open. And now, every time I close firefox (still does not work) after like 15 seconds post closing it I get a ""Firefox has crashed"" report. </p><p>Real shame. Great browser, been using it for ages :( </p>",desktop;websites;,firefox,websites,en-US,1473497;1473530;1473625;,bojans96
1364090,2022-01-13 00:34:44 -0800,2022-01-13 02:27:01 -0800,Network Error + Lags after importing bookmarks,"<p>Hi there I imported <a href=""https://github.com/jameshealyio/bang-bookmarks"" rel=""nofollow"">https://github.com/jameshealyio/bang-bookmarks</a> and now my Firefox instance totally crashing and pages won't load. </p><p>I reinstall firefox, same issue I remove firefox profiles, worked for a little bit. Got synced with my account then again web pages won't load. </p><p>Any Ideas Thanks </p>",desktop;fix-problems;incident13012022;,firefox,fix-problems,en-US,1473554;,tamibam
1364089,2022-01-13 00:34:12 -0800,2022-01-13 02:26:21 -0800,Firefox crashed,"<p>I am trying to open pages in Firefox, but it doesn't reply. I tried to open them in Troubleshoot mode but it didn't work either. Also, I tried to send messages about crashes in <strong>about:crashes </strong>page but they do not send </p>",desktop;fix-problems;incident13012022;,firefox,fix-problems,en-US,1473553;,yusufchik2004
1364088,2022-01-13 00:31:11 -0800,2022-01-13 05:35:07 -0800,Browser revs up my memory and doesn't connect to the internet,<p>The browser revs up my memory and doesn't connect to the internet until finally it crashes.  </p><p>I'm on windows 11 </p><p>Please advise </p><p>Best regards  Sune </p>,desktop;fix-problems;incident13012022;,firefox,fix-problems,en-US,1473563;1473654;,W.J.Stokes
1364087,2022-01-13 00:31:07 -0800,2022-01-13 01:48:16 -0800,Firefox not working,"<p>Hi  I went to my email provider earlier on and Firefox froze saying that a copy was running and to close - which I did. But Firefox will not access any website: just the normal waiting message. </p><p>I did a hard reboot.  No joy. I tried a download. No joy.  I am using Brave at present to access you.  Everyhting else, email etc is working fine. </p><p>Any advice please. </p>",desktop;other;needsinfo;,firefox,other,en-US,1473494;1473510;1473523;,Austrianpeter
1364085,2022-01-13 00:30:40 -0800,2022-01-13 02:35:31 -0800,Firefox Outage,"<p>Is Firefox down right now? I’ve tried to open any page using it and I cannot. I’ve tried on multiple devices, and I have restarted Firefox with no change. </p>",desktop;fix-problems;incident13012022;,firefox,fix-problems,en-US,1473558;,jhlatour
1364084,2022-01-13 00:27:29 -0800,2022-01-13 09:12:05 -0800,web site opening,"<p>Good day, </p><p>I have a problem with Mozilla Firefox. After few minutes of working i cannot open any website and even refresing not helps (only coled Firefox and open again helps). I reinstaled Firefox and still problem shows up. Could you hel me in this case? </p>",desktop;other;incident13012022;,firefox,other,en-US,1473434;1473576;1473738;,jakubczarnyrodvad
1364083,2022-01-13 00:27:18 -0800,2022-01-13 02:41:47 -0800,Unable to load anything,"<p>On 95.0.2 (64-bit) About 15 minutes ago, unable to load anything on the browser, even localhost doesn't work </p>",desktop;fix-problems;incident13012022;,firefox,fix-problems,en-US,1473564;,nds29
