id,created,updated,title,content,tags,product,topic,locale,answers,creator
1384159,2022-07-27 03:50:04 -0700,2022-07-27 03:50:04 -0700,Latest Firefox Version Totally Broken!,"<p>Firefox has worked fine on my WinX systems for years. Yesterday it downloaded a new version (103.0 64-bit) that totally destroyed the experience! </p><p>Everything I see now is <strong>GIANT SIZED</strong> compared to the rest of my desktop and to the old Firefox. I've looked for any relevant setting and I've tried the ""Refresh"" button with no help. </p><p>I want to go back to the previous version! </p>",desktop;fix-problems;windows-10;firefox-1030;,firefox,fix-problems,en-US,"",WebDev
1384158,2022-07-27 03:31:57 -0700,2022-07-27 03:31:57 -0700,sonido videos youtube,<p>Desde hace unos dias todos los videos de youtube en Firefox se reproducen sin sonido. He probado los mismos videos en otros navegadores y si tienen sonido. </p>,desktop;fix-problems;windows-10;firefox-1030;,firefox,fix-problems,es,"",alf_recio
1384157,2022-07-27 03:15:01 -0700,2022-07-27 03:15:01 -0700,R.srvtrck.com Redirect,"<p>How to Remove <a href=""http://R.srvtrck.com"" rel=""nofollow"">R.srvtrck.com</a> Redirect </p>",desktop;other;windows-10;firefox-1030;,firefox,other,en-US,"",idea_server
1384156,2022-07-27 03:14:14 -0700,2022-07-27 03:38:34 -0700,Add on,<p>Français Language Pack by Mozilla Firefox </p><p>Installation aborted because the add-on appears to be corrupt. </p><p>Add ESET Password Manager browser extension Download Password Manager </p><p>Download and install Password Manager as an app or as an extension for your browser. </p><p>file could not be installed appears to be corrupted  could you help to install these extensions  thanks </p>,ios;install-and-update-firefox-ios;,firefox,problems-add-ons-plugins-or-unwanted-software,en-US,1522752;,captaingmp
1384155,2022-07-27 03:13:05 -0700,2022-07-27 03:13:05 -0700,PDF empty values,<p>I am getting blank values while i am printing my pdf in firefox browser </p>,desktop;other;windows-10;,firefox,other,en-US,"",sonakamaraj08
1384154,2022-07-27 03:11:44 -0700,2022-07-27 03:11:44 -0700,GoDaddy login,"<p>Has anyone experienced problems logging into a GoDaddy hosted MS email account via Firefox or a GoDaddy account generally? </p><p>Whenever I try to login to my GoDaddy account via Firefox I get the error message: ""Yikes, Something went wrong. Please, try again later."" I have tried the login with both MS Edge and Google Chrome and both work fine as did Firefox until a few days ago. </p><p>I have done the usual stuff of making sure Firefox is up to date, clearing the cache and cookies etc., but I still get the message and cannot login. </p><p>I can switch to a different browser if there is no resolution to this </p>",desktop;other;windows-10;firefox-1030;,firefox,other,en-US,"",tom324
1384152,2022-07-27 02:55:13 -0700,2022-07-27 02:55:13 -0700,NEXITY website for Cabourg,<p>On the phone the Cabourg agency (NEXITY Syndic) speaks about a new site but I don’t understand the name of it. Maybe you can help ? Thank you for what you can do. Claude Dassas </p>,desktop;other;,firefox,other,en-US,"",cdassas
1384151,2022-07-27 02:43:36 -0700,2022-07-27 02:43:36 -0700,Install extention using GPO,"<p>Hello, </p><p>I want to download an extension using firefox policy templates. I put the location folder and extension id so that it cannot be deleted, but for some reason it doesn't want to install most of the times. The policy is added after using the gpupdate /force command and restarting the machine then open and close the browser. I wait 10 minutes for the policy to be configured on the computer and open the browser again and nothing happens. Also, the keys in the registry have the corresponding value type (checked in site https://admx.help/?Category=Firefox&amp;Policy=Mozilla.Policies.Firefox::Extensions_Locked). But when I drag and drop with a mouse, the extension is installed and cannot be deleted.  Can you tell me why does the extension not install when the policy is in effect? </p><p>I sent pictures from Group Policy Manager, Registry editor and showing that the extension can not be deleted after drag and drop with a mouse.   </p><p>Thank you in advanced! </p>",desktop;tips;firefox-1020;firefox-10201;,firefox,tips,en-US,"",thristov1980
1384150,2022-07-27 02:02:18 -0700,2022-07-27 02:02:18 -0700,Ui and bookmarks toolbar problem's  after 103 update,"<p>i really hate when forcing a new features without clear or easy way to disable it ..started the the download icon new annoying behave. now i have 2 more problems.... </p><p>1.how can i disable  this one  ( Windows' ""Make text bigger"" accessibility setting now affects all the UI and content pages, rather than only applying to system font sizes) it was ok before update  i want to remove this new one i don't like the UI auto resize.. </p><p>2.after updating to 103 my bookmarks toolbar stopped working.. now its it's empty and i cannot add any new bookmark by select and drag the only thing i can do to show or hide this  blank bookmark toolbar how to fix it ? </p>",desktop;customize;windows-10;firefox-1030;,firefox,customize,en-US,"",Rainyskyboy
1384146,2022-07-27 01:44:26 -0700,2022-07-27 03:19:14 -0700,No sound in Firefox,"<p>Hi, </p><p>For quite some time I've been having issues with sound in Firefox, specifically that there isn't any. I've tried some things to fix the problem but haven't found any solutions. The problem is isolated to Firefox as Chrome and other apps will play video with sound. It's also not limited to certain websites. What's interesting is when I open the soundmixer, it shows a green bar going up and down as if there is audio playing. I've also tried troubleshooting mode without any success.  Other things I've tried are: - Updating drivers (everything was up to date) - Re-installing Firefox - Allowing Firefox to automatically play video with sound </p><p>Any ideas? </p><p>Greetings, Gavin W </p>",desktop;other;windows-10;firefox-1030;,firefox,other,en-US,1522746;,gavinwitlox@hotmail.com
1384145,2022-07-27 01:40:58 -0700,2022-07-27 01:40:58 -0700,The size of the icons on the toolbar,"<p>Is it possible to change the icon size on the toolbar? I've been trying all morning to find the solution, but unfortunately without much success.  Help me, please Ania </p>",desktop;customize;windows-10;firefox-1030;,firefox,customize,en-US,"",diuna2004
1384144,2022-07-27 01:29:30 -0700,2022-07-27 03:21:15 -0700,"dopo aggiornamento firefox, problemi con la visualizzazione","<p>Ciao, ieri sul mio pc lenovo, sistema operativo windows 10 pro (21H2)(aggiornato), dopo l'installazione del nuovo aggiornamento di firefox 103.0 64 bit,ho problemi con la visualizzazione web di una sola pagina: quella della mia casella vodafone. In pratica adesso per visualizzare lo spazio in cui scrivere il testo della mail ,devo mettere le impostazioni dello schermo(che son consigliate di default a 125 %data la dimensione del portatile)(nella sezione ridimensionamento e layout, dimensione di testo,app ed altri elementi)  su 100, altrimenti non mi visualizza la stringa per poter scrivere la risposta alle mail. Premetto che non ho modificato alcuna impostazione dei caratteri ecc  e che, dopo l'aggiornaento di firefox, non potendo visualizzare come prima lo spazio per scrivere la mail, ho risolto rimpicciolendo da impostazioni schermo la visualizzazione da 125 cosnigliata a 100(avendo cosi'pero' icone molto più piccole a livello di sistema operativo,idem la stringa della barra degli strumenti ecc). Ho contattato vodafone,poichè pensavo fosse un prblema loro..mi rispondono che è un problema di qualche estensione o componente nuovo che si è installato con il nuovo aggiornamento,o che comunque ""di sicuro dipende dal nuovo aggiornamento).. Le altre pagine le vedo bene se devo fare login ec.questa di vodafone è tutta normale come prima,ha solo il problema quando clicco su rispondi,poichè se lascio impostazioni pc a 125 clicco rispondi,ma non mi fa vedere lo spazio per <a href=""http://scrivere.se"" rel=""nofollow"">scrivere.se</a> riduco al 100, invece lo vedo.. Vi risulta qualche incompatibilità con windows 10pro? O qualcuno ha il mio stesso problema? ho provato a verificare se il pc volesse aggiornamenti di windows..mi era già capitato,dopo un aggiornamento firefox,molto tempo fa(circa un anno ememzzo fa),ma si era risolto in due tre ore. Invece da ieri è sempre cosi'(la volta scorsa comunque era meno evidente,vedevo solo un po' sformattata la pagina web di vodafone. Grazie Daniela </p>",desktop;fix-problems;windows-10;firefox-1030;,firefox,fix-problems,it,1522741;1522742;1522745;1522747;,daniela.novelli
1384140,2022-07-27 00:41:13 -0700,2022-07-27 03:31:53 -0700,Video Player Fail 103.0,<p>All of a sudden no videos work on multiple sites.  KVS video player codec.  Not sure if this is what I have had or it is new.  How can I troubleshoot or use another internal video player? Thanks! </p>,windows-7;desktop;fix-problems;firefox-1030;,firefox,fix-problems,en-US,1522748;1522749;,bricmpt
1384139,2022-07-27 00:36:17 -0700,2022-07-27 02:01:26 -0700,No access to mail,"<p>Hi. How can I change the email in my account if I do not have access to tge mail? The mail service has ceased to exist and, of corse, I cannot receive any confirmation codes. </p>",desktop;other;,firefox,other,en-US,1522734;,atom3
1384133,2022-07-26 23:47:54 -0700,2022-07-26 23:47:54 -0700,Not loading any tabs,"<p>Hello, I have a little problem with firefox in a sudden of a dark firefox is not working its do not open any tabs anything when i tried other browser it worked. </p>",desktop;fix-problems;windows-11;firefox-1030;,firefox,fix-problems,cs,"",danieldj10
1384131,2022-07-26 23:42:03 -0700,2022-07-27 03:42:01 -0700,I cannot resize my browser page,<p>I cannot resize my browser page </p>,desktop;other;windows-11;firefox-1030;,firefox,other,en-US,1522753;,marlisalad
1384130,2022-07-26 23:41:17 -0700,2022-07-27 00:33:36 -0700,Changing password,"<p>Please god help me. I am trying to change my password and it tells me my old password is incorrect. I sign in using the only password I have with Firefox, and use the same one to try and change it, but it keeps giving me this error message. I'm about to put my face through the monitor. </p>",windows-7;desktop;privacy-and-security_1;firefox-1030;,firefox,privacy-and-security,en-US,1522725;,nkrauchi
1384128,2022-07-26 23:19:34 -0700,2022-07-26 23:19:34 -0700,Connect problem.,"<p>Dears, my problem: </p><p>Zabezpečené pripojenie zlyhalo </p><p>Pri pripájaní k <a href=""http://www.roundcube.sk"" rel=""nofollow"">www.roundcube.sk</a> sa vyskytla chyba. PR_END_OF_FILE_ERROR </p><pre>   Stránku nemožno zobraziť, pretože pravosť prijímaných údajov sa nedá overiť.    Obráťte sa na vlastníkov stránky a informujte ich o tomto probléme. </pre> <p>Ďalšie informácie… </p>",windows-7;desktop;other;firefox-1030;,firefox,other,en-US,"",weinlich
1384126,2022-07-26 22:37:03 -0700,2022-07-27 00:34:08 -0700,NOT APEN,<p>ZXADWSFEDFEFEFEF </p>,desktop;privacy-and-security_1;windows-81;needsinfo;firefox-1030;,firefox,privacy-and-security,en-US,1522715;1522726;,anilproja8752
1384125,2022-07-26 22:35:34 -0700,2022-07-26 22:35:34 -0700,OneDrive se nenačítá /cookies,"<p>Dobrý den, poslední dobou mám problémy s načítáním služby OneDrive (<a href=""https://onedrive.live.com"" rel=""nofollow"">https://onedrive.live.com</a>). Stránká se nedokáže načíst. Jediným řešením je vymazat cookies pro <a href=""http://live.com"" rel=""nofollow"">live.com</a> a pak se stránka načte. Ostatní prohlížeče s tímto problém nemají. Netušíte, kde by mohl být problém? </p><p>S pozdravem Michal Tvrdík </p>",desktop;windows-10;website-breakages;firefox-1020;firefox-10201;,firefox,website-breakages,cs,"",M.Tvrdik
1384122,2022-07-26 21:23:35 -0700,2022-07-26 21:26:45 -0700,103.0 home page is enormous,"<p>Unknown to me 301.0 was installed on Windows 10 computer this AM.  When I tried to open Firefox to home page the ""picture"" of the window was enormous. Screen captured only a small portion of normal display. How do I get back to a normal sized window.  Happens only with Firefox...no other programs. </p>",desktop;customize;windows-10;firefox-1030;,firefox,customize,en-US,1522703;,VG41boo
1384121,2022-07-26 21:12:12 -0700,2022-07-26 22:21:57 -0700,"Icloud login error ""fail to verify you identity. Try again""",<p>I can't login to my icloud email </p>,desktop;privacy-and-security_1;windows-11;firefox-1030;,firefox,privacy-and-security,en-US,1522702;1522708;,renysouto
1384119,2022-07-26 21:04:22 -0700,2022-07-27 02:03:37 -0700,New update,"<p>Firefox- You have really screwed the pooch with this update.  Half the websites I visit today are broken in some way, and the other half are displayed incorrectly (as in being about 4 pages wide and who knows how many tall).  I missed a couple of important bids cause I couldn't get to the links I needed to buy something before they expired.  Why was this needed?  You can do security updates all day long, but you had to change how every website on the planet LOOKS????  Plus, YOUR crap on the page takes up one third of the screen real estate.  I trusted you for years as being NOT Microsoft.  Guess that is truly over, as this is an absolute travesty... </p>",desktop;fix-problems;windows-11;firefox-1030;,firefox,fix-problems,en-US,1522735;,mramunds
1384118,2022-07-26 20:58:47 -0700,2022-07-26 20:58:47 -0700,"Unable to see ""Images"" in search result page","<p>When I query a subject, I cannot see the following choices under the search bar: ""All"", ""Images"", ""Video"", ""News"", ""Maps"", ""Shopping"" and ""Settings"".  It only happens once if I restart my computer, but after that I only see ""All Regions"" and ""Anytime"" below the search bar. </p>",desktop;other;windows-11;firefox-1030;,firefox,other,en-US,"",cuthbert43
1384117,2022-07-26 20:57:56 -0700,2022-07-26 20:57:56 -0700,downloaded file,"<p>Hi, In the past (last year), when I downloaded a vendor statement (PDF) to an encrypted folder, it would automatically encrypt. Now, the downloaded file does not encrypt. I have to encrypt it manually. I tried doing the exact same thing with internet explorer, it works. Not with the current Firefox (103). It seems to me this isn't a windows 10 (21H2) problem, but a Firefox bug, or there's a setting I don't know about. I download many PDF statements every month, so it would be great if this auto encryption feature is restored. Please help. </p><p>Thanks, Michael W </p>",desktop;other;windows-10;firefox-1030;,firefox,other,en-US,"",mw1999
1384115,2022-07-26 20:28:12 -0700,2022-07-27 03:34:37 -0700,display issue with 103.0,"<p>After update 103.0 was applied, the entire display got bigger.  Fonts are larger, display no longer fits on screen, taskbar is larger.  Several hours ago, it was fine.  I logged out of Firefox, and at next login, the display had changed.  </p><p>I've checked everything else on the computer and nothing else was affected--only Firefox . Running Windows 10. </p>",desktop;other;windows-10;firefox-1030;,firefox,other,en-US,1522751;,SIDEREA54
1384114,2022-07-26 20:13:19 -0700,2022-07-26 22:23:24 -0700,whats up web not worked,<p>need help </p>,linux;desktop;fix-problems;firefox-970;,firefox,fix-problems,en-US,1522709;,bm.thirukovilur2
1384113,2022-07-26 19:47:06 -0700,2022-07-26 19:47:06 -0700,Yahoo Mail doesn't work when use Firefox but does work on Chrome,"<p>There are problems with Yahoo Mail using Firefox but it does work when I use Chrome or my Android phone. I can only read e-mails. Cannot reply, delete, move emails. My Contacts / Address Book is empty. Most of the settings are missing. Only about 30 e-mails from the last 3 days are available. Older ones are greyed out. This happens on a Windows 11 All-in-One desktop but Yahoo Mail works on Firefox on a Windows 10 tower computer. Need more details? </p>",desktop;other;windows-11;firefox-1020;firefox-10201;,firefox,other,en-US,"",mjkaltenbach
1384111,2022-07-26 19:36:59 -0700,2022-07-26 19:36:59 -0700,"Perdi todos os meus favoritos, não tenho como recuperar?",<p>Eu tive que fazer uma formatação no meu computador pois o mesmo estava lento. Depois de ter instalado o windows eu instalei o Firefox e mesmo conectando na minha conta firefox os meus favoritos todos sumiram. Não tem como mesmo eu recuperá-los ou entrar em contato com o suporte da firefox para resolver isso? Eu achei que o Sync também salvava os favoritos igual em outros navegadores. </p>,desktop;bookmarks;windows-10;firefox-1030;,firefox,bookmarks,pt-BR,"",lucianavieira62
1384106,2022-07-26 18:43:40 -0700,2022-07-26 18:43:40 -0700,Firefox web problema: Colores sobre saturados despues de la actualizacion.,<p>Después de la ultima actualización de Firefox los colores se ven sobre saturados. </p><p>OS: Windows 10 64bit (c/licencia). Imágenes: firefox vs chrome </p>,desktop;fix-problems;windows-10;firefox-1020;firefox-10201;,firefox,fix-problems,es,"",gabriel.purziani
1384104,2022-07-26 18:32:46 -0700,2022-07-26 19:02:49 -0700,Trojan blocked after downloading latest update,"<p>Where is this coming from? Each time I open Firefox, I get Trojan Blocked Warning. Just downloaded most recent update to Firefox Browser. Malwarebytes <a href=""http://www.malwarebytes.com"" rel=""nofollow"">www.malwarebytes.com</a> </p><p>-Log Details- Protection Event Date: 7/26/22 Protection Event Time: 9:11 PM Log File: 10e5a7c2-0d49-11ed-be51-dc41a9a565f3.json </p><p>-Software Information- Version: 4.5.10.200 Components Version: 1.0.1709 Update Package Version: 1.0.57791 License: Premium </p><p>-System Information- OS: Windows 10 (Build 19043.1110) CPU: x64 File System: NTFS User: System </p><p>-Blocked Website Details- Malicious Website: 1 , C:\Program Files\Mozilla Firefox\firefox.exe, Blocked, -1, -1, 0.0.0, ,  </p><p>-Website Data- Category: Trojan Domain: <a href=""http://d1zkz3k4cclnv6.cloudfront.net"" rel=""nofollow"">d1zkz3k4cclnv6.cloudfront.net</a> IP Address: 13.33.165.95 Port: 443 Type: Outbound File: C:\Program Files\Mozilla Firefox\firefox.exe </p><p><br> </p><p>(end) </p>",desktop;privacy-and-security_1;windows-10;firefox-600;,firefox,privacy-and-security,en-US,1522682;,gavinmitchell
1384103,2022-07-26 18:27:52 -0700,2022-07-26 18:27:52 -0700,Text highlight color as Windows accent color,"<p>Hello, </p><p>I am trying to change the text highlighting color, the blue color when I select text to copy and paste. It used to be the same color as my accent color in Windows settings, but now it has changed back to blue despite me not changing anything. This same color was also showing in the extension SoundFixer, which has 2 sliders using the same color, which is now blue. How can I change the color back to using my Windows accent color? </p><p>I'm using Firefox Developer Edition 104.0b2 (64-bit) on Windows 11 version 21H2 (10.0.22000.795) </p>",desktop;beta;customize;windows-11;firefox-1040;,firefox,customize,en-US,"",luke07758
1384102,2022-07-26 18:22:38 -0700,2022-07-26 18:26:52 -0700,2021 and I'm still losing TABS.,"<p>I have Firefox running and have several tabs open. I have checked the proper boxes to save and re-open the tabs from the previous close. This works amazingly well; often for vastly extended periods of time, as in months or years. Then I accidentally close the main window holding the desired tabs while having a second window open with some temporary webpage I was using earlier in the day hidden behind another window. Yes, it's almost not too late to save the mistake but it is often late in the evening and I just don't have the time to remember or find the correct steps to restore the lost tabs. Like what just happened to me at the end of my last session. I try and fail, and then try sleeping!  Also, if a tab sits for a few sessions without actually being activated by a mouse click, my experience suggests it is lost from history.  </p><p>Pease for the love of gawd fix this!!!  </p><p>There are several obvious choices for the programmers to consider. 1.) close the ""main"" and all other windows open with Firefox.  On restarting Firefox open all the previously open windows. 2.) let the user assign or define a master opening page with the desired web pages set as tabs. Then until 100 thousand years have passed always open this page with the defined tabs as set by the user. :-) 3.) do something else even more magical. </p><p>Finally, if anyone can update the steps to restore session tabs for version ~102. I've viewed several Q/A on restoring TABS but they seem to no longer apply.  I cannot restore from history, so I'll need to go a little deeper into the woods. Thank you so much! </p>",desktop;tabs;windows-10;,firefox,tabs,en-US,1522678;,rdb1956
1384099,2022-07-26 17:46:11 -0700,2022-07-26 19:05:00 -0700,Firefox profile,<p>Restore an old profile </p>,desktop;other;needsinfo;,firefox,other,en-US,1522683;,joecoc1952
1384098,2022-07-26 17:44:28 -0700,2022-07-26 17:51:43 -0700,ana ma mananca pula,<p><strong>ma mananca pula ana te doresc te doresc</strong> </p>,desktop;beta;cookies;windows-10;firefox-1030;,firefox,cookies,en-US,1522668;,kenayo8105
1384097,2022-07-26 17:36:12 -0700,2022-07-26 18:01:44 -0700,PROBLEMAS CON MI CUENTA,"<p>Srs. Soporte de Mozilla accounts Dios los bendiga siempre. Tengo problemas hace tiempo con Firefox acounts hace aproximadamente un año, he seguido todos los pasos de cambio de contraseña, cambio de cuenta principal, cambio en varios pasos, he hecho creo yo todas las recomendaciones y hasta este momento no me funciona. Razon por la que les agradezco en gran manera me ayuden de manera facil y sencilla a resolver este impase molestoso. Muchas gracias por su ayuda para solucionar este inconveniente de tanto tiempo </p>",desktop;sync;windows-10;,firefox,sync,en-US,1522671;,bolmervillanueva
1384094,2022-07-26 17:19:57 -0700,2022-07-26 17:52:38 -0700,Quit Firefox,"<p>After all these years I am giving up on Firefox and discontinuing my donation to Mozilla. Last year or so I have faced so many unsolvable heads. The latest is that every time I open Verizon (or refresh it) I not only asks me to sign in but asks the security question....sometimes 5 times in the same hour. I've clicked of the double security on the Verizon page. (but it's been turned off for a long time anyway). The point is there is absolutely not one person or place to turn to for help. So goodby Firefox, it's been fun. </p>",desktop;privacy-and-security_1;windows-10;firefox-1020;firefox-10201;,firefox,privacy-and-security,en-US,1522659;1522669;,dpappas28
