id,created,updated,title,content,tags,product,topic,locale,answers,creator
1364144,2022-01-13 01:19:16 -0800,2022-01-13 02:50:03 -0800,Firefox just stopped working,"<p>Just out of the blue my browser stopped loading pages.  I went through all the processes recommended here and none worked. With the browser open now, its using a high amount of CPU and the power usage is Very High.  Nothing is open because it won't load anything. No error messages, just stuck with the little dot going side to side. I used chrome to download and install an update, but still nothing.  </p><p>Help :( </p>",desktop;fix-problems;incident13012022;,firefox,fix-problems,en-US,1473533;1473545;1473547;1473552;1473562;1473568;,lisamcanally
1364143,2022-01-13 01:18:35 -0800,2022-01-13 07:43:53 -0800,Nelze spustit,"<p>Dnes o rána nelze spustit Firefox, v nastavení vidím, že neustále probíhá kontrola aktualizací. Mám verzi 96.0 (64 bitů), Wind. 10 </p>",desktop;other;,firefox,other,cs,1473691;,riegerbmw
1364142,2022-01-13 01:16:54 -0800,2022-01-13 01:24:35 -0800,Firefox non carica più nessun sito,"<p>Con Safari, Chrome, Edge funziona tutto correttamente. Con Firefox invece non ci si connette più a nessun sito, se chiudo il programma da taskmanager di windows si vedono ancora alcuni processi firefox che non vengono chiusi a meno di terminarli manualmente. Ho provato a riavviare Windows10 ma il problema sussiste, non utilizzo proxy, non sono in VPN per lavoro Ho provato anche la procedura di ripristino, la pulizia della cache/history, la disabilitazione dell'unica estensione che ho, ma non è servito a nulla. Ho provato anche a riscaricare l'installer ed ad eseguirlo, ma ancora nulla. Grazie del supporto Stefano </p>",desktop;websites;,firefox,websites,it,1473491;1473501;1473503;,stefano.cocozza
1364141,2022-01-13 01:16:03 -0800,2022-01-13 02:16:34 -0800,"Firefox crashed. Now does not load websites, other browsers do","<p>Mac OS 11.2.3 Tried every tip in the troubleshooting guide.  Firefox still does not work.  Downloaded and installed version 96 but ""Update History"" only shows up to 95.  Thanks for any help. </p>",desktop;fix-problems;incident13012022;,firefox,fix-problems,en-US,1473534;,asherbrauner
1364140,2022-01-13 01:15:31 -0800,2022-01-13 02:18:01 -0800,Mozilla firefox crash,"<p>After the last update, mozilla firefox has stopped working, does not start websites, the refresh function does not work or goes into troubleshooting mode, the problem is evidently the moziila firefox browser because the opera or google chrome browsers are working properly </p>",desktop;fix-problems;incident13012022;,firefox,fix-problems,en-US,1473536;,arkadiuszambroziak1992
1364139,2022-01-13 01:15:07 -0800,2022-01-13 02:19:28 -0800,"Firefox not working on all my workstations, 4G connection tested as well.","<p><a href=""https://www.resetera.com/threads/is-firefox-down.538898/"" rel=""nofollow"">https://www.resetera.com/threads/is-firefox-down.538898/</a> </p><p>Seems a general issue as firefox is unable to connect to anything on any workstation, any other browser does work. </p>",desktop;other;incident13012022;,firefox,other,en-US,1473538;,gontie
1364138,2022-01-13 01:14:29 -0800,2022-01-13 01:16:36 -0800,"SUPER Slow since latest update, disabling plugins did nothing, refuses to restart in troubleshoot mode.","<p>Hey, I my FF just updated to the latest version and all was going fine and dandy for a little while. I've noticed FF hogging a bit more resources lately but that might be unrelated / more to do with changes to twitch or the like but I feel I should mention it. </p><p>After about 20-30 minutes of browsing, checking my emails etc the browser responded as if it lost connection. I did the general troubleshoot run on my network which came back with no issues found, no other program on my computer had any problems with internet connectivity. But just to be sure I checked all the wires and restarted the modem. </p><p>Now FF starts loading webpages but then get stuck partway and just stands grinding its gears. I'm currently using chrome to try and find a solution / write this and it works without problem. </p><p>I currently have all 3(!) of my extensions disabled and it has changed nothing. I do notice that in the general settings tab in FF it does seem to be ""Checking for updates"" continuously. </p><p>This is extremely annoying, please help me fix this asap! </p>",desktop;fix-problems;firefox-960;,firefox,fix-problems,en-US,1473486;1473488;,rhaen89
1364137,2022-01-13 01:13:53 -0800,2022-01-13 01:13:53 -0800,Firefox using all pc resources on start and not loading any pages,"<p>This started happening this morning when I booted up my PC. </p><p>I started Firefox, and the fans on my PC went crazy, opened up task manager only to see that firefox was apparently using 60% of my CPU and 12GB of RAM. For reference my CPU is Ryzen 9 5900x and I have 32GB of RAM, so this behavior is very strange. </p><p>And I wasn't trying to open a lot of tabs, or some resource crunching web app. My homepage is google, and that's what was supposed to open. I even tried to access my router on the local network, since I thought that maybe firefox suddenly just can't get out to the internet, and same thing happened. </p><p>I tried resetting firefox to default, reinstalling, checking other browsers to see if they work, checked the support page for similar issues, but found none. If anyone has any suggestions please say, firefox has been my regular browser since the late 2000s, and I'd hate to have to use something else. </p><p>Thanks </p>",desktop;fix-problems;,firefox,fix-problems,en-US,"",aeric.wintershard
1364136,2022-01-13 01:13:47 -0800,2022-01-13 01:22:28 -0800,"Firefox Complete Outage - won't connect to any sites , says it's already open if closed","<p>I've used firefox on my current pc ever since i'd set it up about maybe two years ago(??) , it's only today within this hour i'd run into my current problem which renders the whole browser completely unusable whereas any other browser works just fine. I haven't found any previous fix for this that actually works. </p><pre>   What it currently does is it just refuses to load Any page at all , prior to now within the same hour it had started to essentially crap out after any amount of time (fast enough for it to happen multiple times over) where it would just stop loading anything. when it had done this it could be fixed after closing and reopening the browser, however now even that does nothing since after it's stopped working altogether.    Either way , however , it had and still does also bring up an error post-close that says it's currently running and needs to be closed, and <em>sometimes</em> it brings up a crash report, neither of which fix anything - the first time it stopped loading anything and i'd closed it a firefox update was called for , honestly i dont think that even really did anything--    Nothing i've read and tried has fixed this , and it'll probably be tommorrow before i try anything new since i would like to just sleephfhfh,,,, but so far i've tried: </pre> <p>-    Starting firefox in troubleshoot mode (holding shift at startup) and doing a refresh through this - i'd readded my passwords manually after this. -    Disabling all add-ons (i've only used ShinmigamiEyes, UBlock Origin, and Malwarebytes Browser Guard across the time i've used firefox, all of which long prior to this issue and im sure is not the cause). -    Setting Network.Http.Max-Connections to 48 (had previously been defaulted at 900, reset to said default after this didn't work). -    Restarting my computer (Windows 10 if this matters). -    Troubleshooting my own internet (other browsers and other devices have no problem.) </p><pre>   I plan to do a full scan with AVG tomorrow to see if it's a potential malware problem, which would be weird considering how instantaneous and on-and-off this issue had been until now. </pre> <pre>   I don't know if this is even on my end but i've been using firefox as my main browser for a <em>long</em> time now and i'd hate to have to transfer everything to a different one because it's just decided to give up on me--    if there's any additional potential fixes anyone would recommend i'd appreciate it, just what i've tried hasn't done anything and it's really disheartening ,  especially when i dont even know if this is on <em>my end</em> or not-- </pre>",desktop;fix-problems;,firefox,fix-problems,en-US,1473482;1473499;,bowser606
1364135,2022-01-13 01:11:52 -0800,2022-01-13 01:35:08 -0800,Firefox è bloccato PRIMA della schermata Home,"<p>Buongiorno,  </p><p>ho un problema che si sta verificando dall'ultimo aggiornamento di Windows10, cioè, da quando gli updates sono stati installati correttamente e quindi dal successivo riavvio. </p><p>Firefox si avvia ma rimane in pagina bianca, cioè non riesce a caricare neanche la homepage <a href=""http://Google.it"" rel=""nofollow"">Google.it</a> con la nuova scheda che rimane in caricamento ma senza caricare mai. </p><p>Allora chiudo Firefox e lo riavvio e mi esce il segnale di errore che dice che Firefox è già avviato ma non risponde. Il processo esistente deve essere chiuso per aprire una nuova finestra. </p><p>Ovviamente lo chiudo, ritento... e il problema non si risolve. Cosa posso fare per risolverlo? AIUTO. :-( </p>",desktop;fix-problems;,firefox,fix-problems,it,1473484;1473512;1473518;,eapint
1364134,2022-01-13 01:11:33 -0800,2022-01-13 01:24:19 -0800,Perdita connessione Internet,"<p>Buongiorno, oggi ho problemi a mantenere la connessione Internet con Firefox. Apro le mie finestre ma dopo poco tempo le pagine non si aggornano e non riesco più a navigare. </p><p>Faccio presente che non è un problema di connessione perchè con gli altri Browser ( Chrome, Edge ) navigo normalmente. </p><p>Cosa sta succedendo. Come posso risolvere? C'è forse un problema di cui non sono a conoscenza? </p><p>Grazie per l'aiuto. Maurizio </p>",desktop;fix-problems;windows-10;firefox-960;,firefox,fix-problems,it,1473483;1473493;1473500;,mmeronzi
1364131,2022-01-13 01:09:25 -0800,2022-01-13 03:13:24 -0800,Crashing,<p>The browser keeps on crashing.  I have tried just about everything that I know to do.  Please help. </p>,desktop;fix-problems;,firefox,fix-problems,en-US,1473468;1473589;,Bruin98
1364130,2022-01-13 01:08:51 -0800,2022-01-13 01:14:02 -0800,Just installed a new windows update running windows 10 and now firefox wont load webpages on any tabs i open,<p>Just installed a new windows update running windows 10 and now Firefox wont load webpages on any tabs i open  Version 94 64 bit </p>,desktop;websites;,firefox,websites,en-US,1473467;1473480;,dwbradford
1364129,2022-01-13 01:08:41 -0800,2022-01-13 03:14:45 -0800,firefox won't work,"<p>Hi, </p><p>PC rebooted yesterday to complete microsoft office update.  Now firefox won't work. I have removed all addons - and it still won't work </p>",desktop;fix-problems;incident13012022;,firefox,fix-problems,en-US,1473470;1473591;,web62
1364128,2022-01-13 01:07:18 -0800,2022-01-13 01:36:51 -0800,something is wrong the app is broken,<p>I can not bring mozilla back alone . ican not solve the problem </p>,desktop;fix-problems;needsinfo;,firefox,fix-problems,en-US,1473463;1473469;1473473;1473487;1473517;1473519;,aralexandraki
1364127,2022-01-13 01:07:01 -0800,2022-01-13 05:16:09 -0800,recover deleted passwords,<p>I have deleted all my passwords (using a cleaning app) and now lost my passwords. How can I get them back? I assume there is a backup in the system? </p>,mac-os;desktop;privacy-and-security_1;firefox-950;,firefox,privacy-and-security,en-US,1473539;1473647;,sammarwood
1364126,2022-01-13 01:07:01 -0800,2022-01-13 02:20:38 -0800,"Firefox crashes constantly on High Sierra Mac since Jan, 13th 2022","<p>Tried restart, reinstall etc. Is Firefox not compatible with High Sierra anymore? </p>",desktop;fix-problems;incident13012022;,firefox,fix-problems,en-US,1473540;,amannsis
1364125,2022-01-13 01:06:58 -0800,2022-01-13 03:12:16 -0800,problem loading websites,"<p>Dear team, I've been having issues today with firefox which started suddenly, trying to access any website does not work and no error message is returned I've tried google, facebook, local network sites even though all is fine on other browsers. I have followed all steps in your troubleshooting guide with no luck. Refreshing firefox, deleting cache, re installing. </p><pre>troubleshooting mode doesn't start at all and crashes after high CPU usage in task manager </pre> <p>creating a new profile works until restarting the application then the problem re occurs. I've also sent multiple reports. </p>",desktop;websites;incident13012022;,firefox,websites,en-US,1473464;1473588;,aelafifi
1364124,2022-01-13 01:06:46 -0800,2022-01-13 09:09:33 -0800,Firefox 96 Not Working - Workaround/Temp Fix,"<p>Firefox 96 stopped working for me this morning :( </p><p>A workaround/temporary fix is to disable (set to false)  http3 in about:config. </p><p><a href=""https://news.ycombinator.com/item?id=29918052"" rel=""nofollow"">https://news.ycombinator.com/item?id=29918052</a> </p>",mac-os;desktop;other;firefox-960;incident13012022;,firefox,other,en-US,1473479;1473597;1473733;,bob.bousfield
1364123,2022-01-13 01:06:40 -0800,2022-01-13 02:53:05 -0800,Firefox No Internet Access,"<p>Was using my browser firefox, watching a yt vid and clicked to watch another vid and it stopped having network access. Confirmed firewall isn't blocking anything (even disabled it) and no proxy being used. Reinstalled 96.0 (was on like 95.X) no change --- update option in settings has no network access so I just downloaded it on another browser &amp; installed (left the temp files alone) same issue. </p><p>This is a software issue with Firefox, not a computer issue. Nothing was updated or change on the computer either and it just stopped working while on youtube. Restarted PC, no change. Disabled a few exts like adblocker &amp; no change. </p><p>PC is running macos 11.6, 96.0 firefox. </p><p>Thank you for any help. </p>",desktop;other;needsinfo;incident13012022;,firefox,other,en-US,1473465;1473520;1473574;,velaur
1364122,2022-01-13 01:06:39 -0800,2022-01-13 09:09:51 -0800,Firefox 96.0 stop working not loading any websites,"<p>Firefox opens and loads the home page; however, no links work and no tab loads.  It's version 96.0.   I tried to do an update check, but in never connected after 20 minutes.  I have 3 other browsers that work perfectly , but firefox won't do anything but sit and spin.  I can't even log into my modem using a gigabit wired connection.  Please help! </p>",desktop;websites;incident13012022;,firefox,websites,en-US,1473474;1473476;1473594;1473734;,dandaplanman
1364121,2022-01-13 01:06:24 -0800,2022-01-13 01:53:19 -0800,why webgl on firefox is disabled?,"<p>when i searched for "" WebglAllowWindowsNativeGl:false restricts context creation on this system "" in google, without quotes, i saw that at certain firefox version it has become disabled. but there is no explanation, why it was disabled. </p><p><a href=""https://support.mozilla.org/en-US/questions/1334668"" rel=""nofollow"">https://support.mozilla.org/en-US/questions/1334668</a> ""WebGL stopped working after the Firefox 88 upgrade"" </p><p><a href=""https://www.reddit.com/r/firefox/comments/ky3m4l/accelerated_graphics_stopped_working_after_an/"" rel=""nofollow"">https://www.reddit.com/r/firefox/comments/ky3m4l/accelerated_graphics_stopped_working_after_an/</a> ""Accelerated graphics stopped working after an update ... firefox 84.0.1-2 -&gt; 84.0.2-1"" </p><p>somebody answers that users can enable it from about:config. i am responsible if i manually enable it. i want to know, why it become disabled. </p>",linux;desktop;other;firefox-950;,firefox,other,en-US,1473524;,qdinar
1364120,2022-01-13 01:05:38 -0800,2022-01-13 01:13:37 -0800,Firefox no respond + no internet,"<p>Hello, this morning, i can't use Firefox. I've got an error message on opening : ""Firefox is already in use and don't respond. The old process of firefox must be stopped...."" And when i click ""close firefox"", it's opening but i don't have internet. </p><p>What i already tried: - disable all plugin - disconnect my firefox profile - run in ""maintenance"" mode - run an auto repair and clear cache history etc. - uninstall and delete program files folder of firefox - download latest installer and install fresh Firefox - Edit network.dns.ipv6 + network.dns.prefetch </p><p>I still have a crash message on startup and no internet. Chrome and Edge are working like a charm. </p><p>Any idea? thank you. </p>",desktop;fix-problems;,firefox,fix-problems,en-US,1473475;,decapeter
1364119,2022-01-13 01:04:23 -0800,2022-01-13 02:15:26 -0800,Firefox doesn't load pages after update,"<p>After Win10 and Firefox installed some updates, Firefox doesn't load any web-pages, infinitly checks for updates and cann't get it, cann't load my router's web interface. Current Firefox' version is 95.0.2 x64. Microsoft Edge works properly. I have already turned on and off Windows' firewall (I have no other firewalls) and restarted system. </p>",desktop;websites;incident13012022;,firefox,websites,en-US,1473459;1473492;1473496;1473532;,qoom
1364118,2022-01-13 01:03:59 -0800,2022-01-13 01:04:35 -0800,"Firefox 95.0.1 ""new-window"" consuming all CPU","<p>I have a problem with running Firefox v95.0.1 on Ubuntu 20.04 operating system. When I first open Firefox, process with command <strong>/usr/lib/firefox/firefox -new-window</strong> starts and taking up 100% CPU. This process doesn't stop even if after closing Firefox and after a while crash reporters says that Firefox is crashed. While the browser is open and the mentioned process is running, I can't open any web page, since it's loading infinitely. I attached here screenshots of both process details and crash reporter. </p>",desktop;fix-problems;,firefox,fix-problems,en-US,1473454;,cahangirove
1364117,2022-01-13 01:03:33 -0800,2022-01-13 01:48:03 -0800,Firefox crashes after update to version 96,"<p>Hi. </p><p>I just updated my firefox to version 96. After starting it, none of the tabs is loading, regardless of the url. No problems with Chrome or other programs.  After a few minutes I just get the error message telling me that firefox has crashed. I restarted Windows (10, 64 bit, updated yesterday) twice, checked my firewall, reinstalled firefox. None of it worked. :-(  </p><p>It would be great, if you can offer me some help. Greetings Chris </p>",desktop;fix-problems;,firefox,fix-problems,en-US,1473477;1473522;,chris.303
1364116,2022-01-13 01:03:14 -0800,2022-01-13 07:41:57 -0800,Po aktualizaci MF na 96.0 (64 bitů) se nenačítají webové stránky,"<p>Dobrý den,  </p><p>včera večer se mi aktualizoval Firefox na verzi 96.0, a od té doby začalo být načítání webových stránek velmi pomalé (v řádech minut a některé se nenačetli vůbec). Přisuzoval jsem to chybě internetu. Dnes v práci jsem na jiném PC, kde se mi rovněž aktualizoval Firefox na uvedenou verzi a problém se vyskytuje taky.  Vypnul jsem antivir, Firewall, zkoušel Safe mode a bez úspěchu. Následně jsem se dozvěděl z vedlejší kanceláře, že od rána Firefox taky na 2 PC nefunguje, takže to spojuji s jeho aktualizací, ale nevím, jak z toho ven. Dříve bylo možné stáhnout předchozí verzi Firefoxu, a zablokovat aktualizaci, ale teď nevím, jak bych ji stahl, protože jsem našel pouze ""online instalátor"".  Prohlížeče Waterfox i Opera fungují normálně.  </p><p>Předem děkuji za pomoc. </p>",desktop;fix-problems;windows-10;firefox-560;,firefox,fix-problems,cs,1473686;,cetelon
1364115,2022-01-13 01:01:36 -0800,2022-01-13 01:17:35 -0800,"Firefox will no longer load any website, and crashes on quit","<p>My initial problem was that firefox 96 on mac os 12.1 would no longer load any website. </p><p>I verified that other browsers work just fine (in fact, i'm writing this on the same machine, but using Chrome). </p><p>I uninstalled firefox, and even removed my old profiles. Then did a clean install. The problem persists. </p><p>In addition, when I now quit firefox it takes a long time, and pops up the crash reporter every time. </p><p>How can I fix this ? </p>",desktop;fix-problems;,firefox,fix-problems,en-US,1473460;1473490;,krisds
1364114,2022-01-13 00:59:42 -0800,2022-01-13 01:11:48 -0800,Container tabs not working,"<p>I reinstalled firefox because it was not loading any pages, and although that problem is solved, now I can't get container tabs to work. Even if I reinstall it, restart Firefox, or disable/reenable it, I can't get it to work. Anyone know what I can do? Should I just reinstall firefox again? </p>",desktop;customize;windows-10;firefox-960;,firefox,customize,en-US,1473472;,shanzay1234657
1364113,2022-01-13 00:59:30 -0800,2022-01-13 01:34:06 -0800,"Firefox is suddenly not loading any website. No error message displayed, only spinning wheel endlessly displaying in tab","<p>I tried to disable javascript, delete pref.js file, resinstall firefox but without success. </p><p>Even the new reinstalled version crash everytime I try to close it. </p><p>This seems to have happened when I was trying to complete an order on a website...  </p><p>So strange. </p>",desktop;fix-problems;,firefox,fix-problems,en-US,1473458;1473495;1473507;1473516;,liechtjc
1364112,2022-01-13 00:59:23 -0800,2022-01-13 09:06:41 -0800,Firefox is hanging.,"<p>Firefox worked fine for about 20 minutes but now it's hanging. I tried downloading the latest version, changed the places.sqlite filename to places.sqlite.old but nothing works. Help! </p>",desktop;fix-problems;incident13012022;,firefox,fix-problems,en-US,1473478;1473489;1473498;1473611;1473727;,suroora
1364111,2022-01-13 00:55:45 -0800,2022-01-13 03:02:11 -0800,"Firefox crashes on startup, even in troubleshoot","<p>Hi, Firefox suddenly started crashing today. I can't load any tabs, or if I can manage to load one or two it usually crashes very soon after. I tried using troubleshoot mode, which didn't solve the problem. I also tried a clean install, which didn't fix it either. I haven't installed any new extensions or applications on my PC. Here is the latest Crash ID: bp-b7811dc4-26c3-41ab-811b-252bc0220113. Thanks! </p>",desktop;fix-problems;,firefox,fix-problems,en-US,1473579;,kristenvandv
1364110,2022-01-13 00:55:20 -0800,2022-01-13 02:49:41 -0800,"After updating Firefox Developer 97.0b2 (64-bit), Firefox no longer connected to the Internet.","<p>As the title says, after updating Firefox Developer 97.0b2 (64-bit), Firefox no longer connected to the Internet. </p><p>at the same time running other browser, Chrome/Edge is still connected and running fine. The internet connection on my PC is running just fine, just not for Firefox </p>",desktop;fix-problems;incident13012022;,firefox,fix-problems,en-US,1473531;1473567;,Damienov
1364109,2022-01-13 00:55:03 -0800,2022-01-13 12:57:27 -0800,Firefox stopped working on two different macOS systems,"<p>I have Firefox on an old MacBook which hasn't had its macOS updated for a couple of years, and a new Mac running up-to-date Monterey. In both, Firefox has just developed the same problems at the same time: pages won't load, and the program won't shut down normally -- I have to use force quit. Safari works fine and I've tried all the usual solutions, bar deleting and reloading the app. I don't want to do that yet since the problem is the same on two different computers and an old and a new macOS. Since Firefox has recently updated, has that caused the problem? </p><p><br> </p><p>edited iOS to macOS as iOS is a mobile OS for iPhones and moved thread to (desktop) Firefox section. </p>",mac-os;desktop;macos;,firefox,basic-browsing-firefox,en-US,1473513;,PJCMcAuley
1364108,2022-01-13 00:52:48 -0800,2022-01-13 01:25:37 -0800,Mozilla is not loading pages nor showing error messages when doing so,"<p>Good morning, I was working this morning on the  browser when suddenly the webpage I was in showed a connectivity error. When I tried reloading the page it did not load at all. I have tried with many other websites and none of them loads. I have tried waiting to see whether an error appeared, but nothing. Whenever I try to close the browser after a while (approximately a minute) it shows an error message that the process has crashed. I have already sent the report a couple of times before quitting the process from within the error message. </p><p>I run a Dual Boot system of Windows 10/Ubuntu 20.04 I am only experiencing the problem with firefox in Ubuntu and other browsers work correctly on the system. I have re-installed firefox with ""sudo apt remove firefox"" and ""sudo apt install firefox"" and nothing changed. I have also updated to the latest version, tried disabling all the add-ons and switching the connection to ""no-proxy"" as suggested in the support webpage. I don't really know what else to try </p><p>Thanks in advance for the reply and do not hesitate to ask for any further information you may require. </p>",desktop;fix-problems;,firefox,fix-problems,en-US,1473452;1473453;1473506;,penci99
1364107,2022-01-13 00:52:23 -0800,2022-01-13 02:21:28 -0800,Firefox 64 don't navigate - last update,"<p>Anyone else has the same issue after update to latest 64 bit version? Working fine before update, now don't open a single site, even google com </p><p>All other browsers working fine, mainly brave </p><p>Had to uninstall and intall the 32 bit version to be able to navigate again... </p><p>BORING </p><p>Anyone found a better solution? </p><p>(I tried clear all sets when uninstalling and didn't worked) </p>",desktop;fix-problems;incident13012022;,firefox,fix-problems,en-US,1473541;1473543;,ivan46
