id,created,updated,title,content,tags,product,topic,locale,answers,creator
1397421,2022-11-20 22:28:15 -0800,2022-11-20 22:28:15 -0800,Website pages not loading in Firefox,"<p>Hi, </p><p>For some reason some web pages of my website are not loading in Firefox i have tried several times, it shows error. It's loading perfectly fine on google and internet explorer. Here are the pages <a class=""new"" href=""/en-US/kb/new?title=A2+Curd"" rel=""nofollow"" title=""Page does not exist."">A2 Curd</a> and <a class=""new"" href=""/en-US/kb/new?title=A2+Milk"" rel=""nofollow"" title=""Page does not exist."">A2 Milk</a>.  </p><p>Thanks in advance </p>",desktop;fix-problems;windows-10;,firefox,fix-problems,en-US,"",nativemilkindia
1397417,2022-11-20 20:49:38 -0800,2022-11-20 20:49:38 -0800,"I'm Getting ""Use your Google Account to Sign in to...""","<p>I've been getting a PopUp recently (upper right corner below bookmarks toolbar) titled ""Sign in with Google"" saying ""Use your Google Account to Sign in to..."".  I've followed the instructions on the internet to access my Google account and turn off this security setting (Google Account sign-in prompts) and it still appears.  This does not happen on other chromium browsers I regularly use. </p><p>Why does Firefox keep displaying this PopUp, and more importantly, how can I suppress this annoyance? </p><p>Thanks, </p><p>Firefox v107.0 (64-bit) - up to date Windows 10 Pro (fully updated) Running NordVPN. </p>",desktop;privacy-and-security_1;windows-10;firefox-1070;,firefox,privacy-and-security,en-US,"",BPaul_H
1397416,2022-11-20 20:36:24 -0800,2022-11-20 20:44:52 -0800,Computer memory used by FireFox,"<p>In Windows task manager, it shows Firefox using 863.9MG (it was up to 1,4485.6MB a while ago) of memory with 17 Firefox files listed under the Firefox heading.  What is this?  Why is it using so much memory? </p>",desktop;other;windows-10;firefox-1070;,firefox,other,en-US,1549117;,hedeli0812
1397415,2022-11-20 20:30:00 -0800,2022-11-20 20:37:11 -0800,My new Lenovo laptop running Windows 11 Pro with Firefox Browser will not open this URL: https://app.weaveeducation.com/login,"<p>My new Lenovo laptop running Windows 11 Pro with updated Firefox Browser will not open this URL: <a href=""https://app.weaveeducation.com/login"" rel=""nofollow"">https://app.weaveeducation.com/login</a> When I attempt to log in, a large circular image spins around for just a few seconds and the everything stops. </p><p>The same URL will run on my Windows 10 Home machine using Firefox just fine.  </p><p>Just wonder if there is something I may be able to change to get this URL to open on the Windows 11 Pro machine? </p><p>Thanks so much. Howard Kuchta Lawton, Oklahoma hkuchta@sbcglobal.net Retired Educator </p>",desktop;fix-problems;windows-11;firefox-1070;,firefox,fix-problems,en-US,1549116;,hkuchta
1397414,2022-11-20 20:03:42 -0800,2022-11-20 22:22:26 -0800,How to disable restore session when reboot computer,"<p>I disable my option ""Restore previous session"" and it works fine if i close my firefox. </p><p>But if i do not close my firefox and reboot my computer directive, the session will restore at next startup. </p><p>Obviously when i reboot my computer, I don't want to see my tabs anymore, but I failed to find any setting to do so. I also find someone say to set `browser.sessionstore.resume_from_crash` in `about:config`, but it doesn't work, and I don't think it is the proper way to solve this problem because reboot is not crash. </p><p>OS: linux firefox: 107 </p>",linux;desktop;tips;firefox-1070;,firefox,tips,en-US,1549124;1549125;,slow_d
1397413,2022-11-20 19:42:06 -0800,2022-11-20 19:42:06 -0800,nnnnnvvv,"<p><a href=""http://example.com"" rel=""nofollow"">link text</a> </p>",windows-7;desktop;download-and-install_1;firefox-1070;,firefox,download-and-install,en-US,"",karemmorad2015aaa
1397412,2022-11-20 19:12:30 -0800,2022-11-20 19:12:30 -0800,mozilla firefox not suport,<p>help me </p>,windows-7;desktop;privacy-and-security_1;firefox-1070;,firefox,privacy-and-security,en-US,"",monuranjandoley4732
1397411,2022-11-20 18:34:53 -0800,2022-11-20 18:34:53 -0800,Rally asks me to complete my enrollment every time I start Firefox,"<p>I enrolled in ""Rally"" some time ago and participated in a few studies. Suddenly, every time I start Firefox, it puts up a page telling me I haven't completed my Rally enrollment. (<a href=""https://rally.mozilla.org/rally-required/index.html"" rel=""nofollow"">https://rally.mozilla.org/rally-required/index.html</a>) If I click on the button, ""Complete Enrollment,"" I am simply taken to a page that says there are no available studies. </p><p>Not even slightly debilitating, but certainly annoying! Anybody have a suggestion? </p>",desktop;customize;mac-os-x-1015;firefox-1070;,firefox,customize,en-US,"",BSquared
1397410,2022-11-20 18:16:45 -0800,2022-11-20 19:10:02 -0800,Yahoo Mail,"<p>After the latest version of Fire Fox was installed, my yahoo email no longer works as before. Emails show up and can be read but that's all. Can't delete, reply to, access contacts, settings etc. Basically everything along that line of functions is inop. When using MS Edge to access yahoo mail everything is fine. And, everything was fine with the previous version of Fire Fox. Can I go back to that previous version or can this be fixed? </p><p>Thanks for your help..... </p>",desktop;other;windows-10;firefox-1070;,firefox,other,en-US,1549112;,reillybonchien
1397407,2022-11-20 17:13:46 -0800,2022-11-20 17:13:46 -0800,I am missing the Minimize and Exit icons in the top Tab,<p>I am not able to minimize or Exit out of the Firefox browser--There are no icons on the top banner to click on when I have to exit the browser. </p>,desktop;tabs;windows-81;firefox-1070;,firefox,tabs,en-US,"",Gugui1
1397406,2022-11-20 16:24:34 -0800,2022-11-20 16:52:24 -0800,Firefox wont't save password,"<p>for some reason firefox decided it is fun to mess around with my browser and decided to prevent me from making saved logins,this is so frustrating why does firefox like to do this. </p>",desktop;customize;windows-11;firefox-1070;,firefox,customize,en-US,1549103;1549108;,haydensupercargarage
1397405,2022-11-20 16:22:54 -0800,2022-11-20 16:22:54 -0800,My screen resolution in twitter has gone haywire,"<p>Here is a screen dump of my twitter account in firefox. Cant' fix it, </p>",desktop;other;windows-10;firefox-1070;,firefox,other,en-US,"",nctriggs
