id,created,updated,title,content,tags,product,topic,locale,answers,creator
1373068,2022-04-02 23:49:57 -0700,2022-04-02 23:49:57 -0700,NON SI APRONO I LINK PER ISCRIZIONE E DIVERSI WEBINAR,<p>scrHo ricevuto diverse PEC di iscrizione a WEBINAR. Ckicco dove c'è scruitto clicca QUI'. Appare il quadretto di iscrizione per una frazione di secondo e sparisce. Impossibile iscrivermi a DUE webinar. Da cosa dipende? Potete aiutarmi? Grazie in ogni caso. Saluti. Bruno Grazia </p>,desktop;other;windows-10;firefox-980;firefox-9802;,firefox,other,it,"",pietroplatania48
1373067,2022-04-02 23:06:32 -0700,2022-04-02 23:06:32 -0700,ONLINE FORM,<p>MURTIZA Kssar </p>,windows-7;desktop;other;firefox-720;firefox-7202;,firefox,other,en-US,"",murtizaa512
1373066,2022-04-02 22:15:20 -0700,2022-04-02 23:18:38 -0700,None of the Websites I Try to Visit Load in Firefox.,"<p>I was using Firefox as usual when Bitdefender, my antivirus app, apparently caught a Firefox-related file it thought was malicious and either quarantined or deleted it. </p><p>Now, Firefox will not display any websites at all. The other web browser on my computer Microsoft Edge, displays the websites just fine and is not having issues. But not Firefox. </p><p>I tried uninstalling and then reinstalling Firefox, to no avail. I also tried to restart my computer, again to no avail. </p><p>What do I need to do to have Firefox back up and running again? </p>",desktop;fix-problems;windows-11;firefox-980;firefox-9802;,firefox,fix-problems,en-US,1494720;,buy6
1373064,2022-04-02 21:02:47 -0700,2022-04-02 22:00:15 -0700,firefox,<p>-firefoxbrowser </p>,desktop;other;mac-os-x-1015;firefox-980;firefox-9802;,firefox,other,en-US,"",ma_sa
1373063,2022-04-02 20:55:51 -0700,2022-04-02 20:55:51 -0700,Cant load BDO OnLine Banking website,"<p>I have a BDO online banking website in my favorites, it just stopped working, it will not connect, when I search it from browser as apposed from favorites it wont load there either, if i search in Googgle Crome it will load ok </p>",desktop;other;windows-10;firefox-980;firefox-9802;,firefox,other,en-US,"",awhit.ten
1373061,2022-04-02 20:00:30 -0700,2022-04-02 23:22:56 -0700,Option to use Gmail for mailto: links has suddenly vanished from Settings,"<p>Just now, I tried to use ""Email Link..."" under the File Menu and got a pop-up asking me to ""Choose an application to open the mailto link.""  I have seen this before, several times, usually after updating Firefox, IIRC. </p><p>This time, however, Gmail is not presented as an option, in this pop-up.  Clicking ""Choose..."" just opens up a Windows Explorer file-picker window.   </p><p>I tried to fix this in Tools &gt; Settings, under General &gt; Applications.  There, ""mailto"" just shows ""Use other..."" and if I click that, the ""Select Helper Application"" pop-up window is basically blank, with a message at the bottom saying ""No applications were found for this file type."" </p><p>See attached images. </p><p>I am running v98.0.2 on Win 10 Pro. </p>",desktop;customize;windows-10;firefox-980;firefox-9802;,firefox,customize,en-US,1494694;1494709;1494722;,bjkeefe
1373057,2022-04-02 17:46:50 -0700,2022-04-02 20:45:11 -0700,Disable Private Mode temporarily,"<p>I AM NOT TECH SAVVY, SO PLEASE RESPOND IN APPORPIATE LANGUARE  :-) I HAVE AVG ON MY SAMSUNG ADROID MOBILE FOR INTERNET SECURITY. I AM IN NEED OF RENEWAL. WHEN I CLICK TO DO SO, I AM STOPPED WITH THE FOLLOWING MSG:  </p><p>PRIVATE BROWSING MODE NOT SUPPORTED ON THIS WEBSITE AS COOKIES ARE REQUIRE FOR YOUR PURCHASE. PLEASE TRY AGAIN AFTER TURNING PRIVATE BROWSING MODE OFF AND ENSURE COOKIES ARE ENABLED IN ORDER TO SHOW THE CONTENT OF THE SIRE CORRECTLY. </p><p>AFTER SEARCHING ON MY PC FOR INSTRUCTION ON HOW TO DO THIS, I AM UNABLE TO FIND AN ANSWER. I ONLY WISH TO DISABLE PRIVATE MODE TEMPORARILY. CAN IT BE ""TURNED OFF AND ON"" ? HOW ? </p><p>THANK YOU FOR YOUR ASSISTANCE. </p>",desktop;cookies;windows-10;,firefox,cookies,en-US,1494704;1494705;,jentpt63
