id,created,updated,title,content,tags,product,topic,locale,answers,creator
1381354,2022-06-30 07:42:22 -0700,2022-06-30 07:42:22 -0700,"Can't find the Gmail app so that online ""mailto"" links will open in Gmail","<p>Greetings, I've checked a few articles in Firefox to help with my question, but none of them are helping. (Here's the  main article: <a href=""http://example.com"" rel=""nofollow"">http://example.com</a>.) Here's the situation. Say I go to a website's Contact page and click the button to contact someone, a window appears and asks me what app I want to use to open the email. Gmail is my default email, and Firefox is my default browser, and I use Windows 10. When I open the window of options (see attached screenshot) to open the email, and I then click ""Choose Other Application"" (other than Firefox), I don't see the Gmail app anywhere. I then followed the directions in that link above to check my Windows settings, per its suggestion, which I did ... but in those settings, too, I got to a point where the directions no longer matched what I'm seeing on my screen. I didn't see the Gmail app anywhere. Could you let me know in simple layperson's terms how to open Gmail links in Firefox? I don't have a PhD in computer science, so please keep it very simple. Thanks in advance! Best wishes, Bill </p>",desktop;customize;windows-10;firefox-1020;,firefox,customize,en-US,"",BillSiever
1381353,2022-06-30 07:39:43 -0700,2022-06-30 07:39:43 -0700,Screenshot does not work in release 102,"<p>Hi, </p><p>I am unable to use the screenshot feature since the update to 102.0 and I don't know why. So far it always worked. I have updated the screenshot item via customizing the toolbar, still it does not respond. </p><p>Have you got a solution that works? </p><p>Thank you.  </p><p>Sincerely, </p><p>B. Struk </p>",desktop;customize;windows-10;firefox-1020;,firefox,customize,en-US,"",berthold.struk
1381351,2022-06-30 07:28:16 -0700,2022-06-30 07:28:16 -0700,Redirect Issue in firefox browser,"<p>I have been using firefox on ubuntu 22 for more than a month and everything was working fine untill 4 days earlier when i first got error relating to security certificate issue and data hijacking. But i have been using same sites earlier too without any issue. Also those sites are just articles on site without any personal information. From last 2 days i am also getting redirecting issues. First site to redirect to during google search is bestbonusprize.life then if i disable adblocker it just keep redirecting. I don't have any issue accessing same site in google chrome. I just have firefox installed till 4 days earlier, but when i start getting issues i installed chrome to test if i am getting same issue but all work good in chrome. One of the main change from earlier is i was in different location using different wifi provider. It could be one of the issue  but i am not sure as other people using same wifi don't have much issues. Plus things work fine in chrome. I tried using anti-malware but malwarebyte is only available for window and i don't know any thing about anti-virus and malware removal for ubuntu as never needed it. Please guide me for securing my firefox browser. Regards. </p>",linux;desktop;fix-problems;firefox-1010;firefox-10101;,firefox,fix-problems,en-US,"",traptit1
1381347,2022-06-30 07:07:10 -0700,2022-06-30 07:07:10 -0700,How do I contact a technical support person at Firefox to help me?,<p>Is there a technical support or live chat to reach a real person and have a conversation about my problem about my last Firefox update disabling the application. </p>,desktop;other;windows-10;,firefox,other,en-US,"",thornleydj
1381346,2022-06-30 07:04:45 -0700,2022-06-30 07:31:43 -0700,"New Computer, Saved Logins are not showing when I log into Firefox account","<p>I'm working on a new computer, as my work laptop is being upgraded to Windows 11.  In the meantime, I have logged into Firefox, but none of the login info that I had previously saved is available.  I can still see it on my mobile browser, but not on this new laptop.   </p><p>Am I just missing a step? </p>",desktop;sync;windows-11;firefox-1010;firefox-10101;,firefox,sync,en-US,1515791;,mmccormack2
1381345,2022-06-30 07:03:32 -0700,2022-06-30 07:03:32 -0700,Most recent Firefox Update has disabled Firefox and it will not open.,"<p>After loading its most recent update, I am unable to open Firefox.  I get two error messages.  <strong>The procedure entry point  SECMOD_LockedModuleHasRemovableSlots could not be located in the dynamic linked library C:\Program Files\Mozilla Firefox\xul.dll </strong>and a second error message <strong>couldn't load XPCOM</strong>.  What can I do to solve this? </p>",desktop;download-and-install_1;windows-10;,firefox,download-and-install,en-US,"",thornleydj
1381344,2022-06-30 06:52:52 -0700,2022-06-30 07:03:01 -0700,igHome and Google Calendar,"<p>I am using the latest Firefox version 102.0 and I have igHome set as my home page. Yesterday the Google Calendar Gadget would no longer display the calendar but would display this message: </p><p><em>Firefox Can’t Open This Page </em> To protect your security, accountsgooglecom will not allow Firefox to display the page if another site has embedded it. To see this page, you need to open it in a new window.<em> </em> </p><p>If I click on the “Open Site in New Window” button it does open the calendar. (See attached screenshot.) I have tried login out and back into igHome and my Google account but it doesn’t fix the issue. This is happening on both my laptop and desktop computers running Windows 10 Home. All Windows updates are up to date. I opened Firefox in Troubleshooting Mode and the calendar still does not show. When I use the Google Chrome browser with the same igHome home page the Calendar works fine. Is this something Firefox can fix, or do I need to contact Google? </p>",desktop;fix-problems;windows-10;firefox-1020;,firefox,fix-problems,en-US,"",jterps52
1381343,2022-06-30 06:51:34 -0700,2022-06-30 06:51:34 -0700,Notifications don't work,"<p>Absolutely no websites seem to ask the user for allowing notifications, nor can i add them to my notification list myself (not a firefox feature). I also have no way to enable Firefox's notifications in Windows 10's action center, for there is no option. </p>",desktop;other;windows-10;firefox-1020;,firefox,other,en-US,"",electricirbis
1381342,2022-06-30 06:51:27 -0700,2022-06-30 06:53:57 -0700,Is there a way to get your site indexed in the Firefox search engine?,"<p>I searched a lot and didn't find the ideal way to archive my site in Firefox search engines. What do you do? <a href=""https://www.skillsrich.com"" rel=""nofollow"">https://www.skillsrich.com</a> </p>",desktop;tips;needsinfo;,firefox,tips,en-US,1515787;,richskiills
1381341,2022-06-30 06:49:54 -0700,2022-06-30 06:49:54 -0700,Default email setting,<p>Firefox is set as my default email app in W10 - pls see uploaded image. I have tried to change it by using the options at the bottom of that default app screen.  I use Sky Yahoo mail but I cannot change from Firefox. I want to set Sky Yahoo as my default email for W10. </p><p>Any help for this old novice much appreciated. </p><p>Thank you. </p>,desktop;other;windows-10;firefox-1020;,firefox,other,en-US,"",R.1C
1381340,2022-06-30 06:34:02 -0700,2022-06-30 06:34:02 -0700,Unable to see lines of data fill 'boxes'  (screen masks) since new updates  HELP,<p>It seems that since the last update none of the available screen schemes / contrast schemes allow for me to see the input mask boxes.   (Of course today with this support page there is an exception but....)  I have wasted hours trying to read and adjust and end with only an attitude.  HELP </p>,desktop;customize;windows-10;firefox-1020;,firefox,customize,en-US,"",TimHoHere
1381339,2022-06-30 05:57:13 -0700,2022-06-30 05:57:13 -0700,Firefow slows down and becomes inoperable,"<p>Firefox seems to slow down and then stops responding. I have looked at it and it seems to load up to 25 instances, even when only 4 tabs are open. When it fails the only option is to stop it operating and start over. This problem seems to getting worse with newer updates. </p>",desktop;fix-problems;windows-10;firefox-1020;,firefox,fix-problems,en-US,"",DerickB52
1381337,2022-06-30 05:49:05 -0700,2022-06-30 05:49:05 -0700,Websites where I have accounts freezing,"<p>Hi guys- </p><p>I've just recently started having this problem with two websites, both of which I have accounts for: my company's own website - <a href=""http://bbowt.org.uk"" rel=""nofollow"">bbowt.org.uk</a> - and Canva. </p><p>I can get onto both sites and start using them, but invariably - after a certain amount of time - they will freeze up so that none of the links on the page work anymore. </p><p>The only solution is to go to 'Clear Recent History' then 'Clear Active Logins' - but a) obviously I don't want to log out of these sites - I need to be logged in to work, and b) I'd like a permanent solution. </p><p>All suggestions welcome </p><p>Thanks a lot </p><p>Pete Hughes </p>",desktop;windows-10;website-breakages;firefox-1020;,firefox,website-breakages,en-US,"",petehughes1
1381336,2022-06-30 05:46:15 -0700,2022-06-30 05:49:04 -0700,Cannot access usps.com,"<p>When attempting to access site for US Post Office, <a href=""http://usps.com"" rel=""nofollow"">usps.com</a>, this comes up: Reference:176767331483942761601719542674070181865220034968299102359 </p>",desktop;other;windows-11;firefox-1010;firefox-10101;,firefox,other,en-US,1515783;,walkersw58
1381331,2022-06-30 05:09:20 -0700,2022-06-30 05:09:20 -0700,Downloaded files saved without file extension (Firefox 102.0 Mac) / handler-issue?,"<p>Dear Firefox community, </p><p>we discovered a bug in Firefox 102.0 for Mac; to summarize: downloaded files are <em>in some cases saved, without file extension</em> - not in all cases though (otherwise probably lots of users would've reported this bug already).  </p><p>It's not completely clear to me, why this happens, I'll first describe it more in detail: We noticed this problem specifically for Citrix Workspace .ica files (by the way, you can find more info reg. this filetype here: <a href=""https://fileinfo.com/extension/ica"" rel=""nofollow"">https://fileinfo.com/extension/ica</a> ). So instead of saving let's say, <em>73sz92dz.ica</em>, it's just saving <em>73sz92dz</em> - if macOS tries to open this file, it defaults to ""Text Editor.app"", and all normal Citrix workflows are broken. So to explain, why broken: these files are generated automatically from Citrix, after login in the browser; then downloaded and normally opened by ""Citrix Workspace.app"", if it's installed &gt;&gt; then the remote Desktop opens, and you can work in Windows. </p><p>I didn't notice this behavious (saving files without file extensions) for .dmg files, .xlsx, .zip etc., apparently all regular known file-types are saved as expected. Even for files with the .ica file extension, it doesn't always happen; maybe for 30-50% of the Macs. All the same, I'm pretty positive it's <em>not</em> a Citrix problem: if I downgrade Firefox on the clients affected to Firefox v. 101.0.1 for Mac, everything works like a charm again. By the way, we have a couple of hundred of Macs here, and I do distribute some Firefox-settings with our MDM (Jamf) - but it's not related: it happens on unmanaged macs (private, or machines not managed by MDM, etc.) as well, and everything I tried reg. settings to create ""automated"" workarounds up to now, is more / less unsuccesful (only manual workarounds, like downgrading Ffox or adding the file extension by hand...). </p><p>I suspect, it may have to do with the Mime type definitions / handler config files in Firefox: I also noticed there's some older Firefox-bugs reg. this topic. It's not entirely clear for me yet, how these handlers, MIMRE type definitions etc. work in Ffox; I'll post an update, if I make progress, which might be useful for fixing this. By the way, I might just as well post this via Bugzilla, I guess (I'm new to the Firefox community)? </p><p>Many thanks for hints! </p>",desktop;download-and-install_1;firefox-1020;,firefox,download-and-install,en-US,"",klaxmbappleid
1381330,2022-06-30 05:03:31 -0700,2022-06-30 05:46:56 -0700,I accidentally disenabled the cookie consent for a website. Now I can't get into the website. Please help with advice,<p>I accidentally disenabled the cookie consent for a website. Now I can't get into the website. Please help with advice </p>,desktop;privacy-and-security_1;windows-10;firefox-1020;,firefox,privacy-and-security,en-US,1515773;1515778;1515781;1515782;,carole.stretch
1381329,2022-06-30 04:57:43 -0700,2022-06-30 05:10:49 -0700,codeblocks not rendering correctly,"<p>I have no problems with chrome but when I pull up some of the websites that have no problem loading up in chrome on firefox I get those half-cut codeblocks, not sure how to fix this, any advice would be deeply appreciated! </p>",linux;desktop;needsinfo;website-breakages;firefox-1020;,firefox,website-breakages,en-US,1515774;,shuklamanmohan21
1381325,2022-06-30 04:34:55 -0700,2022-06-30 04:34:55 -0700,documents opened online have all colors changed to violet,"<p>When I open a pdf document from a website online, all colours turn violet. The original colour is just shown on the miniature view on the left side. Every time I open the browser again, there different pages shown with the original colour, but when I click on them they stay violet. When I download the document, it has the correct colour. </p><p>I have tried to change the colour setting for designs with high contrast, but there is no difference. </p>",desktop;fix-problems;windows-10;firefox-1020;,firefox,fix-problems,en-US,"",elias.hirmke
1381322,2022-06-30 04:00:26 -0700,2022-06-30 04:00:26 -0700,Web application (RDP) - Error when we use the clipboard in FF,"<p>Dear Mozilla Community, </p><p>Our company use a web application whiches we can connect to customer servers via RDP (Remote Desktop Protocol). The web application uses Spark Gateway. The problem is that if we use the web application with Firefox, we can't use clipboard function. </p><p>The error codes in the browser console: </p><p>Uncaught DOMException: A network error occurred. </p><pre>  httpGet <a href=""https://application.ourcompany.com/hosts/gateway/html/hi5core_min.js:68"" rel=""nofollow"">https://application.ourcompany.com/hosts/gateway/html/hi5core_min.js:68</a>   getClipData <a href=""https://application.ourcompany.com/hosts/gateway/html/rdp_min.js:146"" rel=""nofollow"">https://application.ourcompany.com/hosts/gateway/html/rdp_min.js:146</a>   onCopy <a href=""https://application.ourcompany.com/hosts/gateway/html/surface_min.js:120"" rel=""nofollow"">https://application.ourcompany.com/hosts/gateway/html/surface_min.js:120</a> </pre> <p>Content Security Policy: The page’s settings blocked the loading of a resource at <a href=""https://application.ourcompany.com:8384/CLIP?s=ca5311bl-d6bs-67f1c-w501-13dwk0ca54c1&amp;t=2676589901112&amp;type=copy"" rel=""nofollow"">https://application.ourcompany.com:8384/CLIP?s=ca5311bl-d6bs-67f1c-w501-13dwk0ca54c1&amp;t=2676589901112&amp;type=copy</a> (“connect-src”). </p><p>If we use the application with different browser (like Edge or Chrome), we can enable the clipboard on the browser. If we enable the clipboard access for the site (<a href=""https://application.ourcompany.com"" rel=""nofollow"">https://application.ourcompany.com</a>), the copy/paste function works well. The problem is that we cannot find enable clipboard feature in Firefox. </p><p>My quiestion is, how can we enable the clipboard in Firefox for our (webapplication) site? </p><p>Thank you so much for the help! </p><p>Best Regards Gabor </p>",desktop;other;windows-10;,firefox,other,en-US,"",kovacs.gabor
1381321,2022-06-30 03:55:54 -0700,2022-06-30 03:55:54 -0700,Web application (RDP) - Error when we use the clipboard in FF,"<p>Dear Mozilla Community,  </p><p>Our company use a web application whiches we can connect to customer servers via RDP (Remote Desktop Protocol). The web application uses Spark Gateway. The problem is that if we use the web application with Firefox, we can't use clipboard function.  </p><p><strong>The error codes in the browser console:</strong> </p><p>Uncaught DOMException: A network error occurred.  </p><pre>   httpGet <a href=""https://application.ourcompany.com/hosts/gateway/html/hi5core_min.js:68"" rel=""nofollow"">https://application.ourcompany.com/hosts/gateway/html/hi5core_min.js:68</a>    getClipData <a href=""https://application.ourcompany.com/hosts/gateway/html/rdp_min.js:146"" rel=""nofollow"">https://application.ourcompany.com/hosts/gateway/html/rdp_min.js:146</a>    onCopy <a href=""https://application.ourcompany.com/hosts/gateway/html/surface_min.js:120"" rel=""nofollow"">https://application.ourcompany.com/hosts/gateway/html/surface_min.js:120</a> </pre> <p>Content Security Policy: The page’s settings blocked the loading of a resource at <a href=""https://application.ourcompany.com:8384/CLIP?s=ca5311bl-d6bs-67f1c-w501-13dwk0ca54c1&amp;t=2676589901112&amp;type=copy"" rel=""nofollow"">https://application.ourcompany.com:8384/CLIP?s=ca5311bl-d6bs-67f1c-w501-13dwk0ca54c1&amp;t=2676589901112&amp;type=copy</a> (“connect-src”). </p><p>If we use the application with different browser (like Edge or Chrome), we can enable the clipboard on the browser. If we enable the clipboard access for the site (<a href=""https://application.ourcompany.com"" rel=""nofollow"">https://application.ourcompany.com</a>), the copy/paste function works well. The problem is that we cannot find enable clipboard feature in Firefox. </p><p>My quiestion is, how can we enable the clipboard in Firefox for our (webapplication) site? </p><p>Thank you so much for the help! </p><p>Best Regards Gabor </p>",desktop;other;windows-10;,firefox,fix-problems,en-US,"",kovacs.gabor
1381320,2022-06-30 03:23:59 -0700,2022-06-30 03:23:59 -0700,Websites not opening for few minutes as I start browser.,<p>As I start my browsers in Windows I am unable to open any website for like 1 min even if you type some address it keeps loading and after 2-3 min it loads website. This is happening with start homepage as well. </p><p>Version: 102.0 (64-bit) </p>,desktop;fix-problems;windows-10;firefox-1020;,firefox,fix-problems,en-US,"",legendary-acp
1381309,2022-06-30 00:35:29 -0700,2022-06-30 02:58:42 -0700,Unable to share screen of another window,<p>When i want to share screen of only one tab there is no option in the popup regarding that how do i fix it? </p>,mac-os;tabs;macos;,firefox,chat-and-share,en-US,1515744;1515745;,zehra.baig14
1381308,2022-06-30 00:13:15 -0700,2022-06-30 00:41:40 -0700,SCARICARE HP PRINT AND SCAN DOCTOR,<p><strong># * testo in grassetto</strong>NON RIESCO A DIGITALLIZZARE </p>,desktop;fix-problems;offtopic;windows-10;firefox-1010;firefox-10101;,firefox,fix-problems,it,1515723;,fanaracosimo
1381305,2022-06-29 23:27:18 -0700,2022-06-30 03:03:52 -0700,Show Popup as Tab,"<p>Hello, </p><p>Whenever I use Firefox, I end up seeing popups (necessary for school) and would like to show them as tabs so I can merge them into other windows. I have tried the solutions given in: <a href=""https://support.mozilla.org/en-US/questions/1080255"" rel=""nofollow"">https://support.mozilla.org/en-US/questions/1080255</a> and nothing seemed to work. Is there another way to make sure that popup windows cannot hide the toolbar and show tabs? </p>",desktop;beta;tabs;mac-os-x-1015;firefox-1030;,firefox,tabs,en-US,1515749;,aditya.mangalampalli
1381303,2022-06-29 23:03:09 -0700,2022-06-30 02:40:55 -0700,Dynamic content on web pages not being rendered,"<p>Various website that contain dynamic content are not being rendered by Firefox to display that content. This is happening with websites that provide transportation information and ticketing, including <a href=""http://www.amtrak.com"" rel=""nofollow"">Amtrak</a> and <a href=""http://www.peterpanbus.com"" rel=""nofollow"">Peter Pan Bus Lines</a> . It is also happening with a genealogical website, <a href=""http://www.familytreedna.com"" rel=""nofollow"">FamilyTreeDNA</a>, on pages that should be displaying family tree information. Illustrations of two pages are attached. I have been able to access the information by using Opera on this same computer and operating system, and by using the same version of Firefox installed on a different computer with different operating system. I am not sufficiently proficient with website development to know or understand what type of dynamic content is being generated by these websites, or how Firefox interprets the content. My suspicion is that some Firefox setting has been enabled or disabled, but I do not know which one it would be. </p>",windows-7;desktop;customize;,firefox,customize,en-US,1515740;1515741;,lhughes0
1381302,2022-06-29 22:50:33 -0700,2022-06-29 22:53:58 -0700,e mail,<p>e mail with picture where sent to me did not show up in my mail </p>,desktop;other;windows-10;firefox-1020;,firefox,other,en-US,1515712;,jrvanhouden
1381300,2022-06-29 22:02:47 -0700,2022-06-29 22:57:17 -0700,certificate import,<p>why there is no option to import a certificate ? </p>,desktop;other;windows-11;firefox-1020;,firefox,other,en-US,1515714;,wa3751846
1381298,2022-06-29 21:13:44 -0700,2022-06-29 22:34:02 -0700,"can not install ""Privacy Badger"" in Firefox 101.0.1","<p>can not install ""Privacy Badger"" in Firefox 101.0.1 </p>",linux;desktop;customize;firefox-1010;firefox-10101;,firefox,customize,en-US,1515709;,alan.brown777
1381297,2022-06-29 20:48:46 -0700,2022-06-29 20:48:46 -0700,Youtube TV - Stopped working post 102.0 install,"<p>Updated Firefox to 102.0  Youtube TV stopped working.  (Macbook user)  I am using the web version of Youtube TV through Firefox.  Youtube TV starts, allows me to select channels but then i get the never ending spinning wheel.  I have disabled ad blockers, cleared the cache.  Restarted Firefox, Restarted Macbook Pro.  Restarted router and modem.  Youtube TV is playing fine using Safari which uses the same ad blocking software.   </p><p>My question:  What have I overlooked?  Youtube TV was working fine prior to the Firefox 102.0 update. </p>",desktop;download-and-install_1;mac-os-x-1015;firefox-1020;,firefox,download-and-install,en-US,"",roslansky
1381296,2022-06-29 20:42:25 -0700,2022-06-29 20:42:25 -0700,remove top sites from address bar drop-down,<p>I would really like to turn off the top sites list that pops up when I click on the address bar. How do I do that? </p>,desktop;other;mac-os-x-1015;firefox-1020;,firefox,other,en-US,"",colony_d_85
1381295,2022-06-29 19:08:12 -0700,2022-06-29 19:08:12 -0700,Cannot subscribe to Mary's Nest,"<p>Made several attempts to subscribe to Mary's Nest.  I keep getting the following message: </p><p><br>  Server status </p><p>We couldn't process your request at this time. Please try again later. If you are seeing this message repeatedly, please contact Support with the following information: </p><p><br>       </p><p>ip: 98.209.82.6 </p><p><br>           </p><p>date: Wed Jun 29 2022 21:56:09 GMT-0400 (Eastern Daylight Time) </p><p><br>           </p><p>url: <a href=""https://marysnest.us18.list-manage.com/subscribe/confirm"" rel=""nofollow"">https://marysnest.us18.list-manage.com/subscribe/confirm</a> </p><p><br>           </p><p>user agent: Mozilla/5.0 (Windows NT 10.0; Win64; x64; rv:102.0) Gecko/20100101 Firefox/102.0 </p><p><br>         </p><p><br> We're sorry for the inconvenience and appreciate your patience while we get everything straightened out. </p>",desktop;other;windows-10;firefox-1020;,firefox,other,en-US,"",yjc417d
1381293,2022-06-29 18:39:28 -0700,2022-06-29 19:58:50 -0700,my firefox get bigger after update,"<p>ok my problem is: before: <a href=""https://i.ibb.co/gdBssLZ/Image-224.png"" rel=""nofollow"">https://i.ibb.co/gdBssLZ/Image-224.png</a> after: <a href=""https://i.ibb.co/fSY8RHf/Image-241.png"" rel=""nofollow"">https://i.ibb.co/fSY8RHf/Image-241.png</a> </p><p>my firefox take up more space, even my addons dont fit the way it was. its very annoying, how can i make it back? </p>",desktop;beta;tabs;windows-10;firefox-1030;,firefox,tabs,en-US,1515683;1515686;1515694;,moderndefender
