id,created,updated,title,content,tags,product,topic,locale,answers,creator
1379553,2022-06-10 10:48:23 -0700,2022-06-10 10:48:23 -0700,firefox devs: handlers.json corrupt almost every time there's an update. please fix,"<p>just about everytime there's and update it corrupt my handler.json &gt; handlers.json.corrupt. It's getting real annoying. I don't know why the whole mailto broke around version 99, but it did and I keep having to copy over an old handlers file each time this happens. </p>",desktop;beta;tips;windows-10;firefox-1020;,firefox,tips,en-US,"",hulapluto
1379552,2022-06-10 10:28:25 -0700,2022-06-10 10:28:25 -0700,locking up on ebay,<p>‘When i am on ebay after 4 or 5 selections everything locks up only way to free it is up is close Firefox browser then I'm unable to launch fire fox  for several minutes sometimes have to do restart of pc!. Only site happens on. I asked ebay they didn't help completely unable to shop. Please help! I'm retired rocket Scientist go figure! Bruce Allen </p>,desktop;windows-10;firefox-1010;website-breakages;firefox-10101;,firefox,website-breakages,en-US,"",cromarble
1379551,2022-06-10 10:09:00 -0700,2022-06-10 11:42:43 -0700,Online banking - Fifth Third Bank,"<p>This questions has been around awhile and answered a couple of times but I still have the problem even after using all correction methods previously submitted to this question.  I can load the Fifth Third Bank site (<a href=""http://53.com"" rel=""nofollow"">53.com</a>) but cannot sign on; I get the usual ""OOPS"" message with the number to call Fifth Third Technical Support.  I called their support and the first question they asked is what browser I'm using.  After responding that Firefox was my browser, they told me that everyone who uses Firefox is having problems.   They contend there is nothing on their end causing the problem and that since users of other browsers were not having problems that the only solution they could offer was to switch to Edge or Chrome.  That's ridiculous!  What is causing this problem?  I do not want to move to either Chrome or Edge! </p>",desktop;fix-problems;windows-10;firefox-1010;firefox-10101;,firefox,fix-problems,en-US,1511336;,wwwestphal
1379550,2022-06-10 10:00:58 -0700,2022-06-10 11:40:54 -0700,"I have already answered this several times, But my master password, the exact same one tht I had been using stopped working!",<p>Emergency - the stock market is going crazy &amp; I cannot get to my passwords!  Help ASAP!!! </p>,desktop;other;windows-10;firefox-1010;firefox-10101;,firefox,other,en-US,1511334;,rew-q
1379549,2022-06-10 09:58:37 -0700,2022-06-10 09:58:37 -0700,Bookmarks Toolbar vanished,"<p>Suddenly my Bookmarks Toolbar vanished from my browser screen.  If I click on the Bookmarks Tab I can get the list of the Toolbar as a side bar, but I prefer it to be a horizontal bar always visible.  Please tell me how to restore it to its previous state.  Thanks! </p>",desktop;bookmarks;mac-os-x-1012;firefox-91100;firefox-9110;,firefox,bookmarks,en-US,"",aimeetsao
1379548,2022-06-10 09:56:28 -0700,2022-06-10 09:56:28 -0700,My master password that was good just an hour earlier would not open my vault which I have to get into ASAP.,"<p>Desktop, Win 10:  While using computer, my master password would not work.  It was the same password that I had used an hour earlier.  No mistake the exact same password will no longer let me into my vault.  With the stock market going crazy this morning I need to get to my passwords ASAP! Carlyle (C.A.) Rogillio, 225/721-7167, nwr-raw@att.net </p>",desktop;other;windows-10;firefox-1010;firefox-10101;,firefox,other,en-US,"",rew-q
1379547,2022-06-10 09:47:52 -0700,2022-06-10 11:48:09 -0700,IS FIrefox down?,<p>cannot download email suddenly - is firefox down or downing maintenance </p>,desktop;other;mac-os-x-1012;firefox-1010;,firefox,other,en-US,1511338;,entrekin
1379544,2022-06-10 09:35:54 -0700,2022-06-10 11:53:12 -0700,How to stop Firefox from using system sounds for UI?,"<p>Hello. As the title says, Firefox fetches my Windows sounds for its UI. I want to know if there's a way I can disable them for Firefox because they are really loud here and, even if they weren't, I wouldn't want them in the browser. </p>",desktop;customize;windows-10;firefox-1010;firefox-10101;,firefox,customize,en-US,1511340;,SoundBlaster21
1379543,2022-06-10 09:18:13 -0700,2022-06-10 09:18:13 -0700,Create url exception for dom.event.clipboardevents.enabled = false,"<p>I was wondering if there was a way to have dom.event.clipboardevents.enabled = true for <a href=""http://docs.google.com"" rel=""nofollow"">docs.google.com</a> because setting it to false breaks copy/pasting. I don't want to leave it true for all sites for my privacy of course. If this isn't possible to do in the config alone, is there an addon which can toggle firefox config settings when visiting a specific url? </p><p>I saw that this question was asked before, but it was never answered: <a href=""https://support.mozilla.org/en-US/questions/1346189"" rel=""nofollow"">https://support.mozilla.org/en-US/questions/1346189</a> </p>",desktop;windows-10;firefox-1010;website-breakages;,firefox,website-breakages,en-US,"",lcmbogart
1379542,2022-06-10 09:11:00 -0700,2022-06-10 09:37:07 -0700,crash,"<p>Scusate ma sono stanco , dopo aver provato di tutto il sistema crasha continuamente. Non vorrei migrare al altro browser ma....... </p>",desktop;fix-problems;windows-10;firefox-1010;firefox-10101;,firefox,fix-problems,it,1511309;1511313;,elioroma
1379539,2022-06-10 08:30:02 -0700,2022-06-10 08:30:02 -0700,Fixar o Firefox no menu de acesso rápido,"<p>Instalei o Firefox no Debian 10 Buster, mas não consigo colocá-lo no menu de acesso rápido para abri-lo.  </p><p>Para que eu consiga abrir o Firefox, é preciso que eu vá nos Arquivos e entre manualmente pela pasta do Firefox. Por favor, alguém me ajude a resolver este problema pois está atrapalhando muito o meu uso com o navegador. </p>",linux;desktop;download-and-install_1;firefox-1010;firefox-10101;,firefox,download-and-install,pt-BR,"",kelvincarvaofc
1379537,2022-06-10 08:22:04 -0700,2022-06-10 08:22:04 -0700,Restoring windows to workspaces does not work,"<p>Hello everyone, </p><p>I am a long time Firefox user and absolutely love it. First of all thank you for this amazing product. </p><p>I run Firefox with ""Open previous windows and tabs"" selected in my General settings. When I exit/restart Firefox, it reopens all my windows and their tabs. More importantly, it places them in their original desktop workspaces, BUT this only works reliably in Windows. </p><p>In Linux I have a problem in that some windows ""remember"" the workspace they were in, some however insist on reappearing on the ""first"" workspace. </p><p><strong>I use Firefox with GNOME 42 and a fixed number of workspaces</strong>. (Gnome now has dynamic workspaces which are a bit similar to Mac OS, but I have turned that off. </p><p>Right now I have 6 windows open: </p> <ul><li> two of them (L1/L2) are Linux-related and are in workspace 1 </li><li> two of them (D1/D2/D3) are Development-related and are in workspace 2 </li><li> one of them (S1) is science-related and is in workspace 3 </li></ul> <p>When I exit Firefox and restart it, all windows go back to their respective workspace except for D3 which appears in workspace 1 instead of 2. </p><p>Furthermore, if I open a new window (N1) and visit any site, then it exit/restart always makes it reappear in workspace 1. </p><p>This is very annoying. I have no idea how L1/L2/D1/D2/S1 have “stuck” to their original workspaces, but anything new I open seems to ignore the workspace it was placed in and insists on reappearing in workspace 1. </p><p>Is this something Firefox controls, or is it the role of the desktop (in this case GNOME) to do this? </p>",linux;desktop;other;firefox-1010;,firefox,other,en-US,"",karypid
1379534,2022-06-10 07:45:14 -0700,2022-06-10 07:45:14 -0700,Firefix stops loading pages,"<p>Multiple times per week I've been experiencing an issue where firefox just stops loading pages any longer.  Looking at the network debugger, all I get for a status is a Get method and nothing happens...but in the tab It looks like its loading. Sometimes existing tabs will work, sometimes not and sometimes its not always every tab that will or will not work... </p><p>The only fix is to close firefox then kill every firefox process and then things are fine again. Other browsers work, and other systems I remote onto work, therefore its not an an internet or system connectivity issue...its very specific to firefox only. </p><p>Not sure how to troubleshoot this further.  I could wireshark but since the browser doesn't appear to be actually making a call to the network based on the network inspector in the browser, I'm not sure thats going to show much. </p><p>Anyone else have any idea's?  This has been occurring through at least 2 firefox updates and I am pretty sure I saw it happen on my laptop before as well, but I don't use my laptop as much as my desktop... </p>",desktop;fix-problems;windows-10;firefox-1010;firefox-10101;,firefox,fix-problems,en-US,"",mark.hodges
1379532,2022-06-10 06:04:53 -0700,2022-06-10 11:49:58 -0700,"Missing Compose Message blue button in Outlook, Win 11, Firefox.  How to restore.",<p>See above. </p>,desktop;tabs;windows-11;firefox-1010;,firefox,tabs,en-US,1511339;,Catman1937
1379531,2022-06-10 05:43:45 -0700,2022-06-10 05:43:45 -0700,Can I use a recovery key after had reset my password without it ?,"<p>Hello, I had to reset my password, but couldn't find my recovery key at the moment. I thought I would keep at least some of my informations, but I lost everything, from bookmarks to passwords.  </p><p>Of course, afterward, I did stumble upon the said memory key. I didn't create a new one, how could I reuse my recovery key ? When I try to reset my password again, the option is no more there. </p>",desktop;privacy-and-security_1;windows-11;firefox-1010;firefox-10101;,firefox,privacy-and-security,en-US,"",marylinemarlier
1379530,2022-06-10 05:20:38 -0700,2022-06-10 11:54:21 -0700,import passwords from CSV file using Firefox Version 101.0 (64 bit),"<p>How to import passwords from a CVS file (such as create by Keeper password manager)  into Firefox Version 101?  </p><p>I looked at older questions (example:  &lt;&lt;<a href=""https://support.mozilla.org/en-US/questions/1329981"" rel=""nofollow"">https://support.mozilla.org/en-US/questions/1329981</a> &gt;&gt;)  but the solutions do not apply to the latest Firefox version. </p><p>Thank you in advance for your help </p>",desktop;other;windows-10;firefox-1010;,firefox,other,en-US,1511341;,david.lindat
1379529,2022-06-10 05:18:28 -0700,2022-06-10 07:28:24 -0700,Uncaught Sys.403 error,"<p>Dear Colleagues, </p><p>I hope this message finds you well. We are facing an issue with one of our public site. This site working perfectly fine on all other browsers except firefox. The website loads perfectly but when we click on login or signup Following error we are getting when we try to login .<em>Uncaught Sys.WebForms.PageRequestManagerServerErrorException: Sys.WebForms.PageRequestManagerServerErrorException: An unknown error occurred while processing the request on the server. The status code returned from the server was: 403</em> We have checked all the code and settings from our side but found nothing . '<em><strong>FYI this site was perfectly fine before version 85 but now we are facing issues with later versions'</strong></em> </p><p>Here is the link to our site  <a href=""https://online-antragsmodul.de/OAM/Login.aspx?RetURL=/OAM/default.aspx"" rel=""nofollow"">https://online-antragsmodul.de/OAM/Login.aspx?RetURL=/OAM/default.aspx</a> Your kind support will highly appreciated. </p><p>Best Regards, IOM Germany </p>",desktop;windows-10;firefox-1010;website-breakages;firefox-10101;,firefox,website-breakages,en-US,1511289;1511291;1511292;,ictgermany
1379527,2022-06-10 04:48:34 -0700,2022-06-10 05:08:55 -0700,"icone plugin-estensioni installati non si vedono!!!! Barra ""cerca"" in alto non può essere ridotta!!! Concedere maggior spazio per icone estensioni-plugin!!!","<p>Per quale motivo non si vedono in alto nel browser tutti i plugin-estensioni installati??? Perchè la barra ""cerca"" in alto non può essere ridotta, come invece si può fare con la barra dell'url???? Moltissimi utenti si lamentono di queste 2 cose... Moltissimi utenti vorrebbero avere maggior spazio da lasciare per le icone delle estensioni-plugin, in alto in corrispondenza della barra Url e cerca. </p>",desktop;other;windows-10;firefox-1000;firefox-10002;,firefox,other,it,1511272;,stopallacensura
1379525,2022-06-10 04:18:48 -0700,2022-06-10 04:22:59 -0700,Site slow speed and crashing on Mozilla,"<p>I am facing an issue in one website, on mozilla firefox. whenever I access the site on other browsers it is working fine but when I access that site on firefox it's speed becomes very slow and sometimes breaks the site. Is this because of some cookies or that site have issue? </p>",desktop;windows-10;website-breakages;,firefox,website-breakages,en-US,1511261;,afaqmuhammad474
1379522,2022-06-10 03:58:23 -0700,2022-06-10 03:58:23 -0700,El navegador se cuelga al intentar adjuntar un archivo,"<p>Buenas, cuando intento adjuntar un archivo en cualquier página web, mi navegador se queda pensando y no llega a abrir el explorador de archivos para poder adjuntar. he probado en diferentes páginas y todas hacen lo mismo. Sin embargo, he probado con otro usuario y sí que funciona con otro usuario. Gracias de antemano. Saludos. </p>",desktop;fix-problems;windows-10;firefox-1010;,firefox,fix-problems,es,"",roberto.romero
1379520,2022-06-10 03:35:28 -0700,2022-06-10 04:19:59 -0700,Cannot display WebGL geometry via Three.js,"<p>Hello, </p><p>I have developed a three.js component that works without issue on chromium.  On Firefox, part of it does not display. </p><p>&lt;unable to upload images, the upload hangs &lt;- happy to send via email&gt; </p><p>See chromium.png for how it should look.  In firefox.png you can see that it is missing the surface area.  For reference, the 3d axes shown are three.js components also. </p><p>firefox_console.png shows issue loading webgl </p><p>firefox_console_after_force_enable.png shows the same after webgl.force_enable was set to True in the config. </p><p>Can you offer any advice here?  Our customer is keen to continue using FF. </p><p>Thanks in advance. Scott </p>",desktop;other;windows-10;,firefox,other,en-US,1511260;,scott.cunliffe
1379518,2022-06-10 03:11:31 -0700,2022-06-10 03:11:31 -0700,PR_CONNECT_RESET_ERROR,"<p>Firefox has been displaying the error PR_CONNECT_RESET_ERROR since this morning. No changes have been done from my end in any way, it worked fine last night. I can't load any page at all. </p><p>I went through at least a dozen possible solutions and it only made it worse. Deleting cache made it so the handful of pages I could load before (such as Youtube) don't load anymore. </p><p>I've cleared data cache and cookies, reinstalled, fiddled with about:config, disabled proxy, checked my firewall, imported data from another browser, restarted my computer, restarted my router, everything. Google Chrome works perfectly fine, it's exclusively firefox that doesn't work. </p>",desktop;fix-problems;windows-10;,firefox,fix-problems,es,"",domezain.pagazaurtundua.l
1379516,2022-06-10 02:19:49 -0700,2022-06-10 02:19:49 -0700,restore backups,"<p>restoring backup does not work after pressing ok.Czy mogę znalezc gdzieś plik z kopią zapasową?I care, I had a lot of data. </p>",desktop;tabs;windows-11;firefox-1010;,firefox,tabs,en-US,"",d.pasadyn
1379511,2022-06-10 00:34:38 -0700,2022-06-10 00:34:38 -0700,"Websites don't display their contents properly, they work fine in Private Mode","<p>Firefox was working properly then suddenly this started happening. Certain sites refuse to display properly, and sites like youtube don't even let me log in because when I click certain things they don't do anything. I looked up numerous fixes and they did nothing. </p><p>Tried Troubleshoot mode and the issue persisted. </p><p>Deleted cookies and cache, allowed them for all sites and disabled Enhanced Tracking Protection and it didn't solve the issue. </p><p>I couldn't even log in to this site because it kept saying ""Cookies and local storage are required"" even though I'm pretty sure they are enabled, I had to log in in Private Mode just to get the site working. Private mode for some reason has no issues and all the sites that don't work appear fine when I use it. </p>",desktop;other;windows-10;firefox-1010;firefox-10101;,firefox,other,en-US,"",gilbert777
1379510,2022-06-10 00:32:41 -0700,2022-06-10 00:59:27 -0700,Nem jeleníti meg a levelező rendszert.,<p>Üdv!  Van egy nagy gondom remélem tudnak segíteni?! A Mozilla Firefox nem jeleníti meg az inda-mail fiókot belépve föl villannak a levelek egy pillanatra  majd eltűnik az egész és csak tölt és tölt és más nem történik mi lehet a gond?  Az Edge-n nem tapasztalok ilyen jellegű problémát. Segítségeteket előre is köszönöm! Tisztelettel; Mátyás Zsolt. </p>,desktop;other;windows-10;firefox-1010;,firefox,other,hu,1511240;,m.zsolt75
1379508,2022-06-10 00:12:47 -0700,2022-06-10 04:47:22 -0700,I have Firefox 101 set to open previous session tabs but it does not.,<p>I have Firefox 101. It is set to open previous session tabs but it does not. Further I am not able to retrieve the ones I used to have available when I open Firefox. I have not cleared the history. </p>,desktop;customize;windows-10;firefox-1010;,firefox,customize,en-US,1511239;1511248;1511249;1511268;,david.dala
1379506,2022-06-09 23:53:24 -0700,2022-06-09 23:53:24 -0700,I would like to keep the language in US English,<p>I am happy to keep the language in US English. It makes it easier for me to read and understand. </p>,desktop;other;mac-os-x-1012;firefox-1000;,firefox,other,en-US,"",cei2
1379502,2022-06-09 22:49:21 -0700,2022-06-10 07:56:46 -0700,Fix slowness,<p>please fix the slowness of browsing </p>,desktop;fix-problems;windows-10;firefox-1010;,firefox,fix-problems,en-US,1511298;,anandakumarsivan
1379501,2022-06-09 22:39:36 -0700,2022-06-10 01:05:36 -0700,My broswer is not saving passwords,<p>I have set my browser to save paswords but it is not working </p>,desktop;other;windows-10;firefox-1010;firefox-10101;,firefox,other,en-US,1511228;1511241;,bx.crom
1379500,2022-06-09 22:36:18 -0700,2022-06-09 22:36:18 -0700,"I am unable to post comments on a particular blog.  It just says ""sign in with google"" but firefox will not allow me or show me how to do that.  Help.","<p>I have posted comments on <a href=""https://puzzles.blainesville.com/2022/06/npr-sunday-puzzle-jun-5-2022-do-you.html?lr=1"" rel=""nofollow"">https://puzzles.blainesville.com/2022/06/npr-sunday-puzzle-jun-5-2022-do-you.html?lr=1</a> for many years but now I just receive SIGN IN WITH GOOGLE, but when I click on it nothing happens.  HELP. </p>",windows-7;desktop;other;firefox-1010;firefox-10101;,firefox,other,en-US,"",ronfraz
1379499,2022-06-09 22:10:26 -0700,2022-06-10 11:42:13 -0700,Control + Shift + P doesn't work,"<p>This command doesn't work, and I've seen others with the same issue and no one ever gave a response on how to fix it. </p><p>I'm assuming the same thing will happen here, but I just started using Fire Fox and really hope someone can give some resolve. </p><p>I tried running with no extensions too, it still didn't work. </p><p>Microsoft Edge Control + Shift + N works </p><p>Chrome Shift + N works </p><p>I tried this solution ""Start Firefox in Safe Mode to check if one of the extensions (""3-bar"" menu button or Tools -&gt; Add-ons -&gt; Extensions) or if hardware acceleration is is causing the problem. "" It didn't work. </p><p>Please could someone help me. Firefox has been my favorite go to browser, but now I am forced to look for alternatives. </p>",desktop;other;windows-10;firefox-1010;firefox-10101;,firefox,other,en-US,1511226;1511229;1511232;1511234;1511318;1511319;1511321;1511322;1511327;1511331;1511332;1511333;1511335;,rlpzboss02
1379498,2022-06-09 22:03:06 -0700,2022-06-09 22:03:06 -0700,the fan is running continually,"<p>Hello, google chrome and MS edge work perfectly. Firefox did so too. But now, as soon as I start firefox my computer's fan is running continually. I have tried all your suggestions, I have deleted and cleared anything from firefox. I ran all your help tools. I have deleted/reinstalled firefox many times. I have spent hours and I cannot repair the fault. </p>",desktop;fix-problems;windows-11;,firefox,fix-problems,en-US,"",karl.hoppel
1379497,2022-06-09 21:14:13 -0700,2022-06-09 23:51:33 -0700,Internet Browser,<p>Your browser used to be the best and now it's pathetic. </p>,desktop;fix-problems;windows-10;firefox-1010;,firefox,fix-problems,en-US,1511233;,vagabond_karma
1379496,2022-06-09 20:30:26 -0700,2022-06-10 00:14:29 -0700,CRASHES,"<p>I tried the crash report, you are not up to date.  This was useless. </p><p>I am very mad because I have seen a continuing occurrence.  Firefox crashes when I am on an alternative website not mainstream media sites.  This looks like censorship!@!!!  </p><p>I don't like it one bit.   It has occurred while on Brighteon, Natural News and Locals. At least 6 times and never on other stuff. </p><p>Darlene Massey </p>",desktop;other;windows-10;firefox-1010;firefox-10101;,firefox,other,en-US,1511238;,sanctuaryartworks
1379491,2022-06-09 19:15:41 -0700,2022-06-09 19:17:47 -0700,YouTube,"<p><a href=""https://absgomz.com.net.org.dot.mx.ph"" rel=""nofollow"">link text</a>. The common problems on you tube is the users, they want to expand their programs. That's why we have already a design designated as information processing and applications development of my company NICOLAI/Google Philippines, Microsoft Philippines. If you like my product in you tube, you can get and used it for combining companies that are not yet joint the world wide web development process of subcontracting network operations manager system. </p>",desktop;needsinfo;website-breakages;,firefox,website-breakages,en-US,1511210;,absgomz86
1379490,2022-06-09 19:15:26 -0700,2022-06-09 19:15:26 -0700,idmdownlod maneger,<p>idm add </p>,windows-7;desktop;download-and-install_1;firefox-1010;firefox-10101;,firefox,download-and-install,en-US,"",rajibmondal171
1379489,2022-06-09 19:08:27 -0700,2022-06-10 10:47:09 -0700,PASSWORD AUTO-FILL,"<p>When I login to one site (YAHOO), the correct ID/password are inserted and the login is successful. When I go to the menu panel/passwords, the password for the site is different. It is only one character different, but it would not allow for a login. The menu panel password is probably older and perhaps the Lockwise discontinuation is an issue, but there seems to be no relation between the passwords in the login procedure and the menu panel. I cannot find where the login procedure password is stored, but it works. This is confusing, but I cannot find an answer in any of the Firefox password manager papers. I am up to date with Firefox 101.0 (64 bit) for Windows 10. </p>",desktop;other;windows-10;firefox-1010;,firefox,other,en-US,1511230;1511316;1511317;1511324;,HGCLAUDIUS
1379488,2022-06-09 18:57:40 -0700,2022-06-09 18:57:40 -0700,Session restore option does not appear and can't restore from backup,"<p>This has happened twice now - I've had a main window open with 100+ tabs and a second window open with only one tab.    All settings are as described to save history, etc.    After closing Firefox and later restarting, only the window with a single tab is restored.    I've saved the session backup files in another location and manual copied and renamed them into the main profile folder but in each attempt, only the single tab window was restored, which is obviously not what I want.   I know the 100+ tabs are in the file because of the filesize and because I've used <a href=""https://www.jeffersonscher.com/ffu/scrounger.html"" rel=""nofollow"">https://www.jeffersonscher.com/ffu/scrounger.html</a> to scrounge the URLs from the backup file. But the point is that Firefox is NOT extracting the data from this file and restoring the other window, which makes me suspect there is a bug or problem with session restore when more than one window is open at the time of shutdown. </p><p>Thanks for any suggestions. Bob </p>",desktop;tabs;windows-10;firefox-1010;,firefox,tabs,en-US,"",ranickels
1379487,2022-06-09 18:51:27 -0700,2022-06-09 18:51:27 -0700,My account was compromised and now I receive email notifications in Japanese - How can I change these back to English?,"<p>My account was compromised and now I receive email notifications in Japanese - How can I change these back to English?  (and yes, I've changed my Firefox password) </p><p>My Manage Account screen on Firefox Mobile is also in Japanese. </p><p><a href=""https://imgur.com/vcmYpOR"" rel=""nofollow"">Email Notification in Japanese</a>  </p><p><a href=""https://imgur.com/nFCmPhK"" rel=""nofollow"">Manage Account screen in Japanese</a>  </p><p>Can anyone please help? </p>",windows-7;desktop;other;firefox-1010;,firefox,other,en-US,"",aj.cabigao
1379486,2022-06-09 18:17:46 -0700,2022-06-09 18:51:03 -0700,java script in Firefox 101.0?,<p>how do I enable java script in firefox 101.0 ? </p>,desktop;customize;mac-os-x-1015;firefox-1010;,firefox,customize,en-US,1511202;1511205;,jsolarz
