id,created,updated,title,content,tags,product,topic,locale,answers,creator
1364288,2022-01-13 13:40:40 -0800,2022-01-13 13:40:40 -0800,how to upload documents on Firefox,<p>Where can I upload my documents on Firefox </p>,desktop;bookmarks;,firefox,bookmarks,en-US,"",somelezelisina
1364287,2022-01-13 13:26:53 -0800,2022-01-13 13:26:53 -0800,How to turn off dark mode in theme?,"<p>Hello! After updating FF to newest version I noticed that every site use a dark mode by default. I am using Stylus Blue by Thamyris, so far I had no problems with it. </p><p>Now sites like twitter or google shows in dark mode when I am entering the page. I can change it by changing motive to something light in FF, but I want to use my theme AND have white colours by default. </p><p>I cannot change twitter colours in the menu because I do not have account there and I do not want one. I think I could change something in the about:config but have no idea what. </p><p>Also reaching page to ask question is pain in the ***. </p><p>Kind regards </p>",desktop;websites;windows-10;firefox-960;,firefox,websites,en-US,"",wiktor.pacura
1364285,2022-01-13 13:16:32 -0800,2022-01-13 13:16:32 -0800,SSL errors,"<p>My iOS updated on my iPhone last night to 15.2.1. I now cannot access Amazon and other websites, but my apps have all been updated in the last week. How do I correct this? </p>",desktop;privacy-and-security_1;,firefox,privacy-and-security,en-US,"",gcoregistrar
1364283,2022-01-13 13:12:56 -0800,2022-01-13 13:12:56 -0800,Firefox with Virtual Desktops on Windows 11 - restoring tabs per desktop,"<p>I am using Windows 11 and I have 3 virtual desktops.  In my Firefox settings ""Open previous windows and tabs"" is checked.  One time I'll close Firefox and reopen it later and it opens up in all 3 virtual desktops and restores the tabs for each.  Great!  The next time I reopen it, it loses all the tabs and opens up in the current virtual desktop to the web page I have set as home.  Not so great.  The behavior seems kind of random.  How do I get it to work the way I want all the time?  Is there some additional setting or plugin that would do it?  Or do I have to close Firefox in a certain way to get it to reopen the way I want?  Is it affected by my use of Firefox on other devices with synced Firefox settings? </p>",desktop;tips;windows-11;firefox-960;,firefox,tips,en-US,"",geomouchet
1364280,2022-01-13 13:11:46 -0800,2022-01-13 13:13:04 -0800,ANGEL GOMEZ PUERTOLAS,<p>NO PUEDO CONVERTIR MOZILLA FIREFOX A LA APARIENCIA DE GOOGLECHROME EN ENU NO SALE AUYDA NI HELP ¿COMO LO CONVIERTO? </p>,windows-vista;desktop;download-and-install_1;needsinfo;firefox-520;,firefox,download-and-install,es,1473879;,ANGELGOMEZPUERTOLAS
1364278,2022-01-13 13:08:52 -0800,2022-01-13 13:08:52 -0800,Come aprire un bug per Firefox developer 97.0b2?,"<p>Ciao, da diverso tempo riscontro un problema sia su Windows 10 che sul nuovo Windows 11 e su diverse versioni di Firefox Developer. </p><p>Non ho mai avuto voglia di aprire una segnalazione ma mi sono stufato del problema e vorrei ora condividerlo per sperare in una futura risoluzione. </p><p>Utilizzo Firefox Developer che ha un collegamento nella cartella ""esecuzione autmatica"" di Windows per partire con Windows. Firefox Dev si apre non a tutto schermo ma a finestra ridotta e, nel mio caso, lo uso per gestire le richieste da una live chat. </p><p>Per avviare Firefox ridotto ad icona utilizzo il programma Min2Tray scaricato da Internet. </p><p>Il problema è che spesso Firefox Dev sia quando si accende in automatico richiamato dall'esecuzione automatica che quando lo ripristino da icona vicino all'ora di Windows a finestra intera non visualizza correttamente la pagina e mostra un rettangolo nero che scompare solo se muovo il mouse sulla barra della finestra. </p><p>È un problema fastidioso e mi piacerebbe risolverlo. Al posto di visualizzare la pagina visualizzo una finestra bianca con rettangolo nero, se poi muovo il mouse sulla barra della finestra allora compare il contenuto dentro Firefox. </p><p>Come posso far riprodurre questo problema e capire se può essere risolto? I bug per Windows Firefox vanno sempre aperti qui: <a href=""https://bugzilla.mozilla.org/enter_bug.cgi?product=Firefox"" rel=""nofollow"">https://bugzilla.mozilla.org/enter_bug.cgi?product=Firefox</a> ? </p><p>Grazie. </p>",desktop;beta;fix-problems;windows-10;firefox-970;,firefox,fix-problems,it,"",peopleinside
1364276,2022-01-13 13:07:22 -0800,2022-01-13 13:07:22 -0800,My Firefox just updated from 95 to 96.0 and all my of my bookmarks have disappeared.,<p>My Firefox just updated from 95 to 96.0 and all of my bookmarks have disappeared.  I have the bookmarks toolbar but everything in the Bookmarks menu is gone.  If I open Firefox on my alternate PC everything is still there but that Firefox shows it is still in 95.2 but I have not restarted it to make it 96.0  I have not experienced this problem before. </p><p>I have exported the bookmarks from the alternate PC to its desktop as an HTML and as a JSON file. </p><p>Suggestions? </p>,desktop;bookmarks;windows-10;firefox-960;,firefox,bookmarks,en-US,"",eberger5
1364275,2022-01-13 13:03:04 -0800,2022-01-13 13:03:04 -0800,Websites requesting cookie privileges,"<p>Websites frequently pop up a message telling me to approve their use of cookies.  If I decline, many times the web page becomes inaccessible. </p><p>If I ‘Accept’, does that circumvent my Firefox settings for cookies, either by changing the settings or by putting the website on an ‘Exceptions’ list?  Or can I rely on my Firefox settings being unchanged and enforced even if I click ‘Accept’? </p><p>Sample popup:  “We use cookies to improve user experience, personalize advertisements, and analyze website traffic.  For these reasons, we may share your site usage data with our social media, advertising, and analytics partners.  By clicking ‘Accept’, you agree to our website’s cookie use as described in our Cookie Policy.  You can change your cookie settings at any time by clicking ‘Preferences’.” </p><p>The buttons are ‘Preferences’, ‘Decline’, and ‘Accept’. </p><p>Thanks. </p>",desktop;cookies;windows-10;firefox-960;,firefox,cookies,en-US,"",jmc7
1364274,2022-01-13 12:57:21 -0800,2022-01-13 13:15:44 -0800,Ebay item descriptions compressed display,<p>I am currently running Firefox 96 on windows and for the past many builds of firefox over the past 8 months ebay listings in the item description are compressed. I am attaching an example image of the compressed description. It does this on both just plain text or formated descriptions.  If I reload the listing it will correct it to full width.  I have tested this on another machine that is also using firefox and same issue.   </p><p>I have also disabled all extentions and cleared cache and uninstalled and reinstalled firefox with not luck. </p><p>Any suggestions as this is a pain. </p><p>Thanks! </p>,desktop;websites;windows-10;firefox-960;,firefox,websites,en-US,1473880;,shane23
1364272,2022-01-13 12:50:30 -0800,2022-01-13 12:57:03 -0800,Lost session - sessionstore.jsonlz4 backup refuses to load,"<p>I was shocked to find that my session was deleted when firefox updated to 96.0. (All previous tabs were gone). it seems the firefox updater created a backup when upgrading - however, trying to load the backup by placing it in my profile root and renaming it ""sessionstore.jsonlz4"" does not restore my old session - instead, it simply opens one window with one new tab. </p><p>Also, it seems my old tabs still exist in the current session - ""recovery.lsonlz4"" has a size of 25311kb - very similar to my backup. for some reason, firefox does not show them. </p>",desktop;other;windows-10;firefox-960;,firefox,other,en-US,1473867;,gflyncow
1364271,2022-01-13 12:29:51 -0800,2022-01-13 12:49:02 -0800,Allowing a govevernment sight on FOX?,"<p>Hello, </p><p>A NYC gov sights does Not allow me to use my FOX acct to access the information I need.   </p><p>FOX Help does Not clearly show How to over-ride the block for this sight!!!  </p><p>What are the steps to achieve their accessibility on my FOX acct!?!?!  I do Not want to use another browser! </p><p>Thnx! B. Carranza </p>",desktop;other;windows-10;firefox-950;,firefox,other,en-US,1473853;,Blanca2350
1364270,2022-01-13 12:29:45 -0800,2022-01-13 12:45:54 -0800,I have 3 computers with windows 7 and have no intention of getting rid of them as do other people in this town,<p>I have started donating to keep firefox in windows 7 but was wondering if there was a way to have a set price to use the browser yearly price that was reasonable 20 dollars or so. thanks </p>,windows-7;desktop;other;firefox-960;,firefox,other,en-US,1473851;,ttwrz
1364269,2022-01-13 12:24:08 -0800,2022-01-13 12:50:19 -0800,Latest Firefox 01/12/22,"<p>Screen colors (black/white)on Firefox menu, tools, all Firefox pages are reversed color and very hard on my old eyes. People with seeing problems will more than likely have problems with the reversed images. This was a really bad idea. Please correct or I will have to find a new browser, and I don't want to. I have been with Firefox for 20 years. I don't need all the high tech stuff. I like it simple and easy to use for home use. </p>",desktop;other;windows-10;firefox-960;,firefox,other,en-US,1473855;,conolor003
1364268,2022-01-13 12:16:10 -0800,2022-01-13 12:59:14 -0800,Firefox update to V 96.0 (64-bit),"<p>My banking site, <a href=""http://leominstercu.com"" rel=""nofollow"">leominstercu.com</a>, allows on-line transfers to and from other banks. This function broke when you pushed down the v96.0 update. The site throws the following error: </p><p>""External Transfer </p><p>We're sorry for this error. In order to use this service, your internet browser must accept third-party cookies. Please refer to your browser's online help for enabling cookies in your system. Please try again after you enable the cookies."" </p><p>Screen JPG attached. After wasting 20 minutes fiddling with cookie settings, I still can't get things to work. </p><p>Prior to the update, it worked fine. </p><p>I'll be using Chrome until this gets fixed. </p>",desktop;cookies;windows-10;firefox-960;,firefox,cookies,en-US,1473869;,t_gleason
1364267,2022-01-13 12:10:11 -0800,2022-01-13 13:00:52 -0800,google sign in every time although firefox is default browser. why is this happening,<p>firefox is my default browser but every time i want to open a website or my gmail i have to sign in to google first . always get a message from google stating that cookies are disabled on firefox browser and i must reverse this and make google my default browser . what then is the point of firefox if i have to do this every time i may as well stay with google chrome . how do i solve this so that i can log on to gmail and autotrader with firefox . </p>,windows-7;desktop;websites;firefox-960;,firefox,websites,en-US,1473872;1473873;,julianmoore035
1364265,2022-01-13 11:39:44 -0800,2022-01-13 11:39:44 -0800,Firefox bookmarks disappeared,"<p>The Firefox crashed multiple times during the last days. However, by restarting it all the open pages were restored each and every time.  Now there is a new problem most likely related to the crashes:  all my bookmarks have dissappeared.  How do I get them back ? </p>",desktop;bookmarks;windows-10;firefox-960;,firefox,bookmarks,fi,"",pekka.pentinsaari
1364264,2022-01-13 11:37:46 -0800,2022-01-13 11:37:46 -0800,"Option to open new window not in fiefox 96 on macmini running OS 12.1, only new tab or new private window",<p>There is no option to open a new window under firefox File menu. </p>,desktop;other;firefox-960;,firefox,other,en-US,"",stevepaa
1364263,2022-01-13 11:24:51 -0800,2022-01-13 11:46:28 -0800,Dark Mode and a theme?,"<p>Before Firefox updated last night, I was able to use a dark mode and a theme on new tabs and the settings/addons page. Now I'm only able to use one or the other? Is this a glitch or just how it is now? </p>",desktop;customize;windows-10;firefox-960;,firefox,customize,en-US,1473811;1473815;,chenanigans
1364262,2022-01-13 11:23:43 -0800,2022-01-13 11:23:43 -0800,Проблемы с интерфейсом,"<p>Когда я навожу курсор на какой либо сайт в нижнем левом или правом углу появляется ссылка на этот сайт, как это убрать? </p>",desktop;tips;windows-10;firefox-960;,firefox,tips,en-US,"",gooseta
1364260,2022-01-13 11:18:24 -0800,2022-01-13 11:43:34 -0800,How Do I Disable All Shortcut Keys,"<p>I have read the same named question that has been archived and have not found a solution to my problem there.  I'm using Macro Express to define my own keystrokes which works fine outside of FF.  One of the keystrokes I have defined is Ctrl-Shift-k.  A suggestion was to disable Developer Tools via about:config -&gt; devtools.enable = false, but when I tried to use my definition of Ctrl-Shift-k, instead FF told me ""You activated a Developer Tools shortcut. If that was a mistake, you can close this Tab."" when in fact I wanted to have it invoke my own definition. </p><p>How can I override this (and other) keystrokes when using FF? </p>",desktop;customize;windows-10;firefox-950;,firefox,customize,en-US,1473813;,bsmith7
1364259,2022-01-13 11:12:32 -0800,2022-01-13 11:50:17 -0800,"Tabs ""Jump"" back and forth very quickly.","<p>Win 10. Using FF 96.0.  My entire tab row shifts back and forth very rapidly. This has been happening continuously for the past several versions of FF. Condition is also worsens somewhat when I move the mouse. Occasionally, closing a particular tab stops this action but I cannot determine which type of tab does this. This is driving me crazy. Please HELP!! (Is there some way I can send a video from my iphone?) </p>",desktop;tabs;windows-10;firefox-960;,firefox,tabs,en-US,1473817;,toopah99
1364258,2022-01-13 11:09:52 -0800,2022-01-13 13:25:50 -0800,FireFox v.96 won't save previous session,"<p>My current browser (version in header), has stopped saving previous session. I followed the advise from FredMcD on this page <a href=""https://support.mozilla.org/en-US/questions/1345654"" rel=""nofollow"">https://support.mozilla.org/en-US/questions/1345654</a>, and the browser is still not saving tabs. From Fred's post, I couldn't find any ""sessionstore.jsoniz4"" files in the browser folder. I did find the ""sessionstore-backup"" folder and deleted it. I restarted Firefox, opened a folder and then stopped Firefox and restarted it again, and I only went to the Firefox Home page. The ""restore session"" box is selected. </p><p>What else should I try?? </p>",desktop;tabs;windows-10;firefox-960;,firefox,tabs,en-US,1473806;1473816;1473825;1473837;1473845;1473849;1473877;1473882;,UncleAaron
1364257,2022-01-13 11:07:11 -0800,2022-01-13 12:51:11 -0800,FireFox started crashing at FireFox launch.,"<p>FireFox started crashing at FireFox launch.  Tried reboot, tried refresh, uninstalled and re-installed, tried Safe Mode.  Thought it was a new extension, but apparently not. </p><p>Windows 7 </p>",windows-7;desktop;fix-problems;firefox-950;,firefox,fix-problems,en-US,1473856;,rbryant67
1364256,2022-01-13 11:04:08 -0800,2022-01-13 11:52:22 -0800,"back ground color is black, how to get it back to normal?????","<p>back ground color is black, how to get it back to normal????? </p>",desktop;other;windows-81;firefox-960;,firefox,other,en-US,1473818;,mapa10
1364255,2022-01-13 10:58:31 -0800,2022-01-13 13:03:11 -0800,unable to google anything or access sites.,"<p>Secure Connection Failed </p><p>I get this message 99% of the time - this began two days ago. This morning everything was fine for ten minutes and the problem returned.  </p><p>An error occurred during a connection to <a href=""http://www.theguardian.com"" rel=""nofollow"">www.theguardian.com</a>. SSL received a record that exceeded the maximum permissible length. </p><p>Error code: SSL_ERROR_RX_RECORD_TOO_LONG </p><pre>   The page you are trying to view cannot be shown because the authenticity of the received data could not be verified.    Please contact the website owners to inform them of this problem. </pre> <p>Learn more… </p>",mac-os;desktop;websites;firefox-960;,firefox,websites,en-US,1473874;,d.mcwilliams
1364253,2022-01-13 10:51:03 -0800,2022-01-13 10:51:03 -0800,Upgrade 96 - Bank Login No Longer Works,"<p>Hello, </p><p>The latest upgrade from firefox this week (96) has prevented us from logging into our local credit union account. We had to downgrade to 95.0.2 to regain access. How can you fix this and will it be resolved in a following update. Is there a setting that can be changed that is preventing login?  </p><p>Sharron </p>",desktop;other;windows-10;firefox-950;,firefox,other,en-US,"",sharrona713
1364252,2022-01-13 10:44:08 -0800,2022-01-13 10:54:36 -0800,How to change sidebars and backgrounds  back to white with Black text. Too much Dark and gloomy.,<p>How to change sidebars and backgrounds back to White background (or at least a light gray) with Black text contrasting on top.  Too much Dark and gloomy now days.  Or allow a theme color schemes that fixed it back like it was before updates.  </p><p>Please don't force gloom on our browser. </p>,mac-os;desktop;customize;firefox-960;,firefox,customize,en-US,1473803;,Falgoust.Debbie
1364249,2022-01-13 10:37:30 -0800,2022-01-13 10:44:21 -0800,pages won't load,"<p>The Washington Post.  It will not load, whether I try from their support page, or from the Firefox search box.  What's up? </p>",mac-os;desktop;websites;,firefox,websites,en-US,1473791;,carlaj1
1364248,2022-01-13 10:36:41 -0800,2022-01-13 12:55:34 -0800,HELP PLEASE. I'm desperate.,"<p>Firefox glitched last night and I had to reinstall it. In the process, I've lost everything. I have an ""old data"" folder on my desktop, but no matter how many times I import it, none of my old stuff shows in Firefox. It also stalls on files and says the names are too long. This is all complicated by the fact that I am almost blind. I am desperate for help as most of my site passwords were generated by firefox so I don't have a single clue what they are. Bookmarks are all gone. I'm literally crying. Please help. </p><p>Things I've already tried: Import old data by copy/paste method. Repeatedly. Replace sqite files for passwords, sessions, etc. </p>",desktop;download-and-install_1;windows-10;firefox-960;,firefox,download-and-install,en-US,1473792;1473810;1473864;,TresAngelas
1364247,2022-01-13 10:30:01 -0800,2022-01-13 10:33:44 -0800,Cannot access my website on Firefox,<p>My website cannot be accessed from the Firefox Browser on my computer.  Can you please let me know what settings I need to change to allow my website to be accessed. </p>,desktop;privacy-and-security_1;windows-10;firefox-960;,firefox,privacy-and-security,en-US,1473779;,kdschiff
1364245,2022-01-13 10:25:11 -0800,2022-01-13 10:25:11 -0800,Firefox always connected to an amazonaws server,"<p>Firefox on ubuntu 20.04 </p><p>Whenever firefox is running it's <strong>always</strong> connected to some amazonaws server </p><p>lsof -i </p><p>GeckoMain 450324 shi  199u  IPv4 5430371      0t0  TCP 10.10.100.6:39824-&gt;<a href=""http://ec2-35-161-207-165.us-west-2.compute.amazonaws.com"" rel=""nofollow"">ec2-35-161-207-165.us-west-2.compute.amazonaws.com</a>:https (ESTABLISHED) </p><p>I created a new profile and it's still there. I have never used sync. </p>",linux;desktop;other;firefox-910;,firefox,other,en-US,"",extra692-red
1364244,2022-01-13 10:24:38 -0800,2022-01-13 10:46:54 -0800,Cannot access my website on Firefox,<p>Can you tell me why Firefox cannot access my website/domain </p>,desktop;privacy-and-security_1;windows-10;firefox-960;,firefox,privacy-and-security,en-US,1473780;1473793;,kdschiff
1364243,2022-01-13 10:21:19 -0800,2022-01-13 12:28:34 -0800,"As of update 96.0, now have a white text on black background.","<p>I didn't ask for this change, and I don't want it.   Black on white is hard on my eyes to read. </p><p>I've already checked around the forums and nothing that other posters have suggested works to change it back.  Yes, I use a custom theme and I'm not going to change it to ""white"".  I didn't make any changes , firefox did. </p>",desktop;customize;windows-81;needsinfo;firefox-960;,firefox,customize,en-US,1473788;1473790;1473835;1473840;,lightsenshi23
1364242,2022-01-13 10:20:35 -0800,2022-01-13 11:55:26 -0800,Firefox 96 broke iCloud 2FA 95.0.2 still works,"<p>I have two computers, a desktop and a laptop.  A few days ago FF auto updated to 96.0 on the desktop.  The laptop is still at 95.0.2  (thankfully I turned auto update off on that one.) </p><p>Now iCloud 2FA does not work on the desktop with FF 96.0.0.  The six digit code is correctly sent to my iPhone but on the website in the browser, the 6 character box for entry does not appear and the error message is ""Failed to verify your identity. Try again.""  See attached screen shot. </p><p>I disabled HTTP3 but this did nothing. </p><p>Version 95.0.2 works fine and I am able to logon to iCloud on.  </p><p>As you know, there is no way to rollback FF.  I do not want reinstall the old version and have to create  another profile and lose all my settings! </p><p>Please confirm.  Now I have to use Chrome on my desktop as the work around which I really don't want to do. </p><p>Thank you, Scott Keller </p>",desktop;websites;windows-10;firefox-960;,firefox,websites,en-US,1473800;1473812;1473819;,sfin2golf-mozilla
1364241,2022-01-13 10:20:10 -0800,2022-01-13 10:50:45 -0800,What's the point in having a homepage set if Firefox just ignores it?,"<p>This is more of rant, but you guys need to hear this/fix this. </p><p>What's the point of setting a homepage in Firefox if you just ignore it? Sure, it opens the tab, but it doesn't default to that tab when I open Firefox. Instead I get ""sponsored stories"" which is just annoying. Or I get ""what's new"". One of these I can (and have) disabled. But the ""what's new"" I can't see a setting for. The homepage should be the tab that's presented to me when opening Firefox, otherwise it defeats the purpose of having a homepage. </p>",desktop;customize;windows-10;firefox-960;,firefox,customize,en-US,1473799;,aupyogcgnhhhuqwkjf
1364240,2022-01-13 10:17:34 -0800,2022-01-13 10:20:02 -0800,How to change body background to white instead of black?,"<p>How to change body background to white instead of black?  I am not a programmer or a web developer, and the black is driving me crazy!!! </p>",desktop;other;windows-10;firefox-960;,firefox,other,en-US,1473775;,shirl.magana
1364238,2022-01-13 10:04:18 -0800,2022-01-13 12:55:01 -0800,Add Norton Safe Search to firefox browser,<p>HAving trouble adding Norton Safesearch to newly downloaded Firefox on Max CAtalina 10.15 </p>,ios;install-and-update-firefox-ios;,firefox,basic-browsing-firefox,en-US,1473771;1473862;,ktoc1971
1364237,2022-01-13 10:04:10 -0800,2022-01-13 10:04:34 -0800,Instagram photos sometimes cannot be loaded,"<p>Every few days images on <a href=""http://instagram.com"" rel=""nofollow"">instagram.com</a> stops loading all of sudden. This is generally resolved after 10 minutes, or after I restart the browser (not always a solution). No other sites are affected. Other browsers are working fine while Firefox cannot load Instagram images. </p><p>I tried disabling add-ons and then re-installing Firefox with a new profile to no avail. </p><p>I made an insvestigation with Developer Tool's Network monitor. Image requests to <a href=""http://instagram.fist4-1.fna.fbcdn.net"" rel=""nofollow"">instagram.fist4-1.fna.fbcdn.net</a> return a NS_BINDING_ABORTED error, thus those lines are in red. I searched the web about this error, no solution so far. I'm on Windows 10 x64, ipv4. I face this problem in the last few versions of Firefox. </p>",desktop;fix-problems;windows-10;firefox-960;,firefox,fix-problems,en-US,"",ertan11
1364236,2022-01-13 09:53:06 -0800,2022-01-13 12:11:30 -0800,Firefox magas processzor használat összeomlás után.,"<p>Számítógép használat-Firefox használat közben egyszer csak felpörögtek a ventilátorok és a gép lelassult. A Firefox összeomlott, de a feladatkezelőben láttam, hogy több firefox is megy. Egyik nagyon magas processzor használatot (100%) mutatott. Kilőttem mind, majd újraindítottam..ugyanaz.  Újraindítottam a gépet, ugyanaz. Letöröltem a firefoxot majd újra telepítettem-ugyanaz. Olyan mintha hibás lenne a program. Chrome megy rendesen. A számítógép új. Gigabyte 490-es alaplap és i9-108500K processzor. Videokártya nincs. </p>",desktop;fix-problems;,firefox,fix-problems,hu,1473821;,scansat
1364232,2022-01-13 09:06:33 -0800,2022-01-13 10:37:36 -0800,How to get rid of Bing and use Google as my default browser in firefox,<p>As per subject in header. Thanks Martin </p>,desktop;websites;windows-10;firefox-950;firefox-9502;,firefox,websites,en-US,1473740;1473742;1473743;1473765;1473784;,martin.sollars
1364230,2022-01-13 08:54:03 -0800,2022-01-13 10:12:13 -0800,Home page,"<p>When I started Firefox I used to get my home page, MSN. Now I have to click the home page icon to do so. While I do want to retain my home page button, I also want to have MSN load automatically when I load Firefox. How do I make MSN my home in that manner? Thank you. </p>",windows-7;desktop;websites;needsinfo;firefox-960;,firefox,websites,en-US,1473723;1473749;1473770;,sciencemagic
