id,created,updated,title,content,tags,product,topic,locale,answers,creator
1373579,2022-04-07 19:25:27 -0700,2022-04-07 19:25:27 -0700,Saving my preference for logins and passwords for websites.,"<p>I have Firefox installed on two computers, a HP Envy laptop with Windows 10 Home and a new workstation with Windows 10 Pro. I also have Trend Micro Internet Security on both. I have gone through the FF settings on both computers the make sure they are set the same. The problem is that on the laptop FF will ask for and save passwords then when I log in to a forum the password is automatically filled in for me. On the workstation that is not the case. I need to open FF Settings scroll to Privacy and security settings and reset the ""Ask to save logins and passwords for websites"" setting. Somehow on the workstation that setting gets deselected but the laptop is does not. </p><p>I found an article that instructs to remove the Trend Micro Password manager but even though it is installed on both computers it is not activated on either and I don't use it. </p><p>So why does the workstation not save passwords with the Trend PW mgr but the laptop does?  </p><p>Thanks for any clues you can give me as it is getting a bit tedious having to reset the Ask to save option every time I want to log in to a forum on the workstation. </p><p>Regards, Harold Lakoduk </p>",desktop;privacy-and-security_1;windows-10;firefox-990;,firefox,privacy-and-security,en-US,"",hlakoduk
1373578,2022-04-07 19:05:34 -0700,2022-04-07 22:26:50 -0700,amking a short cut of the wed adress on th desktop,"<p>hi, does any one know how to make a short cut for the web on windows desktop. As chrome and Microsoft edge do? </p><p><br> edit: added a space before 'As' to remove unintentional link. </p>",desktop;other;windows-11;firefox-990;,firefox,other,en-US,1495842;1495844;,Azin
1373576,2022-04-07 18:52:18 -0700,2022-04-07 22:02:54 -0700,OWA (Outlook Web Version) Drag and Drop Not Working with Firefox 99,"<p>Since the latest Firefox 99 update, when I drag and drop an attachment into an Outlook Web Access email on Firefox browser, it does not work (can do attachments through the attachment button, but this takes much more time to click, locate file, and attach). This process continues to work on my other browsers (Safari, Chrome). This is very frustrating (making me consider switching my primary browser. Any help with this would be appreciated. </p>",desktop;fix-problems;mac-os-x-1015;firefox-990;,firefox,fix-problems,en-US,1495818;1495838;,cmartell
1373573,2022-04-07 18:13:05 -0700,2022-04-07 22:04:21 -0700,Firefox file in MacOS Library (.sqlite) preventing TimeMachine from completing backup.,"<p>I am running MacOS 12.3 (Monterey) on a MacMini M1. It has not been able to complete a successful Time Machine backup since April 1st. Prior to April 1st Time Machine backed-up fine. The error message is on the accompanying image. I called Apple Tech Support and they really did not know the causation, though we did tell Time Machine to skip the mentioned file. The back up was then successful.  </p><p>I, unfortunately, do not remember the version of Firefox, other than esr and that I updated a month or two ago. I am pretty sure the version number was in the 90's. I did update to 91.6 esr tonight.  </p><p>Thank you. </p>",desktop;fix-problems;mac-os-x-1015;firefox-9161;firefox-916;,firefox,fix-problems,en-US,1495837;1495839;,gym4jim
1373572,2022-04-07 18:13:05 -0700,2022-04-07 18:13:05 -0700,Barra de Tarefas do Windows,"<p>Uso a barra de tarefas do windows na parte superior da tela, e os icones pequenos. O Navegador sobrepõe uma parte da barra de tarefas. Sabem Se tem algo que eu possa fazer para resolver, e fica sugestão para uma atualização. </p>",desktop;other;windows-10;firefox-990;,firefox,other,pt-BR,"",ethorea.m
1373571,2022-04-07 18:07:33 -0700,2022-04-07 22:06:13 -0700,PDF Print has started acting different,<p>FF PDF Print has been working fine for some time.LAST COUPLE OF WEEKS it tarted acting different  when wanting to save as PDF. Shot # 1 is same file but from Edge &amp; what FF use to look like when viewing. Shot #2 is what it looks like when viewed with FF and  Shot #3 is what it looks when text is selected. You can see the text is there. I have tried different Themes &amp; Dark Reader to no avail. The screenshots don't seem to be able to upload. </p>,desktop;other;windows-10;firefox-990;,firefox,other,en-US,1495840;,scottemyers
1373570,2022-04-07 18:05:33 -0700,2022-04-07 18:05:33 -0700,NY Times crossword,"<p>I can't send the Times crossword to my printer. When I click on ""Print""  from the Crossword web-page it only allows me to save it as a pdf. I never had this problem until today.  It used to be that clicking on ""Print"" would allow me either to save or send to my printer. Now there is no choice. Everything works fine if I use Microsoft Edge or my tablet (Android), but it won't work with FireFix on my desktop running Windows 10. </p>",desktop;websites;windows-10;firefox-980;firefox-9801;,firefox,websites,en-US,"",mark_bridger
