id,created,updated,title,content,tags,product,topic,locale,answers,creator
1372604,2022-03-29 07:23:33 -0700,2022-03-29 07:23:33 -0700,Firefox non supporta multimedia importanti,"<p>Ho riformattato il PC con windows 10 e ho scaricato Firefox Non mi permette di visualizzare contenuti multimedia tipo: netflix, e twitch.  Youtube si. Ricevo dei messaggi di errore tipo: Twitch (Errore #4000), Netflix(F7701-1003) Ho provato tutte le possibili soluzioni trovate online: eliminare la cache/cookie, controllare il DRM e il plugin Widedive nelle impostazioni. Aiutatemi pls Mi sembra impossibile dove cambiare broswer dopo anni per una roba del genere. </p>",desktop;fix-problems;windows-10;firefox-980;firefox-9802;,firefox,fix-problems,it,"",massimilian.battelli
1372603,2022-03-29 07:19:52 -0700,2022-03-29 07:19:52 -0700,Firefox will not stay in a light theme.,"<p>I don't want a dark theme and have tried numerous times to change it to a light theme. Within a min. Firefox returns to a default dark theme without me touching anything. Is there something that I am missing or is this newer browser in need of repair? This is getting old, I have used Firefox for years, never had a problem with kind of issue before.  Thanks </p>",desktop;beta;other;windows-10;firefox-990;,firefox,other,en-US,"",garmbell
1372602,2022-03-29 07:04:12 -0700,2022-03-29 07:07:38 -0700,listing description on ebay seems to get squashed into 10% of page width when seems to be set for 100% and is only TD element on the TR,"<p>Page in question but appears to be all listings: </p><p><a href=""https://www.ebay.co.uk/itm/255449833961?hash=item3b79ff21e9%3Ag%3AZtIAAOSwIIxiC%7EHz&amp;LH_ItemCondition=2000%7C2500%7C3000%7C4000%7C5000%7C6000%7C7000"" rel=""nofollow"">https://www.ebay.co.uk/itm/255449833961?hash=item3b79ff21e9%3Ag%3AZtIAAOSwIIxiC%7EHz&amp;LH_ItemCondition=2000%7C2500%7C3000%7C4000%7C5000%7C6000%7C7000</a> </p><p>Code seems to look like it should fill the width </p><p>&lt;title&gt;eBay&lt;/title&gt; </p> 	<table> 	<tbody><tr> 		<td> 			<div id=""ds-div""> 							<p>TRACE  ELLIOT AH500-7 500 WATT BASS AMP HEAD </p><p>Comes complete with foot switch,euro power cable , midi cable </p><p>and amp cover. This UK Model is becoming very rare due to demand for its awesome sound . The unit has very little use as it was a backup amp for the same TE Bass-head.</p><br><br><br><p>The AH500-7 is a 500W bass head with a 7-band graphic EQ to fine tune your sound with ease. Highly efficient output stage uses MOSFET technology. Footswitchable features include Pre Shape; graphic EQ; compressor with self-adjusting, program-dependent attack/release times; and an output mute.</p><p>* 500W</p><p>* 7-band graphic EQ</p><p>* Footswitchable Pre Shape; graphic EQ; compresor with self-adjusting, program-dependent attack/release times; output mute</p><p>* Series effects loop</p><p>* Electronically balanced XLR DI output (selectable pre/post preamp)</p><p>* Highly efficient output stage using MOSFET technology</p><br><br><p>Dimensions: L 48.5 x 34 x 13 [cm].</p><p>Weight 15.3 [kg].</p><br><p>This is item is advertised as a  COLLECTION ITEM  but the buyer is welcome to arrange a uplift with a courier service . I will box the item securely for a small fee for the parking materials £5.00 .</p></div> 						</td> 	</tr> </tbody></table>",desktop;websites;windows-10;firefox-980;firefox-9802;,firefox,websites,en-US,1493402;,oscarstankard
1372601,2022-03-29 07:02:48 -0700,2022-03-29 07:02:48 -0700,Restoration of tabs upon restart,"<p>Upon restarts, I'm not getting my Tabs restored, even though I have ""Restore Previous Session"" marked. Of course, I have to sign in, but my previous tabs never show up.  What can I do to ensure that previous tabs appear upon a re-start? </p>",desktop;tabs;mac-os-x-1015;firefox-920;firefox-9201;,firefox,tabs,en-US,"",tobyn.anderson
1372600,2022-03-29 06:57:15 -0700,2022-03-29 07:01:37 -0700,Recover old firefox account,<p>Why do you erase sync data when someone resets their password with no warning???????? Now all my information is gone and you have no way of recovering it?????  UNBELIEVABLE </p>,desktop;sync;windows-10;firefox-980;firefox-9802;,firefox,sync,en-US,1493400;1493401;,monica35
1372599,2022-03-29 06:43:42 -0700,2022-03-29 06:43:42 -0700,Seleccion de Certificados Digitales,<p>Hola.  Cómo debo configurar mi navegador para que me solicite seleccionar el certificado que desee de Firefox Uso la version 98.0.2 </p><p>Gracias </p>,desktop;privacy-and-security_1;mac-os-x-1015;firefox-980;firefox-9802;,firefox,privacy-and-security,es,"",juangutierrezmoreno
1372598,2022-03-29 06:33:46 -0700,2022-03-29 06:33:46 -0700,otevření přílohy z mailu,"<p>při otevírání zaslané přílohy xls, word se mi dříve nabízela možnost, zda chci soubor uložit nebo otevřít přímo v programu (excel, word) - nyní se mi příloha jen stáhne nebo se otevře ve firefoxu. umíte prosím poradit? </p><pre>děkuji vw </pre>",desktop;customize;windows-10;firefox-980;firefox-9802;,firefox,customize,cs,"",vendulawachsmannova
1372597,2022-03-29 06:29:53 -0700,2022-03-29 06:29:53 -0700,Can't login to important websites on Windows.  Either boxes don't appear or info is not passed to site.  No problem on Mac just windows.,"<p>I have asked this before but got no reply.  Running FireFox 98.0.2 andthe  problemis logging into many websites (like my bank)  on Windows 10.  Generally the login info drop downs do not accept the data or don't even appear.  I am ready to quit Firefox on windows.  Oddly, Firefox on MacOS is ok.  But it is really frustrating to have to use MS Edge to log into my bank or read the local paper and more. Really, if my main option to switch were something other than GOOGLE I would switch - have use Firefox for years - I am a data scientist with an MS in CS and have high expectations for interface design.  This one is not working. </p>",desktop;websites;windows-10;firefox-980;firefox-9802;,firefox,websites,en-US,"",jj.landwehr
1372594,2022-03-29 05:27:10 -0700,2022-03-29 05:27:10 -0700,Bulk delete for facebook messages- how to?,<p>I would like to be able to bulk delete messages from FB messenger. There is an add on for Chrome to bulk delete and I see others talking about a similar add on for Firefox but I cannot find a link to get this add on. Any idea where this is? </p>,desktop;customize;windows-10;firefox-980;firefox-9802;,firefox,customize,en-US,"",ecampnd
1372590,2022-03-29 03:51:50 -0700,2022-03-29 03:51:50 -0700,BBC Weather does not display correctly,"<p>Part if overlay does not display see attached; Should say ""Light cloud and a ... ?fresh breeze?"" Win 7 Pro, Firefox 98.0.1 </p>",windows-7;desktop;websites;firefox-980;firefox-9801;,firefox,websites,en-US,"",Apalling
1372589,2022-03-29 03:37:36 -0700,2022-03-29 03:37:36 -0700,Firefox Screenshots,"<p>Buenos días, Parece que Screenshots no me funciona bien, solo me deja guardar visible o la página entera, cuando siempre me había dejado pinchar y arrastrar para seleccionar lo que me interesaba. ¿Es un problema de configuración? ¿Ha cambiado Firefox en alguna actualización? Muchas gracias por su atención </p>",desktop;fix-problems;windows-10;firefox-980;firefox-9802;,firefox,fix-problems,es,"",albertocue
1372588,2022-03-29 03:30:22 -0700,2022-03-29 03:30:22 -0700,Why can I no longer see my site on Firefox?,"<p>For the past three days I have been unable to see <a href=""https://candobetter.net"" rel=""nofollow"">https://candobetter.net</a> on the firefox browser.  One of my friends has the same problem.  It shows up normally on other browsers - Opera, Edge. It is important for me that people can see my site.  Can anyone there help, please. </p>",desktop;websites;windows-10;firefox-980;firefox-9802;,firefox,websites,en-US,"",astridnova
1372586,2022-03-29 02:28:44 -0700,2022-03-29 02:28:44 -0700,Más weboldalra való átirányítás blokkolásának kikapcsolása,"<p>Netes online, bankkártyás fizetéskor előbb átirányítanak a banki oldalra, ahol megtörténik a fizetés, majd visszairányítanak az eredeti oldalra. A FireFox alapból letiltja ezeket az átirányításokat. Igaz, hogy RÁKÉRDEZ, de ha az ember nem reagál gyorsan a rákérdezésre, akkor megszakad a fizetési folyamat. Le akarom tiltani az átirányítás figyelését és a rákérdezést! Ezt hogy tehetem meg? Szabó Imre </p>",windows-7;desktop;privacy-and-security_1;firefox-980;,firefox,privacy-and-security,hu,"",imregep.szabo
1372581,2022-03-29 00:44:05 -0700,2022-03-29 00:44:05 -0700,Updated passwords not showing in passwords,<p>I check my password after i while i found that my newly added password after October are not save or updated on Passwords. </p>,desktop;privacy-and-security_1;mac-os-x-1015;firefox-980;firefox-9802;,firefox,privacy-and-security,en-US,"",mimranmughal444
1372580,2022-03-29 00:32:19 -0700,2022-03-29 00:32:19 -0700,Lost tabs,<p>My Firefox tabs usually restore when I open my browser. Now they have all gone after I clicked on a pop up inviting me to update my browser. How do I get them back? .......or stop this happening in future? </p>,windows-7;desktop;tabs;firefox-980;firefox-9802;,firefox,tabs,en-US,"",warwickpeters
1372579,2022-03-29 00:08:34 -0700,2022-03-29 01:35:33 -0700,Can't access Youtube when on Firefox,"<p>Problem description: It's been 3 days since I can no longer access Youtube on Firefox on my macbook pro 13. I've been getting this monkey error saying ""Oops, something went wrong."" Please advise. </p><p>Variables: - I'm a user in China. - I'm on the latest version of Firefox (detailed info attached below). - My macOS is up to date (macOS Monterey, detailed info including hardware info given below). - I access Youtube via ExpressVPN (also up to date), as Youtube is still officially blocked in China. - Youtube is accessible on both Safari and Chrome browser on my macbook, with Firefox being the only exception (but Firefox is also my favorite and default browser, which is why I'm trying to fix this). - I've also tried accessing Youtube via Firefox on my windows 10 PC, and all is fine. All other variables remain the same.  - All the above tests were done in the exact same internet (wifi) environment. - Conclusion: There's nothing wrong with the local internet, VPN service, or Youtube site. It could only be with either the current build of Firefox for mac, or some unknown settings on my macbook. I can't be certain which is it because I only have 1 macbook hence I can't reproduce or test on another. </p><p>My email address for contact: [email removed from public forum]. Looking forward to your prompt reply. </p><p>Cheers, Aaron </p>",desktop;websites;macos;mac-os-x-1015;firefox-980;firefox-9802;,firefox,websites,en-US,"",multimixmeta
1372575,2022-03-28 20:36:08 -0700,2022-03-29 03:26:29 -0700,Connected Services,"<p>Hello - Can someone provide me a simple explanation of what Firefox considers ""Connected Services""? The Connected Services screen says ""Everything you are using and signed into"" - which I can sort of understand - BUT, what is Firefox DOING with its access to my PC, for one thing? At the Connected Services screen there is no link or button which provides an explanation - as to what Firefox DOES with the Connected Services. Any positive, constructive information will be appreciated. JFC </p>",desktop;privacy-and-security_1;windows-10;firefox-980;firefox-9801;,firefox,privacy-and-security,en-US,1493352;1493368;1493379;,jfcaffrey
1372573,2022-03-28 20:00:20 -0700,2022-03-28 20:25:53 -0700,A new zoom level in Firefox,"<p>I look for the smallest zoom possible on the Firefox settings to suit my eyes and I don't find it, there's 67% and 80%. 67 is too small and 80 too big. Unlike other browsers who offer 75% of zoom level, I really want it on Firefox too! If this could come up, it'll look pleasing! </p>",desktop;customize;windows-11;firefox-980;firefox-9802;,firefox,customize,en-US,1493350;,samuelpauloram
1372572,2022-03-28 19:06:08 -0700,2022-03-29 05:47:02 -0700,Global protection control,<p>I don’t know how to enable gpc </p>,desktop;privacy-and-security_1;,firefox,privacy-and-security,en-US,1493353;1493361;,natashab45
1372571,2022-03-28 18:45:14 -0700,2022-03-28 19:04:53 -0700,Firefox randomly opens and closes downloads list,"<p>Firefox version: 98.0.2 (64-bit) OS Version: Microsoft Windows 11 Pro 10.0.22000 Build 22000 </p><p>As I go about my day to day use of the app, I will find that the Downloads list box will randomly open and close itself. This happens several times over a couple hours. If there are no recently downloaded items, then instead of the box opening, it will just add the button and remove it swiftly. </p><p>Is this a known issue? Is there a way to fix it? It is very distracting and really makes one paranoid. </p>",desktop;fix-problems;windows-11;firefox-980;firefox-9802;,firefox,fix-problems,en-US,1493340;1493341;,aheath42
1372569,2022-03-28 18:05:13 -0700,2022-03-28 20:04:29 -0700,Access to REI denied on Firefox WHY?,"<p>Please explain: Access Denied You don't have permission to access ""<a href=""http://www.rei.com/user/login"" rel=""nofollow"">http://www.rei.com/user/login</a>"" on this server. </p><p>Reference #18.f697c68.1648515585.37d0ad20 </p>",desktop;other;mac-os-x-1015;firefox-980;firefox-9802;,firefox,other,en-US,1493335;1493344;1493345;,xueshg12
1372568,2022-03-28 17:52:12 -0700,2022-03-28 21:28:32 -0700,Firefox Browser,"<p>My computer rebooted to install antivirus update.  Now I cannot access any of my bookmarks or anything on the web.  My bookmarks are showing, but when I click on one, it won't load.  When I first open Firefox, there is a tab in the upper left corner that says new tab, but there is a blank page. I can't access my e-mail or anything on the web. </p>",desktop;other;windows-10;firefox-980;firefox-9802;,firefox,other,en-US,1493354;,rbkinney
1372567,2022-03-28 17:30:25 -0700,2022-03-28 20:45:41 -0700,browsing history in the Mozilla database - is it anonymized?,"<p>After doing an internet search using Firefox, does the data get anonymized?  Is it deleted?  If not, how is it protected?  Can it be deleted?  If not how can it be secured?  I'm not concerned about the history on my browser - I know I can delete that from my view.  How can I ensure, my search history isn't viewable by Firefox representatives?  Also, are there third party providers that collect information that I should know about besides internet service provider(s) (and their partners if applicable or cable service when applicable)? </p>",desktop;other;windows-10;firefox-980;firefox-9802;,firefox,other,en-US,1493347;1493351;,@K
1372566,2022-03-28 17:06:36 -0700,2022-03-28 22:25:05 -0700,firefox ni recuerda is pestañas previamente abiertas,"<p>De repente FF dejo de recodar ls pestañas que tenia abiertas (la configuracion si tiene activada esa opción) , si tengo abiuerts 10 pestañas, cierro FF y cuando lo vuelvo a abre en blanco (sin esas pestañaS), ya intente reinstaalro y todo sigue igual </p><p>Que puedo hacer? </p>",desktop;other;windows-11;firefox-980;firefox-9802;,firefox,other,es,1493357;,chentermz
