id,created,updated,title,content,tags,product,topic,locale,answers,creator
1398631,2022-12-03 18:28:01 -0800,2022-12-03 18:28:01 -0800,REPOST : Audio won't play at volume level when unpaused.,"<p>I will repost this every so often until I get SOMETHING to help with this,or I get banned from asking questions (If that's even possible). THIS IS GOING TO DRIVE ME INSANE. I have to adjust my volume when unpausing something because it's too quiet, but then I have to adjust it AGAIN because after it unfades, it's too loud. I KNOW THIS IS PROBABLY A FEATURE, but I don't care. I only have this problem with Firefox, so if there's no solution I'll probably switch back to Google Chrome. I JUST WANT TO KNOW HOW TO DISABLE THIS, I DON'T KNOW HOW TO USE about:config, AND IT'S NOT IN SETTINGS. </p>",desktop;other;windows-10;firefox-1070;,firefox,other,en-US,"",SomeGuyNamedPhoenix
1398630,2022-12-03 18:06:59 -0800,2022-12-03 18:37:49 -0800,thunderbird and mac os ventura 13.0,<p>My computer was upgraded to mac OS ventura 13.0. I did not know that older versions of Thunderbird (60.9.1) would no longer be supported. I believe all 32 bit apps will no longer lunch. Do i uninstall ventura and load monterey or partition part of my hard drive and load monterey ?? </p>,desktop;other;mac-os-x-1015;firefox-990;firefox-9901;,firefox,other,en-US,1551916;,rsap98
1398629,2022-12-03 17:31:14 -0800,2022-12-03 17:31:14 -0800,biometric failed,<p>biometric failed  and not secure please help </p>,desktop;windows-10;website-breakages;firefox-1070;firefox-10701;,firefox,website-breakages,en-US,"",surajsinghmunda43
1398627,2022-12-03 17:19:14 -0800,2022-12-03 17:19:14 -0800,Screen goes black when playing some videos -,"<p>Screen goes black when some videos play - audio continues, but screen is black.  I am sire this is a Firefox problem - I have successfully watched videos using BING browser - same videos go black on Firefox.  I have refreshed Firefox, cleared cache, restarted Firefox - cleaned cookies.  Turned accelerator off then back on - because nothing changed.  Does not do this with all videos, just some - some You Tube videos play, others do not.  I have Windows 10 and McAfee Live Safe - all programs are current and up to dated. </p>",desktop;other;windows-10;firefox-1070;firefox-10701;,firefox,other,en-US,"",edszeliga
1398626,2022-12-03 17:02:15 -0800,2022-12-03 17:02:15 -0800,sub folder not showing when listing parent folder,<p>i have a folder which contains a sub folder.  the sub folder does not show on the &gt;&gt; list.  but when i choose manage bookmarks i can see the sub folder. </p>,desktop;bookmarks;windows-11;firefox-1070;firefox-10701;,firefox,bookmarks,en-US,"",jbjenifer
