id,created,updated,title,content,tags,product,topic,locale,answers,creator
1371391,2022-03-17 23:47:57 -0700,2022-03-17 23:47:57 -0700,Discord is not properly compatible with firefox.,"<p>Discord is almost compatible with the web environment, and firefox is fine for most uses. </p><p>However, the discord also has a stream function, and in this case, there are many parts that are not properly compatible. </p><p>For example, Most game cannot be captured properly for stream. If you play the game as Admin caps, more likely to not be able to capture it. </p><p>For example, It can't adjust the volume of the watching stream. If you try to mute or adjust the volume using Discord UI, it will be ignored. You need to lower and raise the volume using the media control in the context menu. Even if you watch multiple streams at the same time, you can't hear the sound properly. </p>",desktop;websites;windows-10;firefox-980;,firefox,websites,en-US,"",zaqzaq0802
1371390,2022-03-17 23:38:13 -0700,2022-03-17 23:38:13 -0700,is there a way to automatically have my posted question emailed to me?,"<p>hello, </p><p>i am wondering, is there a way to automatically have my posted question emailed to me? Meaning, when i post a question here, can i choose that a copy of it be sent to me? (many other sites, such as google and ebay, have this option, and it is very helpful). </p><p>thanks! </p>",mac-os;desktop;customize;firefox-780;,firefox,customize,en-US,"",coatli
1371389,2022-03-17 22:57:17 -0700,2022-03-18 01:02:32 -0700,How can I get rid finally from update message ?,"<p>I asked such a question the day before yesterday, but none answered me  I still use window 7 32 bit and I never want to update  The new version ( V 98.01 )  is not compatible with Window 7  A black screen is shown just I open the Firefox browser  I thought it is virus, but it is not so.  Now I am sure of the problem  I uninstalled the new version and changed for an old version ( V 80.01 ) and the black screen is never shown  The black screen which I complain about= crashing of the browser because it is not covenant to Window 7  </p><pre>2- I changed the update to  (   Check for updates but let you choose to install them )  and the problem is ended but a message about updating still appears in the right corner  need me close each time.  </pre> <p>How can I get rid finally from update message in the toolbar ?  In V 80.01  there is no choice ( never check for update ) </p>",windows-7;desktop;other;firefox-800;,firefox,other,en-US,1490448;,alrobaey51
1371387,2022-03-17 22:18:38 -0700,2022-03-17 22:28:11 -0700,Firefox change to file download options,"<p>Firefox have stopped offering the option to just OPEN a file or attachment. Files are now automatically saved to 'Downloads' or can be saved to another folder. This sudden autocratic change has caused much grief to many Firefox users judging by comments already made in numerous forums. It appears some Firefox 'brainstormers' created this change to 'benefit' users and to prevent data loss etc. Well, this user and many others strongly disagree and hope that Firefox will reconsider their decision or at least offer some alternative or option to 'just open' a file without saving it. I have, for now, installed an old Firefox version (96.0) to recover the old option menu to open or save files. However, if Firefox persist with this change, without offering a 'open only' option, I and many other users will be forced to switch to other browsers, e.g. Microsoft Edge, which do offer that option. </p>",desktop;customize;windows-10;firefox-960;v98-download;,firefox,customize,en-US,"",kuya7447
1371386,2022-03-17 21:05:45 -0700,2022-03-17 21:05:45 -0700,The Brave search engine,"<p>I have been using DuckDuckGo for my preferred search engine. I want to change to the Brave search engine and continue using it on Firefox. I went to the addon page where I found it and tried to download it, but, for some reason, it wouldn't download. Is it possible to use the Brave search engine on Firefox? </p>",desktop;download-and-install_1;windows-10;firefox-980;,firefox,download-and-install,en-US,"",joyce.greer2
1371385,2022-03-17 21:00:25 -0700,2022-03-17 21:00:25 -0700,facebook,<p>my facebook   page is in adiffernt language and all in black </p>,desktop;sync;windows-10;firefox-980;,firefox,sync,en-US,"",sheiladawson
1371384,2022-03-17 20:56:55 -0700,2022-03-17 20:56:55 -0700,facebook,<p>how can i get facebook back to english   and the cover back to original format it is black </p>,desktop;sync;windows-10;firefox-980;,firefox,sync,en-US,"",sheiladawson
1371383,2022-03-17 20:49:19 -0700,2022-03-17 20:49:19 -0700,FACEBOOK,<p>Some how my face book page is black and also in a diifferent language  how can i get english language back and orinal facebook page back to it orinianal form </p>,desktop;websites;windows-10;firefox-980;firefox-9801;,firefox,websites,en-US,"",sheiladawson
1371382,2022-03-17 20:38:18 -0700,2022-03-17 23:18:26 -0700,Cookies and Sit Data,"<p>When i go into Settings, Privacy and Security, Cookies and Site Data, it always says 62.0KG. I clear it, it says 0 KG hen if I go straight back in it says 62.0KG again. This can't be correct, so how do I fix it please?........................Regards...........Del Norris.........................My email for an answer is .............[removed email from public] </p>",desktop;other;windows-10;firefox-980;,firefox,other,en-US,"",delnorris
1371380,2022-03-17 19:45:01 -0700,2022-03-17 19:45:01 -0700,How can version 98.0 be very outdated ??,"<p>I have been having problems accessing part of a membership site. Can't get past the first step, it doesn't work for me. </p><p>Kubuntu 20.04.4 LTS Release:        20.04 Codename:       focal Firefox Version 98.0 (64 bit) </p><p>Have been informed from the website owner that the IT person has tested this with Explorer, Safari and Chrome, and all work. The IT support person then goes on to state - ""....... that the client needs to use a different browser as Firefox is very outdated."" </p><p>So, I was using the latest version and it is ""very outdated""  ??? </p><p>How can I respond ?  Is there a training course for the IT person to deepen their skill level ? </p>",linux;desktop;other;firefox-980;,firefox,other,en-US,"",oygle
1371379,2022-03-17 19:41:57 -0700,2022-03-17 20:27:00 -0700,When I down load a attachement in by emails why does it automatic down load to my desk top,"<p>When I download an attachment from my emails, why does it automatically download to my desktop when it opens?  I think it all started when I did an update with Firefox?  So all the attachments that I opened up all week are on my desktop, and I did not realize it :( I usually click on the arrow on the attachment I open it up in Adobe Reader, then if I want to save it to  </p><pre>the desktop, I do Save As. </pre> <p>I went to settings tried everything still on the desktop. Please tell me what to change, PLEASE! </p>",desktop;customize;windows-10;firefox-980;v98-download;,firefox,customize,en-US,1490422;,patty8
1371378,2022-03-17 19:13:56 -0700,2022-03-17 21:50:51 -0700,Firefox 98.0.1 (64bit) using more than 8GB of memory and freezes internet,<p>Firefox is becoming more and more buggy and more unstable using more than 8Gb of ram in either the apps processes or if not there then in the background processes and when you look into the firefox task manager it reports it is using no more than maybe 100 MB of ram the only way to stop it is to close the one process that is using all the memory. when i investigate using the about:memory function it tries to tell me that it is an extension using the memory but if i disable the 2 extensions i use and reload the measure memory it still is using exactly the same amount of memory. is there any sort of fix for this because i am getting sick of having to have the windows task manager open to close the rogue process every time i use my browser </p>,desktop;fix-problems;windows-10;firefox-980;,firefox,fix-problems,en-US,1490423;1490437;,whiteshark68
1371376,2022-03-17 19:06:02 -0700,2022-03-17 19:06:02 -0700,unable to get out of S mode in Windows,"<p>I bought this laptop because it had Windows 10 so I could download firefox, The laptop immediately updated to Windows 11, no way to stop it. I am locked out of my microsoft account, have been for years. How do I get firefox downloaded ? </p>",desktop;download-and-install_1;,firefox,download-and-install,en-US,"",jwvest
1371375,2022-03-17 19:02:11 -0700,2022-03-17 20:33:38 -0700,Opening links,"<p>How can I set Firefox for Windows 10 to open links in native apps? It seems that Firefox will now only prompt for Save As -- which is annoying if I only want to view a link (such as a MS Word document), and not save it. </p>",desktop;other;windows-10;firefox-980;,firefox,other,en-US,1490424;,jeffhamill
1371374,2022-03-17 19:01:24 -0700,2022-03-17 20:35:17 -0700,Passwords? viruses?,"<p>I tried to log on on a site. I put the pswd, Firefox offers to me to 'save password', log fails, I clicked 'show password' to verify, but a larger and strange chain of charactears appears.... what is happening? </p><pre>I ' ve scanned for viruses already. I have forticlient for a VPN too. </pre> <p>Some ideas? </p>",desktop;privacy-and-security_1;windows-10;firefox-980;,firefox,privacy-and-security,es,1490425;,patricioperaltaerre
1371373,2022-03-17 18:44:46 -0700,2022-03-17 18:44:46 -0700,I can no longer open www.bankofamerica.com on my firefox browser on iMac. No problem on my cell phone,"<p>I can no longer open <a href=""http://www.bankofamerica.com"" rel=""nofollow"">www.bankofamerica.com</a> on my firefox browser. It works on my iphone and on chrome. What's going on? </p><p>It times out but doesn't open. Rudy </p>",mac-os;desktop;websites;firefox-980;,firefox,websites,en-US,"",srudy9
1371371,2022-03-17 18:22:26 -0700,2022-03-17 20:37:48 -0700,Log-In to Facebook,"<p>The last 2 days I've tried to log into Facebook, my picture is not on log-in page the way it always is, flag #1. It will let me log into Facebook, but when I get there and try to do something, it logs me out,then the log-in pop-up is constantly asking me to log-in, I click on log-in, and it pops-up again asking me to log-in. This has something to do with my picture being missing on the Facebook log-in page. Because when I use my Google Chrome to log-in to Facebook, my picture is on the log-in page and everything works fine. But I like using Firefox on Facebook to play my games. I contacted Facebook, but haven't heard back from them. Are they mad at Firefox and causing problems with log-ins? Do I need to uninstall Firefox and re-install, somebody please help I want Firefox for Facebook please. Thanks Linda </p>",desktop;other;windows-10;firefox-980;,firefox,other,en-US,1490426;,farskapeluver
1371370,2022-03-17 17:40:27 -0700,2022-03-17 21:53:23 -0700,Descargas,"<p>En esta ultima actualización, cualquier contenido que abro, ya sea alguna imagen o documento de whatsapp o de alguna pagina de internet, me descarga dicho archivo y lo guarda en mi computadora, cuando antes no lo hacía, Dentro de las preferencias tengo seleccionado que no haga descargas automáticas, y para cada tipo de archivo pongo la instrucción de que se abra en el programa correspondiente, pero aún así, me guarda los archivos en mi computadora. No quiero esto, justamente por esta razón uso Firefox en lugar de Chrome y ahora están igual. Creo que me regresaré a Edge en lo que arreglan esta situación. </p>",desktop;customize;windows-10;firefox-980;,firefox,customize,es,1490438;,najartsg
1371369,2022-03-17 17:32:43 -0700,2022-03-17 20:41:16 -0700,TIF files only have save option (not open) after last update,"<p>Since the last update .tif files won't open in default application on download anymore, I can only save them. Jpg and pdf files I can set a preference in settings to open or save, but there is no option to set a preference for tif files. </p><p>For my work I use databases with many tif files I need to open to review, and I <strong>really</strong> don't want to waste time saving every single file, then open them for review before going and deleting the unwanted ones. </p><p>Until the most recent update any image files just opened in my default application and I could save from there if I wanted. </p><p>This seems like a pointless change with no benefits and only disadvantages, can it be fixed? </p>",desktop;customize;windows-10;firefox-980;,firefox,customize,en-US,1490427;,impossiben
1371368,2022-03-17 17:26:59 -0700,2022-03-17 20:43:57 -0700,Is it possible to send sms text from my desktop computer using firefox,<p>'Is it possible to send sms text from my desktop computer using firefox?' </p>,desktop;customize;windows-10;firefox-980;,firefox,customize,en-US,1490428;,jandypandy100
1371367,2022-03-17 17:23:45 -0700,2022-03-17 20:45:46 -0700,Firefox is saving torrent files in downloads when told to open them.,"<p>Firefox is saving torrent files in downloads when told to open them. It uses the correct program to open them too, but I don't need it to be saving them, it creates a lot of clutter. Any idea how to correct this? It didn't use to do this. </p>",desktop;other;windows-10;firefox-980;,firefox,other,en-US,1490430;,uvires1
1371366,2022-03-17 17:12:25 -0700,2022-03-17 17:12:25 -0700,Many sites load slowly or time out,"<p>I've had a problem recently with some sites (such as <a href=""http://support.apple.com"" rel=""nofollow"">support.apple.com</a>, but also others) loading very slowly or not loading at all.  </p> <ul><li> Restarting Firefox fixes it for a short while </li><li> I've tried changing to No Proxy from Use System Proxy Settings - this, like restarting, helped for a short while </li><li> Unchecking DNS over HTTPS: DID resolve the problem but I'm curious as to why. I enable it with Safari with no problem. </li></ul>",desktop;fix-problems;firefox-980;firefox-9801;,firefox,fix-problems,en-US,"",finches
1371365,2022-03-17 17:10:29 -0700,2022-03-17 17:10:29 -0700,Google Visited Links Color,"<p>I'm looking for a reliable way to mark Google visited links </p><p>This seems to work everywhere but google </p><p>a:visited { </p><pre>   color: FF0000; </pre> <p>} </p><p>""Custom Google Visited Link Color"" seems to work sometimes, but the page needs to be refreshed.  No support site. <a href=""https://addons.mozilla.org/en-US/firefox/addon/google-link-color/?utm_source=addons.mozilla.org&amp;utm_medium=referral&amp;utm_content=search"" rel=""nofollow"">https://addons.mozilla.org/en-US/firefox/addon/google-link-color/?utm_source=addons.mozilla.org&amp;utm_medium=referral&amp;utm_content=search</a> </p>",desktop;customize;windows-10;firefox-980;,firefox,customize,en-US,"",noel_envoide
