id,created,updated,title,content,tags,product,topic,locale,answers,creator
1399769,2022-12-15 17:50:43 -0800,2022-12-15 17:50:43 -0800,Import from another browser: Firefox ESR,"<p>I've been using Firefox ESR ().  I want to change to Firefox.    </p><p>When I run Firefox, go to the File Menu, and select Import From Another Browser it tells me that no programs that contain bookmarks, history, or password data could be found.  </p><p>I have not uninstalled Firefox ESR, it contains bookmarks, history, or password data.  </p><p>Why can't Firefox find Firefox ESR? How do I make this import happen? </p>",linux;desktop;download-and-install_1;firefox-1070;firefox-10701;,firefox,download-and-install,en-US,"",hatta00
1399767,2022-12-15 17:38:55 -0800,2022-12-15 17:38:55 -0800,Firefox closes unless I rename the executable,"<p>Firefox instantly closes whenever I run it, unless I rename the executable to something other than ""firefox.exe"". This is a problem, because windows doesn't recognize it as a browser otherwise, so I cannot set it to my default browser. </p>",desktop;fix-problems;windows-10;,firefox,fix-problems,en-US,"",3948656735496
1399765,2022-12-15 16:46:30 -0800,2022-12-15 16:46:30 -0800,Google Is Killing Firefox Browser,<p><strong>Google with Captcha is killing Firefox.</strong> </p><p>Captcha constantly comes up in Firefox and stalls browsing. </p><p>Not as much of an issue with Google Chrome. </p><p>Often stuck for ages entering Captcha nonsense in Forefox. </p><p>What can Firefox people do about this crap? </p>,desktop;fix-problems;windows-10;firefox-1070;firefox-10701;,firefox,fix-problems,en-US,"",oznewmedia
1399764,2022-12-15 16:40:34 -0800,2022-12-15 18:03:03 -0800,Font rendering configurations are not being applied after new update.,"<p>I tweaked my Firefox configs to get better font rendering because I hate how ""skinny"" they are by default on windows. The options changed are: </p> <ul><li> gfx.font_rendering.cleartype_params.rendering_mode to 5 </li><li> gfx.font_rendering.cleartype_params.force_gdi_classic_for_families to """" </li><li> gfx.font_rendering.cleartype_params.enhanced_contrast to 100 </li><li> gfx.font_rendering.cleartype_params.cleartype_level to 100 </li><li> gfx.font_rendering.cleartype_params.pixel_structure to 1 </li><li> gfx.webrender.quality.force-subpixel-aa-where-possible to true </li></ul> <p>After the update, the fonts are default again, and no matter how much I change the configs, it doesn't change anything. </p>",desktop;beta;customize;windows-11;firefox-1090;,firefox,customize,en-US,1554087;1554093;,uvh8ozb6
1399762,2022-12-15 16:32:10 -0800,2022-12-15 16:32:10 -0800,Hulu Issues,<p>If I open up Hulu in Firefox it never loads the title cards or let me click on any videos in the website. I have turned my adblocker on and off and even uninstalled it at one point but I cannot get the issue to go away. Upon opening the browser console I found that the site has a source map error as shown in the attached image. Im not sure how to fix this as google hasnt been much help so far. </p>,desktop;windows-10;website-breakages;firefox-1080;,firefox,website-breakages,en-US,"",buddha1346
1399761,2022-12-15 16:20:50 -0800,2022-12-15 16:20:50 -0800,Unwanted blacklisting of websites by CleanTalk.,<p>On of my news websites is being blacklisted by CleanTalk. Is there any way to block CleanTalk from censoring free speech? </p>,windows-7;desktop;other;firefox-1080;,firefox,other,en-US,"",fcsizmadi
1399760,2022-12-15 16:02:01 -0800,2022-12-15 18:01:23 -0800,Sync a new copy of Firefox when you can't receive email,"<p>I have installed Firefox on a computer and I need to sync the data, but the process requires a conformation code that is sent to my primary email. My primary email in Firefox no longer works. How can I do this? Thank you. </p>",desktop;download-and-install_1;windows-10;firefox-1070;firefox-10701;,firefox,download-and-install,en-US,1554092;,Metron
