id,created,updated,title,content,tags,product,topic,locale,answers,creator
1383398,2022-07-19 08:24:42 -0700,2022-07-19 08:24:42 -0700,Mail Inbox & Delete do not work,<p>Inbox Delete Neither work </p>,desktop;other;windows-10;firefox-1020;firefox-10201;,firefox,other,en-US,"",wagnerbwg1
1383397,2022-07-19 08:24:00 -0700,2022-07-19 08:24:00 -0700,Mozilla Firefox,<p>When i open Firefox it will only open in minimise mode so i can't actually maximise or open the pages.  they are all shrunk on to my task bar </p>,desktop;other;windows-10;,firefox,other,en-US,"",maggie.msctraining
1383396,2022-07-19 08:16:58 -0700,2022-07-19 08:30:00 -0700,Space-key automatically scrolls..,"<p>Hi Firefox community, whenever I hit ""space key"" while I type, then it scrolls downwards which I annoys me. This happened at ""Otranscribe"" website where I was typing and this thing happened. Please tell me how can I stop the scrolling when hitting space key? </p>",linux;desktop;firefox-990;firefox-9901;website-breakages;,firefox,website-breakages,en-US,1520775;,ushadevipkm987
1383395,2022-07-19 08:00:22 -0700,2022-07-19 08:00:22 -0700,Selecting to open a file inside browser with Acrobat now always results in file being downloaded too.,"<p>I have the option set to always ask me if I want to open a pdf with browser, acrobat, or to download.  I usually select open with Acrobat and, for the last few months, I have been getting an unwanted download as well.  I found in the help articles that this is now the default action.  For me, it usually means that at the end of a session i have to go to my desktop (my optioned destination for downloads) and clean it up by deleting every file I have looked at. </p><p>I recommend that you make that functionality optional.  I just want to view the vast majority of things I open.  For the few that I might want to download after viewing them, i would prefer to take a proactive step to download them after I have reviewed them. </p>",desktop;customize;windows-10;firefox-1020;firefox-10201;,firefox,customize,en-US,"",Dick39
1383394,2022-07-19 07:58:44 -0700,2022-07-19 07:58:44 -0700,Firefox's automatic spell checking feature is strange. Add image.,"<p>I forgot to paste the image in the previous question, so add it. I want to solve the spell check by Japanese input instead of the spell check by English input. </p>",desktop;other;windows-11;firefox-1020;firefox-10201;,firefox,other,en-US,"",wakuwaku0016
1383392,2022-07-19 07:52:25 -0700,2022-07-19 07:52:25 -0700,Firefox automatic spell check function funny,"<p>I want to ask for advice. Firefox automatic spell check function funny. I've searched a lot, but I'm in trouble because I can't find a solution. In the firefox settings panel, I unchecked ""Use automatic spell check function"" and used it. I understand that the check is entered by inputting characters in English, but it is strange that the spell check is entered in other languages (Japanese input). I don't know the solution. </p>",desktop;other;windows-11;firefox-1020;firefox-10201;,firefox,other,en-US,"",wakuwaku0016
1383390,2022-07-19 07:24:02 -0700,2022-07-19 08:18:01 -0700,Apertura applicazioni,"<p>Buongiorno,  stiamo riscontrando un problema con il salvataggio delle impostazioni di Firefox nel tab applicazioni. <strong>- Percorso: Impostazioni - Generali - Applicazioni (Scegli come gestire in Firefox i file scaricati da Internet......)</strong> </p><p>Abbiamo impostato l'apertura diretta per i tipi di file <em>.pdf</em> ma dopo qualche ora, il sistema perde questa impostazione e ci chiede nuovamente dove salvare il file. </p><p>Come possiamo risolvere? </p><p>Grazie Antonio </p>",desktop;other;windows-10;firefox-1020;,firefox,other,it,1520774;,it154
1383387,2022-07-19 07:08:35 -0700,2022-07-19 08:14:49 -0700,Cannot access a website - recent event>,"<p>I can no longer access a website (<a href=""http://bt.com"" rel=""nofollow"">bt.com</a>) using Firefox. A tab shows up ""CA Authentication Adapter Connector""  with a blank page. If I use Private Browsing I can access. Checked with BT and Apple (I use an iMac) and the issue seems to be Firefox. How do I fix. Is this due to the recent Firefox update? I can access using a different browser. </p>",desktop;privacy-and-security_1;firefox-1020;firefox-10201;,firefox,privacy-and-security,en-US,1520773;,pat.elder
1383386,2022-07-19 06:55:21 -0700,2022-07-19 06:55:21 -0700,firefoxa ses gelmiyor,<p>her şeyi denedim başka tarayıcılarda ve windowsta ses var ama firefoxta yok uzantılardandır diye düşündüm uzantıları sildim gene yoktu firefoxu yeniledim gene ses yoktu yardım ederseniz sevinirim </p>,windows-7;desktop;other;firefox-1020;firefox-10201;,firefox,other,tr,"",aslan30m
1383384,2022-07-19 06:34:05 -0700,2022-07-19 07:21:11 -0700,Password,<p>Can I anyhow get deleted logins and passwords back? </p>,desktop;privacy-and-security_1;windows-10;firefox-1020;firefox-10201;,firefox,privacy-and-security,en-US,1520766;,daniel.bessa.santos
1383383,2022-07-19 06:32:25 -0700,2022-07-19 06:32:25 -0700,How to make Firefox open local font file for local page?,"<p>Hi,  </p><p>I'm working on a web site whose owner wants an unusual font : papyrus </p><p>I have the papyrus.ttf file in the root directory of this site, both locally and on the server.  </p><p>In &lt;style&gt;, I have :  @font-face { </p><pre>   font-family: papyrus;    src: url(papyrus.ttf); </pre> <p>} </p><p>And I add :  font-family:papyrus; among the &lt;style&gt; settings for requested parts of the page </p><p>This functions fine on the server, but not locally. So to view the pages I have to upload them after every modification, and this is a bit tedious.  </p><p>Is there a way to make it function locally, please? Either by adding some more code to the pages or by changing firefox settings?  </p><p>Firefox can open image files locally, &lt;a href&gt; functions both locally and externally, so why wouldn't font files also function locally?  </p><p>A workaround could be to make Firefox display all web pages in papyrus, but this would be a last resort... </p>",linux;desktop;tips;firefox-1020;,firefox,tips,en-US,"",alain.reve.de.rien
1383382,2022-07-19 06:17:45 -0700,2022-07-19 06:17:45 -0700,INSTALAÇÃO DE EXTENSÕES E TEMAS INTERROMPIDAS,"<p>NÃO ESTOU CONSEGUINDO INSTALAR NENHUMA EXTENSÃO OU TEMA NO FIREFOX DE QUALQUER COMPUTADOR, POIS APARECE UMA MENSAGEM DE ERRO DIZENDO QUE ESTÃO CORROMPIDAS!!! </p>",desktop;fix-problems;windows-10;firefox-1020;,firefox,fix-problems,pt-BR,"",henrique.zes
1383381,2022-07-19 06:15:46 -0700,2022-07-19 07:44:59 -0700,"accessing the Transport for London website, www.tfl.gov.uk","<p>Dear Firefox, </p><p>Thanks for reading this. </p><p>I use your superb browser to surf the web.  One of the only sites I am having trouble with is Transport for London, <a href=""http://www.tfl.gov.uk"" rel=""nofollow"">www.tfl.gov.uk</a>.    </p><p>The thing about this site is, that when I go onto it, it simply freezes almost straight away.  I use my wired mouse to try to scroll up or scroll down the site, and I cannot.  It is just stuck.  There are no scroll bars on the right to be able to click on to go up or down. </p><p>I am thinking this problem may have something to do with cookies.  I say this, because the site is allright before the message comes onto the screen asking you to agree to cookies.   </p><p>Is this a possiblity, do you think?   </p><p>Or is there another possibility?  For example, I have visited another forum, and told to increase hardware acceleration.  Could this be the answer? </p><p>Any suggestions would be more than welcome, Yours Marek </p>",desktop;cookies;windows-10;firefox-1020;firefox-10201;,firefox,cookies,en-US,1520769;1520770;,MAREK_WES
1383380,2022-07-19 06:06:40 -0700,2022-07-19 06:06:40 -0700,Trying to install @autofirma on browser,"<p>Hola, buenos días: </p><p>Estoy intentando de utilizar @utofirma para tramitar unos documentos gubermentales en una sede electrónica. Pero lamentablemente, no me deja firmar electrónicamente. En la página administrativa hay instrucciones acerca de la instalación (que se pueden observar en la imgen adjunta a este mensaje) pero estoy muy perdida, ya actualicé la app en el ordenador pero no sé como actualizarla para que se configure con el navegador. Muchísimas gracias y me quedo a la espera. </p>",desktop;privacy-and-security_1;mac-os-x-1015;firefox-1020;firefox-10201;,firefox,privacy-and-security,es,"",mtapia1920
1383378,2022-07-19 05:55:41 -0700,2022-07-19 06:22:23 -0700,"Can't restore previous session, ""recently closed windows"" grayed out","<p>THIS SUCKS YOU HAVE NOT FIX THIS WITH AN UPDATE...    </p><p>Can't restore previous session, ""recently closed windows"" grayed out </p>",desktop;customize;windows-11;firefox-1020;firefox-10201;,firefox,customize,en-US,1520759;,wyattearp59
1383372,2022-07-19 04:48:11 -0700,2022-07-19 06:15:00 -0700,firefox is verry simple browser,<p>firefox is verry simple </p>,windows-7;desktop;fix-problems;needsinfo;firefox-1020;firefox-10201;,firefox,fix-problems,en-US,1520754;,hussainshowkat33
1383369,2022-07-19 03:53:14 -0700,2022-07-19 06:21:02 -0700,how to upgrade firefox,"<p>Why verry slow searching,verry difficult to sign in  google mail how to resolve? </p>",windows-7;desktop;fix-problems;needsinfo;firefox-560;,firefox,fix-problems,en-US,1520755;1520758;,kartomoyuniati
1383366,2022-07-19 02:43:42 -0700,2022-07-19 02:43:42 -0700,Malver on mozilla JS/Malscript.G4,<p>I have such message and it seems it is Mozzilla problem </p><p>C:\Users\WallyK\AppData\Local\Mozilla\Firefox\Profiles\2o0hqf5h.default-release\cache2\entries\BE5285D66E10085F60228AB5036F3CD6D058D845 </p><p>Details </p><p>Malware: JS/Malscript.G4 Type: Infected file Status: Cleaned Path: C:\Users\WallyK\AppData\Local\Mozilla\Firefox\Profiles\2o0hqf5h.default-release\cache2\entries\BE5285D66E10085F60228AB5036F3CD6D058D845 </p><p>Time: 2022/07/19 19:35:44 </p>,desktop;fix-problems;windows-10;firefox-1020;firefox-10201;,firefox,fix-problems,en-US,"",wwk_50
1383363,2022-07-19 02:22:10 -0700,2022-07-19 02:22:10 -0700,Paaaage is only half opening,"<p>On some, not all emails I receive, after clicking on the email, it only opens to half page size. I am not able to read all the email. If I use the scroll bar it does not taaake me to the bottom of the email. Near the bottom of the email it has the following : Options: Reply To All | Show Recipients | Edit Subject | Add Bcc </p>",desktop;other;windows-10;firefox-1020;firefox-10201;,firefox,other,en-US,"",brittlejack
1383361,2022-07-19 01:34:26 -0700,2022-07-19 05:48:45 -0700,updating Firefox version and migrating the config file.,"<p>When I upgrade Firefox versions, I create a new profile folder to test the newer version. When I upgraded to V101, I found Google Maps worked very well  using the standard config file the install created, especially in relation to panning in Street View. then when I miggrated over my old config file from V88 Google Maps became very sluggish on panning. Clearly some config entries need tweaking. How do I know which class of config entries  are used by Google Maps? I dont want to compare every single line of the config files.. </p><p>Its about time Firefox came with a flyout when you hover over each config entry to tell us what it does? </p>",windows-7;desktop;download-and-install_1;firefox-1010;firefox-10101;,firefox,download-and-install,en-US,1520731;1520749;,drivvel
1383360,2022-07-19 01:21:17 -0700,2022-07-19 01:21:17 -0700,Any way to force Firefox to prioritize IPv4 without disabling IPv6?,"<p>Firefox prioritizes IPv6 (even on a network with internet-accessible fd00:: address, which contradicts my currently set up prefix policies) over IPv4. Now the problem is that my IPv6 address is a <a href=""http://tunnelbroker.net"" rel=""nofollow"">tunnelbroker.net</a> one, and while I still want to be able to access the IPv6 internet, I don't want a tunneled connection to be my default. And I don't want to disable IPv6 completely. Is there a way to force Firefox to prioritize IPv4 over IPv6? </p><p>Note: the first time when connecting to a website, the browser connects via IPv4 (like the prefix policies are supposed to work), but then it remembers that the website is accessible via IPv6, saves it into the content-prefs.sqlite file (removing the said file makes the connection fall back to IPv4 first again) and connects via IPv6 again. Is there a way to make Firefox NOT remember that in content-prefs.sqlite and still connect abiding the prefix policies? </p><pre>Using Firefox Dev Edition 103.0b9 on Windows 11 x64 </pre>",desktop;beta;other;windows-11;firefox-1030;,firefox,other,en-US,"",evengard
1383358,2022-07-19 00:47:25 -0700,2022-07-19 00:47:25 -0700,ForeFox does not recognize passcode generated by SAP authenticator app on my mobile device. Can use same passcode to login to same SAP site using other browsers like Chrome and Microsoft Edge.,"<p>Get the error - ""Wrong passcode; enter the passcode"" again while trying to login to SAP SuccessFactors provisioning when I key in passcode generated by SAP 2 factor authenticator app on my phone. Do not face this problem with Chrome or Edge.  </p><p>Interestingly, I do not get the same error when I use FireFox in a new In private window. It then allows me to login using same passcode.  So I do not face the issue in FireFox using In Private Window. </p>",desktop;other;windows-10;firefox-1020;firefox-10201;,firefox,other,en-US,"",saswati.bhattacharjee
1383355,2022-07-19 00:26:37 -0700,2022-07-19 00:26:37 -0700,"Quando sul laptop (Windows) accendo Firefox Browser sulla prima riga in alto appare, con puntini lampeggianti, la terza riga dei segnalibri e non posso più aprire i segnalibri né modificare le impostzioni. E^pure impossibile riinstallare Firefox Browser.",<p>È possibile disinstallare Firefox Browser e riinstallarlo senza perdere i mail ricevuti e i segnalibri? Grazie per l'aiuto. PieroP </p>,desktop;bookmarks;windows-10;firefox-1020;firefox-10201;,firefox,bookmarks,it,"",ppedrocchi
1383351,2022-07-18 22:13:25 -0700,2022-07-18 22:13:25 -0700,CAN THE GREY COLOR FRONTS BE CHANGE?,"<p>I am visually impaired grey fronts are hard read. Can be change to black? If so how? Also, the image quality is por. Could that because I am use older Firefox and need to upgrade I? I so, would tell how would you tell how? You r time is appreciated, Thanks </p>",desktop;customize;windows-11;firefox-1020;firefox-10201;,firefox,customize,en-US,"",BEST2
1383350,2022-07-18 20:30:23 -0700,2022-07-19 04:40:15 -0700,Password Protect in Wordpress.Org does not secure in Firefox,"<p>I have created a page (<a href=""https://wp.me/s20nYT-dustind"" rel=""nofollow"">https://wp.me/s20nYT-dustind</a>) with a password protect, in July 2022. The password box appears in both Chrome and Edge on a PC, and Safari on an iPhone, but the page opens without a password in Firefox. </p><p>Any help that anyone can provide is appreciated beyond expression. Thank you in advance. </p>",desktop;privacy-and-security_1;windows-11;,firefox,privacy-and-security,en-US,1520701;1520702;1520707;1520714;1520741;,buffalogolfer
1383348,2022-07-18 20:15:06 -0700,2022-07-18 23:24:37 -0700,Restoring All Firefox WIndows 10,"<p>I installed a plug in and have now lost all my Firefox configuration, stored pages etc. I backup my entire PC everyday and can restore individual files. What Windows 10 files need to be restored in order to return my Firefox before the crash? </p><p>thank you, Robert </p>",desktop;other;windows-10;firefox-1020;firefox-10201;,firefox,other,en-US,1520703;1520706;1520708;1520710;1520711;1520721;,rkruz3
1383347,2022-07-18 19:44:07 -0700,2022-07-18 22:27:16 -0700,Images in hotmail emails won't show,"<p>This problem cropped up a few months ago. I've tried several remedies suggested online after doing Google and Bing searches, but nothing that involved registry changes.  The one thing that helped, if only partially and temporarily, was clearing out recent history, cookies and cache. (BTW, a cache-clearing extension I've used for years appears to not be doing anything.)   Emails that arrived for two or three days after that displayed images. Then, no more. </p><pre>Side effects of all that clearing out was several days of having to go through two-factor authentication on many sites and being bombarded with warning emails that someone logged in with my credentials, was that really me?  And, that last part kept happening on different devices I use regularly. </pre> <p>I have no such problem with Hotmail email using MS Edge or the Chrome browser. I have no such problem using Firefox with Gmail or Yahoo mail. I've used Firefox for many years and want to go on using it, but more and more I'm using one of the other browsers so I can see images in emails.  It appears Firefox has a long history of this type of problem.  </p><p>Any help will be appreciated. </p>",desktop;other;windows-10;,firefox,other,en-US,1520695;1520715;,s__anderson
1383346,2022-07-18 19:17:17 -0700,2022-07-18 19:25:50 -0700,get fake McAfee push notifications,<p>I keep getting fake push notifications from McAfee. I use Zone Alarm extreme  security which shows no viruses. They cannot help. McAfee advised to go through Firefox privacy settings as below </p><p>Click the menu button Fx89menuButton and select Settings. Click Privacy &amp; Security from the left pane. Scroll to the Permissions section. Click the Settings... button to the right of Notifications. Select Allow or Block from the Status drop-down for any of the websites. Click the Save Changes button.  Have done this but still getting fakes. Can anyone help please Harry </p>,desktop;privacy-and-security_1;windows-10;firefox-1020;firefox-10201;,firefox,privacy-and-security,en-US,1520680;,handspen
1383345,2022-07-18 18:44:24 -0700,2022-07-18 22:20:00 -0700,"Session Restore is once again greyed-out/unclickable, and I had a huge amount of tabs open.  It will take forever to figure out what even a fraction of them were, is it possible to try to restore them some other way.","<p>Any way to try to restore or at least get a list of what my suddenly unrestorable tabs were? I mean, aside from looking through every single item in my entire history and then trying to figure out whether I had already finished that project or not? </p><p>(I'll get old and die before I complete that.) </p><p>I had many many tabs open, in many many windows, and I discovered long ago (this is not necessarily a good thing:) that if you have the internet on your device shut off while you start firefox up, and while you session restore, though all the urls and the tabs and the windows reappear, none of the are actually loaded, they are just sitting there, and you need to reload each page/tab before the computer seems to use any ram (if that's the word) to run the page.  This unfortunately allows a distractable procrastinator like me to accumulate literally thousands of unfinished tabs, which I was of course going through one by one and closing, but I had tons and tons of them open still.    </p><p>When session restore suddenly no longer is an option, (it is greyed out, and not for the first time,) are there any other options?   </p><p>I hear mumblings from the web that imply there may be. </p><p>such as this? </p><p><a href=""https://www.jeffersonscher.com/ffu/scrounger.html?fbclid=IwAR172UESrZ1OHwugYV0KB-4lP0etZG7IyIx1IUCNn3kFLTWgN6EuL8RWLOc"" rel=""nofollow"">https://www.jeffersonscher.com/ffu/scrounger.html?fbclid=IwAR172UESrZ1OHwugYV0KB-4lP0etZG7IyIx1IUCNn3kFLTWgN6EuL8RWLOc</a> </p><p>anything else?  or do I have to just give up and start over? (and ON that note, how can I avoid this in the future, there must be some way in lieu of me actually finishing one thing before starting 100 more,) to avoid this? </p><p>p.s.   getting them back, somehow, would be what I desire, first. </p>",desktop;other;mac-os-x-1015;firefox-1020;firefox-10201;,firefox,other,en-US,1520681;1520713;,Robbins_in_California
1383343,2022-07-18 18:01:01 -0700,2022-07-18 22:54:18 -0700,Firefox paste is not working,"<p>Multiple times this has happened, and it recently started again. If I copy text or images and attempt to paste them into any website using Firefox, the paste does not work. Text will look like it is pasting an image, but there is some shadowy text behind it. When I click into the field where I pasted, the text/image that was pasted will disappear. </p><p>Pasting images is similar. The image pastes far too large and will disappear when clicking into the field where it is pasted. </p><p>This renders Firefox effectively non-functional for anything I need to do. I will have to use a different browser unless/until this is fixed. </p><p>I have rebooted. I have cleared cache and cookies. I REALLY don't want to reset and have to set up extensions again since this includes password managers, etc. I attempted to set dom.event.clipboardevents.enabled with no change. </p>",desktop;fix-problems;windows-10;,firefox,fix-problems,en-US,1520672;1520675;1520698;1520719;1520720;,sifuedition
1383341,2022-07-18 17:15:03 -0700,2022-07-19 06:25:59 -0700,Videos are not loading and Reddit is sometimes slow,"<p>Hey, Twitch dosnt work for me (error #4000) and neither do Reddit videos. Pictures and Youtube works and I could not find a solution online. Thank you for providing this awsome browser. please keep fighting for privacy. </p>",desktop;fix-problems;windows-10;firefox-1020;firefox-10201;,firefox,fix-problems,en-US,1520682;1520693;1520709;1520761;,franz.all
