id,created,updated,title,content,tags,product,topic,locale,answers,creator
1364187,2022-01-13 04:45:11 -0800,2022-01-13 10:40:30 -0800,Impossible to create new profile or utilize Firefox,"<p>Hi, After several issues with firefox not opening or loading websites properly, I attempted to do a clear reinstall of firefox. However upon installing I get the following series of issues which prevent firefox from working all together. </p><p>Upon starting up Firefox automatically opens the profile manager. On first attempt the ""Create Profile Wizard"" would not function all together. After manually adding the ""Mozilla"" and ""Firefox"" folders to %appdata% it will now open, however the following issues occur regardless of any attempt made on my behalf. </p><p>If attempting to save a new profile to the default location the following error occurs </p><p>Profile couldn’t be created. Probably the chosen folder isn’t writable. [Exception... ""Component returned failure code: 0x80520015 (NS_ERROR_FILE_ACCESS_DENIED) [nsIToolkitProfileService.createProfile]""  nsresult: ""0x80520015 (NS_ERROR_FILE_ACCESS_DENIED)""  location: ""JS frame :: chrome://mozapps/content/profile/createProfileWizard.js :: onFinish :: line 239""  data: no] </p><p>If attempting to save a new profile to a different location the following error occurs when trying to either start up OR quit firefox </p><p>An unexpected error has prevented your changes from being saved. </p><p>After a times.json file is created </p><p>I have tried running in administrator mode, safe mode, everything I could possibly think of, and at this point I am convinced I will never be able to use firefox again despite having loved the browser for over a decade Attempting to find help through the knowledge base has completely failed </p>",desktop;download-and-install_1;escalate;,firefox,download-and-install,en-US,1473631;1473632;1473641;1473651;1473663;1473666;1473669;1473673;1473688;1473689;1473690;1473692;1473697;1473754;1473785;,PrivateUser1
1364186,2022-01-13 04:32:21 -0800,2022-01-13 04:32:21 -0800,"Firefox 96 crashes made downgrade to 95.02 fail too, even after HTTP3 fix","<p>This is what I’ve already reported (via Twitter to @FirefoxSupport, see <a href=""https://twitter.com/quiet_listening/status/1481598382942703616"" rel=""nofollow"">https://twitter.com/quiet_listening/status/1481598382942703616</a>). Read several support threads, tried the http3 fix (as indicated via e.g. <a href=""https://support.mozilla.org/en-US/questions/1364124"" rel=""nofollow"">https://support.mozilla.org/en-US/questions/1364124</a>), but without any success. </p>",mac-os;desktop;fix-problems;firefox-950;,firefox,fix-problems,en-US,"",torkveen
1364185,2022-01-13 04:31:03 -0800,2022-01-13 04:31:03 -0800,Como debo configurar Firefox para que me descarge archivos *.CSV,<p>Buenos dias </p><p>Debo descargar frecuentemente unos archivos con la terminacion *.csv </p><p>No logro nunca conseguirlo ya que siempre me los descarga como *.htlm </p><p>Hay alguna manera de conseguirlo ??? </p><p>Muchisimas Gracias  </p><p>Javier </p>,desktop;customize;windows-10;firefox-960;,firefox,customize,es,"",javiertresanchez
1364184,2022-01-13 04:17:08 -0800,2022-01-13 09:00:36 -0800,visualizzazione di siti,"<p>Buongiorno, fino a ieri riuscivo a visualizzare come sempre i miei segnalibri. Da oggi alcuni di questi non si riescono ad aprire sulle pagine di Firefox mentre li posso usare nmormalmente su Google. ho provato a reimpostare l'accocunt ma non mi consente di inserire il codice di verifica poichè mi accetta solo cinque digitalizzazioni all'interno dell'apposit banda di scrittura. Vorrei cortesemente sapere come ovviare a questo inconveniente. Inoltre da ieri alcuni download non mi vengono completati. Ringrazio anticipatamente per la collaborazione rimanendo a disposizione per eventuali ulteriori informazioni. Buona giornata </p>",desktop;bookmarks;windows-10;firefox-960;,firefox,bookmarks,it,1473722;,wyatt1957
1364183,2022-01-13 04:01:55 -0800,2022-01-13 09:05:11 -0800,"Firefox cannot load websites but other browsers can, But if you wait for several minutes or an hour it works again.","<p>Hi,  I know this already Faqs about this problems: <a href=""https://support.mozilla.org/en-US/kb/firefox-cant-load-websites-other-browsers-can"" rel=""nofollow"">https://support.mozilla.org/en-US/kb/firefox-cant-load-websites-other-browsers-can</a> But the things is, it's not works at all. Even it could, it only for few minutes and the problems keeps appears. And oddly, If you ignore it for several minutes or an hour, Firefox suddenly can open websites again.  This problems keep appears in my 2 laptop.  I already try anything including reinstall firefox, and it's just temporal solutions. Can you check what actually happened? Cause this problems not only me but also the other users. I already ask my colleague and my friend, they have same problems, and the solution you give isn't working at all. Thank you. </p>",desktop;other;windows-10;firefox-960;incident13012022;,firefox,other,en-US,1473619;1473620;1473622;1473624;1473639;1473661;1473724;,nicolauscahyadi
1364182,2022-01-13 04:00:17 -0800,2022-01-13 04:26:42 -0800,My website doesn't work on firefox.,"<p>My website doesn't work on firefox. Please help me <a href=""http://bestanmassage.com/"" rel=""nofollow"">http://bestanmassage.com/</a>. </p>",desktop;websites;,firefox,websites,en-US,1473621;,gasohi8444
1364181,2022-01-13 03:59:24 -0800,2022-01-13 03:59:24 -0800,"MY FIREFOX SYNC NOT WORKS, ALL MY PASSWORD DATA AND LOGINS ISNT THERE.","<p>ALL MY LOGINS, HISTORY AND FIREFOX SYNC DATA I CANT RECOVERY, I DIDNT DELETED, A FEW HOURS AGO FIREFOX WAS CRASHED, I UNINSTALLED MY FIREFOX AND RE INSTALL, WHEN I WAS LOGIN MY FIREFOX ACCOUNT IT JUST SIMPLY NOT LOGIN, AFTER A COUPLE OF MINUTES FINALLY I CAN ENTER ON MY FIREFOX LOGIN BUT ALL MY DATA DISSAPEARED. I NEED URGENTLY A HELP, I HAVE IN ANOTHER COMPUTER A BACKUP, BUT IS FIREFOX 48, ALMOST ALL MY DATA ARE THERE, BUT IT CANT RE CONNECT TO FIREFOX SYNC, IT SIMPLY CANT RECONNECT. </p>",mac-os;desktop;sync;firefox-960;,firefox,sync,es,"",benadef
1364180,2022-01-13 03:57:13 -0800,2022-01-13 05:03:53 -0800,problem bookmarks,<p>Does not save bookmarks to a file. I have tried it many times but to no avail  while proceeding normally does not store anything </p>,desktop;bookmarks;windows-10;firefox-960;,firefox,bookmarks,en-US,1473638;1473640;,pantak20
1364177,2022-01-13 03:53:55 -0800,2022-01-13 03:53:55 -0800,actualizaciones a dispositivos móviles,"<p>Hola Gran Comunidad, mi pregunta es muy sencilla, acabo de recibir una actualización en el navegador de mi PC, y con ella una sugerencia para actualizar el navegador de mi móvil,  PERFECTO,  gran idea de actualizar el PC y sugerir lo mismo para el dispositivo de teléfono, pero?, ¿ustedes saben que hay una absurda prohibición para que ciertos dispositivos no puedan actualizarse desde Google?. Uno de ellos es el mío, es un huawei P40, y funciona de fábula, me gustaría que además sugieran la descarga de la APK desde otros sitios o que la mandaran directamente, para que los que no queremos depender del gran espia mundial podamos tener una alternativa para su descarga más fácil. Es una sugerencia, la política monopólica de Google no me gusta nada, y no le hace bien al mundo, incluido a ustedes mismos.  Un saludo cordial y. . . ¡¡¡a pensar a lo grande!!, no solo en que existen un par de proveedores de aplicaciones. Gracias. </p>",desktop;download-and-install_1;windows-10;firefox-960;,firefox,download-and-install,es,"",clauparodi
1364176,2022-01-13 03:44:44 -0800,2022-01-13 03:44:44 -0800,Access linked files on a webpage,"<p>Hello </p><p>When I try to access a document file from a link on a webpage, Firefox is requiring that I first save the file to my iMac. I do not want to do this, I only want to see the file (word document). This has only just started to occur since I recently upgraded my iMac to MacOS Monterey (12.1). </p><p>Can anyone let me know how to stop this happening? </p><p>Hamerdoon. </p>",mac-os;desktop;download-and-install_1;,firefox,download-and-install,en-US,"",Hamerdoon
1364173,2022-01-13 03:27:38 -0800,2022-01-13 12:58:53 -0800,Very odd fonts,"<p>Dear Community,  I love Firefox but here is how fonts now look like on my old MacBook Pro (v10.13.6). Why is this? How can I fix this?  My Firefox version is up-to-date.   As shown on the screenshots below, on Chrome fonts appear to be normal.  Thanks so much for your guidance! </p><p><br> </p><p>/moved thread from Firefox for iOS (for iPhone/iPad) to (desktop) Firefox section. </p>",mac-os;desktop;macos;,firefox,customize-firefox-appearance,en-US,1473603;,hrschindler
1364172,2022-01-13 03:15:46 -0800,2022-01-13 05:10:05 -0800,Download popup always LAG to click OK?,<p>The DOWNLOAD POPUP always has a lag before it lets you click OK WHEN NO DEFAULT download settings for that file type are set. VERY STRANGE could make a rationale for that with  .exe which CANNOT HAVE DEFAULT SAVE SETTINGS APPARENTLY? BUT ALL FILES?? That is insanity POPUP APPLICATION LAG TO CLICK OKAY WHAT IN FREAKING LUDICROUS MADNESS is that load of garbage AHA!! SOLUTION and customization options to fix that would be VERY NICE APPRECIATED FOR SURE. Thank </p>,desktop;download-and-install_1;windows-10;waterfox;firefox-780;,firefox,download-and-install,en-US,1473642;,westchester5
1364171,2022-01-13 03:15:23 -0800,2022-01-13 05:11:25 -0800,new upgrade eating a lot memory,<p>Hi after last upgrade the browser eating all the memory and cpu use about 90 how to fix it ? thanks Rami </p>,desktop;other;windows-10;firefox-960;,firefox,other,en-US,1473643;,ramiram8
1364170,2022-01-13 03:13:04 -0800,2022-01-13 09:08:52 -0800,firefox won't load,<p>without any kind of warning firefox stopped working this morning. not a single web page will load. i switched to edge and went back to the ff settings page to retrieve a login. there i saw an alert that my password for ff might have been compromised. i changed it in edge and now i'm signed out and clicking 'sign-in' just gives me the spinning wheel. any help would be much appreciated! </p>,desktop;websites;incident13012022;,firefox,websites,en-US,1473590;1473600;1473731;,tiburonfirst
1364168,2022-01-13 03:08:31 -0800,2022-01-13 09:08:10 -0800,unable to open website on to the latest version V96,"<p>We are able to open website on previous versions  older than 96. and facing below issue . </p><p>The page isn’t redirecting properly. This problem can sometimes be caused by disabling or refusing to accept cookies. </p><p>Also we check solution and applied as per your help portal but still facing same difficulty , please help regarding this . </p>",desktop;websites;needsinfo;windows-10;firefox-960;incident13012022;,firefox,websites,en-US,1473586;1473592;1473607;1473730;,pritam25deshmukh
1364166,2022-01-13 02:54:44 -0800,2022-01-13 02:54:44 -0800,Ripristino della sessione,"<p>Buongiorno. Solo recentemente quando riapro Firefox dopo avere visitato una o più pagine, compare <em>Siamo spiacenti, c’è un problema con il ripristino delle pagine. Si è verificato un problema durante il ripristino della sessione di navigazione. Selezionare “Ripristina sessione” per riprovare. </em> Continua a non funzionare? In alcuni casi il problema è causato da una scheda. Provare a visualizzare le schede precedenti, rimuovere la spunta dalle schede che non si desidera ripristinare e riprovare.<em> </em> Ho provato sia a ripristinare la sessione che a riaggiornare Fiefox senza esito, il problema si ripresenta. posso solo disinstallarlo e reinstallarlo ma temo di perdere i miei preziosi segnalibri. Cosa posso fare? </p>",desktop;other;windows-10;firefox-960;,firefox,other,it,"",riccardo.castiglion
1364165,2022-01-13 02:49:11 -0800,2022-01-13 04:59:01 -0800,Unable to restore backup bookmarks after having to refresh,"<p>Hi, i've tried reading the existing articles but i'm not very technical and don't understand most of it.  Firefox kept freezing and crashing this morning so I clicked the recommended Refresh, not realizing this would kill all my bookmarks.  I have tried to restore my bookmakrs (over5,000!) using the restore method, but I get an error message saying it cannot process the request - I really don't want to lose all my bookmarks but i'm struggling with the overly technical advice i've seen, can you help please? </p>",desktop;bookmarks;windows-10;firefox-960;,firefox,bookmarks,en-US,1473634;,cutex1701
1364164,2022-01-13 02:35:55 -0800,2022-01-13 02:50:59 -0800,Firefox suddenly stopped working,"<p>Please advise what I need to do to make Firefox work again. Have not changed any settings. I noticed it had stopped working as I was listening to radio via web, and there was sudden silence. Then discovered I could not update ANY websites, not just the one for the radio program. The web pages simply do not load, and they do not stop trying to load. However 0 wrong with internet connection, can browse without any problems using Microsoft (ugh). </p>",desktop;other;incident13012022;,firefox,other,en-US,1473561;1473570;,allison_muir
1364163,2022-01-13 02:31:22 -0800,2022-01-13 02:36:00 -0800,Websites do not load - Additional solution,"<p>Hi You can add an additional solution to the following page <a href=""https://support.mozilla.org/pl/kb/Firefox%20nie%20wczytuje%20witryn%20internetowych%20%E2%80%93%20inne%20przegl%C4%85darki%20tak"" rel=""nofollow"">https://support.mozilla.org/pl/kb/Firefox%20nie%20wczytuje%20witryn%20internetowych%20%E2%80%93%20inne%20przegl%C4%85darki%20tak</a> Websites did not load in Firefox. They loaded well in Edge. I turned off and turned on the computer - it did not help. It helped to turn off all cards (tab). It helped to turn off all cards. </p>",desktop;websites;windows-10;firefox-950;incident13012022;,firefox,websites,en-US,1473560;,krys76
1364162,2022-01-13 02:29:13 -0800,2022-01-13 02:29:13 -0800,Abrir archivos de Word nada más descargar pero no en modo Solo Lectura,"<p>Estimados amigos: Mi navegador puede descargar y abrir de forma automática archivos de Word (he visto cómo hacerlo y es sencillo). Sin embargo, una vez dentro de la aplicación Word, los archivos se abren en modo Solo Lectura. Me gustaría saber si hay alguna manera para hacer que los archivos descargados se abran de forma automática de manera normal (NO en modo Sólo Lectura), como ocurre con otros navegadores. Les agradezco mucho su atención y su ayuda. Atentamente, les deseo un feliz año. </p>",desktop;customize;,firefox,customize,es,"",fmelectronico
1364161,2022-01-13 02:24:43 -0800,2022-01-13 02:24:43 -0800,Screen flashes black,<p>When opening a new tab screen flashes black. Also when visiting sites Firefox opens in dark mode. </p>,desktop;other;windows-10;firefox-960;,firefox,other,en-US,"",donbill1803
1364160,2022-01-13 02:16:01 -0800,2022-01-13 05:31:41 -0800,"[LINUX] GeckoMain crazy CPU usage, behavior as if no internet access","<p>A few days ago there was a Firefox update and this morning suddenly GeckoMain started (out of nowhere) using the CPU at 80% (which lead to the CPU fan going nuts). I opened the gnome system monitor and it showed that GeckoMain was overusing the CPU. There's also a process running called ""Privileged Content"". For as long as this additional process is running, Firefox is behaving as if there were no internet access - infinite time to load any page and if left undisturbed, after a while Firefox closes with a crash message. Also, for as long as this problem is happening, simply closing Firefox with the X button doesn't close it - GeckoMain is still running and the only way to actually close the browser is ""killall GeckoMain"". So I removed all extensions one by one in order to make sure it's not an extension causing this. It's not. Even after removing all extensions the problem continued which lead me to believe something in my prefs.js is causing it. There were so many things modified in about:config over the years that I have no idea which one might be causing the problem. I have uploaded the prefs.js file here, so that you can review it, if needed: <a href=""https://drive.google.com/file/d/1j-EAaeBrcawRfzrIr4n9Pg6IyvM9zROV/view?usp=sharing"" rel=""nofollow"">https://drive.google.com/file/d/1j-EAaeBrcawRfzrIr4n9Pg6IyvM9zROV/view?usp=sharing</a> </p><p>At the moment I'm writing this question through Waterfox bc Firefox is unuseable with this problem. </p>",linux;desktop;fix-problems;incident13012022;,firefox,fix-problems,en-US,1473535;1473653;,rado84
1364158,2022-01-13 02:05:18 -0800,2022-01-13 02:10:47 -0800,collegamento internet,"<p>Il mio collegamento internet funziona, ricevo e invio posta e gli altri browser che ho provato (Safari, Chrome) vanno normalmente. Firefox invece non riesce a collegarsi a nessun sito. Sto provando da 2 ore, ho provato a riavviare il sistema 2 volte, ma niente da fare! Rimane all'infinito bloccato sull'immagine dello schermo che allego </p>",desktop;websites;,firefox,websites,it,1473529;,golem999
1364157,2022-01-13 02:03:32 -0800,2022-01-13 02:03:32 -0800,PDF print issues,"<p>Hi, in recent Firefox updates in debian testing (and in recent developer edition), when I try to print a PDF the page number is just in border and don't get printed. I try almost all things i found related in about:config. </p><p>Also in export to file, now don't strore previous location and always point to ~/mozilla.pdf is a problem, user need to change for a path each print to pdf. Also in debian the file explorer opened dont show recent files can help. </p><p>Thanks so much for your help. </p>",linux;desktop;other;firefox-910;,firefox,other,en-US,"",jabiertxof
1364155,2022-01-13 01:49:29 -0800,2022-01-13 02:52:09 -0800,Firefox 96.0 unstability under Mac,"<p>Hello, </p><p>I work as IT Support admin and I manage de Mac software &amp; update deployments. </p><p>I deployed the 96.0 yesterday and a good portion of our users are experiencing issues (Macs only): </p><p>We have an infinite loading on every pages we try to open. And must force quit the App. From time to time it looks like its working back again for a while, but then it occurs again. Sadly I haven't found a way to trigger the problem on the demand in order to pinpoint the origin. </p><p>according to this post :<a href=""https://www.spinics.net/lists/fedora-devel/msg296180.html"" rel=""nofollow"">https://www.spinics.net/lists/fedora-devel/msg296180.html</a> It may be an infinite loop in the HTTP3 protocol. </p><p>I had trouble finding information on this problem.  </p><p>Any more clue about this ? </p>",desktop;fix-problems;incident13012022;,firefox,fix-problems,en-US,1473527;1473572;,draawa
1364154,2022-01-13 01:49:02 -0800,2022-01-13 02:18:52 -0800,Stuttering videos on some websites,"<p>Whenever I try to play a video in Firefox, the video seems a bit laggy/it stutters. This is very annoying since it makes me impossible to watch a movie online. This, for some reason, doesn't happen on youtube. The thing that it's strange to me, it's that this issue is more noticeable on some websites than others and that the intensity of the micro lag varies depending on the website. </p><p>I already tried running Firefox in safe mode and disabling hardware acceleration in about:preferences, and I'm sure it's not a bandwith issue since I tried it with multiple connections up to 70Mbps DL. </p><p>I'm running Firefox 95.0.2 (RPM version) on Fedora 35, if that helps </p>",linux;desktop;other;firefox-950;firefox-9502;,firefox,other,it,1473528;1473537;,firefox.brie
1364153,2022-01-13 01:45:35 -0800,2022-01-13 01:47:54 -0800,Firefox freezing after update to 96.0,"<p>My Firefox updated to 96.0 yesterday. Since then it freezes frequently apparently checking for updates; no pages load during the freeze. After some time it decides it is up to date and Firefox starts working again, only to start checking for updates again after a few minutes and freezing again.  A second installation on a laptop (also Windows 10) is behaving exactly the same. How do I resolve this? Thank you. </p>",desktop;fix-problems;,firefox,fix-problems,en-US,1473521;,a.g.parker
1364152,2022-01-13 01:42:36 -0800,2022-01-13 05:17:49 -0800,Blocked by Content Security Policy  This page has a content security policy that prevents it from being loaded in this way.  Firefox prevented this page from loading in this way because the page has a content security policy that disallows it.,<p>Blocked by Content Security Policy </p><p>This page has a content security policy that prevents it from being loaded in this way. </p><p>Firefox prevented this page from loading in this way because the page has a content security policy that disallows it. </p>,windows-xp;desktop;sync;firefox-520;,firefox,sync,en-US,1473648;,mdmasum5482
1364151,2022-01-13 01:38:56 -0800,2022-01-13 13:06:05 -0800,importing a csv file for password.,<p>when there is an option to export a .csv file. for password... then why have you complicated the option to import that same csv file. </p><p><br> I have used Firefox for 18 years... now i think its time to find something else. </p>,desktop;other;windows-10;firefox-960;,firefox,other,en-US,1473526;1473668;,shukshok
1364150,2022-01-13 01:37:23 -0800,2022-01-13 03:34:50 -0800,Firefox doesn't know it's online anymore,"<p>Firefox has no idea it's online anymore. It just pretends it's working. </p><p>This started a short time ago. I had walked away from my system for a bit (which I do frequently throughout the day with no issues). When I returned, Firefox didn't know it was online. I tried Waterfox, it worked fine. Well, I need Firefox, so I closed out of Firefox to reboot it. It briefly worked for one page. Then it promptly forgot it was online. </p><p>I rebooted the entire system. Firefox boots but otherwise is completely unresponsive to typing URLs, choosing URLs from bookmarks or favorites or whatever. I'm now writing this through Waterfox. But I can't use Waterfox because I'd have to import every last password, every last everything. I can't work this way. </p><p>What's wrong with Firefox? Why doesn't it know how to do anything online anymore? It doesn't give an error message, it just sits and pretends it's doing something, but it does nothing. </p><p>I have hours of work and no way to do anything. I don't know how to recover Firefox from this mess. </p><p>I can't even begin to guess at the Firefox version here because it's attempting to update, which of course it can't because it doesn't remember it's online. It should be the latest one as of sometime earlier, no idea when. It updates automatically. </p><p>Thank you for your time. </p>",desktop;other;windows-10;incident13012022;,firefox,other,en-US,1473525;1473556;1473557;1473601;1473606;,Beadmaster
1364148,2022-01-13 01:35:11 -0800,2022-01-13 10:37:23 -0800,I lost all my tabs,"<p>So my browser pages weren't loading so I went to my windows 10 settings app and went to ""Apps"" and then I clicked on FireFox to uninstall it but it gave me an option to ""Refresh"" it and so I did that and it fixed the issue I was having but ALL my tabs are gone and I NEED them back. Please tell me there's a way to get them back. I think I even had important ones to. ;-; ;'( </p>",desktop;tabs;windows-10;firefox-960;,firefox,tabs,en-US,1473604;1473617;1473637;1473678;1473783;,careygrant346
1364147,2022-01-13 01:21:39 -0800,2022-01-13 04:36:12 -0800,Firefox does not connect to any website and crashes on exit,"<p>Firefox 96 cannot connect to any website, even in local network or to send crash reports. One of Firefox processes constantly loads 1 cpu core. On trying to close Firefox, crash happens. </p><p>Error persists even in Troubleshooting mode, with new profile and reinstalled Firefox. With older Firefox 88 I don't have this problem. </p><p>Environment: Windows 10, Firefox 96.0 </p>",desktop;fix-problems;incident13012022;,firefox,fix-problems,en-US,1473505;1473515;1473593;1473627;,i-anony
1364146,2022-01-13 01:19:27 -0800,2022-01-13 09:09:17 -0800,Firefox wont work anymore,"<p>After I had some problem with wifi I restarted my laptop, all other browsers work but Firefox.. I restarted it several times but nothing changed. when lunched it does not load webpages. hangs </p>",desktop;fix-problems;incident13012022;,firefox,fix-problems,en-US,1473509;1473598;1473732;,giansays
1364145,2022-01-13 01:19:25 -0800,2022-01-13 09:05:43 -0800,"Firefox doesn't load any pages, crashes on restart.","<p>So firefox doesn't load any webpages, can't check for updates and when I try to open it in Troubleshooting mode it crashes (or when i try anything that requires a restart such as clearing startup cache, Refresh Firefox etc. , it crashes). It also crashes when quitting with Command + Q. </p><p>What I have tried: Basically everything stated in this article: <a href=""https://support.mozilla.org/en-US/kb/firefox-cant-load-websites-other-browsers-can"" rel=""nofollow"">https://support.mozilla.org/en-US/kb/firefox-cant-load-websites-other-browsers-can</a> </p><p>I also saw that firefox can't check for updates, so I'm guessing it can't connect to the internet? (Other browsers work fine: Safari, Chrome) </p><p>OS: MacOs 12.1 Monterey CPU: Apple M1 Pro 8C/14C RAM: 16GB </p><p>I don't have MacOS or any firewall active. </p>",desktop;websites;firefox-960;incident13012022;,firefox,websites,en-US,1473502;1473504;1473613;1473616;1473645;1473725;,lecezar2014
