id,created,updated,title,content,tags,product,topic,locale,answers,creator
1371429,2022-03-18 06:25:27 -0700,2022-03-18 06:25:27 -0700,"Firefox block istalation of addon: ""Browsing protection by F-Secure""","<p>Hello, </p><p>today Firefox blocked istalation of addon: ""Browsing protection by F-Secure"", because it thiks it's a risky addon. I'm usuing F-Secure and Firefox together for many years and I never had that kind of situation. </p><p>Can someone help me with this problem? </p>",desktop;customize;windows-10;firefox-980;,firefox,customize,en-US,"",jakub.muszynski
1371426,2022-03-18 06:15:18 -0700,2022-03-18 06:15:18 -0700,warning that firefox will redirect,"<p>After the last update, Firefox could not open directly a new link that I had clicked. It opens a new tab with a message (in my language it sound similar, but not sure for the proper words in english): ""Worning for redirection""     The page that you you have beed is trying to send you to ............. If you don`t want to continue you can go back to the previous page. </p><p>Please, how to miss this step and when clicking to open directly the link? </p>",desktop;websites;windows-10;firefox-980;,firefox,websites,en-US,"",lei1
1371424,2022-03-18 06:10:11 -0700,2022-03-18 06:10:11 -0700,Firefox desktop,<p>how do I delete unwanted sponsors on my firefox desktop? </p>,desktop;other;windows-10;firefox-980;,firefox,other,en-US,"",BJHarvest
1371423,2022-03-18 06:06:26 -0700,2022-03-18 06:06:26 -0700,Whatsapp no Firefox,"<p>Olá, depois desta última atualização do Firefox (98.0) o whatsapp web parou de funcionar. Continua funcionando no chrome e em outros navegadores, menos no Firefox. Alguma solução??? </p>",desktop;fix-problems;windows-10;firefox-980;,firefox,fix-problems,pt-BR,"",silvadozse
1371422,2022-03-18 06:00:59 -0700,2022-03-18 06:00:59 -0700,Direct import endnote,"<p>I've long used firefox for research using google scholar and science journals to directly import references into endnote. However, since the recent update (firefox v98) direct import of .ris files (endnote) is no longer possible. The only option is to download the file.  </p><p>There is no option to configure these file extensions in settings, and no prompt asking how to handle them...only where to download. </p><p>Please recover this function, as firefox is becoming increasingly unusable (loyal firefox user since 2002). </p>",desktop;other;windows-10;firefox-980;,firefox,other,en-US,"",Roz123
1371420,2022-03-18 05:49:13 -0700,2022-03-18 05:49:13 -0700,NS_BINDING_REDIRECT error while logging onto my college proxy login portal,"<p>I have to use college proxy server to access the college network. After setting system proxy settings, we have to login at an online college proxy portal before being able to use their internet. Most of the times, the login portal is accessible via HTTP protocol, and when logging in, the form submits a POST request to their server and gets redirected to a ""login_success"" page, always via HTTP protocol. But every once in a while, when accessing the login portal through HTTP protocol, it redirects to the same URL but using HTTPS protocol, and when you try to login, the POST request fails with NS_BINDING_REDIRECT error, probably because it gets redirected to ""login_sucess"" page with HTTP protocol. No such error is raised on chromium, and I am able to login without any problem there. Any help would be much appreciated. </p><p>TLDR: NS_BINDING_REDIRECT error when logging at an online portal, since the login page uses HTTPS protocol, and successful login attempt via POST redirects to a success page using HTTP protocol. </p>",linux;desktop;websites;,firefox,websites,en-US,"",TinyTrebuchet
1371419,2022-03-18 05:22:33 -0700,2022-03-18 05:22:33 -0700,Trying to view Document in PDS and it opens it up to save after correcting several times.,"<p>Hello, Over the last few weeks when I try to click on a Document in an Email or web page.  The SAVE box appears.  I correct it in SETTINGS/APPLICATIONS to ALWAYS ASK.  I have changed it about 6 times in the last week.  It seems like each time I try to open a document the settings have changed. </p><p>Please advise as to have this to cease occurring. </p>",desktop;customize;windows-10;firefox-980;,firefox,customize,en-US,"",Mphilking
1371418,2022-03-18 05:04:12 -0700,2022-03-18 05:04:12 -0700,"Verify integrity: ""Unable to complete the coherence check""","<p>Hallo! </p><p>I run Firefox ESR 91.7.0 (64 Bit) on Debian GNU/Linux 11. When running ""Verify integrity"" in about:support, this is the output: </p><p>&gt; Task: checkIntegrity + The places.sqlite database is sane + The favicons.sqlite database is sane &gt; Task: invalidateCaches + The caches have been invalidated &gt; Task: checkCoherence - Unable to complete the coherence check &gt; Task: expire - The task queue was cleared by an error in another task. &gt; Task: originFrecencyStats - The task queue was cleared by an error in another task. &gt; Task: vacuum - The task queue was cleared by an error in another task. &gt; Task: stats - The task queue was cleared by an error in another task. &gt; Task: _refreshUI - The task queue was cleared by an error in another task. </p><p>It seems the integrity verification gets stuck at the coherence check. But I do not find any information what this coherence check does, if it should worry me that it cannot be completed and what I can do to fix the problem (if it is a problem). Any ideas? </p>",linux;desktop;fix-problems;,firefox,fix-problems,en-US,"",theltalpha
1371417,2022-03-18 04:48:10 -0700,2022-03-18 04:48:10 -0700,Prevent installation of Rapid Release over Extende Service Release?,"<p>Hi, </p><p>I have to use the Extended Service Release (ESR) version of Firefox on Windows 10 x64. However I noticed that a software update tool that is outside of my control started updating Firefox recently but unfortunately to the Rapid Release version. I was able to downgrade but I would like to prevent this in the future. Is there a way to enforce ESR? </p>",desktop;download-and-install_1;,firefox,download-and-install,en-US,"",reibuehl
1371416,2022-03-18 04:44:59 -0700,2022-03-18 04:44:59 -0700,Keeping history when updating firefox,"<p>This is more about feedback rather than a question. I am unable to find a place to post feedback here, let me know if there is a better place to post this. I want to direct this to the developers, but would also welcome discussion from other users. </p><p><strong>Background</strong> I am a user that usually keeps a lot of tabs and windows open. It is important to me that this is restored from last session when starting firefox. </p><p>When closing firefox with more windows than it will remember then the excess windows will be discarded without any warnings. Default seems to be 3 from about:config </p><p><strong>Short term solution</strong> I think users should get a very clear message when closing firefox that it will be unable to restore the complete session later on restart. I believe this behavior is unexpected for all or most users. </p><p><strong>Better solution</strong> The much better option here is to NOT discard session history for windows on close. ALL windows closed should be reopened without any hidden limitations inside about:config If i didn't have any very specific order in which i opened my windows then it means that the order was random, in which case firefox is discarding windows at random for later restart. </p><p><strong>about:config lost on update?</strong> <a href=""https://chantheacce71.blogspot.com/2022/03/why-does-mozilla-firefox-keeps-losing.html"" rel=""nofollow"">https://chantheacce71.blogspot.com/2022/03/why-does-mozilla-firefox-keeps-losing.html</a> &gt; When i update firefox then part of this history seems to get lost. </p><p>It's hard to recreate or to find reliable sources on this but it seems like about:config may be reset on firefox update. In which case the value is going back to 3 and all excess windows are lost even if i increased the value earlier. I recently experienced this, and it's not the first time. </p><p>If the solutions above are not used then it would be good if firefox could avoid resetting this value as the result can be disastrous. </p><p>Last time i was unable to get my window history back. i checked my sessionstore-backups and it was not there. </p>",desktop;other;windows-10;firefox-980;,firefox,other,en-US,"",chr_414
1371415,2022-03-18 04:44:54 -0700,2022-03-18 04:44:54 -0700,Certificate Based Authentication and SmartCard requirements,"<p>Hello, </p><p>We are using Firefox on macOS to access web services that require Certificate Based Authentication. Our certificates are stored on YubiKeys PIV slots. </p><p>If we plug the token, open Firefox and access the website, it works just fine. The Certificate picker is shown and the OS ask for the PIV PIN to validate the access. </p><p>However, if we do the request when the token isn't plugged, Firefox does not ask for it, the website deny the authentication and the context is kept in cache. Requesting again the web site with the token added in between does not restart the certificate lookup and we are forced to close Firefox or move to a private window to make it works. </p><p>What is the proper way to avoid this issue? Is it a known bug? Is there a way to configure Firefox to always show the certificate picker even if no certificate are found and then reload the list of certificate based on connections events? </p><p>Thanks </p>",desktop;privacy-and-security_1;,firefox,privacy-and-security,en-US,"",ygini
1371413,2022-03-18 04:22:56 -0700,2022-03-18 04:22:56 -0700,sms Texting from desktop computer,"<p>My phone is not connected to the Internet. Is it still possible to text from computer? My phone is an 'old folks' phone, I can receive a text but am unable to reply to it. </p>",desktop;tips;windows-10;firefox-980;,firefox,tips,en-US,"",jandypandy100
1371411,2022-03-18 04:16:56 -0700,2022-03-18 04:16:56 -0700,"""Performing a TLS handshake...""","<p>Hi ! For a few days now I have a problem with some websites not opening, or opening very slowly with the message “performing a TLS handshake”. Other websites open without any problem. As an alternative, I use Opera, and there are no problems at all. OS is Windows 10. </p><p>I noticed for a while now that Firefox took some time to start. Then websites started to open very slowly, sometimes not at all, and then regularly the TLS handshake message was displayed. I checked for solutions, tried practically everything, but problem persists. I use the default theme, don't have extensions or add-ons I don't have any anti-virus, other than Windows Defender, integrated in Windows 10. I cleared several times the cache. History and cookies are regularly deleted when I close Firefox. I set the DNS to Google's DNS, primary 8.8.8.8, secondary 8.8.4.4. I disabled Ipv6. Renamed cert9.db, and with restart created a new file (it was cert9, and not cert8, as indicated in some posts) Started Firefox in safe mode. I performed a scan with Malwarebytes. I tried all the troubleshooting indicated on several support forums and websites. Yesterday I created a new profile. This morning I uninstalled and reinstalled Firefox. Don't know what else to do. </p><p>The profiles: There are 7 old profiles with date 12/03/2022, 19:41. Were they all set to this date by an update? One profile is displayed with yesterday's date 17/03/2022, 20:42 . This was the former active profile. I created a new profile yesterday evening, but it is displayed today with 18/03/2022, 08:12 . Maybe I did a refresh, don't remember... Another profile, “xxx.default-release”, is shown with today's date 18/03/2022, 08:41 . The newest profile, “xxx.default-release-xxxxx”, probably created with the new installation, changes its time stamp continuously and displays, when I open or close Firefox, the current hour and minutes.  Is this normal or maybe an indication that something is wrong? </p><p>Anyway... any hints how tho solve this issue? Thanks in advance Michael </p>",desktop;fix-problems;,firefox,fix-problems,en-US,"",micha.hoelt
1371409,2022-03-18 03:49:11 -0700,2022-03-18 03:49:11 -0700,sincronizzazione scorciatoie pagina iniziale errata,"<p>Firefox non memorizza più il mio ordine delle scorciatoie che ho selezionato. Per anni è sempre andato bene, fra un desktop e un notebook,  adesso che ho copiato i dati su un altro notebook ha creato un altro ordine di scorciatie che non voglio. Sostituendo la cartella in appData - roaming mi ripristina il mio ordine, ma poi quando spengo e riaccendo il computer o i notebook ritorna la selezione sbagliata. </p>",windows-7;desktop;sync;firefox-980;firefox-9801;,firefox,sync,it,"",ling.noi.x
1371408,2022-03-18 03:45:44 -0700,2022-03-18 05:57:56 -0700,google no funciona,"<p>Hace dos días que no me funciona el google desde firefox. Me dice que hay un problema de seguridad del mismo google. En otros navegadores sí que me funciona.  Dice esto: </p><p>No se ha conectado: Posible problema de seguridad Firefox ha detectado una potencial amenaza de seguridad y no ha continuado a <a href=""http://www.google.com"" rel=""nofollow"">www.google.com</a> porque este sitio web requiere una conexión segura. ¿Qué puede hacer al respecto? <a href=""http://www.google.com"" rel=""nofollow"">www.google.com</a> tiene una política de seguridad llamada HTTP Strict Transport Security (HSTS), que significa que Firefox solo puede conectarse a él de forma segura. No puede añadir una excepción para visitar este sitio. El problema está probablemente en el sitio web, y no hay nada que pueda hacer para resolverlo. Si está en una red corporativa o utilizando un antivirus, puede ponerse en contacto con el equipo de asistencia para obtener ayuda. También puede notificar el problema al administrador del sitio web. </p>",desktop;websites;windows-10;firefox-980;firefox-9801;,firefox,websites,es,1490479;,cagicap
1371407,2022-03-18 03:42:24 -0700,2022-03-18 03:59:16 -0700,Privacy: Firefox Knows User Account Name,"<p>Firefox is a very private browser, and that is why I like it. But recently, when I was pairing my Android Firefox with my Mac Firefox, Firefox asked me whether I want to confirm pairing. This all worked fine, but I noticed that Firefox mentioned the home folder of the account on my mac on which it was installed to identify that Firefox instance running on my Mac. This home folder is the name of my user account, which is my actual name. So Firefox has access to and is in some sense broadcasting my actual name over the internet. I understand that this might be only viewable by me and encrypted, so not even viewable by Firefox itself let alone the public internet (and I hope my understanding is correct and this is indeed the case--correct me if I am wrong), but it was still disconcerting that ""metadata"" like this is floating around the internet which can easily identify someone even if he goes to great lengths for privacy. </p>",mac-os;desktop;privacy-and-security_1;firefox-980;,firefox,privacy-and-security,en-US,"",rbjones111960
1371405,2022-03-18 03:40:10 -0700,2022-03-18 04:27:35 -0700,Video playback not working,"<p>For a few days now, I have not been able to play videos. I get this message in the video screen: ""If playback doesn’t begin shortly, try restarting your device."" When I opened Firefox in Troubleshooting mode, the video played OK and then when I stopped Troubleshooting mode the videos continued to play OK. However, on the next day the problem reappears. What's going on? Thanks in anticipation, Frank </p>",desktop;beta;fix-problems;windows-10;firefox-990;,firefox,fix-problems,en-US,1490473;1490474;,callfrankplumber
1371404,2022-03-18 03:28:57 -0700,2022-03-18 03:28:57 -0700,Firefox tab crashing always and only on Gmail and Youtube,"<p>Hi all, i have a Firefox 98.0.1 on Linux Mint 20.3 Cinnamon. It's been running perfect but since yesterday when i try to visit <a href=""http://accounts.google.com"" rel=""nofollow"">accounts.google.com</a> to log in to Gmail or visit <a href=""http://youtube.com"" rel=""nofollow"">youtube.com</a> the tab always crashes. The tab crashes as soon as the site is loading so i'm not even entering anything. I have Windows 10 running on the same machine, problem does not occur there. I also have Chromium on Linux, problem does not occur. </p><p>I have tried clearing cache, disabling all plugins, disabling hardware acceleration, creating new profile, refreshing Firefox, running Firefox in troubleshooting mode, completely removing Firefox including hidden files. </p><p>I yesterday had a problem with the file system or something. A black screen showed some error message, i quickly googled it, typed in something like sdfk or sfdk and it repaired something broken on the hard disk i guess... </p><p>All crash reports have the signature ""_dl_relocate_object"" </p><p>Can anyone help? I've submitted a crash report with the ID 1bb292d9-61e5-4af1-942d-b5bee0220318 Thanks </p>",linux;desktop;fix-problems;firefox-980;,firefox,fix-problems,en-US,"",zinnamon
1371403,2022-03-18 03:27:30 -0700,2022-03-18 06:02:47 -0700,seleccionar certificados instalados,"<p>Tengo varios certificados instalados en el navegador, son de distintas empresas. El navegador recuerda el último certificado usado y no puedo logearme en una página pública con otro usuario porque no puedo seleccionar otro certificado y firefox no me saca la lista de certificados instalados para que seleccione el que necesito. No encuentro en configuración la opción de que el navegador me pregunte que certificado quiero usar. Cuando entro en ajustes y seguridad en Administración de Certificados no encuentro ninguna acción para que el navegador me permita seleccionar el certificado que necesito </p>",desktop;privacy-and-security_1;windows-10;firefox-980;,firefox,privacy-and-security,es,1490482;,guatizit
1371402,2022-03-18 03:24:13 -0700,2022-03-18 03:25:22 -0700,Secure Websiet Error,"<p>Hello, firstly I am not certain if I am posting in the right thread. Actually my website <a href=""https://daniryguide.com/"" rel=""nofollow"">https://daniryguide.com/</a> <a href=""https://daniryguide.com/"" rel=""nofollow"">https://daniryguide.com/</a> SSL remains valid for a certain period. The certificate with the validity date doesn't match my laptop date. I am confused about whether my website is secure? I am using a free version of SSL but I am not certain if the issue is due to free SSL or something else. </p>",desktop;privacy-and-security_1;,firefox,privacy-and-security,en-US,1490465;,daniwrites109
1371401,2022-03-18 02:45:49 -0700,2022-03-18 03:25:10 -0700,download automatici no nricheisti,<p>dopo l'ultimo aggiornamento i download sono automatici su PC.  A nulla serve specificare di chiedere sempre. Come eliminarli? </p>,desktop;download-and-install_1;windows-10;firefox-980;,firefox,download-and-install,it,1490464;,sara.bogialli
1371400,2022-03-18 02:19:01 -0700,2022-03-18 02:19:01 -0700,Still no Autofill outside USA??,"<p>I'm becoming increasingly frustrated by the lack of Address Autofill in Firefox for people outside USA. I mean physical street address, telephone, etc Every time I fill in a form online that requires phone number or street address, I have to go &amp; open my Contacts App &amp; locate my mobile number, or manually type everything. For a modern browser its an essential feature that is sorely lacking. </p><p>This article explains at the top that address autofill is limited to people in the US. <a href=""https://support.mozilla.org/en-US/kb/automatically-fill-your-address-web-forms"" rel=""nofollow"">https://support.mozilla.org/en-US/kb/automatically-fill-your-address-web-forms</a> </p><p>For the rest of the planet, we have no autofill section in the privacy settings. </p><p>HOWEVER: I have enabled this feature using about:config to attempt to use it, using the testing section mentioned on this page: <a href=""https://wiki.mozilla.org/Firefox/Features/Form_Autofill#Feature_Availability"" rel=""nofollow"">https://wiki.mozilla.org/Firefox/Features/Form_Autofill#Feature_Availability</a> </p><p>This then lets me access the autofill settings &amp; enter my name, address, postcode, tel, etc - but this just doesn't work on any website, I dont see any suggestions when I fill in forms. ~ or perhaps I am doing something wrong? In the `extensions.formautofill.supportedCountries` config I have US,CA,UK,GB Just adding UK didnt seem to work, so I added GB as well, but still no suggestions. </p><p>Is there any way to get this working? Why are Mozilla not supporting other countries? Is there an alternative extension I can use? </p><p>Thanks! I am using Firefox 98 </p>",linux;desktop;privacy-and-security_1;firefox-980;,firefox,privacy-and-security,en-US,"",riquez
1371398,2022-03-18 01:35:37 -0700,2022-03-18 02:16:26 -0700,Firefox 98 options for downloads / security warnings,"<p>I just updated from Firefox 96 to 98. This introduced the following problems: </p> <ul><li> all known file types were set to ""save file"" (so I had to go through the whole list and reset it back to ""always ask"" for like 30+ file types </li><li> downloading an unknown file type for the first time gets automatically set to ""save file"" instead of ""always ask"" </li></ul> <p>and the most annoying issue: </p> <ul><li> selecting ""open with.."" in the ""always ask""-triggered what-to-do-dialog (e.g. to open a PDF in okular, or an ICA file with citrix) produces a warning popup ""&lt;the file&gt; is an executable file. Executable files may contain viruses or other malicious code that could harm your computer. Use caution when opening this file. Are you sure you want to launch"" (even for JPG) </li></ul> <p>I tried closing Firefox, deleting handlers.json, but this behavior did not change. </p>",linux;desktop;other;firefox-980;v98-download;,firefox,other,en-US,1490460;,My_unique_username
1371397,2022-03-18 01:30:34 -0700,2022-03-18 01:30:34 -0700,Changing browsers,<p>Changing browser from Duck Duck Go   to Firefox so I can use VPN I just bought. </p>,desktop;other;windows-10;firefox-980;,firefox,other,en-US,"",davgflo
1371396,2022-03-18 01:26:07 -0700,2022-03-18 02:03:37 -0700,Re: Dialog box that offers to save or open email attachment,"<p>I use ""always ask"" for mp4 files in gmail - it used to work fine, but now it opens file if I select MS Media player AND IT SAVES the blasted file to my Downloads as well ! ....which I don't want it to do. </p><p>please fix </p>",desktop;customize;windows-81;firefox-980;v98-download;,firefox,customize,en-US,1490458;,dra42841
1371395,2022-03-18 01:24:48 -0700,2022-03-18 01:24:48 -0700,FF settings get reset by themselves,"<ol><li> Default home page keeps getting reset to ""Browser default"" every day or two. </li><li> The search engine choice keeps defaulting ""Browser default"" and goes to Yahoo. My preference is Google. </li></ol> <p>Earlier someone said that one of the Add-ons might be causing this and that i should disable all of them and try.  No improvement. It still keeps happening.  </p><p>I even re-installed FF to no avail. </p><p>Can someone help sort this out?  </p><p>Many thanks. </p>",mac-os;desktop;privacy-and-security_1;firefox-980;,firefox,privacy-and-security,en-US,"",CSBalachandran
1371394,2022-03-18 00:46:00 -0700,2022-03-18 00:47:25 -0700,address bar's search engine dropdown menu?,"<p>hi all! </p><p>how can i add the choose search engine dropdown menu in the address bar? now it only shows results from whichever search engine i choose as the default, eg google, from firefox prefs. Even though i have around 6 others chosen as alternative engines. Foe example, i often wish to quickly switch to wikipedia ,or duckduckgo search, etc. </p><p>thanks for your help! </p>",mac-os;desktop;tips;firefox-780;,firefox,tips,en-US,1490447;,coatli
1371393,2022-03-18 00:23:30 -0700,2022-03-18 03:56:56 -0700,Sito bloccato,"<p>Buongiorno, mi trovo momentaneament all 'estero pertanto utilizzo una rete wifi diversa dal solito. </p><p>Se provo a collegarmi a specifici siti, ad esempio <a href=""https://on.eviivo.com/suite/diary"" rel=""nofollow"">https://on.eviivo.com/suite/diary</a> non posso effettuare l'accesso. </p><p>Perfavore aiutatemi a rimuovere eventuali blocchi etc.. </p><p>Grazie Stefano </p>",mac-os;desktop;websites;firefox-980;,firefox,websites,it,1490466;1490470;,tonelli.pg
1371392,2022-03-18 00:20:24 -0700,2022-03-18 00:20:24 -0700,macOS: Firefox using Microphone without active Tab/Add-On and granted permission,"<p>It looks like Firefox on macOS is constantly accessing my microphone or ""polling"" it. The orange microphone indicator is flashing in random intervals although I haven't granted microphone permissions to any website. There are also no open tabs which actively requested microphone permissions. </p><p>I'm not sure if Add-Ons can request mic access but apart from ""Access your data for all websites"" there are no comparable granted permissions for any Add-Ons. I can provide a list of installed Extensions if needed. </p><p>macOS: Monterey 12.3 Firefox: 98.0.1 </p>",mac-os;desktop;privacy-and-security_1;firefox-980;,firefox,privacy-and-security,en-US,"",ff81
