id,created,updated,title,content,tags,product,topic,locale,answers,creator
1344086,2021-07-16 22:17:24 -0700,2021-07-16 22:17:24 -0700,Firefox window display offset on linux,"<p>Sometimes when I start Firefox maximized. The whole window has an offset on the display (to the mouse). </p><p>So you have to click as if the window would be over the full display height, but it starts lower. </p><p>Clicking on windowed, does correct the problem, then you can maximize again (Which also works) </p><p>See <a href=""https://www.youtube.com/watch?v=2tnyxVwpC0E"" rel=""nofollow"">https://www.youtube.com/watch?v=2tnyxVwpC0E</a> </p>",linux;desktop;fix-problems;firefox-890;,firefox,fix-problems,en-US,"",jo.spam89
1344084,2021-07-16 22:07:34 -0700,2021-07-16 22:21:20 -0700,Website Not Opening On Firefox Due To Malware Threats/Security Issues,"<p>Hi, I am working on this ecommerce <a href=""https://www.parkerclay.com/"" rel=""nofollow"">website</a>. When I try to open it on Firefox (Windows 10) it is giving malware threat. I want to ask is my site hacked or there is some other problem? </p>",desktop;privacy-and-security_1;,firefox,privacy-and-security,en-US,1428175;,ch27689014325
1344083,2021-07-16 22:07:29 -0700,2021-07-16 22:24:37 -0700,I cannot log onto accounts.firefox.com,<p>I tried to copying and pasting the email code in and it says wrong code try again. I have tried multiple times and it won't work. Then I tried forget password and tried to use a recovery code to reset my account in an attempt to restart it like a computer but that does not work. I cannot add 2AF to my account. Any help appreciated. It also seems to be recognizing a email that I no longer use. I have had this problem in the past but ignored. </p>,desktop;sync;passwords;escalate;windows-10;verificationemail;firefox-900;,firefox,sync,en-US,1428170;1428173;1428174;1428178;,Noah.Pederson2
1344082,2021-07-16 21:20:15 -0700,2021-07-16 22:22:58 -0700,Extreme Slowness,"<p>Filling MonkeySurvey forms or any large form in Firefox<strong>(browser is updated, version 90.0(64-bit))</strong> is extremely slow and frustrating. Words appear in the field  2-3 sec later after typing. </p>",desktop;fix-problems;windows-10;firefox-900;,firefox,fix-problems,en-US,1428176;,rahul99kaurav
1344079,2021-07-16 17:58:14 -0700,2021-07-16 18:44:11 -0700,Firefox will not save passwords,<p>I currently have FF 90.0 (64 bit).  Three updates ago (several weeks) all my passwords disappeared.  They are not in another profile.  I can't save any passwords either. How can I fix this? Thanks </p><p>Jim </p>,desktop;bookmarks;passwords;windows-10;dataloss;passwords-dataloss;firefox-900;,firefox,bookmarks,en-US,1428139;,theelevatorguy
1344077,2021-07-16 17:31:56 -0700,2021-07-16 17:31:56 -0700,Why does FF90 blacks out tabs,<p>Just one simple question. Who was the idiot who thought it would be cute to black out / hide tabs? Is the fool a reject from redmond? </p>,desktop;tabs;windows-10;firefox-900;,firefox,tabs,en-US,"",RealGomer
1344076,2021-07-16 17:21:33 -0700,2021-07-16 19:37:23 -0700,Bookmarks did not transfer properly,<p>I reset my Firefox browser and my bookmarks did not transfer over properly. They are all there but you can only access them by clicking Bookmarks&gt;Manage Bookmarks after which all my bookmarks appear in the favorites bar in the proper order and fully functional on the left side of the pop up window. Then there are a bunch of duplicated folders. </p><p>Is there a way for me to put the favorites bar back in the bookmarks tab on the right side of the page? </p>,desktop;bookmarks;windows-10;firefox-900;,firefox,bookmarks,en-US,1428140;1428150;,hillmann1954
