id,created,updated,title,content,tags,product,topic,locale,answers,creator
1338063,2021-06-02 06:20:59 -0700,2021-06-02 07:07:05 -0700,Firefox won't run after installation,"<p>I've had Firefox running on this PC for a couple of years and started running into problems with it.  I've tried refreshing, reinstalling, restoring the machine back to prior system restore points, nothing seems to work.  It all seems to revolve around the ntdll.dll.  I've included some event viewer info and the content of Report.wer. </p><p>It seems Firefox has been banned from this machine. </p><p>Let me know if there is anything else I should provide. </p><p>Thanks. </p><p>Faulting application name: firefox.exe, version: 89.0.0.7817, time stamp: 0x60afecf6 Faulting module name: ntdll.dll, version: 10.0.19041.964, time stamp: 0xbd2c3c23 Exception code: 0xc0000005 Fault offset: 0x000000000001ad67 Faulting process id: 0x582c Faulting application start time: 0x01d757b00294012c Faulting application path: C:\Program Files\Mozilla Firefox\firefox.exe Faulting module path: C:\WINDOWS\SYSTEM32\ntdll.dll Report Id: 1afb044a-bf7e-4020-b084-08f882aaf94c Faulting package full name:  Faulting package-relative application ID:  </p><p><br> </p><p>Version=1 EventType=APPCRASH EventTime=132671127503826359 ReportType=2 Consent=1 UploadTime=132671127507247212 ReportStatus=268435456 ReportIdentifier=e315cba1-ca8c-40bf-b0ac-9a142bb7cee1 IntegratorReportIdentifier=113620e8-2ede-466f-98e3-b91d252845e1 Wow64Host=34404 NsAppName=firefox.exe OriginalFilename=firefox.exe AppSessionGuid=00003b48-0001-0037-5262-9c02b057d701 TargetAppId=W:000674066830d6caf8b2219dfd54a0b76a3800000000!00008dd035bd088253590fa20cfecc38a76424eb2feb!firefox.exe TargetAppVer=2021//05//27:19:03:18!93ae6!firefox.exe BootId=4294967295 TargetAsId=42676 IsFatal=1 EtwNonCollectReason=1 Response.BucketId=f59497a5b16ecbe06f93fccb8359c389 Response.BucketTable=4 Response.LegacyBucketId=2275440187764491145 Response.type=4 Sig[0].Name=Application Name Sig[0].Value=firefox.exe Sig[1].Name=Application Version Sig[1].Value=89.0.0.7817 Sig[2].Name=Application Timestamp Sig[2].Value=60afecf6 Sig[3].Name=Fault Module Name Sig[3].Value=ntdll.dll Sig[4].Name=Fault Module Version Sig[4].Value=10.0.19041.964 Sig[5].Name=Fault Module Timestamp Sig[5].Value=bd2c3c23 Sig[6].Name=Exception Code Sig[6].Value=c0000005 Sig[7].Name=Exception Offset Sig[7].Value=000000000001ad67 DynamicSig[1].Name=OS Version DynamicSig[1].Value=10.0.19042.2.0.0.256.48 DynamicSig[2].Name=Locale ID DynamicSig[2].Value=1033 DynamicSig[22].Name=Additional Information 1 DynamicSig[22].Value=0000 DynamicSig[23].Name=Additional Information 2 DynamicSig[23].Value=00000000000000000000000000000000 DynamicSig[24].Name=Additional Information 3 DynamicSig[24].Value=0000 DynamicSig[25].Name=Additional Information 4 DynamicSig[25].Value=00000000000000000000000000000000 UI[2]=C:\Program Files\Mozilla Firefox\firefox.exe LoadedModule[0]=C:\Program Files\Mozilla Firefox\firefox.exe LoadedModule[1]=C:\WINDOWS\SYSTEM32\ntdll.dll LoadedModule[2]=C:\WINDOWS\System32\KERNEL32.DLL LoadedModule[3]=C:\WINDOWS\System32\KERNELBASE.dll LoadedModule[4]=C:\WINDOWS\SYSTEM32\apphelp.dll LoadedModule[5]=C:\Program Files\Norton Security\{EA97DD3A-7978-4E82-83EE-5B9F07E0C020}\NortonData\22.21.1.151\Definitions\IPSDefs\20210601.061\IPSEng64.dll LoadedModule[6]=C:\WINDOWS\System32\ADVAPI32.dll LoadedModule[7]=C:\WINDOWS\System32\msvcrt.dll LoadedModule[8]=C:\WINDOWS\System32\sechost.dll LoadedModule[9]=C:\WINDOWS\System32\RPCRT4.dll LoadedModule[10]=C:\WINDOWS\System32\PSAPI.DLL LoadedModule[11]=C:\WINDOWS\System32\ucrtbase.dll LoadedModule[12]=C:\Program Files\Mozilla Firefox\mozglue.dll LoadedModule[13]=C:\WINDOWS\System32\CRYPT32.dll LoadedModule[14]=C:\WINDOWS\System32\WINTRUST.dll LoadedModule[15]=C:\WINDOWS\SYSTEM32\MSVCP140.dll LoadedModule[16]=C:\WINDOWS\SYSTEM32\VCRUNTIME140.dll LoadedModule[17]=C:\WINDOWS\SYSTEM32\VERSION.dll LoadedModule[18]=C:\WINDOWS\SYSTEM32\dbghelp.dll LoadedModule[19]=C:\WINDOWS\SYSTEM32\VCRUNTIME140_1.dll LoadedModule[20]=C:\WINDOWS\SYSTEM32\CRYPTBASE.DLL LoadedModule[21]=C:\WINDOWS\SYSTEM32\MSASN1.dll State[0].Key=Transport.DoneStage1 State[0].Value=1 OsInfo[0].Key=vermaj OsInfo[0].Value=10 OsInfo[1].Key=vermin OsInfo[1].Value=0 OsInfo[2].Key=verbld OsInfo[2].Value=19042 OsInfo[3].Key=ubr OsInfo[3].Value=985 OsInfo[4].Key=versp OsInfo[4].Value=0 OsInfo[5].Key=arch OsInfo[5].Value=9 OsInfo[6].Key=lcid OsInfo[6].Value=1033 OsInfo[7].Key=geoid OsInfo[7].Value=244 OsInfo[8].Key=sku OsInfo[8].Value=48 OsInfo[9].Key=domain OsInfo[9].Value=0 OsInfo[10].Key=prodsuite OsInfo[10].Value=256 OsInfo[11].Key=ntprodtype OsInfo[11].Value=1 OsInfo[12].Key=platid OsInfo[12].Value=10 OsInfo[13].Key=sr OsInfo[13].Value=0 OsInfo[14].Key=tmsi OsInfo[14].Value=221115844 OsInfo[15].Key=osinsty OsInfo[15].Value=3 OsInfo[16].Key=iever OsInfo[16].Value=11.789.19041.0-11.0.1000 OsInfo[17].Key=portos OsInfo[17].Value=0 OsInfo[18].Key=ram OsInfo[18].Value=32631 OsInfo[19].Key=svolsz OsInfo[19].Value=952 OsInfo[20].Key=wimbt OsInfo[20].Value=0 OsInfo[21].Key=blddt OsInfo[21].Value=191206 OsInfo[22].Key=bldtm OsInfo[22].Value=1406 OsInfo[23].Key=bldbrch OsInfo[23].Value=vb_release OsInfo[24].Key=bldchk OsInfo[24].Value=0 OsInfo[25].Key=wpvermaj OsInfo[25].Value=0 OsInfo[26].Key=wpvermin OsInfo[26].Value=0 OsInfo[27].Key=wpbuildmaj OsInfo[27].Value=0 OsInfo[28].Key=wpbuildmin OsInfo[28].Value=0 OsInfo[29].Key=osver OsInfo[29].Value=10.0.19041.985.amd64fre.vb_release.191206-1406 OsInfo[30].Key=buildflightid OsInfo[30].Value=C0DD2958-3F6C-41DD-85BE-41F4BE4DFAC2.1 OsInfo[31].Key=edition OsInfo[31].Value=Professional OsInfo[32].Key=ring OsInfo[32].Value=Retail OsInfo[33].Key=expid OsInfo[34].Key=fconid OsInfo[35].Key=containerid OsInfo[36].Key=containertype OsInfo[37].Key=edu OsInfo[37].Value=0 FriendlyEventName=Stopped working ConsentKey=APPCRASH AppName=Firefox AppPath=C:\Program Files\Mozilla Firefox\firefox.exe NsPartner=windows NsGroup=windows8 ApplicationIdentity=67E97FB536942A9129100B62F2DE4AEB MetadataHash=1807917528 </p>",desktop;fix-problems;,firefox,fix-problems,en-US,1416423;,vista1
1338062,2021-06-02 06:19:58 -0700,2021-06-02 06:19:58 -0700,Edit functions,"<p>The new Firefox upgrade has removed the edit functions: Cut, Copy, Paste that used to be visible when you clicked on the three-line icon on the top right of the tool bar. How do we edit our posts on the web now? </p>",windows-7;desktop;other;firefox-890;,firefox,other,en-US,"",bcamphome
1338061,2021-06-02 06:14:37 -0700,2021-06-02 07:11:24 -0700,Bookmarks,"<p>somehow lost logins, passwords and all bookmarks.  Uninstalled Firefox.  Downloaded and installed new version. Doesnt appear to be the same.  Anyway if i go to manage bookmarks they are in Library but how do I put them back on my home page please </p>",desktop;download-and-install_1;windows-10;firefox-890;,firefox,download-and-install,en-US,1416427;1416428;,anndesjepson
1338060,2021-06-02 06:12:11 -0700,2021-06-02 06:14:16 -0700,Can't use virtual webcam sources in Firefox,"<p>Hey there, </p><p>For some reason I can't seem to get virtual cam sources like OBS virtual cam to work on Firefox. When I have a website that wants cam permission, <a href=""https://i.imgur.com/jfwjrOz.png"" rel=""nofollow"">only my actual physical cam shows up in the list</a> only my actual physical cam shows up in the list. Weirdly enough, the <a href=""https://i.imgur.com/RcMt7Aa.png"" rel=""nofollow"">website itself *does* show a list of all cam sources</a>, including the virtual ones, but whichever one I choose as a source on the website, it'll always only use the physical cam source, presumably because I gave the website only permission to use *that* webcam (because I had no other option to choose.) </p><p>I've tried <a href=""https://support.mozilla.org/en-US/questions/1304628"" rel=""nofollow"">this</a> solution I found on this helpdesk but it didn't seem to help, unfortunately. With support tickets/feature requests being closed and this question getting no response on Reddit, I hope this will lead to something. </p><p>I should mention, this *only* happens on Firefox. No other software so far that I've found has this issue where it only lets me use the physical sources. </p><p>Note: I'm aware that the screenshot of the permissions dialogue box is outdated and this menu now looks different. This update did not fix the issue, however. </p>",desktop;other;,firefox,other,en-US,"",Z3DT
1338059,2021-06-02 06:04:21 -0700,2021-06-02 06:04:21 -0700,Ikonok cseréje,"<p>Jó Napot ! Szeretném megváltoztatni a firefox  összes  ikonját, ,mert  több példányt használok, és  a tálcán megjelenő nyitott böngészőket nem tudom megkülönböztetni, és  más ikonokkal szeretném kicserélni, DE nem engedi a fox.  kitöröltem a két  fox  ikont a VisualElements ből, és  másikat helyeztem be  azonos  felirattal, de így  sem változik meg a fox.ex fájlban lévő ikonok!  Hogyan lehet kicserélni a Lap, a kezdő oldal és a tálcalap ikonját? Nem a tálcára rögzíthetőt,mert  az megvan,hanem a  nyitott böngésző tálcalapján lévőt?  Küldök scriptet csatolva   Üdvözlettel   László freeman.laci@gmail.com </p>",windows-7;desktop;tips;firefox-890;,firefox,tips,hu,"",freemanlaci
1338058,2021-06-02 05:55:07 -0700,2021-06-02 05:55:07 -0700,how do I stop firefox from opening a new tab for each link I click on,"<p>Hi, until i believe the last update if i was browsing say on ebay and licked on another photo below a listing, Firefox would open up in a new tab and i find it frustrating, i had to check and went over to Chrome and it works like  it always has done and opens the link up in the same page- on ebay anyhow and as such i just use my browser back button, i'd loathe to have to go back to using Chrome constantly as prefer Firefox but i've been all through thr settings and still can't stop it form sending up another new tab. Please help. </p>",windows-vista;desktop;tabs;firefox-890;,firefox,tabs,en-US,"",melissa.home
1338056,2021-06-02 05:46:02 -0700,2021-06-02 05:46:02 -0700,Started Firefox this morning and my tabs are missing.,"<p>Started Firefox this morning and my tabs are missing.  How can I return them so that they are under the toolbar?  Also, WHY do they continue to do this insane crap? </p>",desktop;customize;windows-10;firefox-890;,firefox,customize,en-US,"",montanamoss
1338055,2021-06-02 05:43:56 -0700,2021-06-02 05:43:56 -0700,Where are the tab separators? the tabs are all one thing.,"<p>Just upgraded to 89.0 (64-bit), the tabs are now all one long thing, no separators. Please use separators so users can easily tell where one tab end and the next begins. The UI is a giant step backwards, every few years some thinks no separators is a thing to try. please update to usable UI. </p>",mac-os;desktop;tabs;firefox-890;,firefox,tabs,en-US,"",severino42
1338054,2021-06-02 05:43:15 -0700,2021-06-02 05:43:15 -0700,Firefox 89.0,"<p>Firefox just updated to version 89.0. I find the enlarged bookmarks names in the bookmarks tab, the new coloration, and the new floating tabs to be a hindrance. To elaborate, I have a form of red-green colorblindness and find the floating tabs and lighter coloration make it harder for me to use the interface, enough so that I am considering switching browsers. Is there a way to revert these visual elements to the older version? </p><p>Thank you. </p>",desktop;customize;windows-10;firefox-890;,firefox,customize,en-US,"",mandalorian625
1338053,2021-06-02 05:41:47 -0700,2021-06-02 06:24:00 -0700,Ctrl + D Add bookmark,<p>Hi </p><p>Is there some way to get the Ctrl + D window resizable? I find it a pain trying to scroll through my bookmarks to find a location to save to through a very small window. </p><p>Thanks! </p>,linux;desktop;bookmarks;firefox-890;,firefox,bookmarks,en-US,1416407;,tankopia1
1338052,2021-06-02 05:38:39 -0700,2021-06-02 05:38:39 -0700,Firefox does not see my camera,"<p>Firefox does not see my built-in camera or offer me the option to select a camera. This hapens on all sites, there are no sites allowed to use my camera. I have removed enumerate_devices.txt and the issue persists. </p><p>Firefox always uses ""snap camera,"" which I never want to use, as it does not work correctly for a work environment. Google Chrome and Safari use the FaceTime camera, which works properly. </p>",mac-os;desktop;other;firefox-890;,firefox,other,en-US,"",severino42
1338051,2021-06-02 05:38:19 -0700,2021-06-02 07:00:54 -0700,sharing web site,<p>I am missing the sharing function i.e. for telegram of web sites... the little menue in the URL filed is no longer present. </p><pre>was this on purpose? </pre>,mac-os;desktop;other;firefox-890;,firefox,other,en-US,1416420;,hwbindel
1338050,2021-06-02 05:35:22 -0700,2021-06-02 05:35:22 -0700,Cannot upload large video files to Google Drive,"<p>Using Firefox 88.01 (64-bit) and since the last couple of days I cannot video files (about 1 GB or more) to my Google Drive folder. Files of small size, like text files sized about 50 KB or 10 KB can be uploaded. The error message I get on the Google Drive Page is ""Starting upload"" but the uploading doesn't begin. This happens both in Windows 10 and Ubuntu 21.04. I refreshed Firefox and also tried uploading the file in Troubleshooting mode but that didn't help. Google Chrome can upload files to Google Drive just fine. </p>",desktop;websites;firefox-880;firefox-8801;,firefox,websites,en-US,"",surja.gain
1338049,2021-06-02 05:30:39 -0700,2021-06-02 05:30:39 -0700,Firefox lento porque?,"<p>Dias para cá o fire esta muito lento, eu pensei que era meu pc e comecei a verificar tudo, depois tive a ideia de navegar no aplicativo do Windows 10 Edge foi muitoooooo rápido, mas o fire esta uma lesma, eu fiz tudo que o suporte diz e nada, o que se passa fire ajuda ai! </p>",desktop;websites;windows-10;firefox-890;,firefox,websites,pt-BR,"",guarujamix
1338048,2021-06-02 05:26:24 -0700,2021-06-02 09:34:54 -0700,new so called look,"<p>how do i;  </p><pre>get rid of the blue starred <em> edit bookmark </em> which is of no use to anyone ? </pre> <p>dark mode as its too bloody dark , without changing my 'theme' ? the crap surround on tabs ? i know which tab i'm on , or even change the colour at least .  the line beneath tabs that goes along the whole screen ? 'page info' back to where it was before it was moved for no reason what so ever ? and any other updated crap i havent come across yet . </p><p>still no tabs below , so many tweaks here and there and yet f/f still doesnt give us what we want only what they want us to have . </p>",desktop;customize;windows-10;firefox-890;,firefox,customize,en-US,1416397;1416488;,trevorbartlett
1338047,2021-06-02 05:19:23 -0700,2021-06-02 05:19:23 -0700,How do you disable the horrible floating tabs,"<p>Ver: 89.0 (64-bit) </p><p>Why do UX people constantly change things for no reason other than to make them different. </p><p>How do you turn off the horrible ""floating"" tabs </p>",desktop;tabs;windows-10;firefox-890;,firefox,tabs,en-US,"",firefox928
1338046,2021-06-02 05:19:08 -0700,2021-06-02 07:13:56 -0700,DuckDuckGo search entry flips into address bar after upgrade to 89.0,"<p>DuckDuckGo is my default search engine. When I open a new tab a DuckDuckGo search box comes up as part of the new tab layout.  </p><p>After I upgraded to 89.0 I find that if I enter text into the DuckDuckGo search box the text automatically switches into the address bar and looks through the URL history instead of being entered into the DuckDuckGo search box. I can't use the DuckDuckGo search box at all, I can only choose a search option that (sometimes) comes up in the address bar instead.  </p><p>Is this supposed to work like this? It's very inefficient. </p>",desktop;fix-problems;windows-10;firefox-890;,firefox,fix-problems,en-US,1416395;1416429;,mail1074
1338044,2021-06-02 05:14:39 -0700,2021-06-02 09:45:09 -0700,Update 89.0 fresh new design,"<p>Is there a way to use older look without downgrading the whole browser to previous versions?  </p><p>In my opinion the new design is an absolute eyesore. None of the themes available even resemble what I liked about Firefox. I always adored this browser for simplicity and clarity, but they completely overdid it in the current version. </p>",desktop;tabs;windows-10;firefox-890;,firefox,tabs,en-US,1416462;1416501;,oeparolium
1338041,2021-06-02 04:59:05 -0700,2021-06-02 04:59:05 -0700,New Theme - Wasted Space,"<p>Is there a way to scale down the new theme?  At this point I've lost over 10% of my total screen pixels for a menu bar, tabs, and address bar.  Not only that, there is a 30+ pixel gap between lines.  The only option under ""Density"" I see is ""Touch"" which expands the distances between buttons even greater. </p>",desktop;customize;windows-10;firefox-890;,firefox,customize,en-US,"",hotice919
1338040,2021-06-02 04:55:30 -0700,2021-06-02 04:55:30 -0700,How do i get my bookmark size back down to pre v89 size?,"<p>Just installed the new v89, how do i get my bookmarks back to the size they were before? </p><p>The bookmarks have now taken over my screen and i have to scroll, they were just nice and neat before. </p><p>Regards </p><p>James </p>",desktop;bookmarks;windows-10;firefox-890;,firefox,bookmarks,en-US,"",james_uk
1338039,2021-06-02 04:52:27 -0700,2021-06-02 04:52:27 -0700,The dropdown menu isn't working on Firefox only,"<p>Respected, Website URL: <a href=""https://moneymunch.com"" rel=""nofollow"">Moneymunch.com</a> . I have tested the menu with Chrome, Chromium, Opera, Brave, Epiphany, and IE. It's working fine. But, while I open internal pages and try to explore the dropdown menu, it stopped working. It's happening with Mozilla Firefox only. </p><p><strong>Step 1:</strong> Open the website <strong>Step 2:</strong> Move your mouse to DAILY TIPS &amp; REPORTS under the navigation bar It will work fine here. Now, <strong>Step 3:</strong> Go to TOOLS pages such as ""Best Online Brokers"", ""Currency Converter"", or ""Pivot Points Calculator"" <strong>Step 4:</strong> Now check again, DAILY TIPS &amp; REPORTS dropdown menu </p><p>It's not working at all! Kindly help. </p><p><em>I have completely removed minification tools for testing purposes.</em> </p><p>Warmest Regards, Chinmay </p>",linux;desktop;websites;firefox-890;,firefox,websites,en-US,"",chinmayrajyaguru
1338038,2021-06-02 04:46:09 -0700,2021-06-02 04:46:09 -0700,The tab scrollbar has mostly disappeared.,<p>The tab scrollbar has mostly disappeared. The tabs seem to be on the bottom of the browser page. I only see one tab. </p>,windows-7;desktop;tabs;firefox-890;,firefox,tabs,en-US,"",wworonick
1338037,2021-06-02 04:41:51 -0700,2021-06-02 04:41:51 -0700,Complaint about new update,"<p>I am really really angry at this new update. It is  the worst update I can remember. It cannot be more user unfriendly. It is complicated and confusing. A person has to go to IT school to take a course on how to use it. It is made for IT trained people. Not lay people. I am irate. I am outraged. This update is crazy! Nothing is simple! What percentage of users can understand or figure all this out? Or who has all the time necessary to figure it out? Answer: An extremely low percentage of users! </p><p>The first thing I noticed this morning, when I went to use ff, is the ""Restore previous session""  was gone. To me, this is the most important feature of a browser, and it is gone! </p><p>I normally have over a 100 tabs  on the go. </p><p>This makes me so mad, I could wring someone's neck! I am boiling mad! This is the worst update ever! I can't do anything now! </p><p>And I am told to be nice!?!?  That is BS! </p><p>I did not cause the problem! </p><p>It is even complicated to make a complaint, to give feedback. I do not want to complain to the community. I want to make a complaint to the developers. The people  responsible for developing this new update. </p><p>The developers  heads went into the sky and  lost contact with simplicity and common sense. Lost contact with reality. </p><p>I do not have time  for this crap! </p><p>This new generation of developers have their heads screwed on wrong, and need to get them screwed on right. You need to get down to earth and find and use common sense. Keep it simple! </p><p><br> Please get the ""Restore previous session"" replaced immediately. </p><p>FF is no good to me, without it! </p><p><br> And restore the simple ""give feedback""   </p><p><br> Don't blame me for this submission! </p>",desktop;other;windows-10;firefox-890;,firefox,other,en-US,"",Davidmpelly
1338036,2021-06-02 04:38:37 -0700,2021-06-02 04:38:37 -0700,User interface,"<p>Hey, so i just updated firefox to the newst version, but now the tabs bar is too big and doesnt fit my screen. I tried looking for some ui customization options but i couldnt find any. Is there a way I could make it smaller or how it used to be? </p>",desktop;tabs;windows-10;firefox-890;,firefox,tabs,en-US,"",ogest
1338034,2021-06-02 04:29:50 -0700,2021-06-02 09:28:13 -0700,How do I revert to the previous color scheme with BLACK letters on WHITE background?,"<p>After the last update, the color scheme changed to white letters on a black background, which I don't like at all. How to go back to the previous scheme? </p>",desktop;customize;windows-10;firefox-890;,firefox,customize,en-US,1416378;1416390;1416485;,dmitriy1973.2012
1338032,2021-06-02 04:12:11 -0700,2021-06-02 04:12:11 -0700,Google search not working,"<p>Google search in centre of screen no longer active, searches now default to address bar - why? </p>",desktop;other;windows-10;firefox-890;,firefox,other,en-US,"",getdavidholloway
1338031,2021-06-02 04:03:29 -0700,2021-06-02 04:03:29 -0700,Problema Inicio de Sesión en Gizmodo.com con cuenta Google,"<p>Desde la actualización de ayer a 89.0 (aclaro: lo utilizo en Windows 10 de 64 bits) no me permite iniciar sesión en <a href=""http://gizmodo.com"" rel=""nofollow"">gizmodo.com</a> con mi cuenta de Google.  Para iniciar sesión se abre una ventana flotante donde apreto el botón ""Conectar con Google"". Eso abre una nueva pestaña que luego se cierra. A partir de eso debería aparecer logeado en gizmodo pero no se logea. Es alguna opción nueva de seguridad/privacidad?  Desde ya, gracias. </p>",desktop;fix-problems;windows-10;firefox-890;,firefox,fix-problems,es,"",bochivarine
1338029,2021-06-02 03:55:52 -0700,2021-06-02 03:55:52 -0700,export passwords,"<p>I cant found export passwords button i only found import from another browsers, So what can i do to export my passwords </p>",desktop;privacy-and-security_1;windows-10;firefox-780;,firefox,privacy-and-security,en-US,"",a.alkhwas19
1338028,2021-06-02 03:50:11 -0700,2021-06-02 03:50:11 -0700,Importing Bookmarks and passwords in Windows 10,"<p>I have just iupdated my Firefox today, June 2021. When I try to import bookmarks and passwords from the old Firefox in Windows 10 the only option is from microsoft Edge. </p>",desktop;download-and-install_1;windows-10;firefox-890;,firefox,download-and-install,en-US,"",john248
1338027,2021-06-02 03:50:02 -0700,2021-06-02 03:50:02 -0700,Firefox,"<p>Hallo, seit gestern funktioniert Firefox gar nichts. Es reagiert nicht auf Adresseeingabe, auf die Einstellungen kann ich auch nicht zugreifen, es ist nur eine Leereseite zu sehen. Neuinstalation hat auch nicht geholfen. Wenn jemand eine Idee hätte? Schöne Grüß Jurek </p>",desktop;fix-problems;,firefox,fix-problems,en-US,"",jorgele
1338026,2021-06-02 03:47:23 -0700,2021-06-02 04:17:20 -0700,moving tabs back to below menu bar,"<p>Firefox updated and now my tabs are above the address bar, I hate it. I have went through all the information I could and created a new chrome folder, downloaded the css and changed user preferences but it sets the tabs to the bottom of the screen not just below the address bar. I think I need a different set of code for the css but cant find a copy. Does anyone know what to do? </p>",desktop;tabs;windows-10;firefox-890;,firefox,tabs,en-US,1416376;1416377;,sharkeyandgeorge
1338025,2021-06-02 03:42:14 -0700,2021-06-02 03:42:14 -0700,New update broke light theme :(,"<p>The theme is on, but the bar is blue, not white. This is most likely because I use built-in classical theme in Win 7. Before recent update, the light theme worked just fine, changing bar color to white. First picture is with theme on, second is with theme off. </p>",windows-7;desktop;customize;firefox-890;,firefox,customize,en-US,"",blue-lemon-tree
1338024,2021-06-02 03:40:14 -0700,2021-06-02 03:41:58 -0700,Dark Mode,"<p>Hello Guys, So yesterday I got the color selection thing popping up on my screen and I accidentaly selected white mode but I wanted dark mode. And now I don't know how to get back the color selection, because can't find it anywhere.  Anyone know where I can change my color again? </p>",desktop;customize;windows-10;firefox-890;,firefox,customize,en-US,1416368;,heinischluis
1338023,2021-06-02 03:34:56 -0700,2021-06-02 03:34:56 -0700,How do I back out this new version of firefox desktop?,"<p>This design is the WORST YET.  Wasted space with tiny, tiny icons.  Clunky large floating tabs.  what was this for?  WHO was this for?  I didn't like when we lost the ability to designate new tabs, but these changes just make it look like MS Edge which is S-L-O-W and CLUNKY.  How do I get the old, previous version back? </p>",desktop;other;windows-10;firefox-890;,firefox,other,en-US,"",mikensullivan
