id,created,updated,title,content,tags,product,topic,locale,answers,creator
1338120,2021-06-02 09:20:14 -0700,2021-06-02 09:48:37 -0700,Firefox can no longer play Netflix movies,"<p>Firefox can no longer play Netflix movies. Firefox loads the Netflix site. Firefox attempts to play the movie. Then, Firefox can't play the movie. Netflix says ""Your browser is no longer supported."" This happens every time there is a Firefox update! Do you guys not test your products in development before release? Please fix your product. I tried all your 'help' items. </p>",mac-os;desktop;other;firefox-780;,firefox,other,en-US,1416505;,808state
1338119,2021-06-02 09:18:53 -0700,2021-06-02 09:18:53 -0700,With the new update,"<p>With the new update, everything looks different. So is the small search bar in the middle of the page. What I mean is that for a simple search I would type there, not the big address bar at the top. Well, when I start typing, it goes up into the address bar at the top. I got  a reply from someone but even the 3 bar at the top right side gives me different menu. <strong>How do I get the small search bar working?</strong> Any help will be appreciated. Thanks. </p>",desktop;customize;,firefox,customize,en-US,"",nhorv75597
1338118,2021-06-02 09:17:23 -0700,2021-06-02 09:17:23 -0700,"new version June 2, 2021",<p>the New Tab page is now useless.  The icons are as small as the type size on the toolbar itself. What happened?  I thought the icons were intended to make things easier - make the websites easier to identify.  Instead I can read the typed toolbar titles as well as determine which miniscule square is the icon for a given page.  Get the old icons size back! </p>,desktop;other;windows-10;firefox-890;,firefox,other,en-US,"",timmasanz
1338116,2021-06-02 09:13:10 -0700,2021-06-02 09:13:10 -0700,Kuinka saan firefoksin vanhan ulkoasun ?,<p>Kuinka saan vanhan ulkoasun - firefox ? </p>,desktop;other;windows-10;firefox-890;,firefox,other,fi,"",jupiter4
1338112,2021-06-02 09:08:49 -0700,2021-06-02 09:08:49 -0700,Hmm. We're having trouble finding that site.,"<p>Good morning! This issue started when I moved out of state and signed up with a new ISP (AT&amp;T Fiber). It is only on my work laptop and no other devices are affected. Google Chrome and Microsoft Edge are also not affected. I log into my work computer every day at 10am CST. When I try to open Firefox I get the message ""Hmm. We're having trouble finding that site."" I have tried several troubleshooting tips but nothing has worked so far. The problem always lasts for about an hour. Meaning when I try to open Firefox again around 11am CST it starts working. Even on days when I start later the same thing happens. If I login to my work computer at 2pm CST Firefox won't start working until 3pm CST. I do use a VPN and am on Wi-Fi. Please let me know if anyone can help, thanks! </p>",desktop;websites;,firefox,websites,en-US,"",btfranks
1338111,2021-06-02 09:01:09 -0700,2021-06-02 09:01:09 -0700,Problems syncing up new version of Firefox,<p>Please walk me through the steps to sync - thx! </p>,desktop;sync;,firefox,sync,en-US,"",GTTominaga
1338110,2021-06-02 08:53:37 -0700,2021-06-02 09:49:46 -0700,http://www.iliad.it/,"<p>Hi i can't go into 'Personal Area' anymore, it goes on and on without login in! I must use Microsoft Edge to login my personal area. Why? </p>",desktop;fix-problems;windows-10;firefox-890;,firefox,fix-problems,en-US,1416507;,francedaro
1338109,2021-06-02 08:50:12 -0700,2021-06-02 09:15:50 -0700,Themes,<p>My theme went away with the latest update today.  How do I get my old theme back? </p>,desktop;other;windows-10;firefox-890;,firefox,other,en-US,1416472;,stobbepe
1338108,2021-06-02 08:48:41 -0700,2021-06-02 10:01:06 -0700,I downloaded the latest version but don't want to install it yet; can I remove the download?,"<p>Hello.  I have Firefox set to notify me of new updates but though I always download them I don't immediately install them.  My current version is 88.0.1. </p><p>Today I downloaded what I now know to be the all-new complete revamp version.  But I don't want to install it on my main PC until I've looked into a little more and perhaps tried it out on a laptop.With it in  </p><p>Is there a way of removing the downloaded version? With it in place, if I restart Firefox or reboot the computer it will automatically be installed, and I don't want that to happen just yet. </p><p>I'm running Windows 7 on a desktop PC. </p><p>Many thanks. </p>",windows-7;desktop;download-and-install_1;firefox-880;,firefox,download-and-install,en-US,1416509;1416519;,mail226
1338107,2021-06-02 08:42:33 -0700,2021-06-02 08:42:33 -0700,háttér szín,<p>Frissült a Firefox.  ezt követően a legördülő ablakok feketék lettek és a betűk lettek fehérek. Szóval pont fordítva mint volt.  ezt Én nem bírom nézni. Lehet ezen változtatni????????????? </p>,desktop;customize;windows-10;firefox-890;,firefox,customize,hu,"",civis52
1338106,2021-06-02 08:34:13 -0700,2021-06-02 09:21:03 -0700,Firefox update today and blue bar at top,<p>Firefox updated today and now there is a blue bar along the top which also has my question on it. I don't need two search bars’ for ‘Firefox’. Does firefox ever listen to the people who use it? </p>,desktop;other;windows-10;firefox-890;,firefox,other,en-US,1416460;1416476;,iacapa
1338104,2021-06-02 08:30:34 -0700,2021-06-02 09:18:30 -0700,Default Theme,"<p>In new version of Firefox (89) Default theme is installed but refuses to load properly  it looks like the Light theme, when i am switching it to Light theme and after Default theme there is no difference it looks like Light theme anyway...Can you help me with it? </p>",desktop;other;windows-10;firefox-780;,firefox,other,en-US,1416475;,babu_92
1338101,2021-06-02 08:12:01 -0700,2021-06-02 09:28:01 -0700,Bug or bad design? Separated tabs,"<p><a href=""https://user-media-prod-cdn.itsre-sumo.mozilla.net/uploads/images/2021-06-02-08-09-40-d6148c.png"" rel=""nofollow"">https://user-media-prod-cdn.itsre-sumo.mozilla.net/uploads/images/2021-06-02-08-09-40-d6148c.png</a> </p><p>Is separated tab a bug or bad design? If the second, how can I revert to logical tab, that connected to its page? (And why the hell such ugly design decision passed?) </p><p>As I can see Themes show proper design with connected tabs: <a href=""https://user-media-prod-cdn.itsre-sumo.mozilla.net/uploads/images/2021-06-02-08-11-27-3907e9.png"" rel=""nofollow"">https://user-media-prod-cdn.itsre-sumo.mozilla.net/uploads/images/2021-06-02-08-11-27-3907e9.png</a> </p>",desktop;tabs;windows-81;firefox-890;,firefox,tabs,en-US,1416448;1416483;,Hitrpr
1338098,2021-06-02 08:05:58 -0700,2021-06-02 09:54:01 -0700,How do I make my tabs opaque again?,"<p>I've tried a few different ""themes"", but inevitably I end up with tabs that I can't read. How do I make the tabs opaque again? </p>",desktop;customize;windows-10;firefox-890;,firefox,customize,en-US,1416486;1416513;,klauschers
1338096,2021-06-02 08:00:47 -0700,2021-06-02 08:00:47 -0700,Araç çubuğunda sekme rengini değiştirmek,"<p>Firefox ta açık olan sekme gri renkte oluyor, diğer sekmeler ise siyah renkte oluyor. Ben bunun rengini değiştirmek istiyorum. Yani açık olan sekme siyah, diğer sekmeler ise gri olsun istiyorum. Nasıl yapabilirim ? </p>",desktop;customize;windows-10;firefox-890;,firefox,customize,tr,"",arif-celik56
1338095,2021-06-02 07:59:10 -0700,2021-06-02 09:45:25 -0700,Firefox crashes,<p>For the last six to eight weeks every time I sign into my account at fifth third bank Firefox crashes. Just got back from the bank and signed into my account there and everything worked fine. Have cleared all caches and cookies four time and nothing works. Anyone else having this problem?? </p>,windows-7;desktop;websites;firefox-880;,firefox,websites,en-US,1416491;1416502;,jray38
1338094,2021-06-02 07:54:56 -0700,2021-06-02 08:17:46 -0700,spacing in drop down menus,<p>new firefox has double spacing in drop down menus...how can I change that to single spacing like the previous version. </p>,desktop;customize;windows-10;firefox-890;,firefox,customize,en-US,1416445;,vviktur
1338093,2021-06-02 07:44:37 -0700,2021-06-02 09:36:48 -0700,New homepage in FF 89.0,"<p>The 89.0 update is great, but I'm disappointed by the new homepage (see the picture). The font is too small, and if I scale the page, the lower row doesn't fit to the screen. A good option would be to remove the useless huge Firefox logo in the middle of the page and to shift the search bar up. Then I could just scale the page. Is there a way to do it? </p><p>Changing fonts on every page is not a satisfying solution, I only want to fix the homepage. </p>",linux;desktop;customize;firefox-890;,firefox,customize,en-US,1416439;1416461;1416490;,gemiroshnichenko
1338092,2021-06-02 07:37:50 -0700,2021-06-02 08:49:26 -0700,Web Search Box on Firefox Home Page No Longer Works,"<p>Firefox updated itself this morning to Version 89.0(64-bit) on my Windows 10 desktop.  Now, when I open a new tab and start to type an search term into the search box on the Firefox home page on that tab, it begins typing in the address bar instead. Is this the new normal, or a glitch? </p>",desktop;tabs;windows-10;firefox-890;,firefox,tabs,en-US,1416463;,paulberetta
1338091,2021-06-02 07:37:32 -0700,2021-06-02 08:50:46 -0700,New update,"<p>With the new update, (when I just want to search something) I try to type in the center bar, not the address bar up on top. But it automatically goes up in the top address bar. How can I get that search bar to work? Any help is appreciated. Thanks. </p>",desktop;customize;windows-10;firefox-890;,firefox,customize,en-US,1416464;,nhorv75597
1338089,2021-06-02 07:31:42 -0700,2021-06-02 09:44:35 -0700,Background tabs colour settings,"<p>Hi all, </p><p>After a recent update to firefox I didn't like the premade colour themes, so I made my own.  There is one thing that bothers me though, and I'm not sure how to change it: As you can see in the attached image, the tab I'm currently on has a clear distinct colour. However, all the unselected tabs have the same colour as the background. I find it annoying that this makes unselected tabs harder to spot, and makes it harder to see where one tab begins and the other ends. It is minor, but it annoys me.  Does anyone know a way (either via settings or the add-on firefox color) for me to make the unselected tabs stand out from the background? </p><p>Thanks in advance. </p><p>(firefox version 89.0 64 bit) </p>",desktop;tabs;windows-10;firefox-890;,firefox,tabs,en-US,1416489;1416499;,wesleynielen
1338088,2021-06-02 07:30:52 -0700,2021-06-02 09:44:43 -0700,I downloaded the new Firefox this morning and now I can't access webpages.,"<p>Can you give a link for the previous download so I can go back to what works, please. </p>",desktop;other;,firefox,other,en-US,1416493;1416500;,hakola
1338087,2021-06-02 07:30:24 -0700,2021-06-02 07:30:24 -0700,poner la barra de direcciones justo debajo de la barra de menus,"<p>pues poder usar mi firefox como en la version 88 que era la mejor.  Esta nueva version, poneis cambios que no se pueden revertir y dejar el diseño como en versiones anteriores, cosa que siempre dejaba firefox y ahora cada vez está mas limitada la customizacion. una pena. espero que sea porque no encuentro la menera de hacerlo y no porque no se puede hacer. </p>",desktop;customize;windows-10;firefox-890;,firefox,customize,es,"",toni.chicon
1338086,2021-06-02 07:25:09 -0700,2021-06-02 09:42:39 -0700,Can I Decrease White Space (Padding) Between Bookmark Items in FF89?,"<p>Is there some way to <strong>reduce the white space / padding between bookmark and menu items</strong> in the new Proton interface introduced in Firefox 89? I don't have a touchscreen and all the extra white space just means more scrolling to navigate through my bookmarks. </p><p>The AskVG site has a 02-June-2021 article at <a href=""https://www.askvg.com/tip-restore-old-classic-theme-and-ui-in-firefox-89-and-later-versions/"" rel=""nofollow"">https://www.askvg.com/tip-restore-old-classic-theme-and-ui-in-firefox-89-and-later-versions/</a> that explains how to <strong>disable all the new Proton interface changes</strong> in about:config, but is there one specific hidden preference / flag (e.g., <em>browser.proton.toolbar.version</em>) mentioned in that article that controls the spacing between bookmarks and menu items? </p><p>There is a also a companion article on AskVG titled <a href=""https://www.askvg.com/tip-restore-compact-mode-density-option-in-firefox-customize-window/"" rel=""nofollow"">https://www.askvg.com/tip-restore-compact-mode-density-option-in-firefox-customize-window/</a> with instructions on how to change two Density options (<em>browser.compactmode.show</em> and <em>browser.uidensity</em>) in about:config, but I have no idea if <strong>changing my density setting to ""Compact""</strong> would actually decrease white space (padding) between bookmark and menu items. </p> <hr> <p>Dell Inspiron 15 5584 * 64-bit Win 10 Pro v20H2 build 19042.985 * Firefox v89.0.0 * MS Edge v91.0.864.37 * Microsoft Defender v4.18.2104.14 * Malwarebytes Premium v4.4.0.117-1.0.1308 </p>",desktop;customize;windows-10;firefox-890;,firefox,customize,en-US,1416497;,lmacri
1338085,2021-06-02 07:24:35 -0700,2021-06-02 07:24:35 -0700,Tabs and menus cannot be read in version 89.,"<p>This morning I upgraded to version 89 and selected the dark theme when asked. It was the theme that I was using until now but you can't read anything in the tabs, they are not distinguishable from each other. </p>",desktop;tabs;windows-81;firefox-890;,firefox,tabs,en-US,"",felixq
1338084,2021-06-02 07:20:56 -0700,2021-06-02 07:20:56 -0700,Black background won't change to white when typing in whateve into Google or the addres bar,"<p>I've went to fonts &amp; colors &amp; tried changing it, clicking never &amp; everything else but nothing works. I have a recent Dell XPS desktop, Kaspersky &amp; windows 10. Is this the right category for this question? </p>",desktop;other;windows-10;firefox-890;,firefox,other,en-US,"",jPendragon
1338081,2021-06-02 07:14:36 -0700,2021-06-02 07:33:55 -0700,Lost opened tabs after upgrading to Firefox 89 on macOS 11.3.1,"<p>First I was stuck in an upgrade loop where Firefox would ask me to restart to install the upgrade but then isn't upgraded on restart. So I manually downloaded latest version from the website and installed it. Now after installing I lost my current session (opened tabs). I have enabled sync so I can still see the synced tabs in my Firefox account under my device, but I don't know how to open all tabs from a particular device. </p><p>How do I open all synced tabs from a particular device in Firefox 89 on macOS 11.3.1? </p>",mac-os;desktop;download-and-install_1;firefox-890;,firefox,download-and-install,en-US,1416434;,nis999999
1338080,2021-06-02 07:11:30 -0700,2021-06-02 07:15:03 -0700,Latest firefox browser,<p>The latest Monzilla Firefox upgrade auto installed today has me lost. Question? why is my query typed typed into the qoogle search bar copied directly into the address bar. Is this a malfunction? Do I have an option to go back to the previous version?. May be I should take another look at Edge. </p>,desktop;other;windows-10;firefox-890;,firefox,other,en-US,1416430;,richard119.prime
1338079,2021-06-02 07:08:51 -0700,2021-06-02 07:08:51 -0700,theme,"<p>As of yesterday, June 1, my theme changed in Firefox. It's too light and the dark one is too dark.  Can I have the original one back?  I've played around with different themes and I don't care for any of the fancy colored ones.  I just want the top bar to be a darker gray like it was 2 days ago.  I cannot distinguish from the top bar and the tabs now.  It all blends as one color. Thank you. Barbara </p>",desktop;customize;windows-10;firefox-890;,firefox,customize,en-US,"",barbloki
1338078,2021-06-02 07:08:22 -0700,2021-06-02 09:39:58 -0700,Как вернуть прежний вид браузеру? (как до обновления),"<p>Как вернуть прежний вид браузеру?  Минимализм уже осточертел и я сыт по горлу этим ""user friendly"" дизайном. </p>",windows-7;desktop;other;firefox-890;,firefox,other,en-US,1416492;,kreper1479
1338076,2021-06-02 06:56:28 -0700,2021-06-02 06:56:28 -0700,connected devices,<p>I keep signing out the same device in connected services and it keeps reappearing on the list. </p>,desktop;sync;windows-10;firefox-890;,firefox,sync,en-US,"",sgeodesign
1338075,2021-06-02 06:54:49 -0700,2021-06-02 06:56:57 -0700,4K Youtube videos won't play,"<p>I've been trying to fix this for a week now, and nothing has worked. Everytime I try to play a 4K video on Youtube, the player stalls. Audio works, but the image just stays frozen and jumps from time to time. </p><p>I've tried every fix I could find in the Internet. But now I came here to ask for help because I tried the last thing I was avoiding (Refreshing Firefox) and after risking my custom settings, 4K videos still won't work. </p><p>Any ideas? </p><p>I'm on Mac, latest OS version, latest Firefox version. 4K videos work on other browsers </p>",mac-os;desktop;other;firefox-880;,firefox,other,en-US,1416415;,ig.martinez
1338074,2021-06-02 06:51:28 -0700,2021-06-02 06:51:28 -0700,Default theme changed when going to Firefox 89.0,"<p>When I went to version 89.0 today, the default theme was changed so that the title bar turned white when I had it set to light blue and if I had two or more firefox windos up the non active ones were  white as well when they used to be gray.  While I want a light  theme, the present light theme is so white that it hurts my eyes. You had a decent default before, but now it is terrible.  Change it back!  Look at the terrible image below that shows an active and a non active window. </p>",desktop;other;windows-10;firefox-890;,firefox,other,en-US,"",jan.mike.hollis
1338073,2021-06-02 06:39:07 -0700,2021-06-02 06:39:07 -0700,latest update,"<p>The latest Firefox update installed this morning.  When Firefox is started, the window opening/close controls in the upper right corner and the scroll bar on the right side of the window are not visible unless the window is set on full screen.  Provide a fix ASAP. </p>",windows-7;desktop;beta;other;firefox-900;,firefox,other,en-US,"",bobvineyard495
1338072,2021-06-02 06:34:59 -0700,2021-06-02 06:57:21 -0700,where can I restore the last session,<p>where can I restore the last session ? </p>,desktop;other;windows-10;firefox-890;,firefox,other,en-US,1416417;,lyspei
1338071,2021-06-02 06:31:52 -0700,2021-06-02 06:31:52 -0700,Themes 89.0,<p>The new version of Firefox just loaded. The theme of the browser changed. I went to the section which controls themes and found the system theme does not work... There is no difference between when the light theme or the system is selected. I went to the download to see if I could re-install the system theme and did not find it.   </p><p>Light theme is too light and dark theme is too dark. The system theme is a good compromise but not like the one in the previous version which I liked. Is there a way to fix this Firefox issue? </p>,desktop;customize;windows-10;firefox-890;,firefox,customize,en-US,"",dlaurine
1338070,2021-06-02 06:31:19 -0700,2021-06-02 06:31:19 -0700,"Windows ""Accent Color"" on the title / tab bar","<p>Until the update to 89.0 Firefox used to display the Windows 10 ""Accent Color"" (Settings =&gt; Personalization =&gt; Choose your accent color) on the title / tab bar when the browser was the active windows. With 89.0 it's always grey, whether active or inactive. Is there a way to restore the old behavior? I've found some suggestions using CSS and a file named userChrome.css, but these do not seem to work... </p>",desktop;other;windows-10;firefox-890;,firefox,other,en-US,"",marcus.buettemeyer
1338069,2021-06-02 06:30:03 -0700,2021-06-02 06:30:03 -0700,Google Drive isn't displayed correctly (and some QR codes too),"<p>Well, basically this error is pretty weird, it's like an RGB dots pattern and it doesn't dissapear at all and sometimes it changes color from red to green, purple, brown, etc. I disabled all my extensions and nothing worked (I mostly use privacy extensions but there some that blocks objects like canvas) </p><p>This also happened to me with Whatsapp QR codes but I don't remember how it got fixed. From what I know this visual glitch could be caused by a modified preference (I followed <a href=""http://privacytools.io"" rel=""nofollow"">privacytools.io</a>'s Firefox: Privacy Related ""about:config"" Tweaks) but I'm not sure and if I was sure I wouldn't know what preference it is. </p>",desktop;websites;windows-10;firefox-780;,firefox,websites,en-US,"",bigr4nd
1338068,2021-06-02 06:29:06 -0700,2021-06-02 06:43:54 -0700,Disgusting design of the 89th version,"<p>And you could not warn that with the update of the 89th version, such a disgusting design will appear? Who is your designer? A monkey? Bring back the design of the 88th version! It's impossible to work! Not only that, I wanted to roll back to version 88, but I can't use my old profiles! Idiocy!!!! Pay me and I'll draw you a great design! Fire the person who did this to you! If you do not return the tab design from the 88 version and the color in the next update, then I will go to another browser for good! It's impossible to work with this! </p>",desktop;other;windows-10;firefox-890;,firefox,other,en-US,1416412;,wealrich
1338067,2021-06-02 06:27:56 -0700,2021-06-02 08:51:14 -0700,My search box doesn't work after firefox upgraded yesterday,"<p>When I go to do a search, as soon as I type in a letter, it jumps up to the address bar exposing past searches and all, and makes me do my search in the address bar, with my history exposed to everyone in the room which invades my privacy. How can I correct this to the way it used to be that when I searched it stayed in the search box unless I needed to used the url when I wanted to. Very surprised this started happening with the new upgrade. Can I go back to the last upgrade? </p>",desktop;other;windows-10;firefox-890;,firefox,other,en-US,1416424;1416465;,sassybell1
1338066,2021-06-02 06:27:52 -0700,2021-06-02 06:27:52 -0700,How do I shrink the really large fonts in Firefox 89 bookmarks,<p>How do I shrink the really large fonts in Firefox 89  booksmarks </p>,desktop;bookmarks;windows-10;firefox-890;,firefox,bookmarks,en-US,"",roadmaster1
1338064,2021-06-02 06:21:54 -0700,2021-06-02 06:21:54 -0700,Separate userChrome.css configs for browser.proton.contextmenus.enabled,"<p>``` 	/* //# Items padding */ 	menupopup &gt; menuitem, menupopup &gt; menu { 		padding-block: 1px !important; 	} ``` has different results for this about:config setting . </p><p>I can  ``` 	@media (-moz-proton) { 		menupopup &gt; menuitem, menupopup &gt; menu { 			padding-block: 4px !important; 		} 	} ``` , but this works only if browser.proton.enabled is true that adds some changes i don't want . </p><p>How would it be possible to define different values to apply depending on browser.proton.contextmenus.enabled state ? </p>",desktop;other;windows-10;firefox-890;,firefox,other,en-US,"",accZ2
