id,created,updated,title,content,tags,product,topic,locale,answers,creator
1354843,2021-10-21 07:55:51 -0700,2021-10-21 07:55:51 -0700,Facebook,<p>Some pictures do not show on Facebook </p>,desktop;other;windows-10;firefox-930;,firefox,other,en-US,"",sjkline
1354837,2021-10-21 07:16:06 -0700,2021-10-21 07:16:06 -0700,How to remove multiple cpoies of the same bookmark?,<p><strong>bold text</strong>How to remove copies of the same book mark? Sometimes I have five or more copies to the same book mark. I think this comes from changing browsers again and going back to Firefox. </p>,desktop;bookmarks;windows-10;firefox-930;,firefox,bookmarks,en-US,"",bzyma
1354836,2021-10-21 06:13:14 -0700,2021-10-21 06:13:14 -0700,no sound,"<p>i was  at <a href=""https://totalbattle.com"" rel=""nofollow"">https://totalbattle.com</a> and it gave me a message for cookies yesterday i accepted it ,but scince then my browser has no sound , i have closed browser and opened it up , restarted my pc , turned off  any extentions i can find  and still no sound . I used media player and i got sound there so i know it isn;t my hardware , also got sound in other games . Please help me figure out what happened and how to fix it , i ran out of ideas </p>",desktop;cookies;windows-10;firefox-930;,firefox,cookies,en-US,"",infusion_96
1354835,2021-10-21 06:12:25 -0700,2021-10-21 06:12:25 -0700,falsh player settings,<p>Flash player settings </p>,desktop;other;,firefox,other,en-US,"",surisubbiah
1354833,2021-10-21 05:37:15 -0700,2021-10-21 05:37:15 -0700,"Forced to continuously update from ""older version"" when already using newest version = resets profile",<p>This is happening on a regular basis and happening more frequently. results in a requirement to create a new profile. </p>,desktop;other;windows-10;firefox-780;,firefox,other,en-US,"",joshroper
1354829,2021-10-21 05:18:32 -0700,2021-10-21 05:18:32 -0700,deletion of firefox account with the email address d2onovangregg@yahoo.com needed as i have no longer  got access to it,<p>GOOD DAY FIREFOX OR MOZILLA SUPPORT I WOULD LIKE YOU.S TO DELETE MY FIREFOX ACCOUNT WITH THE EMAIL ACCOUNT d2onovangeregg@yahoo.com as i have no longer  got access to it </p>,desktop;privacy-and-security_1;windows-10;firefox-930;,firefox,privacy-and-security,en-US,"",donovangregg25
1354826,2021-10-21 02:45:55 -0700,2021-10-21 02:45:55 -0700,Automatically accept selected cookies when all cookies are deleted on exit,"<p>I delete my cookies the end of each session. So when I reload FF and revisit any sites that require cookies I have to click to accept, which is tiresome. Can I set certain trusted sites to automatically recreate cookies? I find the 'manage data' panel very confusing - I'm not sure what I'm blocking and allowing. Please see screen shot of settings. </p><p>Windows 10 PC. Not using private mode. </p><p>Rob </p>",desktop;cookies;windows-10;firefox-930;,firefox,cookies,en-US,"",robashcroftwales
1354822,2021-10-21 01:39:01 -0700,2021-10-21 01:39:01 -0700,Restore tabs on open when having more than one window open,"<p>I have set a number of pinned tabs and leave a few other tabs always open. I set Firefox to restore the tabs when I close it and reopen it. Most of the time I have just one Firefox window open and this works fine. Occasionally, however, I need to open a second window usually with just one tab and if I forget and close the main Firefox window with the pinned tabs, etc before the single window one, Firefox reloads this single tab when I reopen it. Is there a way to avoid this behaviour? </p>",linux;desktop;tabs;firefox-930;,firefox,tabs,en-US,"",entodoays
1354821,2021-10-21 01:36:25 -0700,2021-10-21 01:36:25 -0700,Scomparsa la X per cancellare il testo nella finestra ricerca tra i bookmarks,"<p>Magari mi sbaglio io, ma ho sempre utilizzato la finestrella della ricerca tra i bookmarks in alto a sinistra, e ricordo che c'è sempre stata la X per cancellarne il contenuto. Non ho idea di quando esattamente sia scomparsa, ma nella v93 non c'è più. </p><p>Tnx </p>",desktop;bookmarks;windows-10;firefox-930;,firefox,bookmarks,it,"",qmax1
1354819,2021-10-21 01:05:11 -0700,2021-10-21 04:35:20 -0700,Firefox very slow & stop any responding without any notification,"<p>I'm using intel core I3 8th generation PC with 5Mbps internet. But when I enter a website scrolling response delay &amp; sometimes fridge. I need solution otherwise I've to uninstall Mozilla Firefox. For your info, I love using Firefox but now I'm helpless. Because, I've to work with browser minimum 8 hours in a day. Please take this issue urgently and help me. </p><p>Note: There ware no issue before update Firefox version 93.0. </p>",desktop;fix-problems;windows-10;firefox-930;,firefox,fix-problems,en-US,1452613;,arafathossain338
1354818,2021-10-21 01:00:40 -0700,2021-10-21 01:00:40 -0700,Migrating normal Firefox profiles to Firefox ESR ones,"<p>We have around 1000 Firefox installations on our government organization, all installed via the Firefox MSI installer. Unfortunately, we came late to realize that the Firefox ESR would be a much more suitable product, compared to the normal Firefox branch. </p><p>Now, some years ago we would simply mass uninstall the normal Firefox and mass install the (latest) ESR version and all would be well. Problem is that we have to keep existing profiles (including passwords/bookmarks etc), something that is not supported in the latest Firefox builds. </p><p>Can anyone offer some advice/""hacks"" to accomplish this? Note that whatever we'll do, we'll have to do it automatically, we lack the man-power to do this manually on a system by system basis... </p><p>Thanks in advance for any information provided. </p>",desktop;download-and-install_1;escalate;esr;windows-10;enterprise;firefox-930;,firefox,download-and-install,en-US,"",carmik
1354816,2021-10-21 00:07:41 -0700,2021-10-21 00:07:41 -0700,Pocket Won't Lod - appears to be in a loop,<p>In Firefox - trying to access Pocket to save some files....but POCKET won't load.  It appears it's in a loop. </p>,desktop;websites;windows-10;firefox-910;,firefox,websites,en-US,"",tomcrossonsr
1354815,2021-10-21 00:07:28 -0700,2021-10-21 04:40:26 -0700,Updated Firefox does not display some content on my Joomla website www.oz4034.com,"<p>I have been a Firefox user for over a decade. It is the best &amp; most secure browser. Unfortunately the recent Firefox upgrade no longer displays a module in the left column of my website <a href=""http://www.oz4034.com"" rel=""nofollow"">www.oz4034.com</a>. I hadn't changed anything, and Google Chrome displays it correctly, so take a look. Don't know what has changed. Please advise ! </p>",desktop;websites;windows-10;firefox-930;,firefox,websites,en-US,1452614;,admin468
1354813,2021-10-20 21:56:33 -0700,2021-10-21 04:41:02 -0700,Cannot add or delete bookmarks,<p>I cannot add or delete bookmarks. </p>,desktop;bookmarks;windows-10;firefox-930;,firefox,bookmarks,en-US,1452615;,3peterkubicki
1354807,2021-10-20 20:14:13 -0700,2021-10-20 20:14:13 -0700,How do you CHANGE the location (away from Drive C) where Firefox stores temporary files (reprise)?,"<p>I'm trying to find a way to change where Firefox 93 stores my temporary internet files away from C Drive to a different drive to reduce lag. I found an article on how to do it using the about:config utility, but I can't do what that article describes — right-clicking in the about:config browser does not give me the option to create a new string; there is no ""new"" option. </p><p>How do I change this in Firefox 93? </p>",desktop;fix-problems;windows-10;firefox-930;,firefox,fix-problems,en-US,"",Darkeforce
1354805,2021-10-20 20:06:10 -0700,2021-10-21 04:41:36 -0700,firefox and My Yahoo home page,<p>I am having the same problem on firefox and Edge in loading the My Yahoo page. Very slow and it takes several retry's to get all information displayed correctly. </p>,desktop;fix-problems;windows-10;firefox-900;,firefox,fix-problems,en-US,1452617;,dwebspider
1354804,2021-10-20 20:05:44 -0700,2021-10-20 20:05:44 -0700,Increase storage capacity / Aumentar capacidad de almecenamiento,"<p>On some pages when I enter information in forms a certain number is stored, but I want that capacity to be a little larger. How can I do it. </p><p>En algunas páginas cuando ingreso información en formularios se almacena cierto número, pero quiero que sea un poco más grande esa capacidad. Como puedo </p>",desktop;other;windows-10;firefox-930;,firefox,other,es,"",alex.araque
1354802,2021-10-20 19:35:19 -0700,2021-10-20 19:35:19 -0700,Add ons.,"<p>Hello, I uploaded a Add on Theme, It says Firefox Browser Add-ons and it says "" Installation aborted because the add-on appears to be corrupt."" What do i do? The link to it is  <a href=""https://addons.mozilla.org/en-US/firefox/addon/mix-of-colours/"" rel=""nofollow"">https://addons.mozilla.org/en-US/firefox/addon/mix-of-colours/</a> </p>",desktop;other;windows-10;firefox-930;,firefox,other,en-US,"",masonjlee2809
1354800,2021-10-20 18:34:49 -0700,2021-10-20 18:34:49 -0700,Firefox and Audible.com,"<p>Hi all, For years, I have used Firefox to download audiobooks from <a href=""http://Audible.com"" rel=""nofollow"">Audible.com</a>. I go to <a href=""http://Audible.com"" rel=""nofollow"">Audible.com</a>, open my library, click download, and then a pop up shows the .aax file I'm going to download. The problem - In the past week, the pop up window now shows that I'm about to download a .mp4 file. That doesn't play nice with Apple Books or my iPhone. I've called Audible several times, but they haven't been able to help. If I use Safari, the .aax file is downloaded correctly. This is a Firefox issue. Any ideas here? </p><p>Thanks for your time and help! --Scott </p>",mac-os;desktop;websites;firefox-930;,firefox,websites,en-US,"",seschreiber
1354799,2021-10-20 18:25:59 -0700,2021-10-20 18:25:59 -0700,Transfer of Local Folders,<p>I have just bought a new laptop and followed the directions to copy my profile across.  It did not copy or transfer my local folders though.  I have seen some old threads about this but need it broken down very simply please as I am zero technology geek  </p>,mobile;download-and-install_1;windows-10;firefox-930;,firefox,basic-browsing-firefox,en-US,"",CFryer
1354798,2021-10-20 18:22:03 -0700,2021-10-21 06:59:17 -0700,Internet history,<p>I have an issue where I think someone hacked my computer and accessed internet sites causing financial problems for me. When I search the internet history 4 and 5 months back I get the same results for month 4 as I get for month 5. I know the location and times I am looking for but they are not showing up in the history (thinking that I did this and don;t remember). Ay idea how I can determine if access was established by my computer or why I am seeing duplicate information on different months? </p>,windows-7;desktop;other;firefox-930;,firefox,other,en-US,1452587;1452619;1452639;,tld6008
1354796,2021-10-20 18:05:23 -0700,2021-10-20 18:23:11 -0700,Web API: WebGPU,"<p>I have Firefox Nightly and noticed the<strong>Web API: WebGPU</strong> possibility, please explain what it is for? </p>",desktop;other;windows-10;,firefox,other,en-US,1452581;,primalbaily
1354795,2021-10-20 17:54:51 -0700,2021-10-20 18:11:14 -0700,"firefox will not open gmail, this started on the 19/10/21 and I can find no answers. Looks like I will have to leave my favourite browser","<p>firefox will not open gmail, this started on the 19/10/21 and I can find no answers. Looks like I will have to leave my favourite browser </p>",mac-os;desktop;websites;firefox-930;,firefox,websites,en-US,1452574;,kathyandtonysmith
