id,created,updated,title,content,tags,product,topic,locale,answers,creator
1335648,2021-05-09 20:02:16 -0700,2021-05-09 20:02:16 -0700,"Font keeps changing to Symbol font in broswers, web sites and emails",<p>Will not hold a font - I have to clear history and then reboot computer then it's fine for a about an hour then changes to a Symbol font - goes from Times to Times Symbol. see screen shot below . </p><p>Yes I have gone into preferences and changed the font to Helvetica now but still changes to times symbols after about an hour - never had this problem before downloading 88.0.1 (64-bit) </p>,mac-os;desktop;other;firefox-880;firefox-8801;,firefox,other,en-US,"",sue.kramer
1335646,2021-05-09 19:50:04 -0700,2021-05-09 19:50:04 -0700,What happened to Firefox Version 88.0.1?,"<p><strong>Is this known behavior?  Has it been reported to Mozilla?</strong>  Found nothing from a search. </p><p>What happened to FireFox Version 88.0.1?  I updated to this version yesterday after a lot of nagging from popups. </p><p>Prob 1.  Try to open a link from email and I get, ""Secure Connection Failed An error occurred during a connection to <a href=""http://input.mozilla.org"" rel=""nofollow"">input.mozilla.org</a>. PR_CONNECT_ABORTED_ERROR       The page you are trying to view cannot be shown because the authenticity of the received data could not be verified.      Please contact the website owners to inform them of this problem.""   </p><p>When I try the same link in Safari, which tends to be grumpier than Firefox about security issues. it works just fine; no complaints and the page opens. </p><p>Prob 2 ( IMO related ).  Try to open a bookmark and I get, ""The connection was reset </p><p>The connection to the server was reset while the page was loading. </p><pre>   The site could be temporarily unavailable or too busy. Try again in a few moments.    If you are unable to load any pages, check your computer’s network connection.    If your computer or network is protected by a firewall or proxy, make sure that Firefox is permitted to access the Web."" </pre> <p>Again, when I try the same link or site in Safari, works just fine. </p><p>OS MacOS Big Sur Version 11.2.3 </p>",desktop;other;,firefox,other,en-US,"",pwityk
1335643,2021-05-09 19:36:14 -0700,2021-05-09 19:36:14 -0700,Firefox download prompt closing tab or window if open too long?,"<p>I recently noticed that if I am downloading or opening a file, if I do not click open or save fast enough it will Firefox will close the tab or window from which I am trying to download. </p><p>This seems to have started with version 88, but I am not sure. </p><p>The close can happen after just a few seconds to possibly over a minute. </p><p>To replicate I need to click on file link and when the dialog box come up to open or save, I just leave the dialog without making a selection and then the tab or window closes leaving the ope dialog box. </p><p>Can anybody tell me what this is called or how to stop this behavior? </p>",desktop;websites;,firefox,websites,en-US,"",elkinm
1335642,2021-05-09 19:02:25 -0700,2021-05-09 19:02:25 -0700,일부 사이트 전체커서 드레그 불가,<p>안녕하세요 기존엔 잘 되었다가 어느순간 부터 브라우져상 글 또는 숫자를 복사하려 커서를 드레그하면 전체가 안되고 일부만 드레그 되고 있습니다 다른 크롬은 잘되는것으로 확인하였고 해당 파이어폭스에서만 나타나는 증상으로 설정을 다르게 해야 하는지 문의 드립니다. </p>,desktop;websites;windows-10;firefox-880;,firefox,websites,en-US,"",kjhw3422
1335640,2021-05-09 18:40:51 -0700,2021-05-09 18:40:51 -0700,Copy-Paste Function - Double images posted on FF,"<p>I've been having issues with double-images being pasted on Firefox 88.0.1 (64-bit).  I find it annoying because I end up deleting the second image on the site that I'm working on. </p><p>Initially, i thought that the keyboard that I'm using was a bit sensitive however, when I do paste of the screenshot that I've taken via other web browser (Chrome, Edge, Opera), it only pastes 1 image.  </p><p>I've been reading some archived articles but nothing was mentioned about a fix on Firefox (or unless I've missed it).  Is there something that I need to disable/enable on the Settings page? </p>",desktop;other;windows-10;firefox-880;,firefox,other,en-US,"",d0nnsk1.x
1335638,2021-05-09 17:55:19 -0700,2021-05-09 17:55:19 -0700,"playing video on YouTube, when controls visible, half video palyback has horizontal lines","<p>I was on DashCams Australia, for this example. This started happening about a month ago, after an update (of course). I have also updated to see if it fixes. Some youtube videos this doesn't happen with. Don't ask me to identify playback method. I just click play Firefox Settings is to block audio and video autoplay globally. I'll select when a video is to play Linux 20.04 KDE Plasma 5 Firefox 87.0 Ublock, Noscript, HTTPS Everywhere, Privacy Badger </p>",desktop;other;,firefox,other,en-US,"",charles.davids.1999
