id,created,updated,title,content,tags,product,topic,locale,answers,creator
1333727,2021-04-23 01:00:13 -0700,2021-04-23 01:01:04 -0700,Alpha overlays appear to have screen corruption on some sites,"<p>This question relates to my use of Firefox 88 on MacOS 10.14.6 on a dual-GPU retina MacBook Pro (15-inch, 2018). I'm using a dual external monitor set-up, and still running 10.14 due to 32-bit compatibility issues with some of my (scientific, bespoke) software.  </p><p>I am pretty sure that there is a very odd, browser-level bug in alpha display on my system that leads to, for example, the overlay of YouTube's UI appearing peppered with row-wise stripes of other colours; or PDF page previews not displaying properly. There is nothing relevant displayed in either the (JS) console log; `dmesg` or MacOS's Console.app application. The appearance of the stripes / corruption is randomly different each time: it is different in private browsing mode to not, for example, and refreshing the page alters their exact appearance.  </p><p>I have done the obvious things of disabling hardware acceleration -- no change -- trying in a new private window with no extensions / addons loaded -- no difference -- but I do not necessarily want to nuke everything and try again. This problem has existed for as long as I have used FF on this computer, but I am just reporting it now. Mostly it's fine, aside from one variety of captcha that I cannot solve!  </p><p>I have no idea how to go about debugging this and alas I don't have the time to do it ""properly"" -- I am on a system with SIP disabled and can easily load up FF in lldb, for example, if someone could give me targeted advice. I am not a web developer and do not know the exact api call that causes this -- but it appears to be used in pdf.js' sidebar page overlay code, but not the actual page itself. Most PNGs, SVGs etc are fine.  </p><p>Please see the attached series of screenshots – if it's not clear what I've done (the same youtube video in and out of private browsing mode with no extensions, a PDF viewer; and that page reloaded showing a different pattern), please don't hesitate to ask -- the corruption is pretty visible in all cases, I think. The fact that I can screenshot this and share it with you means, I think, that it is not an OS-level graphics driver bug and is probably a rendering bug.  </p><p>Thanks for your help, and sorry if this is the wrong forum! </p>",desktop;fix-problems;mac-os-1014;firefox-880;,firefox,fix-problems,en-US,1407938;,landak123
1333725,2021-04-23 00:43:32 -0700,2021-04-23 00:43:32 -0700,Firefox Update broke my company's printing config,"<p>Hello, </p><p>since the latest update I experience problems with printing. In my store we print hundreds of little slips every day, they are the size of 1/3 of A4 format.  </p><p>The webapp which prints them generates an A4 PDF, where only the top 1/3rd of the page is actually filled with information. Usually we print this via systems dialog, we have it set to print on Letter DL format, change the orientation 90 degrees and zoom to 270%, which gives us a perfect result. </p><p>As of yesterdays update, Firefox somehow changed the alignment rules, and the zoomed-in page now gets centred instead of aligned left, which completely breaks our process. </p><p>Is there any way to force left alignment? This is affecting two different machines exactly on the day of the update rollout. Changelog only says the print margins have been changed but I believe also the alignment has been affected by that. </p><p>Thx </p>",desktop;customize;,firefox,customize,en-US,"",info5314
1333724,2021-04-23 00:02:14 -0700,2021-04-23 00:02:14 -0700,SSL_ERROR_BAD_CERT_DOMAIN happening with email links again,"<p>Hi all, </p><p>I'm having a repeat of this issue: <a href=""https://support.mozilla.org/en-US/questions/1291551"" rel=""nofollow"">https://support.mozilla.org/en-US/questions/1291551</a> </p><p>Again some links from emails have been giving me the ""Warning: Potential Security Risk Ahead"" page with the error message ""SSL_ERROR_BAD_CERT_DOMAIN"". I get this in safe mode but not in private browsing. I have tried <em>all</em> of the fixes suggested last time I asked about this problem including deleting cert9.db but that hasn't worked this time (so maybe it wasn't the fix last time either). </p><p>To be explicit, I've tried all fixes on these pages so please don't suggest them again without providing an explanation about why you think it will work (a technical explanation please): <a href=""https://support.mozilla.org/en-US/kb/troubleshoot-SEC_ERROR_UNKNOWN_ISSUER"" rel=""nofollow"">https://support.mozilla.org/en-US/kb/troubleshoot-SEC_ERROR_UNKNOWN_ISSUER</a> <a href=""https://support.mozilla.org/en-US/kb/firefox-cant-load-websites-other-browsers-can"" rel=""nofollow"">https://support.mozilla.org/en-US/kb/firefox-cant-load-websites-other-browsers-can</a> <a href=""https://support.mozilla.org/en-US/kb/firefox-and-other-browsers-cant-load-websites"" rel=""nofollow"">https://support.mozilla.org/en-US/kb/firefox-and-other-browsers-cant-load-websites</a> <a href=""https://support.mozilla.org/en-US/kb/secure-connection-failed-error-message"" rel=""nofollow"">https://support.mozilla.org/en-US/kb/secure-connection-failed-error-message</a> <a href=""https://support.mozilla.org/en-US/kb/connection-untrusted-error-message"" rel=""nofollow"">https://support.mozilla.org/en-US/kb/connection-untrusted-error-message</a> <a href=""http://kb.mozillazine.org/Error_loading_websites"" rel=""nofollow"">http://kb.mozillazine.org/Error_loading_websites</a> <a href=""https://support.mozilla.org/en-US/kb/what-does-your-connection-is-not-secure-mean"" rel=""nofollow"">https://support.mozilla.org/en-US/kb/what-does-your-connection-is-not-secure-mean</a> <a href=""https://support.mozilla.org/en-US/kb/websites-dont-load-troubleshoot-and-fix-errors"" rel=""nofollow"">https://support.mozilla.org/en-US/kb/websites-dont-load-troubleshoot-and-fix-errors</a> </p><p>And also this one, which is actually related to the message (none of the above are): <a href=""https://support.mozilla.org/en-US/kb/what-does-your-connection-is-not-secure-mean#w_ssl-error-bad-cert-domain"" rel=""nofollow"">https://support.mozilla.org/en-US/kb/what-does-your-connection-is-not-secure-mean#w_ssl-error-bad-cert-domain</a> </p><p>Some examples of links that I get this message for: <a href=""https://click.mail10.smallworldlabs.net/ls/click?upn=4FIN3hZFvI-2BP9iq5nue2vk-2BIMF5sm7TLqXM-2BBHmHs4tQjfdaurWm34ztLj9SPiVE4gseyCl-2FaqSWT59ygV9BpAcDzFkriqc5NC2qBiwl5aOaxL8F5mgo-2BFX-2Fgbi7iwZeFhIlJVBY5pUPWQy6owSYMskwXWDY7Y1aaoMS-2BkHbmCPTNSg29Z4JoYD7fjx9bZW5b2-2Fg5dX2SSuZS5csOf3H6IGmB8UNGulRns8j4EzznpinCvgJxocujRrlszMnMzDFaGlZcc-2BWOcJNASuRsaEH6HcXAoqMnLhDAoAdn0UChLWOY-2FfbP2Ib-2FUEDr6NloUbD-2FnHqHVVYd821nihjMp740-2F5x7GMXZmwRiFR7H2o2PqTC4rmR-2BSqxJ-2BuAl15SvxjWYbO9ClP8PSHw5pY80IikJqK10tVO8wFNKUY0vnffi80-3DW8m3_a4b-2FpboTDHPk-2BrdoYKQMvkNzRfSbL-2BRxE8OVpRrBC237mTF3qcpluLuTnfAWEU7fFwhhtOg-2BbDd1pxD5bmCpb3y8948sPEH5oTF-2Fsg1k82R-2Be5SnCvGNogmdD1MB5K11JV0Ow8rxc63etMs7M6GZzfslGWbxLHW9hydaH2RME5RPXqcBAsIRau-2FizQsq15rW5BclijLm23gWXw-2BvlJjO8gxiJ-2BQwpw2wvKihYGT4DKxPTObnz-2Fpn1ua2ng0ah-2BN1xDub-2Bav5GSEDaq4OPiG8JUArfSPtya-2ByoEn6CzLpZaqsLJ5rbTCztuAV25pOmNhojUORS-2Fnyv8FFlz-2Fh4EX6xolAvA1UgOdaXT3xescKfmROnAvFsYyB88QxIKBXi1-2Br"" rel=""nofollow"">https://click.mail10.smallworldlabs.net/ls/click?upn=4FIN3hZFvI-2BP9iq5nue2vk-2BIMF5sm7TLqXM-2BBHmHs4tQjfdaurWm34ztLj9SPiVE4gseyCl-2FaqSWT59ygV9BpAcDzFkriqc5NC2qBiwl5aOaxL8F5mgo-2BFX-2Fgbi7iwZeFhIlJVBY5pUPWQy6owSYMskwXWDY7Y1aaoMS-2BkHbmCPTNSg29Z4JoYD7fjx9bZW5b2-2Fg5dX2SSuZS5csOf3H6IGmB8UNGulRns8j4EzznpinCvgJxocujRrlszMnMzDFaGlZcc-2BWOcJNASuRsaEH6HcXAoqMnLhDAoAdn0UChLWOY-2FfbP2Ib-2FUEDr6NloUbD-2FnHqHVVYd821nihjMp740-2F5x7GMXZmwRiFR7H2o2PqTC4rmR-2BSqxJ-2BuAl15SvxjWYbO9ClP8PSHw5pY80IikJqK10tVO8wFNKUY0vnffi80-3DW8m3_a4b-2FpboTDHPk-2BrdoYKQMvkNzRfSbL-2BRxE8OVpRrBC237mTF3qcpluLuTnfAWEU7fFwhhtOg-2BbDd1pxD5bmCpb3y8948sPEH5oTF-2Fsg1k82R-2Be5SnCvGNogmdD1MB5K11JV0Ow8rxc63etMs7M6GZzfslGWbxLHW9hydaH2RME5RPXqcBAsIRau-2FizQsq15rW5BclijLm23gWXw-2BvlJjO8gxiJ-2BQwpw2wvKihYGT4DKxPTObnz-2Fpn1ua2ng0ah-2BN1xDub-2Bav5GSEDaq4OPiG8JUArfSPtya-2ByoEn6CzLpZaqsLJ5rbTCztuAV25pOmNhojUORS-2Fnyv8FFlz-2Fh4EX6xolAvA1UgOdaXT3xescKfmROnAvFsYyB88QxIKBXi1-2Br</a> </p><p>Web sites prove their identity via certificates. Firefox does not trust this site because it uses a certificate that is not valid for <a href=""http://click.mail10.smallworldlabs.net"" rel=""nofollow"">click.mail10.smallworldlabs.net</a>. The certificate is only valid for the following names: *.sendgrid.net, <a href=""http://sendgrid.net"" rel=""nofollow"">sendgrid.net</a> </p><p>Error code: SSL_ERROR_BAD_CERT_DOMAIN </p><p><a href=""https://click.topgear.bbc.com/?qs=c719f0befb99016fe4d64e88dc7ec435f7eee7452916295aaa562fc47d530c91af5900c5d298ac67019e3560abca9b8eab0be3a91e8e632f"" rel=""nofollow"">https://click.topgear.bbc.com/?qs=c719f0befb99016fe4d64e88dc7ec435f7eee7452916295aaa562fc47d530c91af5900c5d298ac67019e3560abca9b8eab0be3a91e8e632f</a> </p><p>Firefox does not trust this site because it uses a certificate that is not valid for <a href=""http://click.topgear.bbc.com"" rel=""nofollow"">click.topgear.bbc.com</a>. The certificate is only valid for <a href=""http://origin-click.s6.exacttarget.com"" rel=""nofollow"">origin-click.s6.exacttarget.com</a>. </p><p>Error code: SSL_ERROR_BAD_CERT_DOMAIN </p><p>Please tell me if you need more info. All helpful suggestions much appreciated. </p><p>Thanks :) </p>",desktop;fix-problems;windows-10;firefox-870;,firefox,fix-problems,en-US,"",madb1lly
1333723,2021-04-23 00:01:00 -0700,2021-04-23 00:03:40 -0700,In-view extensions freeze Firefox for 60 seconds,"<p>I just installed Firefox (88.0) on a brand new Surface Pro, signed in to my Firefox Account, which gets me my stuff synced over, such as the Grammarly, LastPass and Pushbullet extensions. I log into those respective applications as needed. I start browsing. </p><p>Now, when I open either of those extensions from the menu bar, they open their little in-place window. If I now touch anything in these windows, about 80% of the time the following happens: </p> <ul><li> The little in-place window closes </li><li> Firefox becomes unresponsive (menus, other controls, web pages, close window) </li><li> This lasts for <strong>60 seconds</strong> (reliably) </li></ul> <p>However: </p> <ul><li> If the extension is visible on the menu bar: <strong>problem happens</strong> </li><li> If the extension is tucked away in ""&gt;&gt;"" (More tools...): <strong>no problem</strong> (this is also a decent-ish workaround) </li></ul> <p>Given that this affects multiple extensions, I'd expect this to be a Firefox issue. Also, I have no idea how to troubleshoot this (I have not been able to find logs). </p><p>Things I tried to no avail: </p> <ul><li> Refresh (through installer) </li><li> Cleaned out profile manually </li><li> Tried extensions before logging them in </li></ul> <p>Thank you for your help. </p>",linux;desktop;fix-problems;firefox-870;,firefox,fix-problems,en-US,1407930;,sander14
1333722,2021-04-22 23:43:04 -0700,2021-04-22 23:44:14 -0700,Manage passwords menu option removed from Firefox account menu button?,"<p>Up to some days ago I had the extremely handy option to look up a stored password in sync, by clicking on the firefox account button in the toolbar. In the menu that opened there was an option to view (add? manage?) stored accounts and passwords. Two clicks and that was it. </p><p>Today I tried to do the same thing, but instead of the usual menu options I was greeted with 5-6 options relating to the firefox account, and a zillion of my synced bookmarked pages from other devices. Where has the ultra-used (perhaps the single most used button on my browser, besides the back/forward ones and ctrl+h to open history) option of opening Lockwise gone to? </p><p>Please God, don't let this one be a ""usability"" improvement... </p>",desktop;sync;windows-10;firefox-880;,firefox,sync,en-US,1407928;,carmik
1333721,2021-04-22 23:41:05 -0700,2021-04-22 23:41:05 -0700,Untrusted certificate for a government official website,"<p>Good Day. Connection to the official French Tax website <a href=""https://cfspart.impots.gouv.fr"" rel=""nofollow"">https://cfspart.impots.gouv.fr</a> (French IRS-equivalent) is not authorized on my browser (Firefox 78.10.0esr / MacBookPro OSX 10.11.6) although this browser version is said to be supported by the governmental Tax website. </p><p><strong>Someone could be trying to impersonate the site and you should not continue. </strong> Websites prove their identity via certificates. Firefox does not trust <a href=""http://cfspart.impots.gouv.fr"" rel=""nofollow"">cfspart.impots.gouv.fr</a> because its certificate issuer is unknown, the certificate is self-signed, or the server is not sending the correct intermediate certificates. Error code: SEC_ERROR_UNKNOWN_ISSUER<strong> </strong> </p><p>Can anyone help on this one ? Thanks a lot in advance best </p>",mac-os;desktop;websites;firefox-780;,firefox,websites,en-US,"",kevin.legent
1333720,2021-04-22 23:36:48 -0700,2021-04-23 01:38:12 -0700,"What happened to Tools, Web Development, Network?","<p>Hi All, </p><p>Fedora 33 firefox-87.0-12.fc33.x86_64 </p><p>What happened to </p><p>--&gt; Tools </p><pre>   --&gt; Web Development      --&gt; Network </pre> <p>I really need this functionality back! </p><p>-T </p>",linux;desktop;other;firefox-870;,firefox,other,en-US,1407939;1407943;,margochester
1333719,2021-04-22 23:28:53 -0700,2021-04-23 06:15:53 -0700,"Sağ tık ""resme bak""","<p>Merhaba, Bir resme sağ tıkladığımda açılan menüde ""resme bak"" seçeneği vardı ama şimdi o seçenek bulunmuyor. Ne olmuş olabilir ki bu seçenek kayboldu. Teşekkür ederim. </p>",desktop;other;windows-10;firefox-880;,firefox,other,tr,1407994;1407995;,nabayli
1333718,2021-04-22 23:15:25 -0700,2021-04-23 12:45:11 -0700,Add-on dev: How can I edit Firefox UI CSS?,"<p>I'm developing an add-on for Firefox which will take the colors from the favicon of the current tab to color bits of the tab-bar dynamically. </p><p>I'm having trouble finding out how I can modify browser CSS, for example in the Browser Tool box console, this works perfectly fine: ```const activeTab = document.querySelector('.tabbrowser-tab[selected=""true""] .tab-background'); activeTab.style.background = ""rgb(0, 221, 255)"";``` </p><p>but when inputting this same code in my add-on, it cannot query that same selector (I've given it tabs and theme permissions). This also does not work as a stylesheet. </p><p>Can anyone point me to what I need to access the browser UI DOM? </p>",desktop;customize;windows-10;,firefox,customize,en-US,1408094;,dukevinjduke
1333717,2021-04-22 22:59:16 -0700,2021-04-23 03:55:44 -0700,Firefox Developer edition,<p>My Firefox Developer Edition crashed. The menu disappeared all of a sudden and I can't get to any websites now.  I tried removing everything FF related on my Macbook Pro and then downloading again and it still looks like the screen shot included here. Nothing going on at the top anymore and it looks like it's 'applying update' but this never ends. </p><p>Any ideas what might be the cause of this? And what I can try to fix it? </p><p>This seemed to all happen at the same time I was working on a GoDaddy managed WordPress website - while pushing my staging site to the production site. GoDaddy said their system software was being updated but that shouldn't affect a browser. </p><p>Thank you for any info you can give! </p>,desktop;other;,firefox,other,en-US,1407974;,gomez.me
1333715,2021-04-22 21:45:18 -0700,2021-04-22 21:45:18 -0700,"Right click ""copy image location"" is gone, gone, gone ...","<p>For years I've been right clicking on memes and GIFs, selecting ""copy image location,"" and pasting it in a forum on a website. I know there are other ways of accomplishing this but losing the ease factor of ""copy image location"" is AWFUL. In retrospect, the simplicity of it was breathtaking. Does anyone know the possibility of its return in an update? </p>",desktop;websites;windows-10;firefox-880;,firefox,websites,en-US,"",stylecramp1
1333714,2021-04-22 21:28:34 -0700,2021-04-22 22:19:55 -0700,Sobre o Firefox,"<p>Como faço para meu firefox voltar a pegar, ele aparece conectando mais nn acha o site </p>",desktop;fix-problems;,firefox,fix-problems,pt-BR,1407919;,ls4309691
1333713,2021-04-22 21:25:18 -0700,2021-04-22 21:25:18 -0700,Can I recover my Firefox Bookmarks,"<p>Unfortunately my main desktop computer decided it no longer wants to boot up. I was using Firefox as my browser and would like to know if there is some way I can get all my bookmarks back. I have a second desktop computer and was wondering if I opened a Firefox account on that computer and then signed in with the same email and password, would I be able to see all my bookmarks or am I simply out of luck? </p><p>Thank you for your help--Matt </p>",desktop;bookmarks;windows-10;firefox-880;,firefox,bookmarks,en-US,"",mcmlekush
1333712,2021-04-22 21:17:45 -0700,2021-04-22 21:17:45 -0700,Downloading attachments causes email to close and return to inbox - how to stop this?,"<p>Every time I try to download attachments, the original email closes and I am returned to the inbox. Not so much of a problem if I am working from the inbox, but an absolute pain when I am working from sub-folders. </p><p>How can I stop this? </p><p>Thanks, </p><p>Shaun. </p>",desktop;fix-problems;windows-10;firefox-870;,firefox,fix-problems,en-US,"",smclewin
1333711,2021-04-22 21:15:50 -0700,2021-04-22 21:15:50 -0700,Screenshot is not complete,<p>Firefox's screenshot is not complete.  The picture saved is just a incomplete part of the area you select. As shown in pictures attached. </p>,desktop;fix-problems;windows-10;firefox-780;,firefox,fix-problems,en-US,"",Smith3451
1333710,2021-04-22 21:03:31 -0700,2021-04-22 21:31:14 -0700,'Restart With Add-ons Disabled' No Longer Showing Under Settings > Help > After Firefox Version Update,<p>'Restart With Add-ons Disabled' No Longer Showing Under Settings &gt; Help &gt; After Firefox Version Update </p>,windows-7;desktop;customize;firefox-880;,firefox,customize,en-US,1407906;,fleur.delamour
1333709,2021-04-22 20:56:25 -0700,2021-04-23 10:15:35 -0700,"Permissions set cookie ""Allow for Session""","<p>Can someone please tell me why Firefox has remove Page Info on the right click? </p><p>Sense Firefox doesn't have a setting to set all cookies to ""Allow for Session"", I have been doing it by my self on every page I see. I right click, select Page info, go to permissions then change ""Set Cookie"" from default, which is ""Allow"" to ""Allow for Session"".  </p><p>I read their update page before I updated, and no where on the page do they mention removing page info and for what reason. </p><p>Does anybody have an idea why? </p>",windows-7;desktop;cookies;firefox-870;,firefox,cookies,en-US,1407912;1408047;1408050;,lucskywalker2000
1333708,2021-04-22 20:31:02 -0700,2021-04-22 20:31:02 -0700,refresh firefox,<p>in previous versions  when you refreshed firefox it would send a file to my desktop  where it gave the add on  so you would not lose them  it gave the data file now it does not how  do  i  get them back.? See example below  the new version  no longer has that option </p><pre>so now  i will lose bookmarks and extentions </pre>,desktop;other;windows-10;firefox-880;,firefox,other,en-US,"",mdm54
1333707,2021-04-22 20:17:43 -0700,2021-04-22 20:17:43 -0700,"How can I create hotkeys/abbreviations for autocompleting full words & phrases for repetitive text, ie email addresses, etc.?","<p>Answer the question ""How can I create hotkeys/ special abbreviations for autocompleting full words &amp; phrases for repetitive text (NOT for autofill on forms which I understand), ie email addresses in FF, etc.?   </p><p>Apologies if this has a tech name I am not familiar with. </p>",desktop;tips;windows-10;firefox-880;,firefox,tips,en-US,"",taddcampbell3
1333705,2021-04-22 20:11:29 -0700,2021-04-23 00:39:02 -0700,What Happened to 'View Image' in the Context Menu?,"<p>Per title and attached image. </p><p>Why do I no longer have the option to view image in the same tab any more? I should not need a browser extension to have brought it back. This new feature is, frankly, rather annoying and I would like to have the option to have it back. Please don't tell me to modify userChrome.css because that doesn't seem to do anything anymore. I have tried on numerous occasions to use it to get rid of the obnoxious Email Image by following markup examples given on numerous forums, so I don't trust it to bring back a feature unjustly stripped from me. </p><p>Or, failing that, tell me how to get that context to open in the background. I have that option set for links, and am rather unhappy that it is ignored on this new image context and bookmarks to a lesser extent. </p><p>It has been a day since updating to this new version, and I hate it already. </p>",desktop;customize;windows-10;firefox-880;,firefox,customize,en-US,1407893;1407899;1407929;1407932;1407936;,treliormorningstar
1333704,2021-04-22 19:56:48 -0700,2021-04-22 19:56:48 -0700,Outros favoritos sumiram na atualizaçãp,"<p>Na última atualização, hoje dia 22 de Abril de 2021. sumiu uma parte dos Outros Favoritos, especificamente os registrados hoje mesmo, Como posso recuperar ? Obrigado, Saudações </p>",desktop;bookmarks;windows-10;firefox-880;,firefox,bookmarks,pt-BR,"",Skrdlik
1333702,2021-04-22 19:24:10 -0700,2021-04-22 20:28:50 -0700,pocket,"<p>WHAT in the world is pocket??  I was in the middle of my exercises,  Pocket came on and goofed me all up.  Is there any to get out of pocket?? </p>",desktop;other;windows-81;firefox-880;,firefox,other,en-US,1407889;1407895;,lesstraite1
1333700,2021-04-22 18:51:01 -0700,2021-04-22 19:12:31 -0700,Widevinecdm crashing since updating to 78.10.0esr,"<p>Streaming accounts like Spotify, Netflix, Apple TV+, Disney+, etc are all no longer playing since I updated to 78.10.0esr This version is supposed to be compatible with my version of OS X 10.9.5 I keep having Firefox crash with this error. Widevinecdm plugin has crashed. Learn more...and when I click on Learn more, there's nothing there that helps. </p><p>Can anyone help? Thank you. </p>",desktop;fix-problems;mac-os-x-109;firefox-780;,firefox,fix-problems,en-US,1407875;,brad46
1333699,2021-04-22 18:33:14 -0700,2021-04-22 18:57:27 -0700,Camera,"<p>Nothing changed on my computer this week, but my camera does not work anymore. I get a blank screen. My students can see me but I cannot see myself. I see a green screen... Help please Thank you in advance to whoever knows the answer. </p>",desktop;other;windows-10;firefox-880;,firefox,other,en-US,1407869;,dianet55
1333698,2021-04-22 18:32:24 -0700,2021-04-22 18:32:24 -0700,Grumpy old fogey says why not leave what is working work...,"<p>I am an old fart (76) and had firefox reasonably set up and nor this tired old brain must remember how it was and how to jump through the hoops that the juveniles thought as better...   Give me a break !!   the complaint I had which I found a workaround was to DELETE up to 1G of cookies so I had a little usable ram and space on my HDD...   Some of the cookies were HUGE...   My OS has been Linux mint or other flavours of Linux since about 1990 and used to boot in less than 20 seconds, then it would load the previous days applications where I left off in another 10 seconds...    Now, judging by the sixes of the files downloaded to refresh Firefox you are writing BLOATWARE WTF...   Why do you think I would not touch Intel &amp; windoze?     DAZE of compulsory Amerikan speling &amp; corporate spying are numbered if this keeps deteriorating... 20,000 cookies a day? and how big is the file to install firefox...   That is what I call BLOATWARE... </p><p>I watch informative YT but when it gets boringly repetitive I just scan what is force fed in the vain hope I will spot something of interest...   90% is crap, or dumb'ed down BS to find a few paste jewels... </p><p>My brain is somewhat addled with Dementia, and afflicted with aspects of Asperger's Syndrome, Bi polar disorder... Give me a break  Please... </p>",linux;desktop;fix-problems;firefox-880;,firefox,fix-problems,en-US,"",brainballard
1333697,2021-04-22 18:32:07 -0700,2021-04-22 18:32:07 -0700,"Firefox Sync requires a verification code from your email, but the password to my email account is ON MY FIREFOX ACCOUNT.","<p>I have firefox sync set up because I have to reset my computer sometimes, for personal reasons. However, upon logging into your firefox account to sync the data, it requires a code from the email account. BUT, the password to my email account is on the firefox account I'm trying to sign into, meaning I can't sign into my email to get the code to sign into firefox. I had to make a new account (the one I'm using now) in order to ask a question about it. Please help as soon as possible. </p>",desktop;sync;windows-10;firefox-880;,firefox,sync,en-US,"",orionwolf38
