id,created,updated,title,content,tags,product,topic,locale,answers,creator
1337814,2021-06-01 07:44:19 -0700,2021-06-01 07:44:19 -0700,Need to transfer Firefox from my old MacBook Pro to my new MacBook Air,<p>Need to transfer Firefox from old computer to new </p>,desktop;download-and-install_1;,firefox,download-and-install,en-US,"",bobhoye
1337811,2021-06-01 07:32:39 -0700,2021-06-01 07:32:39 -0700,buscar marcodores,<p>hola buenas se queda pillado el mozilla al buscar los marcadores ya intente restableciendo el navejador y nada  no sale que el raton se queda dando vueltas con la rueda de colores en la imagen al hacer la captura </p>,mac-os;desktop;fix-problems;firefox-880;firefox-8801;,firefox,fix-problems,es,"",ocio.marcos
1337810,2021-06-01 07:23:22 -0700,2021-06-01 07:23:22 -0700,Have to restart Norton Password Manager each time entering Firefox,"<p>Firefox is my default browser with Windows 10.  I'm running Norton Password Manager (NPM).  During the day, I will go in and out of Firefox.  I have to restart NPM every time I go back in to Firefox.  Any way I can prevent that? Can NPM be automatically started by Firefox each time I call up Firefox? </p>",desktop;beta;customize;windows-10;firefox-890;,firefox,customize,en-US,"",srderenne
1337809,2021-06-01 07:14:40 -0700,2021-06-01 07:14:40 -0700,New look in ver 89,<p>Is there any way I can restore the look of firefox 88.0.1? In my humble opinion it does not look good anymore. </p>,desktop;beta;customize;windows-10;firefox-890;,firefox,customize,en-US,"",kacpipancernik
1337808,2021-06-01 07:12:22 -0700,2021-06-01 07:12:22 -0700,How to set Tabs below address bar Firefox 89,"<p>I would like to set the tabs to display below the address bar in Firefox 89  64bit.  I believe the setting is in about:config but I can't find it.  Firefox does this every so often and I wish they would just have a button to say tabs on top, or tabs below address bar. </p>",desktop;beta;tabs;windows-10;firefox-890;,firefox,tabs,en-US,"",chip4343
1337806,2021-06-01 07:02:13 -0700,2021-06-01 07:02:13 -0700,disable history firefox in security param deactivate add-on from working on tool bar,<p>I discover that when I disable history in security param and reboot firefox it deactivate all add-on from working on tool bar. Firefox Ubuntu 88.0.1 (64 bits) Ubuntu 21.04 </p>,linux;desktop;privacy-and-security_1;firefox-880;firefox-8801;,firefox,privacy-and-security,en-US,"",sebastien+firefox
1337805,2021-06-01 06:43:00 -0700,2021-06-01 06:43:00 -0700,HTTP sowing error after downloading Portswigger CA,"<p>Hey,  i added FoxyProxy standart as add-on and set up FireFox as an external browser to use it with burp.  I followed all the instructions and got stuck on the last one when i need to import Portswigger CA to my authorities inside Privacy &amp; Security in FireFox.  ( link: <a href=""https://portswigger.net/burp/documentation/desktop/getting-started/proxy-setup/certificate/firefox#removing-burp-s-ca-certificate-from-firefox"" rel=""nofollow"">https://portswigger.net/burp/documentation/desktop/getting-started/proxy-setup/certificate/firefox#removing-burp-s-ca-certificate-from-firefox</a>) </p><p>Knowing that I successfully confirmed that the proxy listener is active and have configured my browser to work with Burp. Http websites are only working. Testing them using Burp and intercepting the request works fine.  </p><p>However, after importing  Portswigger CA and checking ""This certificate can identify websites"" then pressing OK.  i visit <a href=""http://www.google.com"" rel=""nofollow"">www.google.com</a> and the error: ""Software is Preventing Firefox From Safely Connecting to This Site"" shows.  </p><p>After taking a look at my authorities certificates again, Portswigger CA doesn't show up on the list. </p>",desktop;websites;,firefox,websites,en-US,"",noid.astra
1337804,2021-06-01 06:33:17 -0700,2021-06-01 06:33:17 -0700,FF V89 tool bar font size,<p>Just updated to V89. What I don't like is the font size in the tool bar. I used the zoom control but that doesn't change the font size in the tool bar. Any suggestions as to how to change the tool bar size and/or the font size? Thanks </p>,desktop;beta;customize;windows-10;firefox-890;,firefox,customize,en-US,"",arejfour
1337801,2021-06-01 05:21:21 -0700,2021-06-01 06:28:04 -0700,make firefox default browser,<p>I installed Firefox on my desktop but I cannot make it my default. The previous HOME appears when I sign in. How can I make firefox my default Home page? </p>,windows-7;desktop;other;firefox-880;,firefox,other,en-US,1416021;,gnafkisp
1337800,2021-06-01 04:57:38 -0700,2021-06-01 04:57:38 -0700,NÃO ESTA ABRINDO NO NAVEGADOR O WHATSAPP WEB,"<p>OLÁ BOM DIA, FAZ MAIS DE UMA SEMANA QUE O WHATSAPP WEB NÃO ABRE NO NAVEGADOR </p>",desktop;fix-problems;windows-10;firefox-880;,firefox,fix-problems,pt-BR,"",mr.carsound
1337799,2021-06-01 04:47:29 -0700,2021-06-01 05:07:25 -0700,Website is not loading,"<p>Hi, I want read some articles of thie site <a href=""https://spy-geek.com/"" rel=""nofollow"">https://spy-geek.com/</a>, it is loading in mobile mozilla browser but not loading in my laptop mozilla browser. Please Check it. </p>",windows-7;desktop;websites;firefox-880;,firefox,websites,en-US,1416013;,HarryKane
1337797,2021-06-01 04:16:19 -0700,2021-06-01 04:16:19 -0700,i don't see a button to change interface language,<p>where is it </p>,desktop;beta;other;windows-10;firefox-890;,firefox,other,en-US,"",thisistrueemail
1337796,2021-06-01 04:01:08 -0700,2021-06-01 04:01:08 -0700,Problems with BT and Thunderbirds,<p>My BT emails no longer work with Thunderbirds. Can any one help? </p>,desktop;other;windows-10;firefox-880;,firefox,other,en-US,"",wforrest61
1337795,2021-06-01 03:55:15 -0700,2021-06-01 03:55:15 -0700,Too many credentials to sync?,"<p>I use Firefox sync accross several installations and today discovered an oddity: </p><p>On my main machine I have 911 credentials stored. On a newly added installation only 489 show up and it is not clear to me, under which condition credentials are synced. The synchronisation process produces no errors. </p><p>A credential entry, once synced, can be changed on several machines and getting synced to the others. </p><p>Any help is appreciated. </p>",desktop;sync;windows-10;firefox-880;,firefox,sync,en-US,"",stefan.sonnenberg.carstens
1337793,2021-06-01 03:52:49 -0700,2021-06-01 03:52:49 -0700,why fingerprint scanner not support to firfox,<p>i am useing Mantra and Secuzen fingerprint scanner. both fingerprint scanner is not supported to firfox it support other borwser pless give me solution </p>,desktop;other;windows-10;firefox-880;,firefox,other,en-US,"",ishwarpoojari4
1337792,2021-06-01 03:40:45 -0700,2021-06-01 03:40:45 -0700,Browser is not supported for background blur in Google meet,<p>Browser is not supported for background blur in Google meet please help me </p>,desktop;websites;beta;windows-10;firefox-890;,firefox,websites,en-US,"",dawood.8423
1337791,2021-06-01 03:37:35 -0700,2021-06-01 03:37:35 -0700,Cant present with voice in google meet,<p>when ever i present a video in google meet the others cant hear the the video  but they can see it. please help me. </p>,desktop;websites;beta;windows-10;firefox-890;,firefox,websites,en-US,"",dawood.8423
1337790,2021-06-01 03:26:16 -0700,2021-06-01 03:26:16 -0700,How can I get videos to autoplay on hover?,"<p>I use <a href=""https://artgrid.io/"" rel=""nofollow"">this stock footage website quite a bit</a>, and on other browsers it's always played the video on hover with no audio. Really handy for quickly looking through shots. </p><p>But Firefox doesn't play the videos on hover. Is there any way to make it? </p>",mac-os;desktop;beta;fix-problems;firefox-890;,firefox,fix-problems,en-US,"",domriozzi
1337781,2021-06-01 00:37:16 -0700,2021-06-01 00:37:16 -0700,reading videos,"<p>Videos can(t be read by Firefox, asking for extra or different codec. How to fix it, how to install extra modules? THKS Pierre </p>",linux;desktop;other;firefox-880;,firefox,other,en-US,"",pierre.souchois
1337780,2021-06-01 00:28:07 -0700,2021-06-01 01:28:39 -0700,One page on website not loading,"<p>Hello, I have one page on my website which is not loading. You keep on seeing the loading dot. I asked other people to check on their Firefox to check and also their is does not load. On other browsers (Safari, Chrome) it works. I downloaded Firefox on my iPad and there it works. </p><p>The page: <a href=""http://hausamzee.com/inspiratie"" rel=""nofollow"">hausamzee.com/inspiratie</a> </p><p>I have no idea how to fix this, I guess settings in Wordpress?!?! Hope someone can help me out. </p><p>Thx so much! Anne </p>",mac-os;desktop;fix-problems;firefox-880;,firefox,fix-problems,en-US,1416001;1416006;,AnnefromAmsterdam
1337779,2021-06-01 00:14:28 -0700,2021-06-01 00:56:55 -0700,AOL Homepage no images?,"<p>Hi Suddenly in the last few days images and videos are failing to load on my <a href=""http://AOL.CO.UK"" rel=""nofollow"">AOL.CO.UK</a> homepage, they are now just blank?? I have altered nothing, I use Windows10, and ad blockers and MWBytes none of which I have altered in any way? Is this a Firefox or AOL issue? Cheers Mick </p>",desktop;other;windows-10;firefox-880;firefox-8801;,firefox,other,en-US,1416002;,pomak249
1337778,2021-06-01 00:07:32 -0700,2021-06-01 05:41:46 -0700,Link ftp,"<p>Ciao, prima di aggiornare utilizzavo da sempre il browser per aprire i mie collegamenti ftp: a i miei file su rete interna. Dopo aver aggiornato alla versione  88.0.1 (64bit) NON funziona più. I link non vengono aperti. Ho provato a disinstallare e rimettere la versione 87.0 e funziona tutto benissimo. Qualcuno ha una soluzione. ? Grazie </p>",desktop;fix-problems;windows-10;firefox-880;,firefox,fix-problems,it,1416016;,bntmax1
1337775,2021-05-31 22:24:49 -0700,2021-06-01 02:23:50 -0700,Komputer,"<p>Przeglądarka Mozilla Firefox ulega awarii  w momencie gdy włączę playera..Przez chwilę materiał leci bez zarzutu a w momencie rozłącza <a href=""http://się.Co"" rel=""nofollow"">się.Co</a> mam zrobić </p>",desktop;websites;,firefox,websites,en-US,1416009;,beata.klimczak
1337773,2021-05-31 21:34:19 -0700,2021-05-31 21:34:19 -0700,safii,<p>saya pribadi# Numbered list item* Bulleted list item </p>,linux;desktop;websites;firefox-510;firefox-5101;,firefox,websites,en-US,"",jepit9046
1337772,2021-05-31 21:32:31 -0700,2021-06-01 01:30:04 -0700,Mozilla Firefox browser not working properly getting error when trying to open or relaunch,"<p>Hi Team, </p><p>Please help Mozilla Firefox browser is not opening .when tried to uninstall and install the browser it is showing error message like ""The code execution cannot proceed because dbghelp.dll was not found.Reinstalling the program may fix this problem."". </p><p>Uninstalled browser and installed.when trying to open the browser getting this help.Even google chrome browser , microsoft EDGE browser also not opening. </p><p>Only Internet Explorer is opening.please help me to resolve this issue. </p><p>Any suggestions or help will welcome. </p><p>Regards, </p><p>Vineela </p>",desktop;other;,firefox,other,en-US,1415987;1415988;1415990;1415997;1416003;1416004;1416007;,vineelavinni0507
1337767,2021-05-31 20:15:58 -0700,2021-05-31 20:15:58 -0700,vk.com does not work without enabling the private window,"<p>It gives an error about the mismatch of the password and username only when I try to access the site through the standard browser mode. in private mode or other browsers, everything works fine.  I was deleting the browser. Turned off the extensions. I was cleaning the cache. it didn't help. </p>",desktop;websites;windows-10;firefox-880;,firefox,websites,en-US,"",berhram
1337762,2021-05-31 18:12:58 -0700,2021-05-31 19:02:21 -0700,Restore tabs from previous session when restarting FF.,"<p>For years I've had multiple open tabs and pinned tabs while browsing, then when I quit and restarted FF all of the tabs reopened when I restarted. </p><p>I've recently upgraded to a newer MacBook Pro and now FF is not reopening tabs upon restart. I also didn't need to login to FF each time I started it on my old computer, but FF on the new computer makes me login every time I restart. I'm using version 88.0.1 on the new computer and 88.0 on the previous computer. I have followed the instructions from the article below, and I've even uninstalled and reinstalled FF, but nothing has worked:  </p><p>[<a href=""https://support.mozilla.org/en-US/kb/restore-previous-session#w_troubleshooting"" rel=""nofollow"">Restore Previous Session</a>]  </p><p>I'm terribly frustrated and I would be ever so appreciative if anyone can help me figure this out! Thank you! </p>",desktop;customize;,firefox,customize,en-US,1415958;,lsinger3
1337760,2021-05-31 17:47:44 -0700,2021-05-31 19:21:50 -0700,Quick searches re-enables itself randomly after being turned off,"<p>It's all in the title. The ""quick searches"" feature that pops up when I highlight text is a lot more annoying then useful, so I turned it off... and it seems to re-enable itself randomly. One time I disabled it, and after <strong>5 seconds,</strong> it re-enabled itself. So annoying. I've made so many accidental searches with that stupid feature. I mean, how many people copy text just to search it up? Even then, they can highlight the text, right click, then click ""Search (engline) for (text)"".  </p><p>The point being, the feature is re-enabling itself randomly, and it's getting on my nerves. </p><p>I don't see any option within the settings to turn it off. Any ideas? </p><p>Thanks, </p><pre>    Stephen </pre>",desktop;customize;windows-10;firefox-880;firefox-8801;,firefox,customize,en-US,1415959;1415964;1415965;1415966;1415974;,skcroushore
1337758,2021-05-31 17:06:52 -0700,2021-05-31 21:37:37 -0700,Trouble accessing GMail,<p>All of a sudden I cannot access my Gmail from my bookmarks </p>,desktop;websites;windows-10;firefox-880;,firefox,websites,en-US,1415970;1415981;1415982;1415984;1415986;,loresilb
