id,created,updated,title,content,tags,product,topic,locale,answers,creator
1359120,2021-11-25 11:27:10 -0800,2021-11-25 11:27:10 -0800,Google Search,"<p>Why does my Google Search or even going to <a href=""http://Google.com"" rel=""nofollow"">Google.com</a> not work? I have tried a reset and that still does not fix the problem. Sometimes I can close Firefox and then reopen it and it will work a few times but not always. </p>",desktop;other;windows-10;firefox-940;firefox-9402;,firefox,other,en-US,"",JerryBSr
1359119,2021-11-25 11:19:46 -0800,2021-11-25 11:25:56 -0800,Hosszú ékezetes betűk hiánya,"<p>Üdv, </p><p>Egy pár hete vettem észre, hogy egyes weboldalakon nem jelennek meg az ő és ű (azaz a hosszú ö és ü) betűk. Az ilyen oldalakon (pl. Facebook), a Chrome-ban látszik, hogy a használt betűtípusban nem voltak ilyen karakterek, ezért a Chrome behelyettesít egy alap (pl. Arial) ékezetes betűt. Ez elüt a többitől, de legalább megjelenik. A Firefoxban látszólag nem működik ez a behelyettesítés. Azt megnéztem, hogy a hibásan megjelenő oldalak ugyanúgy HTML5-ösek és UTF-8 kódolásúak, lang=hu beállítással, mint azok, amelyeken megjelennek a karakterek. </p><p>A gépen pár napja Win 11 Pro van, de már a frissítés előtt is megvolt a hiba. </p><p>Én állíthattam el valamit, vagy ez egy bug? Esetleg tudatos Firefox limitáció? </p>",desktop;websites;firefox-940;firefox-9402;,firefox,websites,hu,1462043;,hellsing5960
1359118,2021-11-25 11:14:55 -0800,2021-11-25 11:14:55 -0800,Abre de ventanas infinitas al intentar descargar autofirma,"<p>Al intentar descargar autofirma, se abren ventanas sin parar, no se completa la descarga. </p>",desktop;tabs;windows-10;firefox-940;,firefox,tabs,es,"",teresa-at
1359116,2021-11-25 10:57:38 -0800,2021-11-25 10:57:38 -0800,Remove Search function in Address Bar,"<p>Hello. After reading numerous posts addressing similar issues &amp; having no success, I've decided to post a question of my own. I am running the current version of firefox, 94.0.2. I use the <strong>Search Bar</strong> religiously for searches to sites like google, wikipedia, youtube, amazon, and ebay. I NEVER use the address bar for searches. I have attempted to disable all functionality associated with searching via the address bar. When I go to the address bar, it is because I have a specifc url I know I want to type with a specific destination in mind. Occasionally, I have a need to just go to the home page of one of my search sites, most often it's <a href=""http://amazon.com"" rel=""nofollow"">amazon.com</a>. Recently (not sure which version of firefox) I've found when I go to the <strong>Address Bar</strong> &amp; type <a href=""http://amazon.com"" rel=""nofollow"">amazon.com</a>, I cannot just go to <a href=""http://amazon.com"" rel=""nofollow"">amazon.com</a>, instead the address bar turns into a search bar. How do I disable this? Its driving me mad! I swear I've disabled every option I can within about:config related to <strong>urlb</strong>. Please Help. I don't want to switch to Chrome, but I'm tired of my settings getting messed up every time mozilla pushes a new version. </p>",windows-7;desktop;customize;firefox-940;,firefox,customize,en-US,"",andrewpatricksmith
1359112,2021-11-25 10:19:12 -0800,2021-11-25 10:19:12 -0800,When I run Firefox and use YoutubeTV I get slowness from internet.,"<p>Hi,  When I run Firefox and use YoutubeTV I get slowness from internet. When I run YoutubeTV on Edge no problems. I have tried running it on Firefox in safe mode and with Bitdefender disabled still have issue. Please see attached screen shots. The delays of up to 3 seconds cause browser slowness when I try to browse to get details of something I am watching like on IMBD etc. I have been a long time user of Firefox and really don't like having to use Edge as my YoutubeTV browser. </p><p>Firefox Version 94.0.2 </p><p>Edition	Windows 10 Pro Version	21H2 Installed on	‎8/‎21/‎2021 OS build	19044.1387 Experience	Windows Feature Experience Pack 120.2212.3920.0 </p><p>I can send you HWinfo64 report if you need it. </p>",desktop;other;windows-10;firefox-940;firefox-9402;,firefox,other,en-US,"",sotackd
1359111,2021-11-25 10:17:28 -0800,2021-11-25 10:17:28 -0800,facebook,"<p>Gentilissimi amivi Firefox, da più tempo mi succede una cosa strana. Solo su Facebook ad un certo punto l'apertura delle pagine e dei commenti o delle schede di notifica, rallenta. Esce la famosa rotellina che gira e rigira, e la pagina non si apre. Solo su FB, per il resto navigo tranquillamente. Ah... dimenticavo, qualche volta lo fa anche su Watsapp, ma di meno. Faccio la stessa prova su Crome e, invece, tutto va  bene. Mi fa rabbia perché io adoro Firefox e vorrei utilizzare solo quello. Mi date qualche dritta per risolvere il problema. Via doro e andate forte! Foza Mozilla fundation. Giovanni Caputo </p>",desktop;websites;windows-10;firefox-940;,firefox,websites,it,"",gcaputo4
1359110,2021-11-25 09:56:13 -0800,2021-11-25 10:04:36 -0800,How can I send feed back on the newest update?,"<p>I was looking for a way to reset Firefox to bring back the previous print preview. In several places the person offering an answer suggests sending feedback to Mozilla re the changes, but... no link or place to send feedback.  </p><p>My desktop and laptop have only just been updated to the latest version with very bright white backgrounds, really large firefox icon on home page, less definition between tabs, a lighter weight font on menus, strange layout on the hamburger menu, and a reset to a google-like print window.  </p><p>I tried on my desktop to change the bright white background using the colors option. Once I found the settings to  tone down the brightness to a very pale grey for the home page and results page, every page I went to had changed fonts and lost colors.  </p><p>Print preview was an awesome tool, many web pages are set up in such a way that when it is printed the fonts are huge, and the web page header prints over the text of the printout. On the worst panels of links to other stories and ads also print. Your preview allowed me to zoom in/out easily and the simplified version was brilliant. </p><p>The tabs are grey on grey with no definite edge, and they just keep shrinking showing less and less of the tab name, instead of hiding extra tabs of the edges. I have 10-20 tabs open on a regular basis often in 2 separate windows and would much rather have a tab label that IDs the page than having to click on each page.  </p><p>Font - the menu font is now a small fine sans serif that is difficult to read. </p><p>Hamburger menu - Why is new tab, find in page, save page as, and print here? In particular why are they at the top of the menu? Please move the new tab panel and print panel to the bottom, the Bookmarks panel to the top and put the Settings panel immediately below it. It would also help if you added a cog icon to the settings panel.  </p><p>Please add a feedback link without sign-on to your page. </p>",desktop;other;windows-10;firefox-910;,firefox,other,en-US,1462018;,olearymr
1359108,2021-11-25 09:55:33 -0800,2021-11-25 09:55:33 -0800,Wrong camera for meetings,<p>I'm on a macboox pro (intel) with the built in camera and an external camera fuji (not connected). </p><p>When I start a google meeting or skype call firefox wants to use the external camera and I don't see any options to use the internal camera. </p><p>If  I try the same thing in Safari browser it works perfectly. </p><p>How do I tell firefox which camera to use? </p>,mac-os;desktop;other;firefox-940;,firefox,other,en-US,"",mtissington
1359105,2021-11-25 09:35:42 -0800,2021-11-25 09:35:42 -0800,Firefox won't sync when SmartProxy (or FoxyProxy) is enabled,"<p>Hello, I'm behind a corporate proxy server and I had no issues with this until a couple of months ago. First I was using FoxyProxy, and one day I realized that Firefox wasn't syncing so I started troubleshooting (Troubleshoot mode) and found out that when a proxy addon (now I moved to SmartProxy and it's the same) is enabled Sync fails. I even tried setting up a new profile with a different, new, Firefox Sync account and the outcome is the same. Anyone else having this trouble? Is this a bug? Should I report it? Anyone wants to help me reproduce it? Thanks in advance! </p><p>PS: This happens on my Windows 10 machine too. </p>",linux;desktop;sync;firefox-940;,firefox,sync,en-US,"",samthelion17
1359104,2021-11-25 09:26:50 -0800,2021-11-25 09:26:50 -0800,History panel always on.,"<p>Whenever I start firefox the history panel is always up, I turn it off in view and ctrl-h but everytime I start firefox its up on every window again by default. How do I disable this panel, I never use it. Thank you for your time. </p>",desktop;customize;windows-10;firefox-940;,firefox,customize,en-US,"",philourwells
1359103,2021-11-25 09:09:44 -0800,2021-11-25 09:09:44 -0800,how can I reinstate browser link app,<p>how can I reinstate browser link app </p>,desktop;fix-problems;windows-10;firefox-940;,firefox,fix-problems,en-US,"",adrian51
1359102,2021-11-25 09:08:16 -0800,2021-11-25 09:08:16 -0800,how can I reinstate browser link app,<p>how can I reinstate browser link app </p>,desktop;fix-problems;windows-10;firefox-940;,firefox,fix-problems,en-US,"",adrian51
1359101,2021-11-25 09:05:08 -0800,2021-11-25 10:40:11 -0800,Prize,<p>I have a message saying I've won a prize . is this true </p>,desktop;other;windows-10;firefox-940;,firefox,other,en-US,1462030;,arni-walker
1359099,2021-11-25 08:58:43 -0800,2021-11-25 09:54:24 -0800,YouTube Playlist Error when Using Firefox Browser,"<p>This problem has been happening for a long time now.  When I'm playing a playlist in YouTube, and YouTube automatically select the next song in the playlist, the song stops and I get the message ""Playback Paused because your account is being used in another location"".  This problem ONLY happens in Firefox and with this playlist scenario.  If I select the song manually in the playlist, the song will play just fine.   I've used other browsers Chrome and Microsoft Edge and DO NOT have the problem in there so I know my account isn't being used in another location.  I've tried using multiple PC's/Laptops and both Windows 7 and 10 and the problem always only happens when using Firefox.  I checked the About section in Firefox and it's showing Firefox is Up To Date. </p>",windows-7;desktop;websites;firefox-940;firefox-9402;,firefox,websites,en-US,1462006;1462010;1462012;1462014;1462016;1462017;,zipperict
1359097,2021-11-25 08:50:16 -0800,2021-11-25 11:34:27 -0800,unable to launch tui.com/uk - access denied,"<p>unable to launch <a href=""http://tui.com/uk"" rel=""nofollow"">tui.com/uk</a> - access denied </p><p>rgds chris </p>",desktop;websites;windows-10;firefox-940;,firefox,websites,en-US,1462011;1462048;,cadamhe16
1359096,2021-11-25 08:48:12 -0800,2021-11-25 08:48:12 -0800,unable to launch tui.com/uk - access denied,"<p>unable to launch <a href=""http://tui.com/uk"" rel=""nofollow"">tui.com/uk</a> - access denied </p><p>rgds chris </p>",desktop;websites;windows-10;firefox-940;,firefox,websites,en-US,"",cadamhe16
1359095,2021-11-25 08:43:11 -0800,2021-11-25 09:46:36 -0800,Web broswer not open,<p>Unable to open Whatsapp web from last 2-3 days. </p>,linux;desktop;websites;firefox-940;,firefox,websites,en-US,1462013;,saxenavaibhav162
1359094,2021-11-25 08:42:56 -0800,2021-11-25 10:41:37 -0800,How to save duckduckgo settings while using firefox private browsing,"<p>I'm using Firefox v94.0.2 in private browsing mode (hereafter PB) and can't figure out how to save the ""infinate scroll"" option in duckduckgo (herafter DDG) while using Firefox private browsing.  I know that PB wipes out all cookies when I shut Firefox down.  So I tried building a cookie for DDG's options while NOT in PB mode.  That works fine both in that session and in subsequent sessions, as long as I don't go back to PB.  But when I do go back to PB, the DDG settings revert to some default set, and DDG's ""infinate scroll"" setting is not set to ON any more.  Is there a way I can have PB keep the DDG ""infinite scroll"" setting? Thanks </p>",desktop;privacy-and-security_1;windows-10;firefox-940;,firefox,privacy-and-security,en-US,1462031;,ugfrog
1359093,2021-11-25 08:22:46 -0800,2021-11-25 08:24:30 -0800,"error, ignore","<p>error, ignore </p>",mac-os;desktop;sync;,firefox,sync,en-US,"",Foxfree99
1359089,2021-11-25 07:53:59 -0800,2021-11-25 11:30:44 -0800,Otevírání nového panelu z odkazu prostředním tlačítkem.,<p>Po poslední aktualizaci nelze otevírat nový panel z odkazu prostředním tlačítkem (kolečkem).  Proboha proč ???!!! Kde případně lze nastavit ? </p>,desktop;customize;windows-10;firefox-940;,firefox,customize,cs,1462044;,jirismolik
1359087,2021-11-25 07:45:10 -0800,2021-11-25 07:45:10 -0800,ij432942@gmail.com,<p>qikmVYzpKM9dEM2 </p>,windows-7;desktop;download-and-install_1;firefox-940;,firefox,download-and-install,en-US,"",ij432942432942@gmail.com
1359086,2021-11-25 07:44:31 -0800,2021-11-25 07:44:31 -0800,"I filled up a form with name and surname, no passwords. The data is stored, but where and why?","<p>I filled up a form with name and surname, no passwords.  When coming back to the site days later, just pressing first letter shows my previously typed data. For example, the letter J will show John right away. </p><p>Where is this information stored? I looked in ""Memory"" devtab, it is not there so I presume this is not stored by the website in my PC. Also, I don't see this data in in History. </p><p>Where is it? </p>",linux;desktop;privacy-and-security_1;firefox-940;,firefox,privacy-and-security,en-US,"",santimirandarp
1359085,2021-11-25 07:42:17 -0800,2021-11-25 07:42:17 -0800,Clear History,"<p>Starting recently, activation of Clear History has also erased all email in the Inbox. How can I correct this, please?    Richard </p>",desktop;customize;windows-10;firefox-940;,firefox,customize,en-US,"",rfanelly
1359082,2021-11-25 07:32:56 -0800,2021-11-25 11:33:27 -0800,Lockwise,"<p>Čtu že Lockwise končí. Moc tomu nerozumím. Co bude v Mozille potom jako na správu hesel? <a href=""https://rychlofky.cz/2021/11/25/spravce-hesel-mozilla-lockwise-konci-13-prosince"" rel=""nofollow"">https://rychlofky.cz/2021/11/25/spravce-hesel-mozilla-lockwise-konci-13-prosince</a> Něco jiného? Díky. </p>",desktop;customize;windows-10;firefox-940;firefox-9402;,firefox,customize,cs,1462046;,peekaa
1359081,2021-11-25 07:30:20 -0800,2021-11-25 07:40:14 -0800,"Solo su alcuni siti, non riesco a salvare nell'hard disk i file Jpg presenti nella cache di Firefox","<p>Ciao a tutti ! il mio Sistema Operativo é Windows 7 Pro vers. 6.1 SP1 , Firefox versione 94.0.2 (64 bit).I file di cui all'oggetto li trovo sulla finestra ""Informazioni pagina"" , sezione ""Media"" (allego screenshot).Come potete vedere, é visibile l'indirizzo , il tipo file ma ""Dimensione file"" da: Sconosciuto (non in cache) e Dimensioni 0px x 0px.Cosa dovrei fare per poter salvare i file Jpg nel mio hard disk ? Grazie mille in anticipo a chiunque potrà offrirmi un aiuto ! </p>",windows-7;desktop;fix-problems;firefox-940;firefox-9402;,firefox,fix-problems,it,1461992;,generazionenirvana
1359080,2021-11-25 07:24:15 -0800,2021-11-25 07:24:15 -0800,Restoring tabs on a Mac when cache was emptied.,<p>How do I restore my tabs when a tech support person emptied my cache and all my history disappeared? I see instructions for a PC but not a Mac. I am on a Mac using Firefox. </p>,mac-os;desktop;tabs;firefox-940;,firefox,tabs,en-US,"",marsoobian
1359078,2021-11-25 07:11:05 -0800,2021-11-25 07:25:13 -0800,"""Never remember history"" changes to ""Use custom..."" and ""...private mode""","<p>Version 94.0.2 (64-bit) Windows 10 </p><p>Hi. </p><p>A few times in Settings I selected History-&gt;Never remember history, yet upon reopening the browser the setting was changed to ""Use custom settings for history"" and ""Always use private mode."" Why is this happening? </p><p>The larger issue is Cached Web Content (CWC), which doesn't completely delete like everything else. No matter the settings to delete everything upon closing or never remember, every time I reopen FF and click Clear Data there is some data in CWC (albeit in kb). I've read many pages and posts here and it's still not clear: A) Why isn't it 0 bytes and B) If a previously visited site can access the CWC, then isn't that a strike against privacy?  </p><p>Sincerley, </p><p>Hank </p>",desktop;privacy-and-security_1;windows-10;firefox-940;,firefox,privacy-and-security,en-US,1461987;,hank.leeps
1359077,2021-11-25 06:58:49 -0800,2021-11-25 06:58:49 -0800,TTFB vs cache,"<p>Hi, </p><p>I wonder why Firefox is so slow when a site is present in it's cache. </p><p>It's been the same problem for years, whenever I'm getting a long TTFB from the server, let's say a TTFB of a second or two, I know that clearing Firefox's cache of that site will resolve the issue and bring down the TTFB to it's normal of around 100ms. </p><p>Why and how clearing the cache changes the server TTFB? </p><p>Thank you. </p><p>-- Francois </p>",windows-7;desktop;fix-problems;firefox-940;,firefox,fix-problems,en-US,"",francoisp
1359076,2021-11-25 06:47:27 -0800,2021-11-25 06:47:27 -0800,"Why did I lose SYNC? Than after SYNCing I got 3x ADs pop ups, why?","<p>Why did I lose SYNC? Than after SYNCing I got 3x ADs pop ups, why? </p><p>Thx Charles  </p><p>cell 805-901-8444 </p>",desktop;sync;windows-10;firefox-940;,firefox,sync,en-US,"",Charles9018444
1359071,2021-11-25 06:17:21 -0800,2021-11-25 06:17:21 -0800,inspect element load every time automatically,"<p>inspect element load every time automatically  while browsing in firefox, so we cant work with firefox, please help me to solve the issue </p>",windows-7;desktop;fix-problems;firefox-940;,firefox,fix-problems,en-US,"",tpbijuu
1359069,2021-11-25 05:57:06 -0800,2021-11-25 05:57:06 -0800,Autofirma pide contraseña maestra y dice que no hay certificados digitales,"<p>Hola buenas tardes, he entrado en estas dos web: </p><p><a href=""https://www.juntadeandalucia.es/economiayhacienda/apl/surweb/ayuda/requisitosTecnicos.jsp"" rel=""nofollow"">https://www.juntadeandalucia.es/economiayhacienda/apl/surweb/ayuda/requisitosTecnicos.jsp</a> </p><p><a href=""https://sede.dgt.gob.es/es/otros-tramites/verificacion-certificados/padi/padi.shtml"" rel=""nofollow"">https://sede.dgt.gob.es/es/otros-tramites/verificacion-certificados/padi/padi.shtml</a> </p><p>Para ver si mi equipo está bien configurado para realizar firmas en documentos oficiales. </p><p>Los problemas son los siguientes: </p><p>1º.- Después de introducir la clave maestra me arroja un error SAF-19 diciendo que no hay certificados digitales válidos o están caducados.  </p><p>En opciones -&gt; certificados están los certificados y todos están vigentes. </p><p>2º.- Elimino la clave maestra y repito el proceso y ¡¡¡me pide la contraseña maestra!!! sin la he eliminado. No entiendo. </p><p>3º.- Después de eliminar la contraseña maestra, elimino los certificados, reinicio, instalo los certificados y establezco la contraseña maestra y vuelve a aparecer el error SAF-19, que no hay certificados. </p><p>Por supuesto que al iniciar el proceso de verificación me abre el autofirma y después es cuando pide la contraseña maestra. </p><p>¿Alguna forma de solucionar este problema? </p><p>La versión de firefox que uso es la 87. Me funcionaba perfectamente pero he tenido que retroceder a un punto anterior ya que las actualizaciones del windows 10 me ha hecho destrozo en mi pc y he tenido que volver a un punto anterior, reinstalando una clonación de la unidad. </p><p>Gracias a quién me ayude y saludos </p>",desktop;other;windows-10;firefox-870;,firefox,other,es,"",p1p2p3p3p2p1
1359067,2021-11-25 05:49:05 -0800,2021-11-25 06:53:34 -0800,Wy can't we get Chrome extensions? And why did you take off chrome store foxified?,<p>I need Ultra surf but I can't find it on the add-on website but Google Chrome has it. Why? </p>,desktop;customize;windows-10;firefox-940;,firefox,customize,en-US,1461979;,bladefnaf
1359066,2021-11-25 05:48:40 -0800,2021-11-25 07:54:31 -0800,Firefox Tarayıcı,"<p>Merhaba </p><p>Hemen hemen hergün güncelleme almasına rağmen Firefox Tarayıcı son derece geç açılıyor,hele güncelleme sonrası 3-4 kere tarayıcıdan çıkıp girdikten sonra açılıyor...Daha önceleri Tarayıcı daha stabildi bu her gün güncelleme almaya başladıktan sonra kararsızlaştı...Bu durumu bilgilerinize sunarım acil çözüm gerekli.....resetleme,yeniden kurma fayda etmiyor,2 adet eklenti kurulu...................... </p><p>Win 10 Home 64 Bit Kullanıyorum..... </p>",desktop;fix-problems;,firefox,fix-problems,tr,1461981;1461988;1461990;1461993;1461995;,prismcube88
1359064,2021-11-25 05:21:30 -0800,2021-11-25 10:45:09 -0800,Crashing bookmarks,"<p>When restoring a backup copy of tabs, nothing happens. I click on any backup and nothing happens. </p>",windows-7;desktop;bookmarks;firefox-940;,firefox,bookmarks,en-US,1462034;,Kernhold
1359062,2021-11-25 05:15:57 -0800,2021-11-25 06:06:32 -0800,Instagram  / Facebook Displays Texts in Icon and posts,"<p>Whats happening? I have already ticked ""websites using their own fonts"" </p><p>Icons and Posts are displayed with text with no reason? Some stories you can see bust most of them are not displayed </p><p>Its the only site that has problem in firefox and you cant even do something, firefox turns it into a broken site. </p><p>Tried: </p><p>Disabling Addons Colors: ""Override the colors specified by the page with your selections above"" </p><p>Nothing works  </p><p>Even facebook sometimes posts images with text description... </p>",desktop;websites;,firefox,websites,en-US,1461971;,lostre5
1359060,2021-11-25 04:25:31 -0800,2021-11-25 04:25:31 -0800,Any way to make firefox use accent color?,<p>Hi! </p><p>On my win 10  PC active window is blue and inactive is dark gray. But firefox is all the time it's own color. Is there way to fix it so that FF would use system color? </p>,desktop;customize;windows-10;firefox-940;,firefox,customize,en-US,"",fdoywugozklvsndgax
1359059,2021-11-25 04:20:29 -0800,2021-11-25 09:30:24 -0800,Ztráta všech záložek po aktualizaci,"<p>Po aktualizaci mi zmizely všechny záložky. Když kliknu na záložky je prázdno. Jako u nové instalace. A nevím, kde bych měl v adresáři Firefox hledat jejich uložení. Předem díky za pomoc. </p>",windows-7;desktop;bookmarks;firefox-940;,firefox,bookmarks,cs,1462009;,jiri.pasta
1359057,2021-11-25 04:09:23 -0800,2021-11-25 04:09:23 -0800,Instagram doesn't work in my Firefox,<p>Instagram doesn't work when I open the website in Firefox. My account appears like a empty page. I clean cookies and cache but it doesn't work. </p>,windows-7;desktop;websites;firefox-940;firefox-9402;,firefox,websites,es,"",mariables
1359056,2021-11-25 04:04:53 -0800,2021-11-25 04:04:53 -0800,Firefox no abre la aplicación nativa WhatsApp,"<p>Hola! Soy usuario de Firefox desde hace más de 15 años, lo uso como navegador predeterminado desde entonces, en todos mis dispositivos: PC Windows, Android, Linux y MacOS. </p><p>El presente problema me sucede en Windows 10 x64. Cada vez que deseo enviar un mensaje de WhatsApp mediante la url: <a href=""https://wa.me/549xxxxxxxx"" rel=""nofollow"">https://wa.me/549xxxxxxxx</a> me abre una pagina de WhatsApp que es difícil de leer, hasta poder llegar a la indicación ""continuar con chat"". Una vez que se hace click en dicho link me abre el WhatsApp Web. </p><p>Ahora, en Chrome, no aparece dicha web, directamente abre el WhatsApp Web, si no esta instalado en Windows la aplicación nativa o directamente abre la aplicación nativa, si esta instalada. Lo cual sería mucho más cómodo.  </p><p>¿Hay que habilitar algo en la configuración para obtener el mismo comportamiento con dicha web? </p><p>Gracias. </p><p>Guido. </p>",desktop;fix-problems;windows-10;firefox-940;firefox-9402;,firefox,fix-problems,es,"",elrengo
1359055,2021-11-25 03:21:31 -0800,2021-11-25 04:25:41 -0800,speed dial,<p>speed dial have problem and error .. i removed of firefox .. now is not install ? i am sorry ..... i dont speek english </p>,desktop;sync;windows-10;firefox-940;,firefox,sync,en-US,1461938;,sa.sepahi
1359054,2021-11-25 03:03:11 -0800,2021-11-25 06:06:19 -0800,How to change or disable default keyboard shortcuts,"<p>I want to disable the F12 shortcuts that open the developer tools, because I use this shortcuts to open a different application (yakuake) </p><p>How do we change the default key bindings? </p>",linux;desktop;customize;firefox-940;,firefox,customize,en-US,1461939;1461970;,hello_world
1359051,2021-11-25 02:32:49 -0800,2021-11-25 02:32:49 -0800,My bookmarks and every other saved data disappeared after firefox logged me out,"<p>as the title says, mozilla automatically logged me out from my account, and when i logged back in everything (bookmarks, password etc) was gone, even extentions. sadly I don't have a backup, anyone knows how to retrieve that data? </p>",desktop;bookmarks;windows-10;firefox-940;,firefox,bookmarks,it,"",domy31.lavezzi
