id,created,updated,title,content,tags,product,topic,locale,answers,creator
1359962,2021-12-03 08:01:07 -0800,2021-12-03 08:01:07 -0800,Caan't open attachments,"<p>I can't open attachments on my email all of a sudden. I have Thunderbiird mail, I have set Firefox as my default browser, and am working on a mac version 12.0.1. </p>",desktop;other;,firefox,other,en-US,"",durette
1359960,2021-12-03 07:45:02 -0800,2021-12-03 13:08:42 -0800,Log in to website,"<p>Trying to log into my investing website (Vanguard) </p><p>So.............I log into the website periodically and several weeks or more ago they 'updated' their site with a new look. So when I go to it, it has 'auto-filled' my username and password (just like it used to do) and after the site does the 'handshake' with the window I press the 'Log In' button and nothing happens. Nothing at all, it just sits there. I can launch my (outdated) Internet Explorer browser and do the same thing and it works fine and I go right in to the site. I've tried deleting cookies for the site on the Firefox browser but it doesn't change anything.  </p><p>So..........ideas? Maybe a plug-in problem??? </p><p>Thanks, Kent </p>",windows-7;desktop;websites;firefox-940;,firefox,websites,en-US,1463805;1463806;1463906;,kentoc.58
1359959,2021-12-03 07:29:14 -0800,2021-12-03 08:06:30 -0800,playing videos from youtube,"<p>my laptop cannot open firefox. needed help, </p>",desktop;other;windows-10;firefox-940;,firefox,other,en-US,1463799;1463807;,mitco_ab12
1359956,2021-12-03 07:22:39 -0800,2021-12-03 10:16:26 -0800,Sudden problems with Microsoft Live Mail,"<p>I recently started having a problem composing an email message when using Windows Live Mail and wondered if anyone has experienced the same issue. Another person on the Microsoft Help Forum reported the same issue, also using Firefox. The issue is that while composing an email, the window suddenly jumps back to the Inbox. It is very intermittent so a little difficult to test out with other browsers I hate using. Another issue which does seem to be only happening with Firefox is inability to open attachments on the first try. </p>",desktop;other;windows-10;outlooklivecom;outlooklive_1;firefox-940;,firefox,other,en-US,1463809;1463810;1463836;1463855;,robs10
1359954,2021-12-03 07:12:27 -0800,2021-12-03 07:12:27 -0800,who can help with the authenication code to pair iphone to desktop,<p>trying to pair iphone firefox to desktop firefox. i can the desktop bar code and it asks for an authenication number. when i go to the google authenicator app on my iphone it has a 6 digit number but the desktop does not accept it. Am i getting the code from the correct place? </p>,desktop;sync;windows-10;firefox-940;,firefox,sync,en-US,"",millar.mg1
1359949,2021-12-03 06:47:18 -0800,2021-12-03 13:39:13 -0800,BLOCCO PROGRAMMA E LINEA,"<p>Buonasera, non so per quale motivo, ma utilizzando Firefox su un pc fisso Windows 10, se apro troppe finestre o scarico files pesanti, internet si blocca e non funziona più finché non chiudo il browser e non trascorrono almeno 5 minuti. Il problema non si presenta mai con Chrome o altri browser, solo con Firefox. Non appaiono mai messaggi di errore o altro, semplicemente la linea smette di funzionare. Spero ci sia una soluzione, Firefox è il browser migliore. </p>",desktop;fix-problems;windows-10;firefox-940;,firefox,fix-problems,it,1463858;,pietro.azzali
1359948,2021-12-03 06:45:13 -0800,2021-12-03 08:09:53 -0800,4F8BHTC5BxNd9nd9fgcNF,<p>Ybfbq/  54yxbe*CGR*crqc /bF6XCEVCdbaFRBV9ytgrcvcR </p>,windows-xp;desktop;download-and-install_1;firefox-520;,firefox,download-and-install,en-US,1463811;,joao.8794107
1359946,2021-12-03 06:33:30 -0800,2021-12-03 08:10:58 -0800,Firefox crashed and lost sesssion/tabs,"<p>I have Firefox for Mac and my browser crashed. I lost my previous session and unable to recover from the ""History"" tabs. This happened today so I'm wondering it's possible to recover from saved sessions folder which I don't know how to access or troubleshoot. </p>",mac-os;desktop;websites;firefox-890;,firefox,websites,en-US,1463812;1463813;,anne.p
1359942,2021-12-03 05:33:45 -0800,2021-12-03 05:33:45 -0800,Ver 94.0.2,<p>Firefox update was forced on me I didn't ask for . Now I can't set the colors for text and menu bars.  The menu bar is all plain white and the link colors are all defaulted. </p>,desktop;customize;windows-10;firefox-940;firefox-9402;,firefox,customize,en-US,"",z3crt3m0x
1359940,2021-12-03 04:58:56 -0800,2021-12-03 15:11:22 -0800,"Multiple Sites Blocked with ""SEC_ERROR_REVOKED_CERTIFICATE"", but work fine with Google Chrome","<p>In the last few days, I started having multiple web sites blocked with ""SEC_ERROR_REVOKED_CERTIFICATE"".  They work fine with Google Chrome and Microsoft Edge, and I trust them.  One example is <a href=""http://www.wumb.org"" rel=""nofollow"">http://www.wumb.org</a>, a public radio station.  I found nothing in Firefox Help to bypass this security flag and go to the page. </p><p>If there is a work-around, please make it show up when searching for SEC_ERROR_REVOKED_CERTIFICATE in Firefox Help.  If there is no work-around, please add one.  Otherwise, Firefox, my favorite browser, will quickly get a bad reputation. </p><p>Thanks, </p><p>Eliot Mayer Belmont, MA, USA </p>",desktop;fix-problems;windows-10;firefox-940;firefox-9402;,firefox,fix-problems,en-US,1463793;1463827;1463840;1463841;1463894;1463912;1463919;1463922;1463939;1463943;,eliotmayer
1359939,2021-12-03 04:46:14 -0800,2021-12-03 08:14:56 -0800,Firefox browser issue?,"<p>Hello, I recently signed on to learn Spanish with Duolingo. I've been working on it for 4 days and now when I try to log into Duolingo, I get the error message: </p><p>!Invalid JWT!eyJ0eXAiOiJKV1QiLCJhbGciOiJIUzI1NiJ9.eyJleHAiOjYzMDcyMDAwMDAsImlhdCI6MCwic3ViIjo4NTUyMTg1NzR9.Ep0V </p><p>I've tried clearing the cache and it does not help.  I can open the site without issues in Google Chrome.  </p><p>Any suggestions? </p><p>Thanks,  Jeanne </p>",mac-os;desktop;privacy-and-security_1;firefox-910;,firefox,privacy-and-security,en-US,1463814;,bisanz14
1359936,2021-12-03 04:31:32 -0800,2021-12-03 04:31:32 -0800,popup-ikkunaan se liittyy,"<p>Melkein joka kerta kun menen verkkosivulle sivusto kysyy ""saako lähettää evästeen"" . Miten vastaan ilman hiiri-osoitinta että kaikki sallitaan? Selain on Firefox </p>",linux;desktop;websites;firefox-940;,firefox,websites,fi,"",telamos
1359935,2021-12-03 04:26:39 -0800,2021-12-03 04:26:39 -0800,Recebi email da Mozilla <mozilla@email.mozilla.org>,"<p>Recebi e-mail da Mozilla para baixar ""REGRETSREPORTER PARA FIREFOX ou CHROME"" de   &lt;mozilla@email.mozilla.org&gt; para restringir recomendações do You Tube. É verdadeiro? </p>",desktop;privacy-and-security_1;windows-10;firefox-940;,firefox,privacy-and-security,pt-BR,"",amauriperce
1359934,2021-12-03 04:22:48 -0800,2021-12-03 13:25:27 -0800,Left Swipe/Previous Page - Can I disable?,"<p>I find when I am browsing on Firefox and swipe down on my Macbook trackpad, the browser often interprets even a slightly leftward slant as a command to go back a page.  Is there a way to disable the swipe left/previous page function or to make it less sensitive? </p><p>Firefox 94.0.2 on Macbook Air 13-inch Early 2015 with MacOS 11.6.1 </p><p>Thanks! </p>",mac-os;desktop;customize;firefox-940;,firefox,customize,en-US,1463901;1463909;,doug.earl.mail
1359933,2021-12-03 03:42:26 -0800,2021-12-03 14:46:33 -0800,Carpeta descargas,"<p>Tengo asignada una carpeta para descargas en una partición diferente de sistema. Hoy, a la hora de dar a aceptar a una descarga, se abría un cuadro de texto pidiendo asignar un nombre al archivo, pero al darle a aceptar me dice que no existe ningún archivo con ese <a href=""http://nombre.No"" rel=""nofollow"">nombre.No</a> tiene sentido, claro que no existe, lo que quiero es descargarlo. Después de restablecer el navegador, volví a intentar descargar ese <a href=""http://archivo.No"" rel=""nofollow"">archivo.No</a> me dió error y seguí descargando varios más. Pero al buscar en la carpeta que yo tengo asignada para descargas en esa otra partición, no los encontraba. Los encontré en la carpeta de descargas de la partición donde tengo los archivos del sistema sin que yo la hubiera cambiado en ajustes. Imagino que es la que se autoasigna por defecto. Cambié a la que tenía antes, probé una nueva descarga....y me vuelve a aparecer ese cuadro de texto diciendo que no existe un archivo con ese nombre y no me deja descargarlo. No quiero descargar de la red en donde tengo Windows y los programas importantes que manejo. ¿Alguna solución? Gracias </p>",desktop;download-and-install_1;windows-10;firefox-940;,firefox,download-and-install,es,1463779;1463936;,biosbardos
1359932,2021-12-03 03:30:41 -0800,2021-12-03 08:15:38 -0800,Facebook randomly stopping loading its content on Firefox,"<p>Hi there, for sometime (4 months), Firefox dosen't load Facebook properly , it's just stop loading images, videos , or emoji things on Facebook, refresh dosen't work either, what is working is a restart of the browser. </p><p>Deleting cookies and cache, history, reinstalling the Browser,  and such, only fix the problem temporary , like 1-2 days without issues, then the loading problem is appearing again, it's usually occuring in the first 5-10 minutes , almost every time. </p><p>The issue is definetively from Firefox, because my other browser load Facebook without problems. I would like to get an answer though, is this issue fixed in the future releases or i'm doomed with this problem from now on, and i will have to use an separate browser for Facebook. </p>",desktop;websites;firefox-940;,firefox,websites,en-US,1463816;,marius.petran
1359928,2021-12-03 01:59:14 -0800,2021-12-03 01:59:14 -0800,schermata flottante,"<p>improvvisamente firefox ha iniziato a fare la schermata flottante in cui la barra degli indirizzi e delle pagine aperte compare e scompare in maniera estremamente fastidiosa, come posso fare per eliminare questo inconveniente e il suo eventuale ripetersi? cordiali saluti Vincenzo Lisena </p>",desktop;customize;windows-10;firefox-940;,firefox,customize,it,"",vincenzo.lisena
1359927,2021-12-03 01:54:08 -0800,2021-12-03 08:56:49 -0800,web site login denials,<p>I am finding a web site that I have used for many years is suddenly not working as the login will not work. I have contacted the compmany whose website i use and they have taken me through steps that point to an issue with firefox. (I can get acces to the site with MS Edge). If firefox thinks there si a security issue I cannor find how to make teh site an exception. </p><p>I also see that firefox thinks my browser preferences are being managed by my organisation. In fact I am my organisation and dont recall having set up a policy for my company </p><p>Can you help pls </p><p>Thanks </p><p>Simon Reid </p>,desktop;privacy-and-security_1;windows-10;firefox-940;firefox-9402;,firefox,privacy-and-security,en-US,1463817;1463818;1463826;,simon122
1359926,2021-12-03 01:41:58 -0800,2021-12-03 01:41:58 -0800,Browser Video Call Error,"<p>I used Firefox for Facebook video call, but cam is blinking like night clup light. I hope it's fixed wholesome. </p>",desktop;other;windows-10;firefox-940;,firefox,other,en-US,"",mangdrai
1359922,2021-12-02 23:21:40 -0800,2021-12-03 00:39:26 -0800,Elveszett két fontos funkció.,"<p>A frissítésekben elveszett két fontos funkció. 1. a tálca megjelenése az egér tálca helyre történő mutatásakor. 2. A mentésnél egyből menteni akar, a megnyitási lehetőséget megszüntették, mint ennek a böngészőnek a legnagyobb előnyét az összes többivel szemben. </p><p>Én szeretném, ha ezek a funkciók működnének a további frissítésekben is, mert megkönnyíti a munkát, és a mentéseknél felesleges lépésektől kímél meg.  </p><p><br> Juhász István </p>",desktop;other;needsinfo;windows-10;firefox-920;,firefox,other,hu,1463754;,hassziju
1359921,2021-12-02 23:06:31 -0800,2021-12-03 01:23:45 -0800,Pulsanti riduci/allarga/chiudi in alto a destra assenti,"<p>Buongiorno,  ho notato che quando apro alcune schede scompaiono i tre pulsanti in alto a destra che permettono di ridurre il browser sulla barra strumenti/allargare la finestra a schermo intero/chiudere il browser.  Sistema operativo: Windows 7 La cosa è piuttosto scomoda e volevo segnalarverlo, non so se si può fare qualcosa.  </p><p>Grazie,  </p><p>Lara Parmeggiani </p>",windows-7;desktop;customize;firefox-940;firefox-9402;,firefox,customize,it,1463759;,lara.parmeggiani1973
1359919,2021-12-02 22:40:11 -0800,2021-12-02 23:09:49 -0800,Changes to bookmark management in FF 94.0.2,<p>Prior to FF 94.0.2 saving a bookmark opened an option to select the folder in which it was to be placed. With 94.0.2 the bookmark is saved directly to the last folder selected with no option to select a folder. I have to perform an extra action immediately to edit the bookmark location. If this isn't done before closing the tab I have no way of finding the bookmark again. Please revert </p>,mac-os;desktop;bookmarks;firefox-940;,firefox,bookmarks,en-US,1463747;,davivid
1359916,2021-12-02 21:51:53 -0800,2021-12-03 14:14:14 -0800,"Bookmarks menu is on toolbar, not under ""bookmarks"" in the menu bar","<p>OK.  someone kindly offered me a new-to-me computer and claimed that they had transferred everything to the newish one. Well, what they did was take my umpteen gazillion desktop shortcuts and place them all in ""bookmarks menu"". EEK.` That's way too many. So I exported them to an html file/link/firefox internet shortcut on the desktop called ""bookmarks.html"". Worked swell. However, the bookmarks menu went along. It no longer appears under""bookmarks"" on the menu bar. I was able to get it onto the toolbar. (star in tray). If I click on that, and then select ""bookmarks sidebar"", what appears in the sidebar is perfect. Just like new. But on the menu bar, on the dropdown menu under ""bookmarks"", no ""bookmarks menu"". </p><p>I can live with this BUT I really don't want to BECAUSE there are bizillion bookmarks in the bookmarks menu. I need to send them someplace (or gather them into a NEW folder, so that I can add newly created bookmarks and be all neat and organized. </p><p>How do I put the ""bookmarks menu"" that shows on the sidebar back under ""bookmarks"" ??? How do I get the bizillion bookmarks off of ""bookmarks menu""? Is there a ""select all"", then ""delete""? I don't want to lose the ones in the html folder on the desktop. I am happy with them being in an html folder on my desktop. Should I change the name of the html link to XYZ.html? </p><p>I just do not understand how the sidebar can look perfect but the menu bar doesn't. </p><p>Help, please ! </p>",desktop;bookmarks;windows-10;firefox-940;,firefox,bookmarks,en-US,1463749;1463750;1463819;1463829;1463835;1463845;1463877;1463897;1463900;1463925;,yukonlilye2021
1359913,2021-12-02 21:12:10 -0800,2021-12-02 23:14:35 -0800,I hate some of your suggestion on the drop down menu below the address bar. Why can't you let me get rid of some or ALL of them?,<p>I described my whole issue above:  I intensely dislike some of the choices you have made for me such as Facebook on your drop down menu below the address bar. Why can't you let me change or delete some or ALL of then? </p>,desktop;customize;windows-10;firefox-940;,firefox,customize,en-US,1463744;1463748;,debkvande
1359912,2021-12-02 20:58:21 -0800,2021-12-03 11:17:41 -0800,muisc,<p>muisc </p>,desktop;other;,firefox,other,en-US,1463888;,meseker.asfaw
1359911,2021-12-02 20:46:21 -0800,2021-12-03 05:25:45 -0800,Only a tiny blank window shows when opening Firefox,<p>When I open Firefox a tiny window appears with nothing but a button and it does not open. When I click the button it just closes. same thing happens when I open the developer edition as well but in that the main window appears but does not load. </p><p>This used to happen intermittently since few months ago. When that happens closing that tiny window and reopening the app usually worked. but it outright does not open anymore </p><p>Happened on Win 10 now on Win 11 </p><p>when I reinstall Firefox it opens up normally. but when I restart my pc this happens again. </p><p>Edit: Tried reinstalling to open Firefox now it does not even open like that anymore. </p>,desktop;fix-problems;,firefox,fix-problems,en-US,1463734;1463738;1463763;1463767;1463775;1463787;,msfrox
1359906,2021-12-02 18:32:16 -0800,2021-12-02 19:23:16 -0800,Browser Tabs,<p>Since their introduction tabs have always been below the address bar. Firefox 94 changed that. How do correct this egregious design error? </p>,desktop;tabs;windows-10;firefox-940;,firefox,tabs,en-US,1463721;,kevin169
1359905,2021-12-02 18:31:57 -0800,2021-12-03 01:46:55 -0800,bp-0abd5671-d98e-43d7-ae19-bdb280211130,<p>help me to fix it!!!!! </p>,desktop;fix-problems;windows-10;firefox-9402;,firefox,fix-problems,en-US,1463722;1463764;1463765;,312395281
1359902,2021-12-02 18:07:51 -0800,2021-12-02 21:11:07 -0800,"PDF files all changed to ""Type of File"" Firefox HTML Document (.pdf)  which i DID NOT WANT!!  I need to change them back to the REGULAR adobe pdf files.  I have followed several instructions on here but they have NOT restored my files to the original .pdf","<p>There are several requests similar to mine, mostly about Windows 7 (i have windows 10).  I made sure the ""general settings"" within Adobe were set to use Acrobat as default, and i set firefox options (as near as i could tell) to save my pdf's with Adobe acrobat also.  However, ALL my files - both already saved and new pdf's - now are listed as filetype ""Firefox HTML.pdf""  and all have the html icon.  For my husband's business, we have to fill out state forms in pdf and forward copies to them and to clients.  My clients are frustrated and confused that they cannot recognize the pdf's i sent by the original icons, and some don't seem to understand how to open the ""html"" files i send them  (most of our clients probably use other browsers: when they showed up as straight adobe files this was never a problem)  I need to fix BOTH my stored pdf forms AND new fillable forms from the state as filename.pdf with the adobe icon.   PLEASE!! </p>",desktop;other;windows-10;firefox-940;firefox-9402;,firefox,other,en-US,1463724;1463740;,trinj
1359901,2021-12-02 17:47:25 -0800,2021-12-03 11:58:40 -0800,In my browser is a pic of an ugly man. When you click on him it says Browser is under remote control (reason:De,"<p>That ugly man in the browser won't let me enter websites or pages within the website ,like sweepstakes entries on Cabela's website for example. My numbers are [phone number]. Michael Lodsin  When I open Firefox, there are 3 or 4 blue screens pop up to make excutible orders to my computer, I always click them off. but they we not always there. Is someone using my computer from afar, or worse tracking my keystrokes or monitoring me ? </p>",desktop;malware;privacy-and-security_1;escalate;needsinfo;windows-10;firefox-940;firefox-9402;,firefox,privacy-and-security,en-US,1463713;1463714;1463717;1463896;,nocowfarm2001
1359900,2021-12-02 17:38:26 -0800,2021-12-02 18:31:19 -0800,firefox wont work!,"<p>When i start firefox, i get a white window. menu works, but unable to visit any site or even see items like settings and password, etc. (although tab is created). I tried to refresh firefox via help, kill the task thru task manager, and finally i tried to uninstall and reinstall. Upon reinstall i got an error regarding a missing DLL?? </p><p>See image. </p><p>Please advise!  </p><p>Note: i recently upgraded to windows 11. </p>",desktop;fix-problems;,firefox,fix-problems,en-US,1463718;,anubhavshah
1359899,2021-12-02 17:34:20 -0800,2021-12-02 20:44:26 -0800,Unable to copy and paste images to websites within Firefox,"<p>When I try copying an image off a website and pasting it, I am unable to As an example (included with images): I right click and copy an image from <a href=""http://Startpage.com"" rel=""nofollow"">Startpage.com</a> I go to <a href=""http://editor.construct.net"" rel=""nofollow"">editor.construct.net</a>, create a sprite, and attempt to paste this image as a sprite. (As shown because the Edit button in the top left corner is flashing, so I am pasting it.) This does not work. It works in other browsers like Edge, Brave, etc. I am on MacOS Big Sur 11.4 and running Firefox 94.0.2 </p>",mac-os;desktop;websites;firefox-940;,firefox,websites,en-US,1463711;1463731;1463733;,itzgreenforever
1359898,2021-12-02 17:31:45 -0800,2021-12-02 17:31:45 -0800,Does enhanced tracking protection include email addresses?,"<p>I recently googled a product and clicked on a link to their site (not an ad result). Shortly after I got an email from the company saying ""thanks for checking us out."" I never filled in any form with my email address. Is Firefox allowing Google to send my email address to the company so they can send marketing emails? I have Enhanced Tracking Protection on. </p>",desktop;privacy-and-security_1;,firefox,privacy-and-security,en-US,"",leelalynn
1359896,2021-12-02 16:34:55 -0800,2021-12-02 21:17:55 -0800,Need Escalated Help:  Firefox Uses Excessive Memory in WIndows 11.x,<p>I asked about this in a previous thread and never got a response from the escalation group. </p><p>I use my computer all day and keep several tabs open for ongoing use. </p><p>This is an example of what I see regarding Firefox's memory use.  I do not open and close tabs often enough to have this make sense. </p><p>Please help!  I cannot afford to have so much of my available memory blocked. </p>,desktop;fix-problems;firefox-940;firefox-9402;,firefox,fix-problems,en-US,1463736;1463741;,JandNL
1359894,2021-12-02 16:05:51 -0800,2021-12-02 16:09:17 -0800,Mozilla Firefox Browser,<p>I am unable to reinstall Mozilla Firefox. </p>,desktop;download-and-install_1;,firefox,download-and-install,en-US,1463703;,davekamin
1359893,2021-12-02 16:02:26 -0800,2021-12-02 16:10:10 -0800,Lost firefox,"<p>Had Firefox update 78 for my Mac, operating sys. OS X El Capitan 10.11.8.. tried to update to 91. After update found out 91 would not work on my OS X. Npw I don't have Firefox and can't find Ver 78? help! </p>",desktop;download-and-install_1;,firefox,download-and-install,en-US,1463704;,outlawmule
