id,created,updated,title,content,tags,product,topic,locale,answers,creator
1327401,2021-02-26 14:00:25 -0800,2021-02-26 14:00:25 -0800,Clear or Remove Recently Bookmarked,"<p>Hi!  </p><p>Just wondering if, and where, is the option to completely remove, disable or clear out the list of ""Recently Bookmarked"", from the bookmarks menu? </p><p>From clicking the icon in the top right, that looks like a stack of books, and then clicking bookmarks, that drop down menu, ""Recently Bookmarked"". </p><p>I do not want that list and find it kinda redundant and annoying to have a list of bookmarks, that I've already bookmarked mind you, sitting there that cannot be removed or cleared. I've searched high and low and can not find an option to remove that list or option. Like a history of bookmarks, that I've already chosen to bookmark.  </p><p>Bookmarkception I guess was the goal there... </p><p>Thanks! </p>",desktop;bookmarks;windows-10;firefox-860;,firefox,bookmarks,en-US,"",MushMush
1327400,2021-02-26 13:56:01 -0800,2021-02-26 13:56:01 -0800,"Web push notifications options, e.g., placement, timeout, fonts, etc","<p>I have been unable to find any information on customizing the look of Web push notifications.  I would like to be able to change the time they remain on the screen, where they appear, how many can stack at a time.  Is there any means to do this?  Specifically, I would like to change the way Slack message announcements appear. </p>",desktop;customize;windows-10;firefox-850;,firefox,customize,en-US,"",elupin
1327397,2021-02-26 13:47:50 -0800,2021-02-26 13:47:50 -0800,colored squares on browser pages,"<p>Today i turned on firefox running the latest ubuntu platform and had colored squares and dots all over the web pages.  If I move the mouse or type the squares colored black, blue, aqua and green move with the mouse or typing all over the display like snow.  I have gone over the troubleshooting steps, I have uninstalled and reloaded mozilla firefox.  The only way I can stop this is to go to safe mode.  I have downloaded two other browsers today and do not have this problem with the other two browsers, or with any of the software programs on the computer.  Any ideas? </p>",desktop;beta;other;firefox-870;,firefox,other,en-US,"",mcantrel
1327396,2021-02-26 13:42:15 -0800,2021-02-26 13:42:15 -0800,Download Firefox latest Version,"<p>When I turned on my computer this morning a message said I needed to download Firefox Update, so I clicked on that link. About a half hour later after it had also updated Windows 10 a page popped up telling me I had been sent a code to my email that I would need to input. I have not received an email or junk mail with any code. However, it looks like I already have Version 86.  Please help me with this issue. I am so overwhelmed with computer issues I'm on the verge of tears right now. My last Windows 10 update Did NOT install and I am not the only one with this issue, but NO help from Microsoft. Did Mozilla update Windows 10 to accept the new version of Firefox? I looked at your educated guess, clicked on Show Details, nothing came up. Then I clicked on Troubleshooting Information and Share Data. I don't know if you are able to see this list or not, I don't know what 99% of it means, but I did copy a few things that may be helpful. environmentVariables"": { </p><pre>   ""MOZ_CRASHREPORTER_DATA_DIRECTORY"": ""C:\\Users\\Rhonda\\AppData\\Roaming\\Mozilla\\Firefox\\Crash Reports"",    ""MOZ_CRASHREPORTER_EVENTS_DIRECTORY"": ""C:\\Users\\Rhonda\\AppData\\Roaming\\Mozilla\\Firefox\\Profiles\\fq7xq0bn.default-release-2\\crashes\\events"",    ""MOZ_CRASHREPORTER_PING_DIRECTORY"": ""C:\\Users\\Rhonda\\AppData\\Roaming\\Mozilla\\Firefox\\Pending Pings"",    ""MOZ_CRASHREPORTER_RESTART_ARG_0"": ""C:\\Program Files\\Mozilla Firefox\\firefox.exe"",    ""MOZ_CRASHREPORTER_RESTART_ARG_1"": ""-os-restarted"",    ""MOZ_CRASHREPORTER_STRINGS_OVERRIDE"": ""C:\\Program Files\\Mozilla Firefox\\browser\\crashreporter-override.ini""  },  ""lockedPreferences"": {    ""fission.autostart"": false,    ""fission.autostart.session"": false </pre> <p>I already have VERSION 86 according to the information on Firefox. But the message I had this morning specifically asked to download FIREFOX latest version. Please help. Rhonda </p>",desktop;download-and-install_1;escalate;windows-10;upgrade;firefox-860;,firefox,download-and-install,en-US,"",Rhonda_89
1327394,2021-02-26 13:22:47 -0800,2021-02-26 13:22:47 -0800,Firefox for Mac version 85.0.2 transferring data message keeps repeating (only with IPv6),"<p>Hello. After updating Firefox on my Macbook, a website I visit now will not load, the message ""transferring data"" will appear and the status indicator looks like the data is loading, then when the status bar looks like its at 100%, it will start over and show ""transferring data"" again, and this keeps repeating indefinitely.  This only happens when using an IPv6 address, it works fine with IPv4. This did not occur in Firefox 81.0.2. This also does not occur on other websites or with other browsers. I am looking at the notes for releases between 81.0.2 and 85.0.1 but am not sure what may have changed that would cause this. The website in question is a BMC GUI for a server I'm working on.  If anyone has any ideas I'd really appreciate it. I tried the debugger in Firefox but not sure what I am looking for. I did set a breakpoint for caught exceptions, and the screenshot is attached if it helps any... Thanks! </p>",desktop;fix-problems;,firefox,fix-problems,en-US,"",jfriedman.seattle
1327393,2021-02-26 13:21:09 -0800,2021-02-26 14:07:14 -0800,Won't load pages on desktop,"<p>For the last week or so, Firefox on my desktop has opened to a blank new tab screen, and won't load any other pages. It won't even load <a href=""http://support.mozilla.org"" rel=""nofollow"">support.mozilla.org</a>, I'm asking this on my phone! I've had to use Edge on the occasions that I CAN'T use my mobile for the task; printing shipping labels, downloading a better art program, that sort of thing. I'd really rather NOT use Edge at all, thanks. </p>",tips;,firefox,basic-browsing-firefox,en-US,1395009;1395014;,jordanliora1995
1327392,2021-02-26 13:17:23 -0800,2021-02-26 13:17:23 -0800,Onglets,"<p>Hello a tous !!! Une mise a jour de firefox, et je me retrouve avec les onglets en hauts de la barre de recherche.  Comment replacer la suite d'onglets sous la barre de marques pages juste au dessus de la fenêtre web.. Merci !! </p>",desktop;customize;windows-10;firefox-860;,firefox,customize,en-US,"",afxs.afxs
1327390,2021-02-26 12:42:43 -0800,2021-02-26 13:18:13 -0800,updaet,<ol><li> Numbered list item </li></ol>,windows-xp;desktop;download-and-install_1;firefox-5290;firefox-529;,firefox,download-and-install,en-US,1394980;1394996;,saeed.noori9383
1327389,2021-02-26 12:41:05 -0800,2021-02-26 13:17:52 -0800,updait,<ol><li> Numbered list item </li></ol>,windows-xp;desktop;download-and-install_1;firefox-520;,firefox,download-and-install,en-US,1394995;,saeed.noori9383
1327388,2021-02-26 12:20:37 -0800,2021-02-26 12:20:37 -0800,"Search shortcuts - ""This time, search with"" requires second click to confirm","<p>Hi, The alternate search shortcuts are an excellent feature. Prior to a recent Firefox update, I was able to enter a search term and click once on one of the alternate search engine icons to perform the search with that engine. </p><p>Currently, I need to click the icon, e.g. Wikipedia, and confirm the request by pressing Enter or clicking the new item in the entry in the address bar drop-down, ""Search with Wikipedia"" (screenshot attached). </p><p>Is there an item in the about:config settings to revert this change and perform this search with a single click on the icon? </p><p>Thank you. </p>",desktop;customize;windows-10;firefox-860;,firefox,customize,en-US,"",futurenow8
1327386,2021-02-26 11:56:13 -0800,2021-02-26 14:11:49 -0800,Firefox installation,"<p>Hello, I am on a MacBook Pro I was facing some issue with Firefox , which did not go even after refresh , so I decided to reinstall I used Appcleaner to uninstall Firefox , including the saved state and plist file.However , after uninstallation , I noticed there were some files under Library~Caches and Library~Application Support.I deleted these files by mistake . I would like to know if deleting these files would affect Firefox if I reinstall it  Thanks in advance </p>",desktop;download-and-install_1;,firefox,download-and-install,en-US,1394973;1395010;1395015;,aymanas2004
1327384,2021-02-26 11:53:01 -0800,2021-02-26 14:04:53 -0800,Notification is not working for youtube,<p>i have notification on for youtube but will not give me push notification also it does work for other website like twitter but not for youtube </p>,mac-os;desktop;other;firefox-860;,firefox,other,en-US,1395013;,shamimdhanji
1327383,2021-02-26 11:50:12 -0800,2021-02-26 11:50:12 -0800,NFS mounted home directory caused a hang condition in firefox. Repeatable when creating ebay listing,"<p>I am using centos 8.2 with it's firefox 78.7.0esr (64-bit) I also have my home directory mounted via NFS using the automounter system. </p><p>In general firefox works fine in this configuration. However, when I get on Ebay and try creating a listing, firefox will hang when adding photos and/or moving the photo order. My NFS server will then start complaining about 'failed to contact remote rpcbind. </p><p>I try to close firefox and it doesn't It then will ask about a script running to long and offer to close. It won't I wait quite some time and it doesn't close About now the whole system is locked up and I may be able to get to the reboot menu I reboot and it won't because the process is hung. I usually have to power cycle to get things back. </p><p>I think if I waited for the automounter to time-out firefox may close at that time. </p><p>So the questions are:  Is this supposed to work in an NFS environment? What is going on to cause the hang? Are there environment variables to move ""some directory"" to the local disk drive if that is the problem? </p><p>I sure hope someone can answer this for me. Thanks Warren </p>",linux;desktop;fix-problems;,firefox,fix-problems,en-US,"",warrendodge
1327382,2021-02-26 11:35:48 -0800,2021-02-26 11:35:48 -0800,2AF TOTP troubleshooting,"<p>Hi! It doesn't matter wich app I use for 2AF, once the QR is scanned (or even when the hash is added manually) Firefox doesn't recognize the 6 digit code. Now I'm using andOTP, but the same behaviour with Google Authenticator. Any help? Thanks in advance! </p>",desktop;privacy-and-security_1;windows-10;firefox-860;,firefox,privacy-and-security,es,"",shadowmasterjose
1327381,2021-02-26 11:10:01 -0800,2021-02-26 11:10:01 -0800,youtube videos,<p>Why are videos slow to load/play on Firefox.? Chrome is fine. </p>,desktop;fix-problems;windows-81;firefox-860;,firefox,fix-problems,en-US,"",bilotxxx
1327380,2021-02-26 11:08:28 -0800,2021-02-26 13:04:21 -0800,printing problem with even-number pages,"<p>Having a problem with printing since moving to FF 86.0.  Print is automatically set up for my Brother MFC-J895W (LAN connection) to print 2-sided and back-to-front, but is printing the 2nd page upside down.  I've tried going into about:config and deleting the entry for ""print.print"", as well as editing the prefs.js and deleting everything that has ""print_"", but no help. </p>",desktop;other;windows-10;firefox-860;,firefox,other,en-US,1394989;,dougschuess1
1327378,2021-02-26 10:53:11 -0800,2021-02-26 10:53:11 -0800,'*' Bookmarks shortcut shows non-bookmark result first,"<p>Hello, </p><p>Recently I observed following behavior: </p> <ol><li> Ctrl+L to select addres bar. </li><li> ""* "" to trigger bookmark shortcuts. </li><li> I type few letters of my query. </li><li> The seeked bookmark is shown second on the list. The first results is a nonbookmarked history item. </li></ol> <p>See attached image for an example. </p><p>The issue is this: Why on earth would I bother with the ""* "" prefix if I wanted a non-bookmark result? </p><p>This seems be a recent change. Can this be disabled somehow? Thanks! </p>",linux;desktop;bookmarks;firefox-860;,firefox,bookmarks,en-US,"",extremegf
1327376,2021-02-26 10:23:01 -0800,2021-02-26 10:23:01 -0800,Fire Fox Update Link opens in New Tab,"<p>Hello, </p><p>I am looking at the reason why every time Firefox updates this link opens in a new tab https://www.grabber.website/ </p><p>No other browser does this.   Wondering if I can block that tab from opening when Firefox updates.  Considering deleting Firefox altogether if this keeps happening. </p>",desktop;other;windows-10;firefox-860;,firefox,other,en-US,"",am1star
1327374,2021-02-26 10:07:54 -0800,2021-02-26 10:07:54 -0800,Hide the PDF Reader toolbar,"<p>Hello guys, is there a way to hide or disable the PDF Reader toolbar when embeding a PDF document thru EMBED or iFRAME? I was able to do it in some browser but was unsuccesful in Firefox. I will appreciate your assistance. Best regards, David Valencia </p>",desktop;tips;,firefox,tips,en-US,"",dvalencia1970
1327368,2021-02-26 09:15:58 -0800,2021-02-26 09:15:58 -0800,Why does a New Folder in Bookmarks create a subfolder instead of top-level folder?,"<p>I cannot seem to control where a new bookmark folder goes. Each time I do this, it creates a subfolder inside another folder. I have to remember which folder it went into, then go into Show All Bookmarks and manually drag my new folder out so it's in the main Bookmarks Menu list. </p><p>It's only a slight inconvenience but annoying nonetheless. Even if I make sure that ""Bookmarks Menu"" is selected, it will still put my new folder inside another folder. </p><p>Is there a way to prevent this? </p>",mac-os;desktop;bookmarks;firefox-850;,firefox,bookmarks,en-US,"",allegrojane
1327365,2021-02-26 09:04:25 -0800,2021-02-26 09:26:14 -0800,"Did a system restore and firefox was rzemoved from my windows 7 computer, had pword saved but now it's gone","<p>I did a system restore because I thought an update had messed up some things, specifically I could not sign in to a site I use regularly because I would get a black screen and a message stating that ""Northern Tool"" is not currently available in your country. I had been using a vpn but it was set for a U.S. city and both I and the website are in the U.S. also. After system restore for a time only 2 days prior, my Firefox was apparently removed from my computer and all history of it. Now I am having trouble re-installing and using sync to get back my saved stuff. This is all on another PC with Windows 7. </p>",desktop;sync;windows-10;firefox-850;,firefox,sync,en-US,1394934;,dagrump
1327364,2021-02-26 09:00:45 -0800,2021-02-26 09:10:05 -0800,Firefox refresh deleted all logins,"<p>Firefox updated on my work machine concurrent to a machine self-restart and VPN update. The VPN update bricked my access to shared drives for my work network so I assumed the issue lie somewhere with lack of internet access and inability to connect to said network. Now the VPN is up and running with normal file access restored, but all my FireFox info is gone. I see on my desktop a file called Old FireFox data and begin googling the recovery process. I generated a new profile in FireFox and copied over all files from the old profile to the new including key4.db and logins.json to no avail. </p><p>There are no passwords, no login info, no cookies, no bookmarks, nothing is left. Also, I cannot copy any of these files. I can only move them for some reason. I've tried to back up these files, but they are move-only somehow. </p><p>Any advice? </p>",desktop;customize;windows-10;firefox-780;,firefox,customize,en-US,1394929;,stuart.blood
1327363,2021-02-26 08:53:23 -0800,2021-02-26 09:13:42 -0800,google search engine change by itself to Yahoo,<p>My search engine changed from google to yahoo how do i change it back </p>,desktop;other;windows-10;firefox-860;,firefox,other,en-US,1394930;,rsw214
1327360,2021-02-26 08:23:03 -0800,2021-02-26 08:23:03 -0800,Installing FireFox from Google Play to my android cellphone does not work,<p>Installing FireFox from Google Play to my android cellphone does not work. What can I do to make it work? </p>,desktop;download-and-install_1;windows-10;firefox-860;,firefox,download-and-install,en-US,"",dhpulley286
1327359,2021-02-26 08:21:45 -0800,2021-02-26 08:21:45 -0800,some twitter feature do not work with firefox on the windows browser on a laptop,<p>the firefox browser for windows on a laptop does not show the lists feature for twitter </p>,windows-7;desktop;websites;firefox-860;,firefox,websites,en-US,"",dasilvasss
1327357,2021-02-26 08:13:09 -0800,2021-02-26 08:13:09 -0800,Search Engine support is not free.,"<p>I front what you promise. Here's a quote: ""Firefox - the independent browser, supported by the non-profit Mozilla"".  </p><p>I am going to <strong>set up a default search engine</strong> with the URL myself. </p><p>Please explain me <strong>how to set http://blackle.com/ as default search engine</strong>. Without using the home button or an existing bookmark every time. </p>",linux;desktop;customize;firefox-850;,firefox,customize,en-US,"",UserNr1
1327354,2021-02-26 08:05:13 -0800,2021-02-26 08:05:13 -0800,Cannot access godaddy website content because of TLS update,<p>I can no long access content on my website and contacted godaddy and they said I need to disable the TLS legacy but cannot find how to disable completely.  I did that in Chrome and it worked but can't do it in firefox. </p>,desktop;websites;windows-10;firefox-860;,firefox,websites,en-US,"",raven277
1327353,2021-02-26 08:01:30 -0800,2021-02-26 08:01:30 -0800,How to change the color on sidebar for my bookmarks,<p>I am new to Firefox and hope I am doing this the right way. I would like to know How to change the color on sidebar for my bookmarks. Its white and hard to see and also make the bookmarks once looked at changed to that website icon? </p><p>Thank you for all your help. </p><p>Frank </p>,mac-os;desktop;bookmarks;firefox-860;,firefox,bookmarks,en-US,"",franick
1327352,2021-02-26 07:57:31 -0800,2021-02-26 13:57:09 -0800,logins and passwords add-ons bookmarks,"<p>Yesterday I reseted my pc and once I was able to get in and reinstall Firefox I did. Once signed in usually everything is there. I might have rearrange a few add-ons but its good to go but not this time. Everything was gone. My passwords, add-ons and bookmarks. </p>",desktop;sync;windows-10;firefox-860;,firefox,sync,en-US,1395011;,destroyerofjericho
1327349,2021-02-26 07:46:52 -0800,2021-02-26 07:46:52 -0800,"powiadomienia z witryn znikają same z ekranu po kilku sekundach, jak wydłużyć czas?",<p><strong>bold text</strong> </p>,windows-7;desktop;fix-problems;firefox-860;,firefox,fix-problems,en-US,"",andrzejelf
1327348,2021-02-26 07:33:39 -0800,2021-02-26 13:58:56 -0800,do my extensions istall when i install firefox on my new PC,<p>do my extensions install when i install Firefox on my new PC </p>,windows-7;desktop;download-and-install_1;firefox-850;,firefox,download-and-install,en-US,1395012;,willy.ed
1327347,2021-02-26 07:31:20 -0800,2021-02-26 07:31:20 -0800,Privacy extensions,"<p>Now that FF 86 has total cookie protection do I still need to run extensions that do the same thing.  I have always run ublock origin.  Also I see that DuckDuckGo has an extension that blocks trackers, wonder if I need that too or not.   </p><p>When I load a web page I still see ublock blocking things and if I add the DDG extension its finding stuff too at the same time. </p><p>Thoughts? </p>",desktop;privacy-and-security_1;,firefox,privacy-and-security,en-US,"",elliot5
1327345,2021-02-26 07:05:44 -0800,2021-02-26 07:05:44 -0800,box keeps popping  up when open comments section of article,<p>this aforementioned box is a P-I-A and i want to stop it </p>,desktop;other;windows-10;firefox-850;,firefox,other,en-US,"",GAINES
1327342,2021-02-26 06:53:41 -0800,2021-02-26 07:33:30 -0800,Pop up notification,"<p>On some sites i need for my work, i get some pop ups saying, are you sure you want to continue with this action? I accidentaly clicked on never show this message again. Now I cannot do things on these sites anymore because the are you sure pop up doesnt show up anymore. Is there somewhere I can reset this? Couldn't find it in the settings. Thanks in advance. </p>",desktop;websites;windows-10;firefox-860;,firefox,websites,en-US,1394911;,jorian
1327341,2021-02-26 06:49:55 -0800,2021-02-26 06:50:46 -0800,Ticks,<p>Hello </p>,linux;desktop;tips;needsinfo;firefox-400;,firefox,tips,en-US,1394899;1394900;1394901;,vy6233118
1327340,2021-02-26 06:47:39 -0800,2021-02-26 10:24:59 -0800,Print PDF files generated from Firefox,"<p>When I want to save a newspaper article as a PDF file in Firefox, Firefox asks if I want to open it with Firefox. It's good. I then also save this file in a folder on the PC. Then I want to print this file too. With several pages as two sides, as a duplex print. For a few days now, the backs of the print, i.e. the even sides, have no longer been printed in advance, but instead are printed upside down. As it seems to be happening in the USA. In the USA, pages are not stapled on the side, but on the top. This is not good. Please change it so that it can be stapled on the page and then read like a book. Not always having to turn it upside down! Thank you, that is very important in Germany! Günther Grau </p>",desktop;other;windows-10;firefox-860;,firefox,other,en-US,1394910;1394951;,ggrau
1327339,2021-02-26 06:22:09 -0800,2021-02-26 07:19:25 -0800,Old account,"<p>Can anyone help. I have just set up a new Firefox account. I tried to enter two different secondary email addresses, but both are already in use.  </p><pre>I am sure I had a Firefox account many years ago and this is the problem. How can I delete the old account without knowing the main email address so I can use those email addresses again? </pre>",desktop;other;needsinfo;windows-10;firefox-860;,firefox,other,en-US,1394895;1394897;1394908;,jzdra56
1327338,2021-02-26 05:45:47 -0800,2021-02-26 05:45:47 -0800,Facebook container,"<p>Hi, does anybody else have this problem? I am using the Facebook container add-on which works fine apart from when I have been on Facebook and then go on to the MSN games site without closing Firefox first. If I close Firefox after using Facebook then open MSN games all is fine. If I forget to close Firefox and go straight to MSN games I lose all my games history and have to log on again with a pop-up appearing saying that they have changed their privacy policy. Many thanks </p>",desktop;privacy-and-security_1;windows-10;firefox-860;,firefox,privacy-and-security,en-US,"",alastair.torrance
1327335,2021-02-26 05:12:50 -0800,2021-02-26 05:27:51 -0800,Bing in Firefox,<p>Microsoft has somehow inserted Bing into all browsers without asking. How do you get rid of it in Firefox? </p>,desktop;other;windows-10;firefox-860;,firefox,other,en-US,1394874;,lmccarth
1327333,2021-02-26 05:03:04 -0800,2021-02-26 05:03:04 -0800,"Just one website, which I use regularly, has suddenly changed to white text on a black background.","<p>I have been viewing this website for years and, suddenly, this evening, the text in certain files on the website has changed to white text on black background, when viewed through Firefox for Windows on my Laptop. </p><p>Story files on this website are either in a basic doc format or in html.  The html files are fine but the doc files are the ones displaying this strange change in 'behaviour'.  Just for comparison, even though Firefox is my preferred browser, I tested the issue on Edge; the doc files, when viewed there, still display as black on white, as usual, so to say. </p><p>I have reviewed the web and found various things about Windows wide settings and also a post about the prefs.js file.  The windows wide settings didn't seem to have any effect.  I did the procedure of renaming the prefs.js file to prefs-old.js, which forced Firefox to return to default settings, but there was still no 'correction'.  I also completely shut down the laptop and restarted; again no resolution of the problem. </p><p>Any ideas, please? </p><p>Philip, Bendigo Victoria, Australia </p><p>P. S. I have not added images, as the site is adult entertainment and therefore not appropriate to display on an 'unguarded' forum. </p>",desktop;websites;windows-10;firefox-860;,firefox,websites,en-US,"",cuddling101
1327332,2021-02-26 04:57:23 -0800,2021-02-26 04:57:23 -0800,How to turn off the name of the search engine in a blue box in the address bar instead of the search shortcut as typed?,"<p>When I typed any search shortcut (let's say ""w"" for Wikipedia) and then Space in the address bar, the bar would have just shown ""w "". </p><p>After an update to 86, now typing ""w "" shows ""Wikipedia"" in a blue box instead of ""w "". This is extremely irritating because I now can't just press Alt+D and enter a new search shortcut from scratch when I mistyped. </p><p>I have both browser.urlbar.update1 and browser.urlbar.update2 set to false. </p>",windows-7;desktop;other;firefox-860;,firefox,other,en-US,"",hysknrs
1327331,2021-02-26 04:47:08 -0800,2021-02-26 04:47:08 -0800,"claiming they belong to priemna@mvr.bg, organised 24/7 group broke the add-on.","<p>relate ""claiming they belong to priemna@mvr.bg, organised 24/7 group broke the add-on."" to - </p><p>1/ Igor Petrovich 2/ Igor Markovski 3/ Stela from Geo Milev 4/ <a href=""http://ff-bg.net"" rel=""nofollow"">ff-bg.net</a> 5/ add-ons 6/ 8211046345 7/ 200428387 8/ slusham 9/ .org 10/ Cherni vrah 1, <a href=""http://abv.bg"" rel=""nofollow"">abv.bg</a>, testuser22 11/ Belneyski, secretary@dps.bg and Cherni vrah to Black Sea </p>",linux;desktop;privacy-and-security_1;firefox-850;,firefox,privacy-and-security,en-US,"",testuser23
