id,created,updated,title,content,tags,product,topic,locale,answers,creator
1359050,2021-11-25 02:27:47 -0800,2021-11-25 04:39:59 -0800,Faulty web site functions,"<p>On screen 'buttons' don't work when using Firefox but work with other browsers. </p><pre>When connecting to the following web site the on screen 'buttons' DONATE and DONATE NOW don't function when using Firefox. </pre> <p><a href=""https://www.charidy.com/lifeline?utm_source=Mailchimp&amp;utm_medium=email&amp;utm_campaign=lf-giving-day-21&amp;utm_content=button&amp;utm_term=donors&amp;mc_cid=9dafdce4b7&amp;mc_eid=a9351daa1d"" rel=""nofollow"">https://www.charidy.com/lifeline?utm_source=Mailchimp&amp;utm_medium=email&amp;utm_campaign=lf-giving-day-21&amp;utm_content=button&amp;utm_term=donors&amp;mc_cid=9dafdce4b7&amp;mc_eid=a9351daa1d</a> </p><p>Firefox is my default browser and has been for many years. If I copy and paste the link into another browser e.g. Chrome, the function as expected. Is this a fault with Firefox or with the particular website? </p>",desktop;websites;firefox-940;firefox-9402;,firefox,websites,en-US,1461940;,GreyViper
1359049,2021-11-25 02:25:08 -0800,2021-11-25 05:03:10 -0800,New Version Searching,"<p>I don't really have a question. I have looked on the Mozilla site for a place to email the developers. I'm not happy with the new version of Firefox (attached) I have to go into History and restore tabs every time I restart my computer, I like to have many tabs continuously open so this doesn't suit me at all. Also the new search function at the top of the screen in the typical URL box is not nice, I preferred when the search was in a box in the middle of the screen and suggestions popped up when you start typing a search. Suggestions don't pop up in the new Firefox version. </p><p>I really enjoy Firefox and have been using it many years, I just wanted to share my opinions of the new version. </p>",windows-7;desktop;customize;,firefox,customize,en-US,1461946;1461947;,garthcusters
1359048,2021-11-25 02:21:53 -0800,2021-11-25 05:34:54 -0800,Firefox caching shopping cart incorrectly,"<p>Hi, </p><p>I am having an issue with a website I am developing, which I am only seeing in Firefox. To reproduce please try the following: </p><p>1. Go to <a href=""https://mymummyteacher.com/store"" rel=""nofollow"">https://mymummyteacher.com/store</a> and add a product to the cart. 2. Close the tab / browser 3. Go back to <a href=""https://mymummyteacher.com/store"" rel=""nofollow"">https://mymummyteacher.com/store</a> and add a product to the cart. The single product that has been just added is shown, however the Subtotal and Total are showing as if the previously added product is still in there too.  </p><p>If I do a hard reload (hold down shift), all the other products then appear. So I think this is an issue with caching. I am not seeing it on other browsers. Is this a bug, or is there something I can do to stop it happening? </p><p>Thanks </p>",mac-os;desktop;websites;escalate;developer;website;firefox-940;firefox-9402;,firefox,websites,en-US,1461948;1461954;1461955;,mike475
1359045,2021-11-25 01:36:44 -0800,2021-11-25 05:07:18 -0800,Outlook not loading on Firefox,"<p>Hello, </p><p>Since the last few days my Outlook email account has stopped loading/refreshing. it won't display the email content of I click on an email. Works fine in Chrome.  What could be causing this issue all of a sudden? </p><p>Thank you, Smita </p>",desktop;other;windows-10;firefox-940;,firefox,other,en-US,1461949;,spatel118
1359044,2021-11-25 01:10:50 -0800,2021-11-25 01:10:50 -0800,PDF with form fields are displayed blank on print,"<p>The fields are displayed correctly when viewing the PDF, but when I try to print, the fields are blank on preview and also on the actual print. The PDF works as expected when using Edge and Chrome. </p>",desktop;beta;other;windows-10;firefox-950;,firefox,other,en-US,"",Tamtam98
1359042,2021-11-25 00:29:08 -0800,2021-11-25 10:50:50 -0800,Firefox is not working,"<p>Hello, After automatic update of FF to version 94.0.2 and restart of program started my problems. Since that time browser is not working properly. Program starts but will not load homepage or will not show any webpage after putting its URL and enter key. Also no setting is possible to show. Seems like browser is not connected to internet. But if I look in menu of FF "" about application Firefox"" there is shown that program is searching update and will show me message ""you are using last version"". I tried renew installation, uninstall and reinstall Firefox but without success. Also tried to install older version but without success. All other web browsers installed in PC are working correctly. Can somebody help me solve this problem please? Thank you </p>",desktop;other;,firefox,other,en-US,1461950;1461960;1461961;1461976;1461982;1461983;1461986;1461991;1462035;,separate1
1359040,2021-11-25 00:09:43 -0800,2021-11-25 06:04:45 -0800,every sites takes longer to load,"<p>dear firefox, i am using firefox. but this time, it takes longer to go any sites. i cant to any sites right now. so i recently using microsoft edge to send a question. i have a good internet connection. no matter what sites took me longer. all sites may not work for me. i have reinstalled firefox, and it was just same for me. Can you help me please. i dont want the firewall protection thing. i dont know how to use firewall. </p>",desktop;other;,firefox,other,en-US,1461914;1461933;1461945;1461966;1461969;,zariefzaheer
1359037,2021-11-24 23:13:28 -0800,2021-11-25 11:33:50 -0800,"List of Cookie exceptions keeps getting deleted, despite ""Allow"" for each","<p>The List of Cookie exceptions under Security Setting, the ones I want to retain, keeps getting deleted.  I select ALLOW for each one.  What is causing the list to get deleted? </p>",desktop;privacy-and-security_1;windows-10;firefox-940;,firefox,privacy-and-security,en-US,1461943;1462005;1462047;,kjsles444
1359036,2021-11-24 23:07:20 -0800,2021-11-25 06:03:33 -0800,Lost All Quick Access Bookmarks and later all Bookmarks except 5!!!!,"<p>After creating a new Windows User account and switching back to original account, I lost ALL of my Quick Access Bookmarks! Then I did a Bookmark Restore using the most recent saved Bookmark file and I lost around 64,050 bookmarks!!! Now, the latest saved Bookmark file lists 5 items. This is a ridiculous and a very serious issue!!! </p><p>What is going on? I spend a lot of time getting important Bookmarks for research, and etc. How can I get all of my Bookmarks back? Apparently, I cannot get them all back. See attached file. </p>",desktop;bookmarks;windows-10;firefox-940;firefox-9402;,firefox,bookmarks,en-US,1461968;,WCarp7
1359035,2021-11-24 22:59:31 -0800,2021-11-24 22:59:31 -0800,Firefox 94.02 disconnecting from certain sites,"<p>After the last update of Firefox, 94.02, my browser keeps disconnecting from some sites like gmail, yahoo. Once it disconnects it cannot reconnect back till a hard reset . Sometimes it doesn't respond at all to some sites. Other sites like Facebook have no such issue. I have the same issue on windows 10 and Linux on two separate machines and two different networks. And no , safe mode is no better. Any ideas ? </p>",desktop;websites;,firefox,websites,en-US,"",arv.mehta
1359033,2021-11-24 21:33:59 -0800,2021-11-24 21:33:59 -0800,Not getting live chart data on Binance.us,"<p>I am not getting live site data like I should be getting on Firefox 94.0.2 (64-bit) . I need to refresh the page to get current chart data. It should be updating in real time. I access <a href=""http://binance.us"" rel=""nofollow"">binance.us</a> on Microsoft Edge and it works fine, I get live chart trading data on the <a href=""http://binance.us"" rel=""nofollow"">binance.us</a> site on Edge. How do I fix this? </p><p>I have inspected the page and I keep getting theses error messages. These messages come up in troubleshooting mode as well. </p><p>Referrer Policy: Ignoring the less restricted referrer policy “origin-when-cross-origin” for the cross-site request: https://frontend-m.binance.cloud/monitor/v1/log </p><p>Cross-Origin Request Blocked: The Same Origin Policy disallows reading the remote resource at https://frontend-m.binance.cloud/monitor/v1/log. (Reason: CORS request did not succeed). </p><p>POST <a href=""https://www.binance.us/gateway-api/v1/private/account/kyc-certificate/get-new-kyc-status"" rel=""nofollow"">https://www.binance.us/gateway-api/v1/private/account/kyc-certificate/get-new-kyc-status</a> [HTTP/2 401 Unauthorized 98ms] </p><p>POST <a href=""https://www.binance.us/gateway-api/v1/private/account/user/base-detail"" rel=""nofollow"">https://www.binance.us/gateway-api/v1/private/account/user/base-detail</a> [HTTP/2 401 Unauthorized 177ms] </p>",desktop;websites;windows-10;firefox-940;,firefox,websites,en-US,"",kalebmartens
1359032,2021-11-24 21:03:43 -0800,2021-11-25 04:13:03 -0800,Import Logins & Passwords,"<p>I followed your help line however, on firefox version 94 there is no ""Import from a csv file"" for logins and passwords.  I am migrating from a PC to a new laptop.  I created the csv file from the old PC however, I am unable to import that data onto the new laptop. </p><p>I am running version 94.0.2 64bit Win10.  Can you provide a solution as this is very frustrating. </p><p>Thanks A </p>",desktop;privacy-and-security_1;windows-10;firefox-940;,firefox,privacy-and-security,en-US,1461899;1461900;1461935;,a_j_1995
1359031,2021-11-24 20:28:21 -0800,2021-11-24 20:28:21 -0800,The Easy Adblock extension icon,"<p>The Easy Adblock extension icon doesn't show up anywhere on my toolbar where it used to be or in bookmarks and such. Where is it? Why has it disappeared, even though the extension is on? </p>",desktop;customize;windows-10;firefox-940;firefox-9402;,firefox,customize,en-US,"",airebird
1359030,2021-11-24 20:01:48 -0800,2021-11-24 20:01:48 -0800,FVD speed dial disabled.  Does anyone know how to find where they are stored and recover them?,"<p>I understand this forum is by volunteers, and that Mozilla doesn't care a whit about the hassle they saddled us with.  And that many many people have asked the same question, does anyone know a work around?   </p><p>Does anyone know whether the speed dial information is stored on our computers? </p><p>If it is somewhere on our computers, does anyone know how to somehow copy it in any way?  Like with specific instructions. The answer might be something like, it is in the such and so folder, and you could open it by step #1 , then step 2, then step 3. </p>",mac-os;desktop;other;firefox-940;,firefox,other,en-US,"",lostcoast123@icloud.com
1359029,2021-11-24 19:33:06 -0800,2021-11-24 19:33:06 -0800,Private Network Says Offline and Cannot Turn Back On,"<p>today at about 7pm(central) I was browsing on <a href=""http://autozone.com"" rel=""nofollow"">autozone.com</a> when I got a popup that said my something about my network needed attention. I noticed that my Firefox Private Network was off. I tried to turn it on and it kept going back to OFF. exited Firefox and restarted. problem still there. rebooted computer, started Firefox browser, problem still there. Don’t enable HTTPS-Only Mode selected still have the problem.. </p><p>system info: windows 7 home prem 64 bit Firefox Browser 94.0.2(64-bit) </p>",desktop;privacy-and-security_1;firefox-940;firefox-9402;,firefox,privacy-and-security,en-US,"",uneekii_1
1359027,2021-11-24 17:44:06 -0800,2021-11-25 09:29:10 -0800,Yahoo,<p>I can't access Yahoo in any form all other websites work fine. </p>,windows-7;desktop;fix-problems;firefox-940;,firefox,fix-problems,en-US,1461874;1461877;1461878;1461879;1461882;1462000;1462007;,rutz33
1359023,2021-11-24 16:05:14 -0800,2021-11-24 16:42:19 -0800,Primary Password not accepted after 94.0.2 update,<p>I just updated to 94.0.2 and now it is prompting for my primary password as usual but it is not accepting it.I've entered it hundreds of times and it is definitely the one I always use for this browser. I'm locked out and don't want to have to reset and lose my data. It was working fine before the update. I tried doing a refresh and it didn't change anything. </p><p>Please help </p><p>UPDATE: after about 25 times it stopped asking. No idea why </p>,desktop;privacy-and-security_1;firefox-940;firefox-9402;,firefox,privacy-and-security,en-US,1461850;1461852;,nhutchings1895
