id,created,updated,title,content,tags,product,topic,locale,answers,creator
1352297,2021-09-30 05:32:12 -0700,2021-09-30 05:32:12 -0700,mixed content,"<p>Dobrý den, </p><p>posílám odkaz na chybu, nemohu upravovat sve vlastní stranky, nahravat obrazky atd..  Dříve bez problemu. Když prozkoumám prvek, hodí mi to tuto chybu. Prosím o řešení, děkuji </p><p><br> <a href=""https://developer.mozilla.org/en-US/docs/Web/Security/Mixed_content"" rel=""nofollow"">https://developer.mozilla.org/en-US/docs/Web/Security/Mixed_content</a> </p>",desktop;websites;windows-81;firefox-920;,firefox,websites,cs,"",michdlouhy
1352296,2021-09-30 05:25:27 -0700,2021-09-30 05:25:27 -0700,"I cannot access into Reolink Camera via Firefox ""92.0 (64bit) Ubuntu Canonical -1.0"", because of Adobe Flash Player.","<p>I cannot access into Reolink Camera via Firefox ""92.0 (64bit) Ubuntu Canonical -1.0"", because of Adobe Flash Player. I have ""Ubuntu 20.04.2"". Reolink Camera on Opera Browser is working on Linux Ubuntu. Reolink Camera on Firefox Browser is working on Windows 10. </p>",linux;desktop;fix-problems;firefox-920;,firefox,fix-problems,fi,"",oisne
1352295,2021-09-30 05:21:52 -0700,2021-09-30 05:38:36 -0700,Some video no longer plays,"<p>I resisted upgrading FF because of the UI change but finally allowed FF to update. Now the streaming video of my local collage teams will no longer play. Youtube videos play normally and Facebook videos play normally. My system is Win7 64bit. The site where the videos no long play is: <a href=""https://cowleytigers.com/csn"" rel=""nofollow"">https://cowleytigers.com/csn</a>. If a game isn't currently in progress when you go there click On Demand for past games. All I get is a black screen in the video window. I get the Play screen for a fraction of a second then it goes black. Thanks. </p>",windows-7;desktop;other;firefox-920;,firefox,other,en-US,1447267;,TinyThomas
1352293,2021-09-30 04:48:30 -0700,2021-09-30 04:48:30 -0700,Blocked Content in Firefox,"<p>Once a week, when I try to view my website named <a href=""http://www.jignal.com"" rel=""nofollow"">www.jignal.com</a>, I receive the following error message: Sorry! Private browsing is blocking this content on your computer. This content can only be viewed if you turn off ad-blocking or exit private browsing. There are no ad-blocking plugins installed on my computer and I do not use private browsing. Can you help me with this? Thank you. </p>",desktop;fix-problems;,firefox,fix-problems,en-US,"",leslieburcham2962
1352292,2021-09-30 04:48:18 -0700,2021-09-30 04:48:18 -0700,Sharing,"<p>I'm having a problem selecting articles that I would like to share with personal friends - i.e. grandaughter to their e-mails.  (Not Facebook or Twitter, etc.).  This used to be available but not accessible now.   Some websites have this feature, but others do not.   </p><p>Please advise.  Betty </p>",desktop;other;windows-81;firefox-920;,firefox,other,en-US,"",beejcee
1352291,2021-09-30 04:44:02 -0700,2021-09-30 04:46:12 -0700,"Easyjet site fails to search for flights ""Access Denied""","<p>I can't use the Easyjet site successfully in Firefox </p><p>Here is my error </p><p>Access Denied You don't have permission to access ""<a href=""http://www.easyjet.com/en/buy/flights?"" rel=""nofollow"">http://www.easyjet.com/en/buy/flights?</a>"" on this server. </p><p>Reference #18.9eb0f748.1633001682.54a86dff  </p><p>I have cleared all Easyjet cookies. Same result. </p><p>I have to use another browser. Zero issues in Chrome or Edge....this is a Firefox problem. </p><p>I can use the site up to a point. It allows me to make my selections. The error occurs as soon as I click on ""Show Flights"". </p><p>Any idea what's causing it? </p><p>thanks. </p>",desktop;fix-problems;windows-10;firefox-920;firefox-9201;,firefox,fix-problems,en-US,"",richardrea36
1352290,2021-09-30 04:41:48 -0700,2021-09-30 04:41:48 -0700,EMAIL E PDF,"<p>Prezados senhores, bom dia! </p><p>Não estou conseguindo visualizando os arquivos em PDF quando os envio nos emails para clientes. Isso começou esta semana. </p><p>Cordialmente, Rosana Gonçalves, Auxiliar Administrativo. </p>",desktop;other;windows-10;firefox-920;,firefox,other,pt-BR,"",vipimobiliaria.financeiro
1352289,2021-09-30 04:40:34 -0700,2021-09-30 04:40:34 -0700,Passwords,<p>How do I find my saved passwords after reinstalling windows </p>,ios;firefox-370;install-and-update-firefox-ios;,firefox,passwords-forms-search-and-history,en-US,"",neal.pickering1
1352288,2021-09-30 04:40:00 -0700,2021-09-30 04:40:00 -0700,error after new firefox update,"<p>after new firefox update, while any video is start to playing(in this site) , this error is shown. </p><pre>please help me </pre>",desktop;fix-problems;windows-10;firefox-920;,firefox,fix-problems,en-US,"",hamidtajik
1352286,2021-09-30 03:30:23 -0700,2021-09-30 03:30:23 -0700,Can't sign into account due to 2FA and verification codes not sent.,"<p>So back in May 2FA was automatically set up for those of us who wanted to update our Mozilla Add-ons. I can see in my email account that I was informed of that and I must have logged in since I also have an email with a verification code from Firefox sent from accounts@firefox.com . </p><p>Fast forward to today, I try to log in and I'm asked a verification code. After reading all the docs I understand that I should have received another such email with a 6 digit verification code. I haven't. I tried to have it resent. It didn't. I waited. I have added accounts@firefox.com to my contacts, no luck. I can see from the email where 2FA was activated that I am on the same device I used back then. Since it is a Mac I'm not sure how to verify it since all verification is via email and I'm not receiving any emails. (even though, again, I had no issues to receive emails when the 2FA was set up) </p><p>I don't have the recovery codes (I'm not sure if I may have received them via email too?) and I am not logged into my Firefox account in any devices. </p><p>How should I proceed? This is very frustrating. </p><p>I can show proof of same device/email access etc if needed. </p><p>PS: I had to create this new account just to post a question. </p>",mac-os;desktop;privacy-and-security_1;firefox-920;,firefox,privacy-and-security,en-US,"",boixadosj
1352280,2021-09-30 01:50:23 -0700,2021-09-30 03:21:48 -0700,Logging out doesn't delete Homepage and New Tab data,"<p>Hi! </p><p><br> I weekly use Firefox on a shared computer and would like to have it delete Homepage and New Tab data automatically when I log out. How do I do this? </p><p>If you need more info please feel free to ask! </p><p><br> Kind regards, Rota </p>",mac-os;desktop;privacy-and-security_1;firefox-920;,firefox,privacy-and-security,en-US,1447233;,Rota
1352279,2021-09-30 01:29:12 -0700,2021-09-30 03:22:40 -0700,Firefox crashes when loading Google Meet call.,"<p>Hi Firefox team, </p><p>I am having issues after updating to the latest version of Firefox. When opening a Google Meet meeting, my Firefox browser crashes and it keeps doing again and again. Otherwise, the browser works just fine. </p><p>The following is from the abouts:crashes webpage:  ID: fcf6a6af-3c59-4e02-9d1b-3b2cf0210927 Signature: VTPixelTransferSessionCanUseMetalInTheBackground </p><p>Thank you, Yerkebulan </p>",mac-os;desktop;websites;googlemeet;firefox-920;,firefox,websites,en-US,1447234;,yr5589
1352276,2021-09-30 00:55:41 -0700,2021-09-30 00:55:41 -0700,js Print,"<p>Hello. I'm about an add-on in your browser. We are working with your browser and we are satisfied with the quality, but recently you have removed those add-ons that we need, namely Js Print and universal Print in the browser settings, there is send to print without a diological window, but which is not brings up this diologue window. You can help me configure the browser so that our receipts are printed automatically without CTRL + P, or tell me the add-on so that I can use it. Thank you so much. </p>",desktop;customize;,firefox,customize,en-US,"",khusrav7789
1352275,2021-09-30 00:43:11 -0700,2021-09-30 03:27:58 -0700,Connection freeze on one website,"<p>Hello  Can you check why Firefox 92.01 (64bit) running under <strong>macO</strong>S Big Sur 11.6 is unable to make me watch online movies/series on </p><pre><a href=""https://www.tv5mondeplus.com/"" rel=""nofollow"">https://www.tv5mondeplus.com/</a> </pre> <p>Olders versions was  not able to work properly either on this website. Firefox open it and let me visit the site  normally  but as soon as I click on a program to look at, looks like the screen and connection freeze... Little Snitch <em>Traffic monitor</em> indicates that there is no more data exchange but connection still active. </p>",mac-os;desktop;other;mac-os-x-10116;firefox-920;firefox-9201;,firefox,other,en-US,1447236;,cldjr1
1352274,2021-09-30 00:35:33 -0700,2021-09-30 04:01:39 -0700,Issue in Firefox on punchout inbound. User is not redirected to shopping cart.,"<p>Hi everyone, Users log in to our shop system from SAP via OCI. Our page is called from SAP in a frame. Then they connect again via OCI to an external Punchout shop. They add some products to the cart and the cart from the external shop is transferred back to our shop system via OCI.  In Chrome, IE, Edge the user is then correctly redirected to our shopping cart page. But in Firefox, the redirection to the cart is not done and the users still see the Punchout inbound page which is empty.  We already tried to switch off the Enhanced Tracking Protection for our site and the punchout site. But that didn't help. Have anyone has an idea what could fix the problem? </p><p>Any help will be much appreciated. </p><p>Thank you in advance. </p><p>Regards </p>",desktop;privacy-and-security_1;windows-10;firefox-920;,firefox,privacy-and-security,en-US,1447237;1447249;,marek.paw
1352273,2021-09-30 00:35:31 -0700,2021-09-30 03:32:16 -0700,Blocked addons list?,"<p>How does one find out if one of their addons has been removed from AMO?  <a href=""https://blocked.cdn.mozilla.net"" rel=""nofollow"">https://blocked.cdn.mozilla.net</a> is no longer updated - not that it was any big help anyway... </p>",windows-7;desktop;other;firefox-920;,firefox,other,en-US,1447238;,siffemoz
1352271,2021-09-29 23:43:01 -0700,2021-09-30 03:34:26 -0700,not able to retrieve any data after a reset,"<p>not able to retrieve any data after a OS reset, already tried syncing. I have lost all the bookmarks of over 10 years and saved passwords. Please help. </p>",desktop;sync;windows-10;dataloss;firefox-920;,firefox,sync,en-US,1447239;,1993prince2008
1352270,2021-09-29 23:41:46 -0700,2021-09-30 00:15:08 -0700,Fatturazione,<p>non riesco accedere al programma. </p>,desktop;privacy-and-security_1;windows-10;firefox-920;,firefox,privacy-and-security,it,1447221;,commerciale18
1352269,2021-09-29 23:08:53 -0700,2021-09-30 03:36:36 -0700,I can't seem to delete a specific website from the address bar no matter what I try,"<p>As the title says every time I go to type in ""Google"" it recommends ""Gmbinder"" and so far all the support article things say the same thing, for me to delete the history or hover over it and press Delete and every time I do it's still there. </p>",desktop;websites;windows-10;firefox-920;,firefox,websites,en-US,1447240;,joshuaeckman518
1352268,2021-09-29 22:45:03 -0700,2021-09-29 23:05:39 -0700,FireFox using more memory (ram) then usual,<p>Firefox suddenly started using more memory overtime like than i doubled check both in chrome and firefox like in chrome it is staying at a certain amount of memory for whole day and in fire fox it just starting to use more memory like i started using firefox because chrome is using high memory and now firefox suddenly started and it is not even staying at a certain amount of memeroy in ram so yeah i think its a glicth in new firefox update and if u fixed that than i can come on firefox again but now i am using chrome. </p>,desktop;other;windows-10;firefox-920;,firefox,other,en-US,1447213;,jutfrfunfun
1352266,2021-09-29 22:38:49 -0700,2021-09-29 22:38:49 -0700,Cannot view source code of http websites,"<p>When I press CTRL + U on a http website to view the source code, it comes up with an error message saying that there is a potential security risk ahead. Even if I try to change the https that Firefox has recently started to insert in view-source URLs, it still doesn't allow me to view the source code of the website. </p><p>Firefox is the only browser that I know of that does this. Google Chrome allows you to view the website's source code, even if the website's URL begins with http. This hasn't always been the case, but it has been the case since I last updated Firefox. </p>",desktop;websites;windows-10;firefox-920;,firefox,websites,en-US,"",calumchilds
1352265,2021-09-29 22:12:06 -0700,2021-09-29 23:07:00 -0700,Automate tasks,"<p>Hello FF </p><p>I'm looking to automate tasks while I fire up the browser, usually my morning routine logging on certain websites and running the processes </p><p><br> it would help if the browser can automate these tasks, </p><p>How can it be set up ? </p><p>Thanks Support </p><p>Regards, </p><p>Mathew </p>",desktop;customize;windows-10;firefox-920;,firefox,customize,en-US,1447214;,matmodeyil
1352263,2021-09-29 21:58:26 -0700,2021-09-30 04:38:40 -0700,allowed cemera on http://abmgrsbyapp.health.rajasthan.gov.in,<p>i try but not add  website not search  </p><pre>                               please quit this problam </pre>,desktop;privacy-and-security_1;windows-10;firefox-920;,firefox,privacy-and-security,en-US,1447252;,gdhakar123
1352262,2021-09-29 21:56:00 -0700,2021-09-29 21:56:00 -0700,"How to remove ""Alternative Language""","<p>I want to remove Korean from my ""Set Alternative Languages"" setting in Firefox but I can't because the ""remove"" button is greyed out. It's annoying because when I want to do things like close all tabs, or split my screen, or when I access Finder from Firefox, the words are in Korean and I want to remove it. How do I do this? </p>",mac-os;desktop;customize;firefox-920;,firefox,customize,en-US,"",jjkim217
1352261,2021-09-29 21:07:20 -0700,2021-09-29 23:08:16 -0700,abdurrahim04777@gmail.com,"<p><a class=""new"" href=""/en-US/kb/new?title=Knowledge+Base+Article"" rel=""nofollow"" title=""Page does not exist."">Knowledge Base Article</a> </p>",windows-7;desktop;other;firefox-920;,firefox,other,en-US,1447215;,pancardgp77
1352260,2021-09-29 20:37:51 -0700,2021-09-29 21:19:28 -0700,Firefox Account Login Problems,"<p>I recently got a new computer and downloaded Firefox to it and proceeded to sign in to Firefox sync. A few months ago I changed my email (which I will refer to as email 1) to a new email (email 2). </p><p>When I try to sign in using email 2, I enter the password and it asks me to check my email for a code. I enter the code in and suddenly I'm back to the password screen, only this time it says ""incorrect password"" and shows email 1. No password I have in my books seems to work on either email 1 or email 2. </p><p>I don't want to lose my data, so I would rather not reset my password... </p>",desktop;sync;,firefox,sync,en-US,1447203;1447205;,supernova17
1352259,2021-09-29 20:35:49 -0700,2021-09-29 21:32:33 -0700,"Audio doesnt work, but video does","<p>Whenever I try to play a video, the video plays perfectly but there isnt any audio. It took me a while to recognize this problem because the audio works perfectly in youtube  </p><pre>I have already cleared the cookies and the cache, I have made sure to allow DRM protected videos, I have made sure to allow autoplay of media with sound in all websites, but nothing has fixed it yet </pre>",desktop;websites;windows-10;firefox-920;firefox-9201;,firefox,websites,en-US,1447201;1447206;1447207;,sv.y4zmin
1352257,2021-09-29 17:05:40 -0700,2021-09-29 21:05:08 -0700,Browser error keeps occuring on GoToTraining platform.,"<p>This is the error message I keep getting every time the page tries to refresh or change screens.  I don't know how to correct it.  Please help!  </p><p>""The page isn’t redirecting properly. </p><p>Firefox has detected that the server is redirecting the request for this address in a way that will never complete. </p><pre>   This problem can sometimes be caused by disabling or refusing to accept cookies."" </pre> <p>This just started about 2 weeks ago. Thank you! </p>",desktop;fix-problems;windows-10;firefox-920;,firefox,fix-problems,en-US,1447204;,Laurajones
