id,created,updated,title,content,tags,product,topic,locale,answers,creator
1333811,2021-04-23 13:28:15 -0700,2021-04-23 13:28:15 -0700,Staying logged on to websites,"<p>Usually, when I log on to a site it keeps me signed in for a long while before I have to log in again, but now I have to log in again every time I re-open the browser.  </p><p>The sites I used are: my Google accounts, Netflix, Amazon Prime, Disney+ and Facebook. </p>",windows-7;desktop;websites;firefox-880;,firefox,websites,en-US,"",star_queen108
1333810,2021-04-23 13:25:35 -0700,2021-04-23 13:26:25 -0700,Where is the tool?,"<p>Their use to have a tool that allowed us to cut and copy a certain image where the 3 dots are in the browser bar. Where the https is, but on the right site of it. It is now gone... I was using firefox mainly for that. Why is it gone? </p>",desktop;customize;windows-10;firefox-880;,firefox,customize,en-US,1408100;,crushit27
1333807,2021-04-23 12:54:04 -0700,2021-04-23 12:54:04 -0700,"How to restore the shortcut for ""Copy link"" back to A?","<p>So after 13 years, Mozilla has changed the shortcut for ""Copy link"" from A to L. </p><p>This is an INSANE move! Copying links isn't some obscure power command, it's a basic, everyday function that everyone needs to use. Who doesn't have to copy URL links from time to time? </p><p>Moving the key to L makes the shortcut so much more difficult to use now. You're required to move your left hand a long way, and look down at the keys. It takes forever and interrupts the flow of browsing the web. It's stupid. Why not change the key to C? Isn't that logical? </p><p>I wish I could give Mozilla feedback about this, but sadly I can't. </p><p>Can someone please tell me how to change this back WITHOUT installing an extension. If Mozilla have just suddenly changed this key without even giving users an option to change it back, that is terrible. </p>",windows-7;desktop;customize;firefox-880;,firefox,customize,en-US,"",MartyJames
1333806,2021-04-23 12:36:22 -0700,2021-04-23 12:36:22 -0700,Loss of Zoom meeting functionality - Zoom say it is a Plug-In problem with Mozilla,<p>All of a sudden I can no longer access Zoom meetings. The video wont work and then the program goes into 'not responding' Zoom say it is a Firefox plug in problem. Help! I've missed 2 meetings now! </p>,desktop;other;windows-10;firefox-880;,firefox,other,en-US,"",carol6
1333805,2021-04-23 12:34:21 -0700,2021-04-23 12:59:02 -0700,Sign in to AMO (Add-ons Mozilla Organization) where? How?,"<p>Many people who answer questions in Mozilla support at least give the appearance of having forgotten that most people with questions are probably those who need the a-b-c's of the answer s-p-e-l-l-e-d--o-u-t for them, including myself. I found the archived answer to my basic question but couldn't use it because it didn't go back to the very beginning and explicitly give every step of how to do whatever it was that was asked for.  </p><p>I know I have to sign in to AMO. I just don't know how. </p><p>So HOW? </p>",desktop;other;windows-10;firefox-880;,firefox,other,en-US,1408092;1408093;1408096;,GutoBebb
1333799,2021-04-23 11:53:28 -0700,2021-04-23 11:53:28 -0700,How to make keyboard shortcuts for addons global for Windows?,"<p>I have an addon for listening to music and it has hotkeys. I need these hotkeys to become global and you can control them from Windows. <a href=""https://addons.mozilla.org/ru/firefox/addon/yandex-music-controls/?utm_source=addons.mozilla.org&amp;utm_medium=referral&amp;utm_content=search"" rel=""nofollow"">https://addons.mozilla.org/ru/firefox/addon/yandex-music-controls/?utm_source=addons.mozilla.org&amp;utm_medium=referral&amp;utm_content=search</a> </p>",desktop;customize;windows-10;,firefox,customize,en-US,"",mcantoharip
1333797,2021-04-23 11:38:05 -0700,2021-04-23 11:38:05 -0700,Silent Printing,"<p>In previous Versions of Firefox 85.0b9 and below enabling Silent Printing would open a second tab, print from that tab then,  leaving that tab open return to the first tab so I could continue on scanning more items.  86.0 and above it remains on the new print tab and I have to manually switch back to the first tab.  Is there anyway to correct this? </p><p>Also rolling back to 85.0b9 does not work as even if you disable auto updates it updates anyway. </p><p><br> Please please somebody help me. </p>",desktop;other;windows-10;firefox-870;,firefox,other,en-US,"",ccifsm
1333795,2021-04-23 11:33:25 -0700,2021-04-23 11:33:25 -0700,"""Simplify page"" function - go back to the previous version of Firefox","<p>The ""Simplify page"" function of the new Firefox version has zero rendering : letters too large, no text centering, no possibility to delete images, etc. So I would like to go back to the previous version of Firefox. Thank you for explaining to me precisely and step by step, as to a particularly bad person who does not understand anything at all.  Why, when things are going well, does it take someone to change them, especially without asking users !!! </p>",desktop;download-and-install_1;windows-10;firefox-880;,firefox,download-and-install,en-US,"",mf-herbin
1333788,2021-04-23 11:06:15 -0700,2021-04-23 11:18:35 -0700,VPN-Does your VPN work on Windows 7,<p>Does your VPN work on Windows 7 ? </p>,windows-7;desktop;other;firefox-880;,firefox,other,en-US,1408069;,cherbocairns
1333787,2021-04-23 10:51:28 -0700,2021-04-23 11:31:04 -0700,Firefox Version 88 For Windows 10,"<p>Please, could someone tell me how to get rid of all of those annoying Quick Links that appear on the opening page of my Firefox browser Version 88 for Windows 10 - or at least delete the ones I've never visited.  Thanks. </p>",desktop;customize;windows-10;firefox-880;,firefox,customize,en-US,1408073;,mdb436
1333785,2021-04-23 10:36:42 -0700,2021-04-23 10:53:46 -0700,Uninstall all versions other than Preferred/Latest Version,"<p>I'd like to know how could we uninstall all versions older than latest or upgrade them to latest version. And I have seen many Pc's with more than one or 2 version of firefox installed, I don't know why? </p>",desktop;download-and-install_1;,firefox,download-and-install,en-US,1408061;,ranjithckm7
1333783,2021-04-23 10:10:35 -0700,2021-04-23 10:55:57 -0700,Keyboard stops responding,"<p>My keyboard quits responding in Firefox. Only Firefox is affected. I can hit ""Win+R"" then run notepad from the run dialog box as soon as it occurs. </p><p>I recently reinstalled Windows from scratch on this computer. About a day or two later, I set up accessibility settings that I hadn't used before. Here are the specific settings that I'm aware of having changed: </p><p>- Set high-contrast mode - Turned on the purple arrows that appear above and below the text cursor - Enlarged the mouse and set it to use inverted colors - Installed Chinese Simplified and Traditional IME's (specifically, pinyin and zhuyin). (Switching the keyboard to English has no effect when the problem is occurring.) </p><p>I just uninstalled and reinstalled Firefox and the problem recurred almost immediately. </p><p>Any ideas? </p>",desktop;fix-problems;,firefox,fix-problems,en-US,1408062;,bigdave45678
1333782,2021-04-23 10:06:11 -0700,2021-04-23 11:54:34 -0700,Screenshot,<p>Since the last update on 4/15 my screenshot isn't working properly. Instead of taking a screenshot of the selected image it screenshots the background images. </p>,desktop;other;,firefox,other,en-US,1408049;1408063;1408077;,brianheckert
1333781,2021-04-23 10:00:58 -0700,2021-04-23 11:11:25 -0700,Firefox launching problems,"<p>Some time ago, firefox stopped launching. I tried everything. I refreshed, reinstalled, clean reinstalled, reset windows, deleted possibly interfering programs, and clean reinstalled windows (that was for other problems). I am running windows 10 home build 10.0.19042 (currently the latest) on a omen HP laptop 15-dc0xxx. It is x64 bit device with a intel core i7 8 gen cpu and a nvidia 1050 ti mobile. It does not seem to be a hardware issue as a linux kernel that I have dual booting with windows 10 runs it like a champ. </p><pre>    When launched the application load for a period of ~7 seconds and for a frame or two there is a small window with either nothing on it or a safe mode window that goes away after a frame. When the problems started I closed firefox and reopened it a small bit later and the problems above happened. Windows safe mode will run firefox. Opera has very similar problems if that helps any. Google chrome, microsoft edge, microsoft internet explorer are all unaffected. </pre>",desktop;fix-problems;,firefox,fix-problems,en-US,1408064;1408067;,seth.grissman
1333780,2021-04-23 09:59:48 -0700,2021-04-23 13:45:44 -0700,Firefox not rendering Draftkings Lineups page correctly...,"<p>Please go to <a href=""https://au.draftkings.com/lineup"" rel=""nofollow"">https://au.draftkings.com/lineup</a> </p><p>You can see that Google Chrome v90.0.4430.85 (64-bit) loads it correctly. </p><p>Firefox v88 (64-bit) does NOT load the page correctly. </p><p>Please refer to attached images for more information. </p><p>Could others please comment if they get the same issue or not? </p><p>How can I solve the issue? </p><p>Thanks all.... </p>",desktop;websites;,firefox,websites,en-US,1408065;1408107;,da4ig
1333777,2021-04-23 09:23:54 -0700,2021-04-23 13:45:07 -0700,replace the crappy linux home page (using Mint 20.0) and replace it with the traditional firefox homepage,"<p>How can I replace the crappy Linux home page (using Mint 20.0) and replace it with the traditional Firefox homepage? Firefox and Mozilla have been no help at all, which I feel is pretty sorry support for their users. They know exactly what the problem is and why it exist.  </p><p>services.sync.prefs.sync.browser.startup.homepage = true already  </p><p>Please contact me at jlannex@gmail.com if you have a solution. </p>",linux;desktop;other;firefox-860;,firefox,other,en-US,1408046;1408106;,lannex
1333774,2021-04-23 08:36:46 -0700,2021-04-23 13:41:11 -0700,"Allowed ""Refresh"" upon installing new browser update and can't get back bookmarks and other data","<p>I recently installed the Firefox 88 browser update to fix the problem that Windows would not recognize my Firefox browser in order to make it my default. Upon researching the issue, it stated that I needed to uninstall my old version of Firefox and reinstall the latest version. At the end of the installation before it completed the installation, it asked if I wanted to ""Refresh"" my browser. I read how it would streamline and speed up my browsing experience and it seemed like a ""good"" idea. I agreed to the ""Refresh"" and the browser finished its installation. I checked into setting Firefox as my default browser and Windows recognized it. Great, the re-installation worked. </p><p>I then proceeded to open Firefox only to realize that any custom setting, including my 15+ years of bookmarks were gone. I began to panic! I noticed that there was an ""Old Firefox Data"" file now on my desktop. I looked inside and realized that it contained my old data, including bookmarks, etc. I began searching online for how to get it back into my browser. I have read 7-8 tutorials and 3-4 Youtubes that supposedly fix the problem, but to no avail. Please help as I do not want to lose all my bookmarks and while not computer illiterate, cannot seem to figure out how to get them to reinstall into the new Firefox browser update. </p><p>Thank you for your help! </p>",desktop;bookmarks;windows-10;firefox-880;,firefox,bookmarks,en-US,1408036;1408104;,elliott.kraig
1333773,2021-04-23 08:33:40 -0700,2021-04-23 09:05:13 -0700,FF Beta 89.0b3 reverts to .0b2,"<p>Since the release of Beta version 89.0b3, Firefox Beta on Win 10 keeps reverting back to .0b2. I cannot pinpoint exactly when it happens; sometimes after 'hibernation'; sometimes after 'sleep'. Getting damn frustrating, and I'm not nearly ready to move up from Windows. </p><p>How the heck do I track what's going on? All advice gratefully accepted! </p>",desktop;beta;download-and-install_1;windows-10;firefox-890;,firefox,download-and-install,en-US,1408039;,irish.mister
1333770,2021-04-23 07:57:52 -0700,2021-04-23 10:16:41 -0700,log ins,"<p>just reset computer lost all the log ins stored in the old set up,  how do I get them onto the reset computer? </p>",desktop;download-and-install_1;windows-10;firefox-880;,firefox,download-and-install,en-US,1408048;1408052;,aasiddall1
1333767,2021-04-23 07:30:13 -0700,2021-04-23 07:30:13 -0700,MSI File for FireFox using Azure Intune does not auto update,"<p>Hello, </p><p>We use FireFox MSI file to push out to all my users that I have on my Azure Domain. But constantly I find myself having to download new MSI packages monthly in order for our users to keep there profile intact and to update there Firefox. If I do not do this, users profiles they have on their PC will be wiped cleaned and they will have to start over new and then manually update FireFox. Only to have there dreams crushed when Azure pushes out the older version of FireFox the next day when they attempt to sign-in and sync with the domain. </p><p>Is there a way to prevent this manual process from me of uploading new MSI files monthly in order for our users to use FireFox with no issue? Strong pain point for any of my users that prefer to use FireFox, but Google Chrome and Edge does not have this issue. </p>",download-and-install_1;desktop;,firefox,download-and-install,en-US,"",dbernier
1333766,2021-04-23 07:29:20 -0700,2021-04-23 07:29:20 -0700,"CentOS Stream and RHEL Flatpak Firefox 88: Facebook videos play at more or less 15fps, but audio is fine","<p>While youtube videos is flawless, facebook videos seem to play at 15fps. Audio plays flawlessly though.. It happens with both CentOS and RHEL. I'm using the flatpak version of firefox 88. Tried with safe mode, same issue. Tried with disabled hardware acceleration, same issue. Tried with both HWA disabled and Safe mode, same issue. It's a little weird that videos are flawless in brave browser..  </p><p>Is there some obscure setting in about:config that I can fiddle with? </p>",linux;desktop;fix-problems;firefox-880;,firefox,fix-problems,en-US,"",XxTriviumxX
1333763,2021-04-23 06:46:50 -0700,2021-04-23 06:46:50 -0700,Screenshot Bug,<p>1.Auto capture DOM node screenshot 2.There is a 1 pixel white edge on the left side of the picture </p>,desktop;websites;beta;windows-10;firefox-890;,firefox,websites,en-US,"",songkaik
1333759,2021-04-23 06:07:07 -0700,2021-04-23 06:07:07 -0700,"Right Click [W} Open Link New Window, changed to [D].","<p>From the very start, for the last 25+ years, Right Click a link, and hit the letter W to open the link in a new window...  Suddenly, with 88 Update, it is now the letter D.  (while everything else in Windows is still W) </p><p>How do I get it back to [W]  (Industry Standard is W) </p><p>Why did Mozilla change the letter to D? </p><p>I don't mind having to train myself to use D instead of W... I do mind that everything else still uses W, so I have to train myself to only use D in Firefox. </p>",desktop;customize;windows-10;firefox-880;,firefox,customize,en-US,"",wizflip
1333755,2021-04-23 05:50:07 -0700,2021-04-23 13:02:53 -0700,firefox crash when trying to upload image with 32bit floating point in discord,<p>firefox crash when trying to upload image with 32bit floating point in discord </p>,linux;desktop;beta;fix-problems;firefox-890;,firefox,fix-problems,en-US,1408066;1408098;,bokunocode
1333754,2021-04-23 05:22:51 -0700,2021-04-23 05:22:51 -0700,Работоспособность и быстродействие,"<p>После последнего обновления многие сайты грузятся или крайне долго, или не грузятся вообще. Особенно это касается банковских и бизнес-сервисов: <a href=""https://www.rbo.raiffeisen.ru"" rel=""nofollow"">https://www.rbo.raiffeisen.ru</a> <a href=""https://online.moysklad.ru"" rel=""nofollow"">https://online.moysklad.ru</a> и другие. Чистил кэш, перезагружал - бесполезно. При этом Опера и Вивальди летают на этих сайтах. Хром не пробовал ибо не хочу. </p>",desktop;websites;windows-10;firefox-880;,firefox,websites,en-US,"",9619040
1333750,2021-04-23 04:41:17 -0700,2021-04-23 04:41:17 -0700,Firefox narrator not shown for traditional Chinese,"<p>I am using Firefox on MacOS. When I use reader mode, narrator icon is not shown for traditional Chinese pages.  </p><p>For example, following are the same wikipedia topic in different languages: </p> <ol><li> English: <a href=""https://en.wikipedia.org/wiki/Shi_Xie"" rel=""nofollow"">https://en.wikipedia.org/wiki/Shi_Xie</a> </li><li> Japanese: <a href=""https://ja.wikipedia.org/wiki/%E5%A3%AB%E7%87%AE_(%E4%BA%A4%E9%98%AF%E5%A4%AA%E5%AE%88)"" rel=""nofollow"">https://ja.wikipedia.org/wiki/%E5%A3%AB%E7%87%AE_(%E4%BA%A4%E9%98%AF%E5%A4%AA%E5%AE%88)</a> </li><li> Chinese(simplify): <a href=""https://zh.wikipedia.org/wiki/%E5%A3%AB%E7%87%AE_(%E4%B8%89%E5%9B%BD)"" rel=""nofollow"">https://zh.wikipedia.org/wiki/%E5%A3%AB%E7%87%AE_(%E4%B8%89%E5%9B%BD)</a> </li><li> Chinese(traditional): <a href=""https://zh.wikipedia.org/zh-hk/%E5%A3%AB%E7%87%AE_(%E4%B8%89%E5%9B%BD)"" rel=""nofollow"">https://zh.wikipedia.org/zh-hk/%E5%A3%AB%E7%87%AE_(%E4%B8%89%E5%9B%BD)</a> </li><li> Chinese(traditional): <a href=""https://zh.wikipedia.org/zh-tw/%E5%A3%AB%E7%87%AE_(%E4%B8%89%E5%9B%BD)"" rel=""nofollow"">https://zh.wikipedia.org/zh-tw/%E5%A3%AB%E7%87%AE_(%E4%B8%89%E5%9B%BD)</a> </li></ol> <p>Narrator work for 1 to 3, but not 4 and 5. The narrator icon do not show in reader view. Anyway to fix it? </p>",mac-os;desktop;tips;,firefox,tips,en-US,"",john.sd.siu
1333749,2021-04-23 04:28:45 -0700,2021-04-23 04:28:45 -0700,Firefox Dev to Firefox release migration,"<p>I have working ""firefox developer"" with ""firefox-dev"" profile. I want to migrate to stable ""firefox"", but release firefox show message </p><p><em>You've launched an older version of Firefox </em> </p><p>Using an older version of Firefox can corrupt bookmarks and browsing history already saved to an existing Firefox profile. To protect your information, create a new profile for this installation of Firefox.<em> </em> </p><p>so what can i do to migrate? is it possible to migrate to profile with lower firefox version? </p>",desktop;beta;download-and-install_1;windows-10;firefox-890;,firefox,download-and-install,en-US,"",konstantin_k
1333748,2021-04-23 04:24:42 -0700,2021-04-23 07:13:18 -0700,Change Firefox upload folder,"<p>hello together, when I want to upload a file it always opens the Desktop folder. Is it possible to preset another folder? Many greetings </p><pre>hessline </pre>",desktop;tips;windows-10;firefox-870;,firefox,tips,en-US,1407998;1408011;,hessline
1333747,2021-04-23 04:20:44 -0700,2021-04-23 08:01:17 -0700,"Update on/about 21 April 2021 broke WidevineCDM for many users, breaking Netflix/Spotify/etc. (thread of threads)","<p>Each of the threads below is someone reporting the same problem (which I also have), with the same timing. Suddenly on 21 April 2021 all (?) major streaming sites started to give ""The WidevineCDM plugin has crashed"" message and ceased to work .  </p><p><a href=""https://support.mozilla.org/en-US/questions/1333289"" rel=""nofollow"">https://support.mozilla.org/en-US/questions/1333289</a> <a href=""https://support.mozilla.org/en-US/questions/1333332"" rel=""nofollow"">https://support.mozilla.org/en-US/questions/1333332</a> <a href=""https://support.mozilla.org/en-US/questions/1333503"" rel=""nofollow"">https://support.mozilla.org/en-US/questions/1333503</a> <a href=""https://support.mozilla.org/en-US/questions/1333613"" rel=""nofollow"">https://support.mozilla.org/en-US/questions/1333613</a> <a href=""https://support.mozilla.org/en-US/questions/1333506"" rel=""nofollow"">https://support.mozilla.org/en-US/questions/1333506</a> <a href=""https://support.mozilla.org/en-US/questions/1333571"" rel=""nofollow"">https://support.mozilla.org/en-US/questions/1333571</a> </p><p>No suggested fix works. Reinstalling does not help, toggling DRM application does not help. It was obviously the update (at least for users on 78.10.0esr with OS X 10.9.5) that did it. Is there some way to get this registered as a bug? </p>",desktop;fix-problems;mac-os-x-1095;,firefox,fix-problems,en-US,1408022;1408024;,pauls.filter
1333744,2021-04-23 03:57:27 -0700,2021-04-23 04:08:13 -0700,Preventing update,"<p>Hi, </p><p>I have created a policies.json file with ""AppAutoUpdate"": false and  ""DisableAppUpdate"":true, but my firefox is still automatically updating. Please do not tell me there are security issues with remaining on an older version, I am aware of that. </p>",desktop;download-and-install_1;windows-10;firefox-880;,firefox,download-and-install,en-US,"",revil0
1333743,2021-04-23 03:34:14 -0700,2021-04-23 03:36:43 -0700,Data Not Saved?,"<p>Hi, I am facing a problem while browsing a website (<a href=""https://quickstuffs.com/"" rel=""nofollow"">https://quickstuffs.com/</a> <a href=""https://quickstuffs.com/"" rel=""nofollow"">https://quickstuffs.com/</a>). I saved login data and filter settings multiple time but browser rest it. Is there any feature I am using wrong. </p>",desktop;cookies;,firefox,cookies,en-US,1407969;1407970;,quickstuffsofficial
1333742,2021-04-23 03:23:41 -0700,2021-04-23 03:23:41 -0700,"Use ""open image in new tab"" but staying on the current tab","<p>Hi,  </p><p>The right-click context menu has a ""open image in new tab"" option with a handy keyboard shortcut, however using it one goes in to the new tab with the opened image. Is there any way to use the ""open image in new tab"" but staying in the current tab? </p><p>Thanks. </p>",desktop;customize;windows-10;firefox-880;,firefox,customize,en-US,"",impar
1333740,2021-04-23 02:28:52 -0700,2021-04-23 03:47:50 -0700,Firefox no longer remembers history,<p>Since I started using Firefox many years ago I have allowed it to remember history and every couple of weeks have delated the oldest history pages. Recently Firefox history covers only today and this page disappears when I close Firefox.  Firefox is set to remember history but the function seems to have gone. How can I resurrect it? </p>,desktop;privacy-and-security_1;windows-10;firefox-880;,firefox,privacy-and-security,en-US,1407972;,smcc
1333737,2021-04-23 02:14:32 -0700,2021-04-23 02:14:32 -0700,Am I the only one?,"<p>Hi, - Youtube doesn't play anymore on pages unless going to Youtube - Open link in other tab works sometime... Have to right click, copy link then new tab to open. - Above when FF allow me to click on links - Websites come without images </p><p>Is that me or FF all security shit, makes browsing like hell at the point after more than 15 years want to go and see elsewhere. BTW...Same shit on windows, android and linux </p>",desktop;other;windows-10;firefox-880;,firefox,other,en-US,"",xcsensei
1333732,2021-04-23 01:33:22 -0700,2021-04-23 01:33:22 -0700,saving user name and password,<p>I cant save my user name and password </p>,desktop;other;windows-10;firefox-880;,firefox,other,en-US,"",pooyapormarefat
1333731,2021-04-23 01:29:32 -0700,2021-04-23 01:29:32 -0700,connect another device,"<p>hi, when i want to connect another device that dont show code </p>",desktop;sync;windows-10;firefox-880;,firefox,sync,en-US,"",pooyapormarefat
1333730,2021-04-23 01:27:34 -0700,2021-04-23 01:27:34 -0700,Disable cache for specific websites,"<p>There's a website I visit that firefox caches for some reason in such a way that it can't be updated anymore when the page changes. I know that the developers of the site won't fix it, so I need a way to fix it on my end. I have to Ctrl F5 to refresh the page otherwise it will say ""Posted 1 second ago"" permanently and never show any comments or upvotes or anything. </p><p>I was hoping there was a way to disable the cache for a specific website only. There is a way in Chrome, but I don't want Chrome. </p>",desktop;websites;windows-10;firefox-880;,firefox,websites,en-US,"",VasVadum
1333729,2021-04-23 01:12:23 -0700,2021-04-23 01:12:23 -0700,attachment fails,"<p>today i tried to attach a file on <a href=""http://dnb.no"" rel=""nofollow"">dnb.no</a> it is a banking in Norway, the  pop up for the attachment progress  would start but the file never gets uploaded. i contacted the dnb customer service, they told me to use another bowers, i used then Microsoft Edge, it worked. why this happens to Firefox, why it didn't work with my Firefox browser? this is the browser i am using since 15 years and never had this problem with it since then. </p>",desktop;websites;windows-10;firefox-880;,firefox,websites,en-US,"",samimys
