id,created,updated,title,content,tags,product,topic,locale,answers,creator
1327330,2021-02-26 04:43:33 -0800,2021-02-26 05:43:32 -0800,Firefox - Opening PDF automatically in firefox,<p>Hello guys. I want to open PDF directly in the browser. I set checkboxes to do it automatically but firefox always displayed this window when I want to download pdf. Could you help me? </p>,desktop;customize;,firefox,customize,en-US,1394879;,nikolay.parfianovich
1327328,2021-02-26 04:32:14 -0800,2021-02-26 04:32:14 -0800,Navegador time out,"<p>Após atualizações o navegador não abre uma página específica (<a href=""https://www.folha.uol.com.br/"" rel=""nofollow"">https://www.folha.uol.com.br/</a>), a qual abre em outros navegadores no mesmo PC. Já executei os procedimentos padrões de cache, revisei as configurações do (network.dns.disablePrefetchFromHTTPS) para ""False"" e o problema persiste. Aguem tem uma dica? Abs. Tomaz </p>",desktop;websites;windows-10;firefox-860;,firefox,websites,pt-BR,"",tomazcarrilho
1327327,2021-02-26 04:25:57 -0800,2021-02-26 04:25:57 -0800,Images and QR-Codes are not shown,"<p>Hi, QR-codes and images are not always visible and replaced by some random weird image (see attachment). If you recognize this problem and know how to fix it, please help me :) Thanks! </p><p>Best regards Martin </p>",desktop;fix-problems;windows-10;firefox-850;firefox-8502;,firefox,fix-problems,en-US,"",henkemartin
1327326,2021-02-26 04:15:39 -0800,2021-02-26 10:51:04 -0800,How to find a certain Style Sheet from the List in the Dev Tools Style Editor?,"<p>Hi, </p><p>I have been working with the Style Editor from the Developer Tools. As you can see from the screenshot, there's a massive list of style sheets. </p><p>I'm looking for a certain style sheet to edit, however the list is not sorted alphabetically. So I don't know how to find the name of my style sheet other than just trying to scroll through the whole list to spot my specific sheet. This every time take hours for me to find what I'm looking for. </p><p>Is there any way to find a style sheet in that list faster than manually scrolling through the list? Something like Ctrl + F, or a way to sort that list alphabetically? </p><p>Thanks for your help! </p>",desktop;beta;customize;windows-10;firefox-870;,firefox,customize,en-US,1394860;1394869;,browserlightedup
1327325,2021-02-26 04:14:33 -0800,2021-02-26 04:14:33 -0800,Library period-timeline folders missing,"<p>Hello, within my library the timeline folders are missing. (No ""Today"", no ""Yesterday"", a.s.o.)  How can I re-activate this ability within the FIREFOX-Browser? Thanks in advance. </p>",desktop;other;windows-10;firefox-860;,firefox,other,en-US,"",mike.wassmann
1327324,2021-02-26 04:02:57 -0800,2021-02-26 04:02:57 -0800,"Want to get rid of ""This time, search with"" option in address bar","<p>Recently, I updated Firefox (as it regularly bothers me to do so) and it added an annoying new feature that appears whenever I type anything into the address bar. It used to just provide search suggestions from my list of bookmarks, but now below the list of search options is a separate segment with ""This time, search with:"" followed by multiple icons--in my case, Google (my default browser), bookmarks, tabs, history, and settings. And you know how when you're sometimes typing something you want to find and the desired result is toward the bottom of the list, so instead of pressing the down arrow key to get to it, you press the up arrow to start from the end…well now, when I try that on the address bar, it cycles through each icon before letting me get to the list's end.  </p><p>I know it sounds like a petty complaint, but it's annoying and inconvenient to have to do it each and every time since it's habitual to cycle from top to bottom or vice versa on basically every other search bar. I went the route of ""Settings &gt; Options &gt; Search &gt; Search Shortcuts"" to see if I could get rid of these icons, but just like how it doesn't let you get rid of search engines when you only have one on the list, it doesn't give you an option to remove these superfluous icons.  </p><p>These Mozilla dumbasses seem to lack foresight and/or consideration with the way they limit user preferences. Can anybody give me any alternative solutions? Please spare me the snide answers like ""switch to Chrome"" (already considering it). If there's a way to simply circumvent these icons in the address bar rather than getting rid of them entirely, that would be more that enough: I just don't know how to go about it. Anyway, thank you for taking the time to read my submission/rant. </p>",desktop;customize;windows-10;firefox-850;,firefox,customize,en-US,"",xcutsy
1327322,2021-02-26 03:44:01 -0800,2021-02-26 03:44:01 -0800,"Over the last few days my ""Find in Page"" function has stopped working.","<p>Over the last few days my ""Find in Page"" function has stopped working. If I type Ctrl-F the window opens in the status bar. I can type one letter that highlights some - but not all - instances of that letter on the page. As soon as I type a second letter the field goes pink.  </p><p>Is it possible this is something easy to fix without having to completely reload Firefox? </p><p>Yes, it's a very old version of Firefox. But it's worked perfectly until now. </p>",windows-7;desktop;other;firefox-620;firefox-6203;,firefox,other,en-US,"",magelord
1327320,2021-02-26 03:29:00 -0800,2021-02-26 03:29:00 -0800,Printjob paused since 85.0.1,<p>Every printjob is paused in FF 85.0.1 and 86. I cannot restart the jobs. Used OS LinuxMint 20.1 and Ubuntu 20.04.1! Firefox 85 was ok! </p>,linux;desktop;fix-problems;firefox-850;firefox-8501;,firefox,fix-problems,en-US,"",mayer.mobil
1327319,2021-02-26 03:16:42 -0800,2021-02-26 03:16:42 -0800,Clear Cookies / Browsing History by Container,"<p>Can you clear your browsing history and / or cookies by container?  </p><p>I use a general container for general use, and others for banking etc - I just want to clear the history of the general usage container but retain the banking ones. </p>",desktop;privacy-and-security_1;windows-10;firefox-850;,firefox,privacy-and-security,en-US,"",phill101
1327316,2021-02-26 02:30:55 -0800,2021-02-26 02:30:55 -0800,"Dcoument not previewing, direct asking to save file for some sites","<p>Dear Team, i am unable to display preview for some sits preview pages, this is direct asking to save file. </p>",desktop;other;windows-10;firefox-860;,firefox,other,en-US,"",neeraj.takuli
1327313,2021-02-26 02:16:15 -0800,2021-02-26 02:16:15 -0800,Is there a way to hide the current window when dragging off its one and only tab?,"<p>Hello! I'm a sort-of new Firefox user, and I just noticed some differences in behavior between Firefox and Chrome. </p><p>In Chrome, when I drag a tab out of its window so that I can move it into another window, if the window in question only has one tab, then dragging that one tab will hide the current window and show the background, allowing me to easily drag it into that background window. </p><p>This is especially useful when both windows are maximized. </p><p>In Firefox, I cannot do the same. Dragging a tab around a window with only that one tab open does not hide the current window, but rather, drags the tab around the browser window. I recognize now that this is because I can drag the tab to other places such as the Bookmarks menu, and if the above Chrome behavior was replicated, I would have a hard time doing this with just one tab open. </p><p>Though, I think the way to merge a maximized one-tab window onto another window in Firefox is to just drag the window a bit so it stops becoming maximized, then drag the one tab onto the window behind it. Is that how I'm supposed to do it, or is there a better way? </p><p>On another note, is there any way as of the moment to replicate Chrome's behavior with regard to this tab dragging situation? If not, thank you for your time, anyway. I'll just get used to the new way of doing this for now. Thank you all! </p>",desktop;beta;tips;windows-10;firefox-870;,firefox,tips,en-US,"",areve.btorres
1327312,2021-02-26 02:10:29 -0800,2021-02-26 02:10:29 -0800,Add-ons,"<p>Sommige add-ons vragen toestemming om alle data van websites te lezen, inclusief namen en wachtwoorden. Dit lijkt mij een beveiligingsrisico, maar toch beveelt Firefox o.a. de add-on Darkreader aan. Kan iemand mij vertellen waarom ik zonder enig risico darkreader kan gebruiken. </p>",desktop;privacy-and-security_1;windows-10;firefox-860;,firefox,privacy-and-security,en-US,"",acmey
1327306,2021-02-26 01:29:00 -0800,2021-02-26 01:29:00 -0800,FF 78.8.0ESR can't load NYT homepage,"<p>Hi! </p><p>Updated FF on my Linux box today &amp; now the NYT homepage can't be loaded. Altho' the WaPo homepage seems to load faster, the NYT just times out in mid-render, probably due to the site's heavy javascript. FF doesn't pop up any error messages, alas.  </p><p>I'm assuming the new FF is simply allergic to the NYT's clunky code. But still. . .any tips, tricks, workarounds or hints to fix?  </p><p>Ty! </p>",linux;desktop;websites;,firefox,websites,en-US,"",frelkins
1327303,2021-02-26 00:55:50 -0800,2021-02-26 01:34:09 -0800,Safe Mode,"<p>Hey, how to turn off safe mode in mozilla Firefox ? </p>",desktop;customize;windows-10;firefox-860;,firefox,customize,en-US,1394830;,Priyamkumarkv1
1327300,2021-02-26 00:05:03 -0800,2021-02-26 06:13:08 -0800,Remove Website from Popup-Block-List,"<p>Hello, </p><p>recently I moved a website to the ""Block Popups from this site"" list. </p><p>Now I only have the option to generally block all pop-ups or to allow them in general. </p><p>Is there any way to get that yellow bar back, telling me, that something has blocked and allows me to select which Popup is to be allowed and which is declined? </p><p>Thank you! </p>",desktop;privacy-and-security_1;windows-10;firefox-860;,firefox,privacy-and-security,en-US,1394845;1394851;1394853;1394857;1394858;1394884;1394890;,devilsraccoon
1327298,2021-02-25 23:46:08 -0800,2021-02-26 01:36:03 -0800,Default zoom when switching to a Youtube tab is 500%,<p>I put Firefox on 500% zoom one day and since that day its defaulted to 500% zoom when clicking on a video or just clicking into the tab from a different one. I managed to find an add-on that kept the zoom the same when going to new videos but the zoom still defaults to 500% when clicking into the tab. I've tried changing the default zoom to something else then changing it back to 100% and I've tried deleting cookies. It still does it in a private window with no add-ons enabled. </p><p>Thanks </p>,desktop;websites;windows-10;firefox-850;,firefox,websites,en-US,1394831;,millerdavis2478
1327297,2021-02-25 23:44:17 -0800,2021-02-26 05:36:44 -0800,Losing browsing history,"<p>Hi there - I want to keep my history. I want to SAVE my browsing history. I do NOT want my history to disappear. I cannot find how to do this. There are Many ways to DELETE history, but how do I prevent mine from disappearing. Mine disappears every day and I want to SAVE my history. Fourth time of asking! Please help. Thanks Pete </p>",windows-7;desktop;customize;firefox-860;,firefox,customize,en-US,1394876;,pete47
1327296,2021-02-25 22:44:02 -0800,2021-02-25 22:44:02 -0800,Youtube,"<p>Hi everyone! When watching YouTube, I can stream the video to the my TV by pressing a button on the player. (Google Chrome or app on my phone). I attach a screenshot. When I switched to the firefox browser, this button is not. The function is extremely convenient, why isn't it in firefox? </p>",mac-os;desktop;customize;firefox-850;,firefox,customize,en-US,"",gglstas
1327294,2021-02-25 22:12:41 -0800,2021-02-25 22:48:55 -0800,browser is outdated,"<p>браузер Firefox  обновлен до версии 86.  Windows 10 браузер яндекс не открывают страницы - пишет старый браузер сайты гугл документы пишет, что это версия не поддерживается </p><p>Сам браузер Firefox пишет  ,что обновился до последней версии. </p><p><br> Firefox browser has been updated to version 86  Windows 10 </p><p>Yandex browser does not open pages - old browser writes sites google docs writes that this version is not supported </p><p><br> Firefox browser itself writes that it has been updated to the latest version. </p>",desktop;other;windows-10;firefox-860;,firefox,other,en-US,1394802;1394806;1394809;1394811;,andrewyunev
1327292,2021-02-25 21:26:28 -0800,2021-02-25 21:26:28 -0800,HELP ME PLEASE,<p>HELP NEEDED WILL NOT ALLOW ME TO ACCESS OTHER MOZZILA ACCOUNT BECAUSE OF UPDATE AND CAN NOT ACCESS OTHER ACCT DUE TO MOZZILA HAVING MY EMAIL PASSWORD SAVED AND AM UNABLE TO ACCESS THAT EMAIL ADDRESS </p>,desktop;other;windows-10;firefox-860;,firefox,other,en-US,"",medic4420
1327291,2021-02-25 20:41:20 -0800,2021-02-25 20:52:20 -0800,Is there a way to change only the color of clicked links and unclicked links in Firefox?,"<p>I set the colors of visited links and unvisited links in [Options]-[General]-[Language and Appearance]-[Color]. </p><p>If you want to take effect, you need to select [All] in [Use the color you selected above to overwrite the color specified on the page] </p><p>In this way, all styles of all website pages: text color and background color are all changed. </p><p>Is there a way to only change the color of the link, while the text and background colors still use the web page's own; or specify that only the domain name pages in the list list use the specified color, and the website's own default color is used for those that are not explicitly specified? </p>",windows-7;desktop;customize;firefox-850;,firefox,customize,en-US,1394789;,planningall
1327290,2021-02-25 20:29:30 -0800,2021-02-26 14:12:12 -0800,Problem With Icons Appearing As Boxes of Numbers and Letters,<p>Can anyone please tell me how to stop seeing boxes full of letters and numbers instead of icons on certain websites I visit ? I attach a small picture of what I mean as an example. It only applies to a very small number but it does make navigating around the sites difficult. </p><p>I would be most grateful for any advice offered. </p><p>Thanks </p>,desktop;websites;windows-10;firefox-860;,firefox,websites,en-US,1394788;1394859;1394997;1395005;,stanstyman
1327289,2021-02-25 20:19:00 -0800,2021-02-25 22:58:42 -0800,Taskbar problem,<p>The only way I can display the taskbar is to hit the Windows button. Then it disappears when I do anything else. I wan it to display all the time. </p><p>Thank you </p>,desktop;other;windows-10;firefox-860;,firefox,other,en-US,1394816;,rtucker41
1327287,2021-02-25 19:27:23 -0800,2021-02-26 11:21:07 -0800,datepicker,"<p>Datepicker displays date yyyy-mm-dd in Firefox 85.0.2 but fails in 86.0 </p><p>left image is 86, right image is 85 </p><p>$ uname -a Linux jcn 5.4.0-66-generic #74-Ubuntu SMP Wed Jan 27 22:54:38 UTC 2021 x86_64 x86_64 x86_64 GNU/Linux </p><p>$ lsb_release -a No LSB modules are available. Distributor ID:	Linuxmint Description:	Linux Mint 20.1 Release:	20.1 Codename:	ulyssa </p>",desktop;fix-problems;firefox-860;,firefox,fix-problems,en-US,1394782;1394960;,jcahn2
1327286,2021-02-25 19:22:11 -0800,2021-02-25 19:22:11 -0800,"Imprimir a un tipo de archivo ""distinto"" a PDF (DjVu, SVG, PS, etc.)","<p>¿Por qué Firefox no tiene la opción de imprimir a SVG, DjVu, u otros formatos? Esta todo bien con PDF, es muy usado, es práctico, pero... se supone que usamos software libre, ¿por qué usar un formato propietario? Creo recordar que hace unos años atrás se dio esta discusión en especial en LinuxMint. </p><p>Hace tiempo estoy buscando una solución en particular en el mismo sistema Linux, para que esté disponible para todos los programas. </p><p>Estuve investigando por alguna impresora virtual para DjVu (que es mucho más eficiente que PDF) pero parece que eso quedó estancado. Tampoco me sirve que luego se pueda convervir los PDF creados a otro formato (es trabajo adicional), lo ideal sería que en el cuadro de impresión de Firefox haya una lista con los tipos de archivos requeridos. </p><p>¿Qué pueden hacer los desarrolladores de Firefox al respecto? ¿abra que coordinar con los desarrolladores de GNU/Linux? </p>",desktop;customize;firefox-850;,firefox,customize,es,"",edgarhfernandez
1327285,2021-02-25 19:10:05 -0800,2021-02-25 23:03:13 -0800,automatic upgrades,"<p>I do not want and never requested ""automatic upgrades"". I want them stopped and if possible the last several ""upgrades"" reversed. How can I get this accomplished. It's bad enough that ""google"" has it's fingers in everything as it is without ""upgrades"" I don't want and didn't ask for, and have done nothing to make things work any better. In fact it's gotten worse. If anyone knows how I can contact firefox directly it would be most appreciated. </p>",windows-7;desktop;other;firefox-860;,firefox,other,en-US,1394818;,djmdgo7
1327282,2021-02-25 18:40:04 -0800,2021-02-26 05:48:54 -0800,Is the multi account containers still useful in Firefox 86,"<p>Hi, </p><p>After reading on the new update with Firefox 86, it seems that you have made some really good changes on the way cookies are handled forcing each site to keep their cookie separate from everyone else. </p><p>So is the Is the multi account containers still useful in Firefox 86 if what I'm using them for is to keep from being tracked?  </p><p>It seems that they would be useful if I wanted to open several different Gmail accounts at the same time from within their respective folders. </p><p>Thank you for your help. </p><p>Kenrick </p>",desktop;privacy-and-security_1;needsinfo;firefox-860;,firefox,privacy-and-security,en-US,1394774;1394883;,keystoyes
1327281,2021-02-25 18:32:39 -0800,2021-02-26 02:19:23 -0800,"""Top Sites""","<p>The first ""site"" in my ""Top Sites"" is shown as Google. Why? I rarely use Google </p>",mac-os;desktop;other;firefox-860;,firefox,other,en-US,1394837;,boffey
1327280,2021-02-25 18:21:25 -0800,2021-02-26 13:46:07 -0800,"i want to play video game and firefox said ""problem loading page secure connection failed"" and ""The page you are trying to view cannot be shown because the authenticity of the received data could not be verified"".",<p>how can i make that video game work???? </p>,desktop;other;windows-10;firefox-860;,firefox,other,en-US,1394773;1394820;1395008;,jonnelpselorio
1327276,2021-02-25 17:46:29 -0800,2021-02-25 17:46:29 -0800,How to stop Microsoft Office pop-up window in Firefox 86.,<p>I installed Firefox 86 and I'm getting Microsoft office pop-up window. I have block pop-ups selected in options. I've uninstalled everything pertaining to Microsoft office and it's still happening. Seems to happen when I hit the page back button on my mouse. I'm running AdBlock Plus. It's driving me crazy. Anybody have any ideas? Thanks much for any help. </p>,desktop;other;windows-10;firefox-860;,firefox,other,en-US,"",Old_Trekee
1327274,2021-02-25 17:26:03 -0800,2021-02-26 13:34:06 -0800,"""PRINT PREVIEW"" is gone !!!","<p>The ""PRINT PREVIEW"" option I have found under the ""FILE"" drop down is GONE!!! I Please tell me HOW to get it back (or at least find it somewhere else)!  I absolutely DEPEND on this function for processing orders and printing packing slips !!!!  </p><p>This is NOT an improvement for me!!! This is absolutely horrible! </p>",desktop;websites;windows-10;firefox-860;,firefox,websites,en-US,1394781;1394817;1394937;1394943;1394948;1394962;1394967;1394971;1394974;1394998;1395002;1395004;,timestreasuresllc
1327273,2021-02-25 16:53:08 -0800,2021-02-26 02:29:18 -0800,"Can I set a new tab extension as INITIAL homepage (I dont want FF home or some page, but a nice momentum like dashboard)","<p>Hi, Can I set a new tab extension as INITIAL homepage (I dont want FF home or some page, but a nice momentum like dashboard) </p><p>thanks </p>",mac-os;desktop;customize;firefox-860;,firefox,customize,en-US,1394758;1394842;,Daij-Djan
1327272,2021-02-25 16:19:23 -0800,2021-02-26 13:16:31 -0800,"What is the purpose of ""app.normandy"" in about:config - can I set all to false?","<p>Mozilla Firefox keeps rolling out changes to functionality and the user interface  without notification, as well as altering my user preferences.  A set of about:config preferences that start with ""app.normandy"" seem to have something to do with installing these on my Windows 10 system. I did NOT enroll in any FF studies. So, it is odd that there seems to be outside manipulation . I am not a programmer. I would appreciate a lay person explanation.  </p><p>""Normandy is a collection of servers, workflows, and Firefox components that enables Mozilla to remote control Firefox clients in the wild based on precise criteria."" </p><p>app.normandy.api_url	<a href=""https://normandy.cdn.mozilla.net/api/v1"" rel=""nofollow"">https://normandy.cdn.mozilla.net/api/v1</a>	 app.normandy.dev_mode	false	 app.normandy.enabled	true	 app.normandy.first_run	false	 app.normandy.last_seen_buildid		 app.normandy.logging.level	50	 app.normandy.migrationsApplied	10	 app.normandy.onsync_skew_sec	600	 app.normandy.run_interval_seconds	21600	 app.normandy.shieldLearnMoreUrl	<a href=""https://support.mozilla.org/1/firefox/%VERSION%/%OS%/%LOCALE%/shield"" rel=""nofollow"">https://support.mozilla.org/1/firefox/%VERSION%/%OS%/%LOCALE%/shield</a>	 app.normandy.startupRolloutPrefs.browser.partnerlink.useAttributionURL	true	 app.normandy.startupRolloutPrefs.browser.toolbars.bookmarks.2h2020	true	 app.normandy.startupRolloutPrefs.browser.topsites.experiment.ebay-2020-1	true	 app.normandy.startupRolloutPrefs.browser.topsites.useRemoteSetting	true	 app.normandy.startupRolloutPrefs.doh-rollout.enabled	true	 app.normandy.startupRolloutPrefs.doh-rollout.profileCreationThreshold	1896163212345	 app.normandy.startupRolloutPrefs.doh-rollout.provider-steering.enabled	true	 app.normandy.startupRolloutPrefs.doh-rollout.provider-steering.provider-list	[{ ""name"": ""comcast"", ""canonicalName"": ""<a href=""http://doh-discovery.xfinity.com"" rel=""nofollow"">doh-discovery.xfinity.com</a>"", ""uri"": ""<a href=""https://doh.xfinity.com/dns-query"" rel=""nofollow"">https://doh.xfinity.com/dns-query</a>"" }]	 app.normandy.startupRolloutPrefs.network.preload	true	 app.normandy.startupRolloutPrefs.print.tab_modal.enabled	false	 app.normandy.user_id	9893538f-07be-4513-8265-9124f1f967ff </p>",desktop;customize;windows-10;firefox-840;,firefox,customize,en-US,1394766;1394993;,plew29881
1327271,2021-02-25 16:14:59 -0800,2021-02-25 16:51:59 -0800,Cannot Enter Exceptions - And Firefox Doesn't Work Properly,"<p>Trying to debug. Firefox breaks my site, and if I change the Tracking Protection to Strict, my site doesn't work at all. So it must be in this no tracking area. </p><p>But I cannot enter exceptions in the tracking window, that window is not live. See attached. Why I cannot enter/type site URLs in this window? </p>",desktop;privacy-and-security_1;windows-10;firefox-860;,firefox,privacy-and-security,en-US,1394730;1394736;,radascuta1
