id,created,updated,title,content,tags,product,topic,locale,answers,creator
1351914,2021-09-26 21:18:42 -0700,2021-09-26 21:18:42 -0700,Automatically fill in your address on web forms,"<p>Although I am in US I couldn't find the ""automatically fill in form and address"" option in my Firefox. Because of this I am forced to use Chrome. </p><p>Please help me with issue. </p>",mac-os;desktop;customize;firefox-920;,firefox,customize,en-US,"",kumarbhaskar2009
1351912,2021-09-26 20:22:59 -0700,2021-09-26 21:45:21 -0700,Text missing,"<p>Recently, text is missing when I try to look at a document on a web site. And using Spectrum for my ISP, when I open their web mail with Firefox there are unusual symbols over the selections in the menu bar, </p>",windows-7;desktop;websites;firefox-900;,firefox,websites,en-US,1446508;1446518;,buckles
1351911,2021-09-26 20:04:45 -0700,2021-09-26 20:46:52 -0700,install extensions from the Windows command line,<p>How install extensions from the Windows command line? having an xpi file. </p>,desktop;download-and-install_1;,firefox,download-and-install,es,1446509;,jose97tirado
1351910,2021-09-26 20:04:21 -0700,2021-09-26 20:04:21 -0700,In bookmark my websites that i save is not showing icon,<p>In bookmark my websites that i save is not showing icon you can watch the picture that what i means </p>,desktop;bookmarks;windows-10;firefox-920;,firefox,bookmarks,en-US,"",thomasaung1978
1351909,2021-09-26 20:01:43 -0700,2021-09-26 20:01:43 -0700,whats up with my firefox,"<p>everyday when i get on my mac, Firefox acts as if I just installed it.  I have to do the import of favorites and such.....sometimes it happens more then once on the same day, like if if it sets for a few hours it closes out.  when I open it back up its like a new install.... Any ideas </p>",mac-os;desktop;download-and-install_1;firefox-920;,firefox,download-and-install,en-US,"",jrbaxter
1351908,2021-09-26 19:18:22 -0700,2021-09-26 21:46:36 -0700,Firefox crashed on Mac M1!!!,"<p>Hi, </p><p>I don't know if this crash has only happened on other Macs or not but here's my report: </p><p>After updating Firefox to the latest update and I tried opening a <strong>Google Slide in presentation mode</strong>, the whole app crached!  </p><p>I tried deleting FF and reinstalling it but the same issue happens again! </p>",desktop;fix-problems;,firefox,fix-problems,en-US,1446519;,ahsan99
1351907,2021-09-26 19:00:42 -0700,2021-09-26 19:00:42 -0700,"How do I eliminate the Firefox ""Bookmarks Side Bar""?","<p>When I start Firefox or open a new tab, a ""BOOKMARKS SIDEBAR"" pops up on the Window on the left side. I do not want this SIDEBAR but can't find how to make it go away permanently. </p>",desktop;bookmarks;windows-10;firefox-920;,firefox,bookmarks,en-US,"",jagman55
1351906,2021-09-26 18:34:41 -0700,2021-09-26 19:05:44 -0700,Search engines not showing up on drop down,<p>In the search engine option I accidentally deleted all search engines except duckduckgo. I want to add google or Bing  but I cant get it in the drop down list </p>,windows-7;desktop;privacy-and-security_1;firefox-920;,firefox,privacy-and-security,en-US,1446505;,rameshjey
1351905,2021-09-26 18:19:05 -0700,2021-09-26 19:00:13 -0700,You send me to pages in foreign languages,"<p>You send me to pages in a foreign language. For example,I clicked LinkedIn, and it's in a foreign language. </p><p>When I click to go to a page often it's in a foreign language that I can't understand. I speak English. My only language setting is English. </p><p>Sometimes you send me that ""Prove you're not a robot"" that's all in characters like Chinese. I cannot understand it at all. I like Mozilla, but may have to use Google to get some work done. </p><p>Sometimes I use a VPN (Virtual Private Network) because I handle bills and finances online. Both myself and the IP address of the VPN are in the United States. I never do anything that involves foreign countries. </p>",desktop;other;windows-10;,firefox,other,en-US,1446503;,harrysauerhoff
