id,created,updated,title,content,tags,product,topic,locale,answers,creator
1360014,2021-12-03 15:09:20 -0800,2021-12-03 15:09:20 -0800,Marcadores duplicados,"<p>Como elimino marcadores duplicados, gracias. </p>",desktop;bookmarks;windows-10;firefox-940;firefox-9402;,firefox,bookmarks,es,"",afabaa
1360012,2021-12-03 14:01:11 -0800,2021-12-03 14:01:11 -0800,Problem with streaming TV content,<p>I'm running Firefox 94.0.2 (64 bit) under Windows 10. Recently I've been receiving messages from TV content providers telling me I need to enable DRM in my browser. I have been to to the Settings menu and see that DRM is enabled. CDM is also activated. I have tried toggling them on and off and restarting but I still get the messages.  Please tell me how to get DRM contento run. </p>,desktop;other;windows-10;firefox-940;firefox-9402;,firefox,other,en-US,"",Willmol
1360009,2021-12-03 13:34:04 -0800,2021-12-03 13:34:04 -0800,FF caused BSOD,"<p>I was recently watching a Twitch livestream when I stepped away from my PC for a moment and upon returning found it sitting at the login screen. Checking eventvwr it showed a BSOD event had occurred.  The only thing actively running on my PC was FireFox with a single tab for Twitch. </p><p>Level: Critical Source: Kernal-Power Event ID: 41 BugCheckCode: 307 decimal, 0x133 hex </p><p>Windows documentation lists hex 0x133 as a DPC_WATCHDOG_VIOLATION error, and since Parameter 1 was a '0', it states, ""A single DPC or ISR exceeded its time allotment. The offending component can usually be identified with a stack trace."" <a href=""https://docs.microsoft.com/en-us/windows-hardware/drivers/debugger/bug-check-0x133-dpc-watchdog-violation"" rel=""nofollow"">https://docs.microsoft.com/en-us/windows-hardware/drivers/debugger/bug-check-0x133-dpc-watchdog-violation</a> </p><p>From Windows Debugging Tools I loaded up the DMP file and ran !analyze to see the process name listed as FF (there's more information listed, just not sure it's really useful). </p><p>PROCESS_NAME:  firefox.exe MODULE_NAME: nt IMAGE_NAME:  ntkrnlmp.exe STACK_COMMAND:  .thread ; .cxr ; kb STACK_TEXT:   ffffa681`de892c88 fffff804`7581f5fa     : 00000000`00000133 00000000`00000000 00000000`00000501 00000000`00000500 : nt!KeBugCheckEx ffffa681`de892c90 fffff804`7561c3cd     : 0000de92`ad226167 ffffa681`de840180 00000000`00000246 00000000`008d0193 : nt!KeAccumulateTicks+0x20644a ffffa681`de892cf0 fffff804`7561c971     : 00000000`008d0192 00000000`00540bd4 ffffa681`de840180 00000000`00000001 : nt!KiUpdateRunTime+0x5d ffffa681`de892d40 fffff804`756167e3     : ffffa681`de840180 00000000`00000000 fffff804`76031630 00000000`00000000 : nt!KiUpdateTime+0x4a1 ffffa681`de892e80 fffff804`7561f1a2     : ffff8a08`cf6e79c0 ffff8a08`cf6e7a40 ffff8a08`cf6e7a00 00000000`00000002 : nt!KeClockInterruptNotify+0x2e3 ffffa681`de892f30 fffff804`756de055     : 00000150`3043798c ffffcb8c`9850adc0 ffffcb8c`9850ae70 ffff2a97`b5c65417 : nt!HalpTimerClockInterrupt+0xe2 ffffa681`de892f60 fffff804`757f8d4a     : ffff8a08`cf6e7a40 ffffcb8c`9850adc0 0000de80`ffc7236f 00000000`00000000 : nt!KiCallInterruptServiceRoutine+0xa5 ffffa681`de892fb0 fffff804`757f92b7     : 00000000`00000000 00001f80`007f02c4 00000000`4af4ce39 ffff8a08`cf6e7bb8 : nt!KiInterruptSubDispatchNoLockNoEtw+0xfa ffff8a08`cf6e79c0 fffff804`75680c6b     : 00000000`80000000 fffff804`75729a99 00000000`00000000 00000000`00000000 : nt!KiInterruptDispatchNoLockNoEtw+0x37 ffff8a08`cf6e7b50 fffff804`75729a99     : 00000000`00000000 00000000`00000000 00000000`00000000 00000000`00000000 : nt!KeYieldProcessorEx+0x1b ffff8a08`cf6e7b60 fffff804`7569a24e     : ffffa681`de843240 ffffa681`4afc988a ffffcb8c`b0c73480 ffffcb8c`ac2e3040 : nt!ExpGetPoolTagInfoTarget+0x149 ffff8a08`cf6e7bb0 fffff804`75699534     : ffffa681`de840180 00000000`00000000 00000000`00000008 00000000`005408f1 : nt!KiExecuteAllDpcs+0x30e ffff8a08`cf6e7d20 fffff804`757fe2e5     : 00000000`00000000 ffffa681`de840180 00000000`00000000 000001d3`21056910 : nt!KiRetireDpcList+0x1f4 ffff8a08`cf6e7fb0 fffff804`757fe0d0     : 00000081`e2df8c90 00000000`00000000 000001d3`18d58b28 00000081`e2df8b90 : nt!KxRetireDpcList+0x5 ffff8a08`d1eefa90 fffff804`757fd79e     : 000001d3`00000000 00000000`00000001 000001d3`2105a4e0 ffff8a08`d1eefb40 : nt!KiDispatchInterruptContinue ffff8a08`d1eefac0 00007ff8`acdd7bd7     : 00000000`00000000 00000000`00000000 00000000`00000000 00000000`00000000 : nt!KiDpcInterrupt+0x2ee 00000081`e2def0b0 00000000`00000000     : 00000000`00000000 00000000`00000000 00000000`00000000 00000000`00000000 : 0x00007ff8`acdd7bd7 </p><p>I checked FF `about:crashes` and it doesn't show any crash report there (presumably because the system BSOD and it did not have a chance to do anything). </p><p>Just wondering if anyone else has seen this issue and how/if they resolved it. In searching around it seemed like some folks suggested disabling hardware acceleration as there may be incompatibility issues with FF and GPU drivers. I checked under FF settings and it has ""Use recommended performance settings"" enabled, but there are no sub-options specific for hardware acceleration. </p><p>Some basic system specs: MoBo: Gigabyte B550 Vision D-P (BIOS F13e, latest available) CPU: AMX Ryzen 7 5800X GPU: Gigabyte GeForce 3060Ti (driver 30.0.14.7141, latest one available) </p><p>Running on FF 94.0.2 (64-bit), the latest update. </p>",desktop;fix-problems;windows-10;firefox-940;,firefox,fix-problems,en-US,"",SirCobalt
1360008,2021-12-03 13:29:15 -0800,2021-12-03 13:29:15 -0800,drag and drop not working .,<p>in fact I don't know under what topic it should be .. </p><p>after upgrade mac system to 11.6.1 drag and drop stop working with firefox. I use it for word press </p><p>the problem is more than 6 steps I should do to upload one photo .. and in drag and drop I can upload many in one step </p><p>mac system  11.6.1 firefox 94.0.2 </p>,mac-os;desktop;tips;firefox-940;firefox-9402;,firefox,tips,en-US,"",alsadr
1360007,2021-12-03 13:28:18 -0800,2021-12-03 13:28:18 -0800,When trying to access spectrun.net to watch TV on a Windows 10 PC I get the error: WLP-4005. I was previously able to access with no problem,"<p>I have cleared out site and cookie history with no success, How do I eliminate this error. Other browsers have no problem with accessing the Spectrum TV app on this windows pc. </p>",desktop;websites;windows-10;firefox-940;firefox-9402;,firefox,websites,en-US,"",paulm9449
1360006,2021-12-03 13:23:24 -0800,2021-12-03 15:08:56 -0800,Web site,"<p>Hello I have a problem with with the security certificate   RE: my wen site   <a href=""http://eriksvensson.com"" rel=""nofollow"">eriksvensson.com</a> Please kindly help me out on this issue. Thank you Best Erik Svensson  </p><p><br> </p><p>edited phone# and address location from public and search/spam bots view as this is a community forum. </p>",mac-os;desktop;other;firefox-940;,firefox,other,en-US,"",pixonlocation
1360005,2021-12-03 13:10:36 -0800,2021-12-03 15:02:37 -0800,Cannot logon to Chase Online Banking since going to FF 94.0.2,"<p>Since upgrading to FF 94.0.2, I cannot logon to Chase Online Banking. The site texts me a code which I then enter and receive a message that part of the site does not seem to be working. If I use Edge, I can get in without a problem. I went into troubleshooting mode and it let me logon without a problem, but returning to normal mode repeats the problem. Using private mode does not work either. I'm not sure what is going on here and any suggestions would be appreciated. </p>",desktop;websites;firefox-940;firefox-9402;,firefox,websites,en-US,1463930;1463941;,schmieg6
1360004,2021-12-03 13:09:52 -0800,2021-12-03 15:42:07 -0800,All Searches Default to URL box,"<p>I want searches to stay in a search engines home page and not go automatically into address box.  When I search for anything by writing in the search box on the Google home page search or even Duck Duck Go, the inserted text goes immediately into the address bar.  I have tried FF in Safe Mode, I have no studies going, using version of FF 94.0.2 and only have 5 extensions (Last Pass, Bitdefender, BreezeClick, Adobe Acrobat and Malwarebytes.) Thank you </p>",desktop;other;windows-10;firefox-940;firefox-9402;,firefox,other,en-US,1463923;1463927;,drsmith
1360002,2021-12-03 12:56:51 -0800,2021-12-03 15:22:55 -0800,where can I download Firefox for MacosMonterey?,<p>'<em><strong>bold text'</strong></em>You didn't answer my question </p>,desktop;download-and-install_1;,firefox,download-and-install,en-US,1463944;1463947;,carlosdehoyos1
1360001,2021-12-03 12:48:00 -0800,2021-12-03 12:48:00 -0800,Mozilla Addons account Sign in problem,"<p>hello, i have a mozilla addons developer account, i have not opened it for a month or two. Today, i am trying to sign in, it has two step verification setup, sent a code to my email, i enter the code back and validated, but it did not sign in and redirect me to the main email and password page. i tried again, but now it is not sending me any code in mail. Suggest me any solution. thanks </p>",desktop;privacy-and-security_1;,firefox,privacy-and-security,en-US,"",AdamGreen
1359999,2021-12-03 12:39:06 -0800,2021-12-03 12:39:06 -0800,norton password manager,<p>how  do I install the norton password manage on my  bookmarks </p>,desktop;bookmarks;windows-10;firefox-940;,firefox,bookmarks,en-US,"",dorsey.levarn
1359998,2021-12-03 12:28:09 -0800,2021-12-03 12:28:09 -0800,firefox does not show dropdown menu for password,"<p>Hi All, I am using firefox on my work laptop and it was working fine, until today that it was updated to the new version: 94.0.2 (64-bit) </p><p>I noticed that the new version was very fast, so I decided to switch from Chrome to Firefox. I imported all my logins and bookmarks, but when I go to a website, in the part where I should enter my login information, the drop-down menu does not show up, even though I have several saves usernames and passwords! I tried entering my logins manually into the password manager, but they still do not show up. The previous saved logins show up and work fine. But the new ones don't. Can you help me solve this issue? the image shows what I mean. The older login that was saved before the new update shows, but none of the other 4 logins that I imported or manually entered into the password manager show up. </p>",desktop;privacy-and-security_1;windows-10;firefox-940;,firefox,privacy-and-security,en-US,"",suuufiii
1359996,2021-12-03 12:01:03 -0800,2021-12-03 12:01:03 -0800,Homepage and new Windows items are all deleted.,"<p>I had a whole list of saved homepage landing sites that displayed when i open firefox they displayed above the main url/searchbar as shown in screenshot. These have all been deleted and i will need to spend hours to go and look them all up again . are these saved in any config files that i can re-add them ?  Why are these being deleted and if this is not going to be saved going forward why do you still make this functionality available ? second, larger screenshot. </p><p>Please advise, this is the main reason I use firefox .... all previous updates these URL's remained until now, but if going fwd you dont support , i would suggest you remove the functionality. and I will remove firefox. </p>",desktop;websites;windows-10;firefox-940;firefox-9402;,firefox,websites,en-US,"",walks0618
1359995,2021-12-03 11:58:37 -0800,2021-12-03 11:58:37 -0800,credit debit catds,<p>how do i remove used cards from where i purchase them in zenga slots </p>,windows-7;desktop;other;firefox-940;,firefox,other,en-US,"",jabowles50
1359994,2021-12-03 11:38:55 -0800,2021-12-03 11:38:55 -0800,TOOOOOOO SLOWWWWW WITH YOUTUBE,"<p>Firefoxe became Tooooooooooooo slow,lagging with youtube </p>",desktop;fix-problems;windows-10;firefox-940;,firefox,fix-problems,en-US,"",aeroformations
1359992,2021-12-03 11:31:21 -0800,2021-12-03 11:31:21 -0800,how can I change keyboard shortcut?,"<p>hello, </p><p>I want to use Firefox fullscreen on macOS, but when I press Esc button on keyboard accidentally Firefox escapes from fullscreen. And, I do press Esc by mistake a lot, because of a hand habit! Is there a way to aviod this? This is a very bad shortcut for closing the fullscreen! Other browsers has combinations to avoid such accidents! </p><p>If there's not way to change this I believe Firefox developers should make it a combination! This looks like a very simple design mistake! </p>",mac-os;desktop;customize;firefox-940;,firefox,customize,en-US,"",baris.sehri
1359991,2021-12-03 11:21:42 -0800,2021-12-03 11:21:42 -0800,page is loading from an OSLO connection...I've selected usa,"<p>Hello -  I purchased the VPN today. The initial connection was Oslo. I switched to USA/Dallas. At least one page, <a href=""http://msn.com"" rel=""nofollow"">msn.com</a>, is still loading from Oslo. </p>",desktop;websites;windows-10;firefox-940;,firefox,websites,en-US,"",kyblue
1359989,2021-12-03 10:57:29 -0800,2021-12-03 11:10:17 -0800,Automatic dark mode for web pages.,"<p>Ésta, es una sugerencia de implementación de funciones para el Firefox Daylight. </p><p>This is a feature implementation suggestion for Firefox Daylight. </p><p>Estoy convencido de que sería un gran avance el poder contar con una función automática activable/desactivable que lograra un ""modo oscuro"" durante la visita de cualquier página web. </p><p>I am convinced that it would be a great advance to have an automatic activated/deactivated function that achieves a ""dark mode"" during the visit of any web page. </p><p>Se trataría de una función similar a la que ya disponen algunos otros grandes Buscadores como, por ejemplo, pueda ser Opera... </p><p>It would be a function similar to that already available to some other large Search Engines, such as Opera... </p><p>De esta manera, Firefox también se sumaría a la corriente por la defensa de la salud visual al utilizar Internet. </p><p>In this way, Firefox would also join the trend for the defense of visual health when using the Internet. </p><p>Un guiño para cualquier otro ser humano inteligente: ésta misma página de Firefox para la escritura de mensajes, está de blanco riguroso y cegador. Y no es que lo blanco y brillante sea algo malo, es que hablamos de pantallas cargadas de luminosidad que agotan nuestra vista. ""Negro sobre blanco"" para describir la posibilidad de leer un texto sobre papel físico (un libro) es una cosa. ""Negro sobre blanco"" para captar la lectura de la imagen proyectada por una pantalla electrónica es otra cosa muy diferente. A mi juicio, demasiado diferente. </p><p>A nod to any other intelligent human being: this very Firefox page for writing messages, is in stark and blinding white. And it is not that white and bright is a bad thing, it is that we are talking about screens loaded with luminosity that exhaust our eyesight. ""Black on white"" to describe the ability to read a text on physical paper (a book) is one thing. ""Black on white"" to capture the reading of the image projected by an electronic screen is quite another thing. In my opinion, too different. </p><p>Es por esta razón por la que ruego que sean informados los ingenieros de Firefox sobre esta petición. </p><p>It is for this reason that I ask that Firefox engineers be informed about this request. </p>",desktop;other;,firefox,other,en-US,1463884;,Tutanotanium
1359987,2021-12-03 10:56:26 -0800,2021-12-03 10:56:26 -0800,How to disable ctrl+k keyboard shortcut?,"<p>For my work, I need to paste a lot of links into text (on a website which is probably somewhat poorly programmed), and when I select some text and hit ctrl+k to create a hyperlink, Firefox doesn't recognize that it's a text box and ""takes over"" the ctrl+k function, focusing on the search/address bar instead of allowing me to insert the link. (The reason I blame the website is that other websites, like Jira, work fine for this) </p><p>Is there a way to disable the ctrl+k functionality in firefox? I've seen a couple old <a href=""https://support.mozilla.org/en-US/questions/1318792"" rel=""nofollow"">threads</a> on disabling various shortcut keys but I don't know what the ""Focus Search bar"" key would be called in either the Browser Console or configs. </p><p><br> Thank you!! </p>",linux;desktop;customize;firefox-940;,firefox,customize,en-US,"",seagull949
1359986,2021-12-03 10:52:56 -0800,2021-12-03 10:52:56 -0800,Interface text size,"<p>Overnight, my the text size on my Firefox interface shrunk significantly. No other programs have changed, nor has the text inside the browser. How can I change this back to the original size, and how can I prevent this from happening again? </p>",desktop;customize;firefox-940;firefox-9402;,firefox,customize,en-US,"",brandtmunk
1359984,2021-12-03 10:38:32 -0800,2021-12-03 10:38:32 -0800,Can't delete bookmark tags created by pre-installed Firefox in Linux,<p>I have a ton of unused tags that cannot be deleted. Apparently unused tags are supposed to be deleted automatically but for some reason they do not. These tags came from a Linux Firefox installation with the Linux distributions bookmarks. </p><p>Is there any way to manually delete them from Firefox? </p>,desktop;bookmarks;windows-10;firefox-940;,firefox,bookmarks,en-US,"",eemelis
1359982,2021-12-03 10:26:38 -0800,2021-12-03 15:31:54 -0800,Block websites and exceptions to blocked websites not working,"<p>Hello, I have a series of laptops that I need to block access to all URLs and only allow access to one.  These laptops are not joined to an AD domain so I downloaded the ADMX templates and copied them to c:\windows\policydefinitions.  I ran gpedit.msc and added &lt;all_urls&gt; to the Blocked Websites policy and then added the specific URL to the Exceptions to Blocked Websites policy.  However I am unable to access the allowed URL as Firefox is blocking it, despite having the URL defined in the exceptions policy.   </p><p>I have added various other URLs to the exceptions policy like <a href=""https://www.msn.com"" rel=""nofollow"">https://www.msn.com</a>, <a href=""https://www.yahoo.com"" rel=""nofollow"">https://www.yahoo.com</a>, and <a href=""https://www.mozilla.org"" rel=""nofollow"">https://www.mozilla.org</a>, and all are blocked.  I have tried different match patterns in the blocked policy and none blocked any URL, which I didn't expect them to anyway.  I tried these patterns: </p><pre>*://*.*.* https://*.*.* http://*.*.* * </pre> <p>Also in my testing I added <a href=""https://www.yahoo.com"" rel=""nofollow"">https://www.yahoo.com</a> to the block policy, did not enable the exceptions policy and found Firefox did not block that site, which makes zero sense.  Am I missing something?  I was able to do something similar to this in Chrome with its ADMX templates copied locally to a non-domain joined PC, and it worked flawlessly. </p>",desktop;websites;,firefox,websites,en-US,1463952;,gorski-michael
1359978,2021-12-03 10:03:26 -0800,2021-12-03 13:39:37 -0800,background color of tabs,<p>by answering my question promptly....that would be the first thing....I need to figure out how to change the background color on the tabs...it is black </p>,desktop;tabs;windows-10;firefox-940;,firefox,tabs,en-US,1463867;,JWolfson68
1359975,2021-12-03 09:50:57 -0800,2021-12-03 09:50:57 -0800,a bookmark subfolder now missing on one device where it used to show,"<p>A subfolder in one of my bookmark folders has disappeared from view on my Windows 10 device. It was there as recently as this past week (I use it frequently). It still shows (and contains bookmarks) when I look on my Android device under Desktop Bookmarks. Oddly enough, I decided to bookmark again one of the pages in the missing folder and the star next to the address indicated it's been bookmarked and the subfolder still shows up in the list when I attempted to bookmark it again. It also shows in the Bookmarks list when I go to Manage Bookmarks (as a subfolder where it has always been). Why is it not showing up when I try to access it from my bookmarks list when I click on the Show Your Bookmarks icon? It won't let me screen shot the dropdown menus. </p>",desktop;bookmarks;windows-10;firefox-940;,firefox,bookmarks,en-US,"",Stroudja
1359973,2021-12-03 09:47:11 -0800,2021-12-03 10:20:33 -0800,enable cookies,"<p>I can't login into a site, it says enable cookies </p><p>how do I do that </p>",desktop;cookies;windows-10;firefox-940;,firefox,cookies,en-US,1463857;,ldmarsh2
1359972,2021-12-03 09:39:14 -0800,2021-12-03 09:39:14 -0800,Hide firefox 94 address bar,"<p>Hey guys. </p><p>My question is very simple: how can I hide the Firefox 94 address bar on any screen size, including full screen? </p><p>I have been searching the internet for an answer, even in previous versions, the answers and suggestions were never clear. Including nonsense add-ons. </p><p>Is there any placement of moz://a? Does anyone have a tip that might actually work? </p><p>Thank you very much. </p>",mac-os;desktop;customize;firefox-940;firefox-9402;,firefox,customize,en-US,"",ricardo.b.mano
1359971,2021-12-03 09:18:24 -0800,2021-12-03 09:18:24 -0800,Cannot Login to Vanguard site (https://investor.vanguard.com/home),"<p>Cannot Login to Vanguard site (<a href=""https://investor.vanguard.com/home"" rel=""nofollow"">https://investor.vanguard.com/home</a>). I was able to login (for years) prior to today. I can login using EDGE. </p>",desktop;websites;windows-10;firefox-940;,firefox,websites,en-US,"",johnrfiedler
1359969,2021-12-03 09:13:34 -0800,2021-12-03 10:11:26 -0800,New Tab Shortcut Thumbnails Are Replaced by Useless Icons,"<p>In the most recent FireFox updates (94), the New Tab page seems to have replaced my recent site Shortcuts graphics.  Whereas this screen was previously displaying miniature images of the various web pages, they are now displaying only the web site favicon. </p><p>While I understand that this eliminates a potential security hole, my shortcut list contains a number of commonly-used pages from my own web site -- and now every single one of them has the same fav icon, instead of the mini thumbnail of the actual page. This makes it difficult and darn-near impossible to discern between the various icons, especially since every one has the exact same text -- the START of the URL (including the web site name), and not the END of the URL, which would actually allow me to know which icon is for which page. </p><p>I have already disabled the ""newnewtabexperience"" config option (which fixed this in the past), but it doesn't appear to be working any more.  Is there a newnewnewnewnewtabexperience setting that I should look for? </p>",desktop;customize;windows-10;firefox-940;,firefox,customize,en-US,1463837;1463846;1463850;,billbach@goldstarsoftware.com
1359968,2021-12-03 09:05:47 -0800,2021-12-03 15:11:08 -0800,"bookmarks gone, can not bookmark at all","<p>version 94.0.2 (64-bit) message: ""The bookmarks and history system will not be functional because one of Firefox's files is in use by another application. Some security software can cause this problem."" I can not see any of my bookmarks and I can not bookmark any page. I have: Shut down Firefox and restarted: no help uninstalled, deleted folders, and reinstalled: no help Import bookmarks from another browser: no help. That doesn't work either </p><p>What ""security software"" is the message talking about? </p><p>Hope you can help, because I don't want to go to another browser. </p><p>Robert </p>",desktop;bookmarks;windows-10;firefox-940;,firefox,bookmarks,en-US,1463838;1463895;1463942;,rschoenert
1359967,2021-12-03 08:47:35 -0800,2021-12-03 08:51:39 -0800,How can I add back the + sign to add more tabs,<p>Need to restore + sign to add more tabs </p>,linux;desktop;tabs;firefox-690;,firefox,tabs,en-US,1463824;,releasetwodotsix
1359966,2021-12-03 08:45:48 -0800,2021-12-03 13:11:02 -0800,Having to clear the Firefox cache multiple times,"<p>I am having to clear the Firefox cache multiple times on UPS tracking page in order to get it to work. I can track one package, but if I try another, the page says: We are unable to complete your tracking request at this time. Please try again later.""  This response will not change until I clear the data and cache and start over.  Having to try and troubleshoot web pages is time consuming and annoying.  If it is a trusted site, why can it not just work? </p><p>This is a recent issue - none of the other browsers I use are having this problem, but I really don't want to start using multiple browsers just to get through my day. Any suggestions on how to fix this? </p>",desktop;websites;windows-10;firefox-940;,firefox,websites,en-US,1463859;1463879;1463907;,giafonem
1359964,2021-12-03 08:09:01 -0800,2021-12-03 08:09:01 -0800,Android Phone Browser in a different language,"<p>When I open a new tab, another language that I can not read is in the search line. </p>",desktop;other;,firefox,other,en-US,"",brim44
