id,created,updated,title,content,tags,product,topic,locale,answers,creator
1333696,2021-04-22 18:31:55 -0700,2021-04-22 22:02:46 -0700,Google search engine on Firefox showing suggestions from a different region.,"<p>Hi, </p><p>Straight to the point,  </p><p>I live in Colombia, the search suggestions that come up when using the default Google search engine on Firefox are on Spanish and are all related to the country. </p><p>This does not happen when I search normally on <a href=""http://Google.com"" rel=""nofollow"">Google.com</a>. I already set the search results on <a href=""http://Google.com"" rel=""nofollow"">Google.com</a> to another region, and the language to English. </p><p>It seems to me, the problem is the default Google search engine on Firefox, since this does not happen when I use the Bing search engine. </p><p>I would like to keep Google as my search engine and search suggestions on, Is it possible to set it so that the search suggestions that show up on the address bar are from another region, more specifically, the US? </p><p>Thank you. </p>",desktop;other;windows-10;firefox-880;,firefox,other,en-US,1407878;1407904;1407909;1407911;1407914;,amaru996
1333695,2021-04-22 18:30:00 -0700,2021-04-23 00:07:12 -0700,"When clicking ""open link in new tab"" Firefox sometimes opens in new window instead","<p>When I open a first Firefox instance from taskbar in Windows 10, if I do a Google search then right click on any of the results, then select ""Open Link in New Tab"", FF lalways opens that link in a new window, not a new tab as requested.  The new window takes up the right hand half of my display which means I have to manually size it larger or maximize it.  This behavior continues as long as I use the first FF window to open any links - they never open in a tab of the original window and only create lots of windows - this is very hard to deal with IMHO.  Now here's the weird part - If I use one of the new windows, then FF behaves just as it should.  Do a Google search and all links can be opened in new tabs in the new window, as requested.  I did not notice this strange behavior until about April 10 when I believe I accepted a new update to FF. </p>",desktop;tips;windows-10;firefox-880;,firefox,tips,en-US,1407877;1407887;1407897;1407918;1407931;,qtluom
1333693,2021-04-22 17:53:17 -0700,2021-04-22 18:24:29 -0700,recent update changes 4/22/2021,<p>Today 4/22/2021 I updated my FIREFOX Browser. WHY did FF get rid of the option to block cookies and block persistent storage for each webpage you are on? Before you could right click and choose view page info which allowed you to BLOCK individual choices .... WHY FF WHY? How can we change this or is there another way to still do it? </p>,desktop;privacy-and-security_1;windows-10;firefox-880;,firefox,privacy-and-security,en-US,1407857;1407862;,mdvaughn1
1333692,2021-04-22 17:41:41 -0700,2021-04-22 19:43:03 -0700,Unabls to login to my bank,<p>Unable to login to dbs banking. </p>,desktop;other;windows-10;firefox-880;,firefox,other,en-US,1407888;,thomaslee473
1333691,2021-04-22 17:32:13 -0700,2021-04-22 21:07:21 -0700,how to get help,"<p>I have NEVER been able to ANY help with firefox, It REALLY SUCKS&gt;  community sucks to NO HELP!!! </p>",windows-7;desktop;other;firefox-880;,firefox,other,en-US,1407902;,windsorbug
1333690,2021-04-22 17:11:05 -0700,2021-04-22 18:29:07 -0700,Outlook via Firefox,"<p>The fonts in Outlook via Firefox are all distorted but when I make a screenshot all seem normal, why? </p>",desktop;websites;windows-10;firefox-880;,firefox,websites,en-US,1407863;,benard_michel1
