id,created,updated,title,content,tags,product,topic,locale,answers,creator
1334313,2021-04-27 20:45:28 -0700,2021-04-27 20:45:28 -0700,Context menu editor.,<p>There was this really useful app called Menu Editor and you could remove things you did not want from the right click context menu. </p>,desktop;customize;windows-10;firefox-880;,firefox,customize,en-US,"",joshua.cade.taylor
1334312,2021-04-27 20:44:02 -0700,2021-04-27 20:44:02 -0700,google.com search box missing,"<p>I am running firefox 88.0 on Windows 10. <a href=""http://google.com"" rel=""nofollow"">google.com</a> is my home page. Lately, the search box in the middle of the screen is simply gone. This is the one with ""Google Search"" and ""I'm feeling lucky"" buttons, also gone. If I run Edge on the same machine the box is there. Likewise it is fine on Linux. Other Windows 10 machines I've check are also OK. The only difference I can see off-hand is that the problem computer is 32bit. </p><p>Any ideas? </p>",desktop;other;windows-10;firefox-880;,firefox,other,en-US,"",MarkFoley
1334311,2021-04-27 19:52:12 -0700,2021-04-27 19:52:12 -0700,Screen Share Window Selection Crashes Computer,"<p>Intermittently when I try to share my screen (Discord, Webex, etc...) my entire computer freezes and becomes unresponsive, the only way I can fix it is to hard reboot by holding the power button. It hurts my heart every time I have to do it, especially because of how new my computer is. </p>",linux;desktop;fix-problems;firefox-880;,firefox,fix-problems,en-US,"",aaronjencks
1334310,2021-04-27 19:46:39 -0700,2021-04-27 20:42:09 -0700,HTTPS redirection behavior changed in 88.0,"<p>I have to access a number of HTTP (not S) servers on a private work network. The URLs all look like <a href=""http://resource.infra.example.com"" rel=""nofollow"">http://resource.infra.example.com</a>. Using Firefox 88.0 the protocol URL is automatically changed to https:// and I get an error ""Unable to connect. Firefox can’t establish a connection to the server at <a href=""http://recourse.infra.example.com"" rel=""nofollow"">recourse.infra.example.com</a>"". This makes sense because these servers are not HTTPS, but Firefox's behavior seems broken. </p><p>I *do* get redirected with a fresh profile in Firefox 88.0. I *do* get redirected in safe mode in Firefox 88.0. I *do* get redirected in Firefox 89.0b4. I *do* get redirected in &gt;= 88.0 regardless of whether HTTPS Only is enabled in Preferences (if it's enabled I get the new HTTP warning, and then I get redirected to HTTPS) I *don't* get redirected in Firefox 87.0 (regardless of profile or safe mode) I *don't* get redirected in Safari and Chrome. I *don't* get redirected by curl. Inspecting these sites's headers with curl gives: </p><p>$ curl -sI <a href=""http://resource.infra.example.com"" rel=""nofollow"">http://resource.infra.example.com</a> HTTP/1.1 200 OK Content-Length: 4198 Content-Type: text/html; charset=utf-8 Date: Wed, 28 Apr 2021 02:43:01 GMT Etag: W/""1066-CEROUmmTJBPO73vecAgQwYdTSow"" Vary: Accept-Encoding X-Content-Type-Options: nosniff X-Dns-Prefetch-Control: off X-Download-Options: noopen X-Frame-Options: SAMEORIGIN X-Xss-Protection: 1; mode=block </p><p>It seems like something changed in 88.0, but I don't see anything related to HTTPS in the 88.0 release notes: <a href=""https://www.mozilla.org/en-US/firefox/88.0/releasenotes/"" rel=""nofollow"">https://www.mozilla.org/en-US/firefox/88.0/releasenotes/</a>. </p><p>What changed? How can I fix it? </p>",mac-os;desktop;websites;firefox-880;,firefox,websites,en-US,1409246;1409251;1409256;1409258;,cottonplane
1334308,2021-04-27 19:13:30 -0700,2021-04-27 19:13:30 -0700,"This page is slowing down Firefox. To speed up your browser, stop this page.","<p>I have an web app I can not control and have to use at work. It constantly all the time every day causes firefox to halt for 10-25 seconds, and displays the black banner with the robot dude ""this page is slowing down firefox. to speed up your browser, stop this page"". </p><p>Restart firefox, removing unnecessary add ons etc I know are the general guidelines.  </p><p>What I am wondering is is there a log or somewhere specifically in the console/debugger etc I can look to find more information about why it is doing that. I am not a web developer but if I can get some idea about whats causing that I'd have more info to share with the web apps admins.  </p><p>I can't do anything live, because it really locks up all of firefox but is there a corresponding message afterwards I could look for in the console? </p>",desktop;fix-problems;windows-10;firefox-880;,firefox,fix-problems,en-US,"",tbv624+firefox
1334306,2021-04-27 19:00:13 -0700,2021-04-27 19:00:13 -0700,Windows taskbar on top of Firefox full screen,"<p>I have an oled tv as monitor and Im trying to take of it as much as possible to avoid burning,  I switched from Chrome since in full screen it wont let me see the bars when I hover over the top, so far I have everything set up perfectly as I like but 1 thing, its a little bit annoying that I have to exit full screen to access the windows taskbar. So far from what I have searched, its meant to be like that, Im wondering if there's a way to make the taskbar show when I hover over the bottom of the screen. </p><p>I appreciate any info that helps me, thanks. </p>",desktop;customize;windows-10;firefox-880;,firefox,customize,en-US,"",juanpcm
1334305,2021-04-27 18:36:08 -0700,2021-04-27 20:23:53 -0700,my extensions disappeared,"<p>My extensions disappeared today, for some reason. I added some back to the laptop I was working on, but when I switched to my other one, they were not there. Do extensions not sync? Add-ons are included in items being synced on my settings page. I was hoping to find they never disappeared from that laptop so I could see which ones to add back. I'm on a Windows 10 machine. </p>",desktop;customize;windows-10;firefox-880;,firefox,customize,en-US,1409254;,docmon67
1334302,2021-04-27 18:13:14 -0700,2021-04-27 19:14:15 -0700,Why is firefox now starting to remove bookmarks from my bookmarks menue.,"<p>Why is Firefox now starting to remove bookmarks from my bookmarks menu. Several bookmarks have been repeatedly removed from my list. Just understand me, if you have started to sensor bookmarks , i will leave and use another browser. I am very disappointing  with this browser. Open source and and a free community to share info. I guess you have also been taken over by big tech. Very sad, I guess it's Good Bye. </p>",desktop;bookmarks;windows-10;firefox-870;,firefox,bookmarks,en-US,1409241;,axelhgruel
1334300,2021-04-27 17:36:13 -0700,2021-04-27 18:29:32 -0700,Unable to download ANYTHING using Firefox,"<p>All of a sudden, I am unable to download any type of file using Firefox. Other browsers (Chrome, Safari) work fine. All I get is an immediate ""FAILED"" message in the download dialog box. Firefox is up to date. </p>",mac-os;desktop;fix-problems;firefox-880;,firefox,fix-problems,en-US,1409219;1409229;,berg
1334299,2021-04-27 17:36:08 -0700,2021-04-27 17:36:08 -0700,No tengo audio,"<p>Antes de ayer el audio en firefox dejó de funcionar de repente, en el resto de navegadores no tengo este prblema. He probado todo lo de la guía, instalado extensiones que slucinan problemas pero nada. Cuando reproduzco un vídeo comienza a sonar y se para de repente, no sé que hacer pero necesito solucionarlo ya de ya. </p>",desktop;fix-problems;windows-10;firefox-880;,firefox,fix-problems,es,"",andersh.pics
1334297,2021-04-27 17:06:55 -0700,2021-04-27 18:14:54 -0700,New browser install: where's my stuff?,"<p>When I installed Firefox 88, all my bookmarks disappeared, as well as my history.  I use my history often, and rely on FFox to open on my last session. Whoops.  How can I recover my history without migrating to another browser? </p>",desktop;bookmarks;windows-10;firefox-880;,firefox,bookmarks,en-US,1409220;1409221;,artrosch
